Joshua,1,1,"After the death of the LORD’s servant Moses, the LORD said to Moses’ assistant Joshua, son of Nun"
Joshua,1,2,“My servant Moses is dead. Now you and all these people must cross the Jordan River into the land that I am going to give the people of Israel.
Joshua,1,3,"I will give you every place on which you set foot, as I promised Moses."
Joshua,1,4,"Your borders will be the desert ⌞on the south⌟, nearby Lebanon to the Euphrates River (the country of the Hittites) ⌞on the north⌟, and the Mediterranean Sea on the west."
Joshua,1,5,No one will be able to oppose you successfully as long as you live. I will be with you as I was with Moses. I will never neglect you or abandon you.
Joshua,1,6,"Be strong and courageous, because you will help these people take possession of the land I swore to give their ancestors."
Joshua,1,7,"“Only be strong and very courageous, faithfully doing everything in the teachings that my servant Moses commanded you. Don’t turn away from them. Then you will succeed wherever you go."
Joshua,1,8,Never stop reciting these teachings. You must think about them night and day so that you will faithfully do everything written in them. Only then will you prosper and succeed.
Joshua,1,9,"“I have commanded you, ‘Be strong and courageous! Don’t tremble or be terrified, because the LORD your God is with you wherever you go.’ ”"
Joshua,1,10,Then Joshua ordered the officers of the people
Joshua,1,11,"“Go through the camp. Tell the people, ‘Get your supplies ready. In three days you will cross the Jordan River to take possession of the land the LORD your God is going to give you.’ ”"
Joshua,1,12,"Next, Joshua said to the tribes of Reuben and Gad and half of the tribe of Manasseh"
Joshua,1,13,"“Remember what the LORD’s servant Moses commanded you. Moses said, ‘The LORD your God will give you this land—a place to rest.’"
Joshua,1,14,"Your wives, children, and livestock may stay in the land that Moses gave you east of the Jordan River. However, all your best soldiers must march in battle formation ahead of your relatives. You must help your relatives"
Joshua,1,15,"take possession of the land the LORD your God is going to give them. Then they will have a place to rest like you do. After that, you may go back and take possession of the land east of the Jordan River which the LORD’s servant Moses gave you.”"
Joshua,1,16,"The people responded to Joshua, “We’ll do everything you tell us and go wherever you send us."
Joshua,1,17,We will obey you as we obeyed Moses. May the LORD your God be with you as he was with Moses.
Joshua,1,18,Whoever rebels against your authority or does not obey your orders will be put to death. Just be strong and courageous!”
Joshua,2,1,"From Shittim Joshua, son of Nun, secretly sent out two men as spies. He told them, “Go, look at that country, especially the city of Jericho.” So they went to Jericho and entered the house of a prostitute named Rahab to spend the night there."
Joshua,2,2,"The king of Jericho was told, “Some Israelites have entered the city tonight. They came to gather information about our land.”"
Joshua,2,3,"So the king of Jericho sent messengers to Rahab, who told her, “Bring out the men who came to your house. They came here to gather information about the entire land.”"
Joshua,2,4,"But the woman had already taken the two men inside and hidden them. So she said, “Yes, the men did come here. But I didn’t know where they had come from."
Joshua,2,5,"When it was dark and the gate was just about to close, they left. I don’t know where they went. If you hurry, you’ll catch up with them.”"
Joshua,2,6,(She had taken them up to the roof and covered them with the flax which she had laid up there.)
Joshua,2,7,"The king’s men pursued them on the road leading to a shallow place to cross the Jordan River. As soon as the king’s men had left, the gate was closed."
Joshua,2,8,"Before the spies fell asleep, Rahab went up to them on the roof."
Joshua,2,9,"She said to them, “I know the LORD will give you this land. Your presence terrifies us. All the people in this country are deathly afraid of you."
Joshua,2,10,"We’ve heard how the LORD dried up the water of the Red Sea in front of you when you left Egypt. We’ve also heard what you did to Sihon and Og, the two kings of the Amorites, who ruled east of the Jordan River. We’ve heard how you destroyed them for the LORD."
Joshua,2,11,"When we heard about it, we lost heart. There was no courage left in any of us because of you. The LORD your God is the God of heaven and earth."
Joshua,2,12,Please swear by the LORD that you’ll be as kind to my father’s family as I’ve been to you. Also give me some proof
Joshua,2,13,"that you’ll protect my father, mother, brothers, sisters, and their households, and that you’ll save us from death.”"
Joshua,2,14,"The men promised her, “We pledge our lives for your lives. If you don’t tell anyone what we’re doing here, we’ll treat you kindly and honestly when the LORD gives us this land.”"
Joshua,2,15,So she let them down by a rope from her window since her house was built into the city wall. (She lived in the city wall.)
Joshua,2,16,"She told them, “Go to the mountains so that the men who are pursuing you will not find you. Hide there for three days until they return to Jericho. Then you can go on your way.”"
Joshua,2,17,"The men told her, “We will be free from the oath which you made us swear, ⌞if you tell anyone what we’re doing here⌟."
Joshua,2,18,"When we invade your land, tie this red cord in the window through which you let us down. Also, gather your father, mother, brothers, and all your father’s family into your house."
Joshua,2,19,Whoever leaves your house will be responsible for his own life. We will be free from that responsibility. But we will take responsibility if anyone inside your house is harmed.
Joshua,2,20,"If you tell anyone what we’re doing here, we will be free from the oath which you made us swear.”"
Joshua,2,21,"“I agree,” she said. So she let them go and tied the red cord in the window."
Joshua,2,22,The men went to the mountains and stayed there for three days until the king’s men returned to Jericho. The king’s men had searched for them all along the road but had not found them.
Joshua,2,23,"Then the two spies came down out of the mountains, crossed the Jordan River, and returned to Joshua, son of Nun. They told him everything that had happened to them."
Joshua,2,24,"They told Joshua, “The LORD has given us the whole country. The people who live there are deathly afraid of us.”"
Joshua,3,1,"Joshua got up early the next morning. He and all the Israelites left Shittim. They came to the Jordan River, where they camped before crossing."
Joshua,3,2,Three days later the officers went through the camp.
Joshua,3,3,"They told the people, “As soon as you see the ark of the promise of the LORD your God and the Levitical priests who carry it, break camp and follow them."
Joshua,3,4,"However, stay about half a mile behind them. Don’t come any closer to them so that you will know which way to go because you have not gone this way before.”"
Joshua,3,5,"Joshua told the people, “Perform the ceremonies to make yourselves holy because tomorrow the LORD will do miracles among you.”"
Joshua,3,6,"Joshua also told the priests, “Take the ark of the promise, and go ahead of the people.” They did as they were told."
Joshua,3,7,"Then the LORD said to Joshua, “Today I will begin to honor you in front of all the people of Israel. I will do this to let them know that I am with you just as I was with Moses."
Joshua,3,8,"Order the priests who carry the ark of the promise, ‘When you step into the water of the Jordan River, stand there.’ ”"
Joshua,3,9,"So Joshua said to the people of Israel, “Come here, and listen to the words of the LORD your God.”"
Joshua,3,10,"Joshua continued, “This is how you will know that the living God is among you and that he will certainly force the Canaanites, Hittites, Hivites, Perizzites, Girgashites, Amorites, and Jebusites out of your way."
Joshua,3,11,Watch the ark of the promise of the Lord of the whole earth as it goes ahead of you into the Jordan River.
Joshua,3,12,Choose one man from each of the 12 tribes of Israel.
Joshua,3,13,"The priests who carry the ark of the LORD, the Lord of the whole earth, will stand in the water of the Jordan. Then the water flowing from upstream will stop and stand up like a dam.”"
Joshua,3,14,So they broke camp to cross the Jordan River. The priests who carried the ark of the promise went ahead of the people.
Joshua,3,15,(The Jordan overflows all its banks during the harvest season.)  When the priests who were carrying the ark came to the edge of the Jordan River and set foot in
Joshua,3,16,"the water, the water stopped flowing from upstream. The water rose up like a dam as far away as the city of Adam near Zarethan. The water flowing down toward the Sea of the Plains (the Dead Sea) was completely cut off. Then the people crossed from the east side ⌞of the Jordan River⌟ directly opposite Jericho."
Joshua,3,17,The priests who carried the ark of the LORD’s promise stood firmly on dry ground in the middle of the Jordan until the whole nation of Israel had crossed the Jordan River on dry ground.
Joshua,4,1,The whole nation finished crossing the Jordan River. The LORD had told Joshua
Joshua,4,2,“Choose one man from each of the 12 tribes.
Joshua,4,3,"Order them to pick up 12 stones from the middle of the Jordan, where the priests’ feet stood firmly. Take the stones along with you, and set them down where you will camp tonight.”"
Joshua,4,4,Joshua called the 12 men whom he had selected (one from each tribe).
Joshua,4,5,"He said to them, “Go to the middle of the Jordan River in front of the ark of the LORD your God. Each man must take a stone on his shoulder, one for each tribe of Israel."
Joshua,4,6,"This will be a sign for you. In the future your children will ask, ‘What do these stones mean to you?’"
Joshua,4,7,"You should answer, ‘The water of the Jordan River was cut off in front of the ark of the LORD’s promise. When the ark crossed the Jordan, the river stopped flowing. These stones are a permanent reminder for the people of Israel.’ ”"
Joshua,4,8,"The people of Israel did as Joshua had ordered. They took 12 stones, one for each of the tribes of Israel. They took them from the middle of the Jordan as the LORD had told Joshua. They carried them to the camp and set them down there."
Joshua,4,9,"Joshua also set 12 stones in the middle of the Jordan River, where the priests who carried the ark of the promise had stood. The stones are still there today."
Joshua,4,10,The priests who carried the ark remained standing in the middle of the Jordan. They stood there until everything the LORD had ordered Joshua to tell the people had been carried out. This was as Moses had told Joshua. The people hurried to the other side.
Joshua,4,11,"As soon as everyone had crossed, the priests with the LORD’s ark crossed and went ahead of them."
Joshua,4,12,"The men of Reuben, Gad, and half of the tribe of Manasseh did as Moses had told them. They marched across in battle formation ahead of the people of Israel."
Joshua,4,13,"About 40,000 armed men crossed the river in front of the LORD to the plains of Jericho for battle."
Joshua,4,14,"On that day the LORD honored Joshua in the presence of all the Israelites. As long as Joshua lived, the Israelites respected him in the same way they had respected Moses."
Joshua,4,15,The LORD said to Joshua
Joshua,4,16,“Order the priests who carry the ark of the testimony to come out of the Jordan River.”
Joshua,4,17,"So Joshua ordered the priests, “Come out of the Jordan.”"
Joshua,4,18,"The priests who carried the ark of the LORD’s promise came out of the middle of the Jordan. When their feet stepped onto dry land, the water of the Jordan returned to its seasonal flood level."
Joshua,4,19,"On the tenth day of the first month, the people came out of the Jordan River. They made their camp at Gilgal, just east of Jericho."
Joshua,4,20,At Gilgal Joshua set up the 12 stones they had taken from the Jordan.
Joshua,4,21,"He said to the people of Israel, “In the future when children ask their parents, ‘What do these stones mean?’"
Joshua,4,22,the children should be told that Israel crossed the Jordan River on dry ground.
Joshua,4,23,"The LORD your God dried up the Jordan ahead of you until you had crossed, as he did to the Red Sea until we had crossed."
Joshua,4,24,The LORD did this so that everyone in the world would know his mighty power and that you would fear the LORD your God every day of your life.”
Joshua,5,1,All the Amorite kings west of the Jordan River and all the Canaanite kings along the Mediterranean Sea heard that the LORD had dried up the Jordan River so that the Israelites could cross. So they lost heart and had no courage left to face the people of Israel.
Joshua,5,2,"At that time the LORD spoke to Joshua, “Make flint knives, and circumcise the men of Israel.”"
Joshua,5,3,So Joshua made flint knives and circumcised the men of Israel at the Hill of Circumcision.
Joshua,5,4,This is the reason Joshua circumcised them: All the soldiers had died on the way through the desert after they left Egypt.
Joshua,5,5,"The men who left Egypt had been circumcised. However, the men born later, on the way through the desert, were not circumcised."
Joshua,5,6,For 40 years the Israelites wandered through the desert until all their soldiers who left Egypt died. They died because they disobeyed the LORD. The LORD swore that he would not let them see this land flowing with milk and honey which he had sworn to give our ancestors.
Joshua,5,7,The sons who took their place had not been circumcised on the way. So Joshua circumcised them.
Joshua,5,8,"When all the men had been circumcised, they remained in the camp until they recovered."
Joshua,5,9,"The LORD said to Joshua, “Today I have removed the disgrace of Egypt from you.” So Joshua named the place Gilgal, the name it still has today."
Joshua,5,10,The people of Israel camped at Gilgal in the Jericho plain. There they celebrated the Passover on the evening of the fourteenth day of the month.
Joshua,5,11,"On the day after the Passover, they ate some of the produce of the land, unleavened bread and roasted grain."
Joshua,5,12,"The day after that, the manna stopped. The people of Israel never had manna again. That year they began to eat the crops that grew in Canaan."
Joshua,5,13,"When Joshua was near Jericho, he looked up and saw a man standing in front of him with a sword in his hand. Joshua went up to him and asked, “Are you one of us or one of our enemies?”"
Joshua,5,14,"He answered, “Neither one! I am here as the commander of the LORD’s army.” Immediately, Joshua bowed with his face touching the ground and worshiped. He asked, “Sir, what do you want to tell me?”"
Joshua,5,15,"The commander of the LORD’s army said to Joshua, “Take off your sandals because this place where you are standing is holy.” So Joshua did as he was told."
Joshua,6,1,Jericho was bolted and barred shut because the people were afraid of the Israelites. No one could enter or leave.
Joshua,6,2,"The LORD said to Joshua, “I am about to hand Jericho, its king, and its warriors over to you."
Joshua,6,3,All the soldiers will march around the city once a day for six days.
Joshua,6,4,Seven priests will carry rams’ horns ahead of the ark. But on the seventh day you must march around the city seven times while the priests blow their horns.
Joshua,6,5,"When you hear a long blast on the horn, all the troops must shout very loudly. The wall around the city will collapse. Then the troops must charge straight ahead into the city.”"
Joshua,6,6,"Joshua, son of Nun, summoned the priests. He said to them, “Pick up the ark of the promise, and have seven priests carry seven rams’ horns ahead of the LORD’s ark.”"
Joshua,6,7,"He told the troops, “March around the city. Let the armed men march ahead of the LORD’s ark.”"
Joshua,6,8,"After Joshua had given orders to the troops, the seven priests carrying the seven rams’ horns ahead of the LORD marched off as they blew their horns. The ark of the LORD’s promise followed them."
Joshua,6,9,"The armed men went ahead of the priests, who blew their horns. The rear guard followed the ark while the priests continued to blow their horns."
Joshua,6,10,"Joshua ordered the troops, “Don’t shout, make any noise, or let one word come out of your mouth until I tell you to shout. Then shout!”"
Joshua,6,11,So the LORD’s ark went around the city once. Then they went back to the camp and stayed there for the night.
Joshua,6,12,Joshua got up early in the morning. The priests carried the LORD’s ark.
Joshua,6,13,"The seven priests carrying the seven rams’ horns were ahead of it. The priests blew their horns as they went. The armed men were ahead of them, and the rear guard followed the LORD’s ark while the horns blew continually."
Joshua,6,14,They went around the city once on the second day and returned to the camp. They did this for six days.
Joshua,6,15,On the seventh day they got up at dawn. They marched around the city seven times the same way they had done it before. That was the only day they marched around it seven times.
Joshua,6,16,"When they went around the seventh time, the priests blew their rams’ horns.
Joshua said to the troops, “Shout, because the LORD has given you the city!"
Joshua,6,17,The city has been claimed by the LORD. Everything in it belongs to the LORD. Only the prostitute Rahab and all who are in the house with her will live because she hid the messengers we sent.
Joshua,6,18,"But stay away from what has been claimed by the LORD for destruction, or you, too, will be destroyed by the LORD. If you take anything that is claimed by the LORD, you will bring destruction and disaster on the camp of Israel."
Joshua,6,19,All the silver and gold and everything made of bronze and iron are holy and belong to the LORD. They must go into the LORD’s treasury.”
Joshua,6,20,"So the troops shouted very loudly when they heard the blast of the rams’ horns, and the wall collapsed. The troops charged straight ahead and captured the city."
Joshua,6,21,"They claimed everything in it for the LORD. With their swords they killed men and women, young and old, as well as cattle, sheep, and donkeys."
Joshua,6,22,"But Joshua said to the two spies, “Go to the prostitute’s house. Bring the woman out, along with everything she has, as you swore you would do for her.”"
Joshua,6,23,"The spies went and brought out Rahab, her father, mother, brothers, everything she had, and even all of her relatives. They gave them a place outside the camp of Israel."
Joshua,6,24,Then Israel burned the city and everything in it. But they put the silver and gold and everything made of bronze and iron into the LORD’s treasury.
Joshua,6,25,"Joshua spared the prostitute Rahab, her father’s family, and everything she had. She still lives in Israel today because she hid the messengers Joshua had sent to look at Jericho."
Joshua,6,26,"At that time Joshua pronounced this curse:
“The LORD will curse
whoever comes to rebuild the city of Jericho.
It will cost him his firstborn son
to lay the foundation.
It will cost him his youngest son
to set up the city doors.”"
Joshua,6,27,"So the LORD was with Joshua, and his fame spread throughout the land."
Joshua,7,1,"The people of Israel proved to be disloyal about the things claimed by the LORD. Achan, son of Carmi, grandson of Zabdi, great-grandson of Zerah, and a member of the tribe of Judah, took something that had been claimed by the LORD. So the LORD became angry with the people of Israel."
Joshua,7,2,"Joshua sent men from Jericho to Ai. Ai is near Beth Aven, east of Bethel. He said to them, “Go, look at that country.” So the men went and looked at Ai."
Joshua,7,3,"They came back to Joshua and told him, “You don’t need to send all the troops. Only about two or three thousand men are needed to destroy Ai. Don’t tire the troops out by sending all of them. There are only a few troops in Ai.”"
Joshua,7,4,"So about three thousand men were sent. However, they fled from the men of Ai."
Joshua,7,5,"The men of Ai killed about thirty-six of them, chasing them from the city gate to the slope of the stone quarries. Israel’s troops lost heart and were scared stiff."
Joshua,7,6,Joshua and the leaders of Israel tore their clothes in grief. They put dust on their heads and bowed down to the ground in front of the LORD’s ark. They stayed there until evening.
Joshua,7,7,"Joshua said, “Almighty LORD, why did you bring these people across the Jordan River? Was it to hand us over to the Amorites so that they could destroy us? I wish we had been content to live on the other side of the Jordan!"
Joshua,7,8,"Lord, what else can I say after Israel ran away from its enemy?"
Joshua,7,9,"When the Canaanites and everyone who lives in the land hears about it, they will surround us and remove every memory of us from the earth. What will you do then so that your great name ⌞will be remembered⌟?”"
Joshua,7,10,"The LORD said to Joshua, “Get up! What are you doing bowing on the ground?"
Joshua,7,11,"Israel has sinned. They have ignored the requirements  that I have placed on them. They have taken what I claimed for myself and put it among their own goods. They have not only stolen, but they have also lied."
Joshua,7,12,“The people of Israel will not be able to defend themselves against their enemies. They will run away from their enemies because the people of Israel are now claimed for destruction. I will not be with you anymore unless you destroy what I have claimed for myself.
Joshua,7,13,"“Get up! Tell the people, ‘Get ready for tomorrow by performing the ceremonies to make yourselves holy. This is what the LORD God of Israel says: You have what I claimed for myself, Israel. You will not be able to defend yourselves against your enemies until you get rid of what I have claimed."
Joshua,7,14,"In the morning come forward by tribes ⌞to the tent of meeting⌟. The tribe the LORD selects will come forward by families. Then the family the LORD selects will come forward by households, and the household the LORD selects will come forward man by man."
Joshua,7,15,"The man who is selected, along with everything he has, must be burned because he has ⌞stolen⌟ what the LORD has claimed. He has ignored the LORD’s requirements and done a godless thing in Israel.’ ”"
Joshua,7,16,Joshua got up early in the morning. He had Israel come forward by tribes. The tribe of Judah was selected.
Joshua,7,17,"Then he had the families of Judah come forward, and the family of Zerah was selected. Then he had the family of Zerah come forward man by man, and Zabdi was selected."
Joshua,7,18,"Then he had Zabdi’s household come forward man by man, and Achan was selected. Achan from the tribe of Judah was the son of Carmi, grandson of Zabdi, and great-grandson of Zerah."
Joshua,7,19,"Joshua said to Achan, “Son, give honor and praise to the LORD God of Israel! Tell me what you have done. Don’t hide anything from me.”"
Joshua,7,20,"Then Achan answered Joshua, “It’s true. I have sinned against the LORD God of Israel. This is what I did"
Joshua,7,21,"I saw a fine robe from Babylonia, five pounds of silver, and a bar of gold weighing about one pound among the loot. I wanted them, so I took them. You will find them buried inside my tent with the silver beneath them.”"
Joshua,7,22,"Joshua sent messengers, and they ran to the tent. The loot was buried inside with the silver beneath it."
Joshua,7,23,They took the loot from the tent and brought it to Joshua and all the people of Israel. Then they laid it out in the presence of the LORD.
Joshua,7,24,"Joshua and all Israel took Achan (son of Zerah), the silver, the robe, the bar of gold, his sons and daughters, his cattle, his donkeys, his sheep, and his tent—everything he had—and brought them to the valley of Achor [Disaster]."
Joshua,7,25,"Then Joshua said, “Why did you bring this disaster on us? The LORD will bring disaster on you today!” And all Israel stoned Achan and his family to death. Then they burned the bodies and piled stones over them."
Joshua,7,26,They made such a large pile of stones over Achan that it is still there today. Then the LORD withdrew his burning anger. For this reason that place is still called the valley of Achor today.
Joshua,8,1,"The LORD said to Joshua, “Don’t be terrified or afraid. Take all the troops with you, and march against Ai. I am about to hand the king of Ai, his people, city, and land over to you."
Joshua,8,2,"You will do the same thing to Ai and its king that you did to Jericho and its king. However, you may take its loot and livestock for yourselves. Set an ambush behind the city.”"
Joshua,8,3,"So Joshua and all the soldiers started to march against Ai. Joshua picked 30,000 of his best soldiers and sent them out at night"
Joshua,8,4,with these orders: “Set an ambush behind the city. Don’t go very far away from the city. Everyone must be ready.
Joshua,8,5,"I’ll approach the city with the rest of the troops. When they come out to attack us as they did the first time, we will run away from them."
Joshua,8,6,"They’ll come out after us, and we will lure them away from the city. They’ll say, ‘They’re running away from us just like the first time.’ As we run away from them"
Joshua,8,7,you come out of hiding and capture the city. The LORD your God will hand it over to you.
Joshua,8,8,"When you have captured the city, set it on fire. Do what the LORD says. These are your orders.”"
