Joshua,13,32,"This is the land that Moses distributed on Moab’s plains, east of the Jordan River near Jericho."
Joshua,13,33,"Moses did not give any land as an inheritance to the tribe of Levi. The LORD God of Israel is what they inherited, as he had promised them."
Joshua,14,1,"This is the land that the people of Israel inherited in Canaan. The priest Eleazar, Joshua (son of Nun), and the heads of Israel’s tribes distributed it to the people."
Joshua,14,2,The land inherited by the nine-and-a-half tribes was determined by drawing lots as the LORD had commanded through Moses.
Joshua,14,3,Moses had given the two-and-a-half tribes their inheritance east of the Jordan River. He did not give any land as an inheritance to Levi’s tribe
Joshua,14,4,"because Joseph’s descendants, Manasseh and Ephraim, formed two tribes. The Levites were not given a share of the land. Joseph’s descendants gave the Levites cities to live in with pasturelands for their cattle and everything they had."
Joshua,14,5,So the people of Israel divided the land as the LORD had commanded Moses.
Joshua,14,6,"Then the people of Judah came to Joshua at Gilgal. Caleb, son of Jephunneh and grandson of Kenaz, said to him, “You know what the LORD said to Moses, the man of God, at Kadesh Barnea about you and me."
Joshua,14,7,I was 40 years old when the LORD’s servant Moses sent me from Kadesh Barnea to explore the land. I reported to him exactly what I thought.
Joshua,14,8,"But my companions discouraged the people. However, I was completely loyal to the LORD my God."
Joshua,14,9,On that day Moses swore this oath: ‘The land your feet walked on will be a permanent inheritance for you and your descendants because you were completely loyal to the LORD my God.’
Joshua,14,10,“So look at me. The LORD has kept me alive as he promised. It’s been 45 years since Israel wandered in the desert when the LORD made this promise to Moses. So now look at me today. I’m 85 years old.
Joshua,14,11,I’m still as fit to go to war now as I was when Moses sent me out.
Joshua,14,12,"Now give me this mountain region which the LORD spoke of that day. You heard that the people of Anak are still there and that they have large, fortified cities. If the LORD is with me, I can force them out, as he promised.”"
Joshua,14,13,"So Joshua blessed Caleb, son of Jephunneh, and gave him Hebron as his inheritance."
Joshua,14,14,"Hebron is still the inheritance of Caleb, son of Jephunneh and grandson of Kenaz, because Caleb was completely loyal to the LORD God of Israel."
Joshua,14,15,In the past Hebron was called Kiriath Arba. Arba was the greatest man among the people of Anak. So the land had peace.
Joshua,15,1,The lot was drawn for the families of the tribe of Judah. Their territory extends as far south as the territory of Edom and the desert of Zin.
Joshua,15,2,The southern border starts from the south end of the Dead Sea
Joshua,15,3,"and goes south of the Akrabbim Pass. It then passes Zin and goes up south of Kadesh Barnea. From there it goes to Hezron, up to Addar, around to Karka"
Joshua,15,4,and on to Azmon. It comes out at the River of Egypt so that the border ends at the Mediterranean Sea. This is the southern border.
Joshua,15,5,"The eastern border is the Dead Sea as far north as the mouth of the Jordan River.
The northern border starts from the north end of the Dead Sea at the mouth of the Jordan"
Joshua,15,6,"and goes up to Beth Hoglah. It then passes north to Beth Arabah and goes up to the Rock of Bohan, son of Reuben."
Joshua,15,7,"From the valley of Achor, the border goes up to Debir and turns north to the region that faces the Adummim Pass, south of the valley. Then the border passes the Springs of En Shemesh and ends at En Rogel."
Joshua,15,8,It continues up the valley of Ben Hinnom to the south slope of the Jebusite city Jerusalem. It then goes to the top of the mountain that overlooks the valley of Hinnom to the west at the north end of the valley of Rephaim.
Joshua,15,9,From the top of that mountain the border goes around to the spring of Nephtoah. From there it goes to the cities of Mount Ephron and around to Baalah (now called Kiriath Jearim).
Joshua,15,10,From Baalah the border turns west to Mount Seir and over to the north slope of Mount Jearim (now called Chesalon). Then it goes down to Beth Shemesh and on to Timnah.
Joshua,15,11,"From there the border goes on the north side of Ekron and turns to Shikkeron, on to Mount Baalah, and comes out at Jabneel. The border ends at the Mediterranean Sea."
Joshua,15,12,The western border is the coastline of the Mediterranean Sea. These are the borders around Judah that belong to their families.
Joshua,15,13,"Joshua gave Caleb, son of Jephunneh, a share of land among the people of Judah as the LORD had told them. It was Kiriath Arba (now called Hebron). Arba was the father of Anak."
Joshua,15,14,"Caleb forced out Sheshai, Ahiman, and Talmai, three descendants of Anak from Hebron."
Joshua,15,15,From there he marched against the people living in Debir. (In the past Debir was called Kiriath Sepher.)
Joshua,15,16,"Caleb said, “I will give my daughter Achsah as a wife to anyone who attacks Kiriath Sepher and captures it.”"
Joshua,15,17,"Then Othniel, son of Caleb’s brother Kenaz, captured it. So Caleb gave him his daughter Achsah as a wife."
Joshua,15,18,"When she came to Othniel, she persuaded him to ask her father for a field. When she got down from her donkey, Caleb asked her, “What do you want?”"
Joshua,15,19,"She answered, “Give me a blessing. Since you’ve given me some dry land, also give me some springs.” So Caleb gave her the upper and lower springs."
Joshua,15,20,This is the land inherited by the families of the tribe of Judah.
Joshua,15,21,"On the farthest edge of the Negev, on the border of Edom, they gave the tribe of Judah 29 cities with their villages: Kabzeel, Eder, Jagur"
Joshua,15,22,"Kinah, Dimonah, Adadah"
Joshua,15,23,"Kedesh, Hazor, Ithnan"
Joshua,15,24,"Ziph, Telem, Bealoth"
Joshua,15,25,"Hazor Hadattah, Kerioth Hezron (now called Hazor)"
Joshua,15,26,"Amam, Shema, Moladah"
Joshua,15,27,"Hazar Gaddah, Heshmon, Beth Pelet"
Joshua,15,28,"Hazar Shual, Beersheba, Biziothiah"
Joshua,15,29,"Baalah, Iim, Ezem"
Joshua,15,30,"Eltolad, Chesil, Hormah"
Joshua,15,31,"Ziklag, Madmannah, Sansannah"
Joshua,15,32,"Lebaoth, Shilhim, Ain, and Rimmon."
Joshua,15,33,"In the foothills they gave Judah 14 cities with their villages: Eshtaol, Zorah, Ashnah"
Joshua,15,34,"Zanoah, En Gannim, Tappuah, Enam"
Joshua,15,35,"Jarmuth, Adullam, Socoh, Azekah"
Joshua,15,36,"Shaaraim, Adithaim, Gederah, and Gederothaim."
Joshua,15,37,"They also gave Judah 16 other cities with their villages: Zenan, Hadashah, Migdalgad"
Joshua,15,38,"Dilean, Mizpah, Joktheel"
Joshua,15,39,"Lachish, Bozkath, Eglon"
Joshua,15,40,"Cabbon, Lahmas, Chitlish"
Joshua,15,41,"Gederoth, Beth Dagon, Naamah, and Makkedah."
Joshua,15,42,"An additional nine cities with their villages were given to Judah: Libnah, Ether, Ashan"
Joshua,15,43,"Iphtah, Ashnah, Nezib"
Joshua,15,44,"Keilah, Achzib, and Mareshah."
Joshua,15,45,Judah also received Ekron with its cities and villages.
Joshua,15,46,This included all the cities with their villages between Ekron and the Mediterranean Sea and alongside Ashdod.
Joshua,15,47,Added to this were Ashdod and Gaza with their cities and villages as far as the River of Egypt and the coast of the Mediterranean Sea.
Joshua,15,48,"In the mountains they gave Judah 11 cities with their villages: Shamir, Jattir, Socoh"
Joshua,15,49,"Dannah, Kiriath Sannah (now called Debir)"
Joshua,15,50,"Anab, Eshtemoh, Anim"
Joshua,15,51,"Goshen, Holon, and Giloh."
Joshua,15,52,"They also gave Judah nine other cities with their villages: Arab, Dumah, Eshan"
Joshua,15,53,"Janim, Beth Tappuah, Aphekah"
Joshua,15,54,"Humtah, Kiriath Arba (now called Hebron), and Zior."
Joshua,15,55,"They also received another ten cities with their villages: Maon, Carmel, Ziph, Juttah"
Joshua,15,56,"Jezreel, Jokdeam, Zanoah"
Joshua,15,57,"Kain, Gibeah, and Timnah."
Joshua,15,58,"Halhul, Bethzur, Gedor"
Joshua,15,59,"Maarath, Bethanoth, and Eltekon were six other cities with their villages that were given to Judah."
Joshua,15,60,The two cities of Kiriath Baal (now called Kiriath Jearim) and Rabbah with their villages ⌞were given to Judah⌟.
Joshua,15,61,"In the desert Judah was given six cities with their villages: Beth Arabah, Middin, Secacah"
Joshua,15,62,"Nibshan, Ir Hamelah, and En Gedi."
Joshua,15,63,"However, Judah was not able to force out the people of Jebus who lived in Jerusalem. So they still live with Judah in Jerusalem today."
Joshua,16,1,"The lot was drawn for Joseph. The border of Joseph’s territory goes from the Jordan River at Jericho to the springs of Jericho on the east, through the desert that goes up from Jericho, and through the mountains to Bethel."
Joshua,16,2,From Bethel the border goes to Luz and over to Ataroth at the border of the Archites.
Joshua,16,3,"Then it descends west to the border of Japhlet and Lower Beth Horon, on to Gezer, and ends at the Mediterranean Sea."
Joshua,16,4,"So Joseph’s sons, Manasseh and Ephraim, received this land as their inheritance."
Joshua,16,5,This is the territory for the families descended from Ephraim. The eastern border of the land they inherited is from Ataroth Addar to Upper Beth Horon.
Joshua,16,6,"From there the border goes west, with Michmethath on the north. The border then turns east to Taanath Shiloh and passes east to Janoah."
Joshua,16,7,"From Janoah it descends to Ataroth and Naarah, touches Jericho, and ends at the Jordan River."
Joshua,16,8,At Tappuah the border goes west along the Kanah River and ends at the Mediterranean Sea. This is the land given as an inheritance to the families of the tribe of Ephraim
Joshua,16,9,with all the cities and their villages selected for Ephraim in Manasseh’s territory.
Joshua,16,10,"However, they did not force out the Canaanites who lived in Gezer. So the Canaanites still live in Ephraim today, but they are required to do forced labor."
Joshua,17,1,"The lot was drawn for the tribe of Manasseh, because Manasseh was Joseph’s firstborn. Machir, Manasseh’s firstborn, the ancestor of the people living in Gilead, had received Gilead and Bashan because he was a soldier."
Joshua,17,2,"The land was given to the rest of the families descended from Manasseh, to the descendants of Abiezer, Helek, Asriel, Shechem, Hepher, and Shemida. These were the male descendants of Joseph’s son Manasseh listed by their families."
Joshua,17,3,"Zelophehad, son of Hepher, grandson of Gilead, and great-grandson of Machir, whose father was Manasseh, had no sons—only daughters. Their names were Mahlah, Noah, Hoglah, Milcah, and Tirzah."
Joshua,17,4,"They came to the priest Eleazar, Joshua (son of Nun), and the leaders. They said, “The LORD commanded Moses to give us some land as an inheritance among our male relatives.” So they gave them an inheritance among their father’s relatives as the LORD had required."
Joshua,17,5,"Ten portions of land went to Manasseh, besides the land of Gilead and Bashan east of the Jordan River."
Joshua,17,6,"These portions were distributed because Manasseh’s daughters were given an inheritance along with his sons, while Gilead belonged to Manasseh’s other descendants."
Joshua,17,7,"Manasseh’s border extends from Asher to Michmethath, which faces Shechem. Then the border goes south toward the people who live in En Tappuah."
Joshua,17,8,"(The land of Tappuah belongs to Manasseh, but Tappuah itself, on the border of Manasseh, belongs to Ephraim.)"
Joshua,17,9,"The border then descends southward to the Kanah River. These cities belong to Ephraim, although they are among Manasseh’s cities. Manasseh’s ⌞southern⌟ border is the river, which ends at the Mediterranean Sea."
Joshua,17,10,"What is south ⌞of the river⌟ belongs to Ephraim, and what is north ⌞of it⌟ belongs to Manasseh. So the Mediterranean Sea ⌞is its western border⌟, Asher its northern border, and Issachar its eastern border."
Joshua,17,11,"In Issachar and Asher, Manasseh possessed Beth Shean and Ibleam with their villages and the people living in Dor, En Dor, Taanach, and Megiddo and their villages. The last three are on mountain ridges."
Joshua,17,12,But Manasseh was not able to take possession of these cities since the Canaanites were determined to stay in this land.
Joshua,17,13,"When the Israelites became strong enough, they made the Canaanites do forced labor, since they didn’t force all of them out."
Joshua,17,14,"Joseph’s descendants asked Joshua, “Why did you give us only one region for an inheritance? We have a lot of people because the LORD has blessed us.”"
Joshua,17,15,"Joshua replied, “If there are so many of you, go into the forest! Clear ground for yourselves there in the land of the Perizzites and Rephaim if the mountains of Ephraim are too confining for you.”"
Joshua,17,16,"Joseph’s descendants responded, “The mountains are not enough for us either. Besides, all the Canaanites living in the valley, in Beth Shean and its villages, and in the valley of Jezreel have chariots made of iron.”"
Joshua,17,17,"Then Joshua said to the descendants of Joseph, ⌞the tribes of⌟ Ephraim and Manasseh, “You are an important and very powerful people. One region is really not enough for you."
Joshua,17,18,"The mountain region will be yours as well. It is a forest, so you will have to clear it. All of it will be yours. But you must force out the Canaanites, even though they are strong and have chariots made of iron.”"
Joshua,18,1,The whole congregation of Israel gathered at Shiloh and set up the tent of meeting there. The land was under their control.
Joshua,18,2,There were still seven tribes in Israel who had not yet received any land as their inheritance.
Joshua,18,3,"So Joshua asked the Israelites, “How long are you going to waste time conquering the land which the LORD God of your ancestors has given you?"
Joshua,18,4,"Choose three men from each tribe, and I will send them out. They will survey the land and write a description of it which shows ⌞the borders of⌟ their inheritance. Then they will come back to me."
Joshua,18,5,"They will divide the land into seven parts. Judah will stay within its territory in the south, and Joseph’s descendants will stay within their territory in the north."
Joshua,18,6,You must describe the seven parts of the land and report to me here. I will draw lots for you here in the presence of the LORD our God.
Joshua,18,7,"Levi’s tribe has no separate region among you, because their inheritance is to serve the LORD as priests. The tribes of Gad and Reuben and half of the tribe of Manasseh have received the inheritance that the LORD’s servant Moses gave them on the east side of the Jordan River.”"
Joshua,18,8,"As the men got ready to go, Joshua ordered them to write a description of the land. He said, “Go survey the land. Write a description of it, and return to me. Then I will draw lots for you in the presence of the LORD here in Shiloh.”"
Joshua,18,9,The men surveyed the land. They described it in a book. The land was divided into seven parts according to its cities. Then they returned to Joshua at the camp at Shiloh.
Joshua,18,10,So Joshua drew lots for them in the presence of the LORD in Shiloh. There Joshua divided the land among the tribes of Israel.
Joshua,18,11,The lot was drawn for the families of the tribe of Benjamin. Their territory lies between Judah’s and Joseph’s.
Joshua,18,12,"Their northern border starts at the Jordan, goes up the slope north of Jericho, west through the mountains, and ends at the desert of Beth Aven."
Joshua,18,13,From there the border goes to the south slope of Luz (now called Bethel). Then the border goes down to Ataroth Addar over the mountains south of Lower Beth Horon.
Joshua,18,14,"The border turns and goes around on the west side, south of the mountain that faces Beth Horon, and ends at Kiriath Baal (now called Kiriath Jearim), a city of Judah."
Joshua,18,15,"The southern border begins just outside Kiriath Jearim and goes west, to the springs of Nephtoah."
Joshua,18,16,"Then the border descends to the foot of the mountain that overlooks the valley of Ben Hinnom, in the north end of the valley of Rephaim. It descends to the valley of Hinnom, to the south slope of the city of Jebus, and down to En Rogel."
Joshua,18,17,"Then it turns north and goes to En Shemesh and from there to the region opposite the Adummim Pass. It descends to the Rock of Bohan, son of Reuben."
Joshua,18,18,Then it continues on to the north side of the slope facing the plains and down into the plains.
Joshua,18,19,The border continues to the north slope of Beth Hoglah and ends at the northern bay of the Dead Sea at the south end of the Jordan River. This is its southern border.
Joshua,18,20,The Jordan River is its eastern border. These are the borders surrounding the inheritance given to Benjamin for its families.
Joshua,18,21,"These are the 12 cities with their villages that belong to the tribe of Benjamin for its families: Jericho, Beth Hoglah, Emek Keziz"
Joshua,18,22,"Beth Arabah, Zemaraim, Bethel"
Joshua,18,23,"Avvim, Parah, Ophrah"
Joshua,18,24,"Chephar Ammoni, Ophni, and Geba."
Joshua,18,25,"There were 14 other cities with their villages: Gibeon, Ramah, Beeroth"
Joshua,18,26,"Mizpeh, Chephirah, Mozah"
Joshua,18,27,"Rekem, Ir Peel, Taralah"
Joshua,18,28,"Zela, Eleph, Jebus (now called Jerusalem), Gibeath, and Kiriath. This is Benjamin’s inheritance for its families."
Joshua,19,1,The second lot was drawn for the families of the tribe of Simeon. Their inheritance was within Judah.
Joshua,19,2,"In their inheritance they received 13 cities and their villages: Beersheba (Sheba), Moladah"
Joshua,19,3,"Hazar Shual, Balah, Ezem"
Joshua,19,4,"Eltolad, Bethul, Hormah"
Joshua,19,5,"Ziklag, Beth Marcaboth, Hazar Susah"
Joshua,19,6,"Beth Lebaoth, and Sharuhen."
Joshua,19,7,"There were four other cities with their villages: Ain, Rimmon, Ether, and Ashan."
Joshua,19,8,All the villages around these cities as far as Baalath Beer and Ramath Negev were also included. This is the inheritance of the tribe of Simeon for its families.
Joshua,19,9,Simeon’s inheritance was a part of Judah’s because Judah had more land than it needed. So Simeon received its inheritance inside Judah’s borders.
Joshua,19,10,The third lot was drawn for the families descended from Zebulun. The border of their inheritance goes as far as Sarid.
Joshua,19,11,Toward the west the border ascends to Maralah and touches Dabbesheth and the river near Jokneam.
Joshua,19,12,"But from Sarid it turns directly east toward the border of Chisloth Tabor, on to Daberath, and then ascends toward Japhia."
Joshua,19,13,"From there it goes directly east to Gath Hepher, Eth Kazin, and Rimmon, where it turns to Neah."
Joshua,19,14,There the border turns north to Hannathon and ends at the valley of Iphtah El.
Joshua,19,15,"This also includes Kattath, Nahalal, Shimron, Idalah, and Bethlehem. There were 12 cities with their villages."
Joshua,19,16,These cities with their villages are the inheritance given to the families descended from Zebulun.
Joshua,19,17,The fourth lot was drawn for the families descended from Issachar.
Joshua,19,18,"Their territory included Jezreel, Chesulloth, Shunem"
Joshua,19,19,"Hapharaim, Shion, Anaharath"
Joshua,19,20,"Rabbith, Kishion, Ebez"
Joshua,19,21,"Remeth, En Gannim, En Haddah, and Beth Pazzez."
Joshua,19,22,"The border touches Tabor, Shahazimah, and Beth Shemesh and ends at the Jordan River. There were 16 cities with their villages."
Joshua,19,23,These cities with their villages are the inheritance for the families of the tribe of Issachar.
Joshua,19,24,The fifth lot was drawn for the families of the tribe of Asher.
Joshua,19,25,"Their territory included Helkath, Hali, Beten, Achshaph"
Joshua,19,26,"Allammelech, Amad, and Mishal. The border touches Carmel and Shihor Libnath in the west."
Joshua,19,27,Then it turns east to Beth Dagon and touches Zebulun and the valley of Iphtah El in the north and goes to Beth Emek and Neiel. From there it goes northward to Cabul
Joshua,19,28,"Abdon, Rehob, Hammon, Kanah, and as far as Great Sidon."
Joshua,19,29,"Then it turns at Ramah and goes on to the fortified city of Tyre. The border then turns to Hosah and ends at the Mediterranean Sea. The territory includes Meheleb, Achzib"
Joshua,19,30,"Umma, Acco, Aphek, and Rehob. There were 22 cities with their villages."
Joshua,19,31,These cities with their villages are the inheritance for the families of the tribe of Asher.
Joshua,19,32,The sixth lot was drawn for the families descended from the tribe of Naphtali.
Joshua,19,33,"Their border starts from Heleph at the oak tree at Zaanannim. It continues to Adami Nekeb, Jabneel, to Lakkum, and ends at the Jordan River."
Joshua,19,34,"The border turns west to Aznoth Tabor, and from there to Hukok. It touches Zebulun in the south, Asher in the west, and Judah in the east at the Jordan."
Joshua,19,35,"The fortified cities were Ziddim, Zer, Hammath, Rakkath, Chinnereth"
Joshua,19,36,"Adamah, Ramah, Hazor"
Joshua,19,37,"Kedesh, Edrei, En Hazor"
Joshua,19,38,"Yiron, Migdal El, Horem, Beth Anath, and Beth Shemeth. There were 19 cities with their villages."
Joshua,19,39,These cities with their villages are the inheritance for the families of the tribe of Naphtali.
Joshua,19,40,The seventh lot was drawn for the families of the tribe of Dan.
Joshua,19,41,"The territory of their inheritance included Zorah, Eshtaol, Ir Shemesh"
Joshua,19,42,"Shaalabbin, Aijalon, Ithlah"
Joshua,19,43,"Elon, Timnah, Ekron"
Joshua,19,44,"Eltekeh, Gibbethon, Baalath"
Joshua,19,45,"Jehud, Bene Berak, Gath Rimmon"
Joshua,19,46,"Me Jarkon, and Rakkon, with the border passing in front of Joppa."
Joshua,19,47,"The border of Dan extended beyond them. Dan’s descendants went up and attacked Leshem, captured it, and killed everyone there. They took it, settled there, and renamed the city Dan after their ancestor Dan."
Joshua,19,48,These cities with their villages are the inheritance for the families of the tribe of Dan.
Joshua,19,49,"When they all had finally received the land they were to inherit, the people of Israel also gave land within their territory as an inheritance to Joshua, son of Nun."
Joshua,19,50,"They gave him the city he asked for, as the LORD had instructed them to do. It was Timnath Serah in the mountains of Ephraim. He rebuilt the city and lived there."
Joshua,19,51,"This is the land that the tribes of Israel drew by lot. The priest Eleazar, Joshua son of Nun, and the leaders of the families divided the land by drawing lots. They did this in Shiloh in the presence of the LORD at the entrance of the tent of meeting. So they finished dividing the land."
Joshua,20,1,The LORD said to Joshua
Joshua,20,2,"“Tell the people of Israel, ‘Now choose for yourselves the cities of refuge about which I spoke to you through Moses."
Joshua,20,3,Choose them so that anyone who unintentionally kills someone may run to them. They will be a place of refuge from any relative who can avenge the death.
Joshua,20,4,"“ ‘A person who kills someone accidentally can run to one of these cities. There he will stand at the entrance to the city, where court is held, and present his case to the leaders of that city. Then they will take him into their city and give him a place to live with them."
Joshua,20,5,"“ ‘If the relative who can avenge the death pursues him, the leaders must not hand him over to the relative because he didn’t intend to kill the other person. He didn’t even hate the person he killed."
Joshua,20,6,The accused person may remain in that city until he can stand trial in front of the congregation or until whoever is chief priest at that time dies. Then he may go back to his home in the city from which he ran away.’ ”
Joshua,20,7,"Kedesh in Galilee in the mountains of Naphtali, Shechem in the mountains of Ephraim, and Kiriath Arba (now called Hebron) in the mountains of Judah were chosen as cities of refuge."
Joshua,20,8,"Bezer on the desert plateau from the tribe of Reuben, Ramoth in Gilead from the tribe of Gad, and Golan in Bashan from the tribe of Manasseh were chosen as cities of refuge on the east side of the Jordan River, east of Jericho."
Joshua,20,9,"These are the cities chosen as cities of refuge for all Israelites, including the foreigners living among them. Anyone who accidentally kills someone may escape to these cities. Then he will not be handed over to the relative who can avenge a death before he stands trial in front of the congregation."
Joshua,21,1,"Then the leaders of the families of Levi came to the priest Eleazar, to Joshua (son of Nun), and to the leaders of the families of the other Israelite tribes"
Joshua,21,2,"at Shiloh in Canaan. They said to them, “The LORD commanded through Moses that we should receive cities to live in and pasturelands for our livestock.”"
Joshua,21,3,"So, as the LORD had instructed, Levi’s descendants were given the following cities with pasturelands from the Israelites’ inheritance."
Joshua,21,4,"These are the cities for the families of Kohath that were chosen by drawing lots. These descendants of the priest Aaron the Levite received 13 cities from the tribes of Judah, Simeon, and Benjamin."
Joshua,21,5,The rest of Kohath’s descendants received 10 cities from the families of the tribes of Ephraim and Dan and half of the tribe of Manasseh.
Joshua,21,6,"Gershon’s descendants received 13 cities from the families of the tribes of Issachar, Asher, Naphtali, and half of the tribe of Manasseh in Bashan."
Joshua,21,7,"Merari’s descendants received 12 cities for their families from the tribes of Reuben, Gad, and Zebulun."
