Joshua,8,9,"So Joshua sent them out, and they hid. They took their position west of Ai, between Bethel and Ai. Joshua spent the night with the troops."
Joshua,8,10,Joshua got up early in the morning and assembled the troops. Then he and the leaders of Israel led the army to Ai.
Joshua,8,11,All the troops with him marched until they were near the city. They camped north of Ai with the ravine between them and Ai.
Joshua,8,12,"Joshua had taken about five thousand men and had them hide between Bethel and Ai, west of the city."
Joshua,8,13,"All the troops were positioned. The main camp was north of the city, and the other troops were hiding west of the city. That night Joshua went down into the middle of the valley."
Joshua,8,14,"When the king of Ai saw the main camp, he and all his troops got up early in the morning. They rushed out toward the plains to meet Israel for battle, just where ⌞Joshua⌟ expected. However, the king didn’t know there were troops behind the city waiting to attack him."
Joshua,8,15,Joshua and all Israel pretended to be defeated. They ran away toward the desert.
Joshua,8,16,"All the troops in the city were called out to chase them. As they chased Joshua, they were lured away from the city."
Joshua,8,17,Not one man was left in Ai or Bethel; they all went after Israel. So the city was left unprotected as they chased Israel.
Joshua,8,18,"Then the LORD said to Joshua, “Hold out the spear in your hand toward the city, because I am handing Ai over to you.” So Joshua held out his spear."
Joshua,8,19,"The men who were hiding got up as soon as he stretched out his hand. They entered the city, captured it, and quickly set it on fire."
Joshua,8,20,"When the men of Ai looked back, they could see the city going up in smoke. They had no place to go, since the Israelites, who had been running toward the desert, had now turned back on them."
Joshua,8,21,"When Joshua and all Israel saw that the men who had been hiding had captured the city and that it was going up in smoke, they turned and attacked the men of Ai."
Joshua,8,22,The men who had captured the city also came out and attacked them. The men of Ai were caught between the battle lines of Israel. So Israel attacked them on both sides. None of them survived or escaped.
Joshua,8,23,But they captured the king of Ai alive and brought him to Joshua.
Joshua,8,24,Israel had finished killing all the inhabitants of Ai in the fields and in the desert where they had been pursued. They put them all to death; not one person survived. Then the Israelites went back to Ai and killed everyone left there.
Joshua,8,25,Twelve thousand men and women from Ai died that day.
Joshua,8,26,Joshua did not lower his hand holding the spear until he had completely destroyed all the inhabitants of Ai.
Joshua,8,27,"Israel took the loot and the livestock of that city for themselves, as the LORD had commanded Joshua."
Joshua,8,28,So Joshua burned Ai and made it a deserted mound of ruins. It is still in ruins today.
Joshua,8,29,"Joshua hung the king of Ai’s ⌞dead body⌟ on a pole and left him there until evening. When the sun went down, Joshua gave the order to take his body down. They threw it in the entrance of the city and made a large pile of stones over it. That pile is still there today."
Joshua,8,30,At that time Joshua built an altar on Mount Ebal to the LORD God of Israel.
Joshua,8,31,He built an altar with uncut stones on which no iron chisels had been used. This was as the LORD’s servant Moses had commanded the people of Israel in the Book of Moses’ Teachings. They made burnt offerings to the LORD and sacrificed fellowship offerings on the altar.
Joshua,8,32,There in front of the people of Israel he wrote on stone slabs a copy of the Teachings which Moses had written down.
Joshua,8,33,"All the people of Israel, whether foreigners or native Israelites, the leaders, officers, and judges were standing on opposite sides of the ark. They faced the Levitical priests who carried the ark of the LORD’s promise. Half of the people were in front of Mount Gerizim and the other half in front of Mount Ebal. Right from the beginning, the LORD’s servant Moses had commanded the priests to bless the people of Israel this way."
Joshua,8,34,"Afterwards, Joshua read all the Teachings—the blessings and curses—as they had all been written down by Moses."
Joshua,8,35,"Joshua read ⌞Moses’ Teachings⌟ in front of the whole assembly of Israel, including women, children, and foreigners living among them. He did not leave out one word from everything Moses had commanded."
Joshua,9,1,When all the kings west of the Jordan River heard about these events
Joshua,9,2,"they joined together to fight Joshua and Israel. (They were the kings in the mountains, the foothills, and along the whole Mediterranean coast as far as Lebanon, the kings of the Hittites, Amorites, Canaanites, Perizzites, Hivites, and Jebusites.)"
Joshua,9,3,When the people living in Gibeon heard what Joshua had done to Jericho and Ai
Joshua,9,4,"they devised a scheme. They posed as messengers. They took worn-out sacks on their donkeys. Their wineskins were old, split, and patched."
Joshua,9,5,"Their sandals were worn-out and repaired, and their clothes were tattered. All their bread was dried out and crumbling."
Joshua,9,6,"They came to Joshua in the camp at Gilgal. They told Joshua and the men of Israel, “We have come from a distant country. Make a treaty with us right now.”"
Joshua,9,7,"The men of Israel said to the Hivites, “What if you’re living in this area? We wouldn’t be able to make a treaty with you.”"
Joshua,9,8,"They responded to Joshua, “We’re at your mercy.”
Joshua asked them, “Who are you, and where did you come from?”"
Joshua,9,9,"They answered him, “We came from a country very far away because the LORD your God has become famous. We heard stories about him and everything he did in Egypt."
Joshua,9,10,"We also heard everything he did to the two kings of the Amorites east of the Jordan, King Sihon of Heshbon and King Og of Bashan in Ashtaroth."
Joshua,9,11,"Our leaders and everyone who lives in our country told us, ‘Take what you need for the trip, and go meet them. Tell them, “We’re at your mercy. Make a treaty with us right now.” ’"
Joshua,9,12,Our bread was warm when we left home to meet with you. Look at it now! It’s dry and crumbling.
Joshua,9,13,These were new wineskins when we filled them. Look at them now! See how they are splitting! Our clothes and sandals are also worn-out because we have come such a long way.”
Joshua,9,14,"The men believed the evidence they were shown, but they did not ask the LORD about it."
Joshua,9,15,So Joshua made peace with them by making a treaty which allowed them to live. The leaders of the congregation swore to it with an oath.
Joshua,9,16,"But three days after the treaty was made, the Israelites heard that these people were their neighbors and lived with them."
Joshua,9,17,"The Israelites broke camp. They came to the cities of Gibeon, Chephirah, Beeroth, and Kiriath Jearim two days later."
Joshua,9,18,"The Israelites didn’t destroy these other people, because the leaders of the congregation had sworn an oath about them to the LORD God of Israel. The whole congregation complained about the leaders."
Joshua,9,19,"But all the leaders said to them, “We have sworn an oath about them to the LORD God of Israel, so we cannot touch them now."
Joshua,9,20,We must let them live to avoid ⌞the LORD’s⌟ anger because of the oath we swore.”
Joshua,9,21,"The leaders said that they should be allowed to live. So they became woodcutters and water carriers for the whole congregation, as the leaders had said."
Joshua,9,22,"Joshua sent for the people of Gibeon and asked, “Why did you deceive us by saying, ‘We live very far away from you,’ when you live here with us?"
Joshua,9,23,You are under a curse now. You will always be servants. You will be woodcutters and water carriers for the house of my God.”
Joshua,9,24,"They answered Joshua, “We were told that the LORD your God commanded his servant Moses to give you the whole land and destroy all who live there. We deceived you because we feared for our lives."
Joshua,9,25,Now we’re at your mercy. Do to us what you think is good and right.”
Joshua,9,26,So Joshua rescued them and did not let the people of Israel kill them.
Joshua,9,27,"But that day Joshua made them woodcutters and water carriers for the congregation. They served the LORD’s altar, wherever he chose to put it. They still serve today."
Joshua,10,1,King Adoni Zedek of Jerusalem heard that Joshua had captured Ai and claimed it for the LORD the same way he had destroyed Jericho and its king. He also heard that the people of Gibeon had made peace with the people of Israel and were living with them.
Joshua,10,2,"He and his people were terribly afraid because Gibeon was a large city. It was like one of the royal cities, larger than Ai. All its men were warriors."
Joshua,10,3,"So King Adoni Zedek of Jerusalem sent ⌞this message⌟ to King Hoham of Hebron, King Piram of Jarmuth, King Japhia of Lachish, and King Debir of Eglon"
Joshua,10,4,"“Come, help me destroy Gibeon because it has made peace with Joshua and the people of Israel.”"
Joshua,10,5,"So the five Amorite kings of Jerusalem, Hebron, Jarmuth, Lachish, and Eglon combined their armies. They marched to Gibeon, camped there, and attacked it."
Joshua,10,6,"The men of Gibeon sent this message to Joshua at the camp in Gilgal: “Don’t abandon us! Come quickly, and save us. Help us because all the Amorite kings who live in the mountains have united against us.”"
Joshua,10,7,"So Joshua, with all his soldiers and best warriors, set out from Gilgal."
Joshua,10,8,"The LORD told Joshua, “Don’t be afraid of them. I have handed them over to you. None of them can stand up to you.”"
Joshua,10,9,So Joshua marched all night from Gilgal and took them by surprise.
Joshua,10,10,The LORD threw the enemy into disorder in front of Israel and defeated them decisively at Gibeon. He chased them along the road that goes to the slope of Beth Horon and continued to defeat them all the way to Azekah and Makkedah.
Joshua,10,11,"As they fled from the Israelites down the slope of Beth Horon toward Azekah, the LORD threw huge hailstones on them. More died from the hailstones than from Israelite swords."
Joshua,10,12,"The day the LORD handed the Amorites over to the people of Israel, Joshua spoke to the LORD while Israel was watching,
“Sun, stand still over Gibeon,
and moon, stand still over the valley of Aijalon!”"
Joshua,10,13,"The sun stood still,
and the moon stopped
until a nation got revenge on its enemies.
Isn’t this recorded in the Book of Jashar? The sun stopped in the middle of the sky, and for nearly a day the sun was in no hurry to set."
Joshua,10,14,"Never before or after this day was there anything like it. The LORD did what a man told him to do, because the LORD fought for Israel."
Joshua,10,15,Then Joshua and all Israel returned to the camp at Gilgal.
Joshua,10,16,The five kings ran away and hid in the cave at Makkedah.
Joshua,10,17,"Someone told Joshua, “The five kings have been found. They are hiding in the cave at Makkedah.”"
Joshua,10,18,"Joshua replied, “Roll large stones against the mouth of the cave, and post a guard there."
Joshua,10,19,"But don’t stop. Chase your enemies! Cut off their rear guard. Don’t let them get back into their own cities, because the LORD your God has handed them over to you.”"
Joshua,10,20,"Joshua and the Israelites defeated them decisively, almost destroying them. But some who survived got back into the fortified cities."
Joshua,10,21,Then the whole army returned safely to Joshua in the camp at Makkedah. Not a single person dared to speak against any of the Israelites.
Joshua,10,22,"Joshua said, “Open the cave, and bring me the five kings!”"
Joshua,10,23,"So they brought him the kings of Jerusalem, Hebron, Jarmuth, Lachish, and Eglon."
Joshua,10,24,"When they brought them to Joshua, he called for all the men of Israel. He told the officers who had gone with him, “Come forward and put your feet on the necks of these kings.” So that’s what they did."
Joshua,10,25,"Joshua told them, “Don’t be afraid or terrified! Be strong and courageous, because this is what the LORD will do to all the enemies you’re fighting against.”"
Joshua,10,26,"After this, Joshua put them to death and hung their bodies on five poles until evening."
Joshua,10,27,"When the sun went down, Joshua gave the order to take them down from the poles. Then they threw them into the cave where they had been hiding and put large stones over the mouth of the cave. These stones are still there today."
Joshua,10,28,"That same day Joshua captured Makkedah, and the Israelites killed its people and king with swords. He claimed them for the LORD by destroying them. There were no survivors. He did the same thing to the king of Makkedah that he had done to the king of Jericho."
Joshua,10,29,Joshua and all Israel marched from Makkedah to Libnah and attacked it.
Joshua,10,30,The LORD also handed Libnah and its king over to Israel. He killed all the people. There were no survivors. He did the same thing to the king of Libnah that he had done to the king of Jericho.
Joshua,10,31,"Joshua and all Israel marched from Libnah to Lachish, camped there, and attacked it."
Joshua,10,32,"The LORD handed Lachish over to Israel. He captured it on the next day and killed all the people, the same way he had captured Libnah."
Joshua,10,33,At that time King Horam of Gezer had come to help Lachish. But Joshua killed him and his troops. There were no survivors.
Joshua,10,34,"Joshua and all Israel marched from Lachish to Eglon, camped there, and attacked it."
Joshua,10,35,They captured it that day and killed everyone in it. He claimed it for the LORD by destroying it the same way he had destroyed Lachish.
Joshua,10,36,Then Joshua and all Israel marched from Eglon to Hebron and attacked it.
Joshua,10,37,"They captured it and its neighboring villages and killed its king and all the people. There were no survivors, the same as at Eglon. He claimed the city and all its people for the LORD by destroying them."
Joshua,10,38,Then Joshua and all Israel went back to Debir and attacked it.
Joshua,10,39,He captured it and its king and all its neighboring villages and killed everyone. So they claimed them all for the LORD by destroying them. There were no survivors. He did the same thing to Debir and its king that he had done to Hebron and Libnah and their kings.
Joshua,10,40,"So Joshua captured the whole land—the mountains, the Negev, the foothills, and the slopes. There were no survivors. He claimed every living creature for the LORD by destroying it, as the LORD God of Israel had commanded."
Joshua,10,41,So Joshua defeated the people from Kadesh Barnea to Gaza and from all the country of Goshen as far as Gibeon.
Joshua,10,42,Joshua captured all these kings and their territories in one campaign because the LORD God of Israel fought for Israel.
Joshua,10,43,Then Joshua and all Israel returned to the camp at Gilgal.
Joshua,11,1,King Jabin of Hazor heard ⌞what had happened⌟. So he sent messengers to King Jobab of Madon and to the kings of Shimron and Achshaph.
Joshua,11,2,"He also sent messengers to the northern kings in the mountains, the plains south of Chinneroth, the foothills, and Naphoth Dor in the west"
Joshua,11,3,"the Canaanites from east and west, the Amorites, Hittites, Perizzites, the Jebusites in the mountains, and the Hivites at the foot of Mount Hermon in Mizpah."
Joshua,11,4,They came out with all their armies. Their troops were as numerous as the grains of sand on the seashore. They also had horses and chariots.
Joshua,11,5,All these kings camped together by the Springs of Merom in order to fight Israel.
Joshua,11,6,"The LORD told Joshua, “Don’t be afraid of them because I am going to give them to Israel. About this time tomorrow they will all be dead. You must disable their horses so that they cannot be used in battle. You must burn their chariots.”"
Joshua,11,7,Joshua and all his troops arrived suddenly at the Springs of Merom and attacked the Canaanite armies.
Joshua,11,8,"The LORD handed them over to Israel, and the Israelites defeated them. The Israelites chased them as far as Great Sidon, Misrephoth Maim, and the valley of Mizpah in the east. There were no survivors."
Joshua,11,9,"Joshua disabled their horses and burned their chariots, as the LORD had told him."
Joshua,11,10,Then Joshua turned back and captured Hazor. He killed its king with a sword. (Hazor was formerly the head of all these kingdoms.)
Joshua,11,11,They claimed everyone for the LORD by destroying them with swords. Not one person survived. Joshua also burned Hazor.
Joshua,11,12,"So Joshua captured all these cities and their kings. He claimed them for the LORD by destroying them, as the LORD’s servant Moses had commanded him."
Joshua,11,13,"Israel did not burn cities built on mounds. However, Joshua made an exception and burned Hazor."
Joshua,11,14,The people of Israel took all the loot and livestock from these cities. But they put everyone to death until they were all destroyed. Not one person survived.
Joshua,11,15,So Joshua carried out what the LORD had commanded his servant Moses and what Moses had commanded him. He did not leave out anything the LORD had commanded Moses.
Joshua,11,16,"Joshua took all this land, the mountains, all the Negev, all the land of Goshen, the foothills, the plains, and the mountains and foothills of Israel."
Joshua,11,17,The land extended from Mount Halak which ascends to Seir as far as Baal Gad in the Lebanon Valley at the foot of Mount Hermon. He captured all their kings and killed them.
Joshua,11,18,Joshua waged war with all these kings for a long time.
Joshua,11,19,"Not one city had made a peace treaty with the people of Israel except Gibeon, where the Hivites lived. Israel captured everything in battle."
Joshua,11,20,"The LORD made their enemies stubborn enough to continue fighting against Israel so that he could claim them all for destruction without mercy, as he had commanded Moses."
Joshua,11,21,"At that time Joshua also wiped out the people of Anak in the mountains, in Hebron, Debir, and Anab, and in all the hills of Judah and Israel. Joshua claimed them for the LORD by destroying them and their cities."
Joshua,11,22,"None of the people of Anak remained in Israel. Some of them were left in Gaza, Gath, and Ashdod."
Joshua,11,23,"Joshua captured the whole land as the LORD had promised Moses. He gave it to Israel as a possession, dividing it among the tribes. So the land had peace."
Joshua,12,1,"These are the kings of the land east of the Jordan River that the people of Israel defeated. Israel also took possession of their lands from the Arnon Valley to Mount Hermon, and all the eastern plains."
Joshua,12,2,"Sihon was the Amorite king who lived in Heshbon. His rule extended from Aroer on the edge of the Arnon Valley to the Jabbok River, which is the border of Ammon. This included the middle of the valley and half of Gilead."
Joshua,12,3,It included the eastern plains from the Sea of Galilee to the Sea of the Plains (the Dead Sea) and the road that goes south from Beth Jeshimoth to the foot of the slopes of Pisgah.
Joshua,12,4,The territory of King Og of Bashan who lived in Ashtaroth and Edrei was captured. He was the last of the Rephaim.
Joshua,12,5,"He ruled Mount Hermon, Salecah, all of Bashan to the border of Geshur and Maacath, and half of Gilead to the border of King Sihon of Heshbon."
Joshua,12,6,The LORD’s servant Moses and the people of Israel defeated them. Then he gave their land as a possession to the tribes of Reuben and Gad and half of the tribe of Manasseh.
Joshua,12,7,"These are the kings of the land west of the Jordan River that Joshua and the people of Israel defeated. ⌞Their lands extended⌟ from Baal Gad in the valley of Lebanon to Mount Halak which rises toward Seir. Joshua gave it as a possession to Israel, dividing it among the tribes."
Joshua,12,8,"It included the mountains, foothills, plains, slopes, desert, and the Negev ⌞that the⌟ Hittites, Amorites, Canaanites, Perizzites, Hivites, and Jebusites ⌞had possessed⌟.
The kings were"
Joshua,12,9,"the king of Jericho, the king of Ai (near Bethel)"
Joshua,12,10,"the king of Jerusalem, the king of Hebron"
Joshua,12,11,"the king of Jarmuth, the king of Lachish"
Joshua,12,12,"the king of Eglon, the king of Gezer"
Joshua,12,13,"the king of Debir, the king of Geder"
Joshua,12,14,"the king of Hormah, the king of Arad"
Joshua,12,15,"the king of Libnah, the king of Adullam"
Joshua,12,16,"the king of Makkedah, the king of Bethel"
Joshua,12,17,"the king of Tappuah, the king of Hepher"
Joshua,12,18,"the king of Aphek, the king of Sharon"
Joshua,12,19,"the king of Madon, the king of Hazor"
Joshua,12,20,"the king of Shimron Meron, the king of Achshaph"
Joshua,12,21,"the king of Taanach, the king of Megiddo"
Joshua,12,22,"the king of Kedesh, the king of Jokneam in Carmel"
Joshua,12,23,"the king of Dor in Naphoth Dor, the king of Goiim in Gilgal"
Joshua,12,24,"the king of Tirzah.
The total was 31 kings."
Joshua,13,1,"Joshua was old, near the end of his life. So the LORD said to him, “You are old, near the end of your life, and there is a lot of land left to be conquered."
Joshua,13,2,The land that is left includes all the districts that belong to the Philistines and Geshur.
Joshua,13,3,"It extends from the Shihor River, east of Egypt, northward as far as the border of Ekron. This is considered to be Canaanite territory, even though there are five Philistine rulers over Gaza, Ashdod, Ashkelon, Gath, and Ekron, as well as the Avvim people"
Joshua,13,4,"in the south. This territory includes all the land of the Canaanites as well as Mearah which belongs to Sidon as far as Aphek, the Amorite border."
Joshua,13,5,"It also includes the land of the people of Gebal, all Lebanon eastward from Baal Gad at the foot of Mount Hermon to the border of Hamath."
Joshua,13,6,"I will force out of the way of the people of Israel everyone who lives in the mountains from Lebanon to Misrephoth Maim and all the people of Sidon. However, you must distribute the land as an inheritance to Israel by drawing lots, as I commanded you."
Joshua,13,7,So divide this land. It will be an inheritance for the nine tribes and half of the tribe of Manasseh.”
Joshua,13,8,"The tribes of Reuben and Gad with half of the tribe of Manasseh had received their inheritance east of the Jordan River, since the LORD’s servant Moses had already given it to them."
Joshua,13,9,"The border extended from Aroer on the edge of the Arnon Valley, including the city in the middle of the valley, and the whole plateau from Medeba to Dibon."
Joshua,13,10,It included all the cities of King Sihon of the Amorites up to the border of Ammon. Sihon’s capital was Heshbon.
Joshua,13,11,"It also included Gilead, the territory of the people of Geshur and Maacath, all of Mount Hermon, and all of Bashan as far as Salecah"
Joshua,13,12,(the whole kingdom of Og in Bashan). Og ruled in Ashtaroth and Edrei. He was the last of the Rephaim. Moses had defeated them and forced them out.
Joshua,13,13,But the Israelites did not force out the people of Geshur and Maacath. So they still live in Israel today.
Joshua,13,14,"Moses did not give any land as an inheritance to the tribe of Levi. The sacrifices offered to the LORD God of Israel are what the Levites inherited, as the LORD had promised them."
Joshua,13,15,Moses gave some land as an inheritance to the tribe of Reuben for their families.
Joshua,13,16,"Their territory extended from Aroer on the edge of the Arnon Valley, including the city in the middle of the valley and the whole plateau near Medeba."
Joshua,13,17,"It included Heshbon and all its cities on the plateau, Dibon, Bamoth Baal, Beth Baal Meon"
Joshua,13,18,"Jahaz, Kedemoth, Mephaath"
Joshua,13,19,"Kiriathaim, Sibmah, Zereth Shahar on the mountain in the valley"
Joshua,13,20,"Beth Peor, the slopes of Pisgah, and Beth Jeshimoth."
Joshua,13,21,"It also included all the cities of the plateau, the whole kingdom of King Sihon of the Amorites, who ruled in Heshbon. Moses defeated him and Midian’s leaders—Evi, Rekem, Zur, Hur, and Reba. They were princes of Sihon, who lived in that country."
Joshua,13,22,"Along with these leaders, the people of Israel also killed Balaam, son of Beor, who used black magic."
Joshua,13,23,The border of Reuben’s territory was the Jordan River. This was Reuben’s inheritance for its families. It included cities with their villages.
Joshua,13,24,Moses gave some land as an inheritance to the tribe of Gad for its families.
Joshua,13,25,"Their territory included Jazer, all the cities of Gilead, and half of Ammon as far as Aroer, which is by Rabbah."
Joshua,13,26,"It extended from Heshbon to Ramath Mizpeh and Betonim, and from Mahanaim as far as the border of Lidbir."
Joshua,13,27,"In the Jordan Valley it included Beth Haram, Beth Nimrah, Succoth, and Zaphon, the rest of the kingdom of King Sihon of Heshbon. The Jordan River served as its western border, extending to the end of the Sea of Galilee."
Joshua,13,28,This was Gad’s inheritance for its families. It included cities with their villages.
Joshua,13,29,Moses gave some land as an inheritance to half of the tribe of Manasseh. It was only for the families of that half of the tribe.
Joshua,13,30,Their territory extended from Mahanaim and included all of Bashan (the whole kingdom of King Og of Bashan) and all 60 settlements of Jair that were in Bashan.
Joshua,13,31,"It also included half of Gilead with Ashtaroth and Edrei, the royal cities of Og in Bashan. They were given to half the families of Machir, son of Manasseh, ⌞for their inheritance⌟."
