Kohelet,10,6,"fools are promoted to high positions,
while the rich occupy humble places."
Kohelet,10,7,"I have seen servants riding horses,
while princes walk on foot like slaves."
Kohelet,10,8,"He who digs a pit may fall into it;
he who breaks through a wall may be bitten by a snake."
Kohelet,10,9,"He who quarries stones may get hurt by them,
he who chops wood puts himself in danger."
Kohelet,10,10,"If the [hatchet’s] iron [blade] is blunt,
and [its user] doesn’t sharpen it,
he will have to exert more effort;
but the expert has the advantage of his skill."
Kohelet,10,11,"If a snake bites before it is charmed,
the snake-charmer has no advantage."
Kohelet,10,12,"The words spoken by the wise bring them favor,
but the lips of a fool swallow him up."
Kohelet,10,13,"What he says starts with foolishness
and ends with wicked madness."
Kohelet,10,14,"A fool keeps talking and talking,
yet no one knows what the future will bring —
can anyone tell a person
what will happen after he’s gone?"
Kohelet,10,15,"The efforts of a fool wear him out;
he doesn’t even know the way to town!"
Kohelet,10,16,"Woe to you, land, when your king is a child,
and your leaders start their parties in the morning!"
Kohelet,10,17,"Happy are you, land, when your king is well-born,
and your princes eat at the proper time,
in order to stay strong, not to get drunk!"
Kohelet,10,18,"When the owner is lazy, the roof sags;
when hands are idle, the house leaks."
Kohelet,10,19,"Parties are made for having a good time,
wine adds cheer to life,
and money has an answer for everything."
Kohelet,10,20,"Don’t insult the king, not even in your thoughts;
and don’t insult the wealthy, not even in your bedroom;
for a bird in the air might carry the news,
a creature with wings might repeat what you said."
Kohelet,11,1,"Send your resources out over the seas;
eventually you will reap a return."
Kohelet,11,2,"Divide your merchandise into seven or eight shares,
since you don’t know what disasters may come on the earth."
Kohelet,11,3,"If the clouds are full of rain,
they empty themselves on the earth.
Whether a tree falls toward the north or the south,
the place where the tree falls is where it stays."
Kohelet,11,4,"He who keeps watching the wind will never sow;
he who keeps looking at the clouds will never reap."
Kohelet,11,5,"Just as you don’t know the way of the wind
or how bones grow in a pregnant woman’s womb,
so you don’t know the work of God,
the maker of everything."
Kohelet,11,6,"In the morning, sow your seed;
and don’t slack off until evening;
for you don’t know which sowing will succeed,
this, or that, or if both will do well."
Kohelet,11,7,"Then the light will be sweet,
and it will be a pleasure to see the sun."
Kohelet,11,8,"For if a person lives many years,
let him take joy in them all;
yet remembering that there will be many days of darkness,
that all to come is futile."
Kohelet,11,9,"Young person, if you spend your youth only having fun,
if you use your early years just to entertain yourself,
if you follow your heart as you live your life,
and let your eyes be your guide;
understand that for all these things
God will bring you to judgment."
Kohelet,11,10,"Therefore, remove anger from your heart;
and keep from harming your body;
for neither adolescence nor youth
has any lasting value."
Kohelet,12,1,"So remember your creator while you are young,
before the evil days come,
and the years approach when you will say,
“They no longer give me pleasure”"
Kohelet,12,2,"before the sun and the light grow dim,
also the moon and the stars;
before the clouds return after the rain"
Kohelet,12,3,"on the day when the guards of the house are trembling,
and men of courage are bent over double;
when the women stop grinding grain,
because there are so few;
when the women at the windows
can no longer see out"
Kohelet,12,4,"when the doors to the streets are kept shut;
when the noise from the grain-mill fades;
when a person is startled by the chirp of a bird,
yet their singing is hard to hear"
Kohelet,12,5,"when they will be afraid to go up a hill,
and terrors will stalk the way,
even though the almond tree is in bloom;
when the locust can only drag itself along,
and the caper berry has no [aphrodisiac] effect —
because the person is headed for his eternal home,
and the mourners are already gathering
in the marketplace "
Kohelet,12,6,"before the silver cord is snapped
the bowl of gold is cracked,
the pitcher is shattered at the spring,
the pulley is broken at the cistern"
Kohelet,12,7,"the dust returns to earth, as it was,
and the spirit returns to God, who gave it!"
Kohelet,12,8,"Pointless! Meaningless! — says Kohelet,
Nothing matters at all!"
Kohelet,12,9,"Not only was Kohelet wise, he also taught the people what he knew; also he weighed, researched and corrected many ethical sayings."
Kohelet,12,10,"Kohelet worked to develop an attractive writing style, in which he expressed the truth straightforwardly."
Kohelet,12,11,"The sayings of the wise are as sharp as goads, and those given by leaders of assemblies are like well-fixed nails; [in this case,] they are presented by a single shepherd."
Kohelet,12,12,"In addition, my son, take heed: one can write many books — there’s no end to it; and one can study so much that it wearies the flesh."
Kohelet,12,13,"Here is the final conclusion, now that you have heard everything: fear God, and keep his mitzvot; this is what being human is all about."
Kohelet,12,14,"For God will bring to judgment everything we do, including every secret, whether good or bad.
[Here is the final conclusion, now that you have heard everything: fear God, and keep his mitzvot; this is what being human is all about.]"
