M'lakhim Bet,6,1,"The guild prophets said to Elisha, “As you can see, the place where we are living in order to be with you is too small for us."
M'lakhim Bet,6,2,"Please allow us to go to the Yarden; each of us will collect a log there, and we’ll build a place there for us to live.” He answered, “Go ahead.”"
M'lakhim Bet,6,3,"But one of them said, “Please, won’t you come with your servants?” He answered, “All right, I will”"
M'lakhim Bet,6,4,"so he went with them. When they arrived at the Yarden, they cut down trees"
M'lakhim Bet,6,5,"but as one was felling a tree trunk, the head of his axe fell in the water. “Oh, no!” he cried. “My master, it was a borrowed one!”"
M'lakhim Bet,6,6,"The man of God asked, “Where did it fall?” He showed him the place. Then Elisha cut a stick, threw it in there, and the iron axe-head floated to the surface."
M'lakhim Bet,6,7,"“Lift it out,” he said. So he put out his hand and took it."
M'lakhim Bet,6,8,"Now the king of Aram went to war against Isra’el; and in consulting his servants he said, “I’ll set up my ambush camp in such-and-such a place.”"
M'lakhim Bet,6,9,"The man of God sent this message to the king of Isra’el: “Be careful not to go past such-and-such a place, because Aram will attack there.”"
M'lakhim Bet,6,10,"So the king of Isra’el sent men to the place the man of God had told him and warned him about, and he took special precautions there. This happened more than once or twice"
M'lakhim Bet,6,11,"and it greatly upset the king of Aram. He called his servants and said to them, “Tell me which of you is betraying us to the king of Isra’el?”"
M'lakhim Bet,6,12,"One of his servants replied, “It’s not that, my lord, king. Rather, Elisha, the prophet who is in Isra’el, tells the king of Isra’el the words you speak privately in your own bedroom!”"
M'lakhim Bet,6,13,"He said, “Go and see where he is, so that I can send and bring him here.” They told him, “He’s in Dotan.”"
M'lakhim Bet,6,14,"So he sent horses, chariots and a large army there; they came by night and surrounded the city."
M'lakhim Bet,6,15,"The servant of the man of God got up early in the morning; on going outside, he saw an army with horses and chariots surrounding the city. His servant said to him, “Oh, my master, this is terrible! What are we going to do?”"
M'lakhim Bet,6,16,"He answered, “Don’t be afraid — those who are with us outnumber those who are with them!”"
M'lakhim Bet,6,17,"Elisha prayed, “ADONAI, I ask you to open his eyes, so that he can see.” Then ADONAI opened the young man’s eyes, and he saw: there before him, all around Elisha, the mountain was covered with horses and fiery chariots."
M'lakhim Bet,6,18,"When they came down to him, Elisha prayed to ADONAI, “Please strike these people blind”; and he struck them blind, as Elisha had asked."
M'lakhim Bet,6,19,"Next, Elisha told them, “You’ve lost your way, and this isn’t even the right city. Follow me, and I’ll take you to the man you’re looking for.” Then he led them to Shomron."
M'lakhim Bet,6,20,"On their arrival in Shomron, Elisha said, “ADONAI, open the eyes of these men, so that they can see.” ADONAI opened their eyes, and they saw: there they were, in the middle of Shomron."
M'lakhim Bet,6,21,"When the king of Isra’el saw them, he asked Elisha, “My father, should I attack them? Should I attack them?”"
M'lakhim Bet,6,22,"He answered, “Don’t attack them! You wouldn’t even attack prisoners you had captured with your own sword and bow, would you? So give them food to eat and water to drink, and let them return to their master.”"
M'lakhim Bet,6,23,"So he provided well for them; and after they had eaten and drunk, he sent them away; and they returned to their master. After that, no more raiding parties entered the land of Isra’el from Aram."
M'lakhim Bet,6,24,"But some time afterwards, Ben-Hadad king of Aram gathered all his army, went up and laid siege to Shomron."
M'lakhim Bet,6,25,"At the time, there was a severe famine in Shomron; and they maintained their siege until a donkey’s head sold for eighty pieces of silver and half a pint of doves’ dung for five pieces of silver."
M'lakhim Bet,6,26,"As the king of Isra’el was passing by on the wall, a woman cried out to him, “Help, my lord, king!”"
M'lakhim Bet,6,27,"He said, “If ADONAI isn’t helping you, how do you expect me to help you? There isn’t any grain, and there isn’t any wine.”"
M'lakhim Bet,6,28,"Then the king asked her, “What’s troubling you?” She answered, “This woman said to me, ‘Give me your son, so that we can eat him today; and we’ll eat my son tomorrow.’"
M'lakhim Bet,6,29,"So we boiled my son and ate him. The next day I said to her, ‘Give your son, so that we can eat him,’ but she has hidden her son.”"
M'lakhim Bet,6,30,"When the king heard what the woman said, he tore his clothes. At the time, he was passing by on the wall; and when the people looked, they saw him there with sackcloth against his skin."
M'lakhim Bet,6,31,"Then he said, “May God do terrible things to me, and worse ones too, if the head of Elisha the son of Shafat remains on his body by day’s end.”"
M'lakhim Bet,6,32,"Elisha was sitting in his house, and the leaders were sitting there with him. The king sent a messenger ahead, but before he arrived, Elisha said to the leaders, “Do you see how this son of a murderer has sent someone to remove my head? Look, when the messenger comes, close the door and keep it shut against him. You can hear his master’s footsteps following right behind him!”"
M'lakhim Bet,6,33,"While he was still speaking, the messenger arrived with this message from the king: “Here, this evil is from ADONAI. Why should I wait for ADONAI any longer?”"
M'lakhim Bet,7,1,"Elisha answered, “Listen to the word of ADONAI. Here is what ADONAI says: ‘Tomorrow, by this time, six quarts of fine flour will sell for only a shekel, and half a bushel of barley for a shekel [in the market] at the gate to Shomron.”"
M'lakhim Bet,7,2,"The servant on whose arm the king was leaning answered the man of God: “Why, this couldn’t happen even if ADONAI made windows in heaven!” Elisha answered, “All right, you yourself will see it with your own eyes; but you won’t eat any of it!”"
M'lakhim Bet,7,3,"Now there were four men with tzara‘at at the entrance to the city gate, and they said to each other, “Why should we sit here till we die?"
M'lakhim Bet,7,4,"If we say, ‘We’ll enter the city, then the city has been struck by the famine, so we’ll die there. And if we sit still here, we’ll also die. So let’s go and surrender to the army of Aram; if they spare our lives, we will live; and if they kill us, we’ll only die.”"
M'lakhim Bet,7,5,"They got up during the twilight to go to the camp of Aram. But when they reached the outskirts of the camp of Aram, they saw no one!"
M'lakhim Bet,7,6,"For ADONAI had caused the army of Aram to hear the sound of chariots and horses; it sounded like a huge army; and they said to each other, “The king of Isra’el must have hired the kings of the Hitti and the kings of the Egyptians to attack us.”"
M'lakhim Bet,7,7,"So they jumped up and fled in the twilight, leaving their tents, horses, donkeys and the whole camp just as it was, and ran for their lives."
M'lakhim Bet,7,8,"When these men with tzara‘at reached the outskirts of the camp, they entered one of the tents, ate and drank; then took some silver, gold and clothing; and went and hid it. Next they returned and entered another tent, took stuff from there, and went and hid it."
M'lakhim Bet,7,9,"But finally they said to each other, “What we are doing is wrong. At a time of good news like this, we shouldn’t keep it to ourselves. If we wait even till morning, we will earn only punishment; so come on, let’s go and tell the king’s household.”"
M'lakhim Bet,7,10,"So they came and shouted to the gatekeepers of the city and told them the news: “We went to the camp of Aram, and no one was there, no human voice — just the horses and donkeys tied up, and the tents left in place.”"
M'lakhim Bet,7,11,The gatekeepers called and told it to the king’s household inside.
M'lakhim Bet,7,12,"Then the king got up in the night; he said to his servants, “I’ll tell you what Aram has done to us. They know that we’re hungry, so they’ve gone outside the camp and hidden in the countryside, saying, ‘When they come out of the city, we’ll take them alive and then get inside the city.’”"
M'lakhim Bet,7,13,"One of his servants answered, “I suggest letting some men take five of the remaining horses that are left in the city — they’re like everything else in Isra’el that remains, like everything else in Isra’el, practically finished — and we’ll send and see.”"
M'lakhim Bet,7,14,"So they took two chariots with horses, and the king sent after the army of Aram, saying, “Go, and see.”"
M'lakhim Bet,7,15,"They went after them all the way to the Yarden, and found the entire distance strewn with clothing and other articles Aram had thrown away in their haste. The messengers returned and told the king."
M'lakhim Bet,7,16,"Then the people went out and ransacked the camp of Aram — with the result that six quarts of fine flour was sold for only a shekel and half a bushel of barley for a shekel, in keeping with what ADONAI had said."
M'lakhim Bet,7,17,"The king put the servant on whose arm he had leaned in charge of the gate, and the people trampled him down in the gateway, so that he died, as the man of God had said he would, who spoke when the king came to him."
M'lakhim Bet,7,18,"For the man of God had said to the king, “Tomorrow by this time six quarts of barley will sell for only a shekel and half a bushel of fine flour for a shekel [in the market] at the gate of Shomron”"
M'lakhim Bet,7,19,"the servant had answered the man of God, “Why, this couldn’t happen even if ADONAI made windows in heaven!” and Elisha had said, “All right, you yourself will see it with your own eyes; but you won’t eat any of it!”"
M'lakhim Bet,7,20,"That is exactly what happened to him, because the people trampled him down in the gateway, so that he died."
M'lakhim Bet,8,1,"Now Elisha had said to the woman whose son he had restored to life, “Move away, you and your household, and stay wherever you can; because ADONAI has called for a famine; and it will be on the land for seven years.”"
M'lakhim Bet,8,2,The woman acted at once and did as the man of God had said — she went with her household and stayed in the land of the P’lishtim for seven years.
M'lakhim Bet,8,3,At the end of seven years the woman returned from the land of the P’lishtim and sought an audience with the king to claim her house and land.
M'lakhim Bet,8,4,"The king was talking with Geichazi the servant of the man of God. “Tell me,” he said, “all the great things Elisha has done.”"
M'lakhim Bet,8,5,"Just as he was telling the king how he had restored a dead person to life, at that very moment the woman whose son he had restored to life came to the king with her claim for her house and land. Geichazi said, “My lord, king, this is the woman; and this is her son, the one Elisha restored to life.”"
M'lakhim Bet,8,6,"On being asked by the king, the woman verified it. At this, the king appointed a special officer and charged him, “Restore everything that belongs to her, including the income her fields have produced from the day she left them until now.”"
M'lakhim Bet,8,7,"Elisha went to Dammesek. Ben-Hadad the king of Aram was ill; and he was told, “The man of God has come here.”"
M'lakhim Bet,8,8,"The king said to Haza’el, “Take with you a gift, go meet the man of God and consult ADONAI through him; ask if I will recover from this illness.”"
M'lakhim Bet,8,9,"Haza’el went to meet him, taking with him a gift that included everything good Dammesek had, forty camel-loads. He came, stood before him and said, “Your son Ben-Hadad king of Aram has sent me to you; he asks, ‘Will I recover from this illness?’”"
M'lakhim Bet,8,10,"Elisha answered, “Go and say to him, ‘You will surely recover’ — even though ADONAI has shown me that he will surely die.”"
M'lakhim Bet,8,11,Then the man of God fixed his gaze on him for so long that Haza’el became embarrassed; finally Elisha began to cry.
M'lakhim Bet,8,12,"Haza’el asked, “Why is my lord crying?” He answered, “Because I know the disasters you will bring on the people of Isra’el — you will set their fortresses on fire, you will kill their young men with the sword, you will dash their little ones to pieces and rip their pregnant women apart.”"
M'lakhim Bet,8,13,"Haza’el said, “But what is your servant? Nothing but a dog! How could he do anything of such magnitude?” Elisha answered, “ADONAI has shown me that you will be king over Aram.”"
M'lakhim Bet,8,14,"Then he left Elisha and returned to his master, who asked him, “What did Elisha say to you?” “He told me you would surely recover.”"
M'lakhim Bet,8,15,"The next day he took a blanket, dipped it in water and spread it on his face, so that he died; and Haza’el took his place as king."
M'lakhim Bet,8,16,It was when Yoram the son of Ach’av king of Isra’el was in the fifth year of his reign that Y’horam the son of Y’hoshafat began his rule over Y’hudah.
M'lakhim Bet,8,17,"He was thirty-two years old when he began to rule, and he ruled eight years in Yerushalayim."
M'lakhim Bet,8,18,"He lived after the example of the kings of Isra’el, as did the house of Ach’av; because he had married Ach’av’s daughter; he did what was evil from ADONAI’s perspective."
M'lakhim Bet,8,19,"However, ADONAI was unwilling to destroy Y’hudah, because of his servant David; inasmuch as he had promised to give him and his children a lamp that would burn forever."
M'lakhim Bet,8,20,During his time Edom revolted against Y’hudah and set up its own king.
M'lakhim Bet,8,21,"In response, Yoram crossed to Tza‘ir with all his chariots. At night he and his chariot commanders set out and attacked Edom who had surrounded him; then the people fled to their tents."
M'lakhim Bet,8,22,"Nevertheless, since that day Edom has remained free of Y’hudah’s domination. Livnah revolted at the same time."
M'lakhim Bet,8,23,Other activities of Yoram and all his accomplishments are recorded in the Annals of the Kings of Y’hudah.
M'lakhim Bet,8,24,"Yoram slept with his ancestors and was buried with his ancestors in the City of David, and Achazyah his son took his place as king."
M'lakhim Bet,8,25,It was in the twelfth year of Yoram the son of Ach’av king of Isra’el that Achazyah the son of Y’horam king of Y’hudah began his reign.
M'lakhim Bet,8,26,"Achazyah was twenty-two years old when he began to rule, and he ruled for one year in Yerushalayim. His mother’s name was ‘Atalyahu the daughter of ‘Omri king of Isra’el."
M'lakhim Bet,8,27,"He lived after the example of the house of Ach’av; he did what was evil from ADONAI’s perspective, as had the house of Ach’av; for he was a son-in-law in the house of Ach’av."
M'lakhim Bet,8,28,"With Yoram the son of Ach’av he went to war against Haza’el king of Aram at Ramot-Gil‘ad, and the Aramim wounded Yoram."
M'lakhim Bet,8,29,"King Yoram returned to Yizre‘el to be healed of the wounds which the Aramim had inflicted on him at Ramah while fighting Haza’el king of Aram. Achazyah the son of Y’horam, king of Y’hudah, went down to visit Yoram the son of Ach’av in Yizre‘el, because he was not feeling well."
M'lakhim Bet,9,1,"Elisha the prophet summoned one of the guild prophets and said to him, “Prepare for traveling, take this flask of oil in your hand and go to Ramot-Gil‘ad."
M'lakhim Bet,9,2,"When you get there, look for Yehu the son of Y’hoshafat, the son of Nimshi. Enter, have him step away from his companions, and take him to an inside room."
M'lakhim Bet,9,3,"Then take the flask of oil, pour it on his head, and say, ‘This is what ADONAI says: “I have anointed you king over Isra’el.”’ After that, open the door; and get away from there as fast as you can.”"
M'lakhim Bet,9,4,So the young prophet left for Ramot-Gil‘ad.
M'lakhim Bet,9,5,"When he arrived, he found the senior army officers sitting there. He said, “I have a message for you, commander.” Yehu asked, “For which one of us?” “For you, commander,” he said."
M'lakhim Bet,9,6,"Yehu got up and went into the house. Then the prophet poured the oil on his head and said to him, “This is what ADONAI the God of Isra’el says: ‘I have anointed you king over the people of ADONAI, over Isra’el."
M'lakhim Bet,9,7,"You will attack the house of Ach’av your master, so that I can avenge the blood of my servants the prophets and of all the servants of ADONAI, blood shed by Izevel."
M'lakhim Bet,9,8,"The entire house of Ach’av will perish; I will cut off from Ach’av every male, whether a slave or free in Isra’el."
M'lakhim Bet,9,9,I will make the house of Ach’av like the house of Yarov‘am the son of N’vat and like the house of Ba‘sha the son of Achiyah.
M'lakhim Bet,9,10,"Moreover, the dogs will eat Izevel in the dumping-ground of Yizre‘el, and there will be no one to bury her.’” Then he opened the door and fled."
M'lakhim Bet,9,11,"Yehu returned to the servants of his lord, and one of them said to him, “Is everything all right? Why did this meshugga come to you?” He answered them, “You know the kind and how they babble.”"
M'lakhim Bet,9,12,"They said, “You’re being evasive. Come on, tell us the truth.” Then he said, “This is exactly what he said to me and how he said it: ‘Here is what ADONAI says: “I have anointed you king over Isra’el.”’”"
M'lakhim Bet,9,13,"At this, they hurried each one to take his cloak and put it under Yehu at the top of the stairs. Then they blew the shofar and proclaimed, “Yehu is king!”"
M'lakhim Bet,9,14,"Yehu the son of Y’hoshafat, the son of Nimshi, formed a conspiracy against Yoram. (At the time, Yoram was guarding Ramot-Gil‘ad, he and all Isra’el, because of Haza’el king of Aram"
M'lakhim Bet,9,15,"but Yoram himself had returned to Yizre‘el to recover from the wounds Aram had inflicted on him when fighting Haza’el king of Aram.) “If you agree,” said Yehu, “then don’t allow anyone to leave town and take the news to Yizre‘el.”"
M'lakhim Bet,9,16,"So Yehu, riding in a chariot, went to Yizre‘el, for Yoram was laid up there. Achazyah king of Y’hudah had come down to visit Yoram."
M'lakhim Bet,9,17,"The lookout standing on the watchtower in Yizre‘el saw Yehu’s troops approaching and said, “I see some troops coming.” Yoram said, “Have a horseman go to meet him and ask, “Are you coming in peace?”"
M'lakhim Bet,9,18,"So a man on horseback went to meet him and said, “The king asks if you are coming in peace.” Yehu answered, “Peace? What business is that of yours? Turn around, and get behind me!” The watchman reported, “The messenger reached them, but he isn’t coming back.”"
M'lakhim Bet,9,19,"So he sent out a second man on horseback, who, on coming to him, said, “The king asks if you are coming in peace.” Yehu answered, “Peace? What business is that of yours? Turn around, and get behind me!”"
M'lakhim Bet,9,20,"The watchman reported, “He reached them, but he isn’t coming back. Also, it looks like the driving of Yehu Nimshi’s [grand]son — he’s driving like a maniac!”"
M'lakhim Bet,9,21,"“Harness my chariot!” ordered Yoram. They got it ready. Then Yoram king of Isra’el and Achazyah king of Y’hudah, each in his chariot, went out to meet Yehu. They met him in the field of Navot the Yizre‘eli."
M'lakhim Bet,9,22,"When Yoram saw Yehu he said, “Are you coming in peace, Yehu?” He answered, “Peace? With your mother Izevel continuing all her cult prostitution and witchcraft? What a question!”"
M'lakhim Bet,9,23,"Yoram wheeled around and fled, shouting, “Treachery, Achazyah!”"
M'lakhim Bet,9,24,"Yehu drew his bow with all his strength and struck Yoram between the shoulder-blades; the arrow went through his heart, and he collapsed in his chariot."
M'lakhim Bet,9,25,"“Pick him up,” said Yehu to Bidkar his servant, “and throw him into the field of Navot the Yizre‘eli; for remember how, when you and I were riding together after Ach’av his father, ADONAI pronounced this sentence against him"
M'lakhim Bet,9,26,"‘ADONAI says: “Yesterday I saw the blood of Navot and the blood of his sons.” ADONAI also says: “I will pay you back in this field.”’ Therefore, pick him up; and throw him into the field, in keeping with what ADONAI said.”"
M'lakhim Bet,9,27,"But when Achazyah the king of Y’hudah saw this, he fled on the road past Beit-HaGan. Yehu pursued him and ordered, “Strike him too in his chariot!” [So they struck him] at the Gur ascent, near Yivle‘am. He fled to Megiddo, but there he died."
M'lakhim Bet,9,28,His servants carried him in a chariot to Yerushalayim and buried him in his tomb with his ancestors in the City of David.
M'lakhim Bet,9,29,It was in the eleventh year of Yoram the son of Ach’av that Achazyah had begun his rule over Y’hudah.
M'lakhim Bet,9,30,"When Yehu reached Yizre‘el, and Izevel heard of it, she put on eye make-up, fixed her hair and looked out the window."
M'lakhim Bet,9,31,"As Yehu came through the city gate, she asked, “Are you here in peace, you Zimri, you murderer of your master?”"
M'lakhim Bet,9,32,"Looking up at the window he said, “Who is on my side? Who?” Two or three officers looked out toward him."
M'lakhim Bet,9,33,"He said, “Throw her down!” So they threw her down. Some of her blood splashed onto the wall and the horses, and she was trampled underfoot."
M'lakhim Bet,9,34,"He went in, ate and drank, and then said, “Deal with this accursed woman — bury her, because she’s a king’s daughter.”"
M'lakhim Bet,9,35,"They went to bury her but found no more of her than her skull, feet and hands."
M'lakhim Bet,9,36,"So they came back and told him. He said, “This is what ADONAI said through his servant Eliyahu from Tishbe: ‘In the field of Yizre‘el the dogs will eat the flesh of Izevel"
M'lakhim Bet,9,37,"Izevel’s corpse in the field of Yizre‘el will be like dung on the ground, unrecognizable as Izevel.’”"
M'lakhim Bet,10,1,"There were seventy descendants of Ach’av in Shomron. Yehu wrote letters and sent them to Shomron to the rulers of Yizre‘el, to the leaders, and to the guardians of Ach’av’s sons. The letters said"
M'lakhim Bet,10,2,"“You have with you your master’s sons, also chariots and horses, as well as fortified cities and armor. So, as soon as this letter reaches you"
M'lakhim Bet,10,3,"choose the best and most suitable of your master’s sons, set him on his father’s throne and fight for your master’s dynasty.”"
M'lakhim Bet,10,4,"They were panic-stricken and said, “If the other two kings couldn’t withstand him, how will we?”"
M'lakhim Bet,10,5,"So the administrator of the palace, the governor of the city, the leaders and the children’s guardians sent this message to Yehu: “We are your servants. We will do everything you ask us to; we won’t appoint anyone king. Do as you see fit.”"
M'lakhim Bet,10,6,"He wrote a second letter to them, which said, “If you are on my side, and if you are ready to obey my orders, then bring the heads of your master’s sons to me in Yizre‘el by this time tomorrow.” Now the seventy sons of the king were with the prominent men who had raised them."
M'lakhim Bet,10,7,"When the letter reached them, they seized the king’s sons and killed them, all seventy of them, put their heads in baskets and sent them to Yehu in Yizre‘el."
M'lakhim Bet,10,8,"A messenger came and told him, “They have brought the heads of the king’s sons.” He said, “Leave them in two piles at the entrance of the city gate until morning.”"
M'lakhim Bet,10,9,"When morning came, he went out, stood before the people and said, “You are not responsible [for the deaths of these men]. Yes, I conspired against my master and killed him. But who killed all these?"
M'lakhim Bet,10,10,"Understand, then, that no part of ADONAI’s word which ADONAI spoke concerning the dynasty of Ach’av falls to the ground; because ADONAI has done what he said through his servant Eliyahu.”"
M'lakhim Bet,10,11,"So Yehu killed everyone who remained from the house of Ach’av in Yizre‘el, all his leading men, his close friends and his cohanim, until not one of them was left alive."
M'lakhim Bet,10,12,"Then he set out and went to Shomron.
On the way he reached a shearing shed for shepherds"
M'lakhim Bet,10,13,"where he encountered relatives of Achazyah king of Y’hudah. “Who are you?” he asked. “We’re relatives of Achazyah,” they answered, “and we’re going down to pay our respects to the families of the king and of the queen mother.”"
M'lakhim Bet,10,14,"“Take them alive,” said Yehu. They took them alive, forty-two men, slaughtered them and threw them into the shearing shed’s pit; he spared not one of them."
M'lakhim Bet,10,15,"On leaving there, he happened upon Y’honadav the son of Rekhav coming toward him. He greeted him and said to him, “Are you wholeheartedly with me, as I am with you?” “Yes,” answered Y’honadav. “If so, give me your hand.” He gave him his hand, and Yehu took him up into the chariot."
M'lakhim Bet,10,16,"He said, “Come with me, and see how zealous I am for ADONAI.” So they had him ride in his chariot."
