M'lakhim Bet,10,17,"On arriving in Shomron he put to death everyone that Ach’av still had in Shomron, until he had destroyed him, in keeping with the word of ADONAI which he had spoken to Eliyahu."
M'lakhim Bet,10,18,"Next, Yehu assembled all the people and said to them, “Ach’av served Ba‘al in limited measure, but Yehu will serve him with full zeal."
M'lakhim Bet,10,19,"Therefore summon all the prophets of Ba‘al to me, all his worshippers and all his priests. None of them is to be missing, because I am going to offer a great sacrifice to Ba‘al; whoever is missing will not remain alive.” But Yehu was setting a trap, in order to destroy the worshippers of Ba‘al."
M'lakhim Bet,10,20,"Yehu said, “Proclaim a solemn assembly for Ba‘al,” and they did so."
M'lakhim Bet,10,21,"Yehu sent throughout all Isra’el, and all the worshippers of Ba‘al came, so that there was not one man left that didn’t come. They entered the temple of Ba‘al, and the temple of Ba‘al was filled from one end to the other."
M'lakhim Bet,10,22,"To the man in charge of the wardrobe he said, “Bring out robes for all the worshippers of Ba‘al”; and he brought them clothes."
M'lakhim Bet,10,23,"Yehu and Y’honadav the son of Rekhav entered the house of Ba‘al and said to the worshippers of Ba‘al, “Search to see that none of the servants of ADONAI is here with you, only worshippers of Ba‘al.”"
M'lakhim Bet,10,24,"Then they went in to offer sacrifices and burnt offerings.
But Yehu had chosen eighty men to remain outside. He said, “If any of the men I am about to put in your hands escapes, it will be your life for his.”"
M'lakhim Bet,10,25,"As soon as he had finished offering the burnt offering, Yehu said to the guards and officers, “Go in, and kill them; don’t let one of them get out.” So they killed them with the sword; then, after the guards and officers had thrown their bodies outside, they went into the temple of Ba‘al’s inner shrine"
M'lakhim Bet,10,26,brought out the pillars in the temple of Ba‘al and burned them.
M'lakhim Bet,10,27,"Finally, they broke down Ba‘al’s standing-stone and demolished the temple of Ba‘al, converting it into a latrine, which it still is today."
M'lakhim Bet,10,28,Thus Yehu rid Isra’el of Ba‘al.
M'lakhim Bet,10,29,"However, Yehu did not turn away from the sins of Yarov‘am the son of N’vat, with which he had led Isra’el into sin, the gold calves that were in Beit-El and Dan."
M'lakhim Bet,10,30,"ADONAI said to Yehu, “Because you did well in accomplishing what is right from my perspective, and have done to the house of Ach’av everything that was in my heart, your descendants down to the fourth generation will sit on the throne of Isra’el.”"
M'lakhim Bet,10,31,"But Yehu made no effort to live wholeheartedly according to the Torah of ADONAI the God of Isra’el and did not turn away from the sins of Yarov‘am, with which he had led Isra’el into sin."
M'lakhim Bet,10,32,It was during that period that ADONAI began to dismember Isra’el. Haza’el attacked them throughout the territory of Isra’el
M'lakhim Bet,10,33,"east of the Yarden — all the land of Gil‘ad, the Gadi, Re’uveni and M’nashi, from ‘Aro‘er by the Arnon River, including Gil‘ad and Bashan."
M'lakhim Bet,10,34,"Other activities of Yehu, all his accomplishments and all his power are recorded in the Annals of the Kings of Isra’el."
M'lakhim Bet,10,35,"Yehu slept with his ancestors, and they buried him in Shomron. Then Y’ho’achaz his son became king in his place."
M'lakhim Bet,10,36,Yehu ruled over Isra’el in Shomron for twenty-eight years.
M'lakhim Bet,11,1,"When ‘Atalyah the mother of Achazyah saw that her son was dead, she set about destroying the entire royal family."
M'lakhim Bet,11,2,"But Y’hosheva the daughter of King Yoram, sister of Achazyah, took Yo’ash the son of Achazyah and stole him away from among the princes who were being slaughtered. She took him and his nurse, sequestered them in a bedroom, and hid them from ‘Atalyah, so that he was not killed."
M'lakhim Bet,11,3,He remained hidden with his nurse in the house of ADONAI for six years; during this time ‘Atalyah ruled the land.
M'lakhim Bet,11,4,"In the seventh year Y’hoyada summoned the captains of hundred-man platoons, of both the Kari and the guard. He brought them into the house of ADONAI, made an agreement with them and had them swear to it in the house of ADONAI. Then he showed them the king’s son"
M'lakhim Bet,11,5,"and gave them this instruction: “Here is what you are to do: of you who come on duty on Shabbat, a third [normally] guards the royal palace"
M'lakhim Bet,11,6,a third is at the Sur Gate and a third is at the gate behind the guards. [The first third] is to continue guarding the palace and serve as a barrier
M'lakhim Bet,11,7,"while the other two groups of you who come on duty on Shabbat will guard the house of ADONAI, where the king is."
M'lakhim Bet,11,8,"You are to surround the king, each man with his weapons in his hand. Anyone who penetrates the ranks is to be killed. Stay with the king whenever he leaves or enters.”"
M'lakhim Bet,11,9,"The captains over hundreds did exactly as Y’hoyada the cohen ordered. Each took his men, those coming on duty on Shabbat and those going off duty on Shabbat, and came to Y’hoyada the cohen."
M'lakhim Bet,11,10,The cohen issued to the captains of hundreds the spears and shields that had been King David’s and were kept in the house of ADONAI.
M'lakhim Bet,11,11,"The guards then took positions, each man with his weapons in his hand, from the right side of the house to the left side of the house, alongside the altar, alongside [the exterior of] the house and around the king."
M'lakhim Bet,11,12,"Then he brought out the king’s son, crowned him, gave him [a copy of] the testimony and thus made him king; they anointed him, clapped their hands and shouted, “Long live the king!”"
M'lakhim Bet,11,13,"When ‘Atalyah heard the shouting of the guard and the people, she entered the house of ADONAI where the people were"
M'lakhim Bet,11,14,"looked and saw the king standing there on the platform, in keeping with the rule, with the leaders and trumpeters next to the king. All the people of the land were celebrating and blowing the trumpets. At this ‘Atalyah tore her clothes and cried, “Treason! Treason!”"
M'lakhim Bet,11,15,"Y’hoyada the cohen ordered the captains of hundreds, the army officers, “Escort her out past the ranks [of guards]; but anyone who follows her, kill with the sword.” For the cohen had said, “She must not be put to death in the house of ADONAI.”"
M'lakhim Bet,11,16,"So they took her by force and led her through the horses’ entry to the royal palace, and there she was put to death."
M'lakhim Bet,11,17,"Y’hoyada made a covenant between ADONAI, the king and the people, that they would be ADONAI’s people, and [a covenant] between the king and the people."
M'lakhim Bet,11,18,"Then all the people of the land went to the house of Ba‘al and broke it down; they completely smashed its altars and images and killed Mattan the priest of Ba‘al in front of the altars.
Next, the cohen appointed officers over the house of ADONAI."
M'lakhim Bet,11,19,"He took the captains of hundreds, the Kari, the guards and all the people of the land; and they brought the king down from the house of ADONAI, going by way of the gate of the guards to the royal palace. There he sat on the throne of the kings."
M'lakhim Bet,11,20,"All the people of the land celebrated, and at last the city was quiet. That is how they killed ‘Atalyah with the sword at the royal palace."
M'lakhim Bet,12,1,Y’ho’ash was seven years old when he began his reign.
M'lakhim Bet,12,2,"It was in the seventh year of Yehu that Y’ho’ash began to rule, and he ruled forty years in Yerushalayim. His mother’s name was Tzivyah, from Be’er-Sheva."
M'lakhim Bet,12,3,"Y’ho’ash did what was right from ADONAI’s perspective throughout the lifetime of Y’hoyada the cohen, who instructed him."
M'lakhim Bet,12,4,Nevertheless the high places were not taken away; the people still sacrificed and presented offerings on the high places.
M'lakhim Bet,12,5,"Y’ho’ash said to the cohanim, “All the funds for sacred purposes which are brought to the house of ADONAI — the half-shekel tax, the taxes on persons in a man’s household, and all the offerings anyone voluntarily brings to the house of ADONAI "
M'lakhim Bet,12,6,"the cohanim are to receive from whoever personally makes contributions to them; and they are to use these funds to repair the damaged parts of the house, wherever damage is found."
M'lakhim Bet,12,7,"But twenty-three years into the reign of King Y’ho’ash, the cohanim had still not repaired the damaged places in the house."
M'lakhim Bet,12,8,"So King Y’ho’ash summoned Y’hoyada the cohen and the other cohanim and said to them, “Why aren’t you repairing the damaged places in the house? Therefore, you are no longer to take money from those who contribute it personally to you; you must hand it over to be used for repairing the damage in the house.”"
M'lakhim Bet,12,9,"The cohanim agreed not to receive money from the people, and they would no longer be responsible for repairing the damage to the house."
M'lakhim Bet,12,10,"Then Y’hoyada the cohen took a chest, drilled a hole in its lid and set it by the altar, on the right, as one enters the house of ADONAI; and the cohanim in charge of the entry put in it all the money brought into the house of ADONAI."
M'lakhim Bet,12,11,"When they saw that there was a large amount of money in the chest, the king’s secretary and the cohen hagadol would come up, count the money found in the house of ADONAI and put it in bags."
M'lakhim Bet,12,12,"Then they would give the weighed-out money to those supervising the work in the house of ADONAI, who would use it to pay the carpenters and construction-workers doing the work in the house of ADONAI"
M'lakhim Bet,12,13,"on masons, stone-workers, timber, worked stone and everything else needed for repairing the damaged places in the house of ADONAI."
M'lakhim Bet,12,14,"But none of the money brought into the house of ADONAI was used to make silver cups, snuffers, bowls, trumpets or other articles of gold or silver for the house of ADONAI"
M'lakhim Bet,12,15,"because they gave the money to those doing the work, thus restricting its use to repairing the damage in the house of ADONAI."
M'lakhim Bet,12,16,"Moreover, they did not require an accounting from the supervisors given the money to pay the workers, because they dealt honestly."
M'lakhim Bet,12,17,"Money from guilt offerings and sin offerings, however, was not brought into the house of ADONAI; it went to the cohanim."
M'lakhim Bet,12,18,"Haza’el king of Aram went up and fought against Gat; and after capturing it, Haza’el made his decision to attack Yerushalayim."
M'lakhim Bet,12,19,"Y’ho’ash king of Y’hudah took all the consecrated articles that Y’hoshafat, Y’horam and Achazyah, his ancestors, kings of Y’hudah, had dedicated, as well as his own consecrated articles and all the gold found in the treasuries of the house of ADONAI and of the royal palace, and sent them to Haza’el king of Aram, who then withdrew from Yerushalayim."
M'lakhim Bet,12,20,Other activities of Yo’ash and all his accomplishments are recorded in the Annals of the Kings of Y’hudah.
M'lakhim Bet,12,21,"Then his servants got together, formed a conspiracy and murdered Yo’ash at Beit-Millo on the way down to Sila."
M'lakhim Bet,12,22,"His servants Yozakhar the son of Shim‘at and Y’hozavad the son of Shomer struck him, so that he died. They buried him with his ancestors in the City of David, and Amatzyah his son took his place as king."
M'lakhim Bet,13,1,"It was in the twenty-third year of Yo’ash the son of Achazyah, king of Y’hudah, that Y’ho’achaz the son of Yehu began his reign over Isra’el in Shomron; he ruled for seventeen years."
M'lakhim Bet,13,2,"He did what was evil from ADONAI’s perspective; he followed the sins of Yarov‘am the son of N’vat, who made Isra’el sin; and he never ceased committing those sins."
M'lakhim Bet,13,3,"ADONAI’s anger burned against Isra’el, and he kept handing them over to Haza’el king of Aram and Ben-Hadad the son of Haza’el."
M'lakhim Bet,13,4,"But Y’ho’achaz pleaded to ADONAI, and ADONAI listened to him, because he saw the oppression the king of Aram was inflicting on Isra’el."
M'lakhim Bet,13,5,"So ADONAI gave Isra’el a savior who freed them from the grip of Aram, so that the people of Isra’el could live in their tents, as they had before."
M'lakhim Bet,13,6,"Despite that, instead of turning from the sins of the house of Yarov‘am, who made Isra’el sin, they continued to live in this sinful way. Moreover, the asherah continued to stand in Shomron."
M'lakhim Bet,13,7,"The king of Aram destroyed Y’ho’achaz’s army, making them like chaff when grain is threshed, except for fifty horsemen, ten chariots and 10,000 foot soldiers."
M'lakhim Bet,13,8,"Other activities of Y’ho’achaz, all his accomplishments and his power are recorded in the Annals of the Kings of Isra’el."
M'lakhim Bet,13,9,"Y’ho’achaz slept with his ancestors, and they buried him in Shomron. Then Yo’ash his son took his place as king."
M'lakhim Bet,13,10,It was in the thirty-seventh year of Yo’ash king of Y’hudah that Yo’ash the son of Y’ho’achaz began his rule over Isra’el in Shomron; he ruled for sixteen years.
M'lakhim Bet,13,11,"He did what was evil from ADONAI’s perspective and did not turn from all the sins of Yarov‘am the son of N’vat, who made Isra’el sin; on the contrary, he lived in this sinful way."
M'lakhim Bet,13,12,"Other activities of Yo’ash, all his accomplishments and his power in fighting Amatzyah king of Y’hudah are recorded in the Annals of the Kings of Isra’el."
M'lakhim Bet,13,13,"Yo’ash slept with his ancestors, and Yarov‘am occupied his throne. Yo’ash was buried in Shomron with the kings of Isra’el."
M'lakhim Bet,13,14,"Elisha was now ill with the disease from which he would eventually die. Yo’ash the king of Isra’el came down to visit him and wept over him; he said, “My father! My father! The chariots and horsemen of Isra’el!”"
M'lakhim Bet,13,15,"Elisha said to him, “Bring a bow and arrows”; and he brought him a bow and arrows."
M'lakhim Bet,13,16,"He said to the king of Isra’el, “Put your hand on the bow”; and he put his hand on it. Then Elisha laid his hands on the king’s hands"
M'lakhim Bet,13,17,"and said, “Open the east window.” He opened it. Elisha said, “Shoot”; and he shot. He said, “ADONAI’s arrow of victory, the arrow of victory against Aram! You will defeat Aram completely at Afek!”"
M'lakhim Bet,13,18,"He said, “Take the arrows”; and he took them. He told the king of Isra’el, “Strike the ground.” He struck three times, then stopped."
M'lakhim Bet,13,19,"The man of God became angry with him; he said, “You should have struck five or six times; then you would have defeated Aram completely. As it is, you will defeat Aram only three times.”"
M'lakhim Bet,13,20,"Elisha died, and they placed him in a burial cave. Now the raiding parties of Mo’av used to make yearly incursions into the land at the start of the year."
M'lakhim Bet,13,21,"Once it happened that just as they were burying a man, they spotted a raiding party; so they threw the man’s body into Elisha’s burial cave; and the moment the man touched the bones of Elisha, he revived and stood on his feet."
M'lakhim Bet,13,22,Haza’el king of Aram oppressed Isra’el throughout the lifetime of Y’ho’achaz
M'lakhim Bet,13,23,"but ADONAI was gracious, took pity on them and looked on them with favor, because of his covenant with Avraham, Yitz’chak and Ya‘akov. He was not willing to destroy them, and to this day he has not banished them from his presence."
M'lakhim Bet,13,24,"Haza’el king of Aram died, and Ben-Hadad his son took his place as king."
M'lakhim Bet,13,25,"Then Y’ho’ash the son of Y’ho’achaz captured from Ben-Hadad the son of Haza’el the cities which he had captured in war from Y’ho’achaz his father. Three times Yo’ash defeated him, thus recovering the cities of Isra’el."
M'lakhim Bet,14,1,It was in the second year of Yo’ash son of Y’ho’achaz king of Isra’el that Amatzyah the son of Yo’ash king of Y’hudah began his reign.
M'lakhim Bet,14,2,"He was twenty-five years old when he began to rule, and he ruled for twenty-nine years in Yerushalayim. His mother’s name was Y’ho‘adan, from Yerushalayim."
M'lakhim Bet,14,3,"He did what was right from ADONAI’s perspective, although not like David his ancestor; he lived the same way as his father Yo’ash."
M'lakhim Bet,14,4,"However, the high places were not removed; the people still sacrificed and offered on the high places."
M'lakhim Bet,14,5,"As soon as he had the kingdom firmly under his control, he put to death the servants of his who had murdered the king his father."
M'lakhim Bet,14,6,"But he did not put the children of the murderers to death, because of what is written in the scroll of the Torah of Moshe, as ADONAI ordered when he said, “Fathers are not to be executed for the children, nor are children to be executed for the fathers; every person will be executed for his own sin.”"
M'lakhim Bet,14,7,"He slaughtered 10,000 men of Edom in the Salt Valley and captured Sela in the war, renaming it Yokte’el, as it is today."
M'lakhim Bet,14,8,"Then Amatzyah sent messengers to Y’ho’ash the son of Y’ho’achaz, son of Yehu, king of Isra’el, with this challenge: “Come on, let’s have it out face-to-face.”"
M'lakhim Bet,14,9,"Y’ho’ash the king of Isra’el sent this reply to Amatzyah king of Y’hudah: “Once, in the L’vanon, the thistle sent a message to the cedar: ‘Give your daughter to my son in marriage.’ But a wild animal passed by the thistle and squashed it."
M'lakhim Bet,14,10,"True, you have defeated Edom, and now you’re ambitious. So enjoy the glory, but stay home! Why provoke calamity, to your own ruin, yours and Y’hudah’s too?”"
M'lakhim Bet,14,11,"But Amatzyah wouldn’t listen. So Y’ho’ash king of Isra’el went up; and he and Amatzyah king of Y’hudah had it out face-to-face at Beit-Shemesh, which belongs to Y’hudah."
M'lakhim Bet,14,12,"Y’hudah was defeated by Isra’el, and every man fled to his tent."
M'lakhim Bet,14,13,"Y’ho’ash king of Isra’el took Amatzyah king of Y’hudah, the son of Y’ho’ash the son of Achazyah, prisoner at Beit-Shemesh. Then he went to Yerushalayim and demolished the wall of Yerushalayim between the Gate of Efrayim and the Corner Gate, a section 600 feet long."
M'lakhim Bet,14,14,"He took all the gold and silver, all the articles he could find in the house of ADONAI and in the treasuries of the royal palace, and hostages; then he returned to Shomron."
M'lakhim Bet,14,15,"Other activities of Y’ho’ash that he did, his power and how he fought Amatzyah king of Y’hudah are recorded in the Annals of the Kings of Isra’el."
M'lakhim Bet,14,16,Y’ho’ash slept with his ancestors and was buried in Shomron with the kings of Isra’el. Then Yarov‘am took his place as king.
M'lakhim Bet,14,17,"Amatzyah the son of Yo’ash king of Y’hudah lived another fifteen years after the death of Y’ho’ash son of Y’ho’achaz, king of Isra’el."
M'lakhim Bet,14,18,Other activities of Amatzyah are recorded in the Annals of the Kings of Y’hudah.
M'lakhim Bet,14,19,"Because of a conspiracy formed against him in Yerushalayim, Amatzyah fled to Lakhish; but they followed him to Lakhish and killed him there."
M'lakhim Bet,14,20,"They brought his body back on horses, and he was buried in Yerushalayim with his ancestors in the City of David."
M'lakhim Bet,14,21,Then all the people of Y’hudah took ‘Azaryah at the age of sixteen and made him king in place of his father Amatzyah.
M'lakhim Bet,14,22,‘Azaryah recovered Eilat for Y’hudah and rebuilt it; after that the king [Amatzyahu] slept with his ancestors.
M'lakhim Bet,14,23,"It was in the fifteenth year of Amatzyah the son of Yo’ash, king of Y’hudah, that Yarov‘am the son of Yo’ash, king of Isra’el, began to reign in Shomron; and he ruled for forty-one years."
M'lakhim Bet,14,24,"He did what was evil from ADONAI’s perspective; he did not turn from all the sins of Yarov‘am the son of N’vat, who made Isra’el sin."
M'lakhim Bet,14,25,"He recovered the territory of Isra’el between the entrance of Hamat and the sea of the ‘Aravah, in keeping with the word of ADONAI the God of Isra’el, which he spoke through his servant Yonah the son of Amitai, the prophet from Gat-Hefer."
M'lakhim Bet,14,26,"For ADONAI saw how bitterly Isra’el had suffered, with no one left, either slave or free, and no one coming to Isra’el’s aid."
M'lakhim Bet,14,27,"ADONAI did not threaten to blot out the name of Isra’el from under heaven, but saved them through Yarov‘am the son of Yo’ash."
M'lakhim Bet,14,28,"Other activities of Yarov‘am, all his accomplishments, all his power, how he conducted war and how he recovered Dammesek and Hamat for Y’hudah in Isra’el are recorded in the Annals of the Kings of Isra’el."
M'lakhim Bet,14,29,"Yarov‘am slept with his ancestors the kings of Isra’el, and Z’kharyah took his place as king."
M'lakhim Bet,15,1,"It was in the twenty-seventh year of Yarov‘am king of Isra’el that ‘Azaryah the son of Amatzyah, king of Y’hudah, began his reign."
M'lakhim Bet,15,2,"He was sixteen years old when he began to rule, and he ruled for fifty-two years in Yerushalayim. His mother’s name was Y’kholyahu, from Yerushalayim."
M'lakhim Bet,15,3,"He did what was right from ADONAI’s perspective, following the example of everything his father Amatzyah had done."
M'lakhim Bet,15,4,"However, the high places were not taken away; the people still sacrificed and offered on the high places."
M'lakhim Bet,15,5,"ADONAI struck the king, so that he had tzara‘at until his dying day, so that he lived in a separate house, while Yotam the king’s son ran the king’s household and was regent over the people of the land."
M'lakhim Bet,15,6,Other activities of ‘Azaryah and all his accomplishments are recorded in the Annals of the Kings of Y’hudah.
M'lakhim Bet,15,7,"So ‘Azaryah slept with his ancestors the kings of Isra’el, and they buried him with his ancestors in the City of David. Then Yotam his son took his place as king."
M'lakhim Bet,15,8,It was in the thirty-eighth year of ‘Azaryah king of Y’hudah that Z’kharyah the son of Yarov‘am began his reign over Isra’el in Shomron; he ruled for six months.
M'lakhim Bet,15,9,"He did what was evil from ADONAI’s perspective, just as his ancestors had done; he did not turn from all the sins of Yarov‘am the son of N’vat, who made Isra’el sin."
M'lakhim Bet,15,10,Shalum the son of Yavesh formed a conspiracy against him. He struck him in the presence of the people and killed him; then he took his place as king.
M'lakhim Bet,15,11,Other activities of Z’kharyah are recorded in the Annals of the Kings of Isra’el.
M'lakhim Bet,15,12,"The word of ADONAI which he had spoken to Yehu was, “Your descendants down to the fourth generation will sit on the throne of Isra’el”; and that is exactly what happened."
M'lakhim Bet,15,13,Shalum the son of Yavesh began his reign in the thirty-ninth year of ‘Uziyah king of Y’hudah; he ruled in Shomron for only a month.
M'lakhim Bet,15,14,"Menachem the son of Gadi went up from Tirtzah, came to Shomron, struck Shalum the son of Yavesh in Shomron and killed him. Then he took his place as king."
M'lakhim Bet,15,15,Other activities of Shalum and the conspiracy he formed are recorded in the Annals of the Kings of Isra’el
M'lakhim Bet,15,16,"From Tirtzah Menachem attacked Tifsach, all the people in it and its territory, because they had not opened their gates to him. So he sacked the city and ripped apart all its pregnant women."
M'lakhim Bet,15,17,It was in the thirty-ninth year of ‘Azaryah king of Y’hudah that Menachem the son of Gadi began his reign over Isra’el; he ruled ten years in Shomron.
M'lakhim Bet,15,18,"He did what was evil from ADONAI’s perspective; throughout his life he did not turn from the sins of Yarov‘am the son of N’vat, who made Isra’el sin."
M'lakhim Bet,15,19,"Pul the king of Ashur invaded the land. Menachem gave Pul thirty-three tons of silver, so that he would confirm Menachem’s hold on the kingdom."
M'lakhim Bet,15,20,He did this by taxing the wealthy men in Isra’el; from each he required one-and-a-quarter pounds of silver to give to the king of Ashur. Then the king of Ashur turned around and left the land.
M'lakhim Bet,15,21,Other activities of Menachem and all his accomplishments are recorded in the Annals of the Kings of Isra’el.
M'lakhim Bet,15,22,"Menachem slept with his ancestors, and P’kachyah his son took his place as king."
M'lakhim Bet,15,23,It was in the fiftieth year of ‘Azaryah king of Y’hudah that P’kachyah the son of Menachem began his reign over Isra’el in Shomron; he ruled for two years.
M'lakhim Bet,15,24,"He did what was evil from ADONAI’s perspective; he did not turn from the sins of Yarov‘am the son of N’vat, who made Isra’el sin."
M'lakhim Bet,15,25,"Pekach the son of Remalyahu, one of his commanders, conspired against him. With Argov, Aryeh and fifty men from Gil‘ad, he assassinated him in the palace stronghold in Shomron. After killing him, he took his place as king."
M'lakhim Bet,15,26,Other activities of P’kachyah and all his accomplishments are recorded in the Annals of the Kings of Isra’el.
