Matthew,23,8,"“But you shouldn’t be called ‘Rabbi.’ You have only one Teacher, and you are all brothers."
Matthew,23,9,"Do not call anyone on earth ‘father.’ You have one Father, and he is in heaven."
Matthew,23,10,"You shouldn’t be called ‘teacher.’ You have one Teacher, and he is the Messiah."
Matthew,23,11,The most important person among you will be your servant.
Matthew,23,12,People who lift themselves up will be made humble. And people who make themselves humble will be lifted up.
Matthew,24,1,Jesus left the temple. He was walking away when his disciples came up to him. They wanted to call his attention to the temple buildings.
Matthew,24,2,“Do you see all these things?” Jesus asked. “What I’m about to tell you is true. Not one stone here will be left on top of another. Every stone will be thrown down.”
Matthew,24,3,"Jesus was sitting on the Mount of Olives. There the disciples came to him in private. “Tell us,” they said. “When will this happen? And what will be the sign of your coming? What will be the sign of the end?”"
Matthew,24,4,"Jesus answered, “Keep watch! Be careful that no one fools you."
Matthew,24,5,"Many will come in my name. They will claim, ‘I am the Messiah!’ They will fool many people."
Matthew,24,6,You will hear about wars. You will also hear people talking about future wars. Don’t be alarmed. Those things must happen. But the end still isn’t here.
Matthew,24,7,Nation will fight against nation. Kingdom will fight against kingdom. People will go hungry. There will be earthquakes in many places.
Matthew,24,8,All these are the beginning of birth pains.
Matthew,24,9,“Then people will hand you over to be treated badly and killed. All nations will hate you because of me.
Matthew,24,10,"At that time, many will turn away from their faith. They will hate each other. They will hand each other over to their enemies."
Matthew,24,11,Many false prophets will appear. They will fool many people.
Matthew,24,12,"Because evil will grow, most people’s love will grow cold."
Matthew,24,13,But the one who remains strong in the faith will be saved.
Matthew,24,14,This good news of the kingdom will be preached in the whole world. It will be a witness to all nations. Then the end will come.
Matthew,24,15,“The prophet Daniel spoke about ‘the hated thing that destroys.’( Daniel 9:27; 11:31; 12:11) Someday you will see it standing in the holy place. The reader should understand this.
Matthew,24,16,Then those who are in Judea should escape to the mountains.
Matthew,24,17,No one on the housetop should go down into the house to take anything out.
Matthew,24,18,No one in the field should go back to get their coat.
Matthew,24,19,How awful it will be in those days for pregnant women! How awful for nursing mothers!
Matthew,24,20,Pray that you will not have to escape in winter or on the Sabbath day.
Matthew,24,21,There will be terrible suffering in those days. It will be worse than any other from the beginning of the world until now. And there will never be anything like it again.
Matthew,24,22,"“If the time had not been cut short, no one would live. But because of God’s chosen people, it will be shortened."
Matthew,24,23,"At that time someone may say to you, ‘Look! Here is the Messiah!’ Or, ‘There he is!’ Do not believe it."
Matthew,24,24,False messiahs and false prophets will appear. They will do great signs and miracles. They will try to fool God’s chosen people if possible.
Matthew,24,25,"See, I have told you ahead of time."
Matthew,24,26,"“So if anyone tells you, ‘He is a long way out in the desert,’ do not go out there. Or if anyone says, ‘He is deep inside the house,’ do not believe it."
Matthew,24,27,Lightning that comes from the east can be seen in the west. It will be the same when the Son of Man comes.
Matthew,24,28,The vultures will gather wherever there is a dead body.
Matthew,24,29,"“Right after the terrible suffering of those days, “ ‘The sun will be darkened. The moon will not shine. The stars will fall from the sky. The heavenly bodies will be shaken.’( Isaiah 13:10; 34:4)"
Matthew,24,30,"“Then the sign of the Son of Man will appear in heaven. At that time, all the peoples of the earth will mourn. They will mourn when they see the Son of Man coming on the clouds of heaven. He will come with power and great glory."
Matthew,24,31,He will send his angels with a loud trumpet call. They will gather his chosen people from all four directions. They will bring them from one end of the heavens to the other.
Matthew,24,32,"“Learn a lesson from the fig tree. As soon as its twigs get tender and its leaves come out, you know that summer is near."
Matthew,24,33,"In the same way, when you see all these things happening, you know that the end is near. It is right at the door."
Matthew,24,34,What I’m about to tell you is true. The people living now will certainly not pass away until all these things have happened.
Matthew,24,35,Heaven and earth will pass away. But my words will never pass away.
Matthew,24,36,“But no one knows about that day or hour. Not even the angels in heaven know. The Son does not know. Only the Father knows.
Matthew,24,37,Remember how it was in the days of Noah. It will be the same when the Son of Man comes.
Matthew,24,38,"In the days before the flood, people were eating and drinking. They were getting married. They were giving their daughters to be married. They did all those things right up to the day Noah entered the ark."
Matthew,24,39,They knew nothing about what would happen until the flood came and took them all away. That is how it will be when the Son of Man comes.
Matthew,24,40,Two men will be in the field. One will be taken and the other left.
Matthew,24,41,Two women will be grinding with a hand mill. One will be taken and the other left.
Matthew,24,42,“So keep watch. You do not know on what day your Lord will come.
Matthew,24,43,You must understand something. Suppose the owner of the house knew what time of night the robber was coming. Then he would have kept watch. He would not have let his house be broken into.
Matthew,24,44,So you also must be ready. The Son of Man will come at an hour when you don’t expect him.
Matthew,24,45,“Suppose a master puts one of his slaves in charge of the other slaves in his house. The slave’s job is to give them their food at the right time. The master wants a faithful and wise slave for this.
Matthew,24,46,It will be good for the slave if the master finds him doing his job when the master returns.
Matthew,24,47,What I’m about to tell you is true. The master will put that slave in charge of everything he owns.
Matthew,24,48,"But suppose that slave is evil. Suppose he says to himself, ‘My master is staying away a long time.’"
Matthew,24,49,Suppose he begins to beat the other slaves. And suppose he eats and drinks with those who drink too much.
Matthew,24,50,The master of that slave will come back on a day the slave doesn’t expect him. He will return at an hour the slave does not know.
Matthew,24,51,Then the master will cut him to pieces. He will send him to the place where pretenders go. There people will weep and grind their teeth.
Matthew,25,1,“Here is what the kingdom of heaven will be like at that time. Ten bridesmaids took their lamps and went out to meet the groom.
Matthew,25,2,Five of them were foolish. Five were wise.
Matthew,25,3,The foolish ones took their lamps but didn’t take any olive oil with them.
Matthew,25,4,The wise ones took oil in jars along with their lamps.
Matthew,25,5,The groom did not come for a long time. So the bridesmaids all grew tired and fell asleep.
Matthew,25,6,"“At midnight someone cried out, ‘Here’s the groom! Come out to meet him!’"
Matthew,25,7,“Then all the bridesmaids woke up and got their lamps ready.
Matthew,25,8,"The foolish ones said to the wise ones, ‘Give us some of your oil. Our lamps are going out.’"
Matthew,25,9,"“ ‘No,’ they replied. ‘There may not be enough for all of us. Instead, go to those who sell oil. Buy some for yourselves.’"
Matthew,25,10,"“So they went to buy the oil. But while they were on their way, the groom arrived. The bridesmaids who were ready went in with him to the wedding dinner. Then the door was shut."
Matthew,25,11,"“Later, the other bridesmaids also came. ‘Sir! Sir!’ they said. ‘Open the door for us!’"
Matthew,25,12,"“But he replied, ‘What I’m about to tell you is true. I don’t know you.’"
Matthew,25,13,“So keep watch. You do not know the day or the hour that the groom will come.
Matthew,25,14,"“Again, here is what the kingdom of heaven will be like. A man was going on a journey. He sent for his slaves and put them in charge of his money."
Matthew,25,15,He gave five bags of gold to one. He gave two bags to another. And he gave one bag to the third. The man gave each slave the amount of money he knew the slave could take care of. Then he went on his journey.
Matthew,25,16,The slave who had received five bags of gold went at once and put his money to work. He earned five bags more.
Matthew,25,17,The one with the two bags of gold earned two more.
Matthew,25,18,But the man who had received one bag went and dug a hole in the ground. He hid his master’s money in it.
Matthew,25,19,“After a long time the master of those slaves returned. He wanted to collect all the money they had earned.
Matthew,25,20,"The man who had received five bags of gold brought the other five. ‘Master,’ he said, ‘you trusted me with five bags of gold. See, I have earned five more.’"
Matthew,25,21,"“His master replied, ‘You have done well, good and faithful slave! You have been faithful with a few things. I will put you in charge of many things. Come and share your master’s happiness!’"
Matthew,25,22,"“The man with two bags of gold also came. ‘Master,’ he said, ‘you trusted me with two bags of gold. See, I have earned two more.’"
Matthew,25,23,"“His master replied, ‘You have done well, good and faithful slave! You have been faithful with a few things. I will put you in charge of many things. Come and share your master’s happiness!’"
Matthew,25,24,"“Then the man who had received one bag of gold came. ‘Master,’ he said, ‘I knew that you are a hard man. You harvest where you have not planted. You gather crops where you have not scattered seed."
Matthew,25,25,"So I was afraid. I went out and hid your gold in the ground. See, here is what belongs to you.’"
Matthew,25,26,"“His master replied, ‘You evil, lazy slave! So you knew that I harvest where I have not planted? You knew that I gather crops where I have not scattered seed?"
Matthew,25,27,"Well then, you should have put my money in the bank. When I returned, I would have received it back with interest.’"
Matthew,25,28,"“Then his master commanded the other slaves, ‘Take the bag of gold from him. Give it to the one who has ten bags."
Matthew,25,29,Everyone who has will be given more. They will have more than enough. And what about anyone who doesn’t have? Even what they have will be taken away from them.
Matthew,25,30,"Throw that worthless slave outside. There in the darkness, people will weep and grind their teeth.’"
Matthew,25,31,“The Son of Man will come in all his glory. All the angels will come with him. Then he will sit in glory on his throne.
Matthew,25,32,All the nations will be gathered in front of him. He will separate the people into two groups. He will be like a shepherd who separates the sheep from the goats.
Matthew,25,33,He will put the sheep to his right and the goats to his left.
Matthew,25,34,"“Then the King will speak to those on his right. He will say, ‘My Father has blessed you. Come and take what is yours. It is the kingdom prepared for you since the world was created."
Matthew,25,35,I was hungry. And you gave me something to eat. I was thirsty. And you gave me something to drink. I was a stranger. And you invited me in.
Matthew,25,36,I needed clothes. And you gave them to me. I was sick. And you took care of me. I was in prison. And you came to visit me.’
Matthew,25,37,"“Then the people who have done what is right will answer him. ‘Lord,’ they will ask, ‘when did we see you hungry and feed you? When did we see you thirsty and give you something to drink?"
Matthew,25,38,When did we see you as a stranger and invite you in? When did we see you needing clothes and give them to you?
Matthew,25,39,When did we see you sick or in prison and go to visit you?’
Matthew,25,40,"“The King will reply, ‘What I’m about to tell you is true. Anything you did for one of the least important of these brothers and sisters of mine, you did for me.’"
Matthew,25,41,"“Then he will say to those on his left, ‘You are cursed! Go away from me into the fire that burns forever. It has been prepared for the devil and his angels."
Matthew,25,42,I was hungry. But you gave me nothing to eat. I was thirsty. But you gave me nothing to drink.
Matthew,25,43,I was a stranger. But you did not invite me in. I needed clothes. But you did not give me any. I was sick and in prison. But you did not take care of me.’
Matthew,25,44,"“They also will answer, ‘Lord, when did we see you hungry or thirsty and not help you? When did we see you as a stranger or needing clothes or sick or in prison and not help you?’"
Matthew,25,45,"“He will reply, ‘What I’m about to tell you is true. Anything you didn’t do for one of the least important of these, you didn’t do for me.’"
Matthew,25,46,“Then they will go away to be punished forever. But those who have done what is right will receive eternal life.”
Matthew,26,1,"Jesus finished saying all these things. Then he said to his disciples,"
Matthew,26,2,"“As you know, the Passover Feast is two days away. The Son of Man will be handed over to be nailed to a cross.”"
Matthew,26,3,"Then the chief priests met with the elders of the people. They met in the palace of Caiaphas, the high priest."
Matthew,26,4,They made plans to arrest Jesus secretly. They wanted to kill him.
Matthew,26,5,"“But not during the feast,” they said. “The people may stir up trouble.”"
Matthew,26,6,"Jesus was in Bethany. He was in the home of Simon, who had a skin disease."
Matthew,26,7,A woman came to Jesus with a special sealed jar of very expensive perfume. She poured the perfume on his head while he was at the table.
Matthew,26,8,"When the disciples saw this, they became angry. “Why this waste?” they asked."
Matthew,26,9,“The perfume could have been sold at a high price. The money could have been given to poor people.”
Matthew,26,10,"Jesus was aware of this. So he said to them, “Why are you bothering this woman? She has done a beautiful thing to me."
Matthew,26,11,You will always have poor people with you. But you will not always have me.
Matthew,26,12,She poured the perfume on my body to prepare me to be buried.
Matthew,26,13,What I’m about to tell you is true. What she has done will be told anywhere this good news is preached all over the world. It will be told in memory of her.”
Matthew,26,14,One of the 12 disciples went to the chief priests. His name was Judas Iscariot.
Matthew,26,15,"He asked, “What will you give me if I hand Jesus over to you?” So they counted out 30 silver coins for him."
Matthew,26,16,"From then on, Judas watched for the right time to hand Jesus over to them."
Matthew,26,17,"It was the first day of the Feast of Unleavened Bread. The disciples came to Jesus. They asked, “Where do you want us to prepare for you to eat the Passover meal?”"
Matthew,26,18,"He replied, “Go into the city to a certain man. Tell him, ‘The Teacher says, “My time is near. I am going to celebrate the Passover at your house with my disciples.” ’ ”"
Matthew,26,19,So the disciples did what Jesus had told them to do. They prepared the Passover meal.
Matthew,26,20,"When evening came, Jesus was at the table with his 12 disciples."
Matthew,26,21,"While they were eating, he said, “What I’m about to tell you is true. One of you will hand me over to my enemies.”"
Matthew,26,22,"The disciples became very sad. One after the other, they began to say to him, “Surely you don’t mean me, Lord, do you?”"
Matthew,26,23,"Jesus replied, “The one who has dipped his hand into the bowl with me will hand me over."
Matthew,26,24,The Son of Man will go just as it is written about him. But how terrible it will be for the one who hands over the Son of Man! It would be better for him if he had not been born.”
Matthew,26,25,"Judas was the one who was going to hand him over. He said, “Surely you don’t mean me, Teacher, do you?” Jesus answered, “You have said so.”"
Matthew,26,26,"While they were eating, Jesus took bread. He gave thanks and broke it. He handed it to his disciples and said, “Take this and eat it. This is my body.”"
Matthew,26,27,"Then he took a cup. He gave thanks and handed it to them. He said, “All of you drink from it."
Matthew,26,28,This is my blood of the covenant. It is poured out to forgive the sins of many people.
Matthew,26,29,"Here is what I tell you. From now on, I won’t drink wine with you again until the day I drink it with you in my Father’s kingdom.”"
Matthew,26,30,Then they sang a hymn and went out to the Mount of Olives.
Matthew,26,31,"Jesus told them, “This very night you will all turn away because of me. It is written that the Lord said, “ ‘I will strike the shepherd down. Then the sheep of the flock will be scattered.’( Zechariah 13:7)"
Matthew,26,32,"But after I rise from the dead, I will go ahead of you into Galilee.”"
Matthew,26,33,"Peter replied, “All the others may turn away because of you. But I never will.”"
Matthew,26,34,"“What I’m about to tell you is true,” Jesus answered. “It will happen tonight. Before the rooster crows, you will say three times that you don’t know me.”"
Matthew,26,35,"But Peter said, “I may have to die with you. But I will never say I don’t know you.” And all the other disciples said the same thing."
Matthew,26,36,"Then Jesus went with his disciples to a place called Gethsemane. He said to them, “Sit here while I go over there and pray.”"
Matthew,26,37,He took Peter and the two sons of Zebedee along with him. He began to be sad and troubled.
Matthew,26,38,"Then he said to them, “My soul is very sad. I feel close to death. Stay here. Keep watch with me.”"
Matthew,26,39,"He went a little farther. Then he fell with his face to the ground. He prayed, “My Father, if it is possible, take this cup of suffering away from me. But let what you want be done, not what I want.”"
Matthew,26,40,Then he returned to his disciples and found them sleeping. “Couldn’t you men keep watch with me for one hour?” he asked Peter.
Matthew,26,41,"“Watch and pray. Then you won’t fall into sin when you are tempted. The spirit is willing, but the body is weak.”"
Matthew,26,42,"Jesus went away a second time. He prayed, “My Father, is it possible for this cup to be taken away? But if I must drink it, may what you want be done.”"
Matthew,26,43,Then he came back. Again he found them sleeping. They couldn’t keep their eyes open.
Matthew,26,44,So he left them and went away once more. For the third time he prayed the same thing.
Matthew,26,45,"Then he returned to the disciples. He said to them, “Are you still sleeping and resting? Look! The hour has come. The Son of Man is about to be handed over to sinners."
Matthew,26,46,Get up! Let us go! Here comes the one who is handing me over to them!”
Matthew,26,47,"While Jesus was still speaking, Judas arrived. He was one of the 12 disciples. A large crowd was with him. They were carrying swords and clubs. The chief priests and the elders of the people had sent them."
Matthew,26,48,"Judas, who was going to hand Jesus over, had arranged a signal with them. “The one I kiss is the man,” he said. “Arrest him.”"
Matthew,26,49,"So Judas went to Jesus at once. He said, “Greetings, Rabbi!” And he kissed him."
Matthew,26,50,"Jesus replied, “Friend, do what you came to do.” Then the men stepped forward. They grabbed Jesus and arrested him."
Matthew,26,51,"At that moment, one of Jesus’ companions reached for his sword. He pulled it out and struck the slave of the high priest with it. He cut off the slave’s ear."
Matthew,26,52,"“Put your sword back in its place,” Jesus said to him. “All who use the sword will die by the sword."
Matthew,26,53,"Do you think I can’t ask my Father for help? He would send an army of more than 70,000 angels right away."
Matthew,26,54,But then how would the Scriptures come true? They say it must happen in this way.”
Matthew,26,55,At that time Jesus spoke to the crowd. “Am I leading a band of armed men against you?” he asked. “Do you have to come out with swords and clubs to capture me? Every day I sat in the temple courtyard teaching. And you didn’t arrest me.
Matthew,26,56,But all this has happened so that the words of the prophets would come true.” Then all the disciples left him and ran away.
Matthew,26,57,"Those who had arrested Jesus took him to Caiaphas, the high priest. The teachers of the law and the elders had come together there."
Matthew,26,58,"Not too far away, Peter followed Jesus. He went right up to the courtyard of the high priest. He entered and sat down with the guards to see what would happen."
Matthew,26,59,The chief priests and the whole Sanhedrin were looking for something to use against Jesus. They wanted to put him to death.
Matthew,26,60,"But they did not find any proof, even though many false witnesses came forward. Finally, two other witnesses came forward."
Matthew,26,61,"They said, “This fellow claimed, ‘I am able to destroy the temple of God. I can build it again in three days.’ ”"
Matthew,26,62,"Then the high priest stood up. He asked Jesus, “Aren’t you going to answer? What are these charges that these men are bringing against you?”"
Matthew,26,63,"But Jesus remained silent. The high priest said to him, “I am commanding you in the name of the living God. May he judge you if you don’t tell the truth. Tell us if you are the Messiah, the Son of God.”"
Matthew,26,64,"“You have said so,” Jesus replied. “But here is what I say to all of you. From now on, you will see the Son of Man sitting at the right hand of the Mighty One. You will see the Son of Man coming on the clouds of heaven.”"
Matthew,26,65,"Then the high priest tore his clothes. He said, “He has spoken a very evil thing against God! Why do we need any more witnesses? You have heard him say this evil thing."
Matthew,26,66,What do you think?” “He must die!” they answered.
Matthew,26,67,Then they spit in his face. They hit him with their fists. Others slapped him.
Matthew,26,68,"They said, “Prophesy to us, Messiah! Who hit you?”"
Matthew,26,69,"Peter was sitting out in the courtyard. A female servant came to him. “You also were with Jesus of Galilee,” she said."
Matthew,26,70,"But in front of all of them, Peter said he was not. “I don’t know what you’re talking about,” he said."
Matthew,26,71,"Then he went out to the gate leading into the courtyard. There another servant saw him. She said to the people, “This fellow was with Jesus of Nazareth.”"
Matthew,26,72,"Again he said he was not. With a curse he said, “I don’t know the man!”"
Matthew,26,73,"After a little while, those standing there went up to Peter. “You must be one of them,” they said. “The way you talk gives you away.”"
Matthew,26,74,"Then Peter began to curse and said to them, “I don’t know the man!” Right away a rooster crowed."
Matthew,26,75,"Then Peter remembered what Jesus had said. “The rooster will crow,” Jesus had told him. “Before it does, you will say three times that you don’t know me.” Peter went outside. He broke down and cried."
Matthew,27,1,It was early in the morning. All the chief priests and the elders of the people planned how to put Jesus to death.
Matthew,27,2,"So they tied him up and led him away. Then they handed him over to Pilate, who was the governor."
Matthew,27,3,"Judas, who had handed him over, saw that Jesus had been sentenced to die. He felt deep shame and sadness for what he had done. So he returned the 30 silver coins to the chief priests and the elders."
Matthew,27,4,"“I have sinned,” he said. “I handed over a man who is not guilty.” “What do we care?” they replied. “That’s your problem.”"
Matthew,27,5,So Judas threw the money into the temple and left. Then he went away and hanged himself.
Matthew,27,6,"The chief priests picked up the coins. They said, “It’s against the law to put this money into the temple fund. It is blood money. It has paid for a man’s death.”"
Matthew,27,7,So they decided to use the money to buy a potter’s field. People from other countries would be buried there.
Matthew,27,8,That is why it has been called the Field of Blood to this day.
Matthew,27,9,"Then the words spoken by Jeremiah the prophet came true. He had said, “They took the 30 silver coins. That price was set for him by the people of Israel."
Matthew,27,10,"They used the coins to buy a potter’s field, just as the Lord commanded me.”( Zechariah 11:12, 13; Jeremiah 19:1–13; 32:6–9)"
Matthew,27,11,"Jesus was standing in front of the governor. The governor asked him, “Are you the king of the Jews?” “Yes. You have said so,” Jesus replied."
Matthew,27,12,"But when the chief priests and the elders brought charges against him, he did not answer."
Matthew,27,13,"Then Pilate asked him, “Don’t you hear the charges they are bringing against you?”"
Matthew,27,14,"But Jesus made no reply, not even to a single charge. The governor was really amazed."
