Matthew,7,8,Everyone who asks will receive. The one who searches will find. The door will be opened to the one who knocks.
Matthew,7,9,“Suppose your son asks for bread. Which of you will give him a stone?
Matthew,7,10,Or suppose he asks for a fish. Which of you will give him a snake?
Matthew,7,11,"Even though you are evil, you know how to give good gifts to your children. How much more will your Father who is in heaven give good gifts to those who ask him!"
Matthew,7,12,"In everything, do to others what you would want them to do to you. This is what is written in the Law and in the Prophets."
Matthew,7,13,“Enter God’s kingdom through the narrow gate. The gate is large and the road is wide that leads to ruin. Many people go that way.
Matthew,7,14,But the gate is small and the road is narrow that leads to life. Only a few people find it.
Matthew,7,15,“Watch out for false prophets. They come to you pretending to be sheep. But on the inside they are hungry wolves.
Matthew,7,16,You can tell each tree by its fruit. Do people pick grapes from bushes? Do they pick figs from thorns?
Matthew,7,17,"In the same way, every good tree bears good fruit. But a bad tree bears bad fruit."
Matthew,7,18,A good tree can’t bear bad fruit. And a bad tree can’t bear good fruit.
Matthew,7,19,Every tree that does not bear good fruit is cut down. It is thrown into the fire.
Matthew,7,20,You can tell each tree by its fruit.
Matthew,7,21,"“Not everyone who says to me, ‘Lord, Lord,’ will enter the kingdom of heaven. Only those who do what my Father in heaven wants will enter."
Matthew,7,22,"Many will say to me on that day, ‘Lord! Lord! Didn’t we prophesy in your name? Didn’t we drive out demons in your name? Didn’t we do many miracles in your name?’"
Matthew,7,23,"Then I will tell them clearly, ‘I never knew you. Get away from me, you who do evil!’"
Matthew,7,24,"“So then, everyone who hears my words and puts them into practice is like a wise man. He builds his house on the rock."
Matthew,7,25,The rain comes down. The water rises. The winds blow and beat against that house. But it does not fall. It is built on the rock.
Matthew,7,26,But everyone who hears my words and does not put them into practice is like a foolish man. He builds his house on sand.
Matthew,7,27,The rain comes down. The water rises. The winds blow and beat against that house. And it falls with a loud crash.”
Matthew,7,28,Jesus finished saying all these things. The crowds were amazed at his teaching.
Matthew,7,29,That’s because he taught like one who had authority. He did not speak like their teachers of the law.
Matthew,8,1,Jesus came down from the mountainside. Large crowds followed him.
Matthew,8,2,"A man who had a skin disease came and got down on his knees in front of Jesus. He said, “Lord, if you are willing to make me ‘clean,’ you can do it.”"
Matthew,8,3,"Jesus reached out his hand and touched the man. “I am willing to do it,” he said. “Be ‘clean’!” Right away the man was healed of his skin disease."
Matthew,8,4,"Then Jesus said to him, “Don’t tell anyone. Go and show yourself to the priest, and offer the gift Moses commanded. It will be a witness to everyone.”"
Matthew,8,5,"When Jesus entered Capernaum, a Roman commander came to him. He asked Jesus for help."
Matthew,8,6,"“Lord,” he said, “my servant lies at home and can’t move. He is suffering terribly.”"
Matthew,8,7,"Jesus said, “Shall I come and heal him?”"
Matthew,8,8,"The commander replied, “Lord, I am not good enough to have you come into my house. But just say the word, and my servant will be healed."
Matthew,8,9,"I myself am a man under authority. And I have soldiers who obey my orders. I tell this one, ‘Go,’ and he goes. I tell that one, ‘Come,’ and he comes. I say to my slave, ‘Do this,’ and he does it.”"
Matthew,8,10,"When Jesus heard this, he was amazed. He said to those following him, “What I’m about to tell you is true. In Israel I have not found anyone whose faith is so strong."
Matthew,8,11,"I say to you that many will come from the east and the west. They will take their places at the feast in the kingdom of heaven. They will sit with Abraham, Isaac and Jacob."
Matthew,8,12,"But those who think they belong in the kingdom will be thrown outside, into the darkness. There they will weep and grind their teeth.”"
Matthew,8,13,"Then Jesus said to the Roman commander, “Go! It will be done just as you believed it would.” And his servant was healed at that moment."
Matthew,8,14,"When Jesus came into Peter’s house, he saw Peter’s mother-in-law. She was lying in bed. She had a fever."
Matthew,8,15,"Jesus touched her hand, and the fever left her. She got up and began to serve him."
Matthew,8,16,"When evening came, many people controlled by demons were brought to Jesus. He drove out the spirits with a word. He healed all who were sick."
Matthew,8,17,"This happened so that what Isaiah the prophet had said would come true. He had said, “He suffered the things we should have suffered. He took on himself the sicknesses that should have been ours.”( Isaiah 53:4)"
Matthew,8,18,Jesus saw the crowd around him. So he gave his disciples orders to go to the other side of the Sea of Galilee.
Matthew,8,19,"Then a teacher of the law came to him. He said, “Teacher, I will follow you no matter where you go.”"
Matthew,8,20,"Jesus replied, “Foxes have dens. Birds have nests. But the Son of Man has no place to lay his head.”"
Matthew,8,21,"Another follower said to him, “Lord, first let me go and bury my father.”"
Matthew,8,22,"But Jesus told him, “Follow me. Let the dead bury their own dead.”"
Matthew,8,23,Jesus got into a boat. His disciples followed him.
Matthew,8,24,Suddenly a terrible storm came up on the lake. The waves crashed over the boat. But Jesus was sleeping.
Matthew,8,25,"The disciples went and woke him up. They said, “Lord! Save us! We’re going to drown!”"
Matthew,8,26,"He replied, “Your faith is so small! Why are you so afraid?” Then Jesus got up and ordered the winds and the waves to stop. It became completely calm."
Matthew,8,27,"The disciples were amazed. They asked, “What kind of man is this? Even the winds and the waves obey him!”"
Matthew,8,28,Jesus arrived at the other side of the lake in the area of the Gadarenes. Two men controlled by demons met him. They came from the tombs. The men were so wild that no one could pass that way.
Matthew,8,29,"“Son of God, what do you want with us?” they shouted. “Have you come here to punish us before the time for us to be judged?”"
Matthew,8,30,"Not very far away, a large herd of pigs was feeding."
Matthew,8,31,"The demons begged Jesus, “If you drive us out, send us into the herd of pigs.”"
Matthew,8,32,"Jesus said to them, “Go!” So the demons came out of the men and went into the pigs. The whole herd rushed down the steep bank. They ran into the lake and drowned in the water."
Matthew,8,33,Those who were tending the pigs ran off. They went into the town and reported all this. They told the people what had happened to the men who had been controlled by demons.
Matthew,8,34,"Then the whole town went out to meet Jesus. When they saw him, they begged him to leave their area."
Matthew,9,1,Jesus stepped into a boat. He went over to the other side of the lake and came to his own town.
Matthew,9,2,"Some men brought to him a man who could not walk. He was lying on a mat. Jesus saw that they had faith. So he said to the man, “Don’t lose hope, son. Your sins are forgiven.”"
Matthew,9,3,"Then some teachers of the law said to themselves, “This fellow is saying a very evil thing!”"
Matthew,9,4,"Jesus knew what they were thinking. So he said, “Why do you have evil thoughts in your hearts?"
Matthew,9,5,"Is it easier to say, ‘Your sins are forgiven’? Or to say, ‘Get up and walk’?"
Matthew,9,6,"But I want you to know that the Son of Man has authority on earth to forgive sins.” So he spoke to the man who could not walk. “Get up,” he said. “Take your mat and go home.”"
Matthew,9,7,The man got up and went home.
Matthew,9,8,"When the crowd saw this, they were filled with wonder. They praised God for giving that kind of authority to a human being."
Matthew,9,9,"As Jesus went on from there, he saw a man named Matthew. He was sitting at the tax collector’s booth. “Follow me,” Jesus told him. Matthew got up and followed him."
Matthew,9,10,Later Jesus was having dinner at Matthew’s house. Many tax collectors and sinners came. They ate with Jesus and his disciples.
Matthew,9,11,"The Pharisees saw this. So they asked the disciples, “Why does your teacher eat with tax collectors and sinners?”"
Matthew,9,12,"Jesus heard this. So he said, “Those who are healthy don’t need a doctor. Sick people do."
Matthew,9,13,"Go and learn what this means, ‘I want mercy and not sacrifice.’( Hosea 6:6) I have not come to get those who think they are right with God to follow me. I have come to get sinners to follow me.”"
Matthew,9,14,"One day John’s disciples came. They said to Jesus, “We and the Pharisees often go without eating. Why don’t your disciples go without eating?”"
Matthew,9,15,"Jesus answered, “How can the guests of the groom be sad while he is with them? The time will come when the groom will be taken away from them. Then they will fast."
Matthew,9,16,“People don’t sew a patch of new cloth on old clothes. The new piece will pull away from the old. That will make the tear worse.
Matthew,9,17,"People don’t pour new wine into old wineskins. If they do, the skins will burst. The wine will run out, and the wineskins will be destroyed. No, people pour new wine into new wineskins. Then both are saved.”"
Matthew,9,18,"While Jesus was saying this, a synagogue leader came. He got down on his knees in front of Jesus. He said, “My daughter has just died. But come and place your hand on her. Then she will live again.”"
Matthew,9,19,Jesus got up and went with him. So did his disciples.
Matthew,9,20,Just then a woman came up behind Jesus. She had a sickness that made her bleed. It had lasted for 12 years. She touched the edge of his clothes.
Matthew,9,21,"She thought, “I only need to touch his clothes. Then I will be healed.”"
Matthew,9,22,"Jesus turned and saw her. “Dear woman, don’t give up hope,” he said. “Your faith has healed you.” The woman was healed at that moment."
Matthew,9,23,"When Jesus entered the synagogue leader’s house, he saw the noisy crowd and people playing flutes."
Matthew,9,24,"He said, “Go away. The girl is not dead. She is sleeping.” But they laughed at him."
Matthew,9,25,"After the crowd had been sent outside, Jesus went in. He took the girl by the hand, and she got up."
Matthew,9,26,News about what Jesus had done spread all over that area.
Matthew,9,27,"As Jesus went on from there, two blind men followed him. They called out, “Have mercy on us, Son of David!”"
Matthew,9,28,"When Jesus went indoors, the blind men came to him. He asked them, “Do you believe that I can do this?” “Yes, Lord,” they replied."
Matthew,9,29,"Then he touched their eyes. He said, “It will happen to you just as you believed.”"
Matthew,9,30,"They could now see again. Jesus strongly warned them, “Be sure that no one knows about this.”"
Matthew,9,31,But they went out and spread the news. They talked about him all over that area.
Matthew,9,32,"While they were going out, another man was brought to Jesus. A demon controlled him, and he could not speak."
Matthew,9,33,"When the demon was driven out, the man spoke. The crowd was amazed. They said, “Nothing like this has ever been seen in Israel.”"
Matthew,9,34,"But the Pharisees said, “He drives out demons by the power of the prince of demons.”"
Matthew,9,35,Jesus went through all the towns and villages. He taught in their synagogues. He preached the good news of the kingdom. And he healed every illness and sickness.
Matthew,9,36,"When he saw the crowds, he felt deep concern for them. They were treated badly and were helpless, like sheep without a shepherd."
Matthew,9,37,"Then Jesus said to his disciples, “The harvest is huge. But there are only a few workers."
Matthew,9,38,So ask the Lord of the harvest to send workers out into his harvest field.”
Matthew,10,1,Jesus called for his 12 disciples to come to him. He gave them authority to drive out evil spirits and to heal every illness and sickness.
Matthew,10,2,"Here are the names of the 12 apostles. First there were Simon Peter and his brother Andrew. Then came James, son of Zebedee, and his brother John."
Matthew,10,3,"Next were Philip and Bartholomew, and also Thomas and Matthew the tax collector. Two more were James, son of Alphaeus, and Thaddaeus."
Matthew,10,4,The last were Simon the Zealot and Judas Iscariot. Judas was the one who was later going to hand Jesus over to his enemies.
Matthew,10,5,"Jesus sent these 12 out with the following orders. “Do not go among the Gentiles,” he said. “Do not enter any town of the Samaritans."
Matthew,10,6,"Instead, go to the people of Israel. They are like sheep that have become lost."
Matthew,10,7,"As you go, preach this message, ‘The kingdom of heaven has come near.’"
Matthew,10,8,"Heal those who are sick. Bring those who are dead back to life. Make those who have skin diseases ‘clean’ again. Drive out demons. You have received freely, so give freely."
Matthew,10,9,"“Do not get any gold, silver or copper to take with you in your belts."
Matthew,10,10,Do not take a bag for the journey. Do not take extra clothes or sandals or walking sticks. A worker should be given what he needs.
Matthew,10,11,"When you enter a town or village, look for someone who is willing to welcome you. Stay at their house until you leave."
Matthew,10,12,"As you enter the home, greet those who live there."
Matthew,10,13,"If that home welcomes you, give it your blessing of peace. If it does not, don’t bless it."
Matthew,10,14,"Some people may not welcome you or listen to your words. If they don’t, leave that home or town, and shake the dust off your feet."
Matthew,10,15,What I’m about to tell you is true. On judgment day it will be easier for Sodom and Gomorrah than for that town.
Matthew,10,16,“I am sending you out like sheep among wolves. So be as wise as snakes and as harmless as doves.
Matthew,10,17,Watch out! You will be handed over to the local courts. You will be whipped in the synagogues.
Matthew,10,18,You will be brought to governors and kings because of me. You will be witnesses to them and to the Gentiles.
Matthew,10,19,"But when they arrest you, don’t worry about what you will say or how you will say it. At that time you will be given the right words to say."
Matthew,10,20,It will not be you speaking. The Spirit of your Father will be speaking through you.
Matthew,10,21,“Brothers will hand over brothers to be killed. Fathers will hand over their children. Children will rise up against their parents and have them put to death.
Matthew,10,22,You will be hated by everyone because of me. But anyone who remains strong in the faith will be saved.
Matthew,10,23,"When people attack you in one place, escape to another. What I’m about to tell you is true. You will not finish going through the towns of Israel before the Son of Man comes."
Matthew,10,24,“The student is not better than the teacher. A slave is not better than his master.
Matthew,10,25,"It is enough for students to be like their teachers. And it is enough for slaves to be like their masters. If the head of the house has been called Beelzebul, what can the others who live there expect?"
Matthew,10,26,“So don’t be afraid of your enemies. Everything that is secret will be brought out into the open. Everything that is hidden will be uncovered.
Matthew,10,27,"What I tell you in the dark, speak in the daylight. What is whispered in your ear, shout from the rooftops."
Matthew,10,28,"Do not be afraid of those who kill the body but can’t kill the soul. Instead, be afraid of the one who can destroy both soul and body in hell."
Matthew,10,29,Aren’t two sparrows sold for only a penny? But not one of them falls to the ground outside your Father’s care.
Matthew,10,30,He even counts every hair on your head!
Matthew,10,31,So don’t be afraid. You are worth more than many sparrows.
Matthew,10,32,“What if someone says in front of others that they know me? I will also say in front of my Father who is in heaven that I know them.
Matthew,10,33,But what if someone says in front of others that they don’t know me? I will say in front of my Father who is in heaven that I don’t know them.
Matthew,10,34,“Do not think that I came to bring peace to the earth. I didn’t come to bring peace. I came to bring a sword.
Matthew,10,35,I have come to turn “ ‘sons against their fathers. Daughters will refuse to obey their mothers. Daughters-in-law will be against their mothers-in-law.
Matthew,10,36,A man’s enemies will be the members of his own family.’( Micah 7:6)
Matthew,10,37,“Anyone who loves their father or mother more than me is not worthy of me. Anyone who loves their son or daughter more than me is not worthy of me.
Matthew,10,38,Whoever does not pick up their cross and follow me is not worthy of me.
Matthew,10,39,Whoever finds their life will lose it. Whoever loses their life because of me will find it.
Matthew,10,40,“Anyone who welcomes you welcomes me. And anyone who welcomes me welcomes the one who sent me.
Matthew,10,41,Suppose someone welcomes a prophet as a prophet. They will receive a prophet’s reward. And suppose someone welcomes a godly person as a godly person. They will receive a godly person’s reward.
Matthew,10,42,Suppose someone gives even a cup of cold water to a little one who follows me. What I’m about to tell you is true. That person will certainly be rewarded.”
Matthew,11,1,Jesus finished teaching his 12 disciples. Then he went on to teach and preach in the towns of Galilee.
Matthew,11,2,"John the Baptist was in prison. When he heard about the actions of the Messiah, he sent his disciples to him."
Matthew,11,3,"They asked Jesus, “Are you the one who is supposed to come? Or should we look for someone else?”"
Matthew,11,4,"Jesus replied, “Go back to John. Report to him what you hear and see."
Matthew,11,5,Blind people receive sight. Disabled people walk. Those who have skin diseases are made ‘clean.’ Deaf people hear. Those who are dead are raised to life. And the good news is preached to those who are poor.
Matthew,11,6,Blessed is anyone who does not give up their faith because of me.”
Matthew,11,7,"As John’s disciples were leaving, Jesus began to speak to the crowd about John. He said, “What did you go out into the desert to see? Tall grass waving in the wind?"
Matthew,11,8,"If not, what did you go out to see? A man dressed in fine clothes? No. People who wear fine clothes are in kings’ palaces."
Matthew,11,9,"Then what did you go out to see? A prophet? Yes, I tell you, and more than a prophet."
Matthew,11,10,"He is the one written about in Scripture. It says, “ ‘I will send my messenger ahead of you. He will prepare your way for you.’( Malachi 3:1)"
Matthew,11,11,What I’m about to tell you is true. No one more important than John the Baptist has ever been born. But the least important person in the kingdom of heaven is more important than he is.
Matthew,11,12,"Since the days of John the Baptist, the kingdom of heaven has been under attack. And violent people are taking hold of it."
Matthew,11,13,All the Prophets and the Law prophesied until John came.
Matthew,11,14,"If you are willing to accept it, John is the Elijah who was supposed to come."
Matthew,11,15,Whoever has ears should listen.
Matthew,11,16,"“What can I compare today’s people to? They are like children sitting in the markets and calling out to others. They say,"
Matthew,11,17,“ ‘We played the flute for you. But you didn’t dance. We sang a funeral song. But you didn’t become sad.’
Matthew,11,18,"When John came, he didn’t eat or drink as you do. And people say, ‘He has a demon.’"
Matthew,11,19,"But when the Son of Man came, he ate and drank as you do. And people say, ‘This fellow is always eating and drinking far too much. He’s a friend of tax collectors and “sinners.” ’ By wise actions wisdom is shown to be right.”"
Matthew,11,20,"Jesus began to speak against the towns where he had done most of his miracles. The people there had not turned away from their sins. So he said,"
Matthew,11,21,"“How terrible it will be for you, Chorazin! How terrible for you, Bethsaida! Suppose the miracles done in you had been done in Tyre and Sidon. They would have turned away from their sins long ago. They would have put on clothes for mourning. They would have sat down in ashes."
Matthew,11,22,But I tell you this. On judgment day it will be easier for Tyre and Sidon than for you.
Matthew,11,23,"And what about you, Capernaum? Will you be lifted to the heavens? No! You will go down to the place of the dead. Suppose the miracles done in you had been done in Sodom. It would still be here today."
Matthew,11,24,But I tell you this. On judgment day it will be easier for Sodom than for you.”
Matthew,11,25,"At that time Jesus said, “I praise you, Father. You are Lord of heaven and earth. You have hidden these things from wise and educated people. But you have shown them to little children."
Matthew,11,26,"Yes, Father. This is what you wanted to do."
Matthew,11,27,“My Father has given all things to me. The Father is the only one who knows the Son. And the only ones who know the Father are the Son and those to whom the Son chooses to make him known.
Matthew,11,28,"“Come to me, all you who are tired and are carrying heavy loads. I will give you rest."
Matthew,11,29,Become my servants and learn from me. I am gentle and free of pride. You will find rest for your souls.
Matthew,11,30,"Serving me is easy, and my load is light.”"
Matthew,12,1,One Sabbath day Jesus walked through the grainfields. His disciples were hungry. So they began to break off some heads of grain and eat them.
Matthew,12,2,"The Pharisees saw this. They said to Jesus, “Look! It is against the Law to do this on the Sabbath day. But your disciples are doing it anyway!”"
Matthew,12,3,"Jesus answered, “Haven’t you read about what David did? He and his men were hungry."
Matthew,12,4,So he entered the house of God. He and his men ate the holy bread. Only priests were allowed to eat it.
Matthew,12,5,Haven’t you read the Law? It tells how every Sabbath day the priests in the temple have to do their work on that day. But they are not considered guilty.
Matthew,12,6,I tell you that something more important than the temple is here.
Matthew,12,7,"Scripture says, ‘I want mercy and not sacrifice.’( Hosea 6:6) You don’t know what those words mean. If you did, you would not bring charges against those who are not guilty."
Matthew,12,8,The Son of Man is Lord of the Sabbath day.”
Matthew,12,9,"Going on from that place, Jesus went into their synagogue."
Matthew,12,10,"A man with a weak and twisted hand was there. The Pharisees were trying to accuse Jesus of a crime. So they asked him, “Does the Law allow us to heal on the Sabbath day?”"
Matthew,12,11,"He said to them, “What if one of your sheep falls into a pit on the Sabbath day? Won’t you take hold of it and lift it out?"
Matthew,12,12,A person is worth more than sheep! So the Law allows us to do good on the Sabbath day.”
Matthew,12,13,"Then Jesus said to the man, “Stretch out your hand.” So he stretched it out. It had been made as good as new. It was just as good as the other hand."
Matthew,12,14,But the Pharisees went out and planned how to kill Jesus.
Matthew,12,15,"Jesus knew all about the Pharisees’ plans. So he left that place. A large crowd followed him, and he healed all who were sick."
Matthew,12,16,But he warned them not to tell other people about him.
Matthew,12,17,"This was to make what was spoken through the prophet Isaiah come true. It says,"
Matthew,12,18,“Here is my servant. I have chosen him. He is the one I love. I am very pleased with him. I will put my Spirit on him. He will announce to the nations that everything will be made right.
Matthew,12,19,He will not argue or cry out. No one will hear his voice in the streets.
Matthew,12,20,He will not break a bent twig. He will not put out a dimly burning flame. He will make right win over wrong.
Matthew,12,21,The nations will put their hope in him.”( Isaiah 42:1–4)
Matthew,12,22,A man controlled by demons was brought to Jesus. The man was blind and could not speak. Jesus healed him. Then the man could speak and see.
Matthew,12,23,"All the people were amazed. They said, “Could this be the Son of David?”"
Matthew,12,24,"The Pharisees heard this. So they said, “This fellow drives out demons by the power of Beelzebul, the prince of demons.”"
Matthew,12,25,"Jesus knew what they were thinking. So he said to them, “Every kingdom that fights against itself will be destroyed. Every city or family that is divided against itself will not stand."
Matthew,12,26,"If Satan drives out Satan, he fights against himself. Then how can his kingdom stand?"
Matthew,12,27,"You say I drive out demons by the power of Beelzebul. Then by whose power do your people drive them out? So then, they will be your judges."
Matthew,12,28,But suppose I drive out demons by the Spirit of God. Then the kingdom of God has come to you.
Matthew,12,29,“Or think about this. How can you enter a strong man’s house and just take what the man owns? You must first tie him up. Then you can rob his house.
Matthew,12,30,“Anyone who is not with me is against me. Anyone who does not gather sheep with me scatters them.
