Psalms,105,33,"He struck down their vines also and their fig trees, And shattered the trees of their territory."
Psalms,105,34,"He spoke, and locusts came, And young locusts, even without number,"
Psalms,105,35,"And ate up all vegetation in their land, And ate up the fruit of their ground."
Psalms,105,36,"He also struck down all the firstborn in their land, The first fruits of all their vigor."
Psalms,105,37,"Then He brought them out with silver and gold, And among His tribes there was not one who stumbled."
Psalms,105,38,"Egypt was glad when they departed, For the dread of them had fallen upon them."
Psalms,105,39,"He spread a cloud for a covering, And fire to illumine by night."
Psalms,105,40,"They asked, and He brought quail, And satisfied them with the bread of heaven."
Psalms,105,41,He opened the rock and water flowed out; It ran in the dry places like a river.
Psalms,105,42,For He remembered His holy word With Abraham His servant;
Psalms,105,43,"And He brought forth His people with joy, His chosen ones with a joyful shout."
Psalms,105,44,"He gave them also the lands of the nations, That they might take possession of the fruit of the peoples’ labor,"
Psalms,105,45,"So that they might keep His statutes And observe His laws, Praise the L ord!"
Psalms,106,1,"Praise the L ord! Oh give thanks to the L ord , for He is good; For His lovingkindness is everlasting."
Psalms,106,2,"Who can speak of the mighty deeds of the L ord, Or can show forth all His praise?"
Psalms,106,3,"How blessed are those who keep justice, Who practice righteousness at all times!"
Psalms,106,4,"Remember me, O L ord , in Your favor toward Your people; Visit me with Your salvation,"
Psalms,106,5,"That I may see the prosperity of Your chosen ones, That I may rejoice in the gladness of Your nation, That I may glory with Your inheritance."
Psalms,106,6,"We have sinned like our fathers, We have committed iniquity, we have behaved wickedly."
Psalms,106,7,"Our fathers in Egypt did not understand Your wonders; They did not remember Your abundant kindnesses, But rebelled by the sea, at the Red Sea."
Psalms,106,8,"Nevertheless He saved them for the sake of His name, That He might make His power known."
Psalms,106,9,"Thus He rebuked the Red Sea and it dried up, And He led them through the deeps, as through the wilderness."
Psalms,106,10,"So He saved them from the hand of the one who hated them, And redeemed them from the hand of the enemy."
Psalms,106,11,The waters covered their adversaries; Not one of them was left.
Psalms,106,12,Then they believed His words; They sang His praise.
Psalms,106,13,"They quickly forgot His works; They did not wait for His counsel,"
Psalms,106,14,"But craved intensely in the wilderness, And tempted God in the desert."
Psalms,106,15,"So He gave them their request, But sent a wasting disease among them."
Psalms,106,16,"When they became envious of Moses in the camp, And of Aaron, the holy one of the L ord,"
Psalms,106,17,"The earth opened and swallowed up Dathan, And engulfed the company of Abiram."
Psalms,106,18,And a fire blazed up in their company; The flame consumed the wicked.
Psalms,106,19,They made a calf in Horeb And worshiped a molten image.
Psalms,106,20,Thus they exchanged their glory For the image of an ox that eats grass.
Psalms,106,21,"They forgot God their Savior, Who had done great things in Egypt,"
Psalms,106,22,Wonders in the land of Ham And awesome things by the Red Sea.
Psalms,106,23,"Therefore He said that He would destroy them, Had not Moses His chosen one stood in the breach before Him, To turn away His wrath from destroying them."
Psalms,106,24,"Then they despised the pleasant land; They did not believe in His word,"
Psalms,106,25,But grumbled in their tents; They did not listen to the voice of the L ord.
Psalms,106,26,"Therefore He swore to them That He would cast them down in the wilderness,"
Psalms,106,27,And that He would cast their seed among the nations And scatter them in the lands.
Psalms,106,28,"They joined themselves also to Baal-peor, And ate sacrifices offered to the dead."
Psalms,106,29,"Thus they provoked Him to anger with their deeds, And the plague broke out among them."
Psalms,106,30,"Then Phinehas stood up and interposed, And so the plague was stayed."
Psalms,106,31,"And it was reckoned to him for righteousness, To all generations forever."
Psalms,106,32,"They also provoked Him to wrath at the waters of Meribah, So that it went hard with Moses on their account;"
Psalms,106,33,"Because they were rebellious against His Spirit, He spoke rashly with his lips."
Psalms,106,34,"They did not destroy the peoples, As the L ord commanded them,"
Psalms,106,35,"But they mingled with the nations And learned their practices,"
Psalms,106,36,"And served their idols, Which became a snare to them."
Psalms,106,37,"They even sacrificed their sons and their daughters to the demons,"
Psalms,106,38,"And shed innocent blood, The blood of their sons and their daughters, Whom they sacrificed to the idols of Canaan; And the land was polluted with the blood."
Psalms,106,39,"Thus they became unclean in their practices, And played the harlot in their deeds."
Psalms,106,40,Therefore the anger of the L ord was kindled against His people And He abhorred His inheritance.
Psalms,106,41,"Then He gave them into the hand of the nations, And those who hated them ruled over them."
Psalms,106,42,"Their enemies also oppressed them, And they were subdued under their power."
Psalms,106,43,"Many times He would deliver them; They, however, were rebellious in their counsel, And so sank down in their iniquity."
Psalms,106,44,Nevertheless He looked upon their distress When He heard their cry;
Psalms,106,45,"And He remembered His covenant for their sake, And relented according to the greatness of His lovingkindness."
Psalms,106,46,He also made them objects of compassion In the presence of all their captors.
Psalms,106,47,"Save us, O L ord our God, And gather us from among the nations, To give thanks to Your holy name And glory in Your praise."
Psalms,106,48,"Blessed be the L ord , the God of Israel, From everlasting even to everlasting. And let all the people say, “Amen.” Praise the L ord!"
Psalms,107,1,"Oh give thanks to the L ord , for He is good, For His lovingkindness is everlasting."
Psalms,107,2,"Let the redeemed of the L ord say so, Whom He has redeemed from the hand of the adversary"
Psalms,107,3,"And gathered from the lands, From the east and from the west, From the north and from the south."
Psalms,107,4,They wandered in the wilderness in a desert region; They did not find a way to an inhabited city.
Psalms,107,5, They were hungry and thirsty; Their soul fainted within them.
Psalms,107,6,Then they cried out to the L ord in their trouble; He delivered them out of their distresses.
Psalms,107,7,"He led them also by a straight way, To go to an inhabited city."
Psalms,107,8,"Let them give thanks to the L ord for His lovingkindness, And for His wonders to the sons of men!"
Psalms,107,9,"For He has satisfied the thirsty soul, And the hungry soul He has filled with what is good."
Psalms,107,10,"There were those who dwelt in darkness and in the shadow of death, Prisoners in misery and chains,"
Psalms,107,11,Because they had rebelled against the words of God And spurned the counsel of the Most High.
Psalms,107,12,Therefore He humbled their heart with labor; They stumbled and there was none to help.
Psalms,107,13,Then they cried out to the L ord in their trouble; He saved them out of their distresses.
Psalms,107,14,He brought them out of darkness and the shadow of death And broke their bands apart.
Psalms,107,15,"Let them give thanks to the L ord for His lovingkindness, And for His wonders to the sons of men!"
Psalms,107,16,For He has shattered gates of bronze And cut bars of iron asunder.
Psalms,107,17,"Fools, because of their rebellious way, And because of their iniquities, were afflicted."
Psalms,107,18,"Their soul abhorred all kinds of food, And they drew near to the gates of death."
Psalms,107,19,Then they cried out to the L ord in their trouble; He saved them out of their distresses.
Psalms,107,20,"He sent His word and healed them, And delivered them from their destructions."
Psalms,107,21,"Let them give thanks to the L ord for His lovingkindness, And for His wonders to the sons of men!"
Psalms,107,22,"Let them also offer sacrifices of thanksgiving, And tell of His works with joyful singing."
Psalms,107,23,"Those who go down to the sea in ships, Who do business on great waters;"
Psalms,107,24,"They have seen the works of the L ord, And His wonders in the deep."
Psalms,107,25,"For He spoke and raised up a stormy wind, Which lifted up the waves of the sea."
Psalms,107,26,"They rose up to the heavens, they went down to the depths; Their soul melted away in their misery."
Psalms,107,27,"They reeled and staggered like a drunken man, And were at their wits’ end."
Psalms,107,28,"Then they cried to the L ord in their trouble, And He brought them out of their distresses."
Psalms,107,29,"He caused the storm to be still, So that the waves of the sea were hushed."
Psalms,107,30,"Then they were glad because they were quiet, So He guided them to their desired haven."
Psalms,107,31,"Let them give thanks to the L ord for His lovingkindness, And for His wonders to the sons of men!"
Psalms,107,32,"Let them extol Him also in the congregation of the people, And praise Him at the seat of the elders."
Psalms,107,33,He changes rivers into a wilderness And springs of water into a thirsty ground;
Psalms,107,34,"A fruitful land into a salt waste, Because of the wickedness of those who dwell in it."
Psalms,107,35,He changes a wilderness into a pool of water And a dry land into springs of water;
Psalms,107,36,"And there He makes the hungry to dwell, So that they may establish an inhabited city,"
Psalms,107,37,"And sow fields and plant vineyards, And gather a fruitful harvest."
Psalms,107,38,"Also He blesses them and they multiply greatly, And He does not let their cattle decrease."
Psalms,107,39,"When they are diminished and bowed down Through oppression, misery and sorrow,"
Psalms,107,40,He pours contempt upon princes And makes them wander in a pathless waste.
Psalms,107,41,"But He sets the needy securely on high away from affliction, And makes his families like a flock."
Psalms,107,42,The upright see it and are glad; But all unrighteousness shuts its mouth.
Psalms,107,43,"Who is wise? Let him give heed to these things, And consider the lovingkindnesses of the L ord."
Psalms,108,1,"My heart is steadfast, O God; I will sing, I will sing praises, even with my soul."
Psalms,108,2,"Awake, harp and lyre; I will awaken the dawn!"
Psalms,108,3,"I will give thanks to You, O L ord , among the peoples, And I will sing praises to You among the nations."
Psalms,108,4,"For Your lovingkindness is great above the heavens, And Your truth reaches to the skies."
Psalms,108,5,"Be exalted, O God, above the heavens, And Your glory above all the earth."
Psalms,108,6,"That Your beloved may be delivered, Save with Your right hand, and answer me!"
Psalms,108,7,"God has spoken in His holiness: “I will exult, I will portion out Shechem And measure out the valley of Succoth."
Psalms,108,8,"Gilead is Mine, Manasseh is Mine; Ephraim also is the helmet of My head; Judah is My scepter."
Psalms,108,9,Moab is My washbowl; Over Edom I shall throw My shoe; Over Philistia I will shout aloud.”
Psalms,108,10,Who will bring me into the besieged city? Who will lead me to Edom?
Psalms,108,11,"Have not You Yourself, O God, rejected us? And will You not go forth with our armies, O God?"
Psalms,108,12,"Oh give us help against the adversary, For deliverance by man is in vain."
Psalms,108,13,"Through God we will do valiantly, And it is He who shall tread down our adversaries."
Psalms,109,1,"O God of my praise, Do not be silent!"
Psalms,109,2,For they have opened the wicked and deceitful mouth against me; They have spoken against me with a lying tongue.
Psalms,109,3,"They have also surrounded me with words of hatred, And fought against me without cause."
Psalms,109,4,In return for my love they act as my accusers; But I am in prayer.
Psalms,109,5,Thus they have repaid me evil for good And hatred for my love.
Psalms,109,6,"Appoint a wicked man over him, And let an accuser stand at his right hand."
Psalms,109,7,"When he is judged, let him come forth guilty, And let his prayer become sin."
Psalms,109,8,Let his days be few; Let another take his office.
Psalms,109,9,Let his children be fatherless And his wife a widow.
Psalms,109,10,Let his children wander about and beg; And let them seek sustenance far from their ruined homes.
Psalms,109,11,"Let the creditor seize all that he has, And let strangers plunder the product of his labor."
Psalms,109,12,"Let there be none to extend lovingkindness to him, Nor any to be gracious to his fatherless children."
Psalms,109,13,Let his posterity be cut off; In a following generation let their name be blotted out.
Psalms,109,14,"Let the iniquity of his fathers be remembered before the L ord, And do not let the sin of his mother be blotted out."
Psalms,109,15,"Let them be before the L ord continually, That He may cut off their memory from the earth;"
Psalms,109,16,"Because he did not remember to show lovingkindness, But persecuted the afflicted and needy man, And the despondent in heart, to put them to death."
Psalms,109,17,"He also loved cursing, so it came to him; And he did not delight in blessing, so it was far from him."
Psalms,109,18,"But he clothed himself with cursing as with his garment, And it entered into his body like water And like oil into his bones."
Psalms,109,19,"Let it be to him as a garment with which he covers himself, And for a belt with which he constantly girds himself."
Psalms,109,20,"Let this be the reward of my accusers from the L ord, And of those who speak evil against my soul."
Psalms,109,21,"But You, O G od , the Lord, deal kindly with me for Your name’s sake; Because Your lovingkindness is good, deliver me;"
Psalms,109,22,"For I am afflicted and needy, And my heart is wounded within me."
Psalms,109,23,I am passing like a shadow when it lengthens; I am shaken off like the locust.
Psalms,109,24,"My knees are weak from fasting, And my flesh has grown lean, without fatness."
Psalms,109,25,"I also have become a reproach to them; When they see me, they wag their head."
Psalms,109,26,"Help me, O L ord my God; Save me according to Your lovingkindness."
Psalms,109,27,"And let them know that this is Your hand; You, L ord , have done it."
Psalms,109,28,"Let them curse, but You bless; When they arise, they shall be ashamed, But Your servant shall be glad."
Psalms,109,29,"Let my accusers be clothed with dishonor, And let them cover themselves with their own shame as with a robe."
Psalms,109,30,With my mouth I will give thanks abundantly to the L ord; And in the midst of many I will praise Him.
Psalms,109,31,"For He stands at the right hand of the needy, To save him from those who judge his soul."
Psalms,110,1,The L ord says to my Lord: “Sit at My right hand Until I make Your enemies a footstool for Your feet.”
Psalms,110,2,"The L ord will stretch forth Your strong scepter from Zion, saying, “Rule in the midst of Your enemies.”"
Psalms,110,3,"Your people will volunteer freely in the day of Your power; In holy array, from the womb of the dawn, Your youth are to You as the dew."
Psalms,110,4,"The L ord has sworn and will not change His mind, “You are a priest forever According to the order of Melchizedek.”"
Psalms,110,5,The Lord is at Your right hand; He will shatter kings in the day of His wrath.
Psalms,110,6,"He will judge among the nations, He will fill them with corpses, He will shatter the chief men over a broad country."
Psalms,110,7,He will drink from the brook by the wayside; Therefore He will lift up His head.
Psalms,111,1,"Praise the L ord! I will give thanks to the L ord with all my heart, In the company of the upright and in the assembly."
Psalms,111,2,Great are the works of the L ord; They are studied by all who delight in them.
Psalms,111,3,"Splendid and majestic is His work, And His righteousness endures forever."
Psalms,111,4,He has made His wonders to be remembered; The L ord is gracious and compassionate.
Psalms,111,5,He has given food to those who fear Him; He will remember His covenant forever.
Psalms,111,6,"He has made known to His people the power of His works, In giving them the heritage of the nations."
Psalms,111,7,The works of His hands are truth and justice; All His precepts are sure.
Psalms,111,8,They are upheld forever and ever; They are performed in truth and uprightness.
Psalms,111,9,He has sent redemption to His people; He has ordained His covenant forever; Holy and awesome is His name.
Psalms,111,10,The fear of the L ord is the beginning of wisdom; A good understanding have all those who do His commandments; His praise endures forever.
Psalms,112,1,"Praise the L ord! How blessed is the man who fears the L ord, Who greatly delights in His commandments."
Psalms,112,2,His descendants will be mighty on earth; The generation of the upright will be blessed.
Psalms,112,3,"Wealth and riches are in his house, And his righteousness endures forever."
Psalms,112,4,Light arises in the darkness for the upright; He is gracious and compassionate and righteous.
Psalms,112,5,It is well with the man who is gracious and lends; He will maintain his cause in judgment.
Psalms,112,6,For he will never be shaken; The righteous will be remembered forever.
Psalms,112,7,"He will not fear evil tidings; His heart is steadfast, trusting in the L ord."
Psalms,112,8,"His heart is upheld, he will not fear, Until he looks with satisfaction on his adversaries."
Psalms,112,9,"He has given freely to the poor, His righteousness endures forever; His horn will be exalted in honor."
Psalms,112,10,"The wicked will see it and be vexed, He will gnash his teeth and melt away; The desire of the wicked will perish."
Psalms,113,1,"Praise the L ord! Praise, O servants of the L ord, Praise the name of the L ord."
Psalms,113,2,Blessed be the name of the L ord From this time forth and forever.
Psalms,113,3,From the rising of the sun to its setting The name of the L ord is to be praised.
Psalms,113,4,The L ord is high above all nations; His glory is above the heavens.
Psalms,113,5,"Who is like the L ord our God, Who is enthroned on high,"
Psalms,113,6,Who humbles Himself to behold The things that are in heaven and in the earth?
Psalms,113,7,"He raises the poor from the dust And lifts the needy from the ash heap,"
Psalms,113,8,"To make them sit with princes, With the princes of His people."
Psalms,113,9,He makes the barren woman abide in the house As a joyful mother of children. Praise the L ord!
Psalms,114,1,"When Israel went forth from Egypt, The house of Jacob from a people of strange language,"
Psalms,114,2,"Judah became His sanctuary, Israel, His dominion."
Psalms,114,3,The sea looked and fled; The Jordan turned back.
Psalms,114,4,"The mountains skipped like rams, The hills, like lambs."
Psalms,114,5,"What ails you, O sea, that you flee? O Jordan, that you turn back?"
Psalms,114,6,"O mountains, that you skip like rams? O hills, like lambs?"
Psalms,114,7,"Tremble, O earth, before the Lord, Before the God of Jacob,"
Psalms,114,8,"Who turned the rock into a pool of water, The flint into a fountain of water."
Psalms,115,1,"Not to us, O L ord , not to us, But to Your name give glory Because of Your lovingkindness, because of Your truth."
Psalms,115,2,"Why should the nations say, “Where, now, is their God?”"
Psalms,115,3,But our God is in the heavens; He does whatever He pleases.
Psalms,115,4,"Their idols are silver and gold, The work of man’s hands."
Psalms,115,5,"They have mouths, but they cannot speak; They have eyes, but they cannot see;"
Psalms,115,6,"They have ears, but they cannot hear; They have noses, but they cannot smell;"
Psalms,115,7,"They have hands, but they cannot feel; They have feet, but they cannot walk; They cannot make a sound with their throat."
Psalms,115,8,"Those who make them will become like them, Everyone who trusts in them."
Psalms,115,9,"O Israel, trust in the L ord; He is their help and their shield."
Psalms,115,10,"O house of Aaron, trust in the L ord; He is their help and their shield."
Psalms,115,11,"You who fear the L ord , trust in the L ord; He is their help and their shield."
Psalms,115,12,The L ord has been mindful of us; He will bless us; He will bless the house of Israel; He will bless the house of Aaron.
Psalms,115,13,"He will bless those who fear the L ord, The small together with the great."
Psalms,115,14,"May the L ord give you increase, You and your children."
Psalms,115,15,"May you be blessed of the L ord, Maker of heaven and earth."
Psalms,115,16,"The heavens are the heavens of the L ord, But the earth He has given to the sons of men."
Psalms,115,17,"The dead do not praise the L ord, Nor do any who go down into silence;"
Psalms,115,18,"But as for us, we will bless the L ord From this time forth and forever. Praise the L ord!"
Psalms,116,1,"I love the L ord , because He hears My voice and my supplications."
Psalms,116,2,"Because He has inclined His ear to me, Therefore I shall call upon Him as long as I live."
Psalms,116,3,The cords of death encompassed me And the terrors of Sheol came upon me; I found distress and sorrow.
Psalms,116,4,"Then I called upon the name of the L ord: “O L ord , I beseech You, save my life!”"
Psalms,116,5,"Gracious is the L ord , and righteous; Yes, our God is compassionate."
Psalms,116,6,"The L ord preserves the simple; I was brought low, and He saved me."
Psalms,116,7,"Return to your rest, O my soul, For the L ord has dealt bountifully with you."
Psalms,116,8,"For You have rescued my soul from death, My eyes from tears, My feet from stumbling."
Psalms,116,9,I shall walk before the L ord In the land of the living.
Psalms,116,10,"I believed when I said, “I am greatly afflicted.”"
Psalms,116,11,"I said in my alarm, “All men are liars.”"
Psalms,116,12,What shall I render to the L ord For all His benefits toward me?
Psalms,116,13,I shall lift up the cup of salvation And call upon the name of the L ord.
Psalms,116,14,"I shall pay my vows to the L ord, Oh may it be in the presence of all His people."
Psalms,116,15,Precious in the sight of the L ord Is the death of His godly ones.
Psalms,116,16,"O L ord , surely I am Your servant, I am Your servant, the son of Your handmaid, You have loosed my bonds."
Psalms,116,17,"To You I shall offer a sacrifice of thanksgiving, And call upon the name of the L ord."
Psalms,116,18,"I shall pay my vows to the L ord, Oh may it be in the presence of all His people,"
Psalms,116,19,"In the courts of the L ord ’ s house, In the midst of you, O Jerusalem. Praise the L ord!"
Psalms,117,1,"Praise the L ord , all nations; Laud Him, all peoples!"
Psalms,117,2,"For His lovingkindness is great toward us, And the truth of the L ord is everlasting. Praise the L ord!"
Psalms,118,1,"Give thanks to the L ord , for He is good; For His lovingkindness is everlasting."
Psalms,118,2,"Oh let Israel say, “His lovingkindness is everlasting.”"
Psalms,118,3,"Oh let the house of Aaron say, “His lovingkindness is everlasting.”"
Psalms,118,4,"Oh let those who fear the L ord say, “His lovingkindness is everlasting.”"
Psalms,118,5,From my distress I called upon the L ord; The L ord answered me and set me in a large place.
Psalms,118,6,The L ord is for me; I will not fear; What can man do to me?
Psalms,118,7,The L ord is for me among those who help me; Therefore I will look with satisfaction on those who hate me.
Psalms,118,8,It is better to take refuge in the L ord Than to trust in man.
Psalms,118,9,It is better to take refuge in the L ord Than to trust in princes.
Psalms,118,10,All nations surrounded me; In the name of the L ord I will surely cut them off.
Psalms,118,11,"They surrounded me, yes, they surrounded me; In the name of the L ord I will surely cut them off."
Psalms,118,12,They surrounded me like bees; They were extinguished as a fire of thorns; In the name of the L ord I will surely cut them off.
Psalms,118,13,"You pushed me violently so that I was falling, But the L ord helped me."
Psalms,118,14,"The L ord is my strength and song, And He has become my salvation."
Psalms,118,15,The sound of joyful shouting and salvation is in the tents of the righteous; The right hand of the L ord does valiantly.
Psalms,118,16,The right hand of the L ord is exalted; The right hand of the L ord does valiantly.
Psalms,118,17,"I will not die, but live, And tell of the works of the L ord."
Psalms,118,18,"The L ord has disciplined me severely, But He has not given me over to death."
Psalms,118,19,"Open to me the gates of righteousness; I shall enter through them, I shall give thanks to the L ord."
Psalms,118,20,This is the gate of the L ord; The righteous will enter through it.
Psalms,118,21,"I shall give thanks to You, for You have answered me, And You have become my salvation."
Psalms,118,22,The stone which the builders rejected Has become the chief corner stone.
Psalms,118,23,This is the L ord ’ s doing; It is marvelous in our eyes.
Psalms,118,24,This is the day which the L ord has made; Let us rejoice and be glad in it.
Psalms,118,25,"O L ord , do save, we beseech You; O L ord , we beseech You, do send prosperity!"
Psalms,118,26,Blessed is the one who comes in the name of the L ord; We have blessed you from the house of the L ord.
Psalms,118,27,"The L ord is God, and He has given us light; Bind the festival sacrifice with cords to the horns of the altar."
Psalms,118,28,"You are my God, and I give thanks to You; You are my God, I extol You."
Psalms,118,29,"Give thanks to the L ord , for He is good; For His lovingkindness is everlasting."
Psalms,119,1,"How blessed are those whose way is blameless, Who walk in the law of the L ord."
