Psalms,1,1,"How blessed is the man who does not walk in the counsel of the wicked, Nor stand in the path of sinners, Nor sit in the seat of scoffers!"
Psalms,1,2,"But his delight is in the law of the L ord, And in His law he meditates day and night."
Psalms,1,3,"He will be like a tree firmly planted by streams of water, Which yields its fruit in its season And its leaf does not wither; And in whatever he does, he prospers."
Psalms,1,4,"The wicked are not so, But they are like chaff which the wind drives away."
Psalms,1,5,"Therefore the wicked will not stand in the judgment, Nor sinners in the assembly of the righteous."
Psalms,1,6,"For the L ord knows the way of the righteous, But the way of the wicked will perish."
Psalms,2,1,Why are the nations in an uproar And the peoples devising a vain thing?
Psalms,2,2,"The kings of the earth take their stand And the rulers take counsel together Against the L ord and against His Anointed, saying,"
Psalms,2,3,“Let us tear their fetters apart And cast away their cords from us!”
Psalms,2,4,"He who sits in the heavens laughs, The Lord scoffs at them."
Psalms,2,5,"Then He will speak to them in His anger And terrify them in His fury, saying,"
Psalms,2,6,"“But as for Me, I have installed My King Upon Zion, My holy mountain.”"
Psalms,2,7,"“I will surely tell of the decree of the L ord: He said to Me, ‘You are My Son, Today I have begotten You."
Psalms,2,8,"Ask of Me, and I will surely give the nations as Your inheritance, And the very ends of the earth as Your possession."
Psalms,2,9,"You shall break them with a rod of iron, You shall shatter them like earthenware.’ ”"
Psalms,2,10,"Now therefore, O kings, show discernment; Take warning, O judges of the earth."
Psalms,2,11,Worship the L ord with reverence And rejoice with trembling.
Psalms,2,12,"Do homage to the Son, that He not become angry, and you perish in the way, For His wrath may soon be kindled. How blessed are all who take refuge in Him!"
Psalms,3,1,"O L ord , how my adversaries have increased! Many are rising up against me."
Psalms,3,2,"Many are saying of my soul, “There is no deliverance for him in God.” Selah."
Psalms,3,3,"But You, O L ord , are a shield about me, My glory, and the One who lifts my head."
Psalms,3,4,"I was crying to the L ord with my voice, And He answered me from His holy mountain. Selah."
Psalms,3,5,"I lay down and slept; I awoke, for the L ord sustains me."
Psalms,3,6,I will not be afraid of ten thousands of people Who have set themselves against me round about.
Psalms,3,7,"Arise, O L ord ; save me, O my God! For You have smitten all my enemies on the cheek; You have shattered the teeth of the wicked."
Psalms,3,8,Salvation belongs to the L ord; Your blessing be upon Your people! Selah.
Psalms,4,1,"Answer me when I call, O God of my righteousness! You have relieved me in my distress; Be gracious to me and hear my prayer."
Psalms,4,2,"O sons of men, how long will my honor become a reproach? How long will you love what is worthless and aim at deception? Selah."
Psalms,4,3,But know that the L ord has set apart the godly man for Himself; The L ord hears when I call to Him.
Psalms,4,4,"Tremble, and do not sin; Meditate in your heart upon your bed, and be still. Selah."
Psalms,4,5,"Offer the sacrifices of righteousness, And trust in the L ord."
Psalms,4,6,"Many are saying, “Who will show us any good?” Lift up the light of Your countenance upon us, O L ord!"
Psalms,4,7,"You have put gladness in my heart, More than when their grain and new wine abound."
Psalms,4,8,"In peace I will both lie down and sleep, For You alone, O L ord , make me to dwell in safety."
Psalms,5,1,"Give ear to my words, O L ord, Consider my groaning."
Psalms,5,2,"Heed the sound of my cry for help, my King and my God, For to You I pray."
Psalms,5,3,"In the morning, O L ord , You will hear my voice; In the morning I will order my prayer to You and eagerly watch."
Psalms,5,4,For You are not a God who takes pleasure in wickedness; No evil dwells with You.
Psalms,5,5,The boastful shall not stand before Your eyes; You hate all who do iniquity.
Psalms,5,6,You destroy those who speak falsehood; The L ord abhors the man of bloodshed and deceit.
Psalms,5,7,"But as for me, by Your abundant lovingkindness I will enter Your house, At Your holy temple I will bow in reverence for You."
Psalms,5,8,"O L ord , lead me in Your righteousness because of my foes; Make Your way straight before me."
Psalms,5,9,There is nothing reliable in what they say; Their inward part is destruction itself. Their throat is an open grave; They flatter with their tongue.
Psalms,5,10,"Hold them guilty, O God; By their own devices let them fall! In the multitude of their transgressions thrust them out, For they are rebellious against You."
Psalms,5,11,"But let all who take refuge in You be glad, Let them ever sing for joy; And may You shelter them, That those who love Your name may exult in You."
Psalms,5,12,"For it is You who blesses the righteous man, O L ord, You surround him with favor as with a shield."
Psalms,6,1,"O L ord , do not rebuke me in Your anger, Nor chasten me in Your wrath."
Psalms,6,2,"Be gracious to me, O L ord , for I am pining away; Heal me, O L ord , for my bones are dismayed."
Psalms,6,3,"And my soul is greatly dismayed; But You, O L ord —how long?"
Psalms,6,4,"Return, O L ord , rescue my soul; Save me because of Your lovingkindness."
Psalms,6,5,For there is no mention of You in death; In Sheol who will give You thanks?
Psalms,6,6,"I am weary with my sighing; Every night I make my bed swim, I dissolve my couch with my tears."
Psalms,6,7,My eye has wasted away with grief; It has become old because of all my adversaries.
Psalms,6,8,"Depart from me, all you who do iniquity, For the L ord has heard the voice of my weeping."
Psalms,6,9,"The L ord has heard my supplication, The L ord receives my prayer."
Psalms,6,10,"All my enemies will be ashamed and greatly dismayed; They shall turn back, they will suddenly be ashamed."
Psalms,7,1,"O L ord my God, in You I have taken refuge; Save me from all those who pursue me, and deliver me,"
Psalms,7,2,"Or he will tear my soul like a lion, Dragging me away, while there is none to deliver."
Psalms,7,3,"O L ord my God, if I have done this, If there is injustice in my hands,"
Psalms,7,4,"If I have rewarded evil to my friend, Or have plundered him who without cause was my adversary,"
Psalms,7,5,Let the enemy pursue my soul and overtake it; And let him trample my life down to the ground And lay my glory in the dust. Selah.
Psalms,7,6,"Arise, O L ord , in Your anger; Lift up Yourself against the rage of my adversaries, And arouse Yourself for me; You have appointed judgment."
Psalms,7,7,"Let the assembly of the peoples encompass You, And over them return on high."
Psalms,7,8,"The L ord judges the peoples; Vindicate me, O L ord , according to my righteousness and my integrity that is in me."
Psalms,7,9,"O let the evil of the wicked come to an end, but establish the righteous; For the righteous God tries the hearts and minds."
Psalms,7,10,"My shield is with God, Who saves the upright in heart."
Psalms,7,11,"God is a righteous judge, And a God who has indignation every day."
Psalms,7,12,"If a man does not repent, He will sharpen His sword; He has bent His bow and made it ready."
Psalms,7,13,He has also prepared for Himself deadly weapons; He makes His arrows fiery shafts.
Psalms,7,14,"Behold, he travails with wickedness, And he conceives mischief and brings forth falsehood."
Psalms,7,15,"He has dug a pit and hollowed it out, And has fallen into the hole which he made."
Psalms,7,16,"His mischief will return upon his own head, And his violence will descend upon his own pate."
Psalms,7,17,I will give thanks to the L ord according to His righteousness And will sing praise to the name of the L ord Most High.
Psalms,8,1,"O L ord , our Lord, How majestic is Your name in all the earth, Who have displayed Your splendor above the heavens!"
Psalms,8,2,"From the mouth of infants and nursing babes You have established strength Because of Your adversaries, To make the enemy and the revengeful cease."
Psalms,8,3,"When I consider Your heavens, the work of Your fingers, The moon and the stars, which You have ordained;"
Psalms,8,4,"What is man that You take thought of him, And the son of man that You care for him?"
Psalms,8,5,"Yet You have made him a little lower than God, And You crown him with glory and majesty!"
Psalms,8,6,"You make him to rule over the works of Your hands; You have put all things under his feet,"
Psalms,8,7,"All sheep and oxen, And also the beasts of the field,"
Psalms,8,8,"The birds of the heavens and the fish of the sea, Whatever passes through the paths of the seas."
Psalms,8,9,"O L ord , our Lord, How majestic is Your name in all the earth!"
Psalms,9,1,I will give thanks to the L ord with all my heart; I will tell of all Your wonders.
Psalms,9,2,"I will be glad and exult in You; I will sing praise to Your name, O Most High."
Psalms,9,3,"When my enemies turn back, They stumble and perish before You."
Psalms,9,4,For You have maintained my just cause; You have sat on the throne judging righteously.
Psalms,9,5,"You have rebuked the nations, You have destroyed the wicked; You have blotted out their name forever and ever."
Psalms,9,6,"The enemy has come to an end in perpetual ruins, And You have uprooted the cities; The very memory of them has perished."
Psalms,9,7,"But the L ord abides forever; He has established His throne for judgment,"
Psalms,9,8,And He will judge the world in righteousness; He will execute judgment for the peoples with equity.
Psalms,9,9,"The L ord also will be a stronghold for the oppressed, A stronghold in times of trouble;"
Psalms,9,10,"And those who know Your name will put their trust in You, For You, O L ord , have not forsaken those who seek You."
Psalms,9,11,"Sing praises to the L ord , who dwells in Zion; Declare among the peoples His deeds."
Psalms,9,12,For He who requires blood remembers them; He does not forget the cry of the afflicted.
Psalms,9,13,"Be gracious to me, O L ord; See my affliction from those who hate me, You who lift me up from the gates of death,"
Psalms,9,14,"That I may tell of all Your praises, That in the gates of the daughter of Zion I may rejoice in Your salvation."
Psalms,9,15,"The nations have sunk down in the pit which they have made; In the net which they hid, their own foot has been caught."
Psalms,9,16,The L ord has made Himself known; He has executed judgment. In the work of his own hands the wicked is snared. Higgaion Selah.
Psalms,9,17,"The wicked will return to Sheol, Even all the nations who forget God."
Psalms,9,18,"For the needy will not always be forgotten, Nor the hope of the afflicted perish forever."
Psalms,9,19,"Arise, O L ord , do not let man prevail; Let the nations be judged before You."
Psalms,9,20,"Put them in fear, O L ord; Let the nations know that they are but men. Selah."
Psalms,10,1,"Why do You stand afar off, O L ord? Why do You hide Yourself in times of trouble?"
Psalms,10,2,In pride the wicked hotly pursue the afflicted; Let them be caught in the plots which they have devised.
Psalms,10,3,"For the wicked boasts of his heart’s desire, And the greedy man curses and spurns the L ord."
Psalms,10,4,"The wicked, in the haughtiness of his countenance, does not seek Him. All his thoughts are, “There is no God.”"
Psalms,10,5,"His ways prosper at all times; Your judgments are on high, out of his sight; As for all his adversaries, he snorts at them."
Psalms,10,6,"He says to himself, “I will not be moved; Throughout all generations I will not be in adversity.”"
Psalms,10,7,His mouth is full of curses and deceit and oppression; Under his tongue is mischief and wickedness.
Psalms,10,8,He sits in the lurking places of the villages; In the hiding places he kills the innocent; His eyes stealthily watch for the unfortunate.
Psalms,10,9,He lurks in a hiding place as a lion in his lair; He lurks to catch the afflicted; He catches the afflicted when he draws him into his net.
Psalms,10,10,"He crouches, he bows down, And the unfortunate fall by his mighty ones."
Psalms,10,11,"He says to himself, “God has forgotten; He has hidden His face; He will never see it.”"
Psalms,10,12,"Arise, O L ord ; O God, lift up Your hand. Do not forget the afflicted."
Psalms,10,13,"Why has the wicked spurned God? He has said to himself, “You will not require it. ”"
Psalms,10,14,"You have seen it, for You have beheld mischief and vexation to take it into Your hand. The unfortunate commits himself to You; You have been the helper of the orphan."
Psalms,10,15,"Break the arm of the wicked and the evildoer, Seek out his wickedness until You find none."
Psalms,10,16,The L ord is King forever and ever; Nations have perished from His land.
Psalms,10,17,"O L ord , You have heard the desire of the humble; You will strengthen their heart, You will incline Your ear"
Psalms,10,18,"To vindicate the orphan and the oppressed, So that man who is of the earth will no longer cause terror."
Psalms,11,1,"In the L ord I take refuge; How can you say to my soul, “Flee as a bird to your mountain;"
Psalms,11,2,"For, behold, the wicked bend the bow, They make ready their arrow upon the string To shoot in darkness at the upright in heart."
Psalms,11,3,"If the foundations are destroyed, What can the righteous do?”"
Psalms,11,4,"The L ord is in His holy temple; the L ord ’ s throne is in heaven; His eyes behold, His eyelids test the sons of men."
Psalms,11,5,"The L ord tests the righteous and the wicked, And the one who loves violence His soul hates."
Psalms,11,6,Upon the wicked He will rain snares; Fire and brimstone and burning wind will be the portion of their cup.
Psalms,11,7,"For the L ord is righteous, He loves righteousness; The upright will behold His face."
Psalms,12,1,"Help, L ord , for the godly man ceases to be, For the faithful disappear from among the sons of men."
Psalms,12,2,They speak falsehood to one another; With flattering lips and with a double heart they speak.
Psalms,12,3,"May the L ord cut off all flattering lips, The tongue that speaks great things;"
Psalms,12,4,"Who have said, “With our tongue we will prevail; Our lips are our own; who is lord over us?”"
Psalms,12,5,"“Because of the devastation of the afflicted, because of the groaning of the needy, Now I will arise,” says the L ord ; “I will set him in the safety for which he longs.”"
Psalms,12,6,"The words of the L ord are pure words; As silver tried in a furnace on the earth, refined seven times."
Psalms,12,7,"You, O L ord , will keep them; You will preserve him from this generation forever."
Psalms,12,8,The wicked strut about on every side When vileness is exalted among the sons of men.
Psalms,13,1,"How long, O L ord ? Will You forget me forever? How long will You hide Your face from me?"
Psalms,13,2,"How long shall I take counsel in my soul, Having sorrow in my heart all the day? How long will my enemy be exalted over me?"
Psalms,13,3,"Consider and answer me, O L ord my God; Enlighten my eyes, or I will sleep the sleep of death,"
Psalms,13,4,"And my enemy will say, “I have overcome him,” And my adversaries will rejoice when I am shaken."
Psalms,13,5,But I have trusted in Your lovingkindness; My heart shall rejoice in Your salvation.
Psalms,13,6,"I will sing to the L ord, Because He has dealt bountifully with me."
Psalms,14,1,"The fool has said in his heart, “There is no God.” They are corrupt, they have committed abominable deeds; There is no one who does good."
Psalms,14,2,"The L ord has looked down from heaven upon the sons of men To see if there are any who understand, Who seek after God."
Psalms,14,3,"They have all turned aside, together they have become corrupt; There is no one who does good, not even one."
Psalms,14,4,"Do all the workers of wickedness not know, Who eat up my people as they eat bread, And do not call upon the L ord?"
Psalms,14,5,"There they are in great dread, For God is with the righteous generation."
Psalms,14,6,"You would put to shame the counsel of the afflicted, But the L ord is his refuge."
Psalms,14,7,"Oh, that the salvation of Israel would come out of Zion! When the L ord restores His captive people, Jacob will rejoice, Israel will be glad."
Psalms,15,1,"O L ord , who may abide in Your tent? Who may dwell on Your holy hill?"
Psalms,15,2,"He who walks with integrity, and works righteousness, And speaks truth in his heart."
Psalms,15,3,"He does not slander with his tongue, Nor does evil to his neighbor, Nor takes up a reproach against his friend;"
Psalms,15,4,"In whose eyes a reprobate is despised, But who honors those who fear the L ord; He swears to his own hurt and does not change;"
Psalms,15,5,"He does not put out his money at interest, Nor does he take a bribe against the innocent. He who does these things will never be shaken."
Psalms,16,1,"Preserve me, O God, for I take refuge in You."
Psalms,16,2,"I said to the L ord , “You are my Lord; I have no good besides You.”"
Psalms,16,3,"As for the saints who are in the earth, They are the majestic ones in whom is all my delight."
Psalms,16,4,"The sorrows of those who have bartered for another god will be multiplied; I shall not pour out their drink offerings of blood, Nor will I take their names upon my lips."
Psalms,16,5,The L ord is the portion of my inheritance and my cup; You support my lot.
Psalms,16,6,"The lines have fallen to me in pleasant places; Indeed, my heritage is beautiful to me."
Psalms,16,7,"I will bless the L ord who has counseled me; Indeed, my mind instructs me in the night."
Psalms,16,8,"I have set the L ord continually before me; Because He is at my right hand, I will not be shaken."
Psalms,16,9,Therefore my heart is glad and my glory rejoices; My flesh also will dwell securely.
Psalms,16,10,For You will not abandon my soul to Sheol; Nor will You allow Your Holy One to undergo decay.
Psalms,16,11,You will make known to me the path of life; In Your presence is fullness of joy; In Your right hand there are pleasures forever.
Psalms,17,1,"Hear a just cause, O L ord , give heed to my cry; Give ear to my prayer, which is not from deceitful lips."
Psalms,17,2,Let my judgment come forth from Your presence; Let Your eyes look with equity.
Psalms,17,3,You have tried my heart; You have visited me by night; You have tested me and You find nothing; I have purposed that my mouth will not transgress.
Psalms,17,4,"As for the deeds of men, by the word of Your lips I have kept from the paths of the violent."
Psalms,17,5,My steps have held fast to Your paths. My feet have not slipped.
Psalms,17,6,"I have called upon You, for You will answer me, O God; Incline Your ear to me, hear my speech."
Psalms,17,7,"Wondrously show Your lovingkindness, O Savior of those who take refuge at Your right hand From those who rise up against them."
Psalms,17,8,Keep me as the apple of the eye; Hide me in the shadow of Your wings
Psalms,17,9,"From the wicked who despoil me, My deadly enemies who surround me."
Psalms,17,10,"They have closed their unfeeling heart, With their mouth they speak proudly."
Psalms,17,11,They have now surrounded us in our steps; They set their eyes to cast us down to the ground.
Psalms,17,12,"He is like a lion that is eager to tear, And as a young lion lurking in hiding places."
Psalms,17,13,"Arise, O L ord , confront him, bring him low; Deliver my soul from the wicked with Your sword,"
Psalms,17,14,"From men with Your hand, O L ord, From men of the world, whose portion is in this life, And whose belly You fill with Your treasure; They are satisfied with children, And leave their abundance to their babes."
Psalms,17,15,"As for me, I shall behold Your face in righteousness; I will be satisfied with Your likeness when I awake."
Psalms,18,1,"“I love You, O L ord , my strength.”"
Psalms,18,2,"The L ord is my rock and my fortress and my deliverer, My God, my rock, in whom I take refuge; My shield and the horn of my salvation, my stronghold."
Psalms,18,3,"I call upon the L ord , who is worthy to be praised, And I am saved from my enemies."
Psalms,18,4,"The cords of death encompassed me, And the torrents of ungodliness terrified me."
Psalms,18,5,The cords of Sheol surrounded me; The snares of death confronted me.
Psalms,18,6,"In my distress I called upon the L ord, And cried to my God for help; He heard my voice out of His temple, And my cry for help before Him came into His ears."
Psalms,18,7,"Then the earth shook and quaked; And the foundations of the mountains were trembling And were shaken, because He was angry."
Psalms,18,8,"Smoke went up out of His nostrils, And fire from His mouth devoured; Coals were kindled by it."
Psalms,18,9,"He bowed the heavens also, and came down With thick darkness under His feet."
Psalms,18,10,He rode upon a cherub and flew; And He sped upon the wings of the wind.
Psalms,18,11,"He made darkness His hiding place, His canopy around Him, Darkness of waters, thick clouds of the skies."
Psalms,18,12,"From the brightness before Him passed His thick clouds, Hailstones and coals of fire."
Psalms,18,13,"The L ord also thundered in the heavens, And the Most High uttered His voice, Hailstones and coals of fire."
Psalms,18,14,"He sent out His arrows, and scattered them, And lightning flashes in abundance, and routed them."
Psalms,18,15,"Then the channels of water appeared, And the foundations of the world were laid bare At Your rebuke, O L ord, At the blast of the breath of Your nostrils."
Psalms,18,16,"He sent from on high, He took me; He drew me out of many waters."
Psalms,18,17,"He delivered me from my strong enemy, And from those who hated me, for they were too mighty for me."
Psalms,18,18,"They confronted me in the day of my calamity, But the L ord was my stay."
Psalms,18,19,"He brought me forth also into a broad place; He rescued me, because He delighted in me."
Psalms,18,20,The L ord has rewarded me according to my righteousness; According to the cleanness of my hands He has recompensed me.
Psalms,18,21,"For I have kept the ways of the L ord, And have not wickedly departed from my God."
Psalms,18,22,"For all His ordinances were before me, And I did not put away His statutes from me."
Psalms,18,23,"I was also blameless with Him, And I kept myself from my iniquity."
Psalms,18,24,"Therefore the L ord has recompensed me according to my righteousness, According to the cleanness of my hands in His eyes."
Psalms,18,25,With the kind You show Yourself kind; With the blameless You show Yourself blameless;
Psalms,18,26,"With the pure You show Yourself pure, And with the crooked You show Yourself astute."
Psalms,18,27,"For You save an afflicted people, But haughty eyes You abase."
Psalms,18,28,For You light my lamp; The L ord my God illumines my darkness.
Psalms,18,29,For by You I can run upon a troop; And by my God I can leap over a wall.
Psalms,18,30,"As for God, His way is blameless; The word of the L ord is tried; He is a shield to all who take refuge in Him."
Psalms,18,31,"For who is God, but the L ord? And who is a rock, except our God,"
Psalms,18,32,The God who girds me with strength And makes my way blameless?
Psalms,18,33,"He makes my feet like hinds’ feet, And sets me upon my high places."
Psalms,18,34,"He trains my hands for battle, So that my arms can bend a bow of bronze."
Psalms,18,35,"You have also given me the shield of Your salvation, And Your right hand upholds me; And Your gentleness makes me great."
Psalms,18,36,"You enlarge my steps under me, And my feet have not slipped."
Psalms,18,37,"I pursued my enemies and overtook them, And I did not turn back until they were consumed."
Psalms,18,38,"I shattered them, so that they were not able to rise; They fell under my feet."
Psalms,18,39,For You have girded me with strength for battle; You have subdued under me those who rose up against me.
Psalms,18,40,"You have also made my enemies turn their backs to me, And I destroyed those who hated me."
Psalms,18,41,"They cried for help, but there was none to save, Even to the L ord , but He did not answer them."
Psalms,18,42,Then I beat them fine as the dust before the wind; I emptied them out as the mire of the streets.
Psalms,18,43,You have delivered me from the contentions of the people; You have placed me as head of the nations; A people whom I have not known serve me.
Psalms,18,44,"As soon as they hear, they obey me; Foreigners submit to me."
Psalms,18,45,"Foreigners fade away, And come trembling out of their fortresses."
Psalms,18,46,"The L ord lives, and blessed be my rock; And exalted be the God of my salvation,"
Psalms,18,47,"The God who executes vengeance for me, And subdues peoples under me."
Psalms,18,48,He delivers me from my enemies; Surely You lift me above those who rise up against me; You rescue me from the violent man.
Psalms,18,49,"Therefore I will give thanks to You among the nations, O L ord, And I will sing praises to Your name."
Psalms,18,50,"He gives great deliverance to His king, And shows lovingkindness to His anointed, To David and his descendants forever."
Psalms,19,1,The heavens are telling of the glory of God; And their expanse is declaring the work of His hands.
Psalms,19,2,"Day to day pours forth speech, And night to night reveals knowledge."
Psalms,19,3,"There is no speech, nor are there words; Their voice is not heard."
Psalms,19,4,"Their line has gone out through all the earth, And their utterances to the end of the world. In them He has placed a tent for the sun,"
Psalms,19,5,Which is as a bridegroom coming out of his chamber; It rejoices as a strong man to run his course.
Psalms,19,6,"Its rising is from one end of the heavens, And its circuit to the other end of them; And there is nothing hidden from its heat."
Psalms,19,7,"The law of the L ord is perfect, restoring the soul; The testimony of the L ord is sure, making wise the simple."
