Psalms,35,7,For without cause they hid their net for me; Without cause they dug a pit for my soul.
Psalms,35,8,"Let destruction come upon him unawares, And let the net which he hid catch himself; Into that very destruction let him fall."
Psalms,35,9,And my soul shall rejoice in the L ord; It shall exult in His salvation.
Psalms,35,10,"All my bones will say, “L ord , who is like You, Who delivers the afflicted from him who is too strong for him, And the afflicted and the needy from him who robs him?”"
Psalms,35,11,Malicious witnesses rise up; They ask me of things that I do not know.
Psalms,35,12,"They repay me evil for good, To the bereavement of my soul."
Psalms,35,13,"But as for me, when they were sick, my clothing was sackcloth; I humbled my soul with fasting, And my prayer kept returning to my bosom."
Psalms,35,14,"I went about as though it were my friend or brother; I bowed down mourning, as one who sorrows for a mother."
Psalms,35,15,"But at my stumbling they rejoiced and gathered themselves together; The smiters whom I did not know gathered together against me, They slandered me without ceasing."
Psalms,35,16,"Like godless jesters at a feast, They gnashed at me with their teeth."
Psalms,35,17,"Lord, how long will You look on? Rescue my soul from their ravages, My only life from the lions."
Psalms,35,18,I will give You thanks in the great congregation; I will praise You among a mighty throng.
Psalms,35,19,Do not let those who are wrongfully my enemies rejoice over me; Nor let those who hate me without cause wink maliciously.
Psalms,35,20,"For they do not speak peace, But they devise deceitful words against those who are quiet in the land."
Psalms,35,21,"They opened their mouth wide against me; They said, “Aha, aha, our eyes have seen it!”"
Psalms,35,22,"You have seen it, O L ord , do not keep silent; O Lord, do not be far from me."
Psalms,35,23,"Stir up Yourself, and awake to my right And to my cause, my God and my Lord."
Psalms,35,24,"Judge me, O L ord my God, according to Your righteousness, And do not let them rejoice over me."
Psalms,35,25,"Do not let them say in their heart, “Aha, our desire!” Do not let them say, “We have swallowed him up!”"
Psalms,35,26,Let those be ashamed and humiliated altogether who rejoice at my distress; Let those be clothed with shame and dishonor who magnify themselves over me.
Psalms,35,27,"Let them shout for joy and rejoice, who favor my vindication; And let them say continually, “The L ord be magnified, Who delights in the prosperity of His servant.”"
Psalms,35,28,And my tongue shall declare Your righteousness And Your praise all day long.
Psalms,36,1,Transgression speaks to the ungodly within his heart; There is no fear of God before his eyes.
Psalms,36,2,For it flatters him in his own eyes Concerning the discovery of his iniquity and the hatred of it.
Psalms,36,3,The words of his mouth are wickedness and deceit; He has ceased to be wise and to do good.
Psalms,36,4,He plans wickedness upon his bed; He sets himself on a path that is not good; He does not despise evil.
Psalms,36,5,"Your lovingkindness, O L ord , extends to the heavens, Your faithfulness reaches to the skies."
Psalms,36,6,"Your righteousness is like the mountains of God; Your judgments are like a great deep. O L ord , You preserve man and beast."
Psalms,36,7,"How precious is Your lovingkindness, O God! And the children of men take refuge in the shadow of Your wings."
Psalms,36,8,They drink their fill of the abundance of Your house; And You give them to drink of the river of Your delights.
Psalms,36,9,For with You is the fountain of life; In Your light we see light.
Psalms,36,10,"O continue Your lovingkindness to those who know You, And Your righteousness to the upright in heart."
Psalms,36,11,"Let not the foot of pride come upon me, And let not the hand of the wicked drive me away."
Psalms,36,12,There the doers of iniquity have fallen; They have been thrust down and cannot rise.
Psalms,37,1,"Do not fret because of evildoers, Be not envious toward wrongdoers."
Psalms,37,2,For they will wither quickly like the grass And fade like the green herb.
Psalms,37,3,Trust in the L ord and do good; Dwell in the land and cultivate faithfulness.
Psalms,37,4,Delight yourself in the L ord; And He will give you the desires of your heart.
Psalms,37,5,"Commit your way to the L ord, Trust also in Him, and He will do it."
Psalms,37,6,He will bring forth your righteousness as the light And your judgment as the noonday.
Psalms,37,7," Rest in the L ord and wait patiently for Him; Do not fret because of him who prospers in his way, Because of the man who carries out wicked schemes."
Psalms,37,8,Cease from anger and forsake wrath; Do not fret; it leads only to evildoing.
Psalms,37,9,"For evildoers will be cut off, But those who wait for the L ord , they will inherit the land."
Psalms,37,10,Yet a little while and the wicked man will be no more; And you will look carefully for his place and he will not be there.
Psalms,37,11,But the humble will inherit the land And will delight themselves in abundant prosperity.
Psalms,37,12,The wicked plots against the righteous And gnashes at him with his teeth.
Psalms,37,13,"The Lord laughs at him, For He sees his day is coming."
Psalms,37,14,"The wicked have drawn the sword and bent their bow To cast down the afflicted and the needy, To slay those who are upright in conduct."
Psalms,37,15,"Their sword will enter their own heart, And their bows will be broken."
Psalms,37,16,Better is the little of the righteous Than the abundance of many wicked.
Psalms,37,17,"For the arms of the wicked will be broken, But the L ord sustains the righteous."
Psalms,37,18,"The L ord knows the days of the blameless, And their inheritance will be forever."
Psalms,37,19,"They will not be ashamed in the time of evil, And in the days of famine they will have abundance."
Psalms,37,20,"But the wicked will perish; And the enemies of the L ord will be like the glory of the pastures, They vanish—like smoke they vanish away."
Psalms,37,21,"The wicked borrows and does not pay back, But the righteous is gracious and gives."
Psalms,37,22,"For those blessed by Him will inherit the land, But those cursed by Him will be cut off."
Psalms,37,23,"The steps of a man are established by the L ord, And He delights in his way."
Psalms,37,24,"When he falls, he will not be hurled headlong, Because the L ord is the One who holds his hand."
Psalms,37,25,"I have been young and now I am old, Yet I have not seen the righteous forsaken Or his descendants begging bread."
Psalms,37,26,"All day long he is gracious and lends, And his descendants are a blessing."
Psalms,37,27,"Depart from evil and do good, So you will abide forever."
Psalms,37,28,"For the L ord loves justice And does not forsake His godly ones; They are preserved forever, But the descendants of the wicked will be cut off."
Psalms,37,29,The righteous will inherit the land And dwell in it forever.
Psalms,37,30,"The mouth of the righteous utters wisdom, And his tongue speaks justice."
Psalms,37,31,The law of his God is in his heart; His steps do not slip.
Psalms,37,32,The wicked spies upon the righteous And seeks to kill him.
Psalms,37,33,The L ord will not leave him in his hand Or let him be condemned when he is judged.
Psalms,37,34,"Wait for the L ord and keep His way, And He will exalt you to inherit the land; When the wicked are cut off, you will see it."
Psalms,37,35,"I have seen a wicked, violent man Spreading himself like a luxuriant tree in its native soil."
Psalms,37,36,"Then he passed away, and lo, he was no more; I sought for him, but he could not be found."
Psalms,37,37,"Mark the blameless man, and behold the upright; For the man of peace will have a posterity."
Psalms,37,38,But transgressors will be altogether destroyed; The posterity of the wicked will be cut off.
Psalms,37,39,But the salvation of the righteous is from the L ord; He is their strength in time of trouble.
Psalms,37,40,"The L ord helps them and delivers them; He delivers them from the wicked and saves them, Because they take refuge in Him."
Psalms,38,1,"O L ord , rebuke me not in Your wrath, And chasten me not in Your burning anger."
Psalms,38,2,"For Your arrows have sunk deep into me, And Your hand has pressed down on me."
Psalms,38,3,There is no soundness in my flesh because of Your indignation; There is no health in my bones because of my sin.
Psalms,38,4,For my iniquities are gone over my head; As a heavy burden they weigh too much for me.
Psalms,38,5,My wounds grow foul and fester Because of my folly.
Psalms,38,6,I am bent over and greatly bowed down; I go mourning all day long.
Psalms,38,7,"For my loins are filled with burning, And there is no soundness in my flesh."
Psalms,38,8,I am benumbed and badly crushed; I groan because of the agitation of my heart.
Psalms,38,9,"Lord, all my desire is before You; And my sighing is not hidden from You."
Psalms,38,10,"My heart throbs, my strength fails me; And the light of my eyes, even that has gone from me."
Psalms,38,11,My loved ones and my friends stand aloof from my plague; And my kinsmen stand afar off.
Psalms,38,12,"Those who seek my life lay snares for me; And those who seek to injure me have threatened destruction, And they devise treachery all day long."
Psalms,38,13,"But I, like a deaf man, do not hear; And I am like a mute man who does not open his mouth."
Psalms,38,14,"Yes, I am like a man who does not hear, And in whose mouth are no arguments."
Psalms,38,15,"For I hope in You, O L ord; You will answer, O Lord my God."
Psalms,38,16,"For I said, “May they not rejoice over me, Who, when my foot slips, would magnify themselves against me.”"
Psalms,38,17,"For I am ready to fall, And my sorrow is continually before me."
Psalms,38,18,For I confess my iniquity; I am full of anxiety because of my sin.
Psalms,38,19,"But my enemies are vigorous and strong, And many are those who hate me wrongfully."
Psalms,38,20,"And those who repay evil for good, They oppose me, because I follow what is good."
Psalms,38,21,"Do not forsake me, O L ord; O my God, do not be far from me!"
Psalms,38,22,"Make haste to help me, O Lord, my salvation!"
Psalms,39,1,"I said, “I will guard my ways That I may not sin with my tongue; I will guard my mouth as with a muzzle While the wicked are in my presence.”"
Psalms,39,2,"I was mute and silent, I refrained even from good, And my sorrow grew worse."
Psalms,39,3,"My heart was hot within me, While I was musing the fire burned; Then I spoke with my tongue:"
Psalms,39,4,"“L ord , make me to know my end And what is the extent of my days; Let me know how transient I am."
Psalms,39,5,"Behold, You have made my days as handbreadths, And my lifetime as nothing in Your sight; Surely every man at his best is a mere breath. Selah."
Psalms,39,6,Surely every man walks about as a phantom; Surely they make an uproar for nothing; He amasses riches and does not know who will gather them.
Psalms,39,7,"“And now, Lord, for what do I wait? My hope is in You."
Psalms,39,8,Deliver me from all my transgressions; Make me not the reproach of the foolish.
Psalms,39,9,"I have become mute, I do not open my mouth, Because it is You who have done it."
Psalms,39,10,Remove Your plague from me; Because of the opposition of Your hand I am perishing.
Psalms,39,11,With reproofs You chasten a man for iniquity; You consume as a moth what is precious to him; Surely every man is a mere breath. Selah.
Psalms,39,12,"“Hear my prayer, O L ord , and give ear to my cry; Do not be silent at my tears; For I am a stranger with You, A sojourner like all my fathers."
Psalms,39,13,"Turn Your gaze away from me, that I may smile again Before I depart and am no more.”"
Psalms,40,1,I waited patiently for the L ord; And He inclined to me and heard my cry.
Psalms,40,2,"He brought me up out of the pit of destruction, out of the miry clay, And He set my feet upon a rock making my footsteps firm."
Psalms,40,3,"He put a new song in my mouth, a song of praise to our God; Many will see and fear And will trust in the L ord."
Psalms,40,4,"How blessed is the man who has made the L ord his trust, And has not turned to the proud, nor to those who lapse into falsehood."
Psalms,40,5,"Many, O L ord my God, are the wonders which You have done, And Your thoughts toward us; There is none to compare with You. If I would declare and speak of them, They would be too numerous to count."
Psalms,40,6,Sacrifice and meal offering You have not desired; My ears You have opened; Burnt offering and sin offering You have not required.
Psalms,40,7,"Then I said, “Behold, I come; In the scroll of the book it is written of me."
Psalms,40,8,"I delight to do Your will, O my God; Your Law is within my heart.”"
Psalms,40,9,"I have proclaimed glad tidings of righteousness in the great congregation; Behold, I will not restrain my lips, O L ord , You know."
Psalms,40,10,I have not hidden Your righteousness within my heart; I have spoken of Your faithfulness and Your salvation; I have not concealed Your lovingkindness and Your truth from the great congregation.
Psalms,40,11,"You, O L ord , will not withhold Your compassion from me; Your lovingkindness and Your truth will continually preserve me."
Psalms,40,12,"For evils beyond number have surrounded me; My iniquities have overtaken me, so that I am not able to see; They are more numerous than the hairs of my head, And my heart has failed me."
Psalms,40,13,"Be pleased, O L ord , to deliver me; Make haste, O L ord , to help me."
Psalms,40,14,Let those be ashamed and humiliated together Who seek my life to destroy it; Let those be turned back and dishonored Who delight in my hurt.
Psalms,40,15,"Let those be appalled because of their shame Who say to me, “Aha, aha!”"
Psalms,40,16,"Let all who seek You rejoice and be glad in You; Let those who love Your salvation say continually, “The L ord be magnified!”"
Psalms,40,17,"Since I am afflicted and needy, Let the Lord be mindful of me. You are my help and my deliverer; Do not delay, O my God."
Psalms,41,1,How blessed is he who considers the helpless; The L ord will deliver him in a day of trouble.
Psalms,41,2,"The L ord will protect him and keep him alive, And he shall be called blessed upon the earth; And do not give him over to the desire of his enemies."
Psalms,41,3,"The L ord will sustain him upon his sickbed; In his illness, You restore him to health."
Psalms,41,4,"As for me, I said, “O L ord , be gracious to me; Heal my soul, for I have sinned against You.”"
Psalms,41,5,"My enemies speak evil against me, “When will he die, and his name perish?”"
Psalms,41,6,"And when he comes to see me, he speaks falsehood; His heart gathers wickedness to itself; When he goes outside, he tells it."
Psalms,41,7,"All who hate me whisper together against me; Against me they devise my hurt, saying,"
Psalms,41,8,"“A wicked thing is poured out upon him, That when he lies down, he will not rise up again.”"
Psalms,41,9,"Even my close friend in whom I trusted, Who ate my bread, Has lifted up his heel against me."
Psalms,41,10,"But You, O L ord , be gracious to me and raise me up, That I may repay them."
Psalms,41,11,"By this I know that You are pleased with me, Because my enemy does not shout in triumph over me."
Psalms,41,12,"As for me, You uphold me in my integrity, And You set me in Your presence forever."
Psalms,41,13,"Blessed be the L ord , the God of Israel, From everlasting to everlasting. Amen and Amen."
Psalms,42,1,"As the deer pants for the water brooks, So my soul pants for You, O God."
Psalms,42,2,"My soul thirsts for God, for the living God; When shall I come and appear before God?"
Psalms,42,3,"My tears have been my food day and night, While they say to me all day long, “Where is your God?”"
Psalms,42,4,"These things I remember and I pour out my soul within me. For I used to go along with the throng and lead them in procession to the house of God, With the voice of joy and thanksgiving, a multitude keeping festival."
Psalms,42,5,"Why are you in despair, O my soul? And why have you become disturbed within me? Hope in God, for I shall again praise Him For the help of His presence."
Psalms,42,6,"O my God, my soul is in despair within me; Therefore I remember You from the land of the Jordan And the peaks of Hermon, from Mount Mizar."
Psalms,42,7,Deep calls to deep at the sound of Your waterfalls; All Your breakers and Your waves have rolled over me.
Psalms,42,8,"The L ord will command His lovingkindness in the daytime; And His song will be with me in the night, A prayer to the God of my life."
Psalms,42,9,"I will say to God my rock, “Why have You forgotten me? Why do I go mourning because of the oppression of the enemy?”"
Psalms,42,10,"As a shattering of my bones, my adversaries revile me, While they say to me all day long, “Where is your God?”"
Psalms,42,11,"Why are you in despair, O my soul? And why have you become disturbed within me? Hope in God, for I shall yet praise Him, The help of my countenance and my God."
Psalms,43,1,"Vindicate me, O God, and plead my case against an ungodly nation; O deliver me from the deceitful and unjust man!"
Psalms,43,2,For You are the God of my strength; why have You rejected me? Why do I go mourning because of the oppression of the enemy?
Psalms,43,3,"O send out Your light and Your truth, let them lead me; Let them bring me to Your holy hill And to Your dwelling places."
Psalms,43,4,"Then I will go to the altar of God, To God my exceeding joy; And upon the lyre I shall praise You, O God, my God."
Psalms,43,5,"Why are you in despair, O my soul? And why are you disturbed within me? Hope in God, for I shall again praise Him, The help of my countenance and my God."
Psalms,44,1,"O God, we have heard with our ears, Our fathers have told us The work that You did in their days, In the days of old."
Psalms,44,2,"You with Your own hand drove out the nations; Then You planted them; You afflicted the peoples, Then You spread them abroad."
Psalms,44,3,"For by their own sword they did not possess the land, And their own arm did not save them, But Your right hand and Your arm and the light of Your presence, For You favored them."
Psalms,44,4,"You are my King, O God; Command victories for Jacob."
Psalms,44,5,Through You we will push back our adversaries; Through Your name we will trample down those who rise up against us.
Psalms,44,6,"For I will not trust in my bow, Nor will my sword save me."
Psalms,44,7,"But You have saved us from our adversaries, And You have put to shame those who hate us."
Psalms,44,8,"In God we have boasted all day long, And we will give thanks to Your name forever. Selah."
Psalms,44,9,"Yet You have rejected us and brought us to dishonor, And do not go out with our armies."
Psalms,44,10,You cause us to turn back from the adversary; And those who hate us have taken spoil for themselves.
Psalms,44,11,You give us as sheep to be eaten And have scattered us among the nations.
Psalms,44,12,"You sell Your people cheaply, And have not profited by their sale."
Psalms,44,13,"You make us a reproach to our neighbors, A scoffing and a derision to those around us."
Psalms,44,14,"You make us a byword among the nations, A laughingstock among the peoples."
Psalms,44,15,"All day long my dishonor is before me And my humiliation has overwhelmed me,"
Psalms,44,16,"Because of the voice of him who reproaches and reviles, Because of the presence of the enemy and the avenger."
Psalms,44,17,"All this has come upon us, but we have not forgotten You, And we have not dealt falsely with Your covenant."
Psalms,44,18,"Our heart has not turned back, And our steps have not deviated from Your way,"
Psalms,44,19,Yet You have crushed us in a place of jackals And covered us with the shadow of death.
Psalms,44,20,"If we had forgotten the name of our God Or extended our hands to a strange god,"
Psalms,44,21,Would not God find this out? For He knows the secrets of the heart.
Psalms,44,22,But for Your sake we are killed all day long; We are considered as sheep to be slaughtered.
Psalms,44,23,"Arouse Yourself, why do You sleep, O Lord? Awake, do not reject us forever."
Psalms,44,24,Why do You hide Your face And forget our affliction and our oppression?
Psalms,44,25,For our soul has sunk down into the dust; Our body cleaves to the earth.
Psalms,44,26,"Rise up, be our help, And redeem us for the sake of Your lovingkindness."
Psalms,45,1,My heart overflows with a good theme; I address my verses to the King; My tongue is the pen of a ready writer.
Psalms,45,2,You are fairer than the sons of men; Grace is poured upon Your lips; Therefore God has blessed You forever.
Psalms,45,3,"Gird Your sword on Your thigh, O Mighty One, In Your splendor and Your majesty!"
Psalms,45,4,"And in Your majesty ride on victoriously, For the cause of truth and meekness and righteousness; Let Your right hand teach You awesome things."
Psalms,45,5,Your arrows are sharp; The peoples fall under You; Your arrows are in the heart of the King’s enemies.
Psalms,45,6,"Your throne, O God, is forever and ever; A scepter of uprightness is the scepter of Your kingdom."
Psalms,45,7,"You have loved righteousness and hated wickedness; Therefore God, Your God, has anointed You With the oil of joy above Your fellows."
Psalms,45,8,All Your garments are fragrant with myrrh and aloes and cassia; Out of ivory palaces stringed instruments have made You glad.
Psalms,45,9,Kings’ daughters are among Your noble ladies; At Your right hand stands the queen in gold from Ophir.
Psalms,45,10,"Listen, O daughter, give attention and incline your ear: Forget your people and your father’s house;"
Psalms,45,11,"Then the King will desire your beauty. Because He is your Lord, bow down to Him."
Psalms,45,12,The daughter of Tyre will come with a gift; The rich among the people will seek your favor.
Psalms,45,13,The King’s daughter is all glorious within; Her clothing is interwoven with gold.
Psalms,45,14,"She will be led to the King in embroidered work; The virgins, her companions who follow her, Will be brought to You."
Psalms,45,15,They will be led forth with gladness and rejoicing; They will enter into the King’s palace.
Psalms,45,16,In place of your fathers will be your sons; You shall make them princes in all the earth.
Psalms,45,17,I will cause Your name to be remembered in all generations; Therefore the peoples will give You thanks forever and ever.
Psalms,46,1,"God is our refuge and strength, A very present help in trouble."
Psalms,46,2,"Therefore we will not fear, though the earth should change And though the mountains slip into the heart of the sea;"
Psalms,46,3,"Though its waters roar and foam, Though the mountains quake at its swelling pride. Selah."
Psalms,46,4,"There is a river whose streams make glad the city of God, The holy dwelling places of the Most High."
Psalms,46,5,"God is in the midst of her, she will not be moved; God will help her when morning dawns."
Psalms,46,6,"The nations made an uproar, the kingdoms tottered; He raised His voice, the earth melted."
Psalms,46,7,The L ord of hosts is with us; The God of Jacob is our stronghold. Selah.
Psalms,46,8,"Come, behold the works of the L ord, Who has wrought desolations in the earth."
Psalms,46,9,He makes wars to cease to the end of the earth; He breaks the bow and cuts the spear in two; He burns the chariots with fire.
Psalms,46,10,"“Cease striving and know that I am God; I will be exalted among the nations, I will be exalted in the earth.”"
Psalms,46,11,The L ord of hosts is with us; The God of Jacob is our stronghold. Selah.
Psalms,47,1,"O clap your hands, all peoples; Shout to God with the voice of joy."
Psalms,47,2,"For the L ord Most High is to be feared, A great King over all the earth."
Psalms,47,3,He subdues peoples under us And nations under our feet.
Psalms,47,4,"He chooses our inheritance for us, The glory of Jacob whom He loves. Selah."
Psalms,47,5,"God has ascended with a shout, The L ord , with the sound of a trumpet."
Psalms,47,6,"Sing praises to God, sing praises; Sing praises to our King, sing praises."
Psalms,47,7,For God is the King of all the earth; Sing praises with a skillful psalm.
Psalms,47,8,"God reigns over the nations, God sits on His holy throne."
Psalms,47,9,"The princes of the people have assembled themselves as the people of the God of Abraham, For the shields of the earth belong to God; He is highly exalted."
Psalms,48,1,"Great is the L ord , and greatly to be praised, In the city of our God, His holy mountain."
Psalms,48,2,"Beautiful in elevation, the joy of the whole earth, Is Mount Zion in the far north, The city of the great King."
Psalms,48,3,"God, in her palaces, Has made Himself known as a stronghold."
Psalms,48,4,"For, lo, the kings assembled themselves, They passed by together."
Psalms,48,5,"They saw it, then they were amazed; They were terrified, they fled in alarm."
Psalms,48,6,"Panic seized them there, Anguish, as of a woman in childbirth."
Psalms,48,7,With the east wind You break the ships of Tarshish.
Psalms,48,8,"As we have heard, so have we seen In the city of the L ord of hosts, in the city of our God; God will establish her forever. Selah."
Psalms,48,9,"We have thought on Your lovingkindness, O God, In the midst of Your temple."
Psalms,48,10,"As is Your name, O God, So is Your praise to the ends of the earth; Your right hand is full of righteousness."
Psalms,48,11,"Let Mount Zion be glad, Let the daughters of Judah rejoice Because of Your judgments."
Psalms,48,12,Walk about Zion and go around her; Count her towers;
Psalms,48,13,"Consider her ramparts; Go through her palaces, That you may tell it to the next generation."
Psalms,48,14,"For such is God, Our God forever and ever; He will guide us until death."
Psalms,49,1,"Hear this, all peoples; Give ear, all inhabitants of the world,"
Psalms,49,2,"Both low and high, Rich and poor together."
