Psalms,66,17,"I cried to Him with my mouth, And He was extolled with my tongue."
Psalms,66,18,"If I regard wickedness in my heart, The Lord will not hear;"
Psalms,66,19,But certainly God has heard; He has given heed to the voice of my prayer.
Psalms,66,20,"Blessed be God, Who has not turned away my prayer Nor His lovingkindness from me."
Psalms,67,1,"God be gracious to us and bless us, And cause His face to shine upon us— Selah."
Psalms,67,2,"That Your way may be known on the earth, Your salvation among all nations."
Psalms,67,3,"Let the peoples praise You, O God; Let all the peoples praise You."
Psalms,67,4,Let the nations be glad and sing for joy; For You will judge the peoples with uprightness And guide the nations on the earth. Selah.
Psalms,67,5,"Let the peoples praise You, O God; Let all the peoples praise You."
Psalms,67,6,"The earth has yielded its produce; God, our God, blesses us."
Psalms,67,7,"God blesses us, That all the ends of the earth may fear Him."
Psalms,68,1,"Let God arise, let His enemies be scattered, And let those who hate Him flee before Him."
Psalms,68,2,"As smoke is driven away, so drive them away; As wax melts before the fire, So let the wicked perish before God."
Psalms,68,3,"But let the righteous be glad; let them exult before God; Yes, let them rejoice with gladness."
Psalms,68,4,"Sing to God, sing praises to His name; Lift up a song for Him who rides through the deserts, Whose name is the L ord , and exult before Him."
Psalms,68,5,"A father of the fatherless and a judge for the widows, Is God in His holy habitation."
Psalms,68,6,"God makes a home for the lonely; He leads out the prisoners into prosperity, Only the rebellious dwell in a parched land."
Psalms,68,7,"O God, when You went forth before Your people, When You marched through the wilderness, Selah."
Psalms,68,8,"The earth quaked; The heavens also dropped rain at the presence of God; Sinai itself quaked at the presence of God, the God of Israel."
Psalms,68,9,"You shed abroad a plentiful rain, O God; You confirmed Your inheritance when it was parched."
Psalms,68,10,"Your creatures settled in it; You provided in Your goodness for the poor, O God."
Psalms,68,11,The Lord gives the command; The women who proclaim the good tidings are a great host:
Psalms,68,12,"“Kings of armies flee, they flee, And she who remains at home will divide the spoil!”"
Psalms,68,13," When you lie down among the sheepfolds, You are like the wings of a dove covered with silver, And its pinions with glistening gold."
Psalms,68,14,"When the Almighty scattered the kings there, It was snowing in Zalmon."
Psalms,68,15,A mountain of God is the mountain of Bashan; A mountain of many peaks is the mountain of Bashan.
Psalms,68,16,"Why do you look with envy, O mountains with many peaks, At the mountain which God has desired for His abode? Surely the L ord will dwell there forever."
Psalms,68,17,"The chariots of God are myriads, thousands upon thousands; The Lord is among them as at Sinai, in holiness."
Psalms,68,18,"You have ascended on high, You have led captive Your captives; You have received gifts among men, Even among the rebellious also, that the L ord God may dwell there."
Psalms,68,19,"Blessed be the Lord, who daily bears our burden, The God who is our salvation. Selah."
Psalms,68,20,God is to us a God of deliverances; And to G od the Lord belong escapes from death.
Psalms,68,21,"Surely God will shatter the head of His enemies, The hairy crown of him who goes on in his guilty deeds."
Psalms,68,22,"The Lord said, “I will bring them back from Bashan. I will bring them back from the depths of the sea;"
Psalms,68,23,"That your foot may shatter them in blood, The tongue of your dogs may have its portion from your enemies.”"
Psalms,68,24,"They have seen Your procession, O God, The procession of my God, my King, into the sanctuary."
Psalms,68,25,"The singers went on, the musicians after them, In the midst of the maidens beating tambourines."
Psalms,68,26,"Bless God in the congregations, Even the L ord, you who are of the fountain of Israel."
Psalms,68,27,"There is Benjamin, the youngest, ruling them, The princes of Judah in their throng, The princes of Zebulun, the princes of Naphtali."
Psalms,68,28,"Your God has commanded your strength; Show Yourself strong, O God, who have acted on our behalf."
Psalms,68,29,Because of Your temple at Jerusalem Kings will bring gifts to You.
Psalms,68,30,"Rebuke the beasts in the reeds, The herd of bulls with the calves of the peoples, Trampling under foot the pieces of silver; He has scattered the peoples who delight in war."
Psalms,68,31,Envoys will come out of Egypt; Ethiopia will quickly stretch out her hands to God.
Psalms,68,32,"Sing to God, O kingdoms of the earth, Sing praises to the Lord, Selah."
Psalms,68,33,"To Him who rides upon the highest heavens, which are from ancient times; Behold, He speaks forth with His voice, a mighty voice."
Psalms,68,34,Ascribe strength to God; His majesty is over Israel And His strength is in the skies.
Psalms,68,35,"O God, You are awesome from Your sanctuary. The God of Israel Himself gives strength and power to the people. Blessed be God!"
Psalms,69,1,"Save me, O God, For the waters have threatened my life."
Psalms,69,2,"I have sunk in deep mire, and there is no foothold; I have come into deep waters, and a flood overflows me."
Psalms,69,3,I am weary with my crying; my throat is parched; My eyes fail while I wait for my God.
Psalms,69,4,"Those who hate me without a cause are more than the hairs of my head; Those who would destroy me are powerful, being wrongfully my enemies; What I did not steal, I then have to restore."
Psalms,69,5,"O God, it is You who knows my folly, And my wrongs are not hidden from You."
Psalms,69,6,"May those who wait for You not be ashamed through me, O Lord G od of hosts; May those who seek You not be dishonored through me, O God of Israel,"
Psalms,69,7,Because for Your sake I have borne reproach; Dishonor has covered my face.
Psalms,69,8,I have become estranged from my brothers And an alien to my mother’s sons.
Psalms,69,9,"For zeal for Your house has consumed me, And the reproaches of those who reproach You have fallen on me."
Psalms,69,10,"When I wept in my soul with fasting, It became my reproach."
Psalms,69,11,"When I made sackcloth my clothing, I became a byword to them."
Psalms,69,12,"Those who sit in the gate talk about me, And I am the song of the drunkards."
Psalms,69,13,"But as for me, my prayer is to You, O L ord , at an acceptable time; O God, in the greatness of Your lovingkindness, Answer me with Your saving truth."
Psalms,69,14,Deliver me from the mire and do not let me sink; May I be delivered from my foes and from the deep waters.
Psalms,69,15,"May the flood of water not overflow me Nor the deep swallow me up, Nor the pit shut its mouth on me."
Psalms,69,16,"Answer me, O L ord , for Your lovingkindness is good; According to the greatness of Your compassion, turn to me,"
Psalms,69,17,"And do not hide Your face from Your servant, For I am in distress; answer me quickly."
Psalms,69,18,Oh draw near to my soul and redeem it; Ransom me because of my enemies!
Psalms,69,19,You know my reproach and my shame and my dishonor; All my adversaries are before You.
Psalms,69,20,"Reproach has broken my heart and I am so sick. And I looked for sympathy, but there was none, And for comforters, but I found none."
Psalms,69,21,They also gave me gall for my food And for my thirst they gave me vinegar to drink.
Psalms,69,22,"May their table before them become a snare; And when they are in peace, may it become a trap."
Psalms,69,23,"May their eyes grow dim so that they cannot see, And make their loins shake continually."
Psalms,69,24,"Pour out Your indignation on them, And may Your burning anger overtake them."
Psalms,69,25,May their camp be desolate; May none dwell in their tents.
Psalms,69,26,"For they have persecuted him whom You Yourself have smitten, And they tell of the pain of those whom You have wounded."
Psalms,69,27,"Add iniquity to their iniquity, And may they not come into Your righteousness."
Psalms,69,28,May they be blotted out of the book of life And may they not be recorded with the righteous.
Psalms,69,29,"But I am afflicted and in pain; May Your salvation, O God, set me securely on high."
Psalms,69,30,I will praise the name of God with song And magnify Him with thanksgiving.
Psalms,69,31,And it will please the L ord better than an ox Or a young bull with horns and hoofs.
Psalms,69,32,"The humble have seen it and are glad; You who seek God, let your heart revive."
Psalms,69,33,For the L ord hears the needy And does not despise His who are prisoners.
Psalms,69,34,"Let heaven and earth praise Him, The seas and everything that moves in them."
Psalms,69,35,"For God will save Zion and build the cities of Judah, That they may dwell there and possess it."
Psalms,69,36,"The descendants of His servants will inherit it, And those who love His name will dwell in it."
Psalms,70,1,"O God, hasten to deliver me; O L ord , hasten to my help!"
Psalms,70,2,Let those be ashamed and humiliated Who seek my life; Let those be turned back and dishonored Who delight in my hurt.
Psalms,70,3,"Let those be turned back because of their shame Who say, “Aha, aha!”"
Psalms,70,4,"Let all who seek You rejoice and be glad in You; And let those who love Your salvation say continually, “Let God be magnified.”"
Psalms,70,5,"But I am afflicted and needy; Hasten to me, O God! You are my help and my deliverer; O L ord , do not delay."
Psalms,71,1,"In You, O L ord , I have taken refuge; Let me never be ashamed."
Psalms,71,2,In Your righteousness deliver me and rescue me; Incline Your ear to me and save me.
Psalms,71,3,"Be to me a rock of habitation to which I may continually come; You have given commandment to save me, For You are my rock and my fortress."
Psalms,71,4,"Rescue me, O my God, out of the hand of the wicked, Out of the grasp of the wrongdoer and ruthless man,"
Psalms,71,5,"For You are my hope; O Lord G od, You are my confidence from my youth."
Psalms,71,6,By You I have been sustained from my birth; You are He who took me from my mother’s womb; My praise is continually of You.
Psalms,71,7,"I have become a marvel to many, For You are my strong refuge."
Psalms,71,8,My mouth is filled with Your praise And with Your glory all day long.
Psalms,71,9,Do not cast me off in the time of old age; Do not forsake me when my strength fails.
Psalms,71,10,"For my enemies have spoken against me; And those who watch for my life have consulted together,"
Psalms,71,11,"Saying, “God has forsaken him; Pursue and seize him, for there is no one to deliver.”"
Psalms,71,12,"O God, do not be far from me; O my God, hasten to my help!"
Psalms,71,13,"Let those who are adversaries of my soul be ashamed and consumed; Let them be covered with reproach and dishonor, who seek to injure me."
Psalms,71,14,"But as for me, I will hope continually, And will praise You yet more and more."
Psalms,71,15,My mouth shall tell of Your righteousness And of Your salvation all day long; For I do not know the sum of them.
Psalms,71,16,"I will come with the mighty deeds of the Lord G od; I will make mention of Your righteousness, Yours alone."
Psalms,71,17,"O God, You have taught me from my youth, And I still declare Your wondrous deeds."
Psalms,71,18,"And even when I am old and gray, O God, do not forsake me, Until I declare Your strength to this generation, Your power to all who are to come."
Psalms,71,19,"For Your righteousness, O God, reaches to the heavens, You who have done great things; O God, who is like You?"
Psalms,71,20,"You who have shown me many troubles and distresses Will revive me again, And will bring me up again from the depths of the earth."
Psalms,71,21,May You increase my greatness And turn to comfort me.
Psalms,71,22,"I will also praise You with a harp, Even Your truth, O my God; To You I will sing praises with the lyre, O Holy One of Israel."
Psalms,71,23,"My lips will shout for joy when I sing praises to You; And my soul, which You have redeemed."
Psalms,71,24,"My tongue also will utter Your righteousness all day long; For they are ashamed, for they are humiliated who seek my hurt."
Psalms,72,1,"Give the king Your judgments, O God, And Your righteousness to the king’s son."
Psalms,72,2,May he judge Your people with righteousness And Your afflicted with justice.
Psalms,72,3,"Let the mountains bring peace to the people, And the hills, in righteousness."
Psalms,72,4,"May he vindicate the afflicted of the people, Save the children of the needy And crush the oppressor."
Psalms,72,5,"Let them fear You while the sun endures, And as long as the moon, throughout all generations."
Psalms,72,6,"May he come down like rain upon the mown grass, Like showers that water the earth."
Psalms,72,7,"In his days may the righteous flourish, And abundance of peace till the moon is no more."
Psalms,72,8,May he also rule from sea to sea And from the River to the ends of the earth.
Psalms,72,9,"Let the nomads of the desert bow before him, And his enemies lick the dust."
Psalms,72,10,Let the kings of Tarshish and of the islands bring presents; The kings of Sheba and Seba offer gifts.
Psalms,72,11,"And let all kings bow down before him, All nations serve him."
Psalms,72,12,"For he will deliver the needy when he cries for help, The afflicted also, and him who has no helper."
Psalms,72,13,"He will have compassion on the poor and needy, And the lives of the needy he will save."
Psalms,72,14,"He will rescue their life from oppression and violence, And their blood will be precious in his sight;"
Psalms,72,15,"So may he live, and may the gold of Sheba be given to him; And let them pray for him continually; Let them bless him all day long."
Psalms,72,16,May there be abundance of grain in the earth on top of the mountains; Its fruit will wave like the cedars of Lebanon; And may those from the city flourish like vegetation of the earth.
Psalms,72,17,May his name endure forever; May his name increase as long as the sun shines; And let men bless themselves by him; Let all nations call him blessed.
Psalms,72,18,"Blessed be the L ord God, the God of Israel, Who alone works wonders."
Psalms,72,19,"And blessed be His glorious name forever; And may the whole earth be filled with His glory. Amen, and Amen."
Psalms,72,20,The prayers of David the son of Jesse are ended.
Psalms,73,1,"Surely God is good to Israel, To those who are pure in heart!"
Psalms,73,2,"But as for me, my feet came close to stumbling, My steps had almost slipped."
Psalms,73,3,For I was envious of the arrogant As I saw the prosperity of the wicked.
Psalms,73,4,"For there are no pains in their death, And their body is fat."
Psalms,73,5,"They are not in trouble as other men, Nor are they plagued like mankind."
Psalms,73,6,Therefore pride is their necklace; The garment of violence covers them.
Psalms,73,7,Their eye bulges from fatness; The imaginations of their heart run riot.
Psalms,73,8,They mock and wickedly speak of oppression; They speak from on high.
Psalms,73,9,"They have set their mouth against the heavens, And their tongue parades through the earth."
Psalms,73,10,"Therefore his people return to this place, And waters of abundance are drunk by them."
Psalms,73,11,"They say, “How does God know? And is there knowledge with the Most High?”"
Psalms,73,12,"Behold, these are the wicked; And always at ease, they have increased in wealth."
Psalms,73,13,Surely in vain I have kept my heart pure And washed my hands in innocence;
Psalms,73,14,For I have been stricken all day long And chastened every morning.
Psalms,73,15,"If I had said, “I will speak thus,” Behold, I would have betrayed the generation of Your children."
Psalms,73,16,"When I pondered to understand this, It was troublesome in my sight"
Psalms,73,17,Until I came into the sanctuary of God; Then I perceived their end.
Psalms,73,18,Surely You set them in slippery places; You cast them down to destruction.
Psalms,73,19,How they are destroyed in a moment! They are utterly swept away by sudden terrors!
Psalms,73,20,"Like a dream when one awakes, O Lord, when aroused, You will despise their form."
Psalms,73,21,"When my heart was embittered And I was pierced within,"
Psalms,73,22,Then I was senseless and ignorant; I was like a beast before You.
Psalms,73,23,Nevertheless I am continually with You; You have taken hold of my right hand.
Psalms,73,24,"With Your counsel You will guide me, And afterward receive me to glory."
Psalms,73,25,"Whom have I in heaven but You? And besides You, I desire nothing on earth."
Psalms,73,26,"My flesh and my heart may fail, But God is the strength of my heart and my portion forever."
Psalms,73,27,"For, behold, those who are far from You will perish; You have destroyed all those who are unfaithful to You."
Psalms,73,28,"But as for me, the nearness of God is my good; I have made the Lord G od my refuge, That I may tell of all Your works."
Psalms,74,1,"O God, why have You rejected us forever? Why does Your anger smoke against the sheep of Your pasture?"
Psalms,74,2,"Remember Your congregation, which You have purchased of old, Which You have redeemed to be the tribe of Your inheritance; And this Mount Zion, where You have dwelt."
Psalms,74,3,Turn Your footsteps toward the perpetual ruins; The enemy has damaged everything within the sanctuary.
Psalms,74,4,Your adversaries have roared in the midst of Your meeting place; They have set up their own standards for signs.
Psalms,74,5,It seems as if one had lifted up His axe in a forest of trees.
Psalms,74,6,And now all its carved work They smash with hatchet and hammers.
Psalms,74,7,They have burned Your sanctuary to the ground; They have defiled the dwelling place of Your name.
Psalms,74,8,"They said in their heart, “Let us completely subdue them.” They have burned all the meeting places of God in the land."
Psalms,74,9,"We do not see our signs; There is no longer any prophet, Nor is there any among us who knows how long."
Psalms,74,10,"How long, O God, will the adversary revile, And the enemy spurn Your name forever?"
Psalms,74,11,"Why do You withdraw Your hand, even Your right hand? From within Your bosom, destroy them!"
Psalms,74,12,"Yet God is my king from of old, Who works deeds of deliverance in the midst of the earth."
Psalms,74,13, You divided the sea by Your strength; You broke the heads of the sea monsters in the waters.
Psalms,74,14,You crushed the heads of Leviathan; You gave him as food for the creatures of the wilderness.
Psalms,74,15,You broke open springs and torrents; You dried up ever-flowing streams.
Psalms,74,16,"Yours is the day, Yours also is the night; You have prepared the light and the sun."
Psalms,74,17,You have established all the boundaries of the earth; You have made summer and winter.
Psalms,74,18,"Remember this, O L ord , that the enemy has reviled, And a foolish people has spurned Your name."
Psalms,74,19,Do not deliver the soul of Your turtledove to the wild beast; Do not forget the life of Your afflicted forever.
Psalms,74,20,Consider the covenant; For the dark places of the land are full of the habitations of violence.
Psalms,74,21,Let not the oppressed return dishonored; Let the afflicted and needy praise Your name.
Psalms,74,22,"Arise, O God, and plead Your own cause; Remember how the foolish man reproaches You all day long."
Psalms,74,23,"Do not forget the voice of Your adversaries, The uproar of those who rise against You which ascends continually."
Psalms,75,1,"We give thanks to You, O God, we give thanks, For Your name is near; Men declare Your wondrous works."
Psalms,75,2,"“When I select an appointed time, It is I who judge with equity."
Psalms,75,3,The earth and all who dwell in it melt; It is I who have firmly set its pillars. Selah.
Psalms,75,4,"I said to the boastful, ‘Do not boast,’ And to the wicked, ‘Do not lift up the horn;"
Psalms,75,5,"Do not lift up your horn on high, Do not speak with insolent pride.’ ”"
Psalms,75,6,"For not from the east, nor from the west, Nor from the desert comes exaltation;"
Psalms,75,7,But God is the Judge; He puts down one and exalts another.
Psalms,75,8,"For a cup is in the hand of the L ord , and the wine foams; It is well mixed, and He pours out of this; Surely all the wicked of the earth must drain and drink down its dregs."
Psalms,75,9,"But as for me, I will declare it forever; I will sing praises to the God of Jacob."
Psalms,75,10,"And all the horns of the wicked He will cut off, But the horns of the righteous will be lifted up."
Psalms,76,1,God is known in Judah; His name is great in Israel.
Psalms,76,2,His tabernacle is in Salem; His dwelling place also is in Zion.
Psalms,76,3,"There He broke the flaming arrows, The shield and the sword and the weapons of war. Selah."
Psalms,76,4,"You are resplendent, More majestic than the mountains of prey."
Psalms,76,5,"The stouthearted were plundered, They sank into sleep; And none of the warriors could use his hands."
Psalms,76,6,"At Your rebuke, O God of Jacob, Both rider and horse were cast into a dead sleep."
Psalms,76,7,"You, even You, are to be feared; And who may stand in Your presence when once You are angry?"
Psalms,76,8,You caused judgment to be heard from heaven; The earth feared and was still
Psalms,76,9,"When God arose to judgment, To save all the humble of the earth. Selah."
Psalms,76,10,For the wrath of man shall praise You; With a remnant of wrath You will gird Yourself.
Psalms,76,11,Make vows to the L ord your God and fulfill them; Let all who are around Him bring gifts to Him who is to be feared.
Psalms,76,12,He will cut off the spirit of princes; He is feared by the kings of the earth.
Psalms,77,1,"My voice rises to God, and I will cry aloud; My voice rises to God, and He will hear me."
Psalms,77,2,In the day of my trouble I sought the Lord; In the night my hand was stretched out without weariness; My soul refused to be comforted.
Psalms,77,3," When I remember God, then I am disturbed; When I sigh, then my spirit grows faint. Selah."
Psalms,77,4,You have held my eyelids open; I am so troubled that I cannot speak.
Psalms,77,5,"I have considered the days of old, The years of long ago."
Psalms,77,6,"I will remember my song in the night; I will meditate with my heart, And my spirit ponders:"
Psalms,77,7,Will the Lord reject forever? And will He never be favorable again?
Psalms,77,8,Has His lovingkindness ceased forever? Has His promise come to an end forever?
Psalms,77,9,"Has God forgotten to be gracious, Or has He in anger withdrawn His compassion? Selah."
Psalms,77,10,"Then I said, “It is my grief, That the right hand of the Most High has changed.”"
Psalms,77,11,I shall remember the deeds of the L ord; Surely I will remember Your wonders of old.
Psalms,77,12,I will meditate on all Your work And muse on Your deeds.
Psalms,77,13,"Your way, O God, is holy; What god is great like our God?"
Psalms,77,14,You are the God who works wonders; You have made known Your strength among the peoples.
Psalms,77,15,"You have by Your power redeemed Your people, The sons of Jacob and Joseph. Selah."
Psalms,77,16,"The waters saw You, O God; The waters saw You, they were in anguish; The deeps also trembled."
Psalms,77,17,The clouds poured out water; The skies gave forth a sound; Your arrows flashed here and there.
Psalms,77,18,The sound of Your thunder was in the whirlwind; The lightnings lit up the world; The earth trembled and shook.
Psalms,77,19,"Your way was in the sea And Your paths in the mighty waters, And Your footprints may not be known."
Psalms,77,20,You led Your people like a flock By the hand of Moses and Aaron.
Psalms,78,1,"Listen, O my people, to my instruction; Incline your ears to the words of my mouth."
Psalms,78,2,"I will open my mouth in a parable; I will utter dark sayings of old,"
Psalms,78,3,"Which we have heard and known, And our fathers have told us."
Psalms,78,4,"We will not conceal them from their children, But tell to the generation to come the praises of the L ord, And His strength and His wondrous works that He has done."
Psalms,78,5,"For He established a testimony in Jacob And appointed a law in Israel, Which He commanded our fathers That they should teach them to their children,"
Psalms,78,6,"That the generation to come might know, even the children yet to be born, That they may arise and tell them to their children,"
Psalms,78,7,"That they should put their confidence in God And not forget the works of God, But keep His commandments,"
Psalms,78,8,"And not be like their fathers, A stubborn and rebellious generation, A generation that did not prepare its heart And whose spirit was not faithful to God."
Psalms,78,9,"The sons of Ephraim were archers equipped with bows, Yet they turned back in the day of battle."
Psalms,78,10,They did not keep the covenant of God And refused to walk in His law;
Psalms,78,11,They forgot His deeds And His miracles that He had shown them.
Psalms,78,12,"He wrought wonders before their fathers In the land of Egypt, in the field of Zoan."
Psalms,78,13,"He divided the sea and caused them to pass through, And He made the waters stand up like a heap."
Psalms,78,14,Then He led them with the cloud by day And all the night with a light of fire.
Psalms,78,15,He split the rocks in the wilderness And gave them abundant drink like the ocean depths.
Psalms,78,16,He brought forth streams also from the rock And caused waters to run down like rivers.
Psalms,78,17,"Yet they still continued to sin against Him, To rebel against the Most High in the desert."
Psalms,78,18,And in their heart they put God to the test By asking food according to their desire.
Psalms,78,19,"Then they spoke against God; They said, “Can God prepare a table in the wilderness?"
Psalms,78,20,"Behold, He struck the rock so that waters gushed out, And streams were overflowing; Can He give bread also? Will He provide meat for His people?”"
