Matthew,1,1,"This book is the record of Jesus the Messiah, the son of David, the son of Abraham, beginning with the family line"
Matthew,1,2,Abraham was the father of Isaac; and Isaac the father of Jacob; and Jacob the father of Judah and his brothers
Matthew,1,3,and Judah the father of Perez and Zerah (their mother was Tamar); and Perez the father of Hezron; and Hezron the father of Ram
Matthew,1,4,and Ram the father of Amminadab; and Amminadab the father of Nahshon; and Nahshon the father of Salmon
Matthew,1,5,and Salmon the father of Boaz (his mother was Rahab); and Boaz the father of Obed (his mother was Ruth); and Obed the father of Jesse
Matthew,1,6,and Jesse the father of King David. David was the father of Solomon (his mother had been Uriah's wife)
Matthew,1,7,and Solomon the father of Rehoboam; and Rehoboam the father of Abijah; and Abijah the father of Asa
Matthew,1,8,and Asa the father of Jehoshaphat; and Jehoshaphat the father of Jehoram; and Jehoram the father of Uzziah
Matthew,1,9,and Uzziah the father of Jotham; and Jotham the father of Ahaz; and Ahaz the father of Hezekiah
Matthew,1,10,and Hezekiah the father of Manasseh; and Manasseh the father of Amon; and Amon the father of Josiah
Matthew,1,11,"and Josiah the father of Jehoiachin and his brothers, at the time of the exile to Babylon."
Matthew,1,12,"After the exile to Babylon, Jehoiachin was the father of Shealtiel; and Shealtiel the father of Zerubbabel"
Matthew,1,13,and Zerubbabel the father of Abiud; and Abiud the father of Eliakim; and Eliakim the father of Azor
Matthew,1,14,and Azor the father of Zadok; and Zadok the father of Akim; and Akim the father of Eliud
Matthew,1,15,and Eliud the father of Eleazar; and Eleazar the father of Matthan; and Matthan the father of Jacob
Matthew,1,16,"and Jacob was the father of Joseph, who was the husband of Mary, to whom Jesus was born, the one who is called the Messiah."
Matthew,1,17,"So all the generations from Abraham to David add up to fourteen; from David to the Babylonian exile, fourteen; and from the Babylonian exile to the Messiah, fourteen."
Matthew,1,18,"This is how the birth of Jesus the Messiah happened. His mother, Mary, was engaged to Joseph, but before they slept together she became pregnant by the Holy Spirit."
Matthew,1,19,"Joseph, her fiancé, was a good man and didn't want to shame her publicly, so he decided to break the engagement discreetly."
Matthew,1,20,"While he was thinking about all of this, an angel of the Lord appeared to him in a dream and told him, “Joseph, son of David, don't be afraid to marry Mary because she is pregnant by the Holy Spirit."
Matthew,1,21,"She will give birth to a son and you shall call him Jesus, for he will save people from their sins.”"
Matthew,1,22,(Now this all happened to fulfill what the Lord said through the prophet
Matthew,1,23,"“A virgin will become pregnant, and will give birth to a son. They will call him Immanuel,” which means “God with us.”)"
Matthew,1,24,Joseph woke up and did what the angel of the Lord told him to do.
Matthew,1,25,"Joseph married Mary, but did not sleep with her until after she had given birth to a son, whom he named Jesus."
Matthew,2,1,"After Jesus was born in Bethlehem in Judea during the reign of King Herod, wise men came from the east to Jerusalem."
Matthew,2,2,“Where is the King of the Jews who has been born?” they asked. “We saw his star in the east and we've come to worship him.”
Matthew,2,3,"When King Herod heard about it, he was very disturbed, and the whole of Jerusalem with him."
Matthew,2,4,"Herod summoned all the chief priests and religious teachers of the people, and asked them where the Messiah was supposed to be born."
Matthew,2,5,"“Bethlehem in Judea,” they told him, “for that's what the prophet wrote"
Matthew,2,6,"‘Bethlehem in the land of Judea, you are certainly not the least important of Judah's leading cities, for a leader will come from you who will be the shepherd for my people Israel.’”"
Matthew,2,7,Then Herod called the wise men and met with them in private and found out from them exactly when the star appeared.
Matthew,2,8,"He sent them to Bethlehem, telling them, “When you get there, search for the child. Once you find him let me know so that I can come and worship him too.”"
Matthew,2,9,"After they had heard what the king had to say they went on their way, and the star which they had seen in the east led them until it stopped right above the place where the child was."
Matthew,2,10,When they saw the star they couldn't contain their happiness!
Matthew,2,11,"They went into the house and saw the child with Mary his mother. They bowed and worshiped him. Then they opened their bags of treasure and presented him with gifts of gold, frankincense, and myrrh."
Matthew,2,12,"Warned by a dream not to return to Herod, they left for their own country by a different route."
Matthew,2,13,"After they'd left, an angel of the Lord appeared to Joseph in a dream, and told him, “Get up, and take the child and his mother, and flee to Egypt. Remain there until I tell you, because Herod is going to search for the child to kill him.”"
Matthew,2,14,"So Joseph got up and took the boy and his mother, and left during the night for Egypt."
Matthew,2,15,"They stayed there until Herod's death. This fulfilled what the Lord said through the prophet, “I called my son out of Egypt.”"
Matthew,2,16,"When Herod realized he'd been fooled by the wise men, he got very angry. He sent men to kill all the young boys in Bethlehem and the regions nearby who were two years old and under. This was based on the time frame he'd discovered from the wise men."
Matthew,2,17,In this way Jeremiah's prophecy was fulfilled
Matthew,2,18,"“The sound of terrible weeping and mourning was heard in Rama, Rachel crying for her children. They are dead, and she can't be comforted.”"
Matthew,2,19,"After Herod died the angel of the Lord appeared in a dream to Joseph in Egypt, and told him"
Matthew,2,20,"“Get up! Take the child and his mother, and return to the land of Israel, because those who were trying to kill the child are dead.”"
Matthew,2,21,"So Joseph got up and took the boy and his mother, and returned to the land of Israel."
Matthew,2,22,"But Joseph was afraid to go there after he learned that Archelaus had succeeded his father Herod as king of Judea. Warned in a dream, Joseph went to the Galilee area"
Matthew,2,23,"and settled down in Nazareth. This fulfilled what the prophets had said, “He will be called a Nazarene.”"
Matthew,3,1,"Some time later John the Baptist appeared on the scene, proclaiming in the Judean desert"
Matthew,3,2,"“Repent, for the kingdom of heaven has arrived!”"
Matthew,3,3,"He was the one Isaiah spoke about when he said, “A voice is heard crying out in the desert, ‘Prepare the way of the Lord. Make the paths straight for him.’”"
Matthew,3,4,"John had clothes made of camel hair, with a leather belt around his waist. His food was locusts and wild honey."
Matthew,3,5,"People came to him from Jerusalem, all of Judea, and the entire Jordan region"
Matthew,3,6,"and were baptized in the Jordan River, publicly admitting their sins."
Matthew,3,7,"But when John saw many of the Pharisees and Sadducees coming to be baptized, he said to them, “You vipers' brood! Who warned you to run away from the coming judgment?"
Matthew,3,8,Show by what you do that you have truly repented
Matthew,3,9,"and don't presume to say proudly to yourselves, ‘Abraham is our father.’ I tell you that God could make children of Abraham from these stones."
Matthew,3,10,In fact the ax is ready to chop down the trees. Every tree that doesn't produce good fruit will be chopped down and thrown into the fire.
Matthew,3,11,"Yes, I baptize you in water to show repentance, but after me is coming one who is greater than I am. I'm not worthy even to remove his sandals. He will baptize you with the Holy Spirit and with fire."
Matthew,3,12,"He has his winnowing tool ready in his hand. He will clean up the threshing floor and gather the wheat into the storehouse, but he will burn the chaff with fire that can't be put out.”"
Matthew,3,13,Then Jesus came from Galilee to the Jordan River to be baptized by John.
Matthew,3,14,"But John tried to change his mind. He told Jesus, “I need to be baptized by you, and you come to me to baptize you?”"
Matthew,3,15,"“Please do so, because it's good for us to do what God says is right,” Jesus told him. So John agreed to do it."
Matthew,3,16,"Immediately after he was baptized, Jesus came out of the water. The heavens were opened, and he saw God's Spirit like a dove descending, landing on him."
Matthew,3,17,"A voice from heaven said, “This is my son whom I love, who pleases me.”"
Matthew,4,1,Then Jesus was led by the Spirit into the desert to be tempted by the devil.
Matthew,4,2,"After fasting forty days and nights, he was hungry."
Matthew,4,3,"The tempter came and said to him, “If you really are the Son of God, order these stones to turn into bread.”"
Matthew,4,4,"Jesus answered, “As Scripture says, ‘Human beings do not live by only eating bread, but by every word that comes from the mouth of God.’”"
Matthew,4,5,Then the devil took him to the holy city and placed him on the top of the Temple.
Matthew,4,6,"“If you really are the son of God, then throw yourself off,” he told Jesus. “As Scripture says, ‘He will order his angels to save you from harm. They will catch you so that you won't fall by tripping over a stone.’”"
Matthew,4,7,"Jesus answered, “As Scripture also says, ‘You shall not tempt the Lord your God.’”"
Matthew,4,8,Then the devil took Jesus to a very high mountain and showed him all the kingdoms of the world in all their glory.
Matthew,4,9,"He said to Jesus, “I will give you all these if you fall down on your knees and worship me.”"
Matthew,4,10,"“Go away, Satan!” said Jesus. “As Scripture says, ‘You shall worship the Lord your God and serve him, and him alone.’”"
Matthew,4,11,"Then the devil left him, and angels came to care for him."
Matthew,4,12,"When Jesus heard that John had been arrested, he returned to Galilee."
Matthew,4,13,"Leaving Nazareth, he came to stay in Capernaum, on the shores of the sea in the regions of Zebulun and Naphthali."
Matthew,4,14,This fulfilled what Isaiah the prophet said
Matthew,4,15,"“In the land of Zebulun and the land of Naphthali, on the road to the sea, across the Jordan River, in Galilee where the foreigners live"
Matthew,4,16,The people living in darkness saw a great light; the light of dawn has shined on those living in the land of the shadow of death.”
Matthew,4,17,"From that time on Jesus began declaring his message, saying, “Repent, for the kingdom of heaven has arrived!”"
Matthew,4,18,"As he was walking by the Sea of Galilee Jesus saw two brothers. Simon, also called Peter, and his brother Andrew, were casting a net in the sea. They made their living by catching fish."
Matthew,4,19,"“Come and follow me, and I will teach you how to catch people,” he told them."
Matthew,4,20,They left their nets immediately and followed him.
Matthew,4,21,"Continuing on he saw two other brothers, James and John. They were in a boat with their father Zebedee, mending their nets. He called them to follow him."
Matthew,4,22,"They left the boat and their father immediately, and followed him."
Matthew,4,23,"Jesus traveled throughout Galilee, teaching in the synagogues, telling the good news of the kingdom, and healing all the diseases and illnesses the people had."
Matthew,4,24,"News about him spread throughout the province of Syria. They brought everyone who was sick to him: people troubled by seizures, the demon-possessed, those who were mentally ill, people who were paralyzed, and he healed all of them."
Matthew,4,25,"Large crowds followed him from Galilee, Decapolis, Jerusalem, Judea, and the region beyond Jordan."
Matthew,5,1,When Jesus saw the crowds following him he went up a mountain. There he sat down together with his disciples.
Matthew,5,2,"He began teaching them, saying"
Matthew,5,3,"“Blessed are those who recognize they are spiritually poor, for the kingdom of heaven is theirs."
Matthew,5,4,"Blessed are those who mourn, for they shall be comforted."
Matthew,5,5,Blessed are those who are kind for they will own the whole world.
Matthew,5,6,"Blessed are those whose greatest desire is to do what is right, for they will be satisfied."
Matthew,5,7,"Blessed are those who are merciful, for they will be shown mercy."
Matthew,5,8,"Blessed are those who have pure minds, for they will see God."
Matthew,5,9,"Blessed are those who work to bring peace, for they will be called children of God."
Matthew,5,10,"Blessed are those persecuted for what is right, for the kingdom of heaven is theirs."
Matthew,5,11,"Blessed are you when people insult you and persecute you, and accuse you of all kinds of evil things because of me."
Matthew,5,12,"Be glad, be really glad, for you will receive a great reward in heaven—for they persecuted the prophets who came before you in just the same way."
Matthew,5,13,"You are the salt of the earth, but if the salt becomes tasteless, how can you make it salty again? It's good for nothing, so it's thrown out and trodden down."
Matthew,5,14,You are the light of the world. A city built on a hill can't be hidden.
Matthew,5,15,"No one lights a lamp and then puts it under a bucket. No, it's placed on a lamp-stand and it provides light to everyone in the house."
Matthew,5,16,In the same way you should let your light shine before everyone so they can see the good things you do and praise your heavenly Father.
Matthew,5,17,"Don't think I came to abolish the law or the writings of the prophets. I didn't come to abolish them, but to fulfill them."
Matthew,5,18,"I assure you, until heaven and earth come to an end, not a single letter, not a single dot of the law will come to an end before everything is fulfilled."
Matthew,5,19,"So whoever disregards the least important commandment, and teaches people to do so, will be called the least in the kingdom of heaven; but whoever practices and teaches the commandments will be called great in the kingdom of heaven."
Matthew,5,20,"I tell you, unless your moral rightness is more than that of the religious teachers and the Pharisees, you can never enter the kingdom of heaven."
Matthew,5,21,"You've heard that the law said to the people of long ago: ‘You shall not murder, and anyone who commits murder will be condemned as guilty.’"
Matthew,5,22,"But I tell you, anyone who is angry with his brother will be condemned as guilty. Whoever calls his brother an idiot has to answer to the council, but whoever verbally abuses others is liable to the fire of Gehenna."
Matthew,5,23,"If you're at the altar making an offering, and remember that your brother has something against you"
Matthew,5,24,"leave your offering on the altar and go and make peace with him first, and afterwards come back and make your offering."
Matthew,5,25,"While you're on the way to court with your opponent, make sure you settle things quickly. Otherwise your opponent might hand you over to the judge, and the judge will hand you over to the court official, and you will be thrown into jail."
Matthew,5,26,I tell you the truth: you won't get out of there until you've paid every last penny.
Matthew,5,27,"You've heard that the law said, ‘Don't commit adultery.’"
Matthew,5,28,But I tell you that everyone who looks lustfully at a woman has already committed adultery with her in his mind.
Matthew,5,29,"If your right eye leads you to sin, then tear it out and throw it away, because it's better to lose one part of your body than to have your whole body thrown into the fire of Gehenna."
Matthew,5,30,"If your right hand leads you to sin, then cut it off and throw it away, for it's better for you to lose one of your limbs than for your whole body to go into the fire of Gehenna."
Matthew,5,31,"The law also said, ‘If a man divorces his wife, he should give her a certificate of divorce.’"
Matthew,5,32,"But I tell you that any man who divorces his wife except for sexual immorality causes her to commit adultery, and whoever marries a divorced woman commits adultery."
Matthew,5,33,"And again, you've heard that the law said to the people of long ago, ‘You shall not perjure yourself. Instead make sure you keep the oaths you swear to the Lord.’"
Matthew,5,34,"But I tell you, don't swear at all. Don't swear by heaven, because it's the throne of God."
Matthew,5,35,"Don't swear by the earth, because it's God's footstool. Don't swear by Jerusalem, because it's the city of the great King."
Matthew,5,36,"Don't even swear by your head, because you're not able to make a single hair white or black."
Matthew,5,37,Simply say yes or no—more than this comes from the evil one.
Matthew,5,38,"You've heard that the law said, ‘An eye for an eye, and a tooth for a tooth.’"
Matthew,5,39,"But I tell you, don't resist someone who is evil. If someone slaps you on the right cheek, turn the other cheek to them as well."
Matthew,5,40,"If someone wants to sue you in court and takes your shirt, give them your coat too."
Matthew,5,41,"If someone demands that you go one mile, go with them two."
Matthew,5,42,"Give to those who ask you, and don't turn away those who want to borrow from you."
Matthew,5,43,"You've heard that the law said, ‘Love your neighbor and hate your enemy.’"
Matthew,5,44,"But I tell you, love your enemies and pray for those who persecute you"
Matthew,5,45,so you may become children of your heavenly Father. For his sun shines on both the good and the bad; and he makes the rain fall on both those who do right and those who do wrong.
Matthew,5,46,"For if you only love those who love you, what reward do you have? Don't even the tax collectors do that?"
Matthew,5,47,"If you only speak kindly to your family, what more are you doing than anyone else? Even the heathen do that!"
Matthew,5,48,"Grow up and become completely trustworthy, just as your heavenly Father is trustworthy.”"
Matthew,6,1,"“Make sure not to do your good deeds in front of people, just so they can be seen. Otherwise you won't have any reward from your Father in heaven."
Matthew,6,2,"When you give to the poor, don't be like the hypocrites who blow their own trumpets to announce what they're doing in the synagogues and in the streets so that people will praise them. I tell you the truth: they already have their reward."
Matthew,6,3,"When you give to the poor, don't let your left hand know what your right hand's doing."
Matthew,6,4,"That way what you give will be in secret, and your Father who sees what happens in secret will reward you."
Matthew,6,5,"When you pray, don't be like the hypocrites, for they love to stand up and pray in the synagogues and on the street corners so that people can see them. I promise you, they already have their reward."
Matthew,6,6,"But you, when you pray, go indoors and close the door, and pray to your Father in private, and your Father who sees what happens in private will reward you."
Matthew,6,7,"When you pray, don't babble on meaninglessly like the foreigners do, who think they will be heard because of all the words they repeat."
Matthew,6,8,"Don't be like them, for your Father knows what you need even before you ask him."
Matthew,6,9,"So pray like this:
Our heavenly Father, may your name be honored."
Matthew,6,10,May your kingdom come! May your will be carried out in earth as it is in heaven.
Matthew,6,11,Please give to us today the food we need.
Matthew,6,12,"Forgive our sins, just as we have forgiven those who have sinned against us."
Matthew,6,13,"Please don't let us give in to temptation, and save us from the evil one."
Matthew,6,14,"For if you forgive those who sin against you, your heavenly Father will also forgive you."
Matthew,6,15,"But if you don't forgive those who sin against you, then your heavenly Father won't forgive your sins."
Matthew,6,16,"When you fast, don't be like the hypocrites who put on sad faces and make themselves look terrible so that everyone can see they're fasting. I tell you the truth, they already have their reward."
Matthew,6,17,"Instead, when you fast, wash your face and look smart"
Matthew,6,18,"so that people won't see you're fasting, and your unseen Father who sees what happens in private will reward you."
Matthew,6,19,"Don't pile up wealth here on earth where moths and rust ruin it, and where thieves break in and steal it."
Matthew,6,20,"Instead, you should store up your wealth in heaven, where moths and rust don't ruin it, and where thieves don't break in and steal it."
Matthew,6,21,For what you value the most shows who you really are.
Matthew,6,22,"The eye is like a lamp that lights the body. So if your eye is healthy, then your whole body will have light."
Matthew,6,23,"But if your eye is evil, then your whole body will be in the dark. If the ‘light’ you have is actually darkness, how dark is that!"
Matthew,6,24,"No one can serve two masters. Either you'll hate one and love the other, or you'll be devoted to one and despise the other. You can't serve both God and Money."
Matthew,6,25,"That's why I'm telling you not to worry about your life. Don't worry about what to eat, or what to drink, or what clothes to put on. Isn't life more than food, and the body more than clothes?"
Matthew,6,26,"Look at the birds—they don't sow or reap or store food in barns, for your heavenly Father feeds them. Aren't you worth more than they are?"
Matthew,6,27,Who of you by worrying can add a minute to your life?
Matthew,6,28,"And why are you worried about clothes? Look at the beautiful flowers in the field. See how they grow: they don't work hard, they don't spin thread."
Matthew,6,29,"But I tell you, not even Solomon in all his glory was dressed like one of these flowers."
Matthew,6,30,"So if God decorates the fields like this, grass which is here today and tomorrow is thrown into the fire, won't he do much more for you, you people who trust so little?"
Matthew,6,31,"So don't worry, saying, ‘What shall we eat?’ or ‘What shall we drink?’ or ‘What shall we wear?’"
Matthew,6,32,"These are all the things that the heathen chase after, but your heavenly Father knows everything you need."
Matthew,6,33,"Seek his kingdom first, and his way of living right, and everything will be given to you."
Matthew,6,34,"So don't worry about tomorrow, because tomorrow can worry about itself. There's already enough evil in every day.”"
Matthew,7,1,"“Don't judge others, so that you won't be judged."
Matthew,7,2,"For whatever standard you use to judge others will be used to judge you, and whatever measurement you use to measure others will be used to measure you."
Matthew,7,3,Why do you see the speck that's in your brother's eye? Don't you notice the plank that's in your own eye?
Matthew,7,4,"How can you say to your brother, ‘Let me take out that speck from your eye’ when you have a plank in your own eye?"
Matthew,7,5,You're being hypocritical! First get rid of the plank that's in your own eye. Then you'll be able to see clearly to take out the speck from your brother's eye.
Matthew,7,6,"Don't give dogs what's holy. Don't throw your pearls to pigs. That way the pigs won't trample them underfoot, and the dogs won't turn and attack you."
Matthew,7,7,"Ask, and it will be given to you; seek, and you will find; knock, and the door will be opened for you."
Matthew,7,8,"Everyone who asks, receives; everyone who seeks, finds; and everyone who knocks has the door opened for them."
Matthew,7,9,Would any of you give your son a stone if he asked for bread?
Matthew,7,10,"Or if he asked for fish, would you give him a snake?"
Matthew,7,11,"So if even you who are evil know to give good things to your children, how much more will your heavenly Father give good things to those who ask him."
Matthew,7,12,Treat others the way you want them to treat you. This sums up the law and the prophets.
Matthew,7,13,"Enter by the narrow entrance. For the entrance is wide, and the way is broad that leads to destruction, and many travel that way."
Matthew,7,14,"But the entrance is narrow, and the way is difficult that leads to life, and only a few find it."
Matthew,7,15,"Watch out for false prophets who come wearing sheep's clothing, but who on the inside are vicious wolves."
Matthew,7,16,"You can recognize them by their fruits. Do people harvest grapes from thorn bushes, or figs from thistles?"
Matthew,7,17,"So every good tree produces good fruit, while a bad tree produces bad fruit."
Matthew,7,18,"A good tree can't produce bad fruit, and a bad tree can't produce good fruit."
Matthew,7,19,Every tree that doesn't produce good fruit is chopped down and thrown into the fire.
Matthew,7,20,So you'll recognize them by their fruits.
Matthew,7,21,"Not everyone who calls me ‘Lord, Lord’ will enter the kingdom of heaven—only those who do the will of my Father in heaven."
Matthew,7,22,"Many will say to me at the Day of Judgment, ‘Lord, Lord, didn't we prophesy in your name and drive out demons in your name, and perform many miracles in your name?’"
Matthew,7,23,"Then I will tell them, ‘I never knew you. Leave me, you people who practice wickedness!’"
Matthew,7,24,"Everyone that hears the words I say, and follows them, is like a wise man who built his house on solid rock."
Matthew,7,25,"The rain poured down, and the floods rose, and the winds blew hard against the house, but it didn't fall down, because its foundations were on solid rock."
Matthew,7,26,"Everyone that hears the words I say, and doesn't follow them, is like a foolish man who built his house on the sand."
Matthew,7,27,"The rain poured down, and the floods rose, and the winds blew hard against the house, and it fell down—it totally collapsed.”"
