Matthew,13,3,"He explained many things to them, using stories as illustrations.
“The sower went out to sow,” he began."
Matthew,13,4,"“As he was sowing, some of the seeds fell on the path. The birds came and ate them up."
Matthew,13,5,Other seeds fell on stony ground where there wasn't much earth where they sprouted quickly.
Matthew,13,6,The sun rose and scorched them and they withered because they had no roots.
Matthew,13,7,Other seeds fell among thorns that grew up and choked them.
Matthew,13,8,"Still other seeds fell on good soil. They produced a harvest—some one hundred, some sixty, and some thirty times what had been planted."
Matthew,13,9,Anybody who has ears should be listening!”
Matthew,13,10,"The disciples came to Jesus and asked him, “Why do you use illustrations when you speak to the people?”"
Matthew,13,11,"“You're privileged to have revealed to you the mysteries of the kingdom of heaven, but they're not given such insights,” Jesus replied."
Matthew,13,12,"“Those who already have will have more given to them, more than enough. But those who don't have, whatever they have will be taken away from them."
Matthew,13,13,"That's why I speak to them in illustrations. For even though they see, they don't see; and even though they hear, they don't hear; nor do they understand."
Matthew,13,14,"The prophecy of Isaiah is fulfilled in them: ‘Even though you hear, you won't understand, and even though you see, you won't perceive."
Matthew,13,15,"They have a hard-hearted attitude, they don't want to listen, and they've closed their eyes. If they didn't they might be able to see with their eyes, hear with their ears, and understand in their minds. Then they could return to me and I would heal them.’"
Matthew,13,16,"Your eyes are blessed, for they see. Your ears are blessed too, for they hear."
Matthew,13,17,"I'm telling you, many prophets and good people longed to see what you're seeing, but didn't see it. They longed to hear what you're hearing, but didn't hear it."
Matthew,13,18,So listen to the story of the sower.
Matthew,13,19,"When people hear the message about the kingdom and don't understand it, the evil one comes along and rips out what was sown in them. This is what happens to the seeds sown on the path."
Matthew,13,20,The seeds sown on stony ground are people who hear the message and happily accept it straight away.
Matthew,13,21,"They last for a while, but because they don't have roots, when problems and troubles come, they quickly fall away."
Matthew,13,22,"The seeds sown among thorns are people who hear the message, but then life's worries and the temptation of money choke the message so that they become fruitless."
Matthew,13,23,"The seeds sown on good soil are people who hear the message, and understand it, and who produce a good harvest—some one hundred, some sixty, and some thirty times what was sown.”"
Matthew,13,24,Then he told them another illustrated story: “The kingdom of heaven is like a farmer who sowed good seeds in his field.
Matthew,13,25,"But while his workers were sleeping, an enemy came and sowed weed seeds on top of the wheat. Then they left."
Matthew,13,26,"So when the wheat grew and produced ears of grain, the weeds also grew up."
Matthew,13,27,"The farmer's workers came and asked him, ‘Sir, didn't you sow good seeds in your field? Where did the weeds come from?’"
Matthew,13,28,"‘Some enemy has done this,’ he replied. ‘Do you want us to go and pull up the weeds?’ they asked him."
Matthew,13,29,"‘No,’ he answered, ‘as you pull up the weeds, you might uproot the wheat too."
Matthew,13,30,"Let them both grow until harvest, and then at harvest-time I'll tell the reapers to first gather the weeds, tie them up into bundles and burn them, and then gather the wheat and store it in my barn.’”"
Matthew,13,31,He gave them another illustration: “The kingdom of heaven is like a mustard seed that a farmer sowed in his field.
Matthew,13,32,Even though it's the tiniest of seeds it grows much bigger than other plants. In fact it grows into a tree big enough for birds to roost in its branches.”
Matthew,13,33,"He told them another illustrated story: “The kingdom of heaven is like yeast that a woman mixed with a large quantity of flour, until all the dough was raised.”"
Matthew,13,34,Jesus explained all these things to the crowds using illustrated stories—in fact he didn't speak to them without using stories.
Matthew,13,35,"This fulfilled the prophet's words: “I will speak using stories, and I will explain things hidden from the creation of the world.”"
Matthew,13,36,"Then Jesus left the crowds and went into a house. His disciples came over to him, and asked him, “Please explain to us the story about the weeds in the field.”"
Matthew,13,37,"“The one who sows the good seed is the Son of man,” Jesus explained."
Matthew,13,38,“The field is the world. The good seeds are the children of the kingdom. The weed seeds are the children of the evil one.
Matthew,13,39,The enemy that sowed the weed seeds is the devil. The harvest is the end of the world. The reapers are angels.
Matthew,13,40,Just as the weeds are harvested and burned so it will be at the end of the world.
Matthew,13,41,"The Son of man will send out his angels, and they will gather up every sinful thing and everyone who does evil"
Matthew,13,42,"and will throw them into the blazing furnace, where there will be weeping and grinding of teeth."
Matthew,13,43,Then those who live right will shine like the sun in the kingdom of their Father. Anybody with ears should be listening!
Matthew,13,44,"The kingdom of heaven is like treasure hidden in a field. A man found it, reburied it, and then full of joy went and sold all he had and bought that field."
Matthew,13,45,The kingdom of heaven is also like a trader looking for good pearls.
Matthew,13,46,When he found the most expensive pearl ever he went and sold all he had and bought it.
Matthew,13,47,"Or again, the kingdom of heaven is like a fishing net thrown into the sea that caught all kinds of fish."
Matthew,13,48,When it was full it was dragged ashore. The good fish were put into baskets while the bad ones were thrown away.
Matthew,13,49,That's the way it will be when the end of the world comes. The angels will go out and separate the evil people from the good
Matthew,13,50,and throw them into the blazing furnace where there will be weeping and grinding of teeth.
Matthew,13,51,"Now do you understand everything?”
“Yes,” they replied."
Matthew,13,52,"“This is why every religious teacher who's learned about the kingdom of heaven is like a house-owner who brings out from his storeroom both new and old treasures,” Jesus said."
Matthew,13,53,"After Jesus finished telling these stories, he left."
Matthew,13,54,"He went back to his home town and taught in the synagogue there. People were amazed, and asked, “Where does he get his wisdom and miracles from?"
Matthew,13,55,"Isn't this the carpenter's son? Isn't his mother's name Mary, and his brothers James, and Joseph, and Simon, and Judas?"
Matthew,13,56,Don't his sisters live here among us? So where does he get all this from?”
Matthew,13,57,"And so they refused to believe in him.
“A prophet is honored everywhere except in his homeland and in his family,” Jesus told them."
Matthew,13,58,"Since they failed to trust in him, he did not do many miracles there."
Matthew,14,1,At that time Herod the tetrarch heard what Jesus was doing
Matthew,14,2,"and he told his servants, “He must be John the Baptist resurrected from the dead, and that's why he has such powers!”"
Matthew,14,3,"Herod had detained John, and had him put in chains and imprisoned on account of Herodias, the wife of Philip, his brother."
Matthew,14,4,"For John had been telling him, “It's not legal for you to marry her.”"
Matthew,14,5,Herod wanted to kill John but he was afraid of the people's reaction for they considered John a prophet.
Matthew,14,6,"However, on Herod's birthday the daughter of Herodias danced for the party, and Herod was delighted with her."
Matthew,14,7,So he promised with an oath to give her whatever she wanted.
Matthew,14,8,"Prompted by her mother, she said, “Give me here on a plate the head of John the Baptist.”"
Matthew,14,9,"Then the king regretted the promise he had made, but because of the oaths he'd made in front of his dinner guests, he gave the order to do it."
Matthew,14,10,The order was passed on and John was beheaded in prison.
Matthew,14,11,"John's head was brought on a plate and given to the girl, who took it to her mother."
Matthew,14,12,"John's disciples came and took the body, and buried him. Then they went and told Jesus."
Matthew,14,13,"When Jesus heard the news he went away by boat to a quiet place to be alone, but when the crowds learned where he was, they followed him on foot from the towns."
Matthew,14,14,"When Jesus got out of the boat and saw the huge crowds, he was full of sympathy for them, and healed their sick."
Matthew,14,15,"As evening came the disciples went up to him and said, “This place is miles from anywhere and it's getting late. Send the crowds away so they can go to the villages and buy food for themselves.”"
Matthew,14,16,"But Jesus told them, “They don't need to leave. You give them something to eat!”"
Matthew,14,17,"“All we have here are five loaves and a couple of fish,” they replied."
Matthew,14,18,"“Bring them to me,” said Jesus."
Matthew,14,19,"He told the crowds to sit down on the grass. Then he took the five loaves and the two fish, looked up to heaven and blessed them. After that he broke the loaves into pieces and gave the bread to the disciples, and the disciples gave it to the crowds."
Matthew,14,20,Everybody ate until they were full. Then they collected up the leftovers which filled twelve baskets.
Matthew,14,21,"Some five thousand men ate the food, not counting women and children."
Matthew,14,22,Right after this he made the disciples get into the boat and go back to the other side of the lake while he sent the crowds on their way.
Matthew,14,23,"After he'd sent the crowds away, he went up into the mountains to pray. Evening came and he was there all alone."
Matthew,14,24,"By now the boat was a long way out from land, being pounded by the waves because the wind was blowing against it."
Matthew,14,25,"About 3 a.m. Jesus caught up with them, walking on the sea."
Matthew,14,26,"When the disciples saw him walking on the sea, they were terrified. They screamed out in fear, “It's a ghost!”"
Matthew,14,27,"But immediately Jesus said to them, “Don't worry, it's me! Don't be afraid!”"
Matthew,14,28,"“Lord, if it's really you, tell me to come over to you, walking on the water,” Peter replied."
Matthew,14,29,"“Come on then,” said Jesus. Peter got out of the boat and walked on the water towards Jesus."
Matthew,14,30,"But when he saw how strong the wind was, he became scared, and started to sink. “Lord! Save me!” he cried out."
Matthew,14,31,"Immediately Jesus reached out and grabbed hold of him, and said, “You have such little trust in me. Why did you doubt?”"
Matthew,14,32,"When they got into the boat, the wind died down"
Matthew,14,33,"and those in the boat worshiped him, saying, “You really are the Son of God!”"
Matthew,14,34,After crossing the lake they arrived at Gennesaret.
Matthew,14,35,"When the people there realized Jesus was there, they let everyone in the whole area know. They brought all who were sick to him"
Matthew,14,36,and pleaded with him to let the sick just touch the edge of his cloak. Everyone that touched him was healed.
Matthew,15,1,Then some Pharisees and religious teachers from Jerusalem came to Jesus and asked him
Matthew,15,2,“Why do your disciples break the tradition of our forefathers by not washing their hands before they eat a meal?”
Matthew,15,3,“Why do you break God's commandment because of your tradition?” Jesus replied.
Matthew,15,4,"“For God said, ‘Honor your father and mother,’ and ‘Those who curse their father or mother should be put to death.’"
Matthew,15,5,"But you say that if someone tells their father or mother, ‘Whatever you might have expected to get from me is now a gift to God,’ then"
Matthew,15,6,they don't have to honor their father. In this way you've annulled God's word for the sake of your tradition.
Matthew,15,7,You hypocrites! How well Isaiah described you when he prophesied
Matthew,15,8,‘These people say they honor me but in their minds they don't care about me.
Matthew,15,9,Their worship of me is pointless. What they teach are just man-made requirements.’”
Matthew,15,10,"He called the crowd over and told them, “Listen, and understand this"
Matthew,15,11,it's not what goes into you through your mouth that defiles you. It's what comes out of your mouth that defiles you.”
Matthew,15,12,"Then Jesus' disciples came to him and said, “You do realize that the Pharisees were offended by what you said.”"
Matthew,15,13,"“Every plant my heavenly Father didn't plant will be uprooted,” Jesus replied."
Matthew,15,14,"“Forget about them—they are blind guides. If a blind man leads another blind man, then they'll both fall into a ditch.”"
Matthew,15,15,"Then Peter asked, “Please tell us what you mean by this illustration.”"
Matthew,15,16,“Haven't you understood this yet?” replied Jesus.
Matthew,15,17,"“Don't you see that whatever goes in through the mouth then passes through the stomach, and then leaves the body as waste?"
Matthew,15,18,"But what comes out through the mouth comes from the mind, and that's what defiles you."
Matthew,15,19,"For what comes from the mind are evil thoughts, murder, adultery, sexual immorality, theft, false witness, and blasphemy"
Matthew,15,20,and those are what defile you. Eating with unwashed hands doesn't defile you.”
Matthew,15,21,Jesus left and went to the region of Tyre and Sidon.
Matthew,15,22,"A Canaanite woman from that area came, shouting out, “Lord, son of David! Please have mercy on me, because my daughter is suffering badly because she's possessed by a demon!”"
Matthew,15,23,"But Jesus didn't reply at all. His disciples came to him and told him, “Tell her to stop following us. All her shouting is really annoying!”"
Matthew,15,24,"“I was sent only to the lost sheep of the house of Israel,” Jesus said to the woman."
Matthew,15,25,"But the woman came and kneeled before him, and said, “Lord, please help me!”"
Matthew,15,26,"“It's not right to take the children's food and throw it to the dogs,” Jesus told her."
Matthew,15,27,"“Yes, Lord, but even dogs are allowed to eat crumbs that fall from their master's table,” she replied."
Matthew,15,28,"“You have great trust in me,” Jesus answered. “Your wish is granted!” And her daughter was healed immediately."
Matthew,15,29,"Jesus returned, passing by the Sea of Galilee. He went into the mountains nearby where he sat down."
Matthew,15,30,"Huge crowds came to him, bringing those who were lame, blind, crippled, dumb, and many others who were sick. They laid them on the ground at his feet, and he healed them."
Matthew,15,31,"The crowd was astounded at what they saw happen: the deaf could speak, the crippled were healed, the lame could walk, and the blind could see. They praised the God of Israel."
Matthew,15,32,"Jesus called his disciples over and told them, “I feel really sorry for all these people, because they've been with me now for three days, and they have nothing to eat. I don't want to send them away hungry, in case they faint on their way home.”"
Matthew,15,33,“Where could we find enough bread here in this desert to feed such a huge crowd?” the disciples responded.
Matthew,15,34,"“How many loaves of bread do you have?” Jesus asked.
“Seven, and a few small fish,” they replied."
Matthew,15,35,Jesus told the crowd to sit down on the ground.
Matthew,15,36,"He took the seven loaves and the fish, and after blessing the food he broke it into pieces and gave it to the disciples, and the disciples gave it to the crowds."
Matthew,15,37,"Everybody ate until they were full, and then they collected the leftovers, filling seven baskets."
Matthew,15,38,"Four thousand men ate the food, not counting women and children."
Matthew,15,39,"Then he sent the crowds away, got into a boat, and went to the Magadan region."
Matthew,16,1,"The Pharisees and Sadducees came to test Jesus, demanding that he show them a sign from heaven."
Matthew,16,2,"Jesus replied, “In the evening you say, ‘It'll be a fine day tomorrow, because the sky is red,’"
Matthew,16,3,"while in the morning you say, ‘It'll be bad weather today, because the sky is red and overcast.’ You know how to predict the weather by what the sky looks like, but you can't recognize the signs of the times!"
Matthew,16,4,"An evil and adulterous generation are the ones who look for a miraculous sign, and no sign will be given to them except the sign of Jonah.” He left them and went away."
Matthew,16,5,"Having crossed to the other side of the lake, the disciples realized they'd forgotten to bring bread with them."
Matthew,16,6,"“Watch out for the yeast of the Pharisees and Sadducees,” Jesus told them."
Matthew,16,7,"The disciples started arguing among themselves. “He's saying that because we didn't bring any bread,” they concluded."
Matthew,16,8,"Jesus knew what they were saying and said, “You have so little trust in me! Why are you arguing among yourselves about not having any bread?"
Matthew,16,9,Haven't you worked it out yet? Don't you remember the five loaves that fed five thousand? How many baskets of leftovers did you collect?
Matthew,16,10,And what about the seven loaves that fed the four thousand? How many baskets of leftovers did you collect?
Matthew,16,11,Haven't you worked it out yet that I wasn't talking to you about bread? Watch out for the yeast of the Pharisees and Sadducees!”
Matthew,16,12,"Then they realized that he wasn't warning them to watch out for bread yeast, but about the teachings of the Pharisees and Sadducees."
Matthew,16,13,"When Jesus arrived in the region of Caesarea Philippi, he asked his disciples, “Who do people say that the Son of man is?”"
Matthew,16,14,"“Some say John the Baptist, some say Elijah, and others say Jeremiah or one of the other prophets,” they replied."
Matthew,16,15,“But what about you?” he asked them. “Who do you say I am?”
Matthew,16,16,"“You are the Messiah, the Son of the living God,” Simon Peter replied."
Matthew,16,17,"“You are truly blessed, Simon son of John,” Jesus told him. “For this wasn't revealed to you by human flesh and blood, but by my Father in heaven."
Matthew,16,18,"I also tell you that you are Peter, and on this rock I will build my church and the powers of death won't overcome it."
Matthew,16,19,"I will give you the keys of the kingdom of heaven, and whatever you ban on earth will have been banned in heaven, and whatever you allow on earth will have been allowed in heaven.”"
Matthew,16,20,Then he warned his disciples not to tell anyone that he was the Messiah.
Matthew,16,21,"From that time on Jesus began to explain to his disciples that he would have to go to Jerusalem, and that he would suffer terribly at the hands of the elders, chief priests, and religious teachers; and that he would be killed, but he would rise again on the third day."
Matthew,16,22,"Peter took Jesus aside and started to tell him he shouldn't talk like that. “God forbid, Lord, that this would ever happen to you!” he said."
Matthew,16,23,"Jesus turned to Peter, and told him, “Get away from me, Satan! You are a trap to trip me up, because you're thinking in a human way, and not as God thinks!”"
Matthew,16,24,"Then Jesus told his disciples, “If you want to be a follower of mine, you must deny yourself, take up your cross, and follow me."
Matthew,16,25,"For if you want to save your life you will lose it, and if you lose your life for my sake you will save it."
Matthew,16,26,"What benefit is it for you to gain the whole world, yet lose your life? What would you give in exchange for your life?"
Matthew,16,27,"For the Son of man is going to come in his Father's glory, together with his angels. Then he will give everyone what they deserve according to what they've done."
Matthew,16,28,"I tell you the truth, there are some standing here who won't die before they see the Son of man coming in his kingdom.”"
Matthew,17,1,"Six days later Jesus took Peter, James and his brother John, with him and they went up a high mountain to be by themselves."
Matthew,17,2,He was transformed in front of them. His face was shining like the sun. His clothes turned white as light.
Matthew,17,3,"Then suddenly Moses and Elijah appeared before them, talking together with Jesus."
Matthew,17,4,"Peter spoke up, saying to Jesus, “Lord, it's really good to be here. If you want I'll make three shelters—one for you, one for Moses, and one for Elijah.”"
Matthew,17,5,"While he was still speaking, a bright cloud covered them. A voice came from the cloud, saying, “This is my son whom I love, who pleases me. Listen to him.”"
Matthew,17,6,"When they heard this, the disciples fell down on their faces, absolutely terrified."
Matthew,17,7,"Jesus went over to them and touched them. “Get up,” he told them. “Don't be afraid.”"
Matthew,17,8,When they looked up they didn't see anybody there except Jesus.
Matthew,17,9,"As they descended the mountain Jesus gave them strict instructions. “Don't tell anybody what you saw until the Son of man has risen from the dead,” he told them."
Matthew,17,10,“So why do the religious teachers say that Elijah has to come first?” his disciples asked.
Matthew,17,11,"“It's true that Elijah comes to put everything in place,” Jesus replied"
Matthew,17,12,“but I tell you that Elijah has already come and yet people didn't recognize who he was. They did whatever they felt like to him. In the same way the Son of man will also suffer at their hands.”
Matthew,17,13,Then the disciples realized that Jesus was referring to John the Baptist.
Matthew,17,14,"When they approached the crowd, a man came to Jesus, and kneeled before him."
Matthew,17,15,"“Lord, please have mercy on my son,” he said. “He loses his mind and suffers such terrible fits that he often falls in the fire or into water."
Matthew,17,16,I brought him to your disciples but they couldn't heal him.”
Matthew,17,17,"“You people refuse to trust me, and are so corrupt!” Jesus responded. “How long do I have to remain here with you? How long do I have to put up with you? Bring him here to me!”"
Matthew,17,18,"Jesus confronted the demon and it left the boy, and he was healed straight away."
Matthew,17,19,"Later the disciples came to Jesus in private and asked him, “Why couldn't we drive it out?”"
Matthew,17,20,"“Because you don't trust enough,” Jesus told them. “I tell you, even if your trust was as small as a mustard seed, you could say to this mountain, ‘Move from here to there,’ and it would move. Nothing would be impossible for you.”"
Matthew,17,21,
Matthew,17,22,"As they were walking together through Galilee, Jesus told them, “The Son of man is going to be betrayed and people will have power over him."
Matthew,17,23,"They will kill him, but on the third day he will rise again.” The disciples were filled with sadness."
Matthew,17,24,"When they arrived at Capernaum, those who were in charge of collecting the half-shekel Temple tax came to Peter and asked him, “Your teacher does pay the half-shekel tax, doesn't he?”"
Matthew,17,25,"“Yes, of course,” Peter replied.
When he returned to where they were staying, Jesus anticipated the issue. “What do you think, Simon?” Jesus asked him. “Do the kings of this world collect their taxes and duties from their own sons or from others?”"
Matthew,17,26,"“From others,” Peter replied. So Jesus told him, “In that case the sons are exempt."
Matthew,17,27,"But to avoid giving offense to anyone, go to the lake, and throw out a fishing line with a hook. Pull in the first fish you catch, and when you open its mouth there you'll find a stater coin. Take the coin and give it to them for both me and you.”"
Matthew,18,1,"Around that time the disciples came to Jesus, and asked, “Who is the greatest in the kingdom of heaven?”"
Matthew,18,2,Jesus called over a small child. He had the child stand in front of them.
Matthew,18,3,"“I tell you the truth, unless you change the way you think and become like little children, you won't ever enter the kingdom of heaven,” he told them."
Matthew,18,4,“But whoever humbles themselves and becomes like this little child is the greatest in the kingdom of heaven.
Matthew,18,5,Whoever accepts a little child like this in my name accepts me.
Matthew,18,6,"But anyone who makes one of these little ones who trust in me sin, it would be better for them to have a large millstone tied around their neck and be drowned in the depths of the sea."
Matthew,18,7,"What a disaster is coming on the world for all its temptations to sin! Temptations will surely come, but it will be a disaster for the person through whom the temptation comes!"
Matthew,18,8,"If your hand or your foot causes you to sin, cut it off and throw it away. It's better for you to enter eternal life crippled or lame rather than to have two hands or two feet and to be thrown into eternal fire."
Matthew,18,9,"If your eye causes you to sin, pull it out and throw it away. It's better for you to enter eternal life with one eye than to have two eyes and to be thrown into the fire of Gehenna."
Matthew,18,10,Make sure you don't look down on these little ones. I tell you that in heaven their angels are always with my heavenly Father.
Matthew,18,11,
