Matthew,23,18,"You say, ‘If you swear on the altar that doesn't count, but if you swear on the sacrifice that's on the altar, then you have to keep your oath.’"
Matthew,23,19,"How foolish and blind you are! What is greater—the sacrifice, or the altar that makes the sacrifice holy?"
Matthew,23,20,"If you swear by the altar, you swear by it and by everything that's on it."
Matthew,23,21,If you swear by the Temple you swear by it and by the one who lives there.
Matthew,23,22,If you swear by heaven you swear by the throne of God and the one who sits there.
Matthew,23,23,"What a disaster is coming on you religious teachers and Pharisees, you hypocrites! You pay a tithe of mint, aniseed, and cumin, but you neglect the vital aspects of the law—doing good, showing mercy, exercising trust. Yes, you should pay your tithe, but don't forget these other things."
Matthew,23,24,You blind guides—you strain what you drink to keep out a fly but then you swallow a camel!
Matthew,23,25,"What a disaster is coming on you religious teachers and Pharisees, you hypocrites! You clean the outside of the cup and the plate, but inside you're full of greed and self-indulgence."
Matthew,23,26,"You blind Pharisees! First clean the inside of the cup and the plate, so that the outside will also be clean."
Matthew,23,27,"What a disaster is coming on you religious teachers and Pharisees, you hypocrites! You are like whitewashed tombs, looking good on the outside, but on the inside full of skeletons and all kinds of rottenness."
Matthew,23,28,"You're just the same. On the outside you look like good people to others, but on the inside you're full of hypocrisy and wickedness."
Matthew,23,29,"What a disaster is coming on you religious teachers and Pharisees, you hypocrites! You build tombs as memorials to the prophets, and decorate the tombs of the good"
Matthew,23,30,"and you say, ‘If we had lived in the times of our ancestors we would not have joined them in shedding the blood of the prophets.’"
Matthew,23,31,"But by saying this you testify against yourselves, proving that you belong to those who murdered the prophets!"
Matthew,23,32,So get on with it—finish it all off using your forefathers' methods!
Matthew,23,33,"You snakes, you brood of vipers, how will you escape the judgment of Gehenna?"
Matthew,23,34,"That's why I'm sending you prophets, wise men, and teachers. Some of them you will kill, some of them you will crucify, and some of them you will flog in your synagogues, hunting them from town to town."
Matthew,23,35,"As a result, you will be held accountable for the blood of all the good people that has been poured out on the land—from the blood of Abel, who did what was right, to the blood of Zechariah son of Barachiah, whom you killed between the Temple and the altar."
Matthew,23,36,"I'm telling you, the consequences of all this will fall on this generation."
Matthew,23,37,"Jerusalem, Jerusalem, you who kill the prophets and stone those who are sent to you! So often I wanted to gather your children as a mother hen gathers her chicks under her wings—but you wouldn't let me."
Matthew,23,38,"Now look—your house is left abandoned, totally empty."
Matthew,23,39,"I tell you this: you won't see me from now on until you say, ‘Blessed is the one who comes in the name of the Lord.’”"
Matthew,24,1,"As Jesus was leaving the Temple his disciples came to him, pointing proudly to the Temple buildings."
Matthew,24,2,"But Jesus replied, “You see all these buildings? I tell you the truth: there won't be one stone left upon another. Every last one will come crashing down!”"
Matthew,24,3,"As Jesus sat on the Mount of Olives, the disciples came to him in private, and asked, “Please tell us when this will happen. What will be the sign of your coming and the end of the world?”"
Matthew,24,4,"“Make sure no one misleads you,” Jesus replied."
Matthew,24,5,"“Many will come claiming to be me, saying, ‘I'm the Messiah,’ and they will deceive many people."
Matthew,24,6,"You'll hear about wars, and rumors about wars, but don't be anxious. These things have to happen, but this isn't the end."
Matthew,24,7,"Nations will attack other nations, and kingdoms will fight against other kingdoms. There will be famines and earthquakes in various places"
Matthew,24,8,but all these things are just the beginnings of birth pains.
Matthew,24,9,"Then they will arrest you, they will persecute you, and they will kill you. All people will hate you because of me."
Matthew,24,10,At that time many believers will give up believing. They will betray one another and hate one another.
Matthew,24,11,Many false prophets will come and deceive many people.
Matthew,24,12,The increasing evil will lead the love of many to grow cold
Matthew,24,13,but those who hold out to the end will be saved.
Matthew,24,14,"The good news of the kingdom will be proclaimed around the whole world so everyone will be able to hear it, and then the end will come."
Matthew,24,15,So when you see the ‘idolatry that causes devastation’ standing in the holy place that the prophet Daniel spoke about (those who read this please consider carefully)
Matthew,24,16,then the people living in Judea should run away to the mountains.
Matthew,24,17,Anyone who is on the housetop must not go down and fetch what's in the house.
Matthew,24,18,Anyone who is out in the fields must not go back to get a coat.
Matthew,24,19,"How awful it will be for those who are pregnant, and those who are nursing babies at that time!"
Matthew,24,20,"Pray that you don't have to run away in winter, or on the Sabbath day."
Matthew,24,21,"For at that time there will be terrible persecution—more terrible than anything that has happened from the beginning of the world up till now, and won't ever happen again."
Matthew,24,22,"Unless those days are cut short, nobody will be saved, but for the sake of the chosen those days will be cut short."
Matthew,24,23,"So if anyone tells you, ‘Look, here's the Messiah,’ or, ‘There he is,’ don't believe it."
Matthew,24,24,"For false messiahs will appear, and false prophets too, and they will perform incredible signs and miracles in order to deceive the chosen, if that were possible."
Matthew,24,25,Notice that I've told you this before it even happens.
Matthew,24,26,"So if they tell you, ‘Look, he's out in the desert,’ don't go looking there; or if they say, ‘Look, he's secretly here,’ don't believe it."
Matthew,24,27,For the coming of the Son of man will be like the lightning that flashes brightly from east to west.
Matthew,24,28,‘Vultures gather where the carcass is.’
Matthew,24,29,"But right after those days of persecution the sun will be darkened, the moon will not shine, the stars will fall from heaven, and the powers of heaven will be shaken."
Matthew,24,30,"Then the sign of the Son of man will appear in heaven, and all the peoples of the earth will mourn. They will see the Son of man coming on the clouds of heaven with power and in brilliant glory."
Matthew,24,31,"With a blast from a trumpet he will send his angels to gather his chosen ones from every place, from one end of heaven and earth to the other."
Matthew,24,32,"Learn an illustration from the fig tree. When its shoots become tender and leaves begin to sprout, you know that summer is coming."
Matthew,24,33,"In the same way when you see all these things happening, you know that his coming is near, in fact it's right at the door!"
Matthew,24,34,I tell you the truth: this generation won't pass away until all these things have happened.
Matthew,24,35,"Heaven and earth may pass away, but my words won't pass away."
Matthew,24,36,"But no one knows the day or hour when this will take place, not the angels in heaven, nor the Son. Only the Father knows."
Matthew,24,37,When the Son of man comes it will be like it was during the time of Noah.
Matthew,24,38,"It will be as in the days before the flood, when they were eating and drinking, marrying and giving in marriage, right up until the day that Noah went into the ark."
Matthew,24,39,They didn't realize what was going to happen until the flood came and swept them all away. That's how the coming of the Son of man will be.
Matthew,24,40,"Two men will be working in the fields. One will be taken, the other left."
Matthew,24,41,"Two women will be grinding grain with a mill. One will be taken, the other left."
Matthew,24,42,"So stay alert, because you don't know what day your Lord is coming."
Matthew,24,43,"But consider this: if the house-owner knew what time a thief was coming, he would keep watch. He would not allow his house to be broken into and robbed."
Matthew,24,44,"You also need to be ready, because the Son of man is coming at a time when you're not expecting him."
Matthew,24,45,For who is the trustworthy and thoughtful servant? It's the one his master puts in charge of his household to provide them with food at the proper time.
Matthew,24,46,How good it will be for that servant to be found doing that when his master returns!
Matthew,24,47,I tell you the truth: the master will put that servant in charge over everything he has.
Matthew,24,48,"But if he was evil, the servant would say to himself, ‘My master is taking a long time,’"
Matthew,24,49,"and would start beating the other servants, feasting and drinking with the drunks."
Matthew,24,50,"Then that servant's master will return when the man doesn't expect him, at a time he doesn't know."
Matthew,24,51,"He'll cut him to pieces, and treat him in the same way as the hypocrites, sending him to a place where there's crying and gnashing of teeth.”"
Matthew,25,1,"“The kingdom of heaven is like ten girls, who took their lamps with them to go and meet the bridegroom."
Matthew,25,2,"Five were foolish, and five were wise."
Matthew,25,3,The foolish girls took their lamps but didn't take any oil with them
Matthew,25,4,while the wise took jars of oil with them as well as their lamps.
Matthew,25,5,The bridegroom took a long time and all the girls became drowsy and fell asleep.
Matthew,25,6,"At midnight the shout came, ‘Look, the bridegroom's here! Come out and meet him!’"
Matthew,25,7,All the girls got up and trimmed the wicks of their lamps. The foolish girls said to the wise ones
Matthew,25,8,"‘Give us some of your oil, because our lamps are going out.’ But the wise girls replied"
Matthew,25,9,"‘No, because otherwise there won't be enough for both you and for us. Go to the shopkeepers and buy some oil for yourselves.’"
Matthew,25,10,"While they went to buy oil, the bridegroom arrived, and those who were ready went in with him to the wedding, and the door was locked shut."
Matthew,25,11,"The other girls came later. ‘Lord, Lord,’ they called, ‘Open the door for us!’"
Matthew,25,12,"But he answered, ‘I tell you the truth: I don't know you.’"
Matthew,25,13,"So stay alert, for you don't know the day, or the hour."
Matthew,25,14,It's like a man who went away on a trip. He called in his servants and entrusted them with what he owned.
Matthew,25,15,"To one of them he gave five talents, to another he gave two, and to another one, according to their different abilities. Then he left."
Matthew,25,16,"Immediately the one with five talents went and invested them in a business, and made another five talents."
Matthew,25,17,In the same way the one with two talents made another two.
Matthew,25,18,But the man who'd received the one talent went off and dug a hole and hid his master's money.
Matthew,25,19,"A long time later the master of those servants returned, and settled accounts with them."
Matthew,25,20,"The one with five talents came and presented the other five talents. ‘Master,’ he said, ‘You gave me five talents. Look, I've made a profit of five talents.’"
Matthew,25,21,"His master said to him, ‘You've done well—you are a good, faithful servant. You have proved yourself trustworthy over small things, so now I'm placing you in charge over many things. Be happy because I'm really pleased with you!’"
Matthew,25,22,"The one with two talents also came. ‘Master,’ he said, ‘You gave me two talents. Look, I've made a profit of two talents.’"
Matthew,25,23,"His master said to him, ‘You've done well—you are a good, faithful servant. You have proved trustworthy over small things, so now I'm placing you in charge over many things. Be happy because I'm really pleased with you!’"
Matthew,25,24,"Then the man with one talent came. ‘Master,’ he said, ‘I know that you're a hard man. You reap where you didn't sow, and you harvest crops that you didn't plant."
Matthew,25,25,"So since I was afraid of you I went and buried your talent in the ground. Look, you can have back what belongs to you.’"
Matthew,25,26,"But his master answered him, ‘You wicked and lazy servant! If you think I reap where I don't sow, and harvest crops I didn't plant"
Matthew,25,27,then you should have deposited my silver in the bank so that when I returned I could have had my money with interest.
Matthew,25,28,"Take the talent away from him, and give it to the one with ten talents."
Matthew,25,29,"For everyone who has will be given even more; and everyone who doesn't have anything, even what they have will be taken away from them."
Matthew,25,30,Now throw this useless servant out into the darkness where there'll be crying and gnashing of teeth.’
Matthew,25,31,"But when the Son of man comes in his glory, and all the angels with him, then he will sit on his majestic throne."
Matthew,25,32,"Everyone will be brought before him. He will separate them from one another, as a shepherd separates the sheep from the goats."
Matthew,25,33,"He'll place the sheep on his right hand, and the goats on his left."
Matthew,25,34,"Then the king will say to the ones on his right, ‘Come, you who are blessed by my Father, and inherit the kingdom that's been prepared for you from the beginning of the world."
Matthew,25,35,"For I was hungry, and you gave me food to eat. I was thirsty, and you gave me a drink. I was a stranger, and you invited me in."
Matthew,25,36,I was naked and you clothed me. I was sick and you looked after me. I was in prison and you visited me.’
Matthew,25,37,"Then those who are right will answer, ‘Lord, when did we see you hungry and fed you, or thirsty and gave you a drink?"
Matthew,25,38,"When did we see you as a stranger and invite you in, or naked and clothe you?"
Matthew,25,39,"When did we see you sick, or in prison, and visit you?’"
Matthew,25,40,"The king will tell them, ‘I tell you the truth: whatever you did for one of these least important brothers of mine you did for me.’"
Matthew,25,41,"He'll also say to those on his left, ‘Go away from me, you who are doomed, into the eternal fire prepared for the devil and his angels!"
Matthew,25,42,For I was hungry and you didn't give me anything to eat. I was thirsty and you didn't give me a drink.
Matthew,25,43,I was a stranger and you didn't invite me in. I was naked and you didn't clothe me. I was sick and in prison and you didn't visit me.’
Matthew,25,44,"Then they will also answer, ‘Lord, when did we see you hungry, or thirsty, or a stranger, or naked, or sick, or in prison, and didn't look after you?’"
Matthew,25,45,"Then he will tell them, ‘I tell you the truth: whatever you didn't do for one of these least important brothers of mine you didn't do for me.’"
Matthew,25,46,"They will go away into eternal condemnation, but those who are good will enter eternal life.”"
Matthew,26,1,"After Jesus had said all this, he told his disciples"
Matthew,26,2,"“You know that it's Passover in two days time, and the Son of man will be handed over to be crucified.”"
Matthew,26,3,"Then the chief priests and the elders of the people gathered in the courtyard of Caiaphas, the high priest."
Matthew,26,4,There they plotted to arrest Jesus on some deceitful pretext and kill him.
Matthew,26,5,"But they said, “Let's not do this during the festival so that the people don't riot.”"
Matthew,26,6,While Jesus was staying at Simon the leper's house in Bethany
Matthew,26,7,a woman came over to him carrying an alabaster jar of very expensive perfume. She poured it on Jesus' head while he was sitting eating.
Matthew,26,8,"But when the disciples saw what she did, they were upset.“What a terrible waste!” they objected."
Matthew,26,9,“This perfume could've been sold for a lot of money and given to the poor!”
Matthew,26,10,"Jesus was aware of what was going on and told them, “Why are you upset with this woman? She's done something wonderful for me!"
Matthew,26,11,"You'll always have the poor with you, but you won't always have me."
Matthew,26,12,By pouring this perfume on my body she's prepared me for burial.
Matthew,26,13,"I tell you the truth: wherever in the world this good news is spread, the story of what this woman has done will also be told in memory of her.”"
Matthew,26,14,"Then Judas Iscariot, one of the twelve disciples, went to the chief priests"
Matthew,26,15,"and asked them, “How much will you pay me for betraying Jesus to you?” They paid him thirty silver coins."
Matthew,26,16,From then on he looked for an opportunity to betray Jesus.
Matthew,26,17,"On the first day of the Festival of Unleavened Bread, the disciples came to Jesus and asked him, “Where do you want us to prepare the Passover meal for you to eat?”"
Matthew,26,18,"Jesus told them, “Go into the city and find this particular man, and tell him that the Teacher says, ‘My time is approaching. I'm coming to celebrate the Passover with my disciples at your house.’”"
Matthew,26,19,"The disciples did as Jesus told them, and prepared the Passover meal there."
Matthew,26,20,When evening came he sat down to eat with the Twelve.
Matthew,26,21,"While they were eating he told them, “I tell you the truth: one of you is going to betray me.”"
Matthew,26,22,"They were extremely upset. One after the other they asked him, “Lord, it's not me, is it?”"
Matthew,26,23,"“The one who's dipped his hand into the dish with me will betray me,” Jesus replied."
Matthew,26,24,"“The Son of man will die just as it was prophesied about him, but what a disaster it will be for the man who betrays the Son of man! It would be better for that man if he'd never been born!”"
Matthew,26,25,"Judas, the one who would betray Jesus, asked, “It's not me, is it, Rabbi?”
“You said it,” Jesus replied."
Matthew,26,26,"While they were eating, Jesus took some bread and blessed it. Then he broke it and gave pieces to the disciples. “Take and eat this for it is my body,” said Jesus."
Matthew,26,27,"Then he picked up the cup, blessed it, and gave it to them. “Drink from it, all of you,” he told them."
Matthew,26,28,"“For this is my blood of the agreement, poured out for many for the forgiveness of sins."
Matthew,26,29,"However, I tell you, I won't drink this fruit of the vine until the day I drink it new with you in the kingdom of my Father.”"
Matthew,26,30,"After they'd sung a song, they left for the Mount of Olives."
Matthew,26,31,"“All of you will abandon me tonight,” Jesus told them. “As Scripture says, ‘I will strike the shepherd, and the flock of sheep will be completely scattered.’"
Matthew,26,32,"But after I have risen, I'll go ahead of you to Galilee.”"
Matthew,26,33,"But Peter objected, “Even if everyone else abandons you, I'll never abandon you.”"
Matthew,26,34,"“I'm telling you the truth,” Jesus told him, “This very night, before the cock crows, you'll deny me three times.”"
Matthew,26,35,"“Even if I have to die with you, I'll never deny you!” Peter insisted. And all the disciples said the same thing."
Matthew,26,36,"Then Jesus went with his disciples to a place called Gethsemane. He told them, “Sit down here while I go over there and pray.”"
Matthew,26,37,"He took Peter and the two sons of Zebedee with him, and he began to suffer agonizing sorrow and distress."
Matthew,26,38,"Then he said to them, “I am so overwhelmed with sadness that it's killing me. Wait here and keep watch with me.”"
Matthew,26,39,"He went a little farther forward, fell facedown, and prayed.
“My Father, please, if it's possible, let this cup of suffering be taken from me,” Jesus asked. “Even so, may it not be what I want but what you want.”"
Matthew,26,40,"He went back to the disciples and found them asleep. He said to Peter, “What, you couldn't stay awake with me for just one hour?"
Matthew,26,41,"Stay awake and pray, so that you don't fall into temptation. Yes, the spirit is willing, but the body is weak.”"
Matthew,26,42,"He went away a second time and prayed.
“My Father, if this cup cannot be taken from me without me drinking from it, then your will be done,” he said."
Matthew,26,43,"He went back and found them sleeping, for they just couldn't stay awake."
Matthew,26,44,"So he left them once more, and went off and prayed a third time, repeating the same things."
Matthew,26,45,"Then he returned to the disciples, and told them, “How can you still be sleeping and resting? Look, the time has come. The Son of man is about to be betrayed into the hands of sinners!"
Matthew,26,46,"Get up, let's go! Look, the one who's betraying me has arrived.”"
Matthew,26,47,"As he said this, Judas, one of the Twelve, arrived with a large mob armed with swords and clubs sent by the chief priests and elders of the people."
Matthew,26,48,"The betrayer had arranged to give them a signal: “The one that I kiss, that's him—arrest him,” he'd told them."
Matthew,26,49,"Judas came up to Jesus immediately, and said, “Hello, Rabbi,” and kissed him."
Matthew,26,50,"“My friend, do what you came to do,” Jesus said to Judas. So they came and grabbed hold of Jesus, and arrested him."
Matthew,26,51,"One of those who was with Jesus reached for his sword and pulled it out. He struck the high priest's servant, cutting off his ear."
Matthew,26,52,"But Jesus told him, “Put your sword away. Everyone who fights with the sword will die by the sword."
Matthew,26,53,"Don't you think I could ask my Father, and he'd immediately send more than twelve legions of angels?"
Matthew,26,54,But then how could the Scriptures be fulfilled that say it must be like this?”
Matthew,26,55,"Then Jesus told the mob, “Have you come with swords and clubs to arrest me as if I was some kind of dangerous criminal? Every day I sat in the Temple teaching and you didn't arrest me then."
Matthew,26,56,But all this is happening to fulfill what the prophets wrote.” Then all the disciples abandoned him and ran away.
Matthew,26,57,"Those who'd arrested Jesus took him to the home of Caiaphas, the high priest, where the religious teachers and elders had gathered."
Matthew,26,58,"Peter followed him at a distance, and went into the high priest's courtyard. He sat there with the guards to see how things would end."
Matthew,26,59,The chief priests and the whole council were trying to find some false evidence against Jesus so they could put him to death.
Matthew,26,60,"But they couldn't find anything, even though many false witnesses came forward. Eventually two came forward"
Matthew,26,61,"and reported, “This man said, ‘I can destroy God's Temple, and rebuild it in three days.’”"
Matthew,26,62,"The high priest stood up and asked Jesus, “Have you no answer? What do you have to say in your defense?”"
Matthew,26,63,"But Jesus remained silent.
The high priest said to Jesus, “In the name of the living God I place you under oath. Tell us if you are the Messiah, the Son of God.”"
Matthew,26,64,"“You said it,” Jesus replied. “And I also tell you that in the future you'll see the Son of man sitting at the right hand of the Almighty, and coming on the clouds of heaven.”"
Matthew,26,65,"Then the high priest tore his clothes, and said, “He's speaking blasphemy! Why do we need any witnesses? Look, now you've heard for yourselves his blasphemy!"
Matthew,26,66,"What's your verdict?”
“Guilty! He deserves to die!” they answered."
Matthew,26,67,Then they spat in his face and beat him. Some of them slapped him with their hands
Matthew,26,68,"and said, “Prophesy to us, you ‘Messiah’! Who just hit you?”"
Matthew,26,69,"Meanwhile Peter was sitting outside in the courtyard. A servant girl came up to him, and said, “You, you were with Jesus the Galilean!”"
Matthew,26,70,"But he denied it in front of everyone. “I don't know what you're talking about,” he said."
Matthew,26,71,"When he went back to the courtyard entrance another servant girl saw him and said to the people there, “This man was with Jesus of Nazareth.”"
Matthew,26,72,"Once again he denied it, saying with an oath, “I don't know him.”"
Matthew,26,73,"A little while later the people standing there came up to Peter and said, “You definitely are one of them. Your accent gives you away.”"
Matthew,26,74,Then he started to swear: “Curses on me if I'm a liar! I don't know the man!” Immediately the cock crowed.
Matthew,26,75,"Then Peter remembered what Jesus had told him: “Before the cock crows, three times you will deny knowing me.” He went outside and wept bitterly."
Matthew,27,1,Early in the morning all the chief priests and elders of the people consulted together and decided to have Jesus put to death.
Matthew,27,2,"They bound him, led him away, and handed him over to Pilate, the governor."
Matthew,27,3,"When Judas, the one who'd betrayed Jesus, saw that Jesus had been condemned to death, he regretted what he'd done and returned the thirty silver coins to the chief priests and the elders."
Matthew,27,4,"“I've sinned! I've betrayed innocent blood!” he told them.
“What's that got to do with us?” they replied. “That's your problem!”"
Matthew,27,5,Judas threw the silver coins into the sanctuary and left. He went away and hanged himself.
