Matthew,7,28,"When Jesus finished explaining these things, the crowds were amazed at his teaching"
Matthew,7,29,"for he taught like someone with authority, and not like their religious teachers."
Matthew,8,1,Large crowds followed Jesus once he'd come down from the mountain.
Matthew,8,2,"A leper approached him and bowed down, worshiping him, and said, “Lord, if you're willing, please heal me.”"
Matthew,8,3,"Jesus reached out and touched him with his hand. “I am willing,” he said. “Be healed!” Immediately he was healed from his leprosy."
Matthew,8,4,"“Make sure you don't tell anyone,” Jesus told him. “Go and show yourself to the priest and give the offering which Moses required as public proof.”"
Matthew,8,5,"When Jesus entered Capernaum, a centurion came up to him, begging for help"
Matthew,8,6,"“Lord, my servant is at home, lying down, unable to move. He's in terrible agony.”"
Matthew,8,7,"“I will come and heal him,” Jesus replied."
Matthew,8,8,"The centurion answered, “Lord, I don't merit a visit to my home. Just say the word, and my servant will be healed."
Matthew,8,9,"For I am myself under the authority of superiors, while I also have soldiers under my command. I command one, ‘Go!’ and he goes. I command another, ‘Come!’ and he comes. I tell my servant, ‘Do this!’ and he does it.”"
Matthew,8,10,"When Jesus heard what he said, he was astonished. He told those who were following him, “I tell you the truth, I haven't found this kind of trust anywhere in Israel."
Matthew,8,11,"I tell you that many will come from the east and the west, and sit down with Abraham and Isaac and Jacob in the kingdom of heaven."
Matthew,8,12,But the heirs of the kingdom will be thrown out into utter darkness where there will be weeping and grinding of teeth.”
Matthew,8,13,"Then Jesus told the centurion, “Go home. Because you trusted that it would happen, what you asked for has been done.” The servant was healed right away."
Matthew,8,14,"When Jesus arrived at Peter's house, he saw that Peter's mother-in-law was sick in bed with a high fever."
Matthew,8,15,He touched her hand and the fever left her. She got up and began making him a meal.
Matthew,8,16,"When evening came they brought many who were demon-possessed to Jesus. He made the spirits leave at his command, and he healed all those who were sick."
Matthew,8,17,"This fulfilled what the prophet Isaiah said: “He healed our diseases, and freed us from our illnesses.”"
Matthew,8,18,"When Jesus saw the crowds around him, he gave instructions that they should go to the other side of the lake."
Matthew,8,19,"One of the religious teachers approached him and said, “Teacher, I will follow you wherever you go!”"
Matthew,8,20,"“Foxes have their dens, and wild birds have their nests, but the Son of man has nowhere he can lie down and rest,” Jesus told him."
Matthew,8,21,"Another disciple said to Jesus, “Lord, first let me go and bury my father.”"
Matthew,8,22,"“Follow me! Leave the dead to bury their own dead,” Jesus replied."
Matthew,8,23,Then Jesus got into a boat and his disciples went with him.
Matthew,8,24,"A violent storm suddenly blew up, and waves crashed over the boat, but Jesus went on sleeping."
Matthew,8,25,"The disciples went over to him and woke him up. “Save us, Lord! We're going to drown!” they shouted."
Matthew,8,26,"“Why are you so afraid? Why do you trust so little?” he asked them. Then he got up, and commanded the winds and the waves to stop. Everything became absolutely calm."
Matthew,8,27,"The disciples were astonished, and said, “Who is this? Even the winds and the waves obey him!”"
Matthew,8,28,"When he arrived on the other side, in the region of the Gadarenes, two demon-possessed men came out of the graveyard to meet him. They were so dangerous that nobody dared to travel that way."
Matthew,8,29,"They shouted out, “What have you got to do with us, you Son of God? Have you come to torture us before our time?”"
Matthew,8,30,In the distance a large herd of pigs was feeding.
Matthew,8,31,"The demons pleaded with him, “If you're going to drive us out, send us into the herd of pigs.”"
Matthew,8,32,“Go!” said Jesus. The demons left the men and went into the pigs. The whole herd ran down the steep hillside into the sea and drowned.
Matthew,8,33,"The pig herders ran away. They went to the town and told the people there everything that had taken place, and what had happened to the demon-possessed men."
Matthew,8,34,"The whole town came out to meet Jesus. When they found him, they begged him to leave their district."
Matthew,9,1,So Jesus took a boat back across the lake to the town where he lived.
Matthew,9,2,"There they brought to him a paralyzed man lying on a mat. When Jesus saw how they trusted him, he told the paralyzed man, “My friend, cheer up! Your sins are forgiven.”"
Matthew,9,3,"In response some of the religious teachers said to themselves, “He's speaking blasphemy!”"
Matthew,9,4,"But Jesus knew what they were thinking. He asked them, “Why are you thinking evil thoughts in your minds?"
Matthew,9,5,"What is easier to say, ‘Your sins are forgiven,’ or ‘Get up and walk’?"
Matthew,9,6,"But to convince you that the Son of man does have the authority to forgive sins…” he said to the paralyzed man, “Get up, pick up your mat, and go home!”"
Matthew,9,7,The man got up and went home.
Matthew,9,8,"When the crowds saw what had happened, they were scared. Then they praised God that he had given human beings such power."
Matthew,9,9,"As Jesus moved on from there he saw a man called Matthew sitting at the tax booth. Jesus called to him, “Follow me!” He got up, and followed Jesus."
Matthew,9,10,"While Jesus was eating at Matthew's home, many tax collectors and sinners came and sat down at the table with Jesus and his disciples."
Matthew,9,11,"When the Pharisees saw this they asked Jesus' disciples, “Why does your Teacher eat with tax collectors and sinners?”"
Matthew,9,12,"When Jesus heard the question, he replied, “Those who are well don't need a doctor, but sick people do."
Matthew,9,13,"Go and discover what this means: ‘I want mercy, not sacrifice.’ For I didn't come to call those who do what's right—I came to call sinners.”"
Matthew,9,14,"Then the disciples of John came and asked, “Why is that we and the Pharisees fast frequently, but your disciples don't?”"
Matthew,9,15,"“Do wedding guests mourn while the bridegroom is with them?” Jesus responded. “But the time is coming when the bridegroom will be taken from them, and then they will fast."
Matthew,9,16,"No one puts a new patch on old clothes, otherwise it will shrink and make the tear worse."
Matthew,9,17,"No one puts new wine in old wineskins either, otherwise the wineskins will burst, spilling the wine and ruining the wineskins. No, new wine is put into new wineskins, and both last.”"
Matthew,9,18,"While he was telling them this, one of the leading officials came and bowed before him. “My daughter has just died,” the man told Jesus. “But if you come and place your hand on her, I know she will come back to life.”"
Matthew,9,19,Jesus and his disciples got up and followed him.
Matthew,9,20,At that moment a woman who had been sick with bleeding for twelve years came up behind him and touched the hem of his cloak.
Matthew,9,21,"She had told herself, “If I can just touch his cloak, I'll be healed.”"
Matthew,9,22,"Jesus turned and saw her. “Be happy, for your trust in me has healed you,” he told her. The woman was immediately healed."
Matthew,9,23,Jesus arrived at the official's house. He saw the flute-players and the crowd that was weeping loudly.
Matthew,9,24,"“Please leave,” he told them, “For the girl isn't dead, she's just asleep.” But they laughed and made fun of him."
Matthew,9,25,"But once the crowd had been sent out, he went in and took the girl by the hand, and she got up."
Matthew,9,26,News of what happened spread throughout that region.
Matthew,9,27,"As Jesus continued on from there, two blind men followed him, shouting, “Son of David, please have mercy on us!”"
Matthew,9,28,"When Jesus arrived at the house where he was staying, the blind men came in too.
“Are you convinced that I'm able to do this?” he asked them.
“Yes, Lord,” they replied."
Matthew,9,29,"Then Jesus touched their eyes, and said, “Because of your trust in me it will happen!”"
Matthew,9,30,"And they could see. Then Jesus warned them, “Make sure nobody knows about this.”"
Matthew,9,31,But they went and spread the word about Jesus everywhere.
Matthew,9,32,"As Jesus and his disciples were leaving, a man was brought to him who was dumb and demon-possessed."
Matthew,9,33,"Once the demon had been thrown out of him, the dumb man spoke, and the crowds were amazed. “Nothing ever happened like this before in Israel,” they said."
Matthew,9,34,"But the Pharisees remarked, “He throws out demons using the power of the chief of demons.”"
Matthew,9,35,"Jesus went all over, visiting the towns and villages. He taught in their synagogues, telling them about the good news of the kingdom, and he healed all kinds of sicknesses and diseases."
Matthew,9,36,"When he saw the crowds, Jesus was deeply moved with compassion for them, because they were troubled and helpless, like sheep without a shepherd."
Matthew,9,37,"He told his disciples, “The harvest is large, but there are only a few workers."
Matthew,9,38,"Pray to the Lord of the harvest, and ask him to send more workers for his harvest.”"
Matthew,10,1,"Jesus called his twelve disciples together and gave them power to throw out evil spirits, and to heal all kinds of diseases and sicknesses."
Matthew,10,2,"These are the names of the twelve apostles: first, Simon (also called Peter), Andrew his brother, James the son of Zebedee, John his brother"
Matthew,10,3,"Philip, Bartholomew, Thomas, Matthew the tax collector, James the son of Alphaeus, Thaddeus"
Matthew,10,4,"Simon the revolutionary, and Judas Iscariot, who betrayed Jesus."
Matthew,10,5,"Jesus sent out these Twelve, telling them, “Don't go to the foreigners, or to any Samaritan city."
Matthew,10,6,You are to go to the lost sheep of the house of Israel.
Matthew,10,7,"Wherever you go, tell the people, ‘The kingdom of heaven has arrived.’"
Matthew,10,8,"Heal those who are sick. Resurrect the dead. Cure the lepers. Drive out demons. You received freely, so give freely!"
Matthew,10,9,"Don't carry any gold, silver, or copper coins in your pockets"
Matthew,10,10,"or a bag for your journey, or two cloaks, or sandals, or a walking stick, for a worker deserves to be supported."
Matthew,10,11,"Wherever you go, whatever town or village, ask for someone who lives according to good principles, and remain there until you leave."
Matthew,10,12,"When you enter the house, give it your blessing."
Matthew,10,13,"If the home deserves it, let your peace rest on it, but if it doesn't deserve it, let your peace return to you."
Matthew,10,14,"If someone doesn't welcome you, and refuses to listen to what you have to say, then leave that house or that town, shaking its dust off your feet as you go."
Matthew,10,15,"I tell you the truth, it will be better for Sodom and Gomorrah at the Day of Judgment than for that town!"
Matthew,10,16,"Look, I'm sending you out like sheep among wolves. So be as wise as serpents and harmless as doves."
Matthew,10,17,Watch out for those who will hand you over to be tried by town councils and will whip you in their synagogues.
Matthew,10,18,"You will be dragged before governors and kings because of me, to witness to them and to the foreigners."
Matthew,10,19,"But when they put you on trial, don't worry about how you should speak or what you should say, because you'll be told what to say at the right time."
Matthew,10,20,For it isn't you who will speak but the Spirit of the Father will speak through you.
Matthew,10,21,"Brother will betray brother and have him killed, and a father will do the same to his child. Children will rebel against their parents, and have them put to death."
Matthew,10,22,"Everyone will hate you because you follow me, but those who endure until the end will be saved."
Matthew,10,23,"When you're persecuted in one town, run away to the next. I'm telling the truth: you won't finish going to the towns of Israel before the Son of man comes."
Matthew,10,24,Disciples are not more important than their teacher; servants are not more important than their master.
Matthew,10,25,"Disciples should be satisfied to become like their teacher, and servants like their master. If the head of the house has been called the head demon Beelzebub, then the members of his household will be demonized even more!"
Matthew,10,26,"So don't be frightened of them, for there's nothing covered that won't be exposed, and nothing hidden that won't be made known."
Matthew,10,27,"What I tell you here in the dark, declare when it's light, and what you hear whispered in your ear, shout from the rooftops."
Matthew,10,28,"Don't be afraid of those who can kill you physically, but can't kill you spiritually. Instead, be afraid of the one who can destroy you physically and spiritually in Gehenna."
Matthew,10,29,Aren't two sparrows sold for just one penny? But not a single one of them falls to the ground without your Father knowing about it.
Matthew,10,30,Even the hairs on your head have all been counted.
Matthew,10,31,So don't worry—you're worth more than many sparrows!
Matthew,10,32,"Anyone who publicly declares their commitment to me, I will also declare my commitment to them before my Father in heaven."
Matthew,10,33,"But anyone who publicly denies me, I will also deny before my Father in heaven."
Matthew,10,34,"Don't think I've come to bring peace on earth. I haven't come to bring peace, but a sword."
Matthew,10,35,"I've come ‘to turn a man against his father, a daughter against her mother, and a daughter-in-law against her mother-in-law."
Matthew,10,36,Your enemies will be those of your own family!’
Matthew,10,37,"If you love your father or mother more than me you don't deserve to be mine, and if you love your son or daughter more than me you don't deserve to be mine."
Matthew,10,38,If you don't pick up your cross and follow me you don't deserve to be mine.
Matthew,10,39,"If you try to save your life, you will lose it, but if you lose your life because of me you will save it."
Matthew,10,40,"Those who welcome you welcome me, and those who welcome me welcome the one that sent me."
Matthew,10,41,"Those who welcome a prophet because that's what they are, will receive the same reward as a prophet. Those who welcome someone who does right will receive the same reward as someone who does right."
Matthew,10,42,"I tell you the truth, those who give a drink of cool water to the least important of my disciples will definitely not miss out on their reward.”"
Matthew,11,1,"When Jesus had finished giving instructions to his twelve disciples, he left to go and teach and speak publicly in the nearby towns."
Matthew,11,2,"While John was in prison he heard what the Messiah was doing, so he sent his disciples"
Matthew,11,3,"to ask on his behalf, “Are you the one we were expecting to come, or should we continue to look for someone else?”"
Matthew,11,4,"Jesus answered them, “Go back and tell John what you hear and what you see."
Matthew,11,5,"The blind can see, the crippled can walk, the lepers are healed, the deaf can hear, the dead are resurrected, and the poor hear the good news."
Matthew,11,6,Blessed are those who don't reject me!”
Matthew,11,7,"As they left, Jesus began to talk to the crowds about John. “What were you expecting to see when you went out into the desert? A reed tossed about by the wind?"
Matthew,11,8,So what did you go to see? A man dressed in fancy clothes? People dressed like that live in kings' palaces.
Matthew,11,9,"So what did you go to see then? A prophet? Yes, and I tell you he is much more than a prophet!"
Matthew,11,10,He's the one this Scripture was written about: ‘I'm sending my messenger on ahead of you. He will prepare your way for you.’
Matthew,11,11,"I tell you the truth, that among humanity there's no one greater than John the Baptist, but even the least important in the kingdom of heaven is greater than he is."
Matthew,11,12,"From the time of John the Baptist up till now the kingdom of heaven continues to be under attack, and violent people are trying to seize it by force."
Matthew,11,13,For all the prophets and the law spoke for God until John came.
Matthew,11,14,"If you're prepared to believe it, he is Elijah, the one who was expected to come."
Matthew,11,15,Anybody with ears should be listening!
Matthew,11,16,What shall I compare this generation to? It's like children sitting in the marketplaces shouting to each other
Matthew,11,17,‘We played the flute for you and you didn't dance; we sang sad songs and you didn't cry.’
Matthew,11,18,"John didn't come feasting and drinking, so people say, ‘He's devil-possessed!’"
Matthew,11,19,"On the other hand the Son of man came and did feast and drink, and people say, ‘Look, he's greedy and drinks too much; he's a friend of tax collectors and sinners!’ But wisdom is shown to be right by what it does…”"
Matthew,11,20,Then he began to reprimand the towns where he'd done most of his miracles because they had not repented.
Matthew,11,21,"“Shame on you, Korazin! Shame on you, Bethsaida! If the miracles had been performed in Tyre and Sidon which happened among you, they would have repented in sackcloth and ashes long ago."
Matthew,11,22,But I tell you that on the Day of Judgment it will be better for Tyre and Sidon than it will for you!
Matthew,11,23,"And what about you, Capernaum? Will you be exalted to heaven? No, you'll go down to Hades! If the miracles had been performed in Sodom which happened among you, Sodom would still be here today."
Matthew,11,24,But I tell you that on the Day of Judgment it will be better for Sodom than it will for you!”
Matthew,11,25,"Then Jesus prayed, “I praise you, Father, Lord of heaven and earth, for you've hidden these things from the clever and sophisticated. Instead you've revealed them to ordinary people."
Matthew,11,26,"Yes, Father, you were pleased to do this!"
Matthew,11,27,"Everything has been entrusted to me by my Father, and no one really understands the Son, except the Father, and no one really understands the Father, except the Son, and those to whom the Son chooses to reveal him."
Matthew,11,28,"Come to me, all of you who struggle and who are burdened down. I will give you rest."
Matthew,11,29,"Accept my yoke, and learn from me. For I am kind and have a humble heart, and in me you will find the rest you need."
Matthew,11,30,"For my yoke is gentle, and my burden is light.”"
Matthew,12,1,Around that time Jesus was walking through fields of grain on the Sabbath day. His disciples were hungry so they started to pick ears of grain and eat them.
Matthew,12,2,"When the Pharisees saw this they said to Jesus, “Look at your disciples—they're doing what isn't allowed on the Sabbath!”"
Matthew,12,3,"But Jesus told them, “Haven't you read what David did when he and his men were hungry?"
Matthew,12,4,"He went into the house of God, and he and his men ate the sacred bread that they weren't allowed to eat since it's only for the priests."
Matthew,12,5,Haven't you read in the law that on the Sabbath day the priests in the Temple break the Sabbath but are not considered guilty?
Matthew,12,6,"However, I tell you that someone is here who is greater than the Temple!"
Matthew,12,7,"If you'd known the meaning of this Scripture, ‘I want mercy, and not sacrifice,’ you wouldn't have condemned those who are innocent."
Matthew,12,8,For the Son of man is Lord of the Sabbath.”
Matthew,12,9,Then Jesus left and went into their synagogue.
Matthew,12,10,"A man was there with a crippled hand. “Does the law allow healing on the Sabbath?” they asked him, looking for a reason to accuse him."
Matthew,12,11,“Suppose you have a sheep and it falls into a hole in the ground on the Sabbath. Don't you grab hold of it and pull it out?” Jesus asked them.
Matthew,12,12,"“Don't you think a human being is worth much more than a sheep? So yes, you are allowed to do good on the Sabbath.”"
Matthew,12,13,"Then he said to the man, “Hold out your hand.” The man held out his hand, and it was healed, just as healthy as the other hand."
Matthew,12,14,But the Pharisees went out and plotted how to kill Jesus.
Matthew,12,15,"Knowing this, Jesus left, with large crowds following him. He healed all of them"
Matthew,12,16,but instructed them not to tell people who he was.
Matthew,12,17,This fulfilled what Isaiah the prophet said
Matthew,12,18,"This is my servant whom I've chosen,
The one I love, who pleases me.
I will put my Spirit on him,
And he will tell the foreigners what's right."
Matthew,12,19,"He won't argue, he won't shout out,
And nobody will hear his voice in the streets."
Matthew,12,20,"He won't break a damaged reed,
And he won't extinguish a smoking wick,
Until he has proved that his judgment is right"
Matthew,12,21,And foreigners will put their hope in him.
Matthew,12,22,"Then a man was brought to Jesus who was demon-possessed and blind and dumb. Jesus healed him, so that the dumb man could speak and see."
Matthew,12,23,"All the crowds were amazed, and asked, “This man couldn't really be the son of David, could he?”"
Matthew,12,24,"But when the Pharisees heard this, they replied, “This man can only throw out demons through the power of Beelzebub, the chief of demons!”"
Matthew,12,25,"Knowing what they were thinking, Jesus told them, “Any kingdom that is divided against itself will be destroyed. No town or household that is divided against itself can stand."
Matthew,12,26,"If Satan drives out Satan, then he's divided against himself—so how could his kingdom stand?"
Matthew,12,27,"If I'm throwing out demons in the name of Beelzebub, in whose name are your people throwing out demons? Your own people prove you're wrong!"
Matthew,12,28,"But if I'm throwing out demons through the power of the Spirit of God, then the kingdom of God has come to you!"
Matthew,12,29,Can you enter a strong man's house and take his belongings unless you tie him up first? If you do that then you can take everything in his house.
Matthew,12,30,"Those who are not with me are against me, and those who do not gather together with me do the opposite: they are scattering."
Matthew,12,31,"That's why I'm telling you that every sin and blasphemy you commit will be forgiven, except blasphemy against the Spirit which won't be forgiven."
Matthew,12,32,"Those who say something against the Son of man will be forgiven, but those who say something against the Holy Spirit won't be forgiven, neither in this life nor the next."
Matthew,12,33,"Either decide that the tree is good, and its fruit is good, or decide that the tree is bad and its fruit is bad—for the tree is known by its fruit."
Matthew,12,34,"You viper's brood, how can you who are evil say anything good? For your mouth simply says what your mind is busy thinking about."
Matthew,12,35,"A good person brings out good from their store of good things, and an evil person brings out evil from their store of evil things."
Matthew,12,36,"I tell you, people will have to account for every careless thing they say on the Day of Judgment."
Matthew,12,37,For what you say will either vindicate you or condemn you.”
Matthew,12,38,"Then some of the religious teachers and Pharisees came to him and said, “Teacher, we want you to show us a miraculous sign.”"
Matthew,12,39,"“An evil and adulterous generation are the ones who look for a miraculous sign. The only sign they will be given is the sign of the prophet Jonah,” Jesus told them."
Matthew,12,40,"“In the same way Jonah was in the belly of a huge fish for three days and three nights, the Son of man will be in the heart of the earth for three days and three nights."
Matthew,12,41,"The people of Nineveh will rise in the judgment together with this generation and they will condemn it because they repented in response to Jonah's message—and as you see, there's someone greater than Jonah here!"
Matthew,12,42,"The Queen of the South will be raised in the judgment together with this generation and will condemn it because she came from the ends of the earth to hear the wisdom of Solomon—and as you see, there's someone greater than Solomon here!"
Matthew,12,43,"When an evil spirit leaves someone, it wanders through deserted places looking for rest, and finds nowhere to stay."
Matthew,12,44,"So it says, ‘I'll go back to the place I left,’ and when it returns it finds the place empty, all clean and tidy."
Matthew,12,45,"Then it goes and brings back seven other spirits even more evil than it is, and it enters and lives there. So the person ends up worse than they were at the beginning. That's the way it will be with this evil generation.”"
Matthew,12,46,"While he was speaking to the crowds, his mother and his brothers arrived and stood outside, wanting to talk to him."
Matthew,12,47,"Someone came and told him, “Look, your mother and brothers are outside, wanting to talk to you.”"
Matthew,12,48,“Who is my mother? Who are my brothers?” Jesus asked.
Matthew,12,49,"He pointed at his disciples, and said, “Look, they are my mother and my brothers!"
Matthew,12,50,"For those who do the will of my heavenly Father, they are my brother, sister, and mother!”"
Matthew,13,1,"Later that day Jesus left the house, and sat down to teach beside the sea."
Matthew,13,2,"So many people gathered around him that he got into a boat and sat down there to teach, while all the crowds stood on the beach."
