Leviticus,7,4,It must include both kidneys with the fat on them next to the lower back muscles. It must also include the long part of the liver. Remove all of it together with the kidneys.
Leviticus,7,5,The priest must burn all of it on the altar. It is a food offering presented to the Lord . It is a guilt offering.
Leviticus,7,6,Any male in a priest’s family can eat it. But he must eat it in the holy area. It is very holy.
Leviticus,7,7,“ ‘The same law applies to the sin offering and the guilt offering. Both of them belong to the priest who offers them to pay for sin.
Leviticus,7,8,The priest who offers a burnt offering for anyone can keep its hide for himself.
Leviticus,7,9,Every grain offering baked in an oven belongs to the priest who offers it. So does every grain offering cooked in a pan or on a metal plate.
Leviticus,7,10,Every grain offering belongs equally to all the priests in Aaron’s family line. That is true whether it is mixed with olive oil or it is dry.
Leviticus,7,11,“ ‘Here are some more rules for friendship offerings anyone may bring to the Lord.
Leviticus,7,12,“ ‘Suppose they offer a friendship offering to show they are thankful. Then together with the thank offering they must offer thick loaves of bread. They must make them without yeast. They must mix them with olive oil. Or they must offer thin loaves of bread made without yeast. They must spread olive oil on them. Or they must offer thick loaves of bread made out of the finest flour. They must add olive oil to it. They must work the flour and prepare it well.
Leviticus,7,13,They must bring another friendship offering along with their thank offering. It should be thick loaves of bread made with yeast.
Leviticus,7,14,They must bring one of each kind of bread as an offering. One kind is made with yeast. The other is not. Both of them are a gift to the Lord . They belong to the priest who splashes the blood of the friendship offering against the altar.
Leviticus,7,15,The person must eat the meat from their thank offering on the day they offer it. They must not leave any of it until morning.
Leviticus,7,16,"“ ‘But suppose they bring a friendship offering to keep a promise they have made. Or suppose they bring an offering they choose to give. Then they must eat the sacrifice on the day they offer it. But if anything is left over, they may eat it the next day."
Leviticus,7,17,They must burn up any meat from the sacrifice left over until the third day.
Leviticus,7,18,"Suppose they eat any meat from the friendship offering on the third day. Then the Lord will not accept the offering. He will not accept it as a gift from them. It is not pure. If they eat any of it, they will be held responsible for it."
Leviticus,7,19,“ ‘They must not eat meat that touches anything “unclean.” They must burn it up. Anyone “clean” may eat any other meat.
Leviticus,7,20,But suppose an “unclean” person eats any meat from the friendship offering that belongs to the Lord . Then they will be separated from their people.
Leviticus,7,21,Suppose someone touches something “unclean.” It does not matter whether it comes from a human being who is not “clean.” It does not matter whether it comes from an “unclean” animal. It does not matter whether it comes from something hated and “unclean.” And suppose they eat any of the meat from the friendship offering that belongs to the Lord . Then they will be separated from their people.’ ”
Leviticus,7,22,"The Lord spoke to Moses. He said,"
Leviticus,7,23,"“Speak to the Israelites. Tell them, ‘Do not eat any of the fat of cattle, sheep or goats."
Leviticus,7,24,Do not eat the fat of any animal found dead. Do not eat the fat of an animal that wild animals have torn apart. But you can use the fat for any other purpose.
Leviticus,7,25,"Suppose an animal has been sacrificed as a food offering to the Lord . No one may eat its fat. If they do, they will be separated from their people."
Leviticus,7,26,"No matter where you live, do not eat the blood of any bird or animal."
Leviticus,7,27,Anyone who eats blood must be separated from their people.’ ”
Leviticus,7,28,"The Lord spoke to Moses. He said,"
Leviticus,7,29,"“Speak to the Israelites. Tell them, ‘Suppose someone brings a friendship offering to the Lord . Then they must bring part of it as their special gift to the Lord."
Leviticus,7,30,They must bring it with their own hands. It is a food offering presented to the Lord . They must bring the fat together with the breast. They must lift the breast up and wave it in front of the Lord as a wave offering.
Leviticus,7,31,The priest will burn the fat on the altar. But the breast belongs to Aaron and the priests in his family line.
Leviticus,7,32,Give the right thigh from your friendship offerings to the priest as a gift.
Leviticus,7,33,The priest who offers the blood and fat from the friendship offering must be given the right thigh. It is his share.
Leviticus,7,34,"I, the Lord , have taken the breast that is waved and the thigh that is given. I have taken them from the friendship offerings of the Israelites. And I have given them to Aaron the priest and the priests in his family line. The offerings will be their share from the Israelites for all time to come.’ ”"
Leviticus,7,35,That is the part of the food offerings presented to the Lord . It is given to Aaron and the priests in his family line. It was given to Aaron and his sons on the day they were set apart to serve the Lord as priests.
Leviticus,7,36,"On the day they were anointed, the Lord commanded the Israelites to give that part to them. For all time to come, it will be the share of Aaron and the priests in his family line."
Leviticus,7,37,"These are the rules for burnt offerings, grain offerings, sin offerings, guilt offerings and friendship offerings. They are also the rules for the offerings that are given when priests are being prepared to serve the Lord."
Leviticus,7,38,They are the rules the Lord gave Moses on Mount Sinai. He gave them on the day he commanded the Israelites to bring their offerings to the Lord . That took place in the Sinai Desert.
Leviticus,8,1,"The Lord spoke to Moses. He said,"
Leviticus,8,2,“Bring Aaron and his sons to the entrance to the tent of meeting. Bring their clothes and the anointing oil. Bring the bull for the sin offering. Also bring two rams. And bring the basket with the bread made without yeast.
Leviticus,8,3,Then gather the whole community at the entrance to the tent of meeting.”
Leviticus,8,4,Moses did just as the Lord had commanded him. All the people gathered together at the entrance to the tent of meeting.
Leviticus,8,5,"Moses said to the people, “Here is what the Lord has commanded us to do.”"
Leviticus,8,6,Then Moses brought Aaron and his sons to the people. He washed Aaron and his sons with water.
Leviticus,8,7,He put the inner robe on Aaron. He tied the belt around him. He dressed him in the outer robe. He put the linen apron on him. He took the skillfully made waistband and tied the apron on him with it. He wanted to make sure it was securely tied to him.
Leviticus,8,8,Moses placed the chest cloth on Aaron. He put the Urim and Thummim in the chest cloth.
Leviticus,8,9,Then he placed the turban on Aaron’s head. On the front of the turban he put the gold plate. It was a sacred crown. Moses did everything just as the Lord had commanded him.
Leviticus,8,10,Then Moses took the anointing oil and poured it on the holy tent. He also poured it on everything in it. That’s how he set apart those things for the Lord.
Leviticus,8,11,He sprinkled some of the oil on the altar seven times. He poured oil on the altar and all its tools. He poured it on the large bowl and its stand. He did it to set them apart.
Leviticus,8,12,He poured some of the anointing oil on Aaron’s head. He anointed him to set him apart to serve the Lord.
Leviticus,8,13,Then Moses brought Aaron’s sons to the people. He put the inner robes on them. He tied belts around them. He put caps on their heads. He did everything just as the Lord had commanded him.
Leviticus,8,14,Then he brought the bull for the sin offering. Aaron and his sons placed their hands on its head.
Leviticus,8,15,Moses killed the bull. He dipped his finger into some of the blood. He put it on the horns that stick out from the upper four corners of the altar. He did it to make the altar pure. He poured out the rest of the blood at the bottom of the altar. So he set it apart to make it pure.
Leviticus,8,16,Moses also removed all the fat around the inside parts of the bull. He removed the long part of the liver. He took both kidneys and their fat. Then he burned all of it on the altar.
Leviticus,8,17,"But he burned the rest of the bull outside the camp. He burned up its hide, its meat and its guts. He did it just as the Lord had commanded him."
Leviticus,8,18,Then Moses brought the ram for the burnt offering. Aaron and his sons placed their hands on its head.
Leviticus,8,19,Moses killed the ram. He splashed the blood against the sides of the altar.
Leviticus,8,20,"He cut the ram into pieces. He burned the head, the other pieces and the fat."
Leviticus,8,21,He washed the inside parts and the legs with water. He burned the whole ram on the altar as a burnt offering. It had a pleasant smell. It was a food offering presented to the Lord . Moses did everything just as the Lord had commanded him.
Leviticus,8,22,Then he brought the other ram. It was sacrificed to prepare the priests for serving the Lord . Aaron and his sons placed their hands on its head.
Leviticus,8,23,Moses killed the ram. He put some of its blood on Aaron’s right earlobe. He put some on the thumb of Aaron’s right hand. He also put some on the big toe of Aaron’s right foot.
Leviticus,8,24,Then Moses brought Aaron’s sons to the people. He put some of the blood on their right earlobes. He put some on the thumbs of their right hands. He also put some on the big toes of their right feet. Then he splashed the rest of the blood against the sides of the altar.
Leviticus,8,25,"He removed the fat, the fat tail and all the fat around the inside parts. He removed the long part of the liver. He removed both kidneys and their fat. And he removed the right thigh."
Leviticus,8,26,Then he took a thick loaf of bread from the basket of bread made without yeast. The basket was in front of the Lord . Moses took a thick loaf of bread made with olive oil. He also took a thin loaf of bread. He put all of it on the fat parts of the ram and on its right thigh.
Leviticus,8,27,He put everything in the hands of Aaron and his sons. He told them to lift it up and wave it in front of the Lord as a wave offering.
Leviticus,8,28,Then Moses took it from their hands. He burned it on the altar on top of the burnt offering. It was the offering that was sacrificed to prepare the priests for serving the Lord . It had a pleasant smell. It was a food offering presented to the Lord.
Leviticus,8,29,Moses also lifted up the ram’s breast and waved it in front of the Lord as a wave offering. The breast was Moses’ share of the ram that was sacrificed to prepare the priests for serving the Lord . Moses did everything just as the Lord had commanded him.
Leviticus,8,30,Then Moses took some of the anointing oil. He also took some of the blood from the altar. He sprinkled some of the oil and blood on Aaron and his clothes. He also sprinkled some on Aaron’s sons and their clothes. That’s how he set apart Aaron and his clothes. And that’s how he set apart Aaron’s sons and their clothes.
Leviticus,8,31,"Then Moses spoke to Aaron and his sons. He said, “Cook the meat at the entrance to the tent of meeting. Eat it there along with the bread from the basket of the offerings that are brought to prepare the priests for serving the Lord . Do it just as I was commanded. I was told, ‘Aaron and his sons must eat it.’"
Leviticus,8,32,Then burn up the rest of the meat and the bread.
Leviticus,8,33,Don’t leave the entrance to the tent of meeting for seven days. Don’t leave until the days that are required to prepare you for serving the Lord have been completed. Stay here for the full seven days.
Leviticus,8,34,The Lord commanded what has been done here today. It was done to pay for your sin.
Leviticus,8,35,Stay at the entrance to the tent of meeting for seven days. Stay here day and night. Do what the Lord requires. Then you won’t die. That’s the command the Lord gave me.”
Leviticus,8,36,So Aaron and his sons did everything just as the Lord had commanded through Moses.
Leviticus,9,1,"On the eighth day Moses sent for Aaron, his sons and the elders of Israel."
Leviticus,9,2,"He said to Aaron, “Bring a bull calf for your sin offering. Bring a ram for your burnt offering. They must not have any flaws. Offer them to the Lord."
Leviticus,9,3,"Then speak to the Israelites. Tell them, ‘Bring a male goat for a sin offering. Bring a calf and a lamb for a burnt offering. Both of them must be a year old. They must not have any flaws."
Leviticus,9,4,Bring an ox and a ram for a friendship offering. Sacrifice all of them to the Lord . Also bring a grain offering. Mix it with olive oil. Today the Lord will appear to you.’ ”
Leviticus,9,5,The people got the things Moses commanded them to get. They took them to the front of the tent of meeting. The whole community came up close to the tent. They stood there in front of the Lord.
Leviticus,9,6,"Then Moses said, “You have done what the Lord has commanded. So the glory of the Lord will appear to you.”"
Leviticus,9,7,"Moses said to Aaron, “Come to the altar. Sacrifice your sin offering and your burnt offering. Pay for your sin and the sin of the people. Sacrifice the people’s offering. Pay for their sin. Do just as the Lord has commanded.”"
Leviticus,9,8,So Aaron came to the altar. He killed the calf as a sin offering for himself.
Leviticus,9,9,His sons brought its blood to him. He dipped his finger into the blood. He put some on the horns that stick out from the upper four corners of the altar. He poured out the rest of the blood at the bottom of the altar.
Leviticus,9,10,He burned the fat and the kidneys on the altar. He also burned the long part of the liver. All these parts were from the sin offering. Aaron did just as the Lord had commanded Moses.
Leviticus,9,11,He burned up the meat and the hide outside the camp.
Leviticus,9,12,Then he killed the animal for the burnt offering. His sons handed him its blood. He splashed it against the sides of the altar.
Leviticus,9,13,They handed him the burnt offering piece by piece. It included the animal’s head. Aaron burned everything on the altar.
Leviticus,9,14,He washed the inside parts and the legs. He burned them on top of the burnt offering on the altar.
Leviticus,9,15,Then Aaron brought the people’s offering. He took the goat for their sin offering and killed it. He offered it for a sin offering. He did just as he had done with his own sin offering.
Leviticus,9,16,He brought the animal for the burnt offering. He offered it in the way the law requires.
Leviticus,9,17,He also brought the grain offering. He took a handful of it and burned it on the altar. It was in addition to that morning’s burnt offering.
Leviticus,9,18,Aaron killed the ox and the ram as the friendship offering for the people. His sons handed him the blood. He splashed it against the sides of the altar.
Leviticus,9,19,His sons also brought the fat parts of the ox and the ram. They included the fat tail and the layer of fat. They also included the kidneys and the long part of the liver.
Leviticus,9,20,Aaron’s sons placed everything on the breasts of the animals. Aaron burned the fat on the altar.
Leviticus,9,21,He lifted up the breasts and the right thigh and waved them in front of the Lord as a wave offering. He did it just as Moses had commanded.
Leviticus,9,22,"Then Aaron lifted up his hands toward the people. He gave them a blessing. He had already sacrificed the sin offering, the burnt offering and the friendship offering. So he stepped down from the altar."
Leviticus,9,23,"Moses and Aaron went into the tent of meeting. When they came out, they gave the people a blessing. The glory of the Lord appeared to all the people."
Leviticus,9,24,The Lord sent fire on the altar. The fire burned up the burnt offering along with the fat parts. All the people saw it. Then they shouted for joy. They fell with their faces to the ground.
Leviticus,10,1,Nadab and Abihu were two of Aaron’s sons. They got their shallow cups for burning incense. They put fire in them. They added incense to it. They made an offering to the Lord by using fire that wasn’t allowed. They did it against his command.
Leviticus,10,2,So the Lord sent fire on them. It burned them up. They died in front of the Lord.
Leviticus,10,3,"Then Moses spoke to Aaron. He said, “That’s what the Lord was talking about when he said, “ ‘Among those who approach me I will show that I am holy. In the sight of all the people I will be honored.’ ” So Aaron remained silent."
Leviticus,10,4,"Moses sent for Mishael and Elzaphan. They were sons of Aaron’s uncle Uzziel. Moses said to them, “Come here. Carry the bodies of your cousins outside the camp. Take them away from in front of the Holy Room.”"
Leviticus,10,5,So they came and carried them outside the camp. It was just as Moses had ordered. The bodies of Nadab and Abihu still had their inner robes on them.
Leviticus,10,6,"Moses spoke to Aaron and to Eleazar and Ithamar. They were Aaron’s sons. Moses said, “Don’t let your hair hang loose. Don’t tear your clothes. If you do, you will die. And the Lord will be angry with the whole community. But all the Israelites are allowed to show they are sad. They are your relatives. They may mourn for those the Lord has destroyed with fire."
Leviticus,10,7,"Don’t leave the entrance to the tent of meeting. If you do, you will die. That’s because the Lord ’s anointing oil has made you holy.” So they did what Moses told them to do."
Leviticus,10,8,"Then the Lord spoke to Aaron. He said,"
Leviticus,10,9,"“You and your sons will go into the tent of meeting. When you do, you must not drink any kind of wine. If you do, you will die. This is a law that will last for all time to come."
Leviticus,10,10,This is so that you can tell the difference between what is holy and what is not. You must be able to tell the difference between what is ‘clean’ and what is not.
Leviticus,10,11,Then you will be able to teach the Israelites all the rules I have given them through Moses.”
Leviticus,10,12,"Moses spoke to Aaron and to Eleazar and Ithamar. They were Aaron’s two remaining sons. Moses said, “Take the grain offering left over from the food offerings presented to the Lord . It is very holy. Make bread without yeast from it. Eat it beside the altar."
Leviticus,10,13,Eat it in the holy area. It’s your share and your sons’ share of the food offerings presented to the Lord . These rules are in keeping with the command the Lord gave me.
Leviticus,10,14,But you and your sons and your daughters can eat the breast that was waved. You can also eat the thigh that was offered. Eat them in a ‘clean’ place. They have been given to you and your children. They are your share of the friendship offerings the Israelites bring.
Leviticus,10,15,The thigh that was offered must be brought together with the fat parts of the food offerings. The breast that was waved must be brought in the same way. All of it must be lifted up and waved in front of the Lord as a wave offering. It will be the share for you and your children for all time to come. That’s what the Lord has commanded.”
Leviticus,10,16,"Moses asked about the goat that was brought as the sin offering. He found out that it had been burned up. So he became angry with Eleazar and Ithamar. They were Aaron’s two remaining sons. Moses asked them,"
Leviticus,10,17,“Why didn’t you eat the sin offering in a place near the Holy Room? The offering is very holy. It was given to you to take the people’s guilt away. It paid for their sin in the sight of the Lord.
Leviticus,10,18,The blood of the offering wasn’t taken into the Holy Room. So you should have eaten the goat in a place near the Holy Room. That’s what I commanded.”
Leviticus,10,19,"Aaron replied to Moses, “Today the people sacrificed their sin offering to the Lord . They also sacrificed their burnt offerings to him. But a terrible thing has happened to me. Two of my sons have died. Would the Lord have been pleased if I had eaten the sin offering today?”"
Leviticus,10,20,"When Moses heard that, he was satisfied."
Leviticus,11,1,"The Lord spoke to Moses and Aaron. He said to them,"
Leviticus,11,2,"“Speak to the Israelites. Tell them, ‘Many animals live on land. Here are the only ones you can eat."
Leviticus,11,3,You can eat any animal that has hooves that are separated completely in two. But it must also chew the cud.
Leviticus,11,4,“ ‘Some animals only chew the cud. Some only have hooves that are separated in two. You must not eat those animals. Camels chew the cud. But their hooves are not separated in two. So they are “unclean” for you.
Leviticus,11,5,Rock badgers chew the cud. But their hooves are not separated in two. So they are “unclean” for you.
Leviticus,11,6,Rabbits chew the cud. But their hooves are not separated in two. So they are “unclean” for you.
Leviticus,11,7,Pigs have hooves that are separated completely in two. But they do not chew the cud. So they are “unclean” for you.
Leviticus,11,8,You must not eat the meat of those animals. You must not even touch their dead bodies. They are “unclean” for you.
Leviticus,11,9,“ ‘Many creatures live in the water of the oceans and streams. You can eat all those that have fins and scales.
Leviticus,11,10,Treat as “unclean” all the creatures in the oceans or streams that do not have fins and scales. That includes all those that move together in groups and all those that do not.
Leviticus,11,11,Treat them as “unclean.” Do not eat their meat. Treat their dead bodies as “unclean.”
Leviticus,11,12,Regard as “unclean” everything that lives in the water that does not have fins and scales.
Leviticus,11,13,"“ ‘Here are the birds you must treat as “unclean.” Do not eat them because they are “unclean.” The birds include eagles, vultures and black vultures."
Leviticus,11,14,They include red kites and all kinds of black kites.
Leviticus,11,15,They include all kinds of ravens.
Leviticus,11,16,"They include horned owls, screech owls, gulls and all kinds of hawks."
Leviticus,11,17,"They include little owls, cormorants and great owls."
Leviticus,11,18,"They include white owls, desert owls and ospreys."
Leviticus,11,19,"They also include storks, hoopoes, bats and all kinds of herons."
Leviticus,11,20,“ ‘Treat as “unclean” every flying insect that walks on all fours.
Leviticus,11,21,But you can eat some flying insects that walk on all fours. Their legs have joints so they can hop on the ground.
Leviticus,11,22,"Here are the insects you can eat. You can eat all kinds of locusts, katydids, crickets and grasshoppers."
Leviticus,11,23,Treat as “unclean” every other creature with wings and four legs.
Leviticus,11,24,"“ ‘You will make yourselves “unclean” if you eat these things. If you touch their dead bodies, you will be “unclean” until evening."
Leviticus,11,25,"If a person picks up one of their dead bodies, that person must wash their clothes. They will be “unclean” until evening."
Leviticus,11,26,"“ ‘Suppose an animal has hooves that are not separated completely in two. Or suppose an animal does not chew the cud. Then these animals are “unclean” for you. If you touch the dead body of any of them, you will be “unclean.”"
Leviticus,11,27,Many animals walk on all fours. But those that walk on their paws are “unclean” for you. Anyone who touches their dead bodies will be “unclean” until evening.
Leviticus,11,28,"If a person picks up their dead bodies, that person must wash their clothes. They will be “unclean” until evening. These animals are “unclean” for you."
Leviticus,11,29,"“ ‘Many animals move along the ground. Here are the ones that are “unclean” for you. They include weasels, rats and all kinds of large lizards."
Leviticus,11,30,"They also include geckos, monitor lizards, wall lizards, skinks and chameleons."
Leviticus,11,31,"These are the animals that move around on the ground that are “unclean” for you. If you touch their dead bodies, you will be “unclean” until evening."
Leviticus,11,32,"Suppose one of them dies and falls on something. Then that thing will be “unclean.” It does not matter what it is used for. It does not matter whether it is made out of wood, cloth, hide or rough cloth. Put it in water. It will be “unclean” until evening. After that, it will be “clean.”"
Leviticus,11,33,Suppose one of these animals falls into a clay pot. Then everything in the pot will be “unclean.” You must break the pot.
Leviticus,11,34,Any food that could be eaten but has water on it that came from that pot is “unclean.” And any liquid that could be drunk from it is “unclean.”
Leviticus,11,35,"Anything that the dead body of one of these animals falls on becomes “unclean.” If it is an oven or cooking pot, break it. It is “unclean.” And you must consider it “unclean.”"
Leviticus,11,36,But a spring or a well for collecting water remains “clean.” That is true even if the dead body of one of these animals falls into it. But anyone who touches the dead body is not “clean.”
Leviticus,11,37,"If the dead body falls on any seeds that have not been planted yet, the seeds remain “clean.”"
