Leviticus,20,6,“ ‘Suppose someone looks for advice from people who get messages from those who have died. Or they go to people who talk to the spirits of the dead. And they do what those people say. Then they have not been faithful to me. So I will turn against them. I will separate them from their people.
Leviticus,20,7,"“ ‘Set yourselves apart for me. Be holy, because I am the Lord your God."
Leviticus,20,8,Obey my rules. Follow them. I am the Lord . I make you holy.
Leviticus,20,9,“ ‘Anyone who asks for bad things to happen to their father or mother must be put to death. They have cursed their father or mother. So anything that happens to them will be their own fault.
Leviticus,20,10,“ ‘Suppose a man commits adultery with his neighbor’s wife. Then the man and the woman must be put to death.
Leviticus,20,11,“ ‘Suppose a man has sex with his father’s wife. Then he has brought shame on his father. The man and the woman must be put to death. Anything that happens to them will be their own fault.
Leviticus,20,12,“ ‘Suppose a man has sex with his daughter-in-law. Then they must be put to death. They have used sex in the wrong way. Anything that happens to them will be their own fault.
Leviticus,20,13,“ ‘Suppose a man has sex with another man as he would have sex with a woman. I hate what they have done. They must be put to death. Anything that happens to them will be their own fault.
Leviticus,20,14,“ ‘Suppose a man gets married to both a woman and her mother. That is evil. All of them must be burned to death. Then there will not be any evil among you.
Leviticus,20,15,“ ‘Suppose a man has sex with an animal. Then he must be put to death. You must also kill the animal.
Leviticus,20,16,“ ‘Suppose a woman has sex with an animal. Then kill the woman and the animal. They must be put to death. Anything that happens to them will be their own fault.
Leviticus,20,17,“ ‘Suppose a man gets married to his sister and has sex with her. That is a shameful thing to do. It does not matter whether she is the daughter of his father or of his mother. They must be separated from their community in front of everyone. That man has brought shame on his sister. He will be responsible for what he has done.
Leviticus,20,18,“ ‘Suppose a man has sex with a woman during her monthly period. He has uncovered the place where her bleeding was coming from. And she has let him do it. So both of them must be separated from their people.
Leviticus,20,19,“ ‘Do not have sex with the sister of either your mother or your father. That would bring shame on a close relative. Both of you would be held responsible for what you have done.
Leviticus,20,20,“ ‘Suppose a man has sex with his aunt. Then he has brought shame on his uncle. Both of them will be held accountable for what they have done. They will die without having any children.
Leviticus,20,21,“ ‘Suppose a man gets married to his brother’s wife. That is something that should never be done. He has brought shame on his brother. Neither of them will have any children.
Leviticus,20,22,“ ‘Obey all my rules and laws. Follow them. Then the land where I am bringing you to live will not throw you out.
Leviticus,20,23,"To make room for you, I am going to drive out the nations that are in the land. You must not follow the practices of those nations. I hated those nations because they did all those things."
Leviticus,20,24,"But I said to you, “You will take over their land as your own. I will give it to you. It will belong to you. It is a land that has plenty of milk and honey.” I am the Lord your God. I have set you apart from the other nations."
Leviticus,20,25,“ ‘So you must be able to tell the difference between animals that are “clean” and those that are not. You must know which birds are “clean” and which are not. Do not make yourselves “unclean” by eating any “unclean” animal or bird. Do not make yourselves “unclean” by eating anything that moves along the ground. I have set all of them apart as “unclean” for you.
Leviticus,20,26,You must be holy. You must be set apart to me. I am the Lord . I am holy. I have set you apart from the other nations to be my own people.
Leviticus,20,27,“ ‘Suppose a man or woman gets messages from those who have died. Or suppose a man or woman talks to the spirits of the dead. Then you must put that man or woman to death. You must kill them by throwing stones at them. Anything that happens to them will be their own fault.’ ”
Leviticus,21,1,"The Lord said to Moses, “Speak to the priests, the sons of Aaron. Tell them, ‘A priest must not make himself “unclean” by going near the dead body of any of his people."
Leviticus,21,2,"But he can go near the body of a close relative. It could be his mother, father, son, daughter or brother."
Leviticus,21,3,He can also go near a sister who is not married. She would have depended on him because she did not have a husband. The priest can make himself “unclean” by going near her body.
Leviticus,21,4,But he must not make himself “unclean” by going near the bodies of people only related to him by marriage. Going near them would make him “unclean.”
Leviticus,21,5,“ ‘Priests must not shave any part of their heads. They must not shave off the edges of their beards. They must not make cuts on their bodies when someone dies.
Leviticus,21,6,Priests must be holy. They must be set apart for me. I am their God. They must not treat my name as if it were not holy. They must be holy because they bring food offerings to me. That is my food.
Leviticus,21,7,“ ‘They must not get married to women who are “unclean” because they are prostitutes. They must not marry women who are divorced from their husbands. That is because priests are holy. They are set apart for me. I am their God.
Leviticus,21,8,"Consider them as holy, because they offer up food to me. Consider them as holy, because I am holy. I am the Lord . I make you holy."
Leviticus,21,9,“ ‘Suppose a priest’s daughter makes herself “unclean” by becoming a prostitute. Then she brings shame on her father. She must be burned to death.
Leviticus,21,10,"“ ‘The high priest is the one among his brothers whose head has been anointed with olive oil. He has been appointed to wear the priest’s clothes. When someone dies, the high priest must not let his own hair hang loose. He must not tear his clothes to show how sad he is."
Leviticus,21,11,"He must not enter a place where there is a dead body. He must not make himself “unclean,” even if his father or mother dies."
Leviticus,21,12,He must not leave the sacred tent of the Lord to take part in burying a body. That would bring shame on the tent. The anointing oil has set the high priest apart. I am the Lord.
Leviticus,21,13,“ ‘The woman the high priest gets married to must be a virgin.
Leviticus,21,14,He must not marry a widow or a woman who is divorced. He must not marry a woman who is “unclean” because she is a prostitute. He must only marry a virgin. She must come from his own people.
Leviticus,21,15,"If he doesn’t marry a virgin, he makes the children he has by her “unclean.” I am the Lord . I make him holy.’ ”"
Leviticus,21,16,"The Lord said to Moses,"
Leviticus,21,17,"“Speak to Aaron. Tell him, ‘No man in your family line with any flaws may come near to offer food to the Lord . This is true for all time to come."
Leviticus,21,18,No man who has any flaws can come near. No man who is blind or disabled can come. No man whose body is scarred or twisted can come.
Leviticus,21,19,No man whose foot or hand is disabled can come.
Leviticus,21,20,No man whose back is bent can come. No man who is too short can come. No man who has anything wrong with his eyes can come. No man who has boils or running sores can come. No man whose sex glands are crushed can come.
Leviticus,21,21,"No man with any flaws who is in the family line of Aaron the priest may come near me. He can’t come to bring the food offerings to the Lord . If he has any flaws, he must not come near to offer food to the Lord."
Leviticus,21,22,He can eat the holy food. He can also eat my very holy food.
Leviticus,21,23,"But because he has a flaw, he must not go near the curtain or approach the altar. If he does, he will make my sacred tent “unclean.” I am the Lord . I make everything holy.’ ”"
Leviticus,21,24,So Moses told all these things to Aaron and his sons. He also told them to all the Israelites.
Leviticus,22,1,"The Lord said to Moses,"
Leviticus,22,2,“Here is what I want you to tell Aaron and his sons. Tell them to treat the sacred offerings with respect. They are the offerings the Israelites set apart to honor me. So Aaron and his sons must never treat my name as if it were not holy. I am the Lord.
Leviticus,22,3,"“Say to them, ‘Suppose a man in your family line is “unclean.” And suppose he comes near the sacred offerings. They are the offerings the Israelites set apart to honor me. That man must not be allowed to serve me as a priest. That applies for all time to come. I am the Lord."
Leviticus,22,4,“ ‘Suppose a man in Aaron’s family line has a skin disease. Or suppose liquid waste is flowing out of his body. Then he can’t eat the sacred offerings until he is made pure and clean. Suppose he touches something made “unclean” by coming near a dead body. Or suppose he touches someone who has semen flowing from his body. Then he will be “unclean.”
Leviticus,22,5,Or suppose he touches any crawling thing that makes him “unclean.” Or suppose he touches any person who makes him “unclean.” It does not matter what “unclean” thing he touches. It will make him “unclean.”
Leviticus,22,6,The one who touches anything of that kind will be “unclean” until evening. He must not eat any of the sacred offerings unless he has taken a bath.
Leviticus,22,7,"When the sun goes down, he will be “clean.” After that, he can eat the sacred offerings. They are his food."
Leviticus,22,8,"He must not eat anything found dead or torn apart by wild animals. If he does, it will make him “unclean.” I am the Lord."
Leviticus,22,9,“ ‘The priests must do what I require. But suppose they make fun of what I require. Then they will become guilty and die. I am the Lord . I make them holy.
Leviticus,22,10,“ ‘Only a member of a priest’s family can eat the sacred offering. The guest of a priest can’t eat it. A priest’s hired worker can’t eat it either.
Leviticus,22,11,But suppose a priest buys a slave with money. Or suppose slaves are born in his house. Then they can eat the sacred food.
Leviticus,22,12,Suppose a priest’s daughter marries someone who is not a priest. Then she can’t eat any of the food brought as a sacred gift.
Leviticus,22,13,"But suppose the priest’s daughter becomes a widow or is divorced. She does not have any children. And she returns to live in her father’s house, where she lived when she was young. Then she can eat her father’s food. But a person who does not belong to a priest’s family can’t eat any of it."
Leviticus,22,14,“ ‘Suppose someone eats a sacred offering by mistake. Then they must pay back the priest for the offering. They must also add a fifth of its value to it.
Leviticus,22,15,The priests must not allow the sacred offerings to become “unclean.” They are the offerings the Israelites bring to the Lord.
Leviticus,22,16,"The priests must not allow the offerings to become “unclean” by letting the people eat them. If they do, they will bring guilt on the people. They will have to pay for what they have done. I am the Lord . I make them holy.’ ”"
Leviticus,22,17,"The Lord spoke to Moses. He said,"
Leviticus,22,18,"“Speak to Aaron and his sons. Speak to all the Israelites. Tell them, ‘Suppose any of you brings a gift for a burnt offering to the Lord . It does not matter whether you are an Israelite or an outsider who lives in Israel. It does not matter whether you bring the offering to keep a promise or because you choose to give it."
Leviticus,22,19,"You must bring a male animal without any flaws if you want the Lord to accept it from you. It does not matter whether it is from your cattle, sheep or goats."
Leviticus,22,20,"Do not bring an animal that has any flaws. If you do, the Lord will not accept it from you."
Leviticus,22,21,"Suppose any of you brings an animal for a friendship offering to the Lord . Then it must not have any flaws at all. If it does, the Lord will not accept it. It does not matter whether the animal is from your herd or flock. It does not matter whether you bring it to keep a promise or because you choose to give it."
Leviticus,22,22,Do not offer a blind animal to the Lord . Do not bring a hurt or wounded animal. And do not offer one that has warts or boils or running sores. Do not place any of them on the altar as a food offering presented to the Lord.
Leviticus,22,23,But suppose you bring an offering you choose to give. Then you can bring an ox or a sheep whose body is twisted or too small. But the Lord will not accept it if you offer it to keep a promise.
Leviticus,22,24,"You must not offer the Lord a male animal whose sex glands have been hurt. The glands also must not be crushed, torn or cut. You must not offer that kind of animal in your own land."
Leviticus,22,25,And you must not accept that kind of animal from someone who comes from another land. You must not offer it as food for your God. He will not accept it from you. Its body is twisted and has flaws.’ ”
Leviticus,22,26,"The Lord spoke to Moses. He said,"
Leviticus,22,27,"“When a calf, lamb or goat is born, it must remain with its mother for seven days. From the eighth day on, I will accept it as a food offering presented to me."
Leviticus,22,28,Do not kill a cow and its calf on the same day. Do not kill a female sheep and its lamb on the same day.
Leviticus,22,29,“Sacrifice a thank offering to me in the right way. Then I will accept it from you.
Leviticus,22,30,You must eat it that same day. Do not leave any of it until morning. I am the Lord.
Leviticus,22,31,“Obey my commands. Follow them. I am the Lord.
Leviticus,22,32,Do not treat my name as if it were not holy. The Israelites must recognize me as the holy God. I am the Lord . I made you holy.
Leviticus,22,33,I brought you out of Egypt to be your God. I am the Lord .”
Leviticus,23,1,"The Lord said to Moses,"
Leviticus,23,2,"“Speak to the Israelites. Tell them, ‘Here are my appointed feast days. They are the appointed feast days of the Lord . Tell the people that they must come together for these sacred assemblies."
Leviticus,23,3,"“ ‘There are six days when you can work. But the seventh day is a day of sabbath rest. You must rest on it. Come together on that sacred day. You must not do any work on it. No matter where you live, it is a Sabbath day to honor the Lord."
Leviticus,23,4,“ ‘Here are the Lord ’s appointed feasts. Tell the people that they must come together for these sacred gatherings at their appointed times.
Leviticus,23,5,The Lord ’s Passover begins when the sun goes down on the 14th day of the first month.
Leviticus,23,6,The Lord ’s Feast of Unleavened Bread begins on the 15th day of that month. For seven days you must eat bread made without yeast.
Leviticus,23,7,On the first day you must come together for a special service. Do not do any regular work on that day.
Leviticus,23,8,On each of the seven days bring a food offering to the Lord . On the seventh day come together for a special service. Do not do any regular work on that day.’ ”
Leviticus,23,9,"The Lord said to Moses,"
Leviticus,23,10,"“Speak to the Israelites. Tell them, ‘When you enter the land I am going to give you, bring an offering to the Lord . Gather your crops. Bring the first bundle of grain to the priest."
Leviticus,23,11,He must lift up the grain and wave it in front of the Lord . Then the Lord will accept it from you. The priest must wave it on the day after the Sabbath.
Leviticus,23,12,"On the day he waves the grain for you, you must sacrifice a burnt offering to me. It must be a lamb that does not have any flaws. It must be a year old."
Leviticus,23,13,You must bring it together with its grain offering. The grain offering must be seven pounds of the finest flour. Mix it with olive oil. It is a food offering presented to the Lord . It has a pleasant smell. You must offer a drink offering along with the burnt offering. It must be a quart of wine.
Leviticus,23,14,You must not eat any bread until the day you bring your offering to the Lord your God. You must not eat any cooked grain or any of your first grain until that time. This is a law that will last for all time to come. It applies no matter where you live.
Leviticus,23,15,“ ‘The day you brought the grain for the wave offering was the day after the Sabbath. Count off seven full weeks from that day.
Leviticus,23,16,Count off 50 days up to the day after the seventh Sabbath. On that day bring to the Lord an offering of your first grain.
Leviticus,23,17,Bring two loaves of bread that are made with seven pounds of the finest flour. They must be baked with yeast. Bring them to me as a wave offering from the first share of your crops. That applies no matter where you live.
Leviticus,23,18,"Together with the bread, bring seven male lambs. Each lamb must be a year old. It must not have any flaws. Also bring one young bull and two rams. They will be a burnt offering to the Lord . They will be offered together with their grain offerings and drink offerings. They are food offerings. Their smell pleases the Lord."
Leviticus,23,19,Then sacrifice one male goat for a sin offering. Also sacrifice two lambs for a friendship offering. Each of the lambs must be a year old.
Leviticus,23,20,The priest must lift up the two lambs and wave them in front of me as a wave offering. He must offer them together with the bread made out of the first share of your crops. They are a sacred offering to the Lord . They will be given to the priest.
Leviticus,23,21,On that same day tell the people that they must come together for a special worship service. They must not do any regular work. That is a law that will last for all time to come. It applies no matter where you live.
Leviticus,23,22,“ ‘Suppose you are gathering your crops. Then do not harvest all the way to the edges of your field. And do not pick up the grain you missed. Leave some for the poor people and the outsiders who live among you. I am the Lord your God.’ ”
Leviticus,23,23,"The Lord said to Moses,"
Leviticus,23,24,"“Say to the Israelites, ‘On the first day of the seventh month you must have a day of sabbath rest. It must be a special service announced with trumpet blasts."
Leviticus,23,25,"Do not do any regular work on that day. Instead, bring a food offering to the Lord .’ ”"
Leviticus,23,26,"The Lord spoke to Moses. He said,"
Leviticus,23,27,“The tenth day of the seventh month is the day when sin is paid for. Come together for a special service. Do not eat any food. Bring a food offering to the Lord.
Leviticus,23,28,Do not do any work on that day. It is the day when sin is paid for. On that day your sin will be paid for in my sight. I am the Lord your God.
Leviticus,23,29,Suppose you do eat food on that day. Then you will be separated from your people.
Leviticus,23,30,I will destroy anyone among your people who does any work on that day.
Leviticus,23,31,You must not do any work at all. This is a law that will last for all time to come. It applies no matter where you live.
Leviticus,23,32,That day is a day of sabbath rest for you. You must rest on it. You must not eat anything on that day. You must follow the rules of the sabbath rest. Follow them from the evening of the ninth day of the month until the following evening.”
Leviticus,23,33,"The Lord said to Moses,"
Leviticus,23,34,"“Say to the Israelites, ‘On the 15th day of the seventh month the Lord ’s Feast of Booths begins. It lasts for seven days."
Leviticus,23,35,On the first day you must come together for a special service. Do not do any regular work on that day.
Leviticus,23,36,On each of the seven days bring a food offering to the Lord . On the eighth day come together for a special service. Bring a food offering to the Lord . That special service is the closing service. Do not do any regular work on that day.
Leviticus,23,37,"“ ‘These are the Lord ’s appointed feasts. Tell the people that they must come together for these sacred assemblies. During those times, the people must bring food offerings to the Lord . They are burnt offerings and grain offerings. They are sacrifices and drink offerings. Each offering must be brought at its required time."
Leviticus,23,38,The offerings are in addition to those of the days of sabbath rest. The offerings are also in addition to your gifts and anything you have promised. They are also in addition to all the offerings you choose to give to the Lord.
Leviticus,23,39,“ ‘Begin with the 15th day of the seventh month. That is after you have gathered your crops. On that day celebrate the Lord ’s Feast of Booths for seven days. The first day is a day of rest. The eighth day is also a day of rest.
Leviticus,23,40,"On the first day you must get branches from palms, willows and other leafy trees. You must be filled with joy in front of the Lord your God for seven days."
Leviticus,23,41,Celebrate the Lord ’s Feast of Booths for seven days each year. This is a law that will last for all time to come. Celebrate the feast in the seventh month.
Leviticus,23,42,Live in booths for seven days. All the Israelites must live in booths.
Leviticus,23,43,Then your children after you will know that I made the Israelites live in booths. I made them do it after I brought them out of Egypt. I am the Lord your God.’ ”
Leviticus,23,44,So Moses announced to the Israelites the appointed feasts of the Lord.
Leviticus,24,1,"The Lord said to Moses,"
Leviticus,24,2,“Command the Israelites to bring you clear oil made from pressed olives. Use it to keep the lamps burning and giving light all the time.
Leviticus,24,3,Aaron must take care of the lamps in front of the Lord from evening until morning all the time. This is a law that will last for all time to come. The lamps are outside the curtain in front of the tablets of the covenant law in the tent of meeting.
Leviticus,24,4,The lamps are on the pure gold lampstand in front of the Lord . They must be taken care of all the time.
Leviticus,24,5,“Get the finest flour and bake 12 loaves of bread. Use seven pounds of flour for each loaf.
Leviticus,24,6,Arrange them in two stacks. Put six loaves in each stack on the table made out of pure gold. The table stands in front of the Lord.
Leviticus,24,7,By each stack put some pure incense. It will remind you that all good things come from the Lord . Burn the incense in place of the bread. The incense is a food offering presented to the Lord.
Leviticus,24,8,The bread must be set out in front of the Lord regularly. Do it every Sabbath day. It will be Israel’s duty to provide it for all time to come.
Leviticus,24,9,The bread belongs to Aaron and his sons. They must eat it in the holy area. It is a very holy part of their regular share of the food offerings presented to the Lord .”
Leviticus,24,10,There was a man who had an Israelite mother. His father was born in Egypt. The man went out among the Israelites. A fight broke out in the camp between him and an Israelite.
Leviticus,24,11,The son of the Israelite woman spoke evil things against the Lord by using a curse. So the people brought him to Moses. The name of the man’s mother was Shelomith. She was the daughter of Dibri. Dibri was from the tribe of Dan.
Leviticus,24,12,The people kept her son under guard until they could find out what the Lord wanted them to do.
Leviticus,24,13,"Then the Lord spoke to Moses. He said,"
Leviticus,24,14,“Get the man who spoke evil things against the Lord . Take him outside the camp. All those who heard him say those things must place their hands on his head. Then the whole community must kill him by throwing stones at him.
Leviticus,24,15,"Say to the Israelites, ‘Anyone who curses me will be held accountable."
Leviticus,24,16,"Anyone who speaks evil things against my Name must be put to death. The whole community must kill them by throwing stones at them. It does not matter whether they are an outsider or an Israelite. When they speak evil things against my Name, they must be put to death."
Leviticus,24,17,“ ‘Anyone who kills another human being must be put to death.
Leviticus,24,18,Anyone who kills someone’s animal must pay its owner. A life must be taken for a life.
Leviticus,24,19,Suppose someone hurts their neighbor. Then what they have done must be done to them.
Leviticus,24,20,A bone must be broken for a bone. An eye must be put out for an eye. A tooth must be knocked out for a tooth. The one who has hurt his neighbor must be hurt in the same way.
Leviticus,24,21,"Whoever kills an animal must pay its owner. But if they kill a human being, they must be put to death."
Leviticus,24,22,The same law applies whether they are an outsider or an Israelite. I am the Lord your God.’ ”
Leviticus,24,23,Then Moses spoke to the Israelites. They got the man who had spoken evil things against the Lord . They took him outside the camp. There they killed him by throwing stones at him. The Israelites did just as the Lord had commanded Moses.
Leviticus,25,1,"The Lord spoke to Moses at Mount Sinai. He said,"
Leviticus,25,2,"“Speak to the Israelites. Tell them, ‘You will enter the land I am going to give you. When you do, you must honor the Lord every seventh year by not farming the land that year."
