2 Samuel,9,13,So M’fivoshet [exterminating the idol] dwelt in Yerushalayim [Foundation of Peace] : for he did eat continually at the king’s table; and was lame on both his feet.
2 Samuel,10,1,"And it came to pass after this, that the king of the children of ‘Amon [Inbred] died, and Hanun [gracious] his son reigned in his stead."
2 Samuel,10,2,"Then said David [beloved] , I will show kindness unto Hanun [gracious] the son of Nachash [serpent] , as his father showed kindness unto me. And David [beloved] sent to comfort him by the hand of his servants for his father. And David’s [beloved] ’s servants came into the land of the children of ‘Amon [Inbred]."
2 Samuel,10,3,"And the princes of the children of ‘Amon [Inbred] said unto Hanun [gracious] their lord, Think you i that David [beloved] does honour your i father, that he has sent comforters unto you i ? has not David [beloved] [rather] sent his servants unto you i , to search the city, and to spy it out, and to overthrow it?"
2 Samuel,10,4,"For what reason Hanun [gracious] took David’s [beloved] ’s servants, and shaved off the one half of their beards, and cut off their garments in the middle, [even] to their buttocks, and sent them away."
2 Samuel,10,5,"When they told [it] unto David [beloved] , he sent to meet them, because the men were greatly ashamed: and the king said, Tarry at Yericho [Its Moon] until your beards be grown, and [then] return."
2 Samuel,10,6,"And when the children of ‘Amon [Inbred] saw that they stank before David [beloved] , the children of ‘Amon [Inbred] sent and hired the children of Aram [Syrians] of Beit-Rechov [House of the Street] , and the Aram [Syrians] of Tzovah [station] , twenty thousand footmen, and of king Ma’akhah [oppression] [oppression] a thousand men, and of Ish-Tov [man of goodness] twelve thousand men."
2 Samuel,10,7,"And when David [beloved] heard of [it] , he sent Yo’av [Yehovah is father] , and all the host of the mighty men."
2 Samuel,10,8,"And the children of ‘Amon [Inbred] came out, and put the battle in array (to put on; to clothe) at the entering in of the gate: and the Aram [Syrians] of Tzovah [station] , and of Rechov [Broad Place] , and Ish-Tov [man of goodness] , and Ma’akhah [oppression] [oppression], [were] by themselves in the field."
2 Samuel,10,9,"When Yo’av [Yehovah is father] saw that the front of the battle was against him before and behind, he chose of all the choice [men] of Yisra’el [He Holds Onto The Heel Of God] , and put [them] in array (to put on; to clothe) against the Aram [Syrians]:"
2 Samuel,10,10,"And the rest of the people he delivered into the hand of Avishai [my father is a gift] his brother, that he might put [them] in array (to put on; to clothe) against the children of ‘Amon [Inbred]."
2 Samuel,10,11,"And he said, If the Aram [Syrians] be too strong for me, then you i shall help me: but if the children of ‘Amon [Inbred] be too strong for you i , then I will come and help you i."
2 Samuel,10,12,"Be of good courage, and let us play the men for our people, and for the cities of our God-Elōhīm (The Living Word) [The Many Powered] : and the Lord-Yehōvah (Messiah Pre-Incarnate) do that which seems him good."
2 Samuel,10,13,"And Yo’av [Yehovah is father] drew near, and the people that [were] with him, unto the battle against the Aram [Syrians] : and they fled before him."
2 Samuel,10,14,"And when the children of ‘Amon [Inbred] saw that the Aram [Syrians] were fled, then fled they also before Avishai [my father is a gift] , and entered into the city. So Yo’av [Yehovah is father] returned from the children of ‘Amon [Inbred] , and came to Yerushalayim [Foundation of Peace]."
2 Samuel,10,15,"And when the Aram [Syrians] saw that they were smitten before Yisra’el [He Holds Onto The Heel Of God] , they gathered themselves together."
2 Samuel,10,16,"And Hadad’ezer [mighty - meaning disputed] is help sent, and brought out the Aram [Syrians] that [were] beyond the river: and they came to Heilam [stronghold] ; and Shovakh [expansion] the captain of the host of Hadad’ezer [mighty - meaning disputed] is help [went] before them."
2 Samuel,10,17,"And when it was told David [beloved] , he gathered all Yisra’el [He Holds Onto The Heel Of God] together, and passed over Yarden [Descender] , and came to Heilam [stronghold] . And the Aram [Syrians] set themselves in array (to put on; to clothe) against David [beloved] , and fought with him."
2 Samuel,10,18,"And the Aram [Syrians] fled before Yisra’el [He Holds Onto The Heel Of God] ; and David [beloved] killed [the men of] seven hundred chariots of the Aram [Syrians] , and forty thousand horsemen, and struck Shovakh [expansion] the captain of their host, who died there."
2 Samuel,10,19,"And when all the kings [that were] servants to Hadad’ezer [mighty - meaning disputed] is help saw that they were smitten before Yisra’el [He Holds Onto The Heel Of God] , they made peace with Yisra’el [He Holds Onto The Heel Of God] , and served them. So the Aram [Syrians] feared to help the children of ‘Amon [Inbred] any more."
2 Samuel,11,1,"And it came to pass, after the year was expired, at the time when kings go forth [to battle] , that David [beloved] sent Yo’av [Yehovah is father] , and his servants with him, and all Yisra’el [He Holds Onto The Heel Of God] ; and they destroyed the children of ‘Amon [Inbred] , and besieged Rabbah [Great] . But David [beloved] tarried still at Yerushalayim [Foundation of Peace]."
2 Samuel,11,2,"And it came to pass in an evening, that David [beloved] arose from off his bed, and walked upon the roof of the king’s house: and from the roof he saw a woman washing herself; and the woman [was] very beautiful to look upon."
2 Samuel,11,3,"And David [beloved] sent and enquired after the woman. And [one] said, [Is] not this Bat-Sheva [daughter of an oath] , the daughter of Eli’am [God of the people, or God is kinsman] , the wife of Uriyah [Yehovah is my light (flame)] the Hitti [Terrorists]?"
2 Samuel,11,4,"And David [beloved] sent messengers, and took her; and she came in unto him, and he lay with her; for she was purified from her uncleanness: and she returned unto her house."
2 Samuel,11,5,"And the woman conceived, and sent and told David [beloved] , and said, I [am] with child."
2 Samuel,11,6,"And David [beloved] sent to Yo’av [Yehovah is father], [saying] , Send me Uriyah [Yehovah is my light (flame)] the Hitti [Terrorists] . And Yo’av [Yehovah is father] sent Uriyah [Yehovah is my light (flame)] to David [beloved]."
2 Samuel,11,7,"And when Uriyah [Yehovah is my light (flame)] was come unto him, David [beloved] demanded [of him] how Yo’av [Yehovah is father] did, and how the people did, and how the war prospered."
2 Samuel,11,8,"And David [beloved] said to Uriyah [Yehovah is my light (flame)] , Go down to you i house, and wash you i feet. And Uriyah [Yehovah is my light (flame)] departed out of the king’s house, and there followed him a mess [of meat] from the king."
2 Samuel,11,9,"But Uriyah [Yehovah is my light (flame)] slept at the door of the king’s house with all the servants of his lord, and went not down to his house."
2 Samuel,11,10,"And when they had told David [beloved] , saying, Uriyah [Yehovah is my light (flame)] went not down unto his house, David [beloved] said unto Uriyah [Yehovah is my light (flame)] , came you i not from [your i ] journey? why [then] did you i not go down unto your i house?"
2 Samuel,11,11,"And Uriyah [Yehovah is my light (flame)] said unto David [beloved] , The ark, and Yisra’el [He Holds Onto The Heel Of God] , and Y’hudah [Let Him (God) Be Praised] , abide in tents; and my lord Yo’av [Yehovah is father] , and the servants of my lord, are encamped in the open fields; shall I then go into my house, to eat and to drink, and to lie with my wife? [as] you i live, and [as] your i soul lives, I will not do this thing."
2 Samuel,11,12,"And David [beloved] said to Uriyah [Yehovah is my light (flame)] , Tarry here today also, and tomorrow I will let you i depart. So Uriyah [Yehovah is my light (flame)] abode in Yerushalayim [Foundation of Peace] that day, and the morrow."
2 Samuel,11,13,"And when David [beloved] had called him, he did eat and drink before him; and he made him drunk: and at even he went out to lie on his bed with the servants of his lord, but went not down to his house."
2 Samuel,11,14,"And it came to pass in the morning, that David [beloved] wrote a letter to Yo’av [Yehovah is father] , and sent [it] by the hand of Uriyah [Yehovah is my light (flame)]."
2 Samuel,11,15,"And he wrote in the letter, saying, Set you 2f Uriyah [Yehovah is my light (flame)] in the forefront of the hottest battle, and retire you 2f from him, that he may be smitten, and die."
2 Samuel,11,16,"And it came to pass, when Yo’av [Yehovah is father] observed the city, that he assigned Uriyah [Yehovah is my light (flame)] unto a place where he knew that valiant men [were]."
2 Samuel,11,17,"And the men of the city went out, and fought with Yo’av [Yehovah is father] : and there fell [some] of the people of the servants of David [beloved] ; and Uriyah [Yehovah is my light (flame)] the Hitti [Terrorists] died also."
2 Samuel,11,18,Then Yo’av [Yehovah is father] sent and told David [beloved] all the things concerning the war;
2 Samuel,11,19,"And charged the messenger, saying, When you i have made an end of telling the matters of the war unto the king,"
2 Samuel,11,20,"And if so be that the king’s wrath arise, and he say unto you i , For what reason approached you 2f so near unto the city when you 2f did fight? knew you 2f not that they would shoot from the wall?"
2 Samuel,11,21,"Who struck Avi-Melekh [My Father is King] the son of Yerubeshet [shame will contend] ? did not a woman cast a piece of a millstone upon him from the wall, that he died in Tevetz [Conspicuous] ? why went you 2f near the wall? then say you i , Your 1s servant Uriyah [Yehovah is my light (flame)] the Hitti [Terrorists] is dead also."
2 Samuel,11,22,"So the messenger went, and came and showed David [beloved] all that Yo’av [Yehovah is father] had sent him for."
2 Samuel,11,23,"And the messenger said unto David [beloved] , Surely the men prevailed against us, and came out unto us into the field, and we were upon them even unto the entering of the gate."
2 Samuel,11,24,"And the shooters shot from off the wall upon your i servants; and [some] of the king’s servants be dead, and your i servant Uriyah [Yehovah is my light (flame)] the Hitti [Terrorists] is dead also."
2 Samuel,11,25,"Then David [beloved] said unto the messenger, Thus shall you i say unto Yo’av [Yehovah is father] , Let not this thing displease you i , for the sword devours one as well as another: make your i battle more strong against the city, and overthrow it: and encourage you i him."
2 Samuel,11,26,"And when the wife of Uriyah [Yehovah is my light (flame)] heard that Uriyah [Yehovah is my light (flame)] her husband was dead, she mourned for her husband."
2 Samuel,11,27,"And when the mourning was past, David [beloved] sent and fetched her to his house, and she became his wife, and bore him a son. But the thing that David [beloved] had done displeased the Lord-Yehōvah (Messiah Pre-Incarnate)."
2 Samuel,12,1,"And the Lord-Yehōvah (Messiah Pre-Incarnate) sent Natan [giver] unto David [beloved] . And he came unto him, and said unto him, There were two men in one city; the one rich, and the other poor."
2 Samuel,12,2,The rich [man] had exceeding many flocks and herds:
2 Samuel,12,3,"But the poor [man] had nothing, save one little ewe lamb, which he had bought and nourished up: and it grew up together with him, and with his children; it did eat of his own meat, and drank of his own cup, and lay in his bosom, and was unto him as a daughter."
2 Samuel,12,4,"And there came a traveller unto the rich man, and he spared to take of his own flock and of his own herd, to dress for the wayfaring man that was come unto him; but took the poor man’s lamb, and dressed it for the man that was come to him."
2 Samuel,12,5,"And David’s [beloved] ’s anger was greatly kindled against the man; and he said to Natan [giver], [As] the Lord-Yehōvah (Messiah Pre-Incarnate) lives, the man that has done this [thing] shall surely die:"
2 Samuel,12,6,"And he shall restore the lamb fourfold, because he did this thing, and because he had no pity."
2 Samuel,12,7,"And Natan [giver] said to David [beloved] , you i [are] the man. Thus says the Lord-Yehōvah (Messiah Pre-Incarnate) God-Elōhīm (The Living Word) [The Many Powered] of Yisra’el [He Holds Onto The Heel Of God] , I anointed you i king over Yisra’el [He Holds Onto The Heel Of God] , and I delivered you i out of the hand of Sha’ul [desired];"
2 Samuel,12,8,"And I gave you i your i master’s house, and your i master’s wives into your i bosom, and gave you i the house of Yisra’el [He Holds Onto The Heel Of God] and of Y’hudah [Let Him (God) Be Praised] ; and if [that had been] too little, I would moreover have given unto you i such and such things."
2 Samuel,12,9,"For what reason have you i despised the commandment of the Lord-Yehōvah (Messiah Pre-Incarnate) , to do evil in his sight? you i have killed Uriyah [Yehovah is my light (flame)] the Hitti [Terrorists] with the sword, and have taken his wife [to be] your i wife, and have slain him with the sword of the children of ‘Amon [Inbred]."
2 Samuel,12,10,"Now therefore the sword shall never depart from your i house; because you i have despised me, and have taken the wife of Uriyah [Yehovah is my light (flame)] the Hitti [Terrorists] to be your i wife."
2 Samuel,12,11,"Thus says the Lord-Yehōvah (Messiah Pre-Incarnate) , Behold, I will raise up evil against you i out of your i own house, and I will take your i wives before you i eyes, and give [them] unto your i neighbour, and he shall lie with your i wives in the sight of this sun."
2 Samuel,12,12,"For you i did [it] secretly: but I will do this thing before all Yisra’el [He Holds Onto The Heel Of God] , and before the sun."
2 Samuel,12,13,"And David [beloved] said unto Natan [giver] , I have sinned against the Lord-Yehōvah (Messiah Pre-Incarnate) . And Natan [giver] said unto David [beloved] , The Lord-Yehōvah (Messiah Pre-Incarnate) also has put away your i sin; you i shall not die."
2 Samuel,12,14,"However, because by this deed you i have given great occasion to the enemies of the Lord-Yehōvah (Messiah Pre-Incarnate) to blaspheme, the child also [that is] born unto you i shall surely die."
2 Samuel,12,15,"And Natan [giver] departed unto his house. And the Lord-Yehōvah (Messiah Pre-Incarnate) struck the child that Uriyah’s [Yehovah is my light (flame)]’s wife bore unto David [beloved] , and it was very sick."
2 Samuel,12,16,"David [beloved] therefore besought God-Elōhīm (The Living Word) [The Many Powered] for the child; and David [beloved] fasted, and went in, and lay all night upon the earth."
2 Samuel,12,17,"And the elders of his house arose, [and went] to him, to raise him up from the earth: but he would not, neither did he eat bread with them."
2 Samuel,12,18,"And it came to pass on the seventh day, that the child died. And the servants of David [beloved] feared to tell him that the child was dead: for they said, Behold, while the child was yet alive, we spoke unto him, and he would not hearken unto our voice: how will he then vex himself, if we tell him that the child is dead?"
2 Samuel,12,19,"But when David [beloved] saw that his servants whispered, David [beloved] perceived that the child was dead: therefore David [beloved] said unto his servants, Is the child dead? And they said, He is dead."
2 Samuel,12,20,"Then David [beloved] arose from the earth, and washed, and anointed [himself] , and changed his apparel, and came into the house of the Lord-Yehōvah (Messiah Pre-Incarnate) , and worshipped: then he came to his own house; and when he required, they set bread before him, and he did eat."
2 Samuel,12,21,"Then said his servants unto him, What thing [is] this that you i have done? you i did fast and weep for the child, [while it was] alive; but when the child was dead, you i did rise and eat bread."
2 Samuel,12,22,"And he said, While the child was yet alive, I fasted and wept: for I said, Who can tell [whether] GOD will be gracious to me, that the child may live?"
2 Samuel,12,23,"But now he is dead, wherefore should I fast? can I bring him back again? I shall go to him, but he shall not return to me."
2 Samuel,12,24,"And David [beloved] comforted Bat-Sheva [daughter of an oath] his wife, and went in unto her, and lay with her: and she bore a son, and he called his name Shlomo (Solomon) [peace] : and the Lord-Yehōvah (Messiah Pre-Incarnate) loved him."
2 Samuel,12,25,"And he sent by the hand of Natan [giver] the prophet; and he called his name Y’didyah [beloved of Yehovah] , because of the Lord-Yehōvah (Messiah Pre-Incarnate)."
2 Samuel,12,26,"And Yo’av [Yehovah is father] fought against Rabbah [Great] of the children of ‘Amon [Inbred] , and took the royal city."
2 Samuel,12,27,"And Yo’av [Yehovah is father] sent messengers to David [beloved] , and said, I have fought against Rabbah [Great] , and have taken the city of waters."
2 Samuel,12,28,"Now therefore gather the rest of the people together, and encamp against the city, and take it: lest I take the city, and it be called after my name."
2 Samuel,12,29,"And David [beloved] gathered all the people together, and went to Rabbah [Great] , and fought against it, and took it."
2 Samuel,12,30,"And he took their king’s crown from off his head, the weight whereof [was] a talent (weight of money; weight; gift) of gold with the precious stones: and it was [set] on David’s [beloved] ’s head. And he brought forth the spoil (plunder; prey; booty) of the city in great abundance."
2 Samuel,12,31,"And he brought forth the people that [were] in it, and put [them] under saws, and under harrows of iron, and under axes of iron, and made them pass through the brick factory: and thus did he unto all the cities of the children of ‘Amon [Inbred] . So David [beloved] and all the people returned unto Yerushalayim [Foundation of Peace]."
2 Samuel,13,1,"And it came to pass after this, that Avshalom [my father is peace] the son of David [beloved] had a fair sister, whose name [was] Tamar [palm-tree] ; and Amnon [faithful] the son of David [beloved] loved her."
2 Samuel,13,2,"And Amnon [faithful] was so vexed, that he fell sick for his sister Tamar [palm-tree] ; for she [was] a virgin; and Amnon [faithful] thought it hard for him to do anything to her."
2 Samuel,13,3,"But Amnon [faithful] had a friend, whose name [was] Yonadav [Yehovah is willing] [Generous] , the son of Shim’ah [report] David’s [beloved] ’s brother: and Yonadav [Yehovah is willing] [Generous] [was] a very subtle man."
2 Samuel,13,4,"And he said unto him, Why [are] you i, [being] the king’s son, lean from day to day? will you i not tell me? And Amnon [faithful] said unto him, I love Tamar [palm-tree] , my brother Avshalom [my father is peace] ’s sister."
2 Samuel,13,5,"And Yonadav [Yehovah is willing] [Generous] said unto him, Lay you i down on your i bed, and make yourself sick: and when your i father comes to see you i , say unto him, I pray you i , let my sister Tamar [palm-tree] come, and give me meat, and dress the meat in my sight, that I may see [it] , and eat [it] at her hand."
2 Samuel,13,6,"So Amnon [faithful] lay down, and made himself sick: and when the king was come to see him, Amnon [faithful] said unto the king, I pray you i , let Tamar [palm-tree] my sister come, and make me a couple of cakes in my sight, that I may eat at her hand."
2 Samuel,13,7,"Then David [beloved] sent home to Tamar [palm-tree] , saying, Go now to your i brother Amnon [faithful] ’s house, and dress him meat."
2 Samuel,13,8,"So Tamar [palm-tree] went to her brother Amnon [faithful] ’s house; and he was laid down. And she took flour, and kneaded [it] , and made cakes in his sight, and did bake the cakes."
2 Samuel,13,9,"And she took a pan, and poured [them] out before him; but he refused to eat. And Amnon [faithful] said, Have out all men from me. And they went out every man from him."
2 Samuel,13,10,"And Amnon [faithful] said unto Tamar [palm-tree] , Bring the meat into the chamber, that I may eat of you i hand. And Tamar [palm-tree] took the cakes which she had made, and brought [them] into the chamber to Amnon [faithful] her brother."
2 Samuel,13,11,"And when she had brought [them] unto him to eat, he took hold of her, and said unto her, Come lie with me, my sister."
2 Samuel,13,12,"And she answered him, No, my brother, do not force me; for no such thing ought to be done in Yisra’el [He Holds Onto The Heel Of God] : do not you i this folly."
2 Samuel,13,13,"And I, to which shall I cause my shame to go? and as for you i , you i shall be as one of the fools in Yisra’el [He Holds Onto The Heel Of God] . Now therefore, I pray you i , speak unto the king; for he will not withhold me from you i."
2 Samuel,13,14,"However he would not hearken unto her voice: but, being stronger than she, forced her, and lay with her."
2 Samuel,13,15,"Then Amnon [faithful] hated her exceedingly; so that the hatred which he hated her [was] greater than the love which he had loved her. And Amnon [faithful] said unto her, Arise, be gone."
2 Samuel,13,16,"And she said unto him, [There is] no cause: this evil in sending me away [is] greater than the other that you i did unto me. But he would not hearken unto her."
2 Samuel,13,17,"Then he called his servant that ministered unto him, and said, Put now this [woman] out from me, and bolt the door after her."
2 Samuel,13,18,"And [she had] a garment of diverse colours upon her: for with such robes were the king’s daughters [that were] virgins appareled. Then his servant brought her out, and bolted the door after her."
2 Samuel,13,19,"And Tamar [palm-tree] put ashes on her head, and rent her garment of diverse colours that [was] on her, and laid her hand on her head, and went on crying."
2 Samuel,13,20,"And Avshalom [my father is peace] her brother said unto her, Has Amnon [faithful] you i brother been with you i ? but hold now you i peace, my sister: he [is] your i brother; regard not this thing. So Tamar [palm-tree] remained desolate in her brother Avshalom [my father is peace] ’s house."
2 Samuel,13,21,"But when king David [beloved] heard of all these things, he was very exceedingly angry."
2 Samuel,13,22,"And Avshalom [my father is peace] spoke unto his brother Amnon [faithful] neither good nor bad: for Avshalom [my father is peace] hated Amnon [faithful] , because he had forced his sister Tamar [palm-tree]."
2 Samuel,13,23,"And it came to pass after two full years, that Avshalom [my father is peace] had sheepshearers in Ba’al-Hatzor [lord of the village] , which [is] beside Efrayim [Doubly Fruitful] : and Avshalom [my father is peace] invited all the king’s sons."
2 Samuel,13,24,"And Avshalom [my father is peace] came to the king, and said, Behold now, your i servant has sheepshearers; let the king, I beseech (to call upon; appeal; beg) you i , and his servants go with you i servant."
2 Samuel,13,25,"And the king said to Avshalom [my father is peace] , No, my son, let us not all now go, lest we be chargeable unto you i . And he pressed him: howbeit he would not go, but Blessed (Favored by God; happy; prosperous) him."
2 Samuel,13,26,"Then said Avshalom [my father is peace] , If not, I pray you i , let my brother Amnon [faithful] go with us. And the king said unto him, Why should he go with you i?"
2 Samuel,13,27,"But Avshalom [my father is peace] pressed him, that he let Amnon [faithful] and all the king’s sons go with him."
2 Samuel,13,28,"Now Avshalom [my father is peace] had commanded his servants, saying, Mark you 2f now when Amnon [faithful] ’s heart is merry with wine, and when I say unto you, Strike Amnon [faithful] ; then kill him, fear not: have not I commanded you? be courageous, and be valiant."
2 Samuel,13,29,"And the servants of Avshalom [my father is peace] did unto Amnon [faithful] as Avshalom [my father is peace] had commanded. Then all the king’s sons arose, and every man got him up upon his mule, and fled."
2 Samuel,13,30,"And it came to pass, while they were in the way, that tidings came to David [beloved] , saying, Avshalom [my father is peace] has slain all the king’s sons, and there is not one of them left."
2 Samuel,13,31,"Then the king arose, and tare his garments, and lay on the earth; and all his servants stood by with their clothes rent."
2 Samuel,13,32,"And Yonadav [Yehovah is willing] [Generous] , the son of Shim’ah [report] David’s [beloved] ’s brother, answered and said, Let not my lord suppose [that] they have slain all the young men the king’s sons; for Amnon [faithful] only is dead: for by the appointment of Avshalom [my father is peace] this has been determined from the day that he forced his sister Tamar [palm-tree]."
2 Samuel,13,33,"Now therefore let not my lord the king take the thing to his heart, to think that all the king’s sons are dead: for Amnon [faithful] only is dead."
2 Samuel,13,34,"But Avshalom [my father is peace] fled. And the young man that kept the watch lifted up his eyes, and looked, and, behold, there came much people by the way of the hill side behind him."
2 Samuel,13,35,"And Yonadav [Yehovah is willing] [Generous] said unto the king, Behold, the king’s sons come: as your i servant said, so it is."
2 Samuel,13,36,"And it came to pass, as soon as he had made an end of speaking, that, behold, the king’s sons came, and lifted up their voice and wept: and the king also and all his servants wept very sore."
