2 Samuel,1,1,"Now it came to pass after the death of Sha’ul [desired] , when David [beloved] was returned from the slaughter of the ‘Amalekim [Dwellers in a Valley] , and David [beloved] had abode two days in Ziklag [Winding];"
2 Samuel,1,2,"It came even to pass on the third day, that, behold, a man came out of the camp from Sha’ul [desired] with his clothes rent, and earth upon his head: and [so] it was, when he came to David [beloved] , that he fell to the earth, and did obesiance (bowing or kneeling in respect)."
2 Samuel,1,3,"And David [beloved] said unto him, From where do you i come? And he said unto him, Out of the camp of Yisra’el [He Holds Onto The Heel Of God] am I escaped."
2 Samuel,1,4,"And David [beloved] said unto him, How went the matter? I pray you i , tell me. And he answered, That the people are fled from the battle, and many of the people also are fallen and dead; and Sha’ul [desired] and Y’honatan [Yehovah has Given] his son are dead also."
2 Samuel,1,5,"And David [beloved] said unto the young man that told him, How know you i that Sha’ul [desired] and Y’honatan [Yehovah has Given] his son be dead?"
2 Samuel,1,6,"And the young man that told him said, As I happened by chance upon mount Gilboa [swollen heap] , behold, Sha’ul [desired] leaned upon his spear; and, lo, the chariots and horsemen followed hard after him."
2 Samuel,1,7,"And when he looked behind him, he saw me, and called unto me. And I answered, Here [am] I."
2 Samuel,1,8,"And he said unto me, Who [are] you i ? And I answered him, I [am] an ‘Amaleki [Dwellers in a Valley]."
2 Samuel,1,9,"He said unto me again, Stand, I pray you i , upon me, and slay me: for anguish is come upon me, because my life [is] yet whole in me."
2 Samuel,1,10,"So I stood upon him, and killed him, because I was sure that he could not live after that he was fallen: and I took the crown that [was] upon his head, and the bracelet that [was] on his arm, and have brought them here unto my lord."
2 Samuel,1,11,"Then David [beloved] took hold on his clothes, and rent them; and likewise all the men that [were] with him:"
2 Samuel,1,12,"And they mourned, and wept, and fasted until even, for Sha’ul [desired] , and for Y’honatan [Yehovah has Given] his son, and for the people of the Lord-Yehōvah (Messiah Pre-Incarnate) , and for the house of Yisra’el [He Holds Onto The Heel Of God] ; because they were fallen by the sword."
2 Samuel,1,13,"And David [beloved] said unto the young man that told him, Whence [are] you i ? And he answered, I [am] the son of a stranger, an ‘Amaleki [Dwellers in a Valley]."
2 Samuel,1,14,"And David [beloved] said unto him, How were you i not afraid to stretch forth you i hand to destroy the Lord-Yehōvah’s [Messiah Pre-Incarnate] anointed?"
2 Samuel,1,15,"And David [beloved] called one of the young men, and said, Go near, [and] fall upon him. And he struck him that he died."
2 Samuel,1,16,"And David [beloved] said unto him, You 1s blood [be] upon you i head; for you i mouth has testified against you i , saying, I have slain the Lord-Yehōvah’s [Messiah Pre-Incarnate] anointed."
2 Samuel,1,17,And David [beloved] lamented with this lamentation over Sha’ul [desired] and over Y’honatan [Yehovah has Given] his son:
2 Samuel,1,18,"(Also he bade them teach the children of Y’hudah [Let Him (God) Be Praised] [the use of] the bow: behold, [it is] written in the book of Yahsar [Upright, Correct] .)"
2 Samuel,1,19,The beauty of Yisra’el [He Holds Onto The Heel Of God] is slain upon you i high places: how are the mighty fallen!
2 Samuel,1,20,"Tell [it] not in Gat [Winepress] , publish [it] not in the streets of Askelon [The Fire of Infamy: I shall be Weighed]; lest the daughters of the P’lishtim [Immigrants] rejoice, lest the daughters of the uncircumcised triumph."
2 Samuel,1,21,"You 2f mountains of Gilboa [swollen heap], [let there be] no dew, neither [let there be] rain, upon you, nor fields of offerings: for there the shield of the mighty is vilely cast away, the shield of Sha’ul [desired], [as though he had] not [been] anointed with oil."
2 Samuel,1,22,"From the blood of the slain, from the fat of the mighty, the bow of Y’honatan [Yehovah has Given] turned not back, and the sword of Sha’ul [desired] returned not empty."
2 Samuel,1,23,"Sha’ul [desired] and Y’honatan [Yehovah has Given] [were] lovely and pleasant in their lives, and in their death they were not divided: they were swifter than eagles, they were stronger than lions."
2 Samuel,1,24,"You 2f daughters of Yisra’el [He Holds Onto The Heel Of God] , weep over Sha’ul [desired] , who clothed you in scarlet, with [other] delights, who put on ornaments of gold upon your apparel."
2 Samuel,1,25,"How are the mighty fallen in the midst of the battle! O Y’honatan [Yehovah has Given], [you i were] slain in you i high places."
2 Samuel,1,26,"I am distressed for you i , my brother Y’honatan [Yehovah has Given] : very pleasant have you i been unto me: you i love to me was wonderful, passing the love of women."
2 Samuel,1,27,"How are the mighty fallen, and the weapons of war perished!"
2 Samuel,2,1,"And it came to pass after this, that David [beloved] enquired of the Lord-Yehōvah (Messiah Pre-Incarnate) , saying, Shall I go up into any of the cities of Y’hudah [Let Him (God) Be Praised] ? And the Lord-Yehōvah (Messiah Pre-Incarnate) said unto him, Go up. And David [beloved] said, Where shall I go up? And he said, Unto Hevron [Seat of Association]."
2 Samuel,2,2,"So David [beloved] went up there, and his two wives also, Achino’am [my brother is delight] the Yizre’elit [God Sows] , and Avigayil [my father is joy] Naval [fool] ’s wife the Carmeli [garden-land]."
2 Samuel,2,3,"And his men that [were] with him did David [beloved] bring up, every man with his household: and they dwelt in the cities of Hevron [Seat of Association]."
2 Samuel,2,4,"And the men of Y’hudah [Let Him (God) Be Praised] came, and there they anointed David [beloved] king over the house of Y’hudah [Let Him (God) Be Praised] . And they told David [beloved] , saying, [That] the men of Yavesh-Gil’ad [Dry Hill of Testimony] [were they] that buried Sha’ul [desired]."
2 Samuel,2,5,"And David [beloved] sent messengers unto the men of Yavesh-Gil’ad [Dry Hill of Testimony] , and said unto them, Blessed (Favored by God; happy; prosperous) [be] you 2f of the Lord-Yehōvah (Messiah Pre-Incarnate) , that you 2f have showed this kindness unto your lord, [even] unto Sha’ul [desired] , and have buried him."
2 Samuel,2,6,"And now the Lord-Yehōvah (Messiah Pre-Incarnate) show kindness and tunto you: and I also will requite (repay) you this kindness, because you 2f have done this thing."
2 Samuel,2,7,"Therefore now let your hands be strengthened, and be you 2f valiant: for your master Sha’ul [desired] is dead, and also the house of Y’hudah [Let Him (God) Be Praised] have anointed me king over them."
2 Samuel,2,8,"But Avner [my father is a lamp] the son of Ner [lamp] , captain of Sha’ul’s [desired] host, took Ish-Boshet [man of shame] the son of Sha’ul [desired] , and brought him over to Machanayim [Two Camps];"
2 Samuel,2,9,"And made him king over Gil’ad [Rocky Region] , and over the Ashuri [guided; Blessed (Favored by God; happy; prosperous)], and over Yizre’el [God Sows] , and over Efrayim [Doubly Fruitful] , and over Binyamin [Son of the Right Hand/Strength] , and over all Yisra’el [He Holds Onto The Heel Of God]."
2 Samuel,2,10,"Ish-Boshet [man of shame] Sha’ul’s [desired] son [was] forty years old when he began to reign over Yisra’el [He Holds Onto The Heel Of God] , and reigned two years. But the house of Y’hudah [Let Him (God) Be Praised] followed David [beloved]."
2 Samuel,2,11,And the time that David [beloved] was king in Hevron [Seat of Association] over the house of Y’hudah [Let Him (God) Be Praised] was seven years and six months.
2 Samuel,2,12,"And Avner [my father is a lamp] the son of Ner [lamp] , and the servants of Ish-Boshet [man of shame] the son of Sha’ul [desired] , went out from Machanayim [Two Camps] to Giv’on [Hill City]."
2 Samuel,2,13,"And Yo’av [Yehovah is father] the son of Tz’ruyah [balsam] , and the servants of David [beloved] , went out, and met together by the pool of Giv’on [Hill City] : and they sat down, the one on the one side of the pool, and the other on the other side of the pool."
2 Samuel,2,14,"And Avner [my father is a lamp] said to Yo’av [Yehovah is father] , Let the young men now arise, and play before us. And Yo’av [Yehovah is father] said, Let them arise."
2 Samuel,2,15,"Then there arose and went over by number twelve of Binyamin [Son of the Right Hand/Strength] , which [pertained] to Ish-Boshet [man of shame] the son of Sha’ul [desired] , and twelve of the servants of David [beloved]."
2 Samuel,2,16,"And they caught everyone his fellow by the head, and [thrust] his sword in his fellow’s side; so they fell down together: wherefore that place was called Helkat-Hatzurim [field of swords] , which [is] in Giv’on [Hill City]."
2 Samuel,2,17,"And there was a very sore battle that day; and Avner [my father is a lamp] was beaten, and the men of Yisra’el [He Holds Onto The Heel Of God] , before the servants of David [beloved]."
2 Samuel,2,18,"And there were three sons of Tz’ruyah [balsam] there, Yo’av [Yehovah is father] , and Avishai [my father is a gift] , and ‘Asah’el [God-made] : and ‘Asah’el [God-made] [was as] light of foot as a wild roe."
2 Samuel,2,19,And ‘Asah’el [God-made] pursued after Avner [my father is a lamp] ; and in going he turned not to the right hand nor to the left from following Avner [my father is a lamp].
2 Samuel,2,20,"Then Avner [my father is a lamp] looked behind him, and said, [Are] you i ‘Asah’el [God-made] ? And he answered, I [am]."
2 Samuel,2,21,"And Avner [my father is a lamp] said to him, Turn you i aside to you i right hand or to you i left, and lay you i hold on one of the young men, and take you i his armour. But ‘Asah’el [God-made] would not turn aside from following of him."
2 Samuel,2,22,"And Avner [my father is a lamp] said again to ‘Asah’el [God-made] , Turn you i aside from following me: wherefore should I strike you i to the ground? how then should I hold up my face to Yo’av [Yehovah is father] you i brother?"
2 Samuel,2,23,"However he refused to turn aside: wherefore Avner [my father is a lamp] with the behind (the back side; the rear) of the spear struck him under the fifth [rib] , that the spear came out behind him; and he fell down there, and died in the same place: and it came to pass, [that] as many as came to the place where ‘Asah’el [God-made] fell down and died stood still."
2 Samuel,2,24,"Yo’av [Yehovah is father] also and Avishai [my father is a gift] pursued after Avner [my father is a lamp] : and the sun went down when they were come to the hill of Amah [a cubit] , that [lies] before Giach [to break forth] by the way of the wilderness of Giv’on [Hill City]."
2 Samuel,2,25,"And the children of Binyamin [Son of the Right Hand/Strength] gathered themselves together after Avner [my father is a lamp] , and became one troop, and stood on the top of an hill."
2 Samuel,2,26,"Then Avner [my father is a lamp] called to Yo’av [Yehovah is father] , and said, Shall the sword devour forever? know you i not that it will be bitterness in the latter end? how long shall it be then, before you i bid the people return from following their brethren?"
2 Samuel,2,27,"And Yo’av [Yehovah is father] said, [As] God-Elōhīm (The Living Word) [The Many Powered] lives, unless you i had spoken, surely then in the morning the people had gone up everyone from following his brother."
2 Samuel,2,28,"So Yo’av [Yehovah is father] blew a trumpet, and all the people stood still, and pursued after Yisra’el [He Holds Onto The Heel Of God] no more, neither fought they any more."
2 Samuel,2,29,"And Avner [my father is a lamp] and his men walked all that night through the plain, and passed over Yarden [Descender] , and went through all Bitron [division, or cleft (split hoof; an opening, break or split) , or ravine], and they came to Machanayim [Two Camps]."
2 Samuel,2,30,"And Yo’av [Yehovah is father] returned from following Avner [my father is a lamp] : and when he had gathered all the people together, there lacked of David’s [beloved] ’s servants nineteen men and ‘Asah’el [God-made]."
2 Samuel,2,31,"But the servants of David [beloved] had smitten of Binyamin [Son of the Right Hand/Strength] , and of Avner [my father is a lamp] ’s men, [so that] three hundred and threescore men died."
2 Samuel,2,32,"And they took up ‘Asah’el [God-made] , and buried him in the sepulcher of his father, which [was in] Beit-Lechem [House of Bread] . And Yo’av [Yehovah is father] and his men went all night, and they came to Hevron [Seat of Association] at break of day."
2 Samuel,3,1,"Now there was long war between the house of Sha’ul [desired] and the house of David [beloved] : but David [beloved] waxed stronger and stronger, and the house of Sha’ul [desired] waxed weaker and weaker."
2 Samuel,3,2,"And unto David [beloved] were sons born in Hevron [Seat of Association] : and his firstborn was Amnon [faithful] , of Achino’am [my brother is delight] the Yizre’elit [God Sows];"
2 Samuel,3,3,"And his second, Kil’av [like his father] , of Avigayil [my father is joy] the wife of Naval [fool] the Carmeli [garden-land] ; and the third, Avshalom [my father is peace] the son of Ma’akhah [oppression] [oppression] the daughter of Talmai [Plowman] king of G’shur [proud beholder];"
2 Samuel,3,4,"And the fourth, Adoniyah [my lord is Yehovah] the son of Haggit [festive] ; and the fifth, Sh’fatyah [Yehovah has judged] the son of Avital [my father is (the) dew];"
2 Samuel,3,5,"And the sixth, Yitre’am [profit of the people] , by ‘Eglah [a heifer] David’s [beloved] ’s wife. These were born to David [beloved] in Hevron [Seat of Association]."
2 Samuel,3,6,"And it came to pass, while there was war between the house of Sha’ul [desired] and the house of David [beloved] , that Avner [my father is a lamp] made himself strong for the house of Sha’ul [desired]."
2 Samuel,3,7,"And Sha’ul [desired] had a concubine, whose name [was] Ritzpah [pavement] , the daughter of Ayah [falcon] : and [Ish-Boshet [man of shame] ] said to Avner [my father is a lamp] , For what reason have you i gone in unto my father’s concubine?"
2 Samuel,3,8,"Then was Avner [my father is a lamp] very exceedingly angry for the words of Ish-Boshet [man of shame] , and said, [Am] I a dog’s head, which against Y’hudah [Let Him (God) Be Praised] do show kindness this day unto the house of Sha’ul [desired] you i father, to his brethren, and to his friends, and have not delivered you i into the hand of David [beloved] , that you i charge me to day with a fault concerning this woman?"
2 Samuel,3,9,"So do God-Elōhīm (The Living Word) [The Many Powered] to Avner [my father is a lamp] , and more also, except, as the Lord-Yehōvah (Messiah Pre-Incarnate) has sworn to David [beloved] , even so I do to him;"
2 Samuel,3,10,"To translate (transfer; remove to another place) the kingdom from the house of Sha’ul [desired] , and to set up the throne of David [beloved] over Yisra’el [He Holds Onto The Heel Of God] and over Y’hudah [Let Him (God) Be Praised] , from Dan [Judge] even to Be’er-sheva [Well of the sevenfold Oath]."
2 Samuel,3,11,"And he could not answer Avner [my father is a lamp] a word again, because he feared him."
2 Samuel,3,12,"And Avner [my father is a lamp] sent messengers to David [beloved] on his behalf, saying, Whose [is] the land? saying [also] , Make your i league with me, and, behold, my hand [shall be] with you i , to bring about all Yisra’el [He Holds Onto The Heel Of God] unto you i."
2 Samuel,3,13,"And he said, Well; I will make a league with you i : but one thing I require of you i , that is, you i shall not see my face, except you i first bring Mikhal [who is like God?] Sha’ul’s [desired] daughter, when you i come to see my face."
2 Samuel,3,14,"And David [beloved] sent messengers to Ish-Boshet [man of shame] Sha’ul’s [desired] son, saying, Deliver [me] my wife Mikhal [who is like God?] , which I espoused to me for an hundred foreskins of the P’lishtim [Immigrants]."
2 Samuel,3,15,"And Ish-Boshet [man of shame] sent, and took her from [her] husband, [even] from Palti’el [God delivers] the son of Layish [Lion]."
2 Samuel,3,16,"And her husband went with her along weeping behind her to Bachurim [young men’s Villiage] . Then said Avner [my father is a lamp] unto him, Go, return. And he returned."
2 Samuel,3,17,"And Avner [my father is a lamp] had communication with the elders of Yisra’el [He Holds Onto The Heel Of God] , saying, You 2f sought for David [beloved] in times past [to be] king over you:"
2 Samuel,3,18,"Now then do [it] : for the Lord-Yehōvah (Messiah Pre-Incarnate) has spoken of David [beloved] , saying, By the hand of my servant David [beloved] I will save my people Yisra’el [He Holds Onto The Heel Of God] out of the hand of the P’lishtim [Immigrants] , and out of the hand of all their enemies."
2 Samuel,3,19,"And Avner [my father is a lamp] also spoke in the ears of Binyamin [Son of the Right Hand/Strength] : and Avner [my father is a lamp] went also to speak in the ears of David [beloved] in Hevron [Seat of Association] all that seemed good to Yisra’el [He Holds Onto The Heel Of God] , and that seemed good to the whole house of Binyamin [Son of the Right Hand/Strength]."
2 Samuel,3,20,"So Avner [my father is a lamp] came to David [beloved] to Hevron [Seat of Association] , and twenty men with him. And David [beloved] made Avner [my father is a lamp] and the men that [were] with him a feast."
2 Samuel,3,21,"And Avner [my father is a lamp] said unto David [beloved] , I will arise and go, and will gather all Yisra’el [He Holds Onto The Heel Of God] unto my lord the king, that they may make a league with you i , and that you i may reign over all that you i heart desires. And David [beloved] sent Avner [my father is a lamp] away; and he went in peace."
2 Samuel,3,22,"And, behold, the servants of David [beloved] and Yo’av [Yehovah is father] came from [pursuing] a troop, and brought in a great spoil (plunder; prey; booty) with them: but Avner [my father is a lamp] [was] not with David [beloved] in Hevron [Seat of Association] ; for he had sent him away, and he was gone in peace."
2 Samuel,3,23,"When Yo’av [Yehovah is father] and all the host that [was] with him were come, they told Yo’av [Yehovah is father] , saying, Avner [my father is a lamp] the son of Ner [lamp] came to the king, and he has sent him away, and he is gone in peace."
2 Samuel,3,24,"Then Yo’av [Yehovah is father] came to the king, and said, What have you i done? behold, Avner [my father is a lamp] came unto you i ; why [is] it [that] you i have sent him away, and he is quite gone?"
2 Samuel,3,25,"you i know Avner [my father is a lamp] the son of Ner [lamp] , that he came to deceive you i , and to know your i going out and your i coming in, and to know all that you i do."
2 Samuel,3,26,"And when Yo’av [Yehovah is father] was come out from David [beloved] , he sent messengers after Avner [my father is a lamp] , which brought him again from the well of Sirah [the turning] : but David [beloved] knew [it] not."
2 Samuel,3,27,"And when Avner [my father is a lamp] was returned to Hevron [Seat of Association] , Yo’av [Yehovah is father] took him aside in the gate to speak with him quietly, and struck him there under the fifth [rib] , that he died, for the blood of ‘Asah’el [God-made] his brother."
2 Samuel,3,28,"And afterward when David [beloved] heard [it] , he said, I and my kingdom [are] guiltless before the Lord-Yehōvah (Messiah Pre-Incarnate) forever from the blood of Avner [my father is a lamp] the son of Ner [lamp]:"
2 Samuel,3,29,"Let it rest on the head of Yo’av [Yehovah is father] , and on all his father’s house; and let there not fail from the house of Yo’av [Yehovah is father] one that has an issue (what comes forth) , or that is a leper, or that leans on a staff, or that falls on the sword, or that lacks bread."
2 Samuel,3,30,"So Yo’av [Yehovah is father] and Avishai [my father is a gift] his brother killed Avner [my father is a lamp] , because he had slain their brother ‘Asah’el [God-made] at Giv’on [Hill City] in the battle."
2 Samuel,3,31,"And David [beloved] said to Yo’av [Yehovah is father] , and to all the people that [were] with him, Rend (tear apart; forcefully rip apart) your clothes, and gird you with sackcloth, and mourn before Avner [my father is a lamp] . And king David [beloved] [himself] followed the bier."
2 Samuel,3,32,"And they buried Avner [my father is a lamp] in Hevron [Seat of Association] : and the king lifted up his voice, and wept at the grave of Avner [my father is a lamp] ; and all the people wept."
2 Samuel,3,33,"And the king lamented over Avner [my father is a lamp] , and said, Died Avner [my father is a lamp] as a fool dies?"
2 Samuel,3,34,"Your 1s hands [were] not bound, nor your i feet put into fetters: as a man falls before wicked men, [so] fell you i . And all the people wept again over him."
2 Samuel,3,35,"And when all the people came to cause David [beloved] to eat meat while it was yet day, David [beloved] swore, saying, So do God-Elōhīm (The Living Word) [The Many Powered] to me, and more also, if I taste bread, or ought else, till the sun be down."
2 Samuel,3,36,"And all the people took notice [of it] , and it pleased them: as whatsoever the king did pleased all the people."
2 Samuel,3,37,For all the people and all Yisra’el [He Holds Onto The Heel Of God] understood that day that it was not of the king to slay Avner [my father is a lamp] the son of Ner [lamp].
2 Samuel,3,38,"And the king said unto his servants, Know you 2f not that there is a prince and a great man fallen this day in Yisra’el [He Holds Onto The Heel Of God]?"
2 Samuel,3,39,"And I [am] this day weak, though anointed king; and these men the sons of Tz’ruyah [balsam] [be] too hard for me: the Lord-Yehōvah (Messiah Pre-Incarnate) shall reward the doer of evil according to his wickedness."
2 Samuel,4,1,"And when Sha’ul’s [desired] son heard that Avner [my father is a lamp] was dead in Hevron [Seat of Association] , his hands were feeble, and all the Yisra’eli’s were troubled."
2 Samuel,4,2,"And Sha’ul’s [desired] son had two men [that were] captains of bands: the name of the one [was] Ba’anah [in affliction] , and the name of the other Rekhav [rider] , the sons of Rimmon [Pomegranate] a Be’erot [wells] , of the children of Binyamin [Son of the Right Hand/Strength] (for B’erot [Wells] also was reckoned to Binyamin [Son of the Right Hand/Strength]:"
2 Samuel,4,3,"And the Be’erotim [wells] fled to Gittayim [two winepresses] , and were sojourners there until this day.)"
2 Samuel,4,4,"And Y’honatan [Yehovah has Given] , Sha’ul’s [desired] son, had a son [that was] lame of [his] feet. He was five years old when the tidings came of Sha’ul [desired] and Y’honatan [Yehovah has Given] out of Yizre’el [God Sows] , and his nurse took him up, and fled: and it came to pass, as she made haste to flee, that he fell, and became lame. And his name [was] M’fivoshet [exterminating the idol]."
2 Samuel,4,5,"And the sons of Rimmon [Pomegranate] the Be’erot [wells] , Rekhav [rider] and Ba’anah [in affliction] , went, and came about the heat of the day to the house of Ish-Boshet [man of shame] , who lay on a bed at noon."
2 Samuel,4,6,"And they came there into the midst of the house, [as though] they would have fetched wheat; and they struck him under the fifth [rib] : and Rekhav [rider] and Ba’anah [in affliction] his brother escaped."
2 Samuel,4,7,"For when they came into the house, he lay on his bed in his bedchamber, and they struck him, and killed him, and beheaded him, and took his head, and got them away through the plain all night."
2 Samuel,4,8,"And they brought the head of Ish-Boshet [man of shame] unto David [beloved] to Hevron [Seat of Association] , and said to the king, Behold the head of Ish-Boshet [man of shame] the son of Sha’ul [desired] your i enemy, which sought you i life; and the Lord-Yehōvah (Messiah Pre-Incarnate) has avenged my lord the king this day of Sha’ul [desired] , and of his seed."
2 Samuel,4,9,"And David [beloved] answered Rekhav [rider] and Ba’anah [in affliction] his brother, the sons of Rimmon [Pomegranate] the Be’erot [wells] , and said unto them, [As] the Lord-Yehōvah (Messiah Pre-Incarnate) lives, who has redeemed my soul out of all adversity,"
2 Samuel,4,10,"When one told me, saying, Behold, Sha’ul [desired] is dead, thinking to have brought good tidings, I took hold of him, and killed him in Ziklag [Winding] , who [thought] that I would have given him a reward for his tidings:"
2 Samuel,4,11,"How much more, when wicked men have slain a righteous person in his own house upon his bed? shall I not therefore now require his blood of your hand, and take you away from the earth?"
2 Samuel,4,12,"And David [beloved] commanded his young men, and they killed them, and cut off their hands and their feet, and hanged [them] up over the pool in Hevron [Seat of Association] . But they took the head of Ish-Boshet [man of shame] , and buried [it] in the sepulcher of Avner [my father is a lamp] in Hevron [Seat of Association]."
2 Samuel,5,1,"Then came all the tribes of Yisra’el [He Holds Onto The Heel Of God] to David [beloved] unto Hevron [Seat of Association] , and spoke, saying, Behold, we [are] you i bone and you i flesh."
