Ezekiel,38,10,"Thus says the Lord-Adonai [Greatest Above All Things] GOD-Yehōvih (THE FATHER) ; It shall also come to pass, [that] at the same time shall things come into your i mind, and you i shall think an evil thought:"
Ezekiel,38,11,"And you i shall say, I will go up to the land of unwalled villages; I will go to them that are at rest, that dwell safely, all of them dwelling without walls, and having neither bars nor gates,"
Ezekiel,38,12,"To take a spoil (plunder; prey; booty) , and to take a prey; to turn your i hand upon the desolate places [that are now] inhabited, and upon the people [that are] gathered out of the nations, which have gotten cattle and goods, that dwell in the midst of the land."
Ezekiel,38,13,"Sheva [Seven] , and D’dan [low country] , and the merchants of Tarshish [yellow jasper] , with all the young lions thereof, shall say unto you i , Are you i come to take a spoil (plunder; prey; booty) ? have you i gathered your i company to take a prey? to carry away silver and gold, to take away cattle and goods, to take a great spoil (plunder; prey; booty)?"
Ezekiel,38,14,"Therefore, Son of man, prophesy and say unto Gog [mountain] , Thus says the Lord-Adonai [Greatest Above All Things] GOD-Yehōvih (THE FATHER) ; In that day when my people of Yisra’el [He Holds Onto The Heel Of God] dwells safely, shall you i not know [it]?"
Ezekiel,38,15,"And you i shall come from your i place out of the north parts, you i , and many people with you i , all of them riding upon horses, a great company, and a mighty army:"
Ezekiel,38,16,"And you i shall come up against my people of Yisra’el [He Holds Onto The Heel Of God] , as a cloud to cover the land; it shall be in the latter days, and I will bring you i against my land, that the heathen may know me, when I shall be sanctified in you i , O Gog [mountain] , before their eyes."
Ezekiel,38,17,"Thus says the Lord-Adonai [Greatest Above All Things] GOD-Yehōvih (THE FATHER); [Are] you i he of whom I have spoken in old time by my servants the prophets of Yisra’el [He Holds Onto The Heel Of God] , which prophesied in those days [many] years that I would bring you i against them?"
Ezekiel,38,18,"And it shall come to pass at the same time when Gog [mountain] shall come against the land of Yisra’el [He Holds Onto The Heel Of God] , says the Lord-Adonai [Greatest Above All Things] GOD-Yehōvih (THE FATHER), [that] my fury shall come up in my face."
Ezekiel,38,19,"For in my jealousy [and] in the fire of my wrath have I spoken, Surely in that day there shall be a great shaking in the land of Yisra’el [He Holds Onto The Heel Of God];"
Ezekiel,38,20,"So that the fishes of the sea, and the fowls of the heaven, and the beasts of the field, and all creeping things that creep upon the earth, and all the men that [are] upon the face of the earth, shall shake at my presence, and the mountains shall be thrown down, and the steep places shall fall, and every wall shall fall to (to do entirely, do wholly) the ground."
Ezekiel,38,21,"And I will call for a sword against him throughout all my mountains, says the Lord-Adonai [Greatest Above All Things] GOD-Yehōvih (THE FATHER) : every man’s sword shall be against his brother."
Ezekiel,38,22,"And I will plead against him with pestilence and with blood; and I will rain upon him, and upon his bands, and upon the many people that [are] with him, an overflowing rain, and great hailstones, fire, and sulfur."
Ezekiel,38,23,"Thus will I magnify myself, and sanctify (make holy; set apart for God’s use) myself; and I will be known in the eyes of many nations, and they shall know that I [am] the Lord-Yehōvah (Messiah Pre-Incarnate)."
Ezekiel,39,1,"Therefore, you i Son of man, prophesy against Gog [mountain] , and say, Thus says the Lord-Adonai [Greatest Above All Things] GOD-Yehōvih (THE FATHER) ; Behold, I [am] against you i , O Gog [mountain] , the chief prince of Meshekh [drawing out] and Tuval [you shall be brought]:"
Ezekiel,39,2,"And I will turn you i back, and leave but the sixth part of you i , and will cause you i to come up from the north parts, and will bring you i upon the mountains of Yisra’el [He Holds Onto The Heel Of God]:"
Ezekiel,39,3,"And I will strike your i bow out of your i left hand, and will cause your i arrows to fall out of your i right hand."
Ezekiel,39,4,"you i shall fall upon the mountains of Yisra’el [He Holds Onto The Heel Of God] , you i , and all you i troops, and the people that [is] with you i : I will give you i unto the ravenous birds of every sort, and [to] the beasts of the field to be devoured."
Ezekiel,39,5,"you i shall fall upon the open field: for I have spoken [it] , says the Lord-Adonai [Greatest Above All Things] GOD-Yehōvih (THE FATHER)."
Ezekiel,39,6,"And I will send a fire on Magog [land of God] , and among them that dwell carelessly in the isles: and they shall know that I [am] the Lord-Yehōvah (Messiah Pre-Incarnate)."
Ezekiel,39,7,"So will I make my holy name known in the midst of my people Yisra’el [He Holds Onto The Heel Of God] ; and I will not [let them] pollute my holy name any more: and the heathen shall know that I [am] the Lord-Yehōvah (Messiah Pre-Incarnate) , the Holy One in Yisra’el [He Holds Onto The Heel Of God]."
Ezekiel,39,8,"Behold, it is come, and it is done, says the Lord-Adonai [Greatest Above All Things] GOD-Yehōvih (THE FATHER) ; this [is] the day whereof I have spoken."
Ezekiel,39,9,"And they that dwell in the cities of Yisra’el [He Holds Onto The Heel Of God] shall go forth, and shall set on fire and burn the weapons, both the shields and the bucklers, the bows and the arrows, and the handstaves, and the spears, and they shall burn them with fire seven years:"
Ezekiel,39,10,"So that they shall take no wood out of the field, neither cut down [any] out of the forests; for they shall burn the weapons with fire: and they shall spoil (plunder; prey; booty) those that spoiled them, and rob those that robbed them, says the Lord-Adonai [Greatest Above All Things] GOD-Yehōvih (THE FATHER)."
Ezekiel,39,11,"And it shall come to pass in that day, [that] I will give unto Gog [mountain] a place there of graves in Yisra’el [He Holds Onto The Heel Of God] , the valley of the passengers on the east of the sea: and it shall stop the [noses] of the passengers: and there shall they bury Gog [mountain] and all his multitude: and they shall call [it] The Valley of Hamon-Gog [multitude of Gog]."
Ezekiel,39,12,"And seven months shall the house of Yisra’el [He Holds Onto The Heel Of God] be burying of them, that they may cleanse the land."
Ezekiel,39,13,"Yes, all the people of the land shall bury [them] ; and it shall be to them a renown (great reputation; being well-known) the day that I shall be glorified, says the Lord-Adonai [Greatest Above All Things] GOD-Yehōvih (THE FATHER)."
Ezekiel,39,14,"And they shall sever out men of continual employment, passing through the land to bury with the travelers those that remain upon the face of the earth, to cleanse it: after the end of seven months shall they search."
Ezekiel,39,15,"And the travelers [that] pass through the land, when [any] sees a man’s bone, then shall he set up a sign by it, till the buriers have buried it in the valley of Hamon-Gog [multitude of Gog]."
Ezekiel,39,16,And also the name of the city [shall be] Hamonah [multitudes] . Thus shall they cleanse the land.
Ezekiel,39,17,"And, you i Son of man, thus says the Lord-Adonai [Greatest Above All Things] GOD-Yehōvih (THE FATHER) ; Speak unto every feathered fowl, and to every beast of the field, Assemble yourselves, and come; gather yourselves on every side to my sacrifice that I do sacrifice for you, [even] a great sacrifice upon the mountains of Yisra’el [He Holds Onto The Heel Of God] , that you 2f may eat flesh, and drink blood."
Ezekiel,39,18,"You 2f shall eat the flesh of the mighty, and drink the blood of the princes of the earth, of rams, of lambs, and of goats, of bullocks, all of them fatlings of Bashan [Fruitful]."
Ezekiel,39,19,"And you 2f shall eat fat till you 2f be full, and drink blood till you 2f be drunken, of my sacrifice which I have sacrificed for you."
Ezekiel,39,20,"Thus you 2f shall be filled at my table with horses and chariots, with mighty men, and with all men of war, says the Lord-Adonai [Greatest Above All Things] GOD-Yehōvih (THE FATHER)."
Ezekiel,39,21,"And I will set my glory among the heathen, and all the heathen shall see my judgment that I have executed, and my hand that I have laid upon them."
Ezekiel,39,22,So the house of Yisra’el [He Holds Onto The Heel Of God] shall know that I [am] the Lord-Yehōvah (Messiah Pre-Incarnate) their God-Elōhīm (The Living Word) [The Many Powered] from that day and forward.
Ezekiel,39,23,"And the heathen shall know that the house of Yisra’el [He Holds Onto The Heel Of God] went into captivity for their iniquity: because they trespassed against me, therefore hid I my face from them, and gave them into the hand of their enemies: so fell they all by the sword."
Ezekiel,39,24,"According to their uncleanness and according to their transgressions have I done unto them, and hid my face from them."
Ezekiel,39,25,"Therefore thus says the Lord-Adonai [Greatest Above All Things] GOD-Yehōvih (THE FATHER) ; Now will I bring again the captivity of Ya’akov [Heal of God] , and have mercy upon the whole house of Yisra’el [He Holds Onto The Heel Of God] , and will be jealous for my holy name;"
Ezekiel,39,26,"After that they have borne their shame, and all their trespasses whereby they have trespassed against me, when they dwelt safely in their land, and none made [them] afraid."
Ezekiel,39,27,"When I have brought them again from the people, and gathered them out of their enemies’ lands, and am sanctified in them in the sight of many nations;"
Ezekiel,39,28,"Then shall they know that I [am] the Lord-Yehōvah (Messiah Pre-Incarnate) their God-Elōhīm (The Living Word) [The Many Powered] , which caused them to be led into captivity among the heathen: but I have gathered them unto their own land, and have left none of them anymore there."
Ezekiel,39,29,"Neither will I hide my face any more from them: for I have poured out my Spirit upon the house of Yisra’el [He Holds Onto The Heel Of God] , says the Lord-Adonai [Greatest Above All Things] GOD-Yehōvih (THE FATHER)."
Ezekiel,40,1,"In the five and twentieth year of our captivity, in the beginning of the year, in the tenth [day] of the month, in the fourteenth year after that the city was smitten, in the selfsame day the hand of the Lord-Yehōvah (Messiah Pre-Incarnate) was upon me, and brought me there."
Ezekiel,40,2,"In the visions of God-Elōhīm (The Living Word) [The Many Powered] brought he me into the land of Yisra’el [He Holds Onto The Heel Of God] , and set me upon a very high mountain, by which [was] as the frame of a city on the south."
Ezekiel,40,3,"And he brought me there, and, behold, [there was] a man, whose appearance [was] like the appearance of brass, with a line of flax in his hand, and a measuring reed; and he stood in the gate."
Ezekiel,40,4,"And the man said unto me, Son of man, behold with your i eyes, and hear with your i ears, and set your i heart upon all that I shall show you i ; for to the intent that I might show [them] unto you i [are] you i brought here: declare all that you i see to the house of Yisra’el [He Holds Onto The Heel Of God]."
Ezekiel,40,5,"And behold a wall on the outside of the house round about, and in the man’s hand a measuring reed of six cubits [long] by the cubit and an hand breadth: so he measured the breadth of the building, one reed; and the height, one reed."
Ezekiel,40,6,"Then came he unto the gate which looks toward the east, and went up the stairs thereof, and measured the threshold of the gate, [which was] one reed broad; and the other threshold [of the gate, which was] one reed broad."
Ezekiel,40,7,"And [every] little chamber [was] one reed long, and one reed broad; and between the little chambers [were] five cubits; and the threshold of the gate by the porch of the gate within [was] one reed."
Ezekiel,40,8,"He measured also the porch of the gate within, one reed."
Ezekiel,40,9,"Then measured he the porch of the gate, eight cubits; and the posts thereof, two cubits; and the porch of the gate [was] inward."
Ezekiel,40,10,"And the little chambers of the gate eastward [were] three on this side, and three on that side; they three [were] of one measure: and the posts had one measure on this side and on that side."
Ezekiel,40,11,"And he measured the breadth of the entry of the gate, ten cubits; [and] the length of the gate, thirteen cubits."
Ezekiel,40,12,"The space also before the little chambers [was] one cubit [on this side] , and the space [was] one cubit on that side: and the little chambers [were] six cubits on this side, and six cubits on that side."
Ezekiel,40,13,"He measured then the gate from the roof of [one] little chamber to the roof of another: the breadth [was] five and twenty cubits, door against door."
Ezekiel,40,14,"He made also posts of threescore cubits, even unto the post of the court round about the gate."
Ezekiel,40,15,And from the face of the gate of the entrance unto the face of the porch of the inner gate [were] fifty cubits.
Ezekiel,40,16,"And [there were] narrow windows to the little chambers, and to their posts within the gate round about, and likewise to the arches: and windows [were] round about inward: and upon [each] post [were] palm trees."
Ezekiel,40,17,"Then brought he me into the outward court, and, lo, [there were] chambers, and a pavement made for the court round about: thirty chambers [were] upon the pavement."
Ezekiel,40,18,And the pavement by the side of the gates over against the length of the gates [was] the lower pavement.
Ezekiel,40,19,"Then he measured the breadth from the forefront of the lower gate unto the forefront of the inner court without, an hundred cubits eastward and northward."
Ezekiel,40,20,"And the gate of the outward court that looked toward the north, he measured the length thereof, and the breadth thereof."
Ezekiel,40,21,"And the little chambers thereof [were] three on this side and three on that side; and the posts thereof and the arches thereof were after the measure of the first gate: the length thereof [was] fifty cubits, and the breadth five and twenty cubits."
Ezekiel,40,22,"And their windows, and their arches, and their palm trees, [were] after the measure of the gate that looks toward the east; and they went up unto it by seven steps; and the arches thereof [were] before them."
Ezekiel,40,23,"And the gate of the inner court [was] over against the gate toward the north, and toward the east; and he measured from gate to gate an hundred cubits."
Ezekiel,40,24,"After that he brought me toward the south, and behold a gate toward the south: and he measured the posts thereof and the arches thereof according to these measures."
Ezekiel,40,25,"And [there were] windows in it and in the arches thereof round about, like those windows: the length [was] fifty cubits, and the breadth five and twenty cubits."
Ezekiel,40,26,"And [there were] seven steps to go up to it, and the arches thereof [were] before them: and it had palm trees, one on this side, and another on that side, upon the posts thereof."
Ezekiel,40,27,And [there was] a gate in the inner court toward the south: and he measured from gate to gate toward the south an hundred cubits.
Ezekiel,40,28,And he brought me to the inner court by the south gate: and he measured the south gate according to these measures;
Ezekiel,40,29,"And the little chambers thereof, and the posts thereof, and the arches thereof, according to these measures: and [there were] windows in it and in the arches thereof round about: [it was] fifty cubits long, and five and twenty cubits broad."
Ezekiel,40,30,"And the arches round about [were] five and twenty cubits long, and five cubits broad."
Ezekiel,40,31,And the arches thereof [were] toward the outer court; and palm trees [were] upon the posts thereof: and the going up to it [had] eight steps.
Ezekiel,40,32,And he brought me into the inner court toward the east: and he measured the gate according to these measures.
Ezekiel,40,33,"And the little chambers thereof, and the posts thereof, and the arches thereof, [were] according to these measures: and [there were] windows in it and in the arches thereof round about: [it was] fifty cubits long, and five and twenty cubits broad."
Ezekiel,40,34,"And the arches thereof [were] toward the outward court; and palm trees [were] upon the posts thereof, on this side, and on that side: and the going up to it [had] eight steps."
Ezekiel,40,35,"And he brought me to the north gate, and measured [it] according to these measures;"
Ezekiel,40,36,"The little chambers thereof, the posts thereof, and the arches thereof, and the windows to it round about: the length [was] fifty cubits, and the breadth five and twenty cubits."
Ezekiel,40,37,"And the posts thereof [were] toward the outer court; and palm trees [were] upon the posts thereof, on this side, and on that side: and the going up to it [had] eight steps."
Ezekiel,40,38,"And the chambers and the entries thereof [were] by the posts of the gates, where they washed the burnt offering."
Ezekiel,40,39,"And in the porch of the gate [were] two tables on this side, and two tables on that side, to slay thereon the burnt offering and the sin offering and the trespass offering."
Ezekiel,40,40,"And at the side without, as one goes up to the entry of the north gate, [were] two tables; and on the other side, which [was] at the porch of the gate, [were] two tables."
Ezekiel,40,41,"Four tables [were] on this side, and four tables on that side, by the side of the gate; eight tables, whereupon they killed [their sacrifices]."
Ezekiel,40,42,"And the four tables [were] of cut stone for the burnt offering, of a cubit and an half long, and a cubit and an half broad, and one cubit high: whereupon also they laid the instruments which they killed the burnt offering and the sacrifice."
Ezekiel,40,43,"And within [were] hooks, an hand broad, fastened round about: and upon the tables [was] the flesh of the offering."
Ezekiel,40,44,"And without the inner gate [were] the chambers of the singers in the inner court, which [was] at the side of the north gate; and their prospect [was] toward the south: one at the side of the east gate [having] the prospect toward the north."
Ezekiel,40,45,"And he said unto me, This chamber, whose prospect [is] toward the south, [is] for the priests, the keepers of the charge of the house."
Ezekiel,40,46,"And the chamber whose prospect [is] toward the north [is] for the priests, the keepers of the charge of the altar: these [are] the sons of Tzadok [righteous] among the sons of Levi (Levite) [Adhesion, Joiner] , which come near to the Lord-Yehōvah (Messiah Pre-Incarnate) to minister unto him."
Ezekiel,40,47,"So he measured the court, an hundred cubits long, and an hundred cubits broad, Foursquare (squared; four cornered) ; and the altar [that was] before the house."
Ezekiel,40,48,"And he brought me to the porch of the house, and measured [each] post of the porch, five cubits on this side, and five cubits on that side: and the breadth of the gate [was] three cubits on this side, and three cubits on that side."
Ezekiel,40,49,"The length of the porch [was] twenty cubits, and the breadth eleven cubits; and [he brought me] by the steps whereby they went up to it: and [there were] pillars by the posts, one on this side, and another on that side."
Ezekiel,41,1,"Afterward he brought me to the temple, and measured the posts, six cubits broad on the one side, and six cubits broad on the other side, [which was] the breadth of the tabernacle."
Ezekiel,41,2,"And the breadth of the door [was] ten cubits; and the sides of the door [were] five cubits on the one side, and five cubits on the other side: and he measured the length thereof, forty cubits: and the breadth, twenty cubits."
Ezekiel,41,3,"Then went he inward, and measured the post of the door, two cubits; and the door, six cubits; and the breadth of the door, seven cubits."
Ezekiel,41,4,"So he measured the length thereof, twenty cubits; and the breadth, twenty cubits, before the temple: and he said unto me, This [is] the most holy [place]."
Ezekiel,41,5,"After he measured the wall of the house, six cubits; and the breadth of [every] side chamber, four cubits, round about the house on every side."
Ezekiel,41,6,"And the side chambers [were] three, one over another, and thirty in order; and they entered into the wall which [was] of the house for the side chambers round about, that they might have hold, but they had not hold in the wall of the house."
Ezekiel,41,7,"And [there was] an enlarging, and a winding about still upward to the side chambers: for the winding about of the house went still upward round about the house: therefore the breadth of the house [was still] upward, and so increased [from] the lowest [chamber] to the highest by the midst."
Ezekiel,41,8,I saw also the height of the house round about: the foundations of the side chambers [were] a full reed of six great cubits.
Ezekiel,41,9,"The thickness of the wall, which [was] for the side chamber without, [was] five cubits: and [that] which [was] left [was] the place of the side chambers that [were] within."
Ezekiel,41,10,And between the chambers [was] the wideness of twenty cubits round about the house on every side.
Ezekiel,41,11,"And the doors of the side chambers [were] toward [the place that was] left, one door toward the north, and another door toward the south: and the breadth of the place that was left [was] five cubits round about."
Ezekiel,41,12,"Now the building that [was] before the separate place at the end toward the west [was] seventy cubits broad; and the wall of the building [was] five cubits thick round about, and the length thereof ninety cubits."
Ezekiel,41,13,"So he measured the house, an hundred cubits long; and the separate place, and the building, with the walls thereof, an hundred cubits long;"
Ezekiel,41,14,"Also the breadth of the face of the house, and of the separate place toward the east, an hundred cubits."
Ezekiel,41,15,"And he measured the length of the building over against the separate place which [was] behind it, and the galleries thereof on the one side and on the other side, an hundred cubits, with the inner temple, and the porches of the court;"
Ezekiel,41,16,"The door posts, and the narrow windows, and the galleries round about on their three stories, over against the door, ceilinged with wood round about, and from the ground up to the windows, and the windows [were] covered;"
Ezekiel,41,17,"To that above the door, even unto the inner house, and without, and by all the wall round about within and without, by measure."
Ezekiel,41,18,"And [it was] made with k’vurim (cherubim) and palm trees, so that a palm tree [was] between a cherub [keruv] and a cherub [keruv] ; and [every] cherub [keruv] had two faces;"
Ezekiel,41,19,"So that the face of a man [was] toward the palm tree on the one side, and the face of a young lion toward the palm tree on the other side: [it was] made through all the house round about."
Ezekiel,41,20,"From the ground unto above the door [were] k’vurim (cherubim) and palm trees made, and [on] the wall of the temple."
Ezekiel,41,21,"The posts of the temple [were] squared, [and] the face of the sanctuary; the appearance [of the one] as the appearance [of the other]."
Ezekiel,41,22,"The altar of wood [was] three cubits high, and the length thereof two cubits; and the corners thereof, and the length thereof, and the walls thereof, [were] of wood: and he said unto me, This [is] the table that [is] before the Lord-Yehōvah (Messiah Pre-Incarnate)."
Ezekiel,41,23,And the temple and the sanctuary had two doors.
Ezekiel,41,24,"And the doors had two leaves [apiece] , two turning leaves; two [leaves] for the one door, and two leaves for the other [door]."
Ezekiel,41,25,"And [there were] made on them, on the doors of the temple, k’vurim (cherubim) and palm trees, like as [were] made upon the walls; and [there were] thick planks upon the face of the porch without."
Ezekiel,41,26,"And [there were] narrow windows and palm trees on the one side and on the other side, on the sides of the porch, and [upon] the side chambers of the house, and thick planks."
Ezekiel,42,1,"Then he brought me forth into the outer court, the way toward the north: and he brought me into the chamber that [was] over against the separate place, and which [was] before the building toward the north."
Ezekiel,42,2,"Before the length of an hundred cubits [was] the north door, and the breadth [was] fifty cubits."
Ezekiel,42,3,"Over against the twenty [cubits] which [were] for the inner court, and over against the pavement which [was] for the outer court, [was] gallery against gallery in three [stories]."
Ezekiel,42,4,"And before the chambers [was] a walk of ten cubits breadth inward, a way of one cubit; and their doors toward the north."
Ezekiel,42,5,"Now the upper chambers [were] shorter: for the galleries were higher than these, than the lower, and than the middlemost of the building."
Ezekiel,42,6,"For they [were] in three [stories] , but had not pillars as the pillars of the courts: therefore [the building] was straitened (impeded or restricted; narrowed, distressed) more than the lowest and the middlemost from the ground."
Ezekiel,42,7,"And the wall that [was] without over against the chambers, toward the outer court on the forepart of the chambers, the length thereof [was] fifty cubits."
Ezekiel,42,8,"For the length of the chambers that [were] in the outer court [was] fifty cubits: and, lo, before the temple [were] an hundred cubits."
