Ezekiel,1,1,"Now it came to pass in the thirtieth year, in the fourth [month] , in the fifth [day] of the month, as I [was] among the captives by the river of, [that] the heavens were opened, and I saw visions of God-Elōhīm (The Living Word) [The Many Powered]."
Ezekiel,1,2,"In the fifth [day] of the month, which [was] the fifth year of king Y’hoyakhin’s [Yehovah establishes] ’s captivity,"
Ezekiel,1,3,"The word of the Lord-Yehōvah (Messiah Pre-Incarnate) came expressly unto Yechezk’el [God strengthens] the priest, the son of Buzi [my contempt] , in the land of the Kasdim [clod-breakers] by the river K’var [far-off] ; and the hand of the Lord-Yehōvah (Messiah Pre-Incarnate) was there upon him."
Ezekiel,1,4,"And I looked, and, behold, a whirlwind came out of the north, a great cloud, and a fire infolding itself, and a brightness [was] about it, and out of the midst thereof as the colour of amber, out of the midst of the fire."
Ezekiel,1,5,Also out of the midst thereof [came] the likeness of four living creatures. And this [was] their appearance; they had the likeness of a man.
Ezekiel,1,6,"And everyone had four faces, and everyone had four wings."
Ezekiel,1,7,And their feet [were] straight feet; and the sole of their feet [was] like the sole of a calf’s foot: and they sparkled like the colour of burnished brass.
Ezekiel,1,8,And [they had] the hands of a man under their wings on their four sides; and they four had their faces and their wings.
Ezekiel,1,9,Their wings [were] joined one to another; they turned not when they went; they went everyone straight forward.
Ezekiel,1,10,"As for the likeness of their faces, they four had the face of a man, and the face of a lion, on the right side: and they four had the face of an ox on the left side; they four also had the face of an eagle."
Ezekiel,1,11,"Thus [were] their faces: and their wings [were] stretched upward; two [wings] of everyone [were] joined one to another, and two covered their bodies."
Ezekiel,1,12,"And they went everyone straight forward: to which the spirit was to go, they went; [and] they turned not when they went."
Ezekiel,1,13,"As for the likeness of the living creatures, their appearance [was] like burning coals of fire, [and] like the appearance of lamps: it went up and down among the living creatures; and the fire was bright, and out of the fire went forth lightning."
Ezekiel,1,14,And the living creatures ran and returned as the appearance of a flash of lightning.
Ezekiel,1,15,"Now as I beheld the living creatures, behold one wheel upon the earth by the living creatures, with his four faces."
Ezekiel,1,16,The appearance of the wheels and their work [was] like unto the colour of a beryl: and they four had one likeness: and their appearance and their work [was] as it were a wheel in the middle of a wheel.
Ezekiel,1,17,"When they went, they went upon their four sides: [and] they turned not when they went."
Ezekiel,1,18,"As for their rings, they were so high that they were dreadful; and their rings [were] full of eyes round about them four."
Ezekiel,1,19,"And when the living creatures went, the wheels went by them: and when the living creatures were lifted up from the earth, the wheels were lifted up."
Ezekiel,1,20,"Whithersoever the spirit was to go, they went, there [was their] spirit to go; and the wheels were lifted up over against them: for the spirit of the living creature [was] in the wheels."
Ezekiel,1,21,"When those went, [these] went; and when those stood, [these] stood; and when those were lifted up from the earth, the wheels were lifted up over against them: for the spirit of the living creature [was] in the wheels."
Ezekiel,1,22,"And the likeness of the Firmament (expanse or vault over the earth) upon the heads of the living creature [was] as the colour of the terrible crystal, stretched forth over their heads above."
Ezekiel,1,23,"And under the Firmament (expanse or vault over the earth) [were] their wings straight, the one toward the other: everyone had two, which covered on this side, and everyone had two, which covered on that side, their bodies."
Ezekiel,1,24,"And when they went, I heard the noise of their wings, like the noise of great waters, as the voice of the Almighty, the voice of speech, as the noise of an host: when they stood, they let down their wings."
Ezekiel,1,25,"And there was a voice from the Firmament (expanse or vault over the earth) that [was] over their heads, when they stood, [and] had let down their wings."
Ezekiel,1,26,"And above the Firmament (expanse or vault over the earth) that [was] over their heads [was] the likeness of a throne, as the appearance of a sapphire stone: and upon the likeness of the throne [was] the likeness as the appearance of a man above upon it."
Ezekiel,1,27,"And I saw as the colour of amber, as the appearance of fire round about within it, from the appearance of his waist even upward, and from the appearance of his waist even downward, I saw as it were the appearance of fire, and it had brightness round about."
Ezekiel,1,28,"As the appearance of the bow that is in the cloud in the day of rain, so [was] the appearance of the brightness round about. This [was] the appearance of the likeness of the glory of the Lord-Yehōvah (Messiah Pre-Incarnate) . And when I saw [it] , I fell upon my face, and I heard a voice of one that spoke."
Ezekiel,2,1,"And he said unto me, Son of man, stand upon your i feet, and I will speak unto you i."
Ezekiel,2,2,"And the Spirit entered into me when he spoke unto me, and set me upon my feet, that I heard him that spoke unto me."
Ezekiel,2,3,"And he said unto me, Son of man, I send you i to the people of Yisra’el [He Holds Onto The Heel Of God] , to a rebellious nation that has rebelled against me: they and their fathers have transgressed against me, [even] unto this very day."
Ezekiel,2,4,"For [they are] impudent (shameless; without modesty) children and stiffhearted. I do send you i unto them; and you i shall say unto them, Thus says the Lord-Adonai [Greatest Above All Things] GOD-Yehōvih (THE FATHER)."
Ezekiel,2,5,"And they, whether they will hear, or whether they will refrain (restrain; refrein from acting) , (for they [are] a rebellious house,) yet shall know that there has been a prophet among them."
Ezekiel,2,6,"And you i , Son of man, be not afraid of them, neither be afraid of their words, though briers and thorns [be] with you i , and you i do dwell among scorpions: be not afraid of their words, nor be dismayed at their looks, though they [be] a rebellious house."
Ezekiel,2,7,"And you i shall speak my words unto them, whether they will hear, or whether they will refrain (restrain; refrein from acting) : for they [are] most rebellious."
Ezekiel,2,8,"But you i , Son of man, hear what I say unto you i ; Be not you i rebellious like that rebellious house: open your i mouth, and eat that I give you i."
Ezekiel,2,9,"And when I looked, behold, an hand [was] sent unto me; and, lo, a roll of a book [was] in it;"
Ezekiel,2,10,"And he spread it before me; and it [was] written within and without: and [there was] written in it lamentations, and mourning, and woe."
Ezekiel,3,1,"Moreover he said unto me, Son of man, eat that you i find; eat this roll, and go speak unto the house of Yisra’el [He Holds Onto The Heel Of God]."
Ezekiel,3,2,"So I opened my mouth, and he caused me to eat that roll."
Ezekiel,3,3,"And he said unto me, Son of man, cause you i belly to eat, and fill your i bowels (inward parts; affections) with this roll that I give you i . Then did I eat [it] ; and it was in my mouth as honey for sweetness."
Ezekiel,3,4,"And he said unto me, Son of man, go, get you i unto the house of Yisra’el [He Holds Onto The Heel Of God] , and speak with my words unto them."
Ezekiel,3,5,"For you i [are] not sent to a people of a strange speech and of an hard language, [but] to the house of Yisra’el [He Holds Onto The Heel Of God];"
Ezekiel,3,6,"Not to many people of a strange speech and of an hard language, whose words you i can not understand. Surely, had I sent you i to them, they would have listened unto you i."
Ezekiel,3,7,But the house of Yisra’el [He Holds Onto The Heel Of God] will not hearken unto you i ; for they will not hearken unto me: for all the house of Yisra’el [He Holds Onto The Heel Of God] [are] impudent (shameless; without modesty) and hardhearted.
Ezekiel,3,8,"Behold, I have made your i face strong against their faces, and your i forehead strong against their foreheads."
Ezekiel,3,9,"As an adamant harder than flint have I made your i forehead: fear them not, neither be dismayed at their looks, though they [be] a rebellious house."
Ezekiel,3,10,"Moreover he said unto me, Son of man, all my words that I shall speak unto you i receive in your i heart, and hear with your i ears."
Ezekiel,3,11,"And go, get you i to them of the captivity, unto the children of your i people, and speak unto them, and tell them, Thus says the Lord-Adonai [Greatest Above All Things] GOD-Yehōvih (THE FATHER) ; whether they will hear, or whether they will refrain (restrain; refrein from acting)."
Ezekiel,3,12,"Then the spirit took me up, and I heard behind me a voice of a great rushing, [saying] , Blessed (Favored by God; happy; prosperous) [be] the glory of the Lord-Yehōvah (Messiah Pre-Incarnate) from his place."
Ezekiel,3,13," [I heard] also the noise of the wings of the living creatures that touched one another, and the noise of the wheels over against them, and a noise of a great rushing."
Ezekiel,3,14,"So the Spirit lifted me up, and took me away, and I went in bitterness, in the heat of my spirit; but the hand of the Lord-Yehōvah (Messiah Pre-Incarnate) was strong upon me."
Ezekiel,3,15,"Then I came to them of the captivity at Tel-Aviv [mound of the flood] , that dwelt by the river of K’var [far-off] , and I sat where they sat, and remained there astonished among them seven days."
Ezekiel,3,16,"And it came to pass at the end of seven days, that the word of the Lord-Yehōvah (Messiah Pre-Incarnate) came unto me, saying,"
Ezekiel,3,17,"Son of man, I have made you i a watchman unto the house of Yisra’el [He Holds Onto The Heel Of God] : therefore hear the word at my mouth, and give them warning from me."
Ezekiel,3,18,"When I say unto the wicked, you i shall surely die; and you i give him not warning, nor speak to warn the wicked from his wicked way, to save his life; the same wicked [man] shall die in his iniquity; but his blood will I require at your i hand."
Ezekiel,3,19,"Yet if you i warn the wicked, and he turn not from his wickedness, nor from his wicked way, he shall die in his iniquity; but you i have delivered your i soul."
Ezekiel,3,20,"Again, When a righteous [man] does turn from his righteousness, and commit iniquity, and I lay a stumblingblock before him, he shall die: because you i have not given him warning, he shall die in his sin, and his righteousness which he has done shall not be remembered; but his blood will I require at your i hand."
Ezekiel,3,21,"Nevertheless if you i warn the righteous [man] , that the righteous sin not, and he does not sin, he shall surely live, because he is warned; also you i have delivered your i soul."
Ezekiel,3,22,"And the hand of the Lord-Yehōvah (Messiah Pre-Incarnate) was there upon me; and he said unto me, Arise, go forth into the plain, and I will there talk with you i."
Ezekiel,3,23,"Then I arose, and went forth into the plain: and, behold, the glory of the Lord-Yehōvah (Messiah Pre-Incarnate) stood there, as the glory which I saw by the river of K’var [far-off] : and I fell on my face."
Ezekiel,3,24,"Then the Spirit entered into me, and set me upon my feet, and spoke with me, and said unto me, Go, shut yourself within you i house."
Ezekiel,3,25,"But you i , O Son of man, behold, they shall put bands upon you i , and shall bind you i with them, and you i shall not go out among them:"
Ezekiel,3,26,"And I will make your i tongue cleave (split open; cut open; divide) to the roof of your i mouth, that you i shall be dumb, and shall not be to them a reprover: for they [are] a rebellious house."
Ezekiel,3,27,"But when I speak with you i , I will open your i mouth, and you i shall say unto them, Thus says the Lord-Adonai [Greatest Above All Things] GOD-Yehōvih (THE FATHER) ; He that hears, let him hear; and he that forbears, let him refrain (restrain; refrein from acting) : for they [are] a rebellious house."
Ezekiel,4,1,"You i also, Son of man, take you i a tile, and lay it before you i , and portray upon it the city, [even] Yerushalayim [Foundation of Peace]:"
Ezekiel,4,2,"And lay siege against it, and build a fort against it, and cast a mount against it; set the camp also against it, and set [battering] rams against it round about."
Ezekiel,4,3,"Moreover take you i unto you i an iron pan, and set it [for] a wall of iron between you i and the city: and set your i face against it, and it shall be besieged, and you i shall lay siege against it. This [shall be] a sign to the house of Yisra’el [He Holds Onto The Heel Of God]."
Ezekiel,4,4,"Lie you i also upon your i left side, and lay the iniquity of the house of Yisra’el [He Holds Onto The Heel Of God] upon it: [according] to the number of the days that you i shall lie upon it you i shall bear their iniquity."
Ezekiel,4,5,"For I have laid upon you i the years of their iniquity, according to the number of the days, three hundred and ninety days: so shall you i bear the iniquity of the house of Yisra’el [He Holds Onto The Heel Of God]."
Ezekiel,4,6,"And when you i have accomplished them, lie again on your i right side, and you i shall bear the iniquity of the house of Y’hudah [Let Him (God) Be Praised] forty days: I have appointed you i each day for a year."
Ezekiel,4,7,"Therefore you i shall set your i face toward the siege of Yerushalayim [Foundation of Peace] , and your i arm [shall be] uncovered, and you i shall prophesy against it."
Ezekiel,4,8,"And, behold, I will lay bands upon you i , and you i shall not turn you i from one side to another, till you i have ended the days of your i siege."
Ezekiel,4,9,"Take you i also unto you i wheat, and barley, and beans, and lentiles, and millet, and fitches (a kind of grain used for seasoning) , and put them in one vessel, and make you i bread thereof, [according] to the number of the days that you i shall lie upon you i side, three hundred and ninety days shall you i eat thereof."
Ezekiel,4,10,"And you i meat which you i shall eat [shall be] by weight, twenty shekels a day: from time to time shall you i eat it."
Ezekiel,4,11,"You i shall drink also water by measure, the sixth part of an hin [a quart] : from time to time shall you i drink."
Ezekiel,4,12,"And you i shall eat it [as] barley cakes, and you i shall bake it with dung that comes out of man, in their sight."
Ezekiel,4,13,"And the Lord-Yehōvah (Messiah Pre-Incarnate) said, Even thus shall the people of Yisra’el [He Holds Onto The Heel Of God] eat their defiled bread among the Gentiles, to which I will drive them."
Ezekiel,4,14,"Then said I, Ah Lord-Adonai [Greatest Above All Things] GOD-Yehōvih (THE FATHER) ! behold, my soul has not been polluted: for from my youth up even till now have I not eaten of that which dies of itself, or is torn in pieces; neither came there abominable flesh into my mouth."
Ezekiel,4,15,"Then he said unto me, Lo, I have given you i cow’s dung for man’s dung, and you i shall prepare your i bread with that."
Ezekiel,4,16,"Moreover he said unto me, Son of man, behold, I will break the staff of bread in Yerushalayim [Foundation of Peace] : and they shall eat bread by weight, and with care; and they shall drink water by measure, and with astonishment:"
Ezekiel,4,17,"That they may lack bread and water, and be astonished one with another, and consume away for their iniquity."
Ezekiel,5,1,"And you i , Son of man, take you i a sharp knife, take you i a barber’s razor, and cause [it] to pass upon your i head and upon your i beard: then take you i balances to weigh, and divide the [hair]."
Ezekiel,5,2,"You i shall burn with fire a third part in the midst of the city, when the days of the siege are fulfilled: and you i shall take a third part, [and] strike about it with a knife: and a third part you i shall scatter in the wind; and I will draw out a sword after them."
Ezekiel,5,3,"You i shall also take thereof a few in number, and bind them in your i skirts."
Ezekiel,5,4,"Then take of them again, and cast them into the midst of the fire, and burn them in the fire; [for] thereof shall a fire come forth into all the house of Yisra’el [He Holds Onto The Heel Of God]."
Ezekiel,5,5,Thus says the Lord-Adonai [Greatest Above All Things] GOD-Yehōvih (THE FATHER) ; This [is] Yerushalayim [Foundation of Peace] : I have set it in the midst of the nations and countries [that are] round about her.
Ezekiel,5,6,"And she has changed my judgments into wickedness more than the nations, and my statutes more than the countries that [are] round about her: for they have refused my judgments and my statutes, they have not walked in them."
Ezekiel,5,7,"Therefore thus says the Lord-Adonai [Greatest Above All Things] GOD-Yehōvih (THE FATHER) ; Because you 2f multiplied more than the nations that [are] round about you, [and] have not walked in my statutes, neither have kept my judgments, neither have done according to the judgments of the nations that [are] round about you;"
Ezekiel,5,8,"Therefore thus says the Lord-Adonai [Greatest Above All Things] GOD-Yehōvih (THE FATHER) ; Behold, I, even I, [am] against you i , and will execute judgments in the midst of your i in the sight of the nations."
Ezekiel,5,9,"And I will do in you i that which I have not done, and whereunto I will not do any more the like, because of all you i abominations."
Ezekiel,5,10,"Therefore the fathers shall eat the sons in the midst of you i , and the sons shall eat their fathers; and I will execute judgments in you i , and the whole remnant of you i will I scatter into all the winds."
Ezekiel,5,11,"For what reason, [as] I live, says the Lord-Adonai [Greatest Above All Things] GOD-Yehōvih (THE FATHER) ; Surely, because you i have defiled my sanctuary with all your i detestable things, and with all your i abominations, therefore will I also diminish [you i ] ; neither shall my eye spare, neither will I have any pity."
Ezekiel,5,12,"A third part of you i shall die with the pestilence, and with famine shall they be consumed in the midst of you i : and a third part shall fall by the sword round about you i ; and I will scatter a third part into all the winds, and I will draw out a sword after them."
Ezekiel,5,13,"Thus shall my anger be accomplished, and I will cause my fury to rest upon them, and I will be comforted: and they shall know that I the Lord-Yehōvah (Messiah Pre-Incarnate) have spoken [it] in my zeal, when I have accomplished my fury in them."
Ezekiel,5,14,"Moreover I will make you i waste, and a reproach (disgrace; shame) among the nations that [are] round about you i , in the sight of all that pass by."
Ezekiel,5,15,"So it shall be a reproach (disgrace; shame) and a taunt, an instruction and an astonishment unto the nations that [are] round about you i , when I shall execute judgments in you i in anger and in fury and in furious rebukes. I the Lord-Yehōvah (Messiah Pre-Incarnate) have spoken [it]."
Ezekiel,5,16,"When I shall send upon them the evil arrows of famine, which shall be for [their] destruction, [and] which I will send to destroy you: and I will increase the famine upon you, and will break your staff of bread:"
Ezekiel,5,17,"So will I send upon you famine and evil beasts, and they shall bereave you i ; and pestilence and blood shall pass through you i ; and I will bring the sword upon you i . I the Lord-Yehōvah (Messiah Pre-Incarnate) have spoken [it]."
Ezekiel,6,1,"And the word of the Lord-Yehōvah (Messiah Pre-Incarnate) came unto me, saying,"
Ezekiel,6,2,"Son of man, set your i face toward the mountains of Yisra’el [He Holds Onto The Heel Of God] , and prophesy against them,"
Ezekiel,6,3,"And say, You 2f mountains of Yisra’el [He Holds Onto The Heel Of God] , hear the word of the Lord-Adonai [Greatest Above All Things] GOD-Yehōvih (THE FATHER) ; Thus says the Lord-Adonai [Greatest Above All Things] GOD-Yehōvih (THE FATHER) to the mountains, and to the hills, to the rivers, and to the valleys; Behold, I, [even] I, will bring a sword upon you, and I will destroy your high places."
Ezekiel,6,4,"And your altars shall be desolate, and your images shall be broken: and I will cast down your slain [men] before your idols."
Ezekiel,6,5,And I will lay the dead carcasses of the people of Yisra’el [He Holds Onto The Heel Of God] before their idols; and I will scatter your bones round about your altars.
Ezekiel,6,6,"In all your dwelling places the cities shall be laid waste, and the high places shall be desolate; that your altars may be laid waste and made desolate, and your idols may be broken and cease, and your images may be cut down, and your works may be abolished."
Ezekiel,6,7,"And the slain shall fall in the midst of you, and you 2f shall know that I [am] the Lord-Yehōvah (Messiah Pre-Incarnate)."
Ezekiel,6,8,"Yet will I leave a remnant, that you 2f may have [some] that shall escape the sword among the nations, when you 2f shall be scattered through the countries."
Ezekiel,6,9,"And they that escape of you shall remember me among the nations to which they shall be carried captives, because I am broken with their whorish heart, which has departed from me, and with their eyes, which go a whoring after their idols: and they shall loathe themselves for the evils which they have committed in all their abominations."
Ezekiel,6,10,"And they shall know that I [am] the Lord-Yehōvah (Messiah Pre-Incarnate), [and that] I have not said in vain that I would do this evil unto them."
Ezekiel,6,11,"Thus says the Lord-Adonai [Greatest Above All Things] GOD-Yehōvih (THE FATHER) ; Strike with your i hand, and stamp with your i foot, and say, Alas for all the evil abominations of the house of Yisra’el [He Holds Onto The Heel Of God] ! for they shall fall by the sword, by the famine, and by the pestilence."
Ezekiel,6,12,He that is far off shall die of the pestilence; and he that is near shall fall by the sword; and he that remains and is besieged shall die by the famine: thus will I accomplish my fury upon them.
Ezekiel,6,13,"Then shall you 2f know that I [am] the Lord-Yehōvah (Messiah Pre-Incarnate) , when their slain [men] shall be among their idols round about their altars, upon every high hill, in all the tops of the mountains, and under every green tree, and under every thick oak, the place where they did offer soothing aroma to all their idols."
Ezekiel,6,14,"So will I stretch out my hand upon them, and make the land desolate, yes, more desolate than the wilderness toward Divlah [the place of the fig cake] , in all their habitations: and they shall know that I [am] the Lord-Yehōvah (Messiah Pre-Incarnate)."
Ezekiel,7,1,"Moreover the word of the Lord-Yehōvah (Messiah Pre-Incarnate) came unto me, saying,"
Ezekiel,7,2,"Also, you i Son of man, thus says the Lord-Adonai [Greatest Above All Things] GOD-Yehōvih (THE FATHER) unto the land of Yisra’el [He Holds Onto The Heel Of God] ; An end, the end is come upon the four corners of the land."
Ezekiel,7,3,"Now [is] the end [come] upon you i , and I will send my anger upon you i , and will judge you i according to your i ways, and will recompense upon you i all your i abominations."
Ezekiel,7,4,"And my eye shall not spare you i , neither will I have pity: but I will recompense your i ways upon you i , and your i abominations shall be in the midst of you i : and you 2f shall know that I [am] the Lord-Yehōvah (Messiah Pre-Incarnate)."
Ezekiel,7,5,"Thus says the Lord-Adonai [Greatest Above All Things] GOD-Yehōvih (THE FATHER) ; An evil, an only evil, behold, is come."
Ezekiel,7,6,"An end is come, the end is come: it watch for you i ; behold, it is come."
Ezekiel,7,7,"The morning is come unto you i , O you i that dwell in the land: the time is come, the day of trouble [is] near, and not the sounding again of the mountains."
Ezekiel,7,8,"Now will I shortly pour out my fury upon you i , and accomplish my anger upon you i : and I will judge you i according to your i ways, and will recompense you i for all your i abominations."
Ezekiel,7,9,"And my eye shall not spare, neither will I have pity: I will recompense you i according to your i ways and your i abominations [that] are in the midst of you i ; and you 2f shall know that I [am] Yehovah Makeh [Messiah Pre-Incarnate Striking {You}]."
Ezekiel,7,10,"Behold the day, behold, it is come: the morning is gone forth; the rod has blossomed, pride has budded."
Ezekiel,7,11,"Violence is risen up into a rod of wickedness: none of them [shall remain] , nor of their multitude, nor of any of theirs: neither [shall there be] wailing for them."
Ezekiel,7,12,"The time is come, the day draws near: let not the buyer rejoice, nor the seller mourn: for wrath [is] upon all the multitude thereof."
Ezekiel,7,13,"For the seller shall not return to that which is sold, although they were yet alive: for the vision [is] touching the whole multitude thereof, [which] shall not return; neither shall any strengthen himself in the iniquity of his life."
Ezekiel,7,14,"They have blown the trumpet, even to make all ready; but none goes to the battle: for my wrath [is] upon all the multitude thereof."
Ezekiel,7,15,"The sword [is] without, and the pestilence and the famine within: he that [is] in the field shall die with the sword; and he that [is] in the city, famine and pestilence shall devour him."
Ezekiel,7,16,"But they that escape of them shall escape, and shall be on the mountains like doves of the valleys, all of them mourning, everyone for his iniquity."
