Ezekiel,25,5,"And I will make Rabbah [Great] a stable for camels, and the ‘Amon [Inbred] a couchingplace for flocks: and you 2f shall know that I [am] the Lord-Yehōvah (Messiah Pre-Incarnate)."
Ezekiel,25,6,"For thus says the Lord-Adonai [Greatest Above All Things] GOD-Yehōvih (THE FATHER) ; Because you i have clapped [your i ] hands, and stamped with the feet, and rejoiced in heart with all your i despite (contempt; angy hatred) against the land of Yisra’el [He Holds Onto The Heel Of God];"
Ezekiel,25,7,"Behold, therefore I will stretch out my hand upon you i , and will deliver you i for a spoil (plunder; prey; booty) to the heathen; and I will cut you i off from the people, and I will cause you i to perish out of the countries: I will destroy you i ; and you i shall know that I [am] the Lord-Yehōvah (Messiah Pre-Incarnate)."
Ezekiel,25,8,"Thus says the Lord-Adonai [Greatest Above All Things] GOD-Yehōvih (THE FATHER) ; Because that Mo’av [Seed of my Father] and Se’ir [Shaggy] do say, Behold, the house of Y’hudah [Let Him (God) Be Praised] [is] like unto all the heathen;"
Ezekiel,25,9,"Therefore, behold, I will open the side of Mo’av [Seed of my Father] from the cities, from his cities [which are] on his frontiers, the glory of the country, Beit-Yeshimot [House of the Desolation] , Ba’al-M’on [lord of the Habitation] , and Kiryatayim [two cities],"
Ezekiel,25,10,"Unto the men of the east with the ‘Amon [Inbred] , and will give them in possession, that the ‘Amon [Inbred] may not be remembered among the nations."
Ezekiel,25,11,And I will execute judgments upon Mo’av [Seed of my Father] ; and they shall know that I [am] the Lord-Yehōvah (Messiah Pre-Incarnate).
Ezekiel,25,12,"Thus says the Lord-Adonai [Greatest Above All Things] GOD-Yehōvih (THE FATHER) ; Because that Edom [Red] has dealt against the house of Y’hudah [Let Him (God) Be Praised] by taking vengeance, and has greatly offended, and revenged himself upon them;"
Ezekiel,25,13,"Therefore thus says the Lord-Adonai [Greatest Above All Things] GOD-Yehōvih (THE FATHER) ; I will also stretch out my hand upon Edom [Red] , and will cut off man and beast from it; and I will make it desolate from Teman [south] ; and they of D’dan [low country] shall fall by the sword."
Ezekiel,25,14,"And I will lay my vengeance upon Edom [Red] by the hand of my people Yisra’el [He Holds Onto The Heel Of God] : and they shall do in Edom [Red] according to my anger and according to my fury; and they shall know my vengeance, says the Lord-Adonai [Greatest Above All Things] GOD-Yehōvih (THE FATHER)."
Ezekiel,25,15,"Thus says the Lord-Adonai [Greatest Above All Things] GOD-Yehōvih (THE FATHER) ; Because the P’lishtim [Immigrants] have dealt by revenge, and have taken vengeance with a despiteful heart, to destroy [it] for the old hatred;"
Ezekiel,25,16,"Therefore thus says the Lord-Adonai [Greatest Above All Things] GOD-Yehōvih (THE FATHER) ; Behold, I will stretch out my hand upon the P’lishtim [Immigrants] , and I will cut off the K’reti [executioners] , and destroy the remnant of the sea coast."
Ezekiel,25,17,"And I will execute great vengeance upon them with furious rebukes; and they shall know that I [am] the Lord-Yehōvah (Messiah Pre-Incarnate) , when I shall lay my vengeance upon them."
Ezekiel,26,1,"And it came to pass in the eleventh year, in the first [day] of the month, [that] the word of the Lord-Yehōvah (Messiah Pre-Incarnate) came unto me, saying,"
Ezekiel,26,2,"Son of man, because that Tzor (Tyrus) [a rock] has said against Yerushalayim [Foundation of Peace] , Aha, she is broken [that was] the gates of the people: she is turned unto me: I shall be replenished, [now] she is laid waste:"
Ezekiel,26,3,"Therefore thus says the Lord-Adonai [Greatest Above All Things] GOD-Yehōvih (THE FATHER) ; Behold, I [am] against you i , O Tzor (Tyrus) [a rock] , and will cause many nations to come up against you i , as the sea causes his waves to come up."
Ezekiel,26,4,"And they shall destroy the walls of Tzor (Tyrus) [a rock] , and break down her towers: I will also scrape her dust from her, and make her like the top of a rock."
Ezekiel,26,5,"It shall be [a place for] the spreading of nets in the midst of the sea: for I have spoken [it] , says the Lord-Adonai [Greatest Above All Things] GOD-Yehōvih (THE FATHER) : and it shall become a spoil (plunder; prey; booty) to the nations."
Ezekiel,26,6,And her daughters which [are] in the field shall be slain by the sword; and they shall know that I [am] the Lord-Yehōvah (Messiah Pre-Incarnate).
Ezekiel,26,7,"For thus says the Lord-Adonai [Greatest Above All Things] GOD-Yehōvih (THE FATHER) ; Behold, I will bring upon Tzor (Tyrus) [a rock] N’vukhadretzar [may Nebo protect the crown] king of Bavel (to jumble, or a confused medley of sounds; confusion; gate of the deity) (Babylon) [confusion] , a king of kings, from the north, with horses, and with chariots, and with horsemen, and companies, and much people."
Ezekiel,26,8,"He shall slay with the sword your i daughters in the field: and he shall make a fort against you i , and cast a mount against you i , and lift up the buckler (round shielf held with a grip) against you i."
Ezekiel,26,9,"And he shall set engines of war against you i walls, and with his axes he shall break down your i towers."
Ezekiel,26,10,"By reason of the abundance of his horses their dust shall cover you i : your i walls shall shake at the noise of the horsemen, and of the wheels, and of the chariots, when he shall enter into your i gates, as men enter into a city wherein is made a breach (breaking forth; a break; opening, inlet)."
Ezekiel,26,11,"With the hoofs of his horses shall he trample down all your i streets: he shall slay your i people by the sword, and your i strong garrisons shall go down to the ground."
Ezekiel,26,12,"And they shall make a spoil (plunder; prey; booty) of your i riches, and make a prey of your i merchandise: and they shall break down your i walls, and destroy you i pleasant houses: and they shall lay your i stones and your i timber and your i dust in the midst of the water."
Ezekiel,26,13,And I will cause the noise of your i songs to cease; and the sound of your i harps shall be no more heard.
Ezekiel,26,14,"And I will make you i like the top of a rock: you i shall be [a place] to spread nets upon; you i shall be built no more: for I the Lord-Yehōvah (Messiah Pre-Incarnate) have spoken [it] , says the Lord-Adonai [Greatest Above All Things] GOD-Yehōvih (THE FATHER)."
Ezekiel,26,15,"Thus says the Lord-Adonai [Greatest Above All Things] GOD-Yehōvih (THE FATHER) to Tzor (Tyrus) [a rock] ; Shall not the isles shake at the sound of your i fall, when the wounded cry, when the slaughter is made in the midst of you i?"
Ezekiel,26,16,"Then all the princes of the sea shall come down from their thrones, and lay away their robes, and put off their adorned with needlework garments: they shall clothe themselves with trembling; they shall sit upon the ground, and shall tremble at [every] moment, and be astonished at you i."
Ezekiel,26,17,"And they shall take up a lamentation for you i , and say to you i , How are you i destroyed, [that were] inhabited of seafaring men, the renowned city, which were strong in the sea, she and her inhabitants, which cause their terror [to be] on all that haunt (where one goes freequently) it!"
Ezekiel,26,18,"Now shall the isles tremble in the day of your i fall; yes, the isles that [are] in the sea shall be troubled at your i departure."
Ezekiel,26,19,"For thus says the Lord-Adonai [Greatest Above All Things] GOD-Yehōvih (THE FATHER) ; When I shall make you i a desolate city, like the cities that are not inhabited; when I shall bring up the deep upon you i , and great waters shall cover you i;"
Ezekiel,26,20,"When I shall bring you i down with them that descend into the pit, with the people of old time, and shall set you i in the low parts of the earth, in places desolate of old, with them that go down to the pit, that you i be not inhabited; and I shall set glory in the land of the living;"
Ezekiel,26,21,"I will make you i a terror, and you i [shall be] no [more] : though you i be sought for, yet shall you i never be found again, says the Lord-Adonai [Greatest Above All Things] GOD-Yehōvih (THE FATHER)."
Ezekiel,27,1,"The word of the Lord-Yehōvah (Messiah Pre-Incarnate) came again unto me, saying,"
Ezekiel,27,2,"Now, you i Son of man, take up a lamentation for Tzor (Tyrus) [a rock];"
Ezekiel,27,3,"And say unto Tzor (Tyrus) [a rock] , O you i that are situate at the entry of the sea, [which are] a merchant of the people for many isles, Thus says the Lord-Adonai [Greatest Above All Things] GOD-Yehōvih (THE FATHER) ; O Tzor (Tyrus) [a rock] , you i have said, I [am] of perfect beauty."
Ezekiel,27,4,"Your 1s borders [are] in the midst of the seas, your i builders have perfected your i beauty."
Ezekiel,27,5,They have made all your i [ship] boards of fir trees of S’nir [snow mountain] : they have taken cedars from L’vanon [Whiteness] to make masts for you i.
Ezekiel,27,6," [Of] the oaks of Bashan [Fruitful] have they made your i oars; the company of the Ashuri [guided; Blessed (Favored by God; happy; prosperous)] have made your i benches [of] ivory, [brought] out of the isles of Kittim [Bruisers]."
Ezekiel,27,7,Fine linen with adorned with needlework work from Mitzrayim [Egypt - The Narrow Place] was that which you i spread forth to be your i sail; blue and purple from the isles of Elishah [God of the coming one] was that which covered you i.
Ezekiel,27,8,"The inhabitants of Tzidon [Hunting] and Arvad [I shall break loose] were your i mariners: your i wise [men] , O Tzor (Tyrus) [a rock], [that] were in you i , were your i pilots."
Ezekiel,27,9,The ancients of G’val [mountain] and the wise [men] thereof were in you i your i caulkers: all the ships of the sea with their mariners were in you i to occupy your i merchandise.
Ezekiel,27,10,"They of Paras (Persia) [pure or splendid] and of Lud [strife] and of Put [a bow] were in you i army, your i men of war: they hanged the shield and helmet in you i ; they set forth your i comeliness."
Ezekiel,27,11,"The men of Arvad [I shall break loose] with your i army [were] upon your i walls round about, and the Gamadim [warriors] were in your i towers: they hanged their shields upon your i walls round about; they have made your i beauty perfect."
Ezekiel,27,12,"Tarshish [yellow jasper] [was] your i merchant by reason of the multitude of all [kind of] riches; with silver, iron, tin, and lead, they traded in your i wares (something gotten at the fair)."
Ezekiel,27,13,"Yavan (Greece) [Ionia] , Tuval [you shall be brought] , and Meshekh [drawing out] , they [were] your i merchants: they traded the persons of men and vessels of brass in your i market."
Ezekiel,27,14,They of the house of Togarmah [you will break her] traded in your i wares (something gotten at the fair) with horses and horsemen and mules.
Ezekiel,27,15,The men of D’dan [low country] [were] your i merchants; many isles [were] the merchandise of you i hand: they brought you i [for] a present horns of ivory and ebony.
Ezekiel,27,16,"Aram (Syria) [exalted] [was] your i merchant by reason of the multitude of the wares of your i making: they occupied in your i wares (something gotten at the fair) with emeralds, purple, and adorned with needlework work, and fine linen, and coral, and agate."
Ezekiel,27,17,"Y’hudah [Let Him (God) Be Praised] , and the land of Yisra’el [He Holds Onto The Heel Of God] , they [were] your i merchants: they traded in your i market wheat of Minnit [distribution] , and cakes, and honey, and oil, and balm (a medicine; rosin from a bush)."
Ezekiel,27,18,"Dammesek (Damascus) [silent is the sackcloth weaver] [was] your i merchant in the multitude of the wares of your i making, for the multitude of all riches; in the wine of Helbon [fertile] , and white wool."
Ezekiel,27,19,"Dan [Judge] also and Yavan (Greece) [Ionia] going to and fro occupied in your i wares (something gotten at the fair) : bright iron, cassia, and calamus, were in your i market."
Ezekiel,27,20,D’dan [low country] [was] your i merchant in precious clothes for chariots.
Ezekiel,27,21,"Arabia [steppe-dwellers] , and all the princes of Kedar [dark] , they occupied with your i in lambs, and rams, and goats: in these [were they] your i merchants."
Ezekiel,27,22,"The merchants of Sheva [Seven] and Ra’mah [horse’s mane] , they [were] your i merchants: they occupied in your i wares (something gotten at the fair) with chief of all spices, and with all precious stones, and gold."
Ezekiel,27,23,"Haran [mountaineer] , and Kaneh [to give a flattering title] , and ‘Eden [pleasure] , the merchants of Sheva [Seven] , Ashur [A Level Plain], [and] Kilmad [enclosure], [were] your i merchants."
Ezekiel,27,24,"These [were] your i merchants in all sorts [of things] , in blue clothes, and adorned with needlework work, and in chests of rich apparel, bound with cords, and made of cedar, among your i merchandise."
Ezekiel,27,25,"The ships of Tarshish [yellow jasper] did sing of you i in your i market: and you i were replenished, and made very glorious in the midst of the seas."
Ezekiel,27,26,Your 1s rowers have brought you i into great waters: the east wind has broken you i in the midst of the seas.
Ezekiel,27,27,"Your 1s riches, and your i wares (something gotten at the fair) , your i merchandise, your i mariners, and your i pilots, your i caulkers, and the occupiers of your i merchandise, and all your i men of war, that [are] in you i , and in all your i company which [is] in the midst of you i , shall fall into the midst of the seas in the day of your i ruin."
Ezekiel,27,28,The suburbs shall shake at the sound of the cry of your i pilots.
Ezekiel,27,29,"And all that handle the oar, the mariners, [and] all the pilots of the sea, shall come down from their ships, they shall stand upon the land;"
Ezekiel,27,30,"And shall cause their voice to be heard against you i , and shall cry bitterly, and shall cast up dust upon their heads, they shall wallow (to approve, commend, accept) themselves in the ashes:"
Ezekiel,27,31,"And they shall make themselves utterly bald for you i , and gird them with sackcloth, and they shall weep for you i with bitterness of heart [and] bitter wailing."
Ezekiel,27,32,"And in their wailing they shall take up a lamentation for you i , and lament over you i, [saying] , What [city is] like Tzor (Tyrus) [a rock] , like the destroyed in the midst of the sea?"
Ezekiel,27,33,"When your i wares went forth out of the seas, you i filled many people; you i did enrich the kings of the earth with the multitude of your i riches and of your i merchandise."
Ezekiel,27,34,In the time [when] you i shall be broken by the seas in the depths of the waters your i merchandise and all your i company in the midst of you i shall fall.
Ezekiel,27,35,"All the inhabitants of the isles shall be astonished at you i , and their kings shall be sore afraid, they shall be troubled in [their] Countenance (Face, appearance; show favor)."
Ezekiel,27,36,"The merchants among the people shall hiss at you i ; you i shall be a terror, and never [shall be] any more."
Ezekiel,28,1,"The word of the Lord-Yehōvah (Messiah Pre-Incarnate) came again unto me, saying,"
Ezekiel,28,2,"Son of man, say unto the prince of Tzor (Tyrus) [a rock] , Thus says the Lord-Adonai [Greatest Above All Things] GOD-Yehōvih (THE FATHER) ; Because your i heart [is] lifted up, and you i have said, I [am] a God-Elōhīm (The Living Word) [The Many Powered] , I sit [in] the seat of God-Elōhīm (The Living Word) [The Many Powered] , in the midst of the seas; yet you i [are] a man, and not God-Elōhīm (The Living Word) [The Many Powered] , though you i set your i heart as the heart of God-Elōhīm (The Living Word) [The Many Powered]:"
Ezekiel,28,3,"Behold, you i [are] wiser than Dani’el [God is Judge] ; there is no secret that they can hide from you i:"
Ezekiel,28,4,"With your i wisdom and with your i understanding you i have gotten you i riches, and have gotten gold and silver into your i treasures:"
Ezekiel,28,5,"By your i great wisdom [and] by your i traffick (trade; do business) have you i increased your i riches, and your i heart is lifted up because of your i riches:"
Ezekiel,28,6,Therefore thus says the Lord-Adonai [Greatest Above All Things] GOD-Yehōvih (THE FATHER) ; Because you i have set your i heart as the heart of God-Elōhīm (The Living Word) [The Many Powered];
Ezekiel,28,7,"Behold, therefore I will bring strangers upon you i , the terrible of the nations: and they shall draw their swords against the beauty of your i wisdom, and they shall defile your i brightness."
Ezekiel,28,8,"They shall bring you i down to the pit, and you i shall die the deaths of [them that are] slain in the midst of the seas."
Ezekiel,28,9,"Will you i yet say before him that slays you i , I [am] God-Elōhīm (The Living Word) [The Many Powered] ? but you i [shall be] a man, and no God-Elōhīm (The Living Word) [The Many Powered] , in the hand of him that slays you i."
Ezekiel,28,10,"you i shall die the deaths of the uncircumcised by the hand of strangers: for I have spoken [it] , says the Lord-Adonai [Greatest Above All Things] GOD-Yehōvih (THE FATHER)."
Ezekiel,28,11,"Moreover the word of the Lord-Yehōvah (Messiah Pre-Incarnate) came unto me, saying,"
Ezekiel,28,12,"Son of man, take up a lamentation upon the king of Tzor (Tyrus) [a rock] , and say unto him, Thus says the Lord-Adonai [Greatest Above All Things] GOD-Yehōvih (THE FATHER) ; you i seal up the sum, full of wisdom, and perfect in beauty."
Ezekiel,28,13,"you i have been in ‘Eden [pleasure] the garden of God-Elōhīm (The Living Word) [The Many Powered] ; every precious stone [was] you i covering, the sardius, topaz, and the diamond, the beryl, the onyx, and the jasper, the sapphire, the emerald, and the Carbuncle (a red precious stone) , and gold: the workmanship of your i tambourines and of your i pipes was prepared in you i in the day that you i were created."
Ezekiel,28,14,you i [are] the anointed cherub [keruv] that covers; and I have set you i [so] : you i were upon the holy mountain of God-Elōhīm (The Living Word) [The Many Powered] ; you i have walked up and down in the midst of the stones of fire.
Ezekiel,28,15,"you i [were] perfect in your i ways from the day that you i were created, till iniquity was found in you i."
Ezekiel,28,16,"By the multitude of your i merchandise they have filled the midst of you i with violence, and you i have sinned: therefore I will cast you i as Profane (treat as common; defile) out of the mountain of God-Elōhīm (The Living Word) [The Many Powered] : and I will destroy you i , O covering cherub [keruv] , from the midst of the stones of fire."
Ezekiel,28,17,"Your 1s heart was lifted up because of your i beauty, you i have corrupted your i wisdom by reason of your i brightness: I will cast you i to the ground, I will lay you i before kings, that they may behold you i."
Ezekiel,28,18,"you i have defiled your i sanctuaries by the multitude of your i iniquities, by the iniquity of your i traffick (trade; do business) ; therefore will I bring forth a fire from the midst of you i , it shall devour you i , and I will bring you i to ashes upon the earth in the sight of all them that behold you i."
Ezekiel,28,19,"All they that know you i among the people shall be astonished at you i : you i shall be a terror, and never [shall] you i [be] any more."
Ezekiel,28,20,"Again the word of the Lord-Yehōvah (Messiah Pre-Incarnate) came unto me, saying,"
Ezekiel,28,21,"Son of man, set your i face against Tzidon [Hunting] , and prophesy against it,"
Ezekiel,28,22,"And say, Thus says the Lord-Adonai [Greatest Above All Things] GOD-Yehōvih (THE FATHER) ; Behold, I [am] against you i , O Tzidon [Hunting] ; and I will be glorified in the midst of you i : and they shall know that I [am] the Lord-Yehōvah (Messiah Pre-Incarnate) , when I shall have executed judgments in her, and shall be sanctified in her."
Ezekiel,28,23,"For I will send into her pestilence, and blood into her streets; and the wounded shall be judged in the midst of her by the sword upon her on every side; and they shall know that I [am] the Lord-Yehōvah (Messiah Pre-Incarnate)."
Ezekiel,28,24,"And there shall be no more a pricking brier unto the house of Yisra’el [He Holds Onto The Heel Of God] , nor [any] grieving thorn of all [that are] round about them, that despised them; and they shall know that I [am] the Lord-Adonai [Greatest Above All Things] GOD-Yehōvih (THE FATHER)."
Ezekiel,28,25,"Thus says the Lord-Adonai [Greatest Above All Things] GOD-Yehōvih (THE FATHER) ; When I shall have gathered the house of Yisra’el [He Holds Onto The Heel Of God] from the people among whom they are scattered, and shall be sanctified in them in the sight of the heathen, then shall they dwell in their land that I have given to my servant Ya’akov [Heal of God]."
Ezekiel,28,26,"And they shall dwell safely in it, and shall build houses, and plant vineyards; yes, they shall dwell with confidence, when I have executed judgments upon all those that despise them round about them; and they shall know that I [am] the Lord-Yehōvah (Messiah Pre-Incarnate) their God-Elōhīm (The Living Word) [The Many Powered]."
Ezekiel,29,1,"In the tenth year, in the tenth [month] , in the twelfth [day] of the month, the word of the Lord-Yehōvah (Messiah Pre-Incarnate) came unto me, saying,"
Ezekiel,29,2,"Son of man, set your i face against Par’oh [Pharaoh - Great House] king of Mitzrayim [Egypt - The Narrow Place] , and prophesy against him, and against all Mitzrayim [Egypt - The Narrow Place]:"
Ezekiel,29,3,"Speak, and say, Thus says the Lord-Adonai [Greatest Above All Things] GOD-Yehōvih (THE FATHER) ; Behold, I [am] against you i , Par’oh [Pharaoh - Great House] king of Mitzrayim [Egypt - The Narrow Place] , the great dragon that lies in the midst of his rivers, which has said, My river [is] my own, and I have made [it] for myself."
Ezekiel,29,4,"But I will put hooks in your i jaws, and I will cause the fish of your i rivers to stick unto your i scales, and I will bring you i up out of the midst of your i rivers, and all the fish of your i rivers shall stick unto your i scales."
Ezekiel,29,5,"And I will leave you i [thrown] into the wilderness, you i and all the fish of your i rivers: you i shall fall upon the open fields; you i shall not be brought together, nor gathered: I have given you i for meat to the beasts of the field and to the fowls of the heaven."
Ezekiel,29,6,"And all the inhabitants of Mitzrayim [Egypt - The Narrow Place] shall know that I [am] the Lord-Yehōvah (Messiah Pre-Incarnate) , because they have been a staff of reed to the house of Yisra’el [He Holds Onto The Heel Of God]."
Ezekiel,29,7,"When they took hold of you i by your i hand, you i did break, and rend (tear apart; forcefully rip apart) all their shoulder: and when they leaned upon you i , you i broke, and made all their waist to be at a stand."
Ezekiel,29,8,"Therefore thus says the Lord-Adonai [Greatest Above All Things] GOD-Yehōvih (THE FATHER) ; Behold, I will bring a sword upon you i , and cut off man and beast out of you i."
Ezekiel,29,9,"And the land of Mitzrayim [Egypt - The Narrow Place] shall be desolate and waste; and they shall know that I [am] the Lord-Yehōvah (Messiah Pre-Incarnate) : because he has said, The river [is] my, and I have made [it]."
Ezekiel,29,10,"Behold, therefore I [am] against you i , and against your i rivers, and I will make the land of Mitzrayim [Egypt - The Narrow Place] utterly waste [and] desolate, from the tower of S’venah [meaning disputed] even unto the border of Ethiopia [Kush]."
Ezekiel,29,11,"No foot of man shall pass through it, nor foot of beast shall pass through it, neither shall it be inhabited forty years."
Ezekiel,29,12,"And I will make the land of Mitzrayim [Egypt - The Narrow Place] desolate in the midst of the countries [that are] desolate, and her cities among the cities [that are] laid waste shall be desolate forty years: and I will scatter the Mitzri among the nations, and will disperse them through the countries."
Ezekiel,29,13,Yet thus says the Lord-Adonai [Greatest Above All Things] GOD-Yehōvih (THE FATHER) ; At the end of forty years will I gather the Mitzri from the people to which they were scattered:
Ezekiel,29,14,"And I will bring again the captivity of Mitzrayim [Egypt - The Narrow Place] , and will cause them to return [into] the land of Patros [region of the south] , into the land of their habitation; and they shall be there a humble kingdom."
Ezekiel,29,15,"It shall be the basest of the kingdoms; neither shall it exalt itself any more above the nations: for I will diminish them, that they shall no more rule over the nations."
Ezekiel,29,16,"And it shall be no more the confidence of the house of Yisra’el [He Holds Onto The Heel Of God] , which brings [their] iniquity to remembrance, when they shall look after them: but they shall know that I [am] the Lord-Adonai [Greatest Above All Things] GOD-Yehōvih (THE FATHER)."
Ezekiel,29,17,"And it came to pass in the seven and twentieth year, in the first [month] , in the first [day] of the month, the word of the Lord-Yehōvah (Messiah Pre-Incarnate) came unto me, saying,"
Ezekiel,29,18,"Son of man, N’vukhadretzar [may Nebo protect the crown] king of Bavel (to jumble, or a confused medley of sounds; confusion; gate of the deity) (Babylon) [confusion] caused his army to serve a great service against Tzor (Tyrus) [a rock] : every head [was] made bald, and every shoulder [was] smooth (bare; bald) : yet had he no wages, nor his army, for Tzor (Tyrus) [a rock] , for the service that he had served against it:"
