Ezekiel,13,8,"Therefore thus says the Lord-Adonai [Greatest Above All Things] GOD-Yehōvih (THE FATHER) ; Because you 2f have spoken vanity, and seen lies, therefore, behold, I [am] against you, says the Lord-Adonai [Greatest Above All Things] GOD-Yehōvih (THE FATHER)."
Ezekiel,13,9,"And my hand shall be upon the prophets that see vanity, and that divine lies: they shall not be in the assembly of my people, neither shall they be written in the writing of the house of Yisra’el [He Holds Onto The Heel Of God] , neither shall they enter into the land of Yisra’el [He Holds Onto The Heel Of God] ; and you 2f shall know that I [am] the Lord-Adonai [Greatest Above All Things] GOD-Yehōvih (THE FATHER)."
Ezekiel,13,10,"Because, even because they have seduced my people, saying, Peace; and [there was] no peace; and one built up a wall, and, lo, others daubed it with untempered [mortar]:"
Ezekiel,13,11,"Say unto them which daub (to cover or plaster) [it] with untempered [mortar] , that it shall fall: there shall be an overflowing shower; and you 2f , O great hailstones, shall fall; and a stormy wind shall rend (tear apart; forcefully rip apart) [it]."
Ezekiel,13,12,"Lo, when the wall is fallen, shall it not be said unto you, Where [is] the daubing which you 2f have daubed [it]?"
Ezekiel,13,13,"Therefore thus says the Lord-Adonai [Greatest Above All Things] GOD-Yehōvih (THE FATHER) ; I will even rend (tear apart; forcefully rip apart) [it] with a stormy wind in my fury; and there shall be an overflowing shower in my anger, and great hailstones in [my] fury to consume [it]."
Ezekiel,13,14,"So will I break down the wall that you 2f have daubed with untempered [mortar] , and bring it down to the ground, so that the foundation thereof shall be discovered, and it shall fall, and you 2f shall be consumed in the midst thereof: and you 2f shall know that I [am] the Lord-Yehōvah (Messiah Pre-Incarnate)."
Ezekiel,13,15,"Thus will I accomplish my wrath upon the wall, and upon them that have daubed it with untempered [mortar] , and will say unto you, The wall [is] no [more] , neither they that daubed it;"
Ezekiel,13,16," [To wit] , the prophets of Yisra’el [He Holds Onto The Heel Of God] which prophesy concerning Yerushalayim [Foundation of Peace] , and which see visions of peace for her, and [there is] no peace, says the Lord-Adonai [Greatest Above All Things] GOD-Yehōvih (THE FATHER)."
Ezekiel,13,17,"Likewise, you i Son of man, set your i face against the daughters of your i people, which prophesy out of their own heart; and prophesy you i against them,"
Ezekiel,13,18,"And say, Thus says the Lord-Adonai [Greatest Above All Things] GOD-Yehōvih (THE FATHER) ; Woe to the [women] that sew pillows to all armholes, and make kerchiefs upon the head of every stature to hunt souls! Will you 2f hunt the souls of my people, and will you 2f save the souls alive [that come] unto you?"
Ezekiel,13,19,"And will you 2f pollute me among my people for handfuls of barley and for pieces of bread, to slay the souls that should not die, and to save the souls alive that should not live, by your lying to my people that hear [your] lies?"
Ezekiel,13,20,"For what reason thus says the Lord-Adonai [Greatest Above All Things] GOD-Yehōvih (THE FATHER) ; Behold, I [am] against your pillows, which you 2f there hunt the souls to make [them] fly, and I will tear them from your arms, and will let the souls go, [even] the souls that you 2f hunt to make [them] fly."
Ezekiel,13,21,"Your kerchiefs also will I tear, and deliver my people out of your hand, and they shall be no more in your hand to be hunted; and you 2f shall know that I [am] the Lord-Yehōvah (Messiah Pre-Incarnate)."
Ezekiel,13,22,"Because with lies you 2f have made the heart of the righteous sad, whom I have not made sad; and strengthened the hands of the wicked, that he should not return from his wicked way, by promising him life:"
Ezekiel,13,23,"Therefore you 2f shall see no more vanity, nor divine divinations: for I will deliver my people out of your hand: and you 2f shall know that I [am] the Lord-Yehōvah (Messiah Pre-Incarnate)."
Ezekiel,14,1,"Then came certain of the elders of Yisra’el [He Holds Onto The Heel Of God] unto me, and sat before me."
Ezekiel,14,2,"And the word of the Lord-Yehōvah (Messiah Pre-Incarnate) came unto me, saying,"
Ezekiel,14,3,"Son of man, these men have set up their idols in their heart, and put the stumbling block of their iniquity before their face: should I be enquired of at all by them?"
Ezekiel,14,4,"Therefore speak unto them, and say unto them, Thus says the Lord-Adonai [Greatest Above All Things] GOD-Yehōvih (THE FATHER) ; Every man of the house of Yisra’el [He Holds Onto The Heel Of God] that sets up his idols in his heart, and puts the stumblingblock of his iniquity before his face, and comes to the prophet; I the Lord-Yehōvah (Messiah Pre-Incarnate) will answer him that comes according to the multitude of his idols;"
Ezekiel,14,5,"That I may take the house of Yisra’el [He Holds Onto The Heel Of God] in their own heart, because they are all estranged from me through their idols."
Ezekiel,14,6,"Therefore say unto the house of Yisra’el [He Holds Onto The Heel Of God] , Thus says the Lord-Adonai [Greatest Above All Things] GOD-Yehōvih (THE FATHER) ; Repent, and turn [yourselves] from your idols; and turn away your faces from all your abominations."
Ezekiel,14,7,"For every one of the house of Yisra’el [He Holds Onto The Heel Of God] , or of the stranger that sojourns in Yisra’el [He Holds Onto The Heel Of God] , which separates himself from me, and sets up his idols in his heart, and puts the stumblingblock of his iniquity before his face, and comes to a prophet to enquire of him concerning me; I the Lord-Yehōvah (Messiah Pre-Incarnate) will answer him by myself:"
Ezekiel,14,8,"And I will set my face against that man, and will make him a sign and a proverb, and I will cut him off from the midst of my people; and you 2f shall know that I [am] the Lord-Yehōvah (Messiah Pre-Incarnate)."
Ezekiel,14,9,"And if the prophet be deceived when he has spoken a thing, I the Lord-Yehōvah (Messiah Pre-Incarnate) have deceived that prophet, and I will stretch out my hand upon him, and will destroy him from the midst of my people Yisra’el [He Holds Onto The Heel Of God]."
Ezekiel,14,10,And they shall bear the punishment of their iniquity: the punishment of the prophet shall be even as the punishment of him that seeks [unto him];
Ezekiel,14,11,"That the house of Yisra’el [He Holds Onto The Heel Of God] may go no more astray from me, neither be polluted any more with all their transgressions; but that they may be my people, and I may be their God-Elōhīm (The Living Word) [The Many Powered] , says the Lord-Adonai [Greatest Above All Things] GOD-Yehōvih (THE FATHER)."
Ezekiel,14,12,"The word of the Lord-Yehōvah (Messiah Pre-Incarnate) came again to me, saying,"
Ezekiel,14,13,"Son of man, when the land sins against me by trespassing grievously, then will I stretch out my hand upon it, and will break the staff of the bread thereof, and will send famine upon it, and will cut off man and beast from it:"
Ezekiel,14,14,"Though these three men, Noach [rest] , Dani’el [God is Judge] , and Job, were in it, they should deliver [but] their own souls by their righteousness, says the Lord-Adonai [Greatest Above All Things] GOD-Yehōvih (THE FATHER)."
Ezekiel,14,15,"If I cause destructive (hurtful; noxious) beasts to pass through the land, and they spoil (plunder; prey; booty) it, so that it be desolate, that no man may pass through because of the beasts:"
Ezekiel,14,16," [Though] these three men [were] in it, [as] I live, says the Lord-Adonai [Greatest Above All Things] GOD-Yehōvih (THE FATHER) , they shall deliver neither sons nor daughters; they only shall be delivered, but the land shall be desolate."
Ezekiel,14,17,"Or [if] I bring a sword upon that land, and say, Sword, go through the land; so that I cut off man and beast from it:"
Ezekiel,14,18,"Though these three men [were] in it, [as] I live, says the Lord-Adonai [Greatest Above All Things] GOD-Yehōvih (THE FATHER) , they shall deliver neither sons nor daughters, but they only shall be delivered themselves."
Ezekiel,14,19,"Or [if] I send a pestilence into that land, and pour out my fury upon it in blood, to cut off from it man and beast:"
Ezekiel,14,20,"Though No’ah [Motion] , Dani’el [God is Judge] , and Job, [were] in it, [as] I live, says the Lord-Adonai [Greatest Above All Things] GOD-Yehōvih (THE FATHER) , they shall deliver neither son nor daughter; they shall [but] deliver their own souls by their righteousness."
Ezekiel,14,21,"For thus says the Lord-Adonai [Greatest Above All Things] GOD-Yehōvih (THE FATHER) ; How much more when I send my four sore judgments upon Yerushalayim [Foundation of Peace] , the sword, and the famine, and the destructive (hurtful; noxious) beast, and the pestilence, to cut off from it man and beast?"
Ezekiel,14,22,"Yet, behold, in it shall be left a remnant that shall be brought forth, [both] sons and daughters: behold, they shall come forth unto you, and you 2f shall see their way and their doings: and you 2f shall be comforted concerning the evil that I have brought upon Yerushalayim [Foundation of Peace], [even] concerning all that I have brought upon it."
Ezekiel,14,23,"And they shall comfort you, when you 2f see their ways and their doings: and you 2f shall know that I have not done without cause all that I have done in it, says the Lord-Adonai [Greatest Above All Things] GOD-Yehōvih (THE FATHER)."
Ezekiel,15,1,"And the word of the Lord-Yehōvah (Messiah Pre-Incarnate) came unto me, saying,"
Ezekiel,15,2,"Son of man, What is the vine tree more than any tree, [or than] a branch which is among the trees of the forest?"
Ezekiel,15,3,Shall wood be taken thereof to do any work? or will [men] take a pin of it to hang any vessel thereon?
Ezekiel,15,4,"Behold, it is cast into the fire for fuel; the fire devours both the ends of it, and the midst of it is burned. Is it meet for [any] work?"
Ezekiel,15,5,"Behold, when it was whole, it was meet for no work: how much less shall it be meet yet for [any] work, when the fire has devoured it, and it is burned?"
Ezekiel,15,6,"Therefore thus says the Lord-Adonai [Greatest Above All Things] GOD-Yehōvih (THE FATHER) ; As the vine tree among the trees of the forest, which I have given to the fire for fuel, so will I give the inhabitants of Yerushalayim [Foundation of Peace]."
Ezekiel,15,7,"And I will set my face against them; they shall go out from [one] fire, and [another] fire shall devour them; and you 2f shall know that I [am] the Lord-Yehōvah (Messiah Pre-Incarnate) , when I set my face against them."
Ezekiel,15,8,"And I will make the land desolate, because they have committed a trespass, says the Lord-Adonai [Greatest Above All Things] GOD-Yehōvih (THE FATHER)."
Ezekiel,16,1,"Again the word of the Lord-Yehōvah (Messiah Pre-Incarnate) came unto me, saying,"
Ezekiel,16,2,"Son of man, cause Yerushalayim [Foundation of Peace] to know her abominations,"
Ezekiel,16,3,"And say, Thus says the Lord-Adonai [Greatest Above All Things] GOD-Yehōvih (THE FATHER) unto Yerushalayim [Foundation of Peace] ; You 1s birth and you i nativity [is] of the land of Kena’an [Merchant] ; you i father [was] an Emori [Rebellious Highlanders] , and you i mother an Hitti [Terrorists]."
Ezekiel,16,4,"And [as for] your i nativity, in the day you i were born your i navel was not cut, neither were you i washed in water to supple [you i ] ; you i were not salted at all, nor swaddled at all."
Ezekiel,16,5,"None eye pitied you i , to do any of these unto you i , to have compassion upon you i ; but you i were cast out in the open field, to the loathing of you i person, in the day that you i were born."
Ezekiel,16,6,"And when I passed by you i , and saw you i polluted in your i own blood, I said unto you i [when you i were] in your i blood, Live; yes, I said unto you i [when you i were] in your i blood, Live."
Ezekiel,16,7,"I have caused you i to multiply as the bud of the field, and you i have increased and waxen great, and you i are come to excellent ornaments: [your i ] breasts are fashioned, and your i hair is grown, whereas you i [were] naked and bare."
Ezekiel,16,8,"Now when I passed by you i , and looked upon you i , behold, your i time [was] the time of love; and I spread my skirt over you i , and covered your i nakedness: yes, I swore unto you i , and entered into a covenant with you i , says the Lord-Adonai [Greatest Above All Things] GOD-Yehōvih (THE FATHER) , and you i became mine."
Ezekiel,16,9,"Then washed I you i with water; yes, I thoroughly washed away your i blood from you i , and I anointed you i with oil."
Ezekiel,16,10,"I clothed you i also with adorned with needlework work, and shod you i with badgers’ skin, and I girded you i about with fine linen, and I covered you i with silk."
Ezekiel,16,11,"I decked you i also with ornaments, and I put bracelets upon your i hands, and a chain on your i neck."
Ezekiel,16,12,"And I put a jewel on your i forehead, and earrings in your i ears, and a beautiful crown upon your i head."
Ezekiel,16,13,"Thus were you i decked with gold and silver; and your i clothing [was of] fine linen, and silk, and adorned with needlework work; you i did eat fine flour, and honey, and oil: and you i were exceeding beautiful, and you i did prosper into a kingdom."
Ezekiel,16,14,"And your i renown (great reputation; being well-known) went forth among the heathen for your i beauty: for it [was] perfect through my comeliness, which I had put upon you i , says the Lord-Adonai [Greatest Above All Things] GOD-Yehōvih (THE FATHER)."
Ezekiel,16,15,"But you i did trust in your i own beauty, and played the prostitute because of your i renown (great reputation; being well-known), and poured out your i fornications on everyone that passed by; his it was."
Ezekiel,16,16,"And of your i garments you i did take, and decked you i high places with diverse colours, and played the prostitute thereupon: [the like things] shall not come, neither shall it be [so]."
Ezekiel,16,17,"You i have also taken your i fair jewels of my gold and of my silver, which I had given you i , and made to yourself images of men, and did commit whoredom with them,"
Ezekiel,16,18,"And took your i embroidered garments, and covered them: and you i have set my oil and my incense before them."
Ezekiel,16,19,"My meat also which I gave you i , fine flour, and oil, and honey, [which] I fed you i , you i have even set it before them for a soothing aroma: and [thus] it was, says the Lord-Adonai [Greatest Above All Things] GOD-Yehōvih (THE FATHER)."
Ezekiel,16,20,"Moreover you i have taken your i sons and your i daughters, whom you i have borne unto me, and these have you i sacrificed unto them to be devoured. [Is this] of your i cult prostitution a small matter,"
Ezekiel,16,21,"That you i have slain my children, and delivered them to cause them to pass through [the fire] for them?"
Ezekiel,16,22,"And in all your i abominations and your i cult prostitution you i have not remembered the days of your i youth, when you i were naked and bare, [and] were polluted in your i blood."
Ezekiel,16,23,"And it came to pass after all your i wickedness, (woe, woe unto you i ! says the Lord-Adonai [Greatest Above All Things] GOD-Yehōvih (THE FATHER) ;)"
Ezekiel,16,24," [That] you i have also built unto you i an eminent place, and have made you i an high place in every street."
Ezekiel,16,25,"You i have built your i high place at every head of the way, and have made your i beauty to be abhorred, and have opened your i legs to everyone that passed by, and multiplied your i cult prostitution."
Ezekiel,16,26,"You i have also committed fornication with the Mitzri your i neighbours, great of flesh; and have increased your i cult prostitution, to provoke me to anger."
Ezekiel,16,27,"Behold, therefore I have stretched out my hand over you i , and have diminished your i ordinary [food] , and delivered you i unto the will of them that hate you i , the daughters of the P’lishtim [Immigrants] , which are ashamed of your i lewd way."
Ezekiel,16,28,"You i have played the whore also with the children of Ashur, because you i were insatiable; yes, you i have played the prostitute with them, and yet could not be satisfied."
Ezekiel,16,29,You i have moreover multiplied your i fornication in the land of Kena’an [Merchant] unto Kasdim [clod-breakers] ; and yet you i were not satisfied with this!
Ezekiel,16,30,"How weak is your i heart, says the Lord-Adonai [Greatest Above All Things] GOD-Yehōvih (THE FATHER) , seeing you i do all these [things] , the work of an shameless whorish woman;"
Ezekiel,16,31,"In that you i build your i eminent place in the head of every way, and makes your i high place in every street; and have not been as an prostitute, in that you i scorn getting paid;"
Ezekiel,16,32," [But as] a wife that commits adultery, [which] takes strangers instead of her husband!"
Ezekiel,16,33,"They give gifts to all whores: but you i give your i gifts to all your i lovers, and hire them, that they may come unto you i on every side for your i whoredom."
Ezekiel,16,34,"And the contrary is in you i from [other] women in your i cult prostitution, whereas none follows you i to commit cult prostitution: and in that you i give a reward, and no reward is given unto you i , therefore you i are contrary."
Ezekiel,16,35,"For this reason, O prostitute, hear the word of the Lord-Yehōvah (Messiah Pre-Incarnate):"
Ezekiel,16,36,"Thus says the Lord-Adonai [Greatest Above All Things] GOD-Yehōvih (THE FATHER) ; Because you i filthiness was poured out, and your i nakedness discovered through your i cult prostitution with your i lovers, and with all the idols of your i abominations, and by the blood of your i children, which you i did give unto them;"
Ezekiel,16,37,"Behold, therefore I will gather all your i lovers, with whom you i have taken pleasure, and all [them] that you i have loved, with all [them] that you i have hated; I will even gather them roundabout against you i , and will expose your i nakedness unto them, that they may see all your i nakedness."
Ezekiel,16,38,"And I will judge you i , as women that breaks wedlock and sheds blood are judged; and I will give you i blood in fury and jealousy."
Ezekiel,16,39,"And I will also give you i into their hand, and they shall throw down your i eminent place, and shall break down your i high places: they shall strip you i also of your i clothes, and shall take your i fair jewels, and leave your i naked and bare."
Ezekiel,16,40,"They shall also bring up a company against you i , and they shall stone you i with stones, and thrust you i through with their swords."
Ezekiel,16,41,"And they shall burn your i houses with fire, and execute judgments upon you i in the sight of many women: and I will cause you i to cease from playing the prostitute, and you i also shall give no pay (to your lovers) any more."
Ezekiel,16,42,"So will I make my fury toward you i to rest, and my jealousy shall depart from you i , and I will be quiet, and will be no more angry."
Ezekiel,16,43,"Because you i have not remembered the days of your i youth, but have fretted me in all these [things] ; behold, therefore I also will recompense your i way upon [you i ] head, says the Lord-Adonai [Greatest Above All Things] GOD-Yehōvih (THE FATHER) : and you i shall not commit this lewdness above all your i abominations."
Ezekiel,16,44,"Behold, everyone that uses proverbs shall use [this] proverb against you i , saying, As [is] the mother, [so is] her daughter."
Ezekiel,16,45,"You i [are] your i mother’s daughter, that loathes her husband and her children; and you i [are] the sister of your i sisters, which loathed their husbands and their children: your mother [was] an Hitti [Terrorists] , and your father an Emori [Rebellious Highlanders]."
Ezekiel,16,46,"And your i elder sister [is] Shomron [watch mountain] , she and her daughters that dwell at your i left hand: and your i younger sister, that dwells at your i right hand, [is] S’dom [Burning] and her daughters."
Ezekiel,16,47,"Yet have you i not walked after their ways, nor done after their abominations: but, as [if that were] a very little [thing] , you i were corrupted more than they in all your i ways!"
Ezekiel,16,48," [As] I live, says the Lord-Adonai [Greatest Above All Things] GOD-Yehōvih (THE FATHER) , S’dom [Burning] your i sister has not done, she nor her daughters, as you i have done, you i and your i daughters."
Ezekiel,16,49,"Behold, this was the iniquity of your i sister S’dom [Burning] , pride, fullness of bread, and abundance of idleness was in her and in her daughters, neither did she strengthen the hand of the poor and needy."
Ezekiel,16,50,"And they were arrogant (proud; lifted up) , and committed abomination before me: therefore I took them away as I saw [good]."
Ezekiel,16,51,"Neither has Shomron [watch mountain] committed half of your i sins; but you i have multiplied your i abominations more than they, and have justified your i sisters in all your i abominations which you i have done."
Ezekiel,16,52,"You i also, which have judged your i sisters, bear your i own shame for your i sins that you i have committed more abominable than they: they are more righteous than you i : yes, be you i confounded also, and bear your i shame, in that you i have justified your i sisters."
Ezekiel,16,53,"When I shall bring again their captivity, the captivity of S’dom [Burning] and her daughters, and the captivity of Shomron [watch mountain] and her daughters, then [will I bring again] the captivity of your i captives in the midst of them:"
Ezekiel,16,54,"That you i may bear your i own shame, and may be confounded in all that you i have done, in that you i are a comfort unto them."
Ezekiel,16,55,"When your i sisters, S’dom [Burning] and her daughters, shall return to their former estate, and Shomron [watch mountain] and her daughters shall return to their former estate, then you i and your i daughters shall return to your former estate."
Ezekiel,16,56,"For your i sister S’dom [Burning] was not mentioned by your i mouth in the day of your i pride,"
Ezekiel,16,57,"Before your i wickedness was discovered, as at the time of [your i ] reproach (disgrace; shame) of the daughters of Aram (Syria) [exalted] , and all [that are] round about her, the daughters of the P’lishtim [Immigrants] , which despise you i round about."
Ezekiel,16,58,"You i have borne your i lewdness and your i abominations, says the Lord-Yehōvah (Messiah Pre-Incarnate)."
Ezekiel,16,59,"For thus says the Lord-Adonai [Greatest Above All Things] GOD-Yehōvih (THE FATHER) ; I will even deal with you i as you i have done, which have despised the oath in breaking the Covenant."
Ezekiel,16,60,"Nevertheless I will remember my covenant with you i in the days of your i youth, and I will establish unto you i an everlasting covenant."
Ezekiel,16,61,"Then you i shall remember your i ways, and be ashamed, when you i shall receive your i sisters, your i elder and your i younger: and I will give them unto you i for daughters, but not by your i covenant."
Ezekiel,16,62,And I will establish my covenant with you i ; and you i shall know that I [am] the Lord-Yehōvah (Messiah Pre-Incarnate):
Ezekiel,16,63,"That you i may remember, and be confounded, and never open your i mouth anymore because of your i shame, when I am pacified toward you i for all that you i have done, says the Lord-Adonai [Greatest Above All Things] GOD-Yehōvih (THE FATHER)."
Ezekiel,17,1,"And the word of the Lord-Yehōvah (Messiah Pre-Incarnate) came unto me, saying,"
Ezekiel,17,2,"Son of man, put forth a riddle, and speak a parable unto the house of Yisra’el [He Holds Onto The Heel Of God];"
Ezekiel,17,3,"And say, Thus says the Lord-Adonai [Greatest Above All Things] GOD-Yehōvih (THE FATHER) ; A great eagle with great wings, longwinged, full of feathers, which had diverse colours, came unto L’vanon [Whiteness] , and took the highest branch of the cedar:"
Ezekiel,17,4,"He cropped off the top of his young twigs, and carried it into a land of traffick (trade; do business) ; he set it in a city of merchants."
Ezekiel,17,5,"He took also of the seed of the land, and planted it in a fruitful field; he placed [it] by great waters, [and] set it [as] a willow tree."
Ezekiel,17,6,"And it grew, and became a spreading vine of low stature, whose branches turned toward him, and the roots thereof were under him: so it became a vine, and brought forth branches, and shot forth sprigs."
Ezekiel,17,7,"There was also another great eagle with great wings and many feathers: and, behold, this vine did bend her roots toward him, and shot forth her branches toward him, that he might water it by the furrows of her plantation."
Ezekiel,17,8,"It was planted in a good soil by great waters, that it might bring forth branches, and that it might bear fruit, that it might be a goodly vine."
Ezekiel,17,9,"Say you i , Thus says the Lord-Adonai [Greatest Above All Things] GOD-Yehōvih (THE FATHER) ; Shall it prosper? shall he not pull up the roots thereof, and cut off the fruit thereof, that it wither? it shall wither in all the leaves of her spring, even without great power or many people to pluck it up by the roots thereof."
Ezekiel,17,10,"Yes, behold, [being] planted, shall it prosper? shall it not utterly wither, when the east wind touches it? it shall wither in the furrows where it grew."
Ezekiel,17,11,"Moreover the word of the Lord-Yehōvah (Messiah Pre-Incarnate) came unto me, saying,"
