Isaiah,34,3,"Their slain also shall be cast out, and their stink shall come up out of their carcasses, and the mountains shall be melted with their blood."
Isaiah,34,4,"And all the army of heaven shall be dissolved, and the heavens shall be rolled together as a scroll: and all their host shall fall down, as the leaf falls off from the vine, and as a falling [fig] from the fig tree."
Isaiah,34,5,"For my sword shall be bathed in heaven: behold, it shall come down upon Edom [red] , and upon the people of my curse, to judgment."
Isaiah,34,6,"The sword of the Lord-Yehōvah (Messiah Pre-Incarnate) is filled with blood, it is made fat with fatness, [and] with the blood of lambs and goats, with the fat of the kidneys of rams: for the Lord-Yehōvah (Messiah Pre-Incarnate) has a sacrifice in Botzrah [sheepfold or fortress] , and a great slaughter in the land of Edom [red]."
Isaiah,34,7,"And the unicorns shall come down with them, and the bullocks with the bulls; and their land shall be soaked with blood, and their dust made fat with fatness."
Isaiah,34,8,"For [it is] the day of the Lord-Yehōvah’s [Messiah Pre-Incarnate] vengeance, [and] the year of recompenses for the controversy of Tziyon [parched place]."
Isaiah,34,9,"And the streams thereof shall be turned into pitch, and the dust thereof into sulfur, and the land thereof shall become burning pitch."
Isaiah,34,10,It shall not be quenched night nor day; the smoke thereof shall go up forever: from generation to generation it shall lie waste; none shall pass through it forever and ever.
Isaiah,34,11,"But the cormorant and the hedgehogs shall possess it; the owl also and the raven shall dwell in it: and he shall stretch out upon it the line of confusion, and the stones of emptiness."
Isaiah,34,12,"They shall call the nobles thereof to the kingdom, but none [shall be] there, and all her princes shall be nothing."
Isaiah,34,13,"And thorns shall come up in her palaces, nettles and brambles in the fortresses thereof: and it shall be an habitation of dragons, [and] a court for owls."
Isaiah,34,14,"The wild beasts of the desert shall also meet with the wild beasts of the island, and the he-goat shall cry to his fellow; the screech owl also shall rest there, and find for herself a place of rest."
Isaiah,34,15,"There shall the great owl make her nest, and lay, and hatch, and gather under her shadow: there shall the vultures also be gathered, everyone with her mate."
Isaiah,34,16,"Seek you 2f out of the Book of the Lord-Yehōvah (Messiah Pre-Incarnate) , and read: no one of these shall fail, none shall lack her mate: for my mouth it has commanded, and his spirit it has gathered them."
Isaiah,34,17,"And he has cast the lot for them, and his hand has divided it unto them by line: they shall possess it forever, from generation to generation shall they dwell in it."
Isaiah,35,1,"The wilderness and the solitary place shall be glad for them; and the desert shall rejoice, and blossom as the rose."
Isaiah,35,2,"It shall blossom abundantly, and rejoice even with joy and singing: the glory of L’vanon [Whiteness] shall be given unto it, the excellency of Carmel [Garden-land] and Sharon [a plain] , they shall see the glory of the Lord-Yehōvah (Messiah Pre-Incarnate), [and] the excellency of our God-Elōhīm (The Living Word) [The Many Powered]."
Isaiah,35,3,"Strengthen you 2f the weak hands, and confirm the feeble knees."
Isaiah,35,4,"Say to them [that are] of a fearful heart, Be strong, fear not: behold, your God-Elōhīm (The Living Word) [The Many Powered] will come [with] vengeance, [even] God-Elōhīm (The Living Word) [The Many Powered] [with] a recompense; he will come and save you."
Isaiah,35,5,"Then the eyes of the blind shall be opened, and the ears of the deaf shall be unstopped."
Isaiah,35,6,"Then shall the lame [man] leap as an deer, and the tongue of the dumb sing: for in the wilderness shall waters break out, and streams in the desert."
Isaiah,35,7,"And the parched ground shall become a pool, and the thirsty land springs of water: in the habitation of dragons, where each lay, [shall be] grass with reeds and rushes."
Isaiah,35,8,"And an highway shall be there, and a way, and it shall be called The way of holiness; the unclean shall not pass over it; but it [shall be] for those: the wayfaring men, though fools, shall not err [in it]."
Isaiah,35,9,"No lion shall be there, nor [any] ravenous beast shall go up thereon, it shall not be found there; but the redeemed shall walk [there]:"
Isaiah,35,10,"And the ransomed of the Lord-Yehōvah (Messiah Pre-Incarnate) shall return, and come to Tziyon [parched place] with songs and everlasting joy upon their heads: they shall obtain joy and gladness, and sorrow and sighing shall flee away."
Isaiah,36,1,"Now it came to pass in the fourteenth year of king Hizkiyahu [Yehovah is my strength], [that] Sancheriv [Sin (the moon) multiplied brothers] king of Ashur [the level plain] (the land of the sons of Shem (name, renown (great reputation; being well-known))) came up against all the fortified cities of Y’hudah [Let Him (God) Be Praised] , and took them."
Isaiah,36,2,"And the king of Ashur [the level plain] (the land of the sons of Shem (name, renown (great reputation; being well-known))) sent Rav-Shakeh [chief cupbearer] from Lakhish [Invincible] to Yerushalayim [Foundation of Peace] unto king Hizkiyahu [Yehovah is my strength] with a great army. And he stood by the conduit of the upper pool in the highway of the Launderers’ Field."
Isaiah,36,3,"Then came forth unto him Elyakim [God sets up] , Hilkiyahu [my portion is Yehovah] ’s son, which was over the house, and Shevnah [vigour] the scribe, and Yo’ach [Yahovah is brother] , Asaf [gatherer] ’s son, the recorder."
Isaiah,36,4,"And Rav-Shakeh [chief cupbearer] said unto them, Say you 2f now to Hizkiyahu [Yehovah is my strength] , Thus says the great king, the king of Ashur [the level plain] (the land of the sons of Shem (name, renown (great reputation; being well-known))) , What confidence [is] this wherein you i trust?"
Isaiah,36,5,"I say, [say you i ] , (but [they are but] vain words) [I have] counsel and strength for war: now on whom do you i trust, that you i rebel against me?"
Isaiah,36,6,"Lo, you i trust in the staff of this broken reed, on Mitzrayim [Egypt - The Narrow Place] ; whereon if a man lean, it will go into his hand, and pierce it: so [is] Par’oh [Pharaoh - Great House] king of Mitzrayim [Egypt - The Narrow Place] to all that trust in him."
Isaiah,36,7,"But if you i say to me, We trust in the Lord-Yehōvah (Messiah Pre-Incarnate) our God-Elōhīm (The Living Word) [The Many Powered]: [is it] not he, whose high places and whose altars Hizkiyahu [Yehovah is my strength] has taken away, and said to Y’hudah [Let Him (God) Be Praised] and to Yerushalayim [Foundation of Peace] , You 2f shall worship before this altar?"
Isaiah,36,8,"Now therefore give pledges, I pray you i , to my master the king of Ashur [the level plain] (the land of the sons of Shem (name, renown (great reputation; being well-known))) , and I will give you i two thousand horses, if you i be able on your i part to set riders upon them."
Isaiah,36,9,"How then will you i turn away the face of one captain of the least of my master’s servants, and put your i trust on Mitzrayim [Egypt - The Narrow Place] for chariots and for horsemen?"
Isaiah,36,10,"And am I now come up without the Lord-Yehōvah (Messiah Pre-Incarnate) against this land to destroy it? the Lord-Yehōvah (Messiah Pre-Incarnate) said unto me, Go up against this land, and destroy it."
Isaiah,36,11,"Then said Elyakim [God sets up] and Shevnah [vigour] and Yo’ach [Yahovah is brother] unto Rav-Shakeh [chief cupbearer] , Speak, I pray you i , unto your i servants in the Arami [exalted] language; for we understand [it] : and speak not to us in the Y’hudit (Y’hudim (Judeans)’) language, in the ears of the people that [are] on the wall."
Isaiah,36,12,"But Rav-Shakeh [chief cupbearer] said, Has my master sent me to your i master and to you i to speak these words? [has he] not [sent me] to the men that sit upon the wall, that they may eat their own dung, and drink their own piss with you?"
Isaiah,36,13,"Then Rav-Shakeh [chief cupbearer] stood, and cried with a loud voice in the Y’hudit (Y’hudim (Judeans)’) language, and said, Hear you 2f the words of the great king, the king of Ashur [the level plain] (the land of the sons of Shem (name, renown (great reputation; being well-known)))."
Isaiah,36,14,"Thus says the king, Let not Hizkiyahu [Yehovah is my strength] deceive you: for he shall not be able to deliver you."
Isaiah,36,15,"Neither let Hizkiyahu [Yehovah is my strength] make you trust in the Lord-Yehōvah (Messiah Pre-Incarnate) , saying, The Lord-Yehōvah (Messiah Pre-Incarnate) will surely deliver us: this city shall not be delivered into the hand of the king of Ashur [the level plain] (the land of the sons of Shem (name, renown (great reputation; being well-known)))."
Isaiah,36,16,"Listen not to Hizkiyahu [Yehovah is my strength] : for thus says the king of Ashur [the level plain] (the land of the sons of Shem (name, renown (great reputation; being well-known))) , Make [an agreement] with me [by] a present, and come out to me: and eat you 2f everyone of his vine, and everyone of his fig tree, and drink you 2f everyone the waters of his own cistern;"
Isaiah,36,17,"Until I come and take you away to a land like your own land, a land of corn and wine, a land of bread and vineyards."
Isaiah,36,18," [Beware] lest Hizkiyahu [Yehovah is my strength] persuade you, saying, The Lord-Yehōvah (Messiah Pre-Incarnate) will deliver us. Has any of the gods of the nations delivered his land out of the hand of the king of Ashur [the level plain] (the land of the sons of Shem (name, renown (great reputation; being well-known)))?"
Isaiah,36,19,Where [are] the gods of Hamat [Fortress] and Arpad [I shall be supported] ? where [are] the gods of S’farvayim [the two Sipparas (the city of books)] ? and have they delivered Shomron [watch mountain] out of my hand?
Isaiah,36,20,"Who [are they] among all the gods of these lands, that have delivered their land out of my hand, that the Lord-Yehōvah (Messiah Pre-Incarnate) should deliver Yerushalayim [Foundation of Peace] out of my hand?"
Isaiah,36,21,"But they held their peace, and answered him not a word: for the king’s commandment was, saying, Answer him not."
Isaiah,36,22,"Then came Elyakim [God sets up] , the son of Hilkiyahu [my portion is Yehovah] , that [was] over the household, and Shevnah [vigour] the scribe, and Yo’ach [Yahovah is brother] , the son of Asaf [gatherer] , the recorder, to Hizkiyahu [Yehovah is my strength] with [their] clothes rent, and told him the words of Rav-Shakeh [chief cupbearer]."
Isaiah,37,1,"And it came to pass, when king Hizkiyahu [Yehovah is my strength] heard [it] , that he rent his clothes, and covered himself with sackcloth, and went into the house of the Lord-Yehōvah (Messiah Pre-Incarnate)."
Isaiah,37,2,"And he sent Elyakim [God sets up] , who [was] over the household, and Shevnah [vigour] the scribe, and the elders of the priests covered with sackcloth, unto Yesha’yahu [Yehovah has saved] the prophet the son of Amotz [strong]."
Isaiah,37,3,"And they said unto him, Thus says Hizkiyahu [Yehovah is my strength] , This day [is] a day of trouble, and of rebuke (reprimand; strongly warn; restrain) , and of blasphemy: for the children are come to the birth, and [there is] not strength to bring forth."
Isaiah,37,4,"It may be the Lord-Yehōvah (Messiah Pre-Incarnate) your i God-Elōhīm (The Living Word) [The Many Powered] will hear the words of Rav-Shakeh [chief cupbearer] , whom the king of Ashur [the level plain] (the land of the sons of Shem (name, renown (great reputation; being well-known))) his master has sent to reproach (disgrace; shame) the living God-Elōhīm (The Living Word) [The Many Powered] , and will reprove the words which the Lord-Yehōvah (Messiah Pre-Incarnate) you i God-Elōhīm (The Living Word) [The Many Powered] has heard: wherefore lift up [your i ] prayer for the remnant that is left."
Isaiah,37,5,So the servants of king Hizkiyahu [Yehovah is my strength] came to Yesha’yahu [Yehovah has saved].
Isaiah,37,6,"And Yesha’yahu [Yehovah has saved] said unto them, Thus shall you 2f say unto your master, Thus says the Lord-Yehōvah (Messiah Pre-Incarnate) , Be not afraid of the words that you i have heard, which the servants of the king of Ashur [the level plain] (the land of the sons of Shem (name, renown (great reputation; being well-known))) have blasphemed me."
Isaiah,37,7,"Behold, I will send a blast upon him, and he shall hear a rumour, and return to his own land; and I will cause him to fall by the sword in his own land."
Isaiah,37,8,"So Rav-Shakeh [chief cupbearer] returned, and found the king of Ashur [the level plain] (the land of the sons of Shem (name, renown (great reputation; being well-known))) warring against Livnah [Pavement] : for he had heard that he was departed from Lakhish [Invincible]."
Isaiah,37,9,"And he heard say concerning Tirhakah [he searched out the pious] king of Ethiopia [Kush] , He is come forth to make war with you i . And when he heard [it] , he sent messengers to Hizkiyahu [Yehovah is my strength] , saying,"
Isaiah,37,10,"Thus shall you 2f speak to Hizkiyahu [Yehovah is my strength] king of Y’hudah [Let Him (God) Be Praised] , saying, Let not your i God-Elōhīm (The Living Word) [The Many Powered] , in whom you i trust, deceive you i , saying, Yerushalayim [Foundation of Peace] shall not be given into the hand of the king of Ashur [the level plain] (the land of the sons of Shem (name, renown (great reputation; being well-known)))."
Isaiah,37,11,"Behold, you i have heard what the kings of Ashur [the level plain] (the land of the sons of Shem (name, renown (great reputation; being well-known))) have done to all lands by destroying them utterly; and shall you i be delivered?"
Isaiah,37,12,"Have the gods of the nations delivered them which my fathers have destroyed, [as] Gozan [a cutting off] , and Haran [mountaineer] , and Retzef [a hot stone] , and the children of ‘Eden [pleasure] which [were] in Tel’asar [Assyrian hill]?"
Isaiah,37,13,"Where [is] the king of Hamat [Fortress] , and the king of Arpad [I shall be supported] , and the king of the city of S’farvayim [the two Sipparas (the city of books)] , Hena [troubling] , and ‘Ivah [ruin]?"
Isaiah,37,14,"And Hizkiyahu [Yehovah is my strength] received the letter from the hand of the messengers, and read it: and Hizkiyahu [Yehovah is my strength] went up unto the house of the Lord-Yehōvah (Messiah Pre-Incarnate) , and spread it before the Lord-Yehōvah (Messiah Pre-Incarnate)."
Isaiah,37,15,"And Hizkiyahu [Yehovah is my strength] prayed unto the Lord-Yehōvah (Messiah Pre-Incarnate) , saying,"
Isaiah,37,16,"O Lord-Yehōvah (Messiah Pre-Incarnate) Tz’va’ot [of the Heavenly Armies] , God-Elōhīm (The Living Word) [The Many Powered] of Yisra’el [He Holds Onto The Heel Of God] , that dwell [between] the k’vurim (cherubim) , you i [are] the God-Elōhīm (The Living Word) [The Many Powered], [even] you i alone, of all the kingdoms of the earth: you i have made heaven and earth."
Isaiah,37,17,"Incline you i ear, O Lord-Yehōvah (Messiah Pre-Incarnate) , and hear; open your i eyes, O Lord-Yehōvah (Messiah Pre-Incarnate) , and see: and hear all the words of Sancheriv [Sin (the moon) multiplied brothers] , which has sent to reproach (disgrace; shame) the living God-Elōhīm (The Living Word) [The Many Powered]."
Isaiah,37,18,"Of a truth, Lord-Yehōvah (Messiah Pre-Incarnate) , the kings of Ashur [the level plain] (the land of the sons of Shem (name, renown (great reputation; being well-known))) have laid waste all the nations, and their countries,"
Isaiah,37,19,"And have cast their gods into the fire: for they [were] no gods, but the work of men’s hands, wood and stone: therefore they have destroyed them."
Isaiah,37,20,"Now therefore, O Lord-Yehōvah (Messiah Pre-Incarnate) our God-Elōhīm (The Living Word) [The Many Powered] , save us from his hand, that all the kingdoms of the earth may know that you i [are] the Lord-Yehōvah (Messiah Pre-Incarnate), [even] you i only."
Isaiah,37,21,"Then Yesha’yahu [Yehovah has saved] the son of Amotz [strong] sent unto Hizkiyahu [Yehovah is my strength] , saying, Thus says the Lord-Yehōvah (Messiah Pre-Incarnate) God-Elōhīm (The Living Word) [The Many Powered] of Yisra’el [He Holds Onto The Heel Of God] , Whereas you i have prayed to me against Sancheriv [Sin (the moon) multiplied brothers] king of Ashur [the level plain] (the land of the sons of Shem (name, renown (great reputation; being well-known))):"
Isaiah,37,22,"This [is] the word which the Lord-Yehōvah (Messiah Pre-Incarnate) has spoken concerning him; The virgin, the daughter of Tziyon [parched place] , has despised you i, [and] laughed you i to scorn; the daughter of Yerushalayim [Foundation of Peace] has shaken her head at you i."
Isaiah,37,23,"Whom have you i reproached and blasphemed? and against whom have you i exalted [your i ] voice, and lifted up your i eyes on high? [even] against the Holy One of Yisra’el [He Holds Onto The Heel Of God]."
Isaiah,37,24,"By your i servants have you i reproached the Lord-Adonai (The Father) [Greatest Above All Things] , and have said, By the multitude of my chariots am I come up to the height of the mountains, to the sides of L’vanon [Whiteness] ; and I will cut down the tall cedars thereof, [and] the choice fir trees thereof: and I will enter into the height of his border, [and] the forest of his Carmel [Garden-land]."
Isaiah,37,25,"I have excavated, and drunk water; and with the sole of my feet have I dried up all the rivers of the besieged places."
Isaiah,37,26,"Have you i not heard long ago, [how] I have done it; [and] of ancient times, that I have formed it? now have I brought it to pass, that you i should be to lay waste fortified cities [into] ruinous heaps."
Isaiah,37,27,"Therefore their inhabitants [were] of small power, they were dismayed and confounded: they were [as] the grass of the field, and [as] the green herb, [as] the grass on the housetops, and [as corn] blasted before it be grown up."
Isaiah,37,28,"But I know you i abode, and your i going out, and your i coming in, and your i rage against me."
Isaiah,37,29,"Because your i rage against me, and your i tumult, is come up into my ears, therefore will I put my hook in your i nose, and my bridle in your i lips, and I will turn you i back by the way by which you i came."
Isaiah,37,30,"And this [shall be] a sign unto you i , You 2f shall eat [this] year such as grows of itself; and the second year that which springs of the same: and in the third year sow you 2f , and reap, and plant vineyards, and eat the fruit thereof."
Isaiah,37,31,"And the remnant that is escaped of the house of Y’hudah [Let Him (God) Be Praised] shall again take root downward, and bear fruit upward:"
Isaiah,37,32,"For out of Yerushalayim [Foundation of Peace] shall go forth a remnant, and they that escape out of mount Tziyon [parched place] : the zeal of the Lord-Yehōvah (Messiah Pre-Incarnate) Tz’va’ot [of the Heavenly Armies] shall do this."
Isaiah,37,33,"Therefore thus says the Lord-Yehōvah (Messiah Pre-Incarnate) concerning the king of Ashur [the level plain] (the land of the sons of Shem (name, renown (great reputation; being well-known))) , He shall not come into this city, nor shoot an arrow there, nor come before it with shields, nor cast a bank against it."
Isaiah,37,34,"By the way that he came, by the same shall he return, and shall not come into this city, says the Lord-Yehōvah (Messiah Pre-Incarnate)."
Isaiah,37,35,"For I will defend this city to save it for my own sake, and for my servant David’s [beloved] ’s sake."
Isaiah,37,36,"Then the Angel of the Lord-Yehōvah (Messiah Pre-Incarnate) went forth, and struck in the camp of the children of Ashur a hundred and eighty and five thousand: and when they arose early in the morning, behold, they [were] all dead corpses."
Isaiah,37,37,"So Sancheriv [Sin (the moon) multiplied brothers] king of Ashur [the level plain] (the land of the sons of Shem (name, renown (great reputation; being well-known))) departed, and went and returned, and dwelt at Nineveh [abode of Ninus, or Offspring’s Habitation]."
Isaiah,37,38,"And it came to pass, as he was worshipping in the house of Nisrokh [the great eagle] his god, that Adramelekh [honor of the king, or Adar is prince] and Shar’etzer [prince of fire] his sons struck him with the sword; and they escaped into the land of Ararat [the curse reversed] [the curse reversed: precipitation of curse]: and Esar-Hadon [Ashur has given a brother] his son reigned in his stead."
Isaiah,38,1,"In those days was Hizkiyahu [Yehovah is my strength] sick unto death. And Yesha’yahu [Yehovah has saved] the prophet the son of Amotz [strong] came unto him, and said unto him, Thus says the Lord-Yehōvah (Messiah Pre-Incarnate) , Set your i house in order: for you i shall die, and not live."
Isaiah,38,2,"Then Hizkiyahu [Yehovah is my strength] turned his face toward the wall, and prayed unto the Lord-Yehōvah (Messiah Pre-Incarnate),"
Isaiah,38,3,"And said, Remember now, O Lord-Yehōvah (Messiah Pre-Incarnate) , I beseech (to call upon; appeal; beg) you i , how I have walked before you i in tand with a perfect heart, and have done [that which is] good in your i sight. And Hizkiyahu [Yehovah is my strength] wept sore."
Isaiah,38,4,"Then came the word of the Lord-Yehōvah (Messiah Pre-Incarnate) to Yesha’yahu [Yehovah has saved] , saying,"
Isaiah,38,5,"Go, and say to Hizkiyahu [Yehovah is my strength] , Thus says the Lord-Yehōvah (Messiah Pre-Incarnate) , the God-Elōhīm (The Living Word) [The Many Powered] of David [beloved] your i father, I have heard your i prayer, I have seen your i tears: behold, I will add unto your i days fifteen years."
Isaiah,38,6,"And I will deliver you i and this city out of the hand of the king of Ashur [the level plain] (the land of the sons of Shem (name, renown (great reputation; being well-known))) : and I will defend this city."
Isaiah,38,7,"And this [shall be] a sign unto you i from the Lord-Yehōvah (Messiah Pre-Incarnate) , that the Lord-Yehōvah (Messiah Pre-Incarnate) will do this thing that he has spoken;"
Isaiah,38,8,"Behold, I will bring again the shadow of the degrees, which is gone down in the sun dial of Achaz [he has grasped] , ten degrees backward. So the sun returned ten degrees, by which degrees it was gone down."
Isaiah,38,9,"The writing of Hizkiyahu [Yehovah is my strength] king of Y’hudah [Let Him (God) Be Praised] , when he had been sick, and was recovered of his sickness:"
Isaiah,38,10,"I said in the cutting off of my days, I shall go to the gates of the grave: I am deprived of the residue (part that remains, the rest) of my years."
Isaiah,38,11,"I said, I shall not see the Lord- [Yah] (Messiah Pre-Incarnate), [even] the Lord- [Yah] (Messiah Pre-Incarnate) , in the land of the living: I shall behold man no more with the inhabitants of the world."
Isaiah,38,12,"Mine age is departed, and is removed from me as a shepherd’s tent: I have cut off like a weaver my life: he will cut me off with pining sickness: from day [even] tonight will you i make an end of me."
Isaiah,38,13,"I reckoned till morning, [that] , as a lion, so will he break all my bones: from day [even] tonight will you i make an end of me."
Isaiah,38,14,"Like a crane [or] a swallow (to approve, commend, accept) , so did I chatter: I did mourn as a dove: my eyes fail [with looking] upward: O Lord-Adonai (The Father) [Greatest Above All Things] I am oppressed; undertake for me."
Isaiah,38,15,"What shall I say? he has both spoken unto me, and himself has done [it] : I shall go softly all my years in the bitterness of my soul."
Isaiah,38,16,"O Lord-Adonai (The Father) [Greatest Above All Things] , by these [things men] live, and in all these [things is] the life of my spirit: so will you i recover me, and make me to live."
Isaiah,38,17,"Behold, for peace I had great bitterness: but you i have in love to my soul [delivered it] from the pit of corruption: for you i have cast all my sins behind your i back."
Isaiah,38,18,"For the grave cannot praise you i , death can [not] celebrate you i : they that go down into the pit cannot hope for your i truth."
Isaiah,38,19,"The living, the living, he shall praise you i , as I [do] this day: the father to the children shall make known your i truth."
Isaiah,38,20,The Lord-Yehōvah (Messiah Pre-Incarnate) [was ready] to save me: therefore we will sing my songs to the stringed instruments all the days of our life in the house of the Lord-Yehōvah (Messiah Pre-Incarnate).
Isaiah,38,21,"For Yesha’yahu [Yehovah has saved] had said, Let them take a lump of figs, and lay [it] for a plaster upon the boil, and he shall recover."
Isaiah,38,22,"Hizkiyahu [Yehovah is my strength] also had said, What [is] the sign that I shall go up to the house of the Lord-Yehōvah (Messiah Pre-Incarnate)?"
Isaiah,39,1,"At that time M’rodakh-Bal’adan [Marduk has given a son] , the son of Bal’adan [Bel is lord] , king of Bavel (to jumble, or a confused medley of sounds; confusion; gate of the deity) (Babylon) [confusion] , sent letters and a present to Hizkiyahu [Yehovah is my strength] : for he had heard that he had been sick, and was recovered."
Isaiah,39,2,"And Hizkiyahu [Yehovah is my strength] was glad of them, and showed them the house of his precious things, the silver, and the gold, and the spices, and the precious ointment, and all the house of his armour, and all that was found in his treasures: there was nothing in his house, nor in all his dominion, that Hizkiyahu [Yehovah is my strength] showed them not."
