Isaiah,13,13,"Therefore I will shake the heavens, and the earth shall remove out of her place, in the wrath of the Lord-Yehōvah (Messiah Pre-Incarnate) Tz’va’ot [of the Heavenly Armies] , and in the day of his fierce anger."
Isaiah,13,14,"And it shall be as the chased roe, and as a sheep that no man takes up: they shall every man turn to his own people, and flee everyone into his own land."
Isaiah,13,15,Every one that is found shall be thrust through; and everyone that is joined [unto them] shall fall by the sword.
Isaiah,13,16,"Their children also shall be dashed to pieces before their eyes; their houses shall be spoiled, and their wives raped."
Isaiah,13,17,"Behold, I will stir up the Medes [middle land] against them, which shall not regard silver; and [as for] gold, they shall not delight in it."
Isaiah,13,18, [Their] bows also shall dash the young men to pieces; and they shall have no pity on the fruit of the womb; their eye shall not spare children.
Isaiah,13,19,"And Bavel (to jumble, or a confused medley of sounds; confusion; gate of the deity) (Babylon) [confusion] , the glory of kingdoms, the beauty of the Kasdim [clod-breakers]’ excellency, shall be as when God-Elōhīm (The Living Word) [The Many Powered] overthrew S’dom [Burning] and ‘Amora [Submersion]."
Isaiah,13,20,"It shall never be inhabited, neither shall it be dwelt in from generation to generation: neither shall the Aravi [Arabian] pitch tent there; neither shall the shepherds make their fold there."
Isaiah,13,21,"But wild beasts of the desert shall lie there; and their houses shall be full of doleful (mournful cry; sorrowful howl) creatures; and owls shall dwell there, and goats shall dance there."
Isaiah,13,22,"And the wild beasts of the islands shall cry in their desolate houses, and dragons in [their] pleasant palaces: and her time [is] near to come, and her days shall not be prolonged."
Isaiah,14,1,"For the Lord-Yehōvah (Messiah Pre-Incarnate) will have mercy on Ya’akov [Heal of God] , and will yet choose Yisra’el [He Holds Onto The Heel Of God] , and set them in their own land: and the strangers shall be joined with them, and they shall cleave (split open; cut open; divide) to the house of Ya’akov [Heal of God]."
Isaiah,14,2,"And the people shall take them, and bring them to their place: and the house of Yisra’el [He Holds Onto The Heel Of God] shall possess them in the land of the Lord-Yehōvah (Messiah Pre-Incarnate) for servants and handmaids: and they shall take them captives, whose captives they were; and they shall rule over their oppressors."
Isaiah,14,3,"And it shall come to pass in the day that the Lord-Yehōvah (Messiah Pre-Incarnate) shall give you i rest from your i sorrow, and from your i fear, and from the hard bondage wherein you i were made to serve,"
Isaiah,14,4,"That you i shall take up this proverb against the king of Bavel (to jumble, or a confused medley of sounds; confusion; gate of the deity) (Babylon) [confusion] , and say, How has the oppressor ceased! the golden city ceased!"
Isaiah,14,5,"The Lord-Yehōvah (Messiah Pre-Incarnate) has broken the staff of the wicked, [and] the scepter of the rulers."
Isaiah,14,6,"He who struck the people in wrath with a continual stroke, he that ruled the nations in anger, is persecuted, [and] none hinders it."
Isaiah,14,7,"The whole earth is at rest, [and] is quiet: they break forth into singing."
Isaiah,14,8,"Yes, the fir trees rejoice at you i, [and] the cedars of L’vanon [Whiteness], [saying] , Since you i are laid down, no feller is come up against us."
Isaiah,14,9,"Hell from beneath is moved for you i to meet [you i ] at your i coming: it stirs up the dead for you i, [even] all the chief ones of the earth; it has raised up from their thrones all the kings of the nations."
Isaiah,14,10,"All they shall speak and say unto you i , Are you i also become weak as we? are you i become like unto us?"
Isaiah,14,11,"Your 1s pomp is brought down to the grave, [and] the noise of your i viols: the worm is spread under you i , and the worms cover you i."
Isaiah,14,12,"How are you i fallen from heaven, O Lucifer, son of the morning! [how] are you i cut down to the ground, which did weaken the nations!"
Isaiah,14,13,"For you i have said in your i heart, I will ascend into heaven, I will exalt my throne above the stars of God-Elōhīm (The Living Word) [The Many Powered] : I will sit also upon the mount of the congregation, in the sides of the north:"
Isaiah,14,14,I will ascend above the heights of the clouds; I will be like the Most High.
Isaiah,14,15,"Yet you i shall be brought down to hell, to the sides of the pit."
Isaiah,14,16,"They that see you i shall narrowly look upon you i, [and] consider you i, [saying, Is] this the man that made the earth to tremble, that did shake kingdoms;"
Isaiah,14,17," [That] made the world as a wilderness, and destroyed the cities thereof; [that] opened not the house of his prisoners?"
Isaiah,14,18,"All the kings of the nations, [even] all of them, lie in glory, everyone in his own tomb."
Isaiah,14,19,"But you i are cast out of your i grave like an abominable branch, [and as] the clothing of those that are slain, thrust through with a sword, that go down to the stones of the pit; as a carcass trampled under feet."
Isaiah,14,20,"you i shall not be joined with them in burial, because you i have destroyed your i land, [and] slain your i people: the seed of evildoers shall never be mentioned forever."
Isaiah,14,21,"Prepare slaughter for his children for the iniquity of their fathers; that they do not rise, nor possess the land, nor fill the face of the world with cities."
Isaiah,14,22,"For I will rise up against them, says the Lord-Yehōvah (Messiah Pre-Incarnate) Tz’va’ot [of the Heavenly Armies] , and cut off from Bavel (to jumble, or a confused medley of sounds; confusion; gate of the deity) (Babylon) [confusion] the name, and remnant, and son, and nephew, says the Lord-Yehōvah (Messiah Pre-Incarnate)."
Isaiah,14,23,"I will also make it a possession for the hedgehogs, and pools of water: and I will sweep it with the broom of destruction, says the Lord-Yehōvah (Messiah Pre-Incarnate) Tz’va’ot [of the Heavenly Armies]."
Isaiah,14,24,"The Lord-Yehōvah (Messiah Pre-Incarnate) Tz’va’ot [of the Heavenly Armies] has sworn, saying, Surely as I have thought, so shall it come to pass; and as I have purposed, [so] shall it stand:"
Isaiah,14,25,"That I will break the Ashur (Assyrian) in my land, and upon my mountains trample him under foot: then shall his yoke depart from off them, and his burden depart from off their shoulders."
Isaiah,14,26,This [is] the purpose that is purposed upon the whole earth: and this [is] the hand that is stretched out upon all the nations.
Isaiah,14,27,"For the Lord-Yehōvah (Messiah Pre-Incarnate) Tz’va’ot [of the Heavenly Armies] has purposed, and who shall frustrate [it] ? and his hand [is] stretched out, and who shall turn it back?"
Isaiah,14,28,In the year that king Achaz [he has grasped] died was this burden.
Isaiah,14,29,"Rejoice not you i , all of you P’leshet [Land of Strangers] , because the rod of him that struck you i is broken: for out of the serpent’s root shall come forth a Cockatrice (venomous snake) (viper) , and his fruit [shall be] a fiery flying serpent."
Isaiah,14,30,"And the firstborn of the poor shall feed, and the needy shall lie down in safety: and I will kill your i root with famine, and he shall slay your i survivors"
Isaiah,14,31,"Howl, O gate; cry, O city; you i , all of you P’leshet [Land of Strangers], [are] dissolved: for there shall come from the north a smoke, and none [shall be] alone in his ranks."
Isaiah,14,32,"What shall [one] then answer the messengers of the nation? That the Lord-Yehōvah (Messiah Pre-Incarnate) has founded Tziyon [parched place] , and the poor of his people shall trust in it."
Isaiah,15,1,"The burden of Mo’av [Seed of my Father] . Because in the night ‘Ar [A City] of Mo’av [Seed of my Father] is laid waste, [and] brought to silence; because in the night Kir [wall] of Mo’av [Seed of my Father] is laid waste, [and] brought to silence;"
Isaiah,15,2,"He is gone up to Bayit [the temple] , and to Divon [Wasting] , the high places, to weep: Mo’av [Seed of my Father] shall howl over Nevo [Prophet] , and over Meidva [Water of Rest] : on all their heads [shall be] baldness, [and] every beard cut off."
Isaiah,15,3,"In their streets they shall clothe themselves with sackcloth: on the tops of their houses, and in their streets, everyone shall howl, weeping abundantly."
Isaiah,15,4,"And Heshbon [Stronghold] shall cry, and El’aleh [God is Ascending] : their voice shall be heard [even] unto Yachatz [Trampled Down] : therefore the armed soldiers of Mo’av [Seed of my Father] shall cry out; his life shall be grievous unto him."
Isaiah,15,5,"My heart shall cry out for Mo’av [Seed of my Father] ; his fugitives [shall flee] unto Tzo’ar [Insignificance] , an heifer of three years old: for by the mounting up of Luchit [tablets (small, flat ornaments or jewelry)] with weeping shall they go it up; for in the way of Horonayim [two caves] [two caves] they shall raise up a cry of destruction."
Isaiah,15,6,"For the waters of Nimrim [pure] shall be desolate: for the hay is withered away, the grass fails, there is no green thing."
Isaiah,15,7,"Therefore the abundance they have gotten, and that which they have laid up, shall they carry away to the brook of the willows."
Isaiah,15,8,"For the cry is gone round about the borders of Mo’av [Seed of my Father] ; the howling thereof unto Eglayim [double reservoir] , and the howling thereof unto Be’er-Elim [well of God]."
Isaiah,15,9,"For the waters of Dimon [river bed or silence] shall be full of blood: for I will bring more upon Dimon [river bed or silence] , lions upon him that escapes of Mo’av [Seed of my Father] , and upon the remnant of the land."
Isaiah,16,1,"Send you 2f the lamb to the ruler of the land from Sela [the rocks] to the wilderness, unto the mount of the daughter of Tziyon [parched place]."
Isaiah,16,2,"For it shall be, [that] , as a wandering bird cast out of the nest, [so] the daughters of Mo’av [Seed of my Father] shall be at the fords of ‘Arnon [Rushing Stream]."
Isaiah,16,3,"Take counsel, execute judgment; make your i shadow as the night in the midst of the noonday; hide the outcasts; betray not him that wanders."
Isaiah,16,4,"Let my outcasts dwell with you i , Mo’av [Seed of my Father] ; be you i a colonnade to them from the face of the spoiler: for the extortioner is at an end, the spoiler ceases, the oppressors are consumed out of the land."
Isaiah,16,5,"And in mercy shall the throne be established: and he shall sit upon it in tin the tabernacle of David [beloved] , judging, and seeking judgment, and hasting righteousness."
Isaiah,16,6,"We have heard of the pride of Mo’av [Seed of my Father]; [he is] very proud: [even] of his haughtiness, and his pride, and his wrath: [but] his lies [shall] not [be] so."
Isaiah,16,7,"Therefore shall Mo’av [Seed of my Father] howl for Mo’av [Seed of my Father] , everyone shall howl: for the foundations of Kir-Hareset [wall of potsherds] shall you 2f mourn; surely [they are] stricken."
Isaiah,16,8,"For the fields of Heshbon [Stronghold] languish, [and] the vine of Sivnah [Fragrance] : the lords of the heathen have broken down the principal plants thereof, they are come [even] unto Ya’zer [Helped] , they wandered [through] the wilderness: her branches are stretched out, they are gone over the sea."
Isaiah,16,9,"Therefore I will bewail with the weeping of Ya’zer [Helped] the vine of Sivnah [Fragrance] : I will water you i with my tears, O Heshbon [Stronghold] , and El’aleh [God is Ascending] : for the shouting for your i summer fruits and for your i harvest is fallen."
Isaiah,16,10,"And gladness is taken away, and joy out of the plentiful field; and in the vineyards there shall be no singing, neither shall there be shouting: the treaders shall trample out no wine in [their] presses; I have made [their vintage] shouting to cease."
Isaiah,16,11,"For what reason my bowels (inward parts; affections) shall sound like an harp for Mo’av [Seed of my Father] , and my inward parts for Kir-Heres [wall of potsherds]."
Isaiah,16,12,"And it shall come to pass, when it is seen that Mo’av [Seed of my Father] is weary on the high place, that he shall come to his sanctuary to pray; but he shall not prevail."
Isaiah,16,13,This [is] the word that the Lord-Yehōvah (Messiah Pre-Incarnate) has spoken concerning Mo’av [Seed of my Father] since that time.
Isaiah,16,14,"But now the Lord-Yehōvah (Messiah Pre-Incarnate) has spoken, saying, Within three years, as the years of an employee (hired laborer) , and the glory of Mo’av [Seed of my Father] shall be scorned, with all that great multitude; and the remnant [shall be] very small [and] feeble."
Isaiah,17,1,"The burden of Dammesek (Damascus) [silent is the sackcloth weaver] . Behold, Dammesek (Damascus) [silent is the sackcloth weaver] is taken away from [being] a city, and it shall be a ruinous heap."
Isaiah,17,2,"The cities of ‘Aeo’er [Ruins] [are] forsaken: they shall be for flocks, which shall lie down, and none shall make [them] afraid."
Isaiah,17,3,"The fortress also shall cease from Efrayim [Doubly Fruitful] , and the kingdom from Dammesek (Damascus) [silent is the sackcloth weaver] , and the remnant of Aram (Syria) [exalted] : they shall be as the glory of the people of Yisra’el [He Holds Onto The Heel Of God] , says the Lord-Yehōvah (Messiah Pre-Incarnate) Tz’va’ot [of the Heavenly Armies]."
Isaiah,17,4,"And in that day it shall come to pass, [that] the glory of Ya’akov [Heal of God] shall be made thin, and the fatness of his flesh shall grow (become; advance) lean."
Isaiah,17,5,"And it shall be as when the harvestman gathers the corn, and reaps the ears with his arm; and it shall be as he that gathers ears in the valley of Refa’im [giants]."
Isaiah,17,6,"Yet gleaning grapes shall be left in it, as the shaking of an olive tree, two [or] three berries in the top of the uppermost bough, four [or] five in the outmost fruitful branches thereof, says the Lord-Yehōvah (Messiah Pre-Incarnate) God-Elōhīm (The Living Word) [The Many Powered] of Yisra’el [He Holds Onto The Heel Of God]."
Isaiah,17,7,"At that day shall a man look to his Maker, and his eyes shall have respect to the Holy One of Yisra’el [He Holds Onto The Heel Of God]."
Isaiah,17,8,"And he shall not look to the altars, the work of his hands, neither shall respect [that] which his fingers have made, either the groves, or the images."
Isaiah,17,9,"In that day shall his strong cities be as a forsaken bough, and an uppermost branch, which they left because of the people of Yisra’el [He Holds Onto The Heel Of God] : and there shall be a desolation."
Isaiah,17,10,"Because you i have forgotten the God-Elōhīm (The Living Word) [The Many Powered] of your i salvation, and have not been mindful of the Rock of your i strength, therefore shall you i plant pleasant plants, and shall set them with vine slips of a strange god:"
Isaiah,17,11,"In the day shall you i make your i plant to grow, and in the morning shall you i make your i seed to flourish: [but] the harvest [shall be] a heap in the day of grief and of desperate sorrow."
Isaiah,17,12,"Woe to the multitude of many people, [which] make a noise like the noise of the seas; and to the rushing of nations, [that] make a rushing like the rushing of mighty waters!"
Isaiah,17,13,"The nations shall rush like the rushing of many waters: but [God-Elōhīm (The Living Word) [The Many Powered] ] shall rebuke (reprimand; strongly warn; restrain) them, and they shall flee far off, and shall be chased as the chaff of the mountains before the wind, and like a rolling thing before the whirlwind."
Isaiah,17,14,"And behold at evening trouble; [and] before the morning he [is] not. This [is] the portion of them that plunder us, and the lot of them that rob us."
Isaiah,18,1,"Woe to the land shadowing with wings, which [is] beyond the rivers of Ethiopia [Kush]:"
Isaiah,18,2,"That send ambassadors by the sea, even in vessels of bulrushes (papyrus) upon the waters, [saying] , Go, you 2f swift messengers, to a nation tall and bronzed, to a people terrible from far and wide; a nation powerful and oppressive, whose land the rivers have divided!"
Isaiah,18,3,"All you 2f inhabitants of the world, and dwellers on the earth, see you 2f , when he lifts up an flag (or banner; as of an army) on the mountains; and when he blows a trumpet, hear you 2f."
Isaiah,18,4,"For so the Lord-Yehōvah (Messiah Pre-Incarnate) said unto me, I will take my rest, and I will consider in my dwelling place like a clear heat upon herbs, [and] like a cloud of dew in the heat of harvest."
Isaiah,18,5,"For before the harvest, when the bud is perfect, and the sour grape is ripening in the flower, he shall both cut off the sprigs with pruning hooks, and take away [and] cut down the branches."
Isaiah,18,6,"They shall be left together unto the fowls of the mountains, and to the beasts of the earth: and the fowls shall summer upon them, and all the beasts of the earth shall winter upon them."
Isaiah,18,7,"In that time shall the present be brought unto the Lord-Yehōvah (Messiah Pre-Incarnate) Tz’va’ot [of the Heavenly Armies] of a people tall and bronzed and from a people terrible from their beginning up to this time; a nation meted out and trampled under foot, whose land the rivers have divided, to the place of the name of the Lord-Yehōvah (Messiah Pre-Incarnate) Tz’va’ot [of the Heavenly Armies] , the mount Tziyon [parched place]."
Isaiah,19,1,"The burden of Mitzrayim [Egypt - The Narrow Place] . Behold, the Lord-Yehōvah (Messiah Pre-Incarnate) rides upon a swift cloud, and shall come into Mitzrayim [Egypt - The Narrow Place] : and the idols of Mitzrayim [Egypt - The Narrow Place] shall be moved at his presence, and the heart of Mitzrayim [Egypt - The Narrow Place] shall melt in the midst of it."
Isaiah,19,2,"And I will set the Mitzri against the Mitzri: and they shall fight everyone against his brother, and everyone against his neighbour; city against city, [and] kingdom against kingdom."
Isaiah,19,3,"And the spirit of Mitzrayim [Egypt - The Narrow Place] shall fail in the midst thereof; and I will destroy the counsel thereof: and they shall seek to the idols, and to the charmers, and to them that have familiar spirits, and to the wizards."
Isaiah,19,4,"And the Mitzri will I give over into the hand of a cruel lord; and a fierce king shall rule over them, says the Lord-Adon [Lord of the Earth] , the Lord-Yehōvah (Messiah Pre-Incarnate) Tz’va’ot [of the Heavenly Armies]."
Isaiah,19,5,"And the waters shall fail from the sea, and the river shall be parched and dried up."
Isaiah,19,6,And they shall turn the rivers far away; [and] the brooks of defense shall be emptied and dried up: the reeds and flags shall wither.
Isaiah,19,7,"The paper reeds by the brooks, by the mouth of the brooks, and everything sown by the brooks, shall wither, be driven away, and be no [more]."
Isaiah,19,8,"The fishers also shall mourn, and all they that cast angle (fishhook) into the brooks shall lament, and they that spread nets upon the waters shall languish."
Isaiah,19,9,"Moreover they that work in fine flax, and they that weave networks, shall be confounded."
Isaiah,19,10,"And they shall be broken in the purposes thereof, all that make sluices [and] ponds for fish."
Isaiah,19,11,"Surely the princes of Tzo’an [Place of Departure] [are] fools, the counsel of the wise counselors of Par’oh [Pharaoh - Great House] is become cruel: how say you 2f unto Par’oh [Pharaoh - Great House] , I [am] the son of the wise (a sage) , the son of ancient kings?"
Isaiah,19,12,"Where [are] they? where [are] your i wise [men] ? and let them tell you i now, and let them know what the Lord-Yehōvah (Messiah Pre-Incarnate) Tz’va’ot [of the Heavenly Armies] has purposed upon Mitzrayim [Egypt - The Narrow Place]."
Isaiah,19,13,"The princes of Tzo’an [Place of Departure] are become fools, the princes of Nof [presentability] are deceived; they have also led astray Mitzrayim [Egypt - The Narrow Place], [even they that are] the cornerstone of the tribes."
Isaiah,19,14,"The Lord-Yehōvah (Messiah Pre-Incarnate) has mingled a perverse spirit in the midst of it: and they have caused Mitzrayim [Egypt - The Narrow Place] to err in every work there, as a drunken [man] staggers in his vomit."
Isaiah,19,15,"Neither shall there be [any] work for Mitzrayim [Egypt - The Narrow Place] , which the head or tail, branch or rush, may do."
Isaiah,19,16,"In that day shall Mitzrayim [Egypt - The Narrow Place] be like unto women: and it shall be afraid and fear because of the shaking of the hand of the Lord-Yehōvah (Messiah Pre-Incarnate) Tz’va’ot [of the Heavenly Armies] , which he shakes over it."
Isaiah,19,17,"And the land of Y’hudah [Let Him (God) Be Praised] shall be a terror unto Mitzrayim [Egypt - The Narrow Place] , everyone that makes mention thereof shall be afraid in himself, because of the counsel of the Lord-Yehōvah (Messiah Pre-Incarnate) Tz’va’ot [of the Heavenly Armies] , which he has determined against it."
Isaiah,19,18,"In that day shall five cities in the land of Mitzrayim [Egypt - The Narrow Place] speak the language of Kena’an [Merchant] , and swear to the Lord-Yehōvah (Messiah Pre-Incarnate) Tz’va’ot [of the Heavenly Armies] ; one shall be called, The city of destruction."
Isaiah,19,19,"In that day shall there be an altar to the Lord-Yehōvah (Messiah Pre-Incarnate) in the midst of the land of Mitzrayim [Egypt - The Narrow Place] , and a pillar at the border thereof to the Lord-Yehōvah (Messiah Pre-Incarnate)."
Isaiah,19,20,"And it shall be for a sign and for a witness unto the Lord-Yehōvah (Messiah Pre-Incarnate) Tz’va’ot [of the Heavenly Armies] in the land of Mitzrayim [Egypt - The Narrow Place] : for they shall cry unto the Lord-Yehōvah (Messiah Pre-Incarnate) because of the oppressors, and he shall send them a saviour, and a great one, and he shall deliver them."
Isaiah,19,21,"And the Lord-Yehōvah (Messiah Pre-Incarnate) shall be known to Mitzrayim [Egypt - The Narrow Place] , and the Mitzri shall know the Lord-Yehōvah (Messiah Pre-Incarnate) in that day, and shall do sacrifice and oblation; yes, they shall vow a vow unto the Lord-Yehōvah (Messiah Pre-Incarnate) , and perform [it]."
Isaiah,19,22,"And the Lord-Yehōvah (Messiah Pre-Incarnate) shall strike Mitzrayim [Egypt - The Narrow Place] : he shall strike and heal [it] : and they shall return [even] to the Lord-Yehōvah (Messiah Pre-Incarnate) , and he shall be entreated of them, and shall heal them."
Isaiah,19,23,"In that day shall there be a highway out of Mitzrayim [Egypt - The Narrow Place] to Ashur [the level plain] (the land of the sons of Shem (name, renown (great reputation; being well-known))) , and the Ashur (Assyrian) shall come into Mitzrayim [Egypt - The Narrow Place] , and the Mitzri [Egyptian] into Ashur [the level plain] (the land of the sons of Shem (name, renown (great reputation; being well-known))) , and the Mitzri shall serve with the children of Ashur."
Isaiah,19,24,"In that day shall Yisra’el [He Holds Onto The Heel Of God] be the third with Mitzrayim [Egypt - The Narrow Place] and with Ashur [the level plain] (the land of the sons of Shem (name, renown (great reputation; being well-known))), [even] a blessing in the midst of the land:"
Isaiah,19,25,"Whom the Lord-Yehōvah (Messiah Pre-Incarnate) Tz’va’ot [of the Heavenly Armies] shall bless, saying, Blessed (Favored by God; happy; prosperous) [be] Mitzrayim [Egypt - The Narrow Place] my people, and Ashur [the level plain] (the land of the sons of Shem (name, renown (great reputation; being well-known))) the work of my hands, and Yisra’el [He Holds Onto The Heel Of God] my inheritance."
Isaiah,20,1,"In the year that Tartan [general] came unto Ashdod [powerful] , (when Sargon [prince of the sun] the king of Ashur [the level plain] (the land of the sons of Shem (name, renown (great reputation; being well-known))) sent him,) and fought against Ashdod [powerful] , and took it;"
Isaiah,20,2,"At the same time spoke the Lord-Yehōvah (Messiah Pre-Incarnate) by Yesha’yahu [Yehovah has saved] the son of Amotz [strong] , saying, Go and loose the sackcloth from off your i waist, and put off your i shoe from your i foot. And he did so, walking naked and barefoot."
Isaiah,20,3,"And the Lord-Yehōvah (Messiah Pre-Incarnate) said, Like as my servant Yesha’yahu [Yehovah has saved] has walked naked and barefoot three years [for] a sign and wonder upon Mitzrayim [Egypt - The Narrow Place] and upon Ethiopia [Kush];"
Isaiah,20,4,"So shall the king of Ashur [the level plain] (the land of the sons of Shem (name, renown (great reputation; being well-known))) lead away the Mitzri prisoners, and the Ethiopians captives, young and old, naked and barefoot, even with [their] buttocks uncovered, to the shame of Mitzrayim [Egypt - The Narrow Place]."
Isaiah,20,5,"And they shall be afraid and ashamed of Ethiopia [Kush] their expectation, and of Mitzrayim [Egypt - The Narrow Place] their glory."
Isaiah,20,6,"And the inhabitant of this isle shall say in that day, Behold, such [is] our expectation, to which we flee for help to be delivered from the king of Ashur [the level plain] (the land of the sons of Shem (name, renown (great reputation; being well-known))) : and how shall we escape?"
Isaiah,21,1,"The burden of the desert of the sea. As whirlwinds in the south pass through; [so] it comes from the desert, from a terrible land."
