Job,9,35," [Then] would I speak, and not fear him; but [it is] not so with me."
Job,10,1,My soul is weary of my life; I will leave my complaint upon myself; I will speak in the bitterness of my soul.
Job,10,2,"I will say unto God-Elōhīm (The Living Word) [The Many Powered] , Do not condemn me; show me wherefore you i contend with me."
Job,10,3," [Is it] good unto you i that you i should oppress, that you i should despise the work of you i hands, and shine upon the counsel of the wicked?"
Job,10,4,Have you i eyes of flesh? or see you i as man sees?
Job,10,5," [Are] you i days as the days of man? [are] you i years as man’s days,"
Job,10,6,"That you i enquire after my iniquity, and search after my sin?"
Job,10,7,you i know that I am not wicked; and [there is] none that can deliver out of you i hand.
Job,10,8,Your 1s hands have made me and fashioned me together round about; yet you i do destroy me.
Job,10,9,"Remember, I beseech (to call upon; appeal; beg) you i , that you i have made me as the clay; and will you i bring me into dust again?"
Job,10,10,"Have you i not poured me out as milk, and curdled me like cheese?"
Job,10,11,"you i have clothed me with skin and flesh, and have fenced me with bones and sinews."
Job,10,12,"you i have granted me life and favour, and you i visitation has preserved my spirit."
Job,10,13,And these [things] have you i hid in you i heart: I know that this [is] with you i.
Job,10,14,"If I sin, then you i mark me, and you i will not acquit me from my iniquity."
Job,10,15,"If I be wicked, woe unto me; and [if] I be righteous, [yet] will I not lift up my head. [I am] full of confusion; therefore see you i my affliction;"
Job,10,16,For it increases. you i hunt me as a fierce lion: and again you i show yourself marvelous upon me.
Job,10,17,"you i renew your i witnesses against me, and increase your i indignation upon me; changes and war [are] against me."
Job,10,18,"For what reason then have you i brought me forth out of the womb? Oh that I had given up the ghost, and no eye had seen me!"
Job,10,19,I should have been as though I had not been; I should have been carried from the womb to the grave.
Job,10,20," [Are] not my days few? cease [then, and] let me alone, that I may take comfort a little,"
Job,10,21,"Before I go [from what place] I shall not return, [even] to the land of darkness and the shadow of death;"
Job,10,22,"A land of darkness, as darkness [itself; and] of the shadow of death, without any order, and [where] the light [is] as darkness."
Job,11,1,"Then answered Tzofar [sparrow] the Na’amti [pleasantness] , and said,"
Job,11,2,Should not the multitude of words be answered? and should a man full of talk be justified?
Job,11,3,"Should you i lies make men hold their peace? and when you i mock, shall no man make you i ashamed?"
Job,11,4,"For you i have said, My doctrine [is] pure, and I am clean in you i eyes."
Job,11,5,"But oh that God-Elōhīm (The Living Word) [The Many Powered] would speak, and open his lips against you i;"
Job,11,6,"And that he would show you i the secrets of wisdom, that [they are] double to that which is! Know therefore that God-Elōhīm (The Living Word) [The Many Powered] exacts of you i [less] than your i iniquity [deserves]."
Job,11,7,Can you i by searching find out God-Elōhīm (The Living Word) [The Many Powered] ? can you i find out the Almighty’s limits?
Job,11,8, [It is] as high as heaven; what can you i do? deeper than hell; what can you i know?
Job,11,9,"The measure thereof [is] longer than the earth, and broader than the sea."
Job,11,10,"If he cut off, and shut up, or gather together, then who can hinder him?"
Job,11,11,For he knows vain men: he sees wickedness also; will he not then consider [it]?
Job,11,12,"For vain man would be wise, though man be born [like] a wild ass’s colt."
Job,11,13,"If you i prepare you i heart, and stretch out you i hands toward him;"
Job,11,14,"If iniquity [be] in you i hand, put it far away, and let not wickedness dwell in you i tabernacles."
Job,11,15,"For then shall you i lift up you i face without spot; yes, you i shall be steadfast, and shall not fear:"
Job,11,16,"Because you i shall forget [you i ] misery, [and] remember [it] as waters [that] pass away:"
Job,11,17,"And [you i ] age shall be clearer than the noonday; you i shall shine forth, you i shall be as the morning."
Job,11,18,"And you i shall be secure, because there is hope; yes, you i shall dig [about you i , and] you i shall take you i rest in safety."
Job,11,19,"Also you i shall lie down, and none shall make [you i ] afraid; yes, many shall make suit unto you i."
Job,11,20,"But the eyes of the wicked shall fail, and they shall not escape, and their hope [shall be as] the giving up of the ghost."
Job,12,1,"And Iyov [hated] answered and said,"
Job,12,2,"No doubt but you 2f [are] the people, and wisdom shall die with you."
Job,12,3,"But I have understanding as well as you; I [am] not inferior to you: yes, who knows not such things as these?"
Job,12,4,"I am [as] one mocked of his neighbour, who calls upon God-Elōhīm (The Living Word) [The Many Powered] , and he answer him: the just upright [man is] laughed to scorn."
Job,12,5,He that is ready to slip with [his] feet [is as] a lamp despised in the thought of him that is at ease.
Job,12,6,"The tabernacles of robbers prosper, and they that provoke God-Elōhīm (The Living Word) [The Many Powered] are secure; into whose hand God-Elōhīm (The Living Word) [The Many Powered] brings [abundantly]."
Job,12,7,"But ask now the beasts, and they shall teach you i ; and the fowls of the air, and they shall tell you i:"
Job,12,8,"Or speak to the earth, and it shall teach you i : and the fishes of the sea shall declare unto you i."
Job,12,9,Who knows not in all these that the hand of the Lord-Yehōvah (Messiah Pre-Incarnate) has wrought this?
Job,12,10,"In whose hand [is] the soul of every living thing, and the breath of all mankind."
Job,12,11,Does not the ear try words? and the mouth taste his meat?
Job,12,12,With the ancient [is] wisdom; and in length of days understanding.
Job,12,13,"With him [is] wisdom and strength, he has counsel and understanding."
Job,12,14,"Behold, he breaks down, and it cannot be built again: he shuts up a man, and there can be no opening."
Job,12,15,"Behold, he withholds the waters, and they dry up: also he send them out, and they overturn the earth."
Job,12,16,With him [is] strength and wisdom: the deceived and the deceiver [are] his.
Job,12,17,"He leads counselors away spoiled, and makes the fools."
Job,12,18,"He looses the bond of kings, and put on their waist with a belt."
Job,12,19,"He leads princes away spoiled, and overthrows the mighty."
Job,12,20,"He removes away the speech of the trusty, and takes away the understanding of the aged."
Job,12,21,"He pours contempt upon princes, and weakens the strength of the mighty."
Job,12,22,"He discovers deep things out of darkness, and brings out to light the shadow of death."
Job,12,23,"He increases the nations, and destroys them: he enlarges the nations, and straitens them [again]."
Job,12,24,"He takes away the heart of the chief of the people of the earth, and causes them to wander in a wilderness [where there is] no way."
Job,12,25,"They grope in the dark without light, and he makes them to stagger like [a] drunken [man]."
Job,13,1,"Lo, my eye has seen all [this] , my ear has heard and understood it."
Job,13,2,"What you 2f know, [the same] do I know also: I [am] not inferior unto you."
Job,13,3,"Surely I would speak to the Almighty, and I desire to reason with God-Elōhīm (The Living Word) [The Many Powered]."
Job,13,4,"But you 2f [are] forgers of lies, you 2f [are] all physicians of no value."
Job,13,5,O that you 2f would altogether hold your peace! and it should be your wisdom.
Job,13,6,"Hear now my reasoning, and hearken to the pleadings of my lips."
Job,13,7,Will you 2f speak wickedly for God-Elōhīm (The Living Word) [The Many Powered] ? and talk deceitfully for him?
Job,13,8,Will you 2f accept his person? will you 2f contend for God-El [The Powerful Living Word]?
Job,13,9,"Is it good that he should search you out? or as one man mocks another, do you 2f [so] mock him?"
Job,13,10,"He will surely reprove you, if you 2f do secretly accept persons."
Job,13,11,Shall not his excellency make you afraid? and his dread fall upon you?
Job,13,12,"Your remembrances [are] like unto ashes, your bodies to bodies of clay."
Job,13,13,"Hold your peace, let me alone, that I may speak, and let come on me what [will]."
Job,13,14,"For what reason do I take my flesh in my teeth, and put my life in my hand?"
Job,13,15,"Though he slay me, yet will I trust in him: but I will maintain my own ways before him."
Job,13,16,He also [shall be] my salvation: for an hypocrite shall not come before him.
Job,13,17,"Hear diligently my speech, and my declaration with your ears."
Job,13,18,"Behold now, I have ordered [my] cause; I know that I shall be justified."
Job,13,19,"Who [is] he [that] will plead with me? for now, if I hold my tongue, I shall give up the ghost."
Job,13,20,Only do not two [things] unto me: then will I not hide myself from you i.
Job,13,21,Withdraw you i hand far from me: and let not you i dread make me afraid.
Job,13,22,"Then call you i , and I will answer: or let me speak, and answer you i me."
Job,13,23,How many [are] my iniquities and sins? make me to know my transgression and my sin.
Job,13,24,"For what reason hide you i your i face, and hold me for you i enemy?"
Job,13,25,Will you i break a leaf driven to and fro? and will you i pursue the dry stubble?
Job,13,26,"For you i write bitter things against me, and makes me to possess the iniquities of my youth."
Job,13,27,"you i put my feet also in the stocks, and look narrowly unto all my paths; you i set a print upon the heels of my feet."
Job,13,28,"And he, as a rotten thing, consumes, as a garment that is moth eaten."
Job,14,1,"Man [that is] born of a woman [is] of few days, and full of trouble."
Job,14,2,"He comes forth like a flower, and is cut down: he flees also as a shadow, and continue not."
Job,14,3,"And do you i open you i eyes upon such an one, and brings me into judgment with you i?"
Job,14,4,Who can bring a clean [thing] out of an unclean? not one.
Job,14,5,"Seeing his days [are] determined, the number of his months [are] with you i , you i have appointed his bounds that he cannot pass;"
Job,14,6,"Turn from him, that he may rest, till he shall accomplish, as an employee (hired laborer) , his day."
Job,14,7,"For there is hope of a tree, if it be cut down, that it will sprout again, and that the tender branch thereof will not cease."
Job,14,8,"Though the root thereof grow (become; advance) old in the earth, and the stock thereof die in the ground;"
Job,14,9," [Yet] through the scent of water it will bud, and bring forth boughs like a plant."
Job,14,10,"But man dies, and wastes away: yes, man gives up the ghost, and where [is] he?"
Job,14,11," [As] the waters fail from the sea, and the flood decays and dries up:"
Job,14,12,"So man lies down, and rises not: till the heavens [be] no more, they shall not awake, nor be raised out of their sleep."
Job,14,13,"O that you i would hide me in the grave, that you i would keep me secret, until you i wrath be past, that you i would appoint me a set time, and remember me!"
Job,14,14,"If a man die, shall he live [again] ? all the days of my appointed time will I wait, till my change come."
Job,14,15,"you i shall call, and I will answer you i : you i will have a desire to the work of you i hands."
Job,14,16,For now you i my steps: do you i not watch over my sin?
Job,14,17,"My transgression [is] sealed up in a bag, and you i sews up my iniquity."
Job,14,18,"And surely the mountain falling comes to nothing, and the rock is removed out of his place."
Job,14,19,The waters wear the stones: you i washes away the things which grow [out] of the dust of the earth; and you i destroy the hope of man.
Job,14,20,"you i prevail forever against him, and he passes: you i change his Countenance (Face, appearance; show favor), and send him away."
Job,14,21,"His sons come to honour, and he knows [it] not; and they are brought low, but he perceives [it] not of them."
Job,14,22,"But his flesh upon him shall have pain, and his soul within him shall mourn."
Job,15,1,"Then answered Elifaz [my God is (fine) gold] the Temani [southward] , and said,"
Job,15,2,"Should a wise man utter vain knowledge, and fill his belly with the east wind?"
Job,15,3,Should he reason with unprofitable talk? or with speeches which he can do no good?
Job,15,4,"Yes, you i cast off fear, and restraints prayer before God-Elōhīm (The Living Word) [The Many Powered]."
Job,15,5,"For your i mouth utters your i iniquity, and you i choose the tongue of the crafty."
Job,15,6,"Your 1s own mouth condemns you i , and not I: yes, your i own lips testify against you i."
Job,15,7, [Are] you i the first man [that] was born? or were you i made before the hills?
Job,15,8,Have you i heard the secret of God-Elōhīm (The Living Word) [The Many Powered] ? and do you i restrain wisdom to yourself?
Job,15,9,"What know you i , that we know not? [what] understand you i , which [is] not in us?"
Job,15,10,"With us [are] both the grayheaded and very aged men, much elder than you i father."
Job,15,11, [Are] the consolations of God-Elōhīm (The Living Word) [The Many Powered] small with you i ? is there any secret thing with you i?
Job,15,12,"Why does you i heart carry you i away? and what do you i eyes wink at,"
Job,15,13,"That you i turn your i spirit against God-Elōhīm (The Living Word) [The Many Powered] , and let [such] words go out of your i mouth?"
Job,15,14,"What [is] man, that he should be clean? and [he which is] born of a woman, that he should be righteous?"
Job,15,15,"Behold, he puts no trust in his saints; yes, the heavens are not clean in his sight."
Job,15,16,"How much more abominable and filthy [is] man, which drink iniquity like water?"
Job,15,17,"I will show you i , hear me; and that [which] I have seen I will declare;"
Job,15,18,"Which wise men have told from their fathers, and have not hid [it]:"
Job,15,19,"Unto whom alone the earth was given, and no stranger passed among them."
Job,15,20,"The wicked man travails with pain all [his] days, and the number of years is hidden to the oppressor."
Job,15,21,A dreadful sound [is] in his ears: in prosperity the destroyer shall come upon him.
Job,15,22,"He believeth not that he shall return out of darkness, and he is waited for of the sword."
Job,15,23,"He wanders abroad for bread, [saying] , Where [is it] ? he knows that the day of darkness is ready at his hand."
Job,15,24,"Trouble and anguish shall make him afraid; they shall prevail against him, as a king ready to the battle."
Job,15,25,"For he stretches out his hand against God-Elōhīm (The Living Word) [The Many Powered] , and strengthens himself against the Almighty."
Job,15,26,"He runs upon him, [even] on [his] neck, upon the thick bosses (bump-like shapes on a shield) of his bucklers:"
Job,15,27,"Because he covers his face with his fatness, and makes blubber of fat on [his] flanks."
Job,15,28,"And he dwells in desolate cities, [and] in houses which no man inhabits, which are ready to become heaps."
Job,15,29,"He shall not be rich, neither shall his substance continue, neither shall he prolong the perfection thereof upon the earth."
Job,15,30,"He shall not depart out of darkness; the flame shall dry up his branches, and by the breath of his mouth shall he go away."
Job,15,31,Let not him that is deceived trust in vanity: for vanity shall be his recompense.
Job,15,32,"It shall be accomplished before his time, and his branch shall not be green."
Job,15,33,"He shall shake off his unripe grape as the vine, and shall cast off his flower as the olive."
Job,15,34,"For the congregation of hypocrites [shall be] desolate, and fire shall consume the tabernacles of bribery."
Job,15,35,"They conceive mischief, and bring forth vanity, and their belly prepares deceit."
Job,16,1,"Then Iyov [hated] answered and said,"
Job,16,2,I have heard many such things: miserable comforters [are] you 2f all.
Job,16,3,Shall vain words have an end? or what emboldens you i that you i answer?
Job,16,4,"I also could speak as you 2f [do] : if your soul were in my soul’s stead, I could heap up words against you, and shake my head at you."
Job,16,5," [But] I would strengthen you with my mouth, and the moving of my lips should assuage [your grief]."
Job,16,6,"Though I speak, my grief is not assuaged: and [though] I refrain (restrain; refrein from acting) , what am I eased?"
Job,16,7,But now he has made me weary: you i have made desolate all my company.
Job,16,8,"And you i have filled me with wrinkles, [which] is a witness [against me] : and my leanness rising up in me bears witness to my face."
Job,16,9,"He tears [me] in his wrath, who hates me: he gnashes upon me with his teeth; my enemy sharpens his eyes upon me."
Job,16,10,They have gaped upon me with their mouth; they have smitten me upon the cheek reproachfully; they have gathered themselves together against me.
Job,16,11,"God-Elōhīm (The Living Word) [The Many Powered] has delivered me to the ungodly, and turned me over into the hands of the wicked."
Job,16,12,"I was at ease, but he has broken me asunder: he has also taken [me] by my neck, and shaken me to pieces, and set me up for his mark."
Job,16,13,"His archers compass (go around, encircle; encompass) me round about, he cleaves my reins (literally, kidneys; figuratively, seat of emotion) asunder, and does not spare; he pours out my gall (something bitter or poisonous) upon the ground."
Job,16,14,"He breaks me with breach (breaking forth; a break; opening, inlet) upon breach (breaking forth; a break; opening, inlet), he runs upon me like a giant."
Job,16,15,"I have sewed sackcloth upon my skin, and defiled my horn in the dust."
Job,16,16,"My face is foul with weeping, and on my eyelids [is] the shadow of death;"
Job,16,17,Not for [any] injustice in my hands: also my prayer [is] pure.
Job,16,18,"O earth, cover not you i my blood, and let my cry have no place."
Job,16,19,"Also now, behold, my witness [is] in heaven, and my record [is] on high."
Job,16,20,My friends scorn me: [but] my eye pours out [tears] unto God-Elōhīm (The Living Word) [The Many Powered].
Job,16,21,"O that one might plead for a man with God-Elōhīm (The Living Word) [The Many Powered] , as a man [pleads] for his neighbour!"
Job,16,22,"When a few years are come, then I shall go the way [from what place] I shall not return."
Job,17,1,"My breath is corrupt, my days are extinct, the graves [are ready] for me."
Job,17,2, [Are there] not mockers with me? and does not my eye continue in their provocation?
Job,17,3,"Lay down now, put me in a surety with you i ; who [is] he [that] will strike hands with me?"
Job,17,4,For you i have hid their heart from understanding: therefore shall you i not exalt [them].
Job,17,5,"He that speaks flattery to [his] friends, even the eyes of his children shall fail."
Job,17,6,He has made me also a byword of the people; and aforetime I was as a tambourine.
Job,17,7,"Mine eye also is dim by reason of sorrow, and all my members [are] as a shadow."
Job,17,8,"Upright [men] shall be astonished at this, and the innocent shall stir up himself against the hypocrite."
Job,17,9,"The righteous also shall hold on his way, and he that has clean hands shall be stronger and stronger."
Job,17,10,"But as for you all, do you 2f return, and come now: for I cannot find [one] wise [man] among you."
Job,17,11,"My days are past, my purposes are broken off, [even] the thoughts of my heart."
Job,17,12,They change the night into day: the light [is] short because of darkness.
Job,17,13,"If I wait, the grave [is] my house: I have made my bed in the darkness."
Job,17,14,"I have said to corruption, you i [are] my father: to the worm, [you i are] my mother, and my sister."
Job,17,15,"And where [is] now my hope? as for my hope, who shall see it?"
Job,17,16,"They shall go down to the bars of the pit, when [our] rest together [is] in the dust."
Job,18,1,"Then answered Bildad [confusing by mingling love] the Shuchi [wealth] , and said,"
Job,18,2,"How long [will it be before] you 2f make an end of words? mark, and afterwards we will speak."
Job,18,3,"For what reason are we counted as beasts, [and] reputed vile in your sight?"
Job,18,4,He tears himself in his anger: shall the earth be forsaken for you i ? and shall the rock be removed out of his place?
Job,18,5,"Yes, the light of the wicked shall be put out, and the spark of his fire shall not shine."
Job,18,6,"The light shall be dark in his tabernacle, and his candle shall be put out with him."
Job,18,7,"The steps of his strength shall be straightened, and his own counsel shall cast him down."
Job,18,8,"For he is cast into a net by his own feet, and he walks upon a snare."
Job,18,9,"The trap shall take [him] by the heel, [and] the robber shall prevail against him."
Job,18,10,"The snare [is] laid for him in the ground, and a trap for him in the way."
Job,18,11,"Terrors shall make him afraid on every side, and shall drive him to his feet."
Job,18,12,"His strength shall be hungerbitten, and destruction [shall be] ready at his side."
Job,18,13,It shall devour the strength of his skin: [even] the firstborn of death shall devour his strength.
Job,18,14,"His confidence shall be rooted out of his tabernacle, and it shall bring him to the king of terrors."
Job,18,15,"It shall dwell in his tabernacle, because [it is] none of his: sulfur shall be scattered upon his habitation."
Job,18,16,"His roots shall be dried up beneath, and above shall his branch be cut off."
Job,18,17,"His remembrance shall perish from the earth, and he shall have no name in the street."
Job,18,18,"He shall be driven from light into darkness, and chased out of the world."
Job,18,19,"He shall neither have son nor nephew among his people, nor any remaining in his dwellings."
Job,18,20,"They that come after [him] shall be astonished at his day, as they that went before were affrighted."
Job,18,21,"Surely such [are] the dwellings of the wicked, and this [is] the place [of him that] knows not God-Elōhīm (The Living Word) [The Many Powered]."
Job,19,1,"Then Iyov [hated] answered and said,"
Job,19,2,"How long will you 2f vex my soul, and break me in pieces with words?"
Job,19,3,These ten times have you 2f reproached me: you 2f are not ashamed [that] you 2f make yourselves strange to me.
Job,19,4,"And be it indeed [that] I have erred, my error remains with myself."
Job,19,5,"If indeed you 2f will magnify [yourselves] against me, and plead against me my reproach (disgrace; shame):"
Job,19,6,"Know now that God-Elōhīm (The Living Word) [The Many Powered] has overthrown me, and has compassed me with his net."
Job,19,7,"Behold, I cry out of wrong, but I am not heard: I cry aloud, but [there is] no judgment."
Job,19,8,"He has fenced up my way that I cannot pass, and he has set darkness in my paths."
Job,19,9,"He has stripped me of my glory, and taken the crown [from] my head."
Job,19,10,"He has destroyed me on every side, and I am gone: and my hope has he removed like a tree."
Job,19,11,"He has also kindled his wrath against me, and he counts me unto him as [one of] his enemies."
Job,19,12,"His troops come together, and raise up their way against me, and encamp round about my tabernacle."
Job,19,13,"He has put my brethren far from me, and my acquaintance are truly estranged from me."
Job,19,14,"My kinsfolk have failed, and my familiar friends have forgotten me."
Job,19,15,"They that dwell in my house, and my maids, count me for a stranger: I am an alien in their sight."
Job,19,16,"I called my servant, and he gave [me] no answer; I entreated him with my mouth."
Job,19,17,"My breath is strange to my wife, though I entreated for the children’s [sake] of my own body."
Job,19,18,"Yes, young children despised me; I arose, and they spoke against me."
Job,19,19,All my inward friends abhorred me: and they whom I loved are turned against me.
Job,19,20,"My bone cleaves to my skin and to my flesh, and I am escaped with the skin of my teeth."
Job,19,21,"Have pity upon me, have pity upon me, O you 2f my friends; for the hand of God-Elōhīm (The Living Word) [The Many Powered] has touched me."
Job,19,22,"Why do you 2f persecute me as God-Elōhīm (The Living Word) [The Many Powered] , and are not satisfied with my flesh?"
Job,19,23,Oh that my words were now written! oh that they were printed in a book!
Job,19,24,That they were graven with an iron pen and lead in the rock forever!
Job,19,25,"For I know [that] my redeemer lives, and [that] he shall stand at the latter [day] upon the earth:"
Job,19,26,"And [though] after my skin [worms] destroy this [body] , yet in my flesh shall I see God-Elōhīm (The Living Word) [The Many Powered]:"
Job,19,27,"Whom I shall see for myself, and my eyes shall behold, and not another; [though] my reins (literally, kidneys; figuratively, seat of emotion) be consumed within me."
Job,19,28,"But you 2f should say, Why persecute we him, seeing the root of the matter is found in me?"
Job,19,29,"Be you 2f afraid of the sword: for wrath [brings] the punishments of the sword, that you 2f may know [there is] a judgment."
Job,20,1,"Then answered Tzofar [sparrow] the Na’amti [pleasantness] , and said,"
Job,20,2,"Therefore do my thoughts cause me to answer, and for [this] I make haste."
Job,20,3,"I have heard the rebuke (reprimand; strongly warn; restrain) of my reproach (disgrace; shame) , and the spirit of my understanding causes me to answer."
Job,20,4,"Know you i [not] this of old, since man was placed upon earth,"
Job,20,5,"That the triumphing of the wicked [is] short, and the joy of the hypocrite [but] for a moment?"
Job,20,6,"Though his excellency mount up to the heavens, and his head reach unto the clouds;"
