Job,20,7," [Yet] he shall perish forever like his own dung: they which have seen him shall say, Where [is] he?"
Job,20,8,"He shall fly away as a dream, and shall not be found: yes, he shall be chased away as a vision of the night."
Job,20,9,The eye also [which] saw him shall [see him] no more; neither shall his place any more behold him.
Job,20,10,"His children shall seek to please the poor, and his hands shall restore their goods."
Job,20,11,"His bones are full [of the sin] of his youth, which shall lie down with him in the dust."
Job,20,12,"Though wickedness be sweet in his mouth, [though] he hide it under his tongue;"
Job,20,13," [Though] he spare it, and forsake it not; but keep it still within his mouth:"
Job,20,14," [Yet] his meat in his bowels (inward parts; affections) is turned, [it is] the gall (something bitter or poisonous) of asps within him."
Job,20,15,"He has swallow (to approve, commend, accept)ed down riches, and he shall vomit them up again: God-Elōhīm (The Living Word) [The Many Powered] shall cast them out of his belly."
Job,20,16,He shall suck the poison of asps: the viper’s tongue shall slay him.
Job,20,17,"He shall not see the rivers, the floods, the brooks of honey and butter."
Job,20,18,"That which he laboured for shall he restore, and shall not swallow (to approve, commend, accept) [it] down: according to [his] substance [shall] the restitution [be] , and he shall not rejoice [in it]."
Job,20,19,Because he has oppressed [and] has forsaken the poor; [because] he has violently taken away an house which he built not;
Job,20,20,"Surely he shall not feel quietness in his belly, he shall not save of that which he desired."
Job,20,21,There shall none of his meat be left; therefore shall no man look for his goods.
Job,20,22,In the fullness of his sufficiency he shall be in straits: every hand of the wicked shall come upon him.
Job,20,23," [When] he is about to fill his belly, [God-Elōhīm (The Living Word) [The Many Powered] ] shall cast the fury of his wrath upon him, and shall rain [it] upon him while he is eating."
Job,20,24,"He shall flee from the iron weapon, [and] the bow of steel shall strike him through."
Job,20,25,"It is drawn, and comes out of the body; yes, the glittering sword comes out of his gall (something bitter or poisonous) : terrors [are] upon him."
Job,20,26,All darkness [shall be] hid in his secret places: a fire not blown shall consume him; it shall go ill with him that is left in his tabernacle.
Job,20,27,The heaven shall reveal his iniquity; and the earth shall rise up against him.
Job,20,28,"The increase of his house shall depart, [and his goods] shall flow away in the day of his wrath."
Job,20,29,"This [is] the portion of a wicked man from God-Elōhīm (The Living Word) [The Many Powered] , and the heritage appointed unto him by God-Elōhīm (The Living Word) [The Many Powered]."
Job,21,1,"But Iyov [hated] answered and said,"
Job,21,2,"Hear diligently my speech, and let this be your consolations."
Job,21,3,"Suffer me that I may speak; and after that I have spoken, mock on."
Job,21,4,"As for me, [is] my complaint to man? and if [it were so] , why should not my spirit be troubled?"
Job,21,5,"Mark me, and be astonished, and lay [your] hand upon [your] mouth."
Job,21,6,"Even when I remember I am afraid, and trembling takes hold on my flesh."
Job,21,7,"For what reason do the wicked live, become old, yes, are mighty in power?"
Job,21,8,"Their seed is established in their sight with them, and their offspring before their eyes."
Job,21,9,"Their houses [are] safe from fear, neither [is] the rod of God-Elōhīm (The Living Word) [The Many Powered] upon them."
Job,21,10,"Their bulls are fertile, and fail not; their cow calve, and casts not her calf."
Job,21,11,"They send forth their little ones like a flock, and their children dance."
Job,21,12,"They take the timbrel and harp, and rejoice at the sound of the organ."
Job,21,13,"They spend their days in wealth, and in a moment go down to the grave."
Job,21,14,"Therefore they say unto God-El [The Powerful Living Word] , Depart from us; for we desire not the knowledge of you i ways."
Job,21,15,"What [is] the Almighty, that we should serve him? and what profit should we have, if we pray unto him?"
Job,21,16,"Lo, their good [is] not in their hand: the counsel of the wicked is far from me."
Job,21,17,How oft is the candle of the wicked put out! and [how oft] comes their destruction upon them! [God-Elōhīm (The Living Word) [The Many Powered] ] distributes sorrows in his anger.
Job,21,18,"They are as stubble before the wind, and as chaff that the storm carries away."
Job,21,19,"God-Elōhīm (The Living Word) [The Many Powered] lays up his iniquity for his children: he rewards him, and he shall know [it]."
Job,21,20,"His eyes shall see his destruction, and he shall drink of the wrath of the Almighty."
Job,21,21,"For what pleasure [has] he in his house after him, when the number of his months is cut off in the midst?"
Job,21,22,Shall [any] teach God-Elōhīm (The Living Word) [The Many Powered] knowledge? seeing he those that are high.
Job,21,23,"One dies in his full strength, being wholly at ease and quiet."
Job,21,24,"His breasts are full of milk, and his bones are moistened with marrow."
Job,21,25,"And another dies in the bitterness of his soul, and never eats with pleasure."
Job,21,26,"They shall lie down alike in the dust, and the worms shall cover them."
Job,21,27,"Behold, I know your thoughts, and the devices [which] you 2f wrongfully imagine against me."
Job,21,28,"For you 2f say, Where [is] the house of the prince? and where [are] the dwelling places of the wicked?"
Job,21,29,"Have you 2f not asked them that go by the way? and do you 2f not know their tokens,"
Job,21,30,That the wicked is reserved to the day of destruction? they shall be brought forth to the day of wrath.
Job,21,31,Who shall declare his way to his face? and who shall repay him [what] he has done?
Job,21,32,"Yet shall he be brought to the grave, and shall remain in the tomb."
Job,21,33,"The clods of the valley shall be sweet unto him, and every man shall draw after him, as [there are] innumerable before him."
Job,21,34,"How then comfort you 2f me in vain, seeing in your answers there remains falsehood?"
Job,22,1,"Then Elifaz [my God is (fine) gold] the Temani [southward] answered and said,"
Job,22,2,"Can a man be profitable unto God-Elōhīm (The Living Word) [The Many Powered] , as he that is wise may be profitable unto himself?"
Job,22,3," [Is it] any pleasure to the Almighty, that you i are righteous? or [is it] gain [to him] , that you i makes you i ways perfect?"
Job,22,4,Will he reprove you i for fear of you i ? will he enter with you i into judgment?
Job,22,5, [Is] not you i wickedness great? and you i iniquities infinite?
Job,22,6,"For you i have taken a pledge from you i brother for nothing, and stripped the naked of their clothing."
Job,22,7,"you i have not given water to the weary to drink, and you i have withheld bread from the hungry."
Job,22,8,"But [as for] the mighty man, he had the earth; and the honourable man dwelt in it."
Job,22,9,"you i have sent widows away empty, and the arms of the fatherless have been broken."
Job,22,10,"Therefore snares [are] round about you i , and sudden fear troubles you i;"
Job,22,11,"Or darkness, [that] you i cannot see; and abundance of waters cover you i."
Job,22,12," [Is] not God-Elōhīm (The Living Word) [The Many Powered] in the height of heaven? and behold the height of the stars, how high they are!"
Job,22,13,"And you i say, How does God-Elōhīm (The Living Word) [The Many Powered] know? can he judge through the dark cloud?"
Job,22,14,"Thick clouds [are] a covering to him, that he sees not; and he walks in the circuit of heaven."
Job,22,15,Have you i marked the old way which wicked men have trampled?
Job,22,16,"Which were cut down out of time, whose foundation was overflown with a flood:"
Job,22,17,"Which said unto God-El [The Powerful Living Word] , Depart from us: and what can the Almighty do for them?"
Job,22,18,Yet he filled their houses with good [things] : but the counsel of the wicked is far from me.
Job,22,19,"The righteous see [it] , and are glad: and the innocent laugh them to scorn."
Job,22,20,"Whereas our substance is not cut down, but the remnant of them the fire consumes."
Job,22,21,"Acquaint now yourself with him, and be at peace: thereby good shall come unto you i."
Job,22,22,"Receive, I pray you i , the law from his mouth, and lay up his words in you i heart."
Job,22,23,"If you i return to the Almighty, you i shall be built up, you i shall put away iniquity far from you i tabernacles."
Job,22,24,"Then shall you i lay up gold as dust, and the [gold] of Ofir [reducing to ashes] as the stones of the brooks."
Job,22,25,"Yes, the Almighty shall be you i defense, and you i shall have plenty of silver."
Job,22,26,"For then shall you i have you i delight in the Almighty, and shall lift up you i face unto God-Elōhīm (The Living Word) [The Many Powered]."
Job,22,27,"you i shall make you i prayer unto him, and he shall hear you i , and you i shall pay you i vows."
Job,22,28,"you i shall also decree a thing, and it shall be established unto you i : and the light shall shine upon you i ways."
Job,22,29,"When [men] are cast down, then you i shall say, [There is] lifting up; and he shall save the humble person."
Job,22,30,He shall deliver the island of the innocent: and it is delivered by the pureness of you i hands.
Job,23,1,"Then Iyov [hated] answered and said,"
Job,23,2,Even today [is] my complaint bitter: my stroke is heavier than my groaning.
Job,23,3,Oh that I knew where I might find him! [that] I might come [even] to his seat!
Job,23,4,"I would order [my] cause before him, and fill my mouth with arguments."
Job,23,5,"I would know the words [which] he would answer me, and understand what he would say unto me."
Job,23,6,Will he plead against me with [his] great power? No; but he would put [strength] in me.
Job,23,7,There the righteous might dispute with him; so should I be delivered forever from my judge.
Job,23,8,"Behold, I go forward, but he [is] not [there] ; and backward, but I cannot perceive him:"
Job,23,9,"On the left hand, where he does work, but I cannot behold [him] : he hides himself on the right hand, that I cannot see [him]:"
Job,23,10,"But he knows the way that I take: [when] he has tried me, I shall come forth as gold."
Job,23,11,"My foot has held his steps, his way have I kept, and not declined."
Job,23,12,Neither have I gone back from the commandment of his lips; I have esteemed the words of his mouth more than my necessary [food].
Job,23,13,"But he [is] in one [mind] , and who can turn him? and [what] his soul desires, even [that] he does."
Job,23,14,For he performs [the thing that is] appointed for me: and many such [things are] with him.
Job,23,15,"Therefore am I troubled at his presence: when I consider, I am afraid of him."
Job,23,16,"For God-Elōhīm (The Living Word) [The Many Powered] makes my heart soft, and the Almighty troubles me:"
Job,23,17,"Because I was not cut off before the darkness, [neither] has he covered the darkness from my face."
Job,24,1,"Why, seeing times are not hidden from the Almighty, do they that know him not see his days?"
Job,24,2," [Some] remove the landmarks; they violently take away flocks, and feed [thereof]."
Job,24,3,"They drive away the ass of the fatherless, they take the widow’s ox for a pledge."
Job,24,4,They turn the needy out of the way: the poor of the earth hide themselves together.
Job,24,5,"Behold, [as] wild asses in the desert, go they forth to their work; rising early for a prey: the wilderness [yields] food for them [and] for [their] children."
Job,24,6,They reap [every one] his corn in the field: and they gather the vintage of the wicked.
Job,24,7,"They cause the naked to lodge without clothing, that [they have] no covering in the cold."
Job,24,8,"They are wet with the showers of the mountains, and embrace the rock for lack of a shelter."
Job,24,9,"They pluck the fatherless from the breast, and take a pledge of the poor."
Job,24,10,"They cause [him] to go naked without clothing, and they take away the sheaf [from] the hungry;"
Job,24,11," [Which] make oil within their walls, [and] trample [their] winepresses, and suffer thirst."
Job,24,12,"Men groan from out of the city, and the soul of the wounded cries out: yet God-Elōhīm (The Living Word) [The Many Powered] lays not folly [to them]."
Job,24,13,"They are of those that rebel against the light; they know not the ways thereof, nor abide in the paths thereof."
Job,24,14,"The murderer rising with the light kills the poor and needy, and in the night is as a thief."
Job,24,15,"The eye also of the adulterer waits for the twilight, saying, No eye shall see me: and disguises [his] face."
Job,24,16,"In the dark they dig through houses, [which] they had marked for themselves in the daytime: they know not the light."
Job,24,17,"For the morning [is] to them even as the shadow of death: if [one] know [them, they are in] the terrors of the shadow of death."
Job,24,18,He [is] swift as the waters; their portion is cursed in the earth: he beholds not the way of the vineyards.
Job,24,19,Drought and heat consume the snow waters: [so does] the grave [those which] have sinned.
Job,24,20,The womb shall forget him; the worm shall feed sweetly on him; he shall be no more remembered; and wickedness shall be broken as a tree.
Job,24,21,He evil entreats the barren [that] bears not: and does not good to the widow.
Job,24,22,"He draws also the mighty with his power: he rises up, and no [man] is sure of life."
Job,24,23," [Though] it be given him [to be] in safety, whereon he rests; yet his eyes [are] upon their ways."
Job,24,24,"They are exalted for a little while, but are gone and brought low; they are taken out of the way as all [other] , and cut off as the tops of the ears of corn."
Job,24,25,"And if [it be] not [so] now, who will make me a liar, and make my speech nothing worth?"
Job,25,1,"Then answered Bildad [confusing by mingling love] the Shuchi [wealth] , and said,"
Job,25,2,"Dominion and fear [are] with him, he makes peace in his high places."
Job,25,3,Is there any number of his armies? and upon whom does not his light arise?
Job,25,4,How then can man be justified with God-Elōhīm (The Living Word) [The Many Powered] ? or how can he be clean [that is] born of a woman?
Job,25,5,"Behold even to the moon, and it shines not; yes, the stars are not pure in his sight."
Job,25,6,"How much less man, [that is] a worm? and the Son of man, [which is] a worm?"
Job,26,1,"But Job answered and said,"
Job,26,2,How have you i helped [him that is] without power? [how] save you i the arm [that has] no strength?
Job,26,3,How have you i counseled [him that has] no wisdom? and [how] have you i plentifully declared the thing as it is?
Job,26,4,To whom have you i uttered words? and whose spirit came from you i?
Job,26,5,"Dead [things] are formed from under the waters, and the inhabitants thereof."
Job,26,6,"Hell [is] naked before him, and destruction has no covering."
Job,26,7,"He stretches out the north over the empty place, [and] hangs the earth upon nothing."
Job,26,8,He binds up the waters in his thick clouds; and the cloud is not rent under them.
Job,26,9,"He holds back the face of his throne, [and] spreads his cloud upon it."
Job,26,10,"He has compassed the waters with bounds, until the day and night come to an end."
Job,26,11,The pillars of heaven tremble and are astonished at his reproof (rebuke; scolding).
Job,26,12,"He divides the sea with his power, and by his understanding he smites through the proud."
Job,26,13,By his spirit he has garnished the heavens; his hand has formed the crooked serpent.
Job,26,14,"Lo, these [are] parts of his ways: but how little a portion is heard of him? but the thunder of his power who can understand?"
Job,27,1,"Moreover Iyov [hated] continued his parable, and said,"
Job,27,2," [As] God-Elōhīm (The Living Word) [The Many Powered] lives, [who] has taken away my judgment; and the Almighty, [who] has vexed my soul;"
Job,27,3,"All the while my breath [is] in me, and the spirit of God-Elōhīm (The Living Word) [The Many Powered] [is] in my nostrils;"
Job,27,4,"My lips shall not speak wickedness, nor my tongue utter deceit."
Job,27,5,God-Elōhīm (The Living Word) [The Many Powered] forbid that I should justify you: till I die I will not remove my integrity from me.
Job,27,6,"My righteousness I hold fast, and will not let it go: my heart shall not reproach (disgrace; shame) [me] so long as I live."
Job,27,7,"Let my enemy be as the wicked, and he that rises up against me as the unrighteous."
Job,27,8,"For what [is] the hope of the hypocrite, though he has gained, when God-Elōhīm (The Living Word) [The Many Powered] takes away his soul?"
Job,27,9,Will God-Elōhīm (The Living Word) [The Many Powered] hear his cry when trouble comes upon him?
Job,27,10,Will he delight himself in the Almighty? will he always call upon God-Elōhīm (The Living Word) [The Many Powered]?
Job,27,11,I will teach you by the hand of God-Elōhīm (The Living Word) [The Many Powered]: [that] which [is] with the Almighty will I not conceal.
Job,27,12,"Behold, all you 2f yourselves have seen [it] ; why then are you 2f thus altogether vain?"
Job,27,13,"This [is] the portion of a wicked man with God-Elōhīm (The Living Word) [The Many Powered] , and the heritage of oppressors, [which] they shall receive of the Almighty."
Job,27,14,"If his children be multiplied, [it is] for the sword: and his offspring shall not be satisfied with bread."
Job,27,15,Those that remain of him shall be buried in death: and his widows shall not weep.
Job,27,16,"Though he heap up silver as the dust, and prepare clothing as the clay;"
Job,27,17,"He may prepare [it] , but the just shall put [it] on, and the innocent shall divide the silver."
Job,27,18,"He builds his house as a moth, and as a booth [that] the keeper makes."
Job,27,19,"The rich man shall lie down, but he shall not be gathered: he opens his eyes, and he [is] not."
Job,27,20,"Terrors take hold on him as waters, a tempest steals him away in the night."
Job,27,21,"The east wind carries him away, and he departs: and as a storm hurls him out of his place."
Job,27,22,"For [God-Elōhīm (The Living Word) [The Many Powered] ] shall cast upon him, and not spare: he would fain (earnestly want to or long to; gladly) flee out of his hand."
Job,27,23," [Men] shall clap their hands at him, and shall hiss him out of his place."
Job,28,1,"Surely there is a vein for the silver, and a place for gold [where] they fine [it]."
Job,28,2,"Yir’on [fearing] is taken out of the earth, and brass [is] molten [out of] the stone."
Job,28,3,"He sets an end to darkness, and searches out all perfection: the stones of darkness, and the shadow of death."
Job,28,4,"The flood breaks out from the inhabitant; [even the waters] forgotten of the foot: they are dried up, they are gone away from men."
Job,28,5," [As for] the earth, out of it comes bread: and under it is turned up as it were fire."
Job,28,6,The stones of it [are] the place of sapphires: and it has dust of gold.
Job,28,7," [There is] a path which no fowl knows, and which the vulture’s eye has not seen:"
Job,28,8,"The lion’s whelps have not trampled it, nor the fierce lion passed by it."
Job,28,9,He puts forth his hand upon the rock; he overturns the mountains by the roots.
Job,28,10,He cuts out rivers among the rocks; and his eye sees every precious thing.
Job,28,11,He binds the floods from overflowing; and [the thing that is] hid brings he forth to light.
Job,28,12,But where shall wisdom be found? and where [is] the place of understanding?
Job,28,13,Man knows not the price thereof; neither is it found in the land of the living.
Job,28,14,"The depth says, It [is] not in me: and the sea says, [It is] not with me."
Job,28,15,"It cannot be gotten for gold, neither shall silver be weighed [for] the price thereof."
Job,28,16,"It cannot be valued with the gold of Ofir [reducing to ashes] , with the precious onyx, or the sapphire."
Job,28,17,The gold and the crystal cannot equal it: and the exchange of it [shall not be for] jewels of fine gold.
Job,28,18,"No mention shall be made of coral, or of pearls: for the price of wisdom [is] above rubies."
Job,28,19,"The topaz of Ethiopia [Kush] shall not equal it, neither shall it be valued with pure gold."
Job,28,20,Whence then comes wisdom? and where [is] the place of understanding?
Job,28,21,"Seeing it is hid from the eyes of all living, and kept close from the fowls of the air."
Job,28,22,"Destruction and death say, We have heard the fame thereof with our ears."
Job,28,23,"God-Elōhīm (The Living Word) [The Many Powered] understands the way thereof, and he knows the place thereof."
Job,28,24,"For he looks to the ends of the earth, [and] sees under the whole heaven;"
Job,28,25,To make the weight for the winds; and he weighs the waters by measure.
Job,28,26,"When he made a decree for the rain, and a way for the lightning of the thunder:"
Job,28,27,"Then did he see it, and declare it; he prepared it, yes, and searched it out."
Job,28,28,"And unto man he said, Behold, the fear of the Lord-Adonai (The Father) [Greatest Above All Things] , that [is] wisdom; and to depart from evil [is] understanding."
Job,29,1,"Moreover Iyov [hated] continued his parable, and said,"
Job,29,2,"Oh that I were as [in] months past, as [in] the days [when] God-Elōhīm (The Living Word) [The Many Powered] preserved me;"
Job,29,3,"When his candle shined upon my head, [and when] by his light I walked [through] darkness;"
Job,29,4,"As I was in the days of my youth, when the secret of God-Elōhīm (The Living Word) [The Many Powered] [was] upon my tabernacle;"
Job,29,5,"When the Almighty [was] yet with me, [when] my children [were] about me;"
Job,29,6,"When I washed my steps with butter, and the rock poured me out rivers of oil;"
Job,29,7,"When I went out to the gate through the city, [when] I prepared my seat in the street!"
Job,29,8,"The young men saw me, and hid themselves: and the aged arose, [and] stood up."
Job,29,9,"The princes refrained talking, and laid [their] hand on their mouth."
Job,29,10,"The nobles held their peace, and their tongue cleaved to the roof of their mouth."
Job,29,11,"When the ear heard [me] , then it Blessed (Favored by God; happy; prosperous) me; and when the eye saw [me] , it gave witness to me:"
Job,29,12,"Because I delivered the poor that cried, and the fatherless, and [him that had] none to help him."
Job,29,13,The blessing of him that was ready to perish came upon me: and I caused the widow’s heart to sing for joy.
Job,29,14,"I put on righteousness, and it clothed me: my judgment [was] as a robe and a Diadem (royal headband worn by Eastern kings)."
Job,29,15,"I was eyes to the blind, and feet [was] I to the lame."
Job,29,16,I [was] a father to the poor: and the cause [which] I knew not I searched out.
Job,29,17,"And I broke the jaws of the wicked, and plucked the spoil (plunder; prey; booty) out of his teeth."
Job,29,18,"Then I said, I shall die in my nest, and I shall multiply [my] days as the sand."
Job,29,19,"My root [was] spread out by the waters, and the dew lay all night upon my branch."
Job,29,20,"My glory [was] fresh in me, and my bow was renewed in my hand."
Job,29,21,"Unto me [men] gave ear, and waited, and kept silence at my counsel."
Job,29,22,After my words they spoke not again; and my speech dropped upon them.
Job,29,23,And they waited for me as for the rain; and they opened their mouth wide [as] for the latter rain.
Job,29,24," [If] I laughed on them, they believed [it] not; and the light of my Countenance (Face, appearance; show favor) they cast not down."
Job,29,25,"I chose out their way, and sat chief, and dwelt as a king in the army, as one [that] comforts the mourners."
Job,30,1,"But now [they that are] younger than I have me in ridicule (laughing at enemies’ threats) , whose fathers I would have disdained to have set with the dogs of my flock."
Job,30,2,"Yes, whereto [might] the strength of their hands [profit] me, in whom old age was perished?"
Job,30,3,For lack and famine [they were] solitary; fleeing into the wilderness in former time desolate and waste.
Job,30,4,"Who cut up mallow (to approve, commend, accept) s by the bushes, and juniper roots [for] their meat."
Job,30,5,"They were driven forth from among [men] , (they cried after them as [after] a thief;)"
Job,30,6,"To dwell in the clefts of the valleys, [in] caves of the earth, and [in] the rocks."
Job,30,7,Among the bushes they groan (wail; make a foul noise) ed; under the nettles they were gathered together.
Job,30,8," [They were] children of fools, yes, children of base men: they were viler than the earth."
Job,30,9,"And now am I their song, yes, I am their byword."
Job,30,10,"They abhor me, they flee far from me, and spare not to spit in my face."
Job,30,11,"Because he has loosed my cord, and afflicted me, they have also let loose the bridle before me."
Job,30,12,"Upon [my] right [hand] rise the youth; they push away my feet, and they raise up against me the ways of their destruction."
Job,30,13,"They mar my path, they set forward my calamity, they have no helper."
Job,30,14,They came [upon me] as a wide breaking in [of waters] : in the desolation they rolled themselves [upon me].
Job,30,15,Terrors are turned upon me: they pursue my soul as the wind: and my welfare passes away as a cloud.
Job,30,16,And now my soul is poured out upon me; the days of affliction have taken hold upon me.
Job,30,17,My bones are pierced in me in the night season: and my sinews take no rest.
Job,30,18,By the great force [of my disease] is my garment changed: it binds me about as the collar of my coat.
Job,30,19,"He has cast me into the mire, and I am become like dust and ashes."
