Nehemiah,6,10,"Afterward I came unto the house of Sh’may’yah [Yehovah hears] the son of D’layahu [Yehovah has accomplished] the son of M’heitav’el [Favoured of God] , who [was] shut up; and he said, Let us meet together in the house of God-Elōhīm (The Living Word) [The Many Powered] , within the temple, and let us shut the doors of the temple: for they will come to slay you i ; yes, in the night will they come to slay you i."
Nehemiah,6,11,"And I said, Should such a man as I flee? and who [is there] , that, [being] as I [am] , would go into the temple to save his life? I will not go in."
Nehemiah,6,12,"And, lo, I perceived that God-Elōhīm (The Living Word) [The Many Powered] had not sent him; but that he pronounced this prophecy against me: for Toviyah [Yehovah is good] and Sanvalat [strength] had hired him."
Nehemiah,6,13,"Therefore [was] he hired, that I should be afraid, and do so, and sin, and [that] they might have [matter] for an evil report, that they might reproach (disgrace; shame) me."
Nehemiah,6,14,"My God-Elōhīm (The Living Word) [The Many Powered] , think you i upon Toviyah [Yehovah is good] and Sanvalat [strength] according to these their works, and on the prophetess No’adyah [meeting with Yehovah] , and the rest of the prophets, that would have put me in fear."
Nehemiah,6,15,"So the wall was finished in the twenty and fifth [day] of [the month] Elul, in fifty and two days."
Nehemiah,6,16,"And it came to pass, that when all our enemies heard [thereof] , and all the heathen that [were] about us saw [these things] , they were much cast down in their own eyes: for they perceived that this work was wrought of our God-Elōhīm (The Living Word) [The Many Powered]."
Nehemiah,6,17,"Moreover in those days the nobles of Y’hudah [Let Him (God) Be Praised] sent many letters unto Toviyah [Yehovah is good] , and [the letters] of Toviyah [Yehovah is good] came unto them."
Nehemiah,6,18,"For [there were] many in Y’hudah [Let Him (God) Be Praised] sworn unto him, because he [was] the son in law of Sh’khanyah [dweller with Yehovah] the son of Arach [traveller] ; and his son Yochanan [Yehovah has graced] had taken the daughter of Meshulam [friend] the son of Berekhyah [Yehovah blesses]."
Nehemiah,6,19,"Also they reported his good deeds before me, and uttered my words to him. [And] Toviyah [Yehovah is good] sent letters to put me in fear."
Nehemiah,7,1,"Now it came to pass, when the wall was built, and I had set up the doors, and the porters and the singers and the Levi’im (Levites) [Joined to] were appointed,"
Nehemiah,7,2,"That I gave my brother Hanani [gracious] , and Hananyah [God has favoured] the ruler of the palace, charge over Yerushalayim [Foundation of Peace] : for he [was] a faithful man, and feared God-Elōhīm (The Living Word) [The Many Powered] above many."
Nehemiah,7,3,"And I said unto them, Let not the gates of Yerushalayim [Foundation of Peace] be opened until the sun be hot; and while they stand by, let them shut the doors, and bar [them] : and appoint watches of the inhabitants of Yerushalayim [Foundation of Peace] , everyone in his watch, and every one [to be] over against his house."
Nehemiah,7,4,"Now the city [was] large and great: but the people [were] few in it, and the houses [were] not built."
Nehemiah,7,5,"And my God-Elōhīm (The Living Word) [The Many Powered] put into my heart to gather together the nobles, and the rulers, and the people, that they might be reckoned by genealogy. And I found a register of the genealogy of them which came up at the first, and found written in it,"
Nehemiah,7,6,"These [are] the children of the province, that went up out of the captivity, of those that had been carried away, whom N’vukhadnetzar [May Nebo protect the crown] the king of Bavel (to jumble, or a confused medley of sounds; confusion; gate of the deity) (Babylon) [confusion] had carried away, and came again to Yerushalayim [Foundation of Peace] and to Y’hudah [Let Him (God) Be Praised] , every one unto his city;"
Nehemiah,7,7,"Who came with Z’rubavel [sown in Babylon] , Yeshua [he is saved] , Nechemyah [God comforts] , ‘Azaryah [Yehovah has helped] , Ra’amyah [thunder of Yehovah] , Nachamani [merciful] , Mordekhai [little man] , Bilshan [in slander] , Misperet [number] , Bigvai [in my bodies] , N’chum [comfort] , Ba’anah [in affliction] . The number, [I say] , of the men of the people of Yisra’el [He Holds Onto The Heel Of God] [was this];"
Nehemiah,7,8,"The children of Par’osh [flea] , two thousand an hundred seventy and two."
Nehemiah,7,9,"The children of Sh’fatyah [Yehovah has judged] , three hundred seventy and two."
Nehemiah,7,10,"The children of Arach [traveller] , six hundred fifty and two."
Nehemiah,7,11,"The children of Pachat-Mo’av [pit of Mo’av] , of the children of Yeshua [he is saved] and Yo’av [Yehovah is father] , two thousand and eight hundred [and] eighteen."
Nehemiah,7,12,"The children of ‘Eilam [eternity] , a thousand two hundred fifty and four."
Nehemiah,7,13,"The children of Zatu [brightness of him] , eight hundred forty and five."
Nehemiah,7,14,"The children of Zakkai [pure] , seven hundred and threescore."
Nehemiah,7,15,"The children of Binui [built up] , six hundred forty and eight."
Nehemiah,7,16,"The children of Bevai [my cavities] , six hundred twenty and eight."
Nehemiah,7,17,"The children of ‘Azgad [Gad is mighty] , two thousand three hundred twenty and two."
Nehemiah,7,18,"The children of Adonikam [my lord arose] , six hundred threescore and seven."
Nehemiah,7,19,"The children of Bigvai [in my bodies] , two thousand threescore and seven."
Nehemiah,7,20,"The children of ‘Adin [delicate] , six hundred fifty and five."
Nehemiah,7,21,"The children of Ater [binder] of Hizkiyahu [Yehovah is my strength] , ninety and eight."
Nehemiah,7,22,"The children of Hashum [rich] , three hundred twenty and eight."
Nehemiah,7,23,"The children of Betzai [conqueror] , three hundred twenty and four."
Nehemiah,7,24,"The children of Harif [a plucking off] , an hundred and twelve."
Nehemiah,7,25,"The children of Giv’on [Hill City] , ninety and five."
Nehemiah,7,26,"The men of Beit-Lechem [House of Bread] and N’tofah [dropping] , an hundred eighty and eight."
Nehemiah,7,27,"The men of ‘Anatot [answers to prayer] , an hundred twenty and eight."
Nehemiah,7,28,"The men of Beit-’Azmavet [house of the strength of death] , forty and two."
Nehemiah,7,29,"The men of Kiryat-Ye’arim [City of Forests] , K’firah [Lioness] , and B’erot [Wells] , seven hundred forty and three."
Nehemiah,7,30,"The men of Ramah [Hill] and Geva [hill] , six hundred twenty and one."
Nehemiah,7,31,"The men of Mikhmas [hidden] , an hundred and twenty and two."
Nehemiah,7,32,"The men of Beit-El [House of God] and ‘Ai [Heap of Ruins] , an hundred twenty and three."
Nehemiah,7,33,"The men of the other Nevo [Prophet] , fifty and two."
Nehemiah,7,34,"The children of the other ‘Eilam [eternity] , a thousand two hundred fifty and four."
Nehemiah,7,35,"The children of Harim [dedicated] , three hundred and twenty."
Nehemiah,7,36,"The children of Yericho [Its Moon] , three hundred forty and five."
Nehemiah,7,37,"The children of Lod [travail] , Hadid [sharp] , and Ono [vigorous] , seven hundred twenty and one."
Nehemiah,7,38,"The children of S’na’ah [thorny] , three thousand nine hundred and thirty."
Nehemiah,7,39,"The priests: the children of Y’da’yah [Yehovah has known] , of the house of Yeshua [he is saved] , nine hundred seventy and three."
Nehemiah,7,40,"The children of Immer [he has said] , a thousand fifty and two."
Nehemiah,7,41,"The children of Pash’chur [freedom] , a thousand two hundred forty and seven."
Nehemiah,7,42,"The children of Harim [dedicated] , a thousand and seventeen."
Nehemiah,7,43,"The Levi’im (Levites) [Joined to] : the children of Yeshua [he is saved] , of Kadmi’el [God is the ancient one], [and] of the children of Hodvah [praise of Yehovah] , seventy and four."
Nehemiah,7,44,"The singers: the children of Asaf [gatherer] , an hundred forty and eight."
Nehemiah,7,45,"The porters: the children of Shalum [retribution] , the children of Ater [binder] , the children of Talmon [oppressor] , the children of ‘Akuv [insidious] , the children of Hatita [exploring] , the children of Shovai [glorious] , an hundred thirty and eight."
Nehemiah,7,46,"The temple servants: the children of Tzicha [parched] , the children of Hasufa [stipped] , the children of Taba’ot [rings],"
Nehemiah,7,47,"The children of Keros [anklet] , the children of Si’a [departing] , the children of Padon [ransom],"
Nehemiah,7,48,"The children of L’vanah [moon-white] , the children of Hagava [locust] , the children of Salmai [my garments],"
Nehemiah,7,49,"The children of Hanan [he is merciful] , the children of Giddel [very great] , the children of Gachar [hiding place],"
Nehemiah,7,50,"The children of Re’ayah [Yehovah has seen] , the children of Retzin [firm] , the children of N’koda [distinguished],"
Nehemiah,7,51,"The children of Gazam [devouring] , the children of ‘Uza [strength] , the children of Paseach [limper],"
Nehemiah,7,52,"The children of Besai [my treading] , the children of Me’unim [habitations] , the children of N’fish’sim [refreshed of spices],"
Nehemiah,7,53,"The children of Bakbuk [bottle] , the children of Hakufa [bent] , the children of Harhur [inflammation],"
Nehemiah,7,54,"The children of Batzlit [asking] , the children of M’chida [famour, or noble] , the children of Harsha [mute],"
Nehemiah,7,55,"The children of Barkos [the son cut off] , the children of Sisra [Battle Array (to put on; to clothe)], the children of Temach [laughter],"
Nehemiah,7,56,"The children of N’tziach [pre-eminent] , the children of Hatifa [seized]."
Nehemiah,7,57,"The children of Shlomo’s (Solomon) [peace] servants: the children of Sotai [changeful] , the children of HaSoferet [writing] , the children of P’rida [grain],"
Nehemiah,7,58,"The children of Ya’lah [ascending] , the children of Darkon [scatterer] , the children of Giddel [very great],"
Nehemiah,7,59,"The children of Sh’fatyah [Yehovah has judged] , the children of Hatil [doubtful] , the children of Pokheret-Hatzvayim [here is the cutting off] , the children of ‘Amon [master workman]."
Nehemiah,7,60,"All the temple servants, and the children of Shlomo’s (Solomon) [peace] servants, [were] three hundred ninety and two."
Nehemiah,7,61,"And these [were] they which went up [also] from Tel-Melach [mound of salt] , Tel-Harsha [mound of the deaf mute] , K’ruv [blessing] , Adon [powerful] , and Immer [he has said] : but they could not show their father’s house, nor their seed, whether they [were] of Yisra’el [He Holds Onto The Heel Of God]."
Nehemiah,7,62,"The children of D’layahu [Yehovah has accomplished] , the children of Toviyah [Yehovah is good] , the children of N’koda [distinguished] , six hundred forty and two."
Nehemiah,7,63,"And of the priests: the children of Havayah [Yehovah has hidden] , the children of Hakotz [thorn] , the children of Barzillai [my iron] , which took [one] of the daughters of Barzillai [my iron] the Gil’adi [Hill of Testimony] to wife, and was called after their name."
Nehemiah,7,64,"These sought their register [among] those that were reckoned by genealogy, but it was not found: therefore were they, as polluted, put from the priesthood."
Nehemiah,7,65,"And the Tirshata [governor] said unto them, that they should not eat of the most holy things, till there stood [up] a priest with Urim [Lights] and Tumim [Perfection]."
Nehemiah,7,66,"The whole congregation together [was] forty and two thousand three hundred and threescore,"
Nehemiah,7,67,"Beside their manservants and their maidservants, of whom [there were] seven thousand three hundred thirty and seven: and they had two hundred forty and five singing men and singing women."
Nehemiah,7,68,"Their horses, seven hundred thirty and six: their mules, two hundred forty and five:"
Nehemiah,7,69," [Their] camels, four hundred thirty and five: six thousand seven hundred and twenty asses."
Nehemiah,7,70,"And some of the chief of the fathers gave unto the work. The Tirshata [governor] gave to the treasure a thousand drams of gold, fifty basons, five hundred and thirty priests’ garments."
Nehemiah,7,71,"And [some] of the chief of the fathers gave to the treasure of the work twenty thousand drams of gold, and two thousand and two hundred pound of silver."
Nehemiah,7,72,"And [that] which the rest of the people gave [was] twenty thousand drams of gold, and two thousand pound of silver, and threescore and seven priests’ garments."
Nehemiah,7,73,"So the priests, and the Levi’im (Levites) [Joined to] , and the porters, and the singers, and [some] of the people, and the temple servants, and all Yisra’el [He Holds Onto The Heel Of God] , dwelt in their cities; and when the seventh month came, the people of Yisra’el [He Holds Onto The Heel Of God] [were] in their cities."
Nehemiah,8,1,"And all the people gathered themselves together as one man into the street that [was] before the water gate; and they spoke unto ‘the scribe to bring the book of the law of Moshe [He Who Draws Out Of The Waters] , which the Lord-Yehōvah (Messiah Pre-Incarnate) had commanded to Yisra’el [He Holds Onto The Heel Of God]."
Nehemiah,8,2,"And ‘the priest brought the law before the congregation both of men and women, and all that could hear with understanding, upon the first day of the seventh month."
Nehemiah,8,3,"And he read in it before the street that [was] before the water gate from the morning until midday, before the men and the women, and those that could understand; and the ears of all the people [were attentive] unto the book of the law."
Nehemiah,8,4,"And ‘the scribe stood upon a pulpit of wood, which they had made for the purpose; and beside him stood Mattityah [gift of Yehovah] , and Sh’ma [Hear] , and ‘Anayah [Yehovah has answered] , and Uriyah [Yehovah is my flame] , and Hilkiyahu [my portion is Yehovah] , and Ma’aseiyah [work of Yehovah] , on his right hand; and on his left hand, P’dayah [Yehovah has ransomed] , and Misha’el [Who is what God is] , and Malkiyah [my king is Yehovah] , and Hashum [rich] , and Hashbadanah [considerate judge] , Z’kharyah [Yehovah remembers], [and] Meshulam [friend]."
Nehemiah,8,5,"And ‘opened the book in the sight of all the people; (for he was above all the people;) and when he opened it, all the people stood up:"
Nehemiah,8,6,"And ‘Blessed (Favored by God; happy; prosperous) the Lord-Yehōvah (Messiah Pre-Incarnate) , the great God-Elōhīm (The Living Word) [The Many Powered] . And all the people answered, Amen, Amen, with lifting up their hands: and they bowed their heads, and worshipped the Lord-Yehōvah (Messiah Pre-Incarnate) with [their] faces to the ground."
Nehemiah,8,7,"Also Yeshua [he is saved] , and Bani [built] , and Sherevyah [Yehovah has scorched] , Yamin [Right Hand] , ‘Akuv [insidious] , Shabtai [sabbatical] , Hodiyah [my majesty is Yehovah] , Ma’aseiyah [work of Yehovah] , K’lita [crippled] , ‘Azaryah [Yehovah has helped] , Yozavad [Yehovah has endowed] , Hanan [he is merciful] , P’layah [Yehovah does wonders] , and the Levi’im (Levites) [Joined to] , caused the people to understand the law: and the people [stood] in their place."
Nehemiah,8,8,"So they read in the book in the law of God-Elōhīm (The Living Word) [The Many Powered] distinctly, and gave the sense, and caused [them] to understand the reading."
Nehemiah,8,9,"And Nechemyah [God comforts] , which [is] the Tirshata [governor] , and ‘the priest the scribe, and the Levi’im (Levites) [Joined to] that taught the people, said unto all the people, This day [is] holy unto the Lord-Yehōvah (Messiah Pre-Incarnate) your God-Elōhīm (The Living Word) [The Many Powered] ; mourn not, nor weep. For all the people wept, when they heard the words of the law."
Nehemiah,8,10,"Then he said unto them, Go your way, eat the fat, and drink the sweet, and send portions unto them for whom nothing is prepared: for [this] day [is] holy unto our Lord: neither be you 2f sorry; for the joy of the Lord-Yehōvah (Messiah Pre-Incarnate) is your strength."
Nehemiah,8,11,"So the Levi’im (Levites) [Joined to] stilled all the people, saying, Hold your peace, for the day [is] holy; neither be you 2f grieved."
Nehemiah,8,12,"And all the people went their way to eat, and to drink, and to send portions, and to make great gladness, because they had understood the words that were declared unto them."
Nehemiah,8,13,"And on the second day were gathered together the chief of the fathers of all the people, the priests, and the Levi’im (Levites) [Joined to] , unto ‘the scribe, even to understand the words of the law."
Nehemiah,8,14,"And they found written in the law which the Lord-Yehōvah (Messiah Pre-Incarnate) had commanded by Moshe [He Who Draws Out Of The Waters] , that the people of Yisra’el [He Holds Onto The Heel Of God] should dwell in booths in the feast of the seventh month:"
Nehemiah,8,15,"And that they should publish and proclaim in all their cities, and in Yerushalayim [Foundation of Peace] , saying, Go forth unto the mount, and fetch olive branches, and pine branches, and myrtle branches, and palm branches, and branches of thick trees, to make booths, as [it is] written."
Nehemiah,8,16,"So the people went forth, and brought [them] , and made themselves booths, every one upon the roof of his house, and in their courts, and in the courts of the house of God-Elōhīm (The Living Word) [The Many Powered] , and in the street of the water gate, and in the street of the gate of Efrayim [Doubly Fruitful]."
Nehemiah,8,17,"And all the congregation of them that were come again out of the captivity made booths, and sat under the booths: for since the days of Yeshua [he is saved] the son of Nun [Posterity] unto that day had not the people of Yisra’el [He Holds Onto The Heel Of God] done so. And there was very great gladness."
Nehemiah,8,18,"Also day by day, from the first day unto the last day, he read in the book of the law of God-Elōhīm (The Living Word) [The Many Powered] . And they kept the feast seven days; and on the eighth day [was] a solemn assembly, according unto the manner."
Nehemiah,9,1,"Now in the twenty and fourth day of this month the people of Yisra’el [He Holds Onto The Heel Of God] were assembled with fasting, and with sackclothes, and earth upon them."
Nehemiah,9,2,"And the seed of Yisra’el [He Holds Onto The Heel Of God] separated themselves from all strangers, and stood and confessed their sins, and the iniquities of their fathers."
Nehemiah,9,3,"And they stood up in their place, and read in the book of the law of the Lord-Yehōvah (Messiah Pre-Incarnate) their God-Elōhīm (The Living Word) [The Many Powered] [one] fourth part of the day; and [another] fourth part they confessed, and worshipped the Lord-Yehōvah (Messiah Pre-Incarnate) their God-Elōhīm (The Living Word) [The Many Powered]."
Nehemiah,9,4,"Then stood up upon the stairs, of the Levi’im (Levites) [Joined to] , Yeshua [he is saved] , and Bani [built] , Kadmi’el [God is the ancient one] , Sh’vanyah [increased by Yehovah] , Buni [built] , Sherevyah [Yehovah has scorched] , Bani [built], [and] K’nani [my station] , and cried with a loud voice unto the Lord-Yehōvah (Messiah Pre-Incarnate) their God-Elōhīm (The Living Word) [The Many Powered]."
Nehemiah,9,5,"Then the Levi’im (Levites) [Joined to] , Yeshua [he is saved] , and Kadmi’el [God is the ancient one] , Bani [built] , Hashavn’yah [whom Yehovah regards] , Sherevyah [Yehovah has scorched] , Hodiyah [my majesty is Yehovah] , Sh’vanyah [increased by Yehovah], [and] P’tachyah [freed by Yehovah] , said, Stand up [and] bless the Lord-Yehōvah (Messiah Pre-Incarnate) your God-Elōhīm (The Living Word) [The Many Powered] forever and ever: and Blessed (Favored by God; happy; prosperous) be you i glorious name, which is exalted above all blessing and praise."
Nehemiah,9,6,"you i, [even] you i, [are] Lord-Yehōvah (Messiah Pre-Incarnate) alone; you i have made heaven, the heaven of heavens, with all their host, the earth, and all [things] that [are] in it, the seas, and all that [is] in it, and you i preserve them all; and the army of heaven worships you i."
Nehemiah,9,7,"you i [are] the Lord-Yehōvah (Messiah Pre-Incarnate) the God-Elōhīm (The Living Word) [The Many Powered] , who did choose Abram, and brought him forth out of Ur of the Kasdim [clod-breakers] [clod-breakers] , and gave him the name of Avraham [Exalted Father];"
Nehemiah,9,8,"And found his heart faithful before you i , and made a covenant with him to give the land of the Kena’ani [Merchant] , the Hitti [Terrorists] , the Emori [Highlanders] , and the P’rizi [Dwellers in Unwalled Towns] , and the Y’vusi [Threshers, Trampled Under Foot] , and the Girgashi [Dwelling on Clay Soil] , to give [it, I say] , to his seed, and have performed you i words; for you i [are] righteous:"
Nehemiah,9,9,"And did see the affliction of our fathers in Mitzrayim [Egypt - The Narrow Place] , and heard their cry by the Red sea;"
Nehemiah,9,10,"And showed signs and wonders upon Par’oh [Pharaoh - Great House] , and on all his servants, and on all the people of his land: for you i knew that they dealt proudly against them. So did you i get yourselfi a name, as [it is] this day."
Nehemiah,9,11,"And you i did divide the sea before them, so that they went through the midst of the sea on the dry land; and their persecutors you i threw into the deeps, as a stone into the mighty waters."
Nehemiah,9,12,"Moreover you i led them in the day by a cloudy pillar; and in the night by a pillar of fire, to give them light in the way wherein they should go."
Nehemiah,9,13,"you i came down also upon mount Sinai, and spoke with them from heaven, and gave them right judgments, and true laws, good statutes and commandments:"
Nehemiah,9,14,"And made known unto them you i holy Shabbat [Rest] , and commanded them precepts, statutes, and laws, by the hand of Moshe [He Who Draws Out Of The Waters] you i servant:"
Nehemiah,9,15,"And gave them bread from heaven for their hunger, and brought forth water for them out of the rock for their thirst, and promised them that they should go in to possess the land which you i had sworn to give them."
Nehemiah,9,16,"But they and our fathers dealt proudly, and hardened their necks, and listened not to you i commandments,"
Nehemiah,9,17,"And refused to obey, neither were mindful of you i wonders that you i did among them; but hardened their necks, and in their rebellion appointed a captain to return to their bondage: but you i [are] a God-Elōhīm (The Living Word) [The Many Powered] ready to pardon, gracious and merciful, slow to anger, and of great kindness, and forsook them not."
Nehemiah,9,18,"Yes, when they had made them a molten calf, and said, This [is] you i God-Elōhīm (The Living Word) [The Many Powered] that brought you i up out of Mitzrayim [Egypt - The Narrow Place] , and had wrought great provocations;"
Nehemiah,9,19,"Yet you i in your i manifold mercies forsook them not in the wilderness: the pillar of the cloud departed not from them by day, to lead them in the way; neither the pillar of fire by night, to show them light, and the way wherein they should go."
Nehemiah,9,20,"you i gave also your i good spirit to instruct them, and withheld not your i manna from their mouth, and gave them water for their thirst."
Nehemiah,9,21,"Yes, forty years did you i sustain them in the wilderness, [so that] they lacked nothing; their clothes waxed not old, and their feet swelled not."
Nehemiah,9,22,"Moreover you i gave them kingdoms and nations, and did divide them into corners: so they possessed the land of Sichon [Warrior] , and the land of the king of Heshbon [Stronghold] , and the land of ‘Og [Long-necked] king of Bashan [Fruitful]."
Nehemiah,9,23,"Their children also multiplied you i as the stars of heaven, and brought them into the land, concerning which you i had promised to their fathers, that they should go in to possess [it]."
Nehemiah,9,24,"So the children went in and possessed the land, and you i subdued before them the inhabitants of the land, the Kena’ani [Merchant] , and gave them into their hands, with their kings, and the people of the land, that they might do with them as they would."
Nehemiah,9,25,"And they took strong cities, and a fat land, and possessed houses full of all goods, wells excavated, vineyards, and oliveyards, and fruit trees in abundance: so they did eat, and were filled, and became fat, and delighted themselves in you i great goodness."
Nehemiah,9,26,"Nevertheless they were disobedient, and rebelled against you i , and cast you i law behind their backs, and killed you i prophets which testified against them to turn them to you i , and they wrought great provocations."
Nehemiah,9,27,"Therefore you i delivered them into the hand of their enemies, who vexed them: and in the time of their trouble, when they cried unto you i , you i heard [them] from heaven; and according to you i manifold mercies you i gave them saviours, who saved them out of the hand of their enemies."
Nehemiah,9,28,"But after they had rest, they did evil again before you i : therefore left you i them in the hand of their enemies, so that they had the dominion over them: yet when they returned, and cried unto you i , you i heard [them] from heaven; and many times did you i deliver them according to you i mercies;"
Nehemiah,9,29,"And testified against them, that you i might bring them again unto you i law: yet they dealt proudly, and listened not unto you i commandments, but sinned against you i judgments, (which if a man do, he shall live in them;) and withdrew the shoulder, and hardened their neck, and would not hear."
