Hosea,13,10,"Where now is your king, that he may save you? Where in all your cities are your rulers, of whom you said, “Give me a king and rulers”?"
Hosea,13,11,"I gave you a king in my anger, and I took him away in my wrath."
Hosea,13,12,Ephraim's iniquity is bound up; his sin is kept in store.
Hosea,13,13,"The pangs of childbirth come for him, but he is an unwise son; for at the proper time he does not present himself at the mouth of the womb."
Hosea,13,14,"Shall I ransom them from the power of Sheol? Shall I redeem them from Death? O Death, where are your plagues? O Sheol, where is your destruction? Compassion is hidden from my eyes."
Hosea,13,15,"Although he may flourish among rushes, the east wind shall come, a blast from the Lord, rising from the wilderness; and his fountain shall dry up, his spring shall be parched. It shall strip his treasury of every precious thing."
Hosea,13,16," Samaria shall bear her guilt, because she has rebelled against her God; they shall fall by the sword, their little ones shall be dashed in pieces, and their pregnant women ripped open."
Hosea,14,1,"Return, O Israel, to the Lord your God, for you have stumbled because of your iniquity."
Hosea,14,2,"Take words with you and return to the Lord; say to him, “Take away all guilt; accept that which is good, and we will offer the fruit of our lips."
Hosea,14,3,"Assyria shall not save us; we will not ride upon horses; we will say no more, ‘Our God,’ to the work of our hands. In you the orphan finds mercy.”"
Hosea,14,4,"I will heal their disloyalty; I will love them freely, for my anger has turned from them."
Hosea,14,5,"I will be like the dew to Israel; he shall blossom like the lily, he shall strike root like the forests of Lebanon."
Hosea,14,6,"His shoots shall spread out; his beauty shall be like the olive tree, and his fragrance like that of Lebanon."
Hosea,14,7,"They shall again live beneath my shadow, they shall flourish as a garden; they shall blossom like the vine, their fragrance shall be like the wine of Lebanon."
Hosea,14,8,"O Ephraim, what have I to do with idols? It is I who answer and look after you. I am like an evergreen cypress; your faithfulness comes from me."
Hosea,14,9,"Those who are wise understand these things; those who are discerning know them. For the ways of the Lord are right, and the upright walk in them, but transgressors stumble in them."
