Hosea,1,1,"The word of the Lord that came to Hosea son of Beeri, in the days of Kings Uzziah, Jotham, Ahaz, and Hezekiah of Judah, and in the days of King Jeroboam son of Joash of Israel."
Hosea,1,2,"When the Lord first spoke through Hosea, the Lord said to Hosea, “Go, take for yourself a wife of whoredom and have children of whoredom, for the land commits great whoredom by forsaking the Lord .”"
Hosea,1,3,"So he went and took Gomer daughter of Diblaim, and she conceived and bore him a son."
Hosea,1,4,"And the Lord said to him, “Name him Jezreel; for in a little while I will punish the house of Jehu for the blood of Jezreel, and I will put an end to the kingdom of the house of Israel."
Hosea,1,5,On that day I will break the bow of Israel in the valley of Jezreel.”
Hosea,1,6,"She conceived again and bore a daughter. Then the Lord said to him, “Name her Lo-ruhamah, for I will no longer have pity on the house of Israel or forgive them."
Hosea,1,7,"But I will have pity on the house of Judah, and I will save them by the Lord their God; I will not save them by bow, or by sword, or by war, or by horses, or by horsemen.”"
Hosea,1,8,"When she had weaned Lo-ruhamah, she conceived and bore a son."
Hosea,1,9,"Then the Lord said, “Name him Lo-ammi, for you are not my people and I am not your God.”"
Hosea,1,10," Yet the number of the people of Israel shall be like the sand of the sea, which can be neither measured nor numbered; and in the place where it was said to them, “You are not my people,” it shall be said to them, “Children of the living God.”"
Hosea,1,11,"The people of Judah and the people of Israel shall be gathered together, and they shall appoint for themselves one head; and they shall take possession of the land, for great shall be the day of Jezreel."
Hosea,2,1," Say to your brother, Ammi, and to your sister, Ruhamah."
Hosea,2,2,"Plead with your mother, plead— for she is not my wife, and I am not her husband— that she put away her whoring from her face, and her adultery from between her breasts,"
Hosea,2,3,"or I will strip her naked and expose her as in the day she was born, and make her like a wilderness, and turn her into a parched land, and kill her with thirst."
Hosea,2,4,"Upon her children also I will have no pity, because they are children of whoredom."
Hosea,2,5,"For their mother has played the whore; she who conceived them has acted shamefully. For she said, “I will go after my lovers; they give me my bread and my water, my wool and my flax, my oil and my drink.”"
Hosea,2,6,"Therefore I will hedge up her way with thorns; and I will build a wall against her, so that she cannot find her paths."
Hosea,2,7,"She shall pursue her lovers, but not overtake them; and she shall seek them, but shall not find them. Then she shall say, “I will go and return to my first husband, for it was better with me then than now.”"
Hosea,2,8,"She did not know that it was I who gave her the grain, the wine, and the oil, and who lavished upon her silver and gold that they used for Baal."
Hosea,2,9,"Therefore I will take back my grain in its time, and my wine in its season; and I will take away my wool and my flax, which were to cover her nakedness."
Hosea,2,10,"Now I will uncover her shame in the sight of her lovers, and no one shall rescue her out of my hand."
Hosea,2,11,"I will put an end to all her mirth, her festivals, her new moons, her sabbaths, and all her appointed festivals."
Hosea,2,12,"I will lay waste her vines and her fig trees, of which she said, “These are my pay, which my lovers have given me.” I will make them a forest, and the wild animals shall devour them."
Hosea,2,13,"I will punish her for the festival days of the Baals, when she offered incense to them and decked herself with her ring and jewelry, and went after her lovers, and forgot me, says the Lord."
Hosea,2,14,"Therefore, I will now allure her, and bring her into the wilderness, and speak tenderly to her."
Hosea,2,15,"From there I will give her her vineyards, and make the Valley of Achor a door of hope. There she shall respond as in the days of her youth, as at the time when she came out of the land of Egypt."
Hosea,2,16,"On that day, says the Lord , you will call me, “My husband,” and no longer will you call me, “My Baal.”"
Hosea,2,17,"For I will remove the names of the Baals from her mouth, and they shall be mentioned by name no more."
Hosea,2,18,"I will make for you a covenant on that day with the wild animals, the birds of the air, and the creeping things of the ground; and I will abolish the bow, the sword, and war from the land; and I will make you lie down in safety."
Hosea,2,19,"And I will take you for my wife forever; I will take you for my wife in righteousness and in justice, in steadfast love, and in mercy."
Hosea,2,20,I will take you for my wife in faithfulness; and you shall know the Lord.
Hosea,2,21,"On that day I will answer, says the Lord, I will answer the heavens and they shall answer the earth;"
Hosea,2,22,"and the earth shall answer the grain, the wine, and the oil, and they shall answer Jezreel;"
Hosea,2,23,"and I will sow him for myself in the land. And I will have pity on Lo-ruhamah, and I will say to Lo-ammi, “You are my people”; and he shall say, “You are my God.”"
Hosea,3,1,"The Lord said to me again, “Go, love a woman who has a lover and is an adulteress, just as the Lord loves the people of Israel, though they turn to other gods and love raisin cakes.”"
Hosea,3,2,So I bought her for fifteen shekels of silver and a homer of barley and a measure of wine.
Hosea,3,3,"And I said to her, “You must remain as mine for many days; you shall not play the whore, you shall not have intercourse with a man, nor I with you.”"
Hosea,3,4,"For the Israelites shall remain many days without king or prince, without sacrifice or pillar, without ephod or teraphim."
Hosea,3,5,"Afterward the Israelites shall return and seek the Lord their God, and David their king; they shall come in awe to the Lord and to his goodness in the latter days."
Hosea,4,1,"Hear the word of the Lord , O people of Israel; for the Lord has an indictment against the inhabitants of the land. There is no faithfulness or loyalty, and no knowledge of God in the land."
Hosea,4,2,"Swearing, lying, and murder, and stealing and adultery break out; bloodshed follows bloodshed."
Hosea,4,3,"Therefore the land mourns, and all who live in it languish; together with the wild animals and the birds of the air, even the fish of the sea are perishing."
Hosea,4,4,"Yet let no one contend, and let none accuse, for with you is my contention, O priest."
Hosea,4,5,"You shall stumble by day; the prophet also shall stumble with you by night, and I will destroy your mother."
Hosea,4,6,"My people are destroyed for lack of knowledge; because you have rejected knowledge, I reject you from being a priest to me. And since you have forgotten the law of your God, I also will forget your children."
Hosea,4,7,"The more they increased, the more they sinned against me; they changed their glory into shame."
Hosea,4,8,They feed on the sin of my people; they are greedy for their iniquity.
Hosea,4,9,"And it shall be like people, like priest; I will punish them for their ways, and repay them for their deeds."
Hosea,4,10,"They shall eat, but not be satisfied; they shall play the whore, but not multiply; because they have forsaken the Lord to devote themselves to"
Hosea,4,11,whoredom. Wine and new wine take away the understanding.
Hosea,4,12,"My people consult a piece of wood, and their divining rod gives them oracles. For a spirit of whoredom has led them astray, and they have played the whore, forsaking their God."
Hosea,4,13,"They sacrifice on the tops of the mountains, and make offerings upon the hills, under oak, poplar, and terebinth, because their shade is good. Therefore your daughters play the whore, and your daughters-in-law commit adultery."
Hosea,4,14,"I will not punish your daughters when they play the whore, nor your daughters-in-law when they commit adultery; for the men themselves go aside with whores, and sacrifice with temple prostitutes; thus a people without understanding comes to ruin."
Hosea,4,15,"Though you play the whore, O Israel, do not let Judah become guilty. Do not enter into Gilgal, or go up to Beth-aven, and do not swear, “As the Lord lives.”"
Hosea,4,16,"Like a stubborn heifer, Israel is stubborn; can the Lord now feed them like a lamb in a broad pasture?"
Hosea,4,17,Ephraim is joined to idols— let him alone.
Hosea,4,18,"When their drinking is ended, they indulge in sexual orgies; they love lewdness more than their glory."
Hosea,4,19,"A wind has wrapped them in its wings, and they shall be ashamed because of their altars."
Hosea,5,1,"Hear this, O priests! Give heed, O house of Israel! Listen, O house of the king! For the judgment pertains to you; for you have been a snare at Mizpah, and a net spread upon Tabor,"
Hosea,5,2,and a pit dug deep in Shittim; but I will punish all of them.
Hosea,5,3,"I know Ephraim, and Israel is not hidden from me; for now, O Ephraim, you have played the whore; Israel is defiled."
Hosea,5,4,"Their deeds do not permit them to return to their God. For the spirit of whoredom is within them, and they do not know the Lord."
Hosea,5,5,Israel's pride testifies against him; Ephraim stumbles in his guilt; Judah also stumbles with them.
Hosea,5,6,"With their flocks and herds they shall go to seek the Lord, but they will not find him; he has withdrawn from them."
Hosea,5,7,They have dealt faithlessly with the Lord; for they have borne illegitimate children. Now the new moon shall devour them along with their fields.
Hosea,5,8,"Blow the horn in Gibeah, the trumpet in Ramah. Sound the alarm at Beth-aven; look behind you, Benjamin!"
Hosea,5,9,Ephraim shall become a desolation in the day of punishment; among the tribes of Israel I declare what is sure.
Hosea,5,10,The princes of Judah have become like those who remove the landmark; on them I will pour out my wrath like water.
Hosea,5,11,"Ephraim is oppressed, crushed in judgment, because he was determined to go after vanity."
Hosea,5,12,"Therefore I am like maggots to Ephraim, and like rottenness to the house of Judah."
Hosea,5,13,"When Ephraim saw his sickness, and Judah his wound, then Ephraim went to Assyria, and sent to the great king. But he is not able to cure you or heal your wound."
Hosea,5,14,"For I will be like a lion to Ephraim, and like a young lion to the house of Judah. I myself will tear and go away; I will carry off, and no one shall rescue."
Hosea,5,15,I will return again to my place until they acknowledge their guilt and seek my face. In their distress they will beg my favor:
Hosea,6,1,"“Come, let us return to the Lord; for it is he who has torn, and he will heal us; he has struck down, and he will bind us up."
Hosea,6,2,"After two days he will revive us; on the third day he will raise us up, that we may live before him."
Hosea,6,3,"Let us know, let us press on to know the Lord; his appearing is as sure as the dawn; he will come to us like the showers, like the spring rains that water the earth.”"
Hosea,6,4,"What shall I do with you, O Ephraim? What shall I do with you, O Judah? Your love is like a morning cloud, like the dew that goes away early."
Hosea,6,5,"Therefore I have hewn them by the prophets, I have killed them by the words of my mouth, and my judgment goes forth as the light."
Hosea,6,6,"For I desire steadfast love and not sacrifice, the knowledge of God rather than burnt offerings."
Hosea,6,7,But at Adam they transgressed the covenant; there they dealt faithlessly with me.
Hosea,6,8,"Gilead is a city of evildoers, tracked with blood."
Hosea,6,9,"As robbers lie in wait for someone, so the priests are banded together; they murder on the road to Shechem, they commit a monstrous crime."
Hosea,6,10,"In the house of Israel I have seen a horrible thing; Ephraim's whoredom is there, Israel is defiled."
Hosea,6,11,"For you also, O Judah, a harvest is appointed. When I would restore the fortunes of my people,"
Hosea,7,1,"when I would heal Israel, the corruption of Ephraim is revealed, and the wicked deeds of Samaria; for they deal falsely, the thief breaks in, and the bandits raid outside."
Hosea,7,2,"But they do not consider that I remember all their wickedness. Now their deeds surround them, they are before my face."
Hosea,7,3,"By their wickedness they make the king glad, and the officials by their treachery."
Hosea,7,4,"They are all adulterers; they are like a heated oven, whose baker does not need to stir the fire, from the kneading of the dough until it is leavened."
Hosea,7,5,On the day of our king the officials became sick with the heat of wine; he stretched out his hand with mockers.
Hosea,7,6,"For they are kindled like an oven, their heart burns within them; all night their anger smolders; in the morning it blazes like a flaming fire."
Hosea,7,7,"All of them are hot as an oven, and they devour their rulers. All their kings have fallen; none of them calls upon me."
Hosea,7,8,Ephraim mixes himself with the peoples; Ephraim is a cake not turned.
Hosea,7,9,"Foreigners devour his strength, but he does not know it; gray hairs are sprinkled upon him, but he does not know it."
Hosea,7,10,"Israel's pride testifies against him; yet they do not return to the Lord their God, or seek him, for all this."
Hosea,7,11,"Ephraim has become like a dove, silly and without sense; they call upon Egypt, they go to Assyria."
Hosea,7,12,"As they go, I will cast my net over them; I will bring them down like birds of the air; I will discipline them according to the report made to their assembly."
Hosea,7,13,"Woe to them, for they have strayed from me! Destruction to them, for they have rebelled against me! I would redeem them, but they speak lies against me."
Hosea,7,14,"They do not cry to me from the heart, but they wail upon their beds; they gash themselves for grain and wine; they rebel against me."
Hosea,7,15,"It was I who trained and strengthened their arms, yet they plot evil against me."
Hosea,7,16,They turn to that which does not profit; they have become like a defective bow; their officials shall fall by the sword because of the rage of their tongue. So much for their babbling in the land of Egypt.
Hosea,8,1,"Set the trumpet to your lips! One like a vulture is over the house of the Lord, because they have broken my covenant, and transgressed my law."
Hosea,8,2,"Israel cries to me, “My God, we—Israel—know you!”"
Hosea,8,3,Israel has spurned the good; the enemy shall pursue him.
Hosea,8,4,"They made kings, but not through me; they set up princes, but without my knowledge. With their silver and gold they made idols for their own destruction."
Hosea,8,5,"Your calf is rejected, O Samaria. My anger burns against them. How long will they be incapable of innocence?"
Hosea,8,6,"For it is from Israel, an artisan made it; it is not God. The calf of Samaria shall be broken to pieces."
Hosea,8,7,"For they sow the wind, and they shall reap the whirlwind. The standing grain has no heads, it shall yield no meal; if it were to yield, foreigners would devour it."
Hosea,8,8,Israel is swallowed up; now they are among the nations as a useless vessel.
Hosea,8,9,"For they have gone up to Assyria, a wild ass wandering alone; Ephraim has bargained for lovers."
Hosea,8,10,"Though they bargain with the nations, I will now gather them up. They shall soon writhe under the burden of kings and princes."
Hosea,8,11,"When Ephraim multiplied altars to expiate sin, they became to him altars for sinning."
Hosea,8,12,"Though I write for him the multitude of my instructions, they are regarded as a strange thing."
Hosea,8,13,"Though they offer choice sacrifices, though they eat flesh, the Lord does not accept them. Now he will remember their iniquity, and punish their sins; they shall return to Egypt."
Hosea,8,14,"Israel has forgotten his Maker, and built palaces; and Judah has multiplied fortified cities; but I will send a fire upon his cities, and it shall devour his strongholds."
Hosea,9,1,"Do not rejoice, O Israel! Do not exult as other nations do; for you have played the whore, departing from your God. You have loved a prostitute's pay on all threshing floors."
Hosea,9,2,"Threshing floor and wine vat shall not feed them, and the new wine shall fail them."
Hosea,9,3,"They shall not remain in the land of the Lord; but Ephraim shall return to Egypt, and in Assyria they shall eat unclean food."
Hosea,9,4,"They shall not pour drink offerings of wine to the Lord, and their sacrifices shall not please him. Such sacrifices shall be like mourners' bread; all who eat of it shall be defiled; for their bread shall be for their hunger only; it shall not come to the house of the Lord."
Hosea,9,5,"What will you do on the day of appointed festival, and on the day of the festival of the Lord?"
Hosea,9,6,"For even if they escape destruction, Egypt shall gather them, Memphis shall bury them. Nettles shall possess their precious things of silver; thorns shall be in their tents."
Hosea,9,7,"The days of punishment have come, the days of recompense have come; Israel cries, “The prophet is a fool, the man of the spirit is mad!” Because of your great iniquity, your hostility is great."
Hosea,9,8,"The prophet is a sentinel for my God over Ephraim, yet a fowler's snare is on all his ways, and hostility in the house of his God."
Hosea,9,9,"They have deeply corrupted themselves as in the days of Gibeah; he will remember their iniquity, he will punish their sins."
Hosea,9,10,"Like grapes in the wilderness, I found Israel. Like the first fruit on the fig tree, in its first season, I saw your ancestors. But they came to Baal-peor, and consecrated themselves to a thing of shame, and became detestable like the thing they loved."
Hosea,9,11,"Ephraim's glory shall fly away like a bird— no birth, no pregnancy, no conception!"
Hosea,9,12,"Even if they bring up children, I will bereave them until no one is left. Woe to them indeed when I depart from them!"
Hosea,9,13,"Once I saw Ephraim as a young palm planted in a lovely meadow, but now Ephraim must lead out his children for slaughter."
Hosea,9,14,"Give them, O Lord — what will you give? Give them a miscarrying womb and dry breasts."
Hosea,9,15,Every evil of theirs began at Gilgal; there I came to hate them. Because of the wickedness of their deeds I will drive them out of my house. I will love them no more; all their officials are rebels.
Hosea,9,16,"Ephraim is stricken, their root is dried up, they shall bear no fruit. Even though they give birth, I will kill the cherished offspring of their womb."
Hosea,9,17,"Because they have not listened to him, my God will reject them; they shall become wanderers among the nations."
Hosea,10,1,"Israel is a luxuriant vine that yields its fruit. The more his fruit increased the more altars he built; as his country improved, he improved his pillars."
Hosea,10,2,"Their heart is false; now they must bear their guilt. The Lord will break down their altars, and destroy their pillars."
Hosea,10,3,"For now they will say: “We have no king, for we do not fear the Lord, and a king—what could he do for us?”"
Hosea,10,4,They utter mere words; with empty oaths they make covenants; so litigation springs up like poisonous weeds in the furrows of the field.
Hosea,10,5,"The inhabitants of Samaria tremble for the calf of Beth-aven. Its people shall mourn for it, and its idolatrous priests shall wail over it, over its glory that has departed from it."
Hosea,10,6,"The thing itself shall be carried to Assyria as tribute to the great king. Ephraim shall be put to shame, and Israel shall be ashamed of his idol."
Hosea,10,7,Samaria's king shall perish like a chip on the face of the waters.
Hosea,10,8,"The high places of Aven, the sin of Israel, shall be destroyed. Thorn and thistle shall grow up on their altars. They shall say to the mountains, Cover us, and to the hills, Fall on us."
Hosea,10,9,"Since the days of Gibeah you have sinned, O Israel; there they have continued. Shall not war overtake them in Gibeah?"
Hosea,10,10,I will come against the wayward people to punish them; and nations shall be gathered against them when they are punished for their double iniquity.
Hosea,10,11,"Ephraim was a trained heifer that loved to thresh, and I spared her fair neck; but I will make Ephraim break the ground; Judah must plow; Jacob must harrow for himself."
Hosea,10,12,"Sow for yourselves righteousness; reap steadfast love; break up your fallow ground; for it is time to seek the Lord, that he may come and rain righteousness upon you."
Hosea,10,13,"You have plowed wickedness, you have reaped injustice, you have eaten the fruit of lies. Because you have trusted in your power and in the multitude of your warriors,"
Hosea,10,14,"therefore the tumult of war shall rise against your people, and all your fortresses shall be destroyed, as Shalman destroyed Beth-arbel on the day of battle when mothers were dashed in pieces with their children."
Hosea,10,15,"Thus it shall be done to you, O Bethel, because of your great wickedness. At dawn the king of Israel shall be utterly cut off."
Hosea,11,1,"When Israel was a child, I loved him, and out of Egypt I called my son."
Hosea,11,2,"The more I called them, the more they went from me; they kept sacrificing to the Baals, and offering incense to idols."
Hosea,11,3,"Yet it was I who taught Ephraim to walk, I took them up in my arms; but they did not know that I healed them."
Hosea,11,4,"I led them with cords of human kindness, with bands of love. I was to them like those who lift infants to their cheeks. I bent down to them and fed them."
Hosea,11,5,"They shall return to the land of Egypt, and Assyria shall be their king, because they have refused to return to me."
Hosea,11,6,"The sword rages in their cities, it consumes their oracle-priests, and devours because of their schemes."
Hosea,11,7,"My people are bent on turning away from me. To the Most High they call, but he does not raise them up at all."
Hosea,11,8,"How can I give you up, Ephraim? How can I hand you over, O Israel? How can I make you like Admah? How can I treat you like Zeboiim? My heart recoils within me; my compassion grows warm and tender."
Hosea,11,9,"I will not execute my fierce anger; I will not again destroy Ephraim; for I am God and no mortal, the Holy One in your midst, and I will not come in wrath."
Hosea,11,10,"They shall go after the Lord, who roars like a lion; when he roars, his children shall come trembling from the west."
Hosea,11,11,"They shall come trembling like birds from Egypt, and like doves from the land of Assyria; and I will return them to their homes, says the Lord."
Hosea,11,12," Ephraim has surrounded me with lies, and the house of Israel with deceit; but Judah still walks with God, and is faithful to the Holy One."
Hosea,12,1,"Ephraim herds the wind, and pursues the east wind all day long; they multiply falsehood and violence; they make a treaty with Assyria, and oil is carried to Egypt."
Hosea,12,2,"The Lord has an indictment against Judah, and will punish Jacob according to his ways, and repay him according to his deeds."
Hosea,12,3,"In the womb he tried to supplant his brother, and in his manhood he strove with God."
Hosea,12,4,"He strove with the angel and prevailed, he wept and sought his favor; he met him at Bethel, and there he spoke with him."
Hosea,12,5,"The Lord the God of hosts, the Lord is his name!"
Hosea,12,6,"But as for you, return to your God, hold fast to love and justice, and wait continually for your God."
Hosea,12,7,"A trader, in whose hands are false balances, he loves to oppress."
Hosea,12,8,"Ephraim has said, “Ah, I am rich, I have gained wealth for myself; in all of my gain no offense has been found in me that would be sin.”"
Hosea,12,9,"I am the Lord your God from the land of Egypt; I will make you live in tents again, as in the days of the appointed festival."
Hosea,12,10,"I spoke to the prophets; it was I who multiplied visions, and through the prophets I will bring destruction."
Hosea,12,11,"In Gilead there is iniquity, they shall surely come to nothing. In Gilgal they sacrifice bulls, so their altars shall be like stone heaps on the furrows of the field."
Hosea,12,12,"Jacob fled to the land of Aram, there Israel served for a wife, and for a wife he guarded sheep."
Hosea,12,13,"By a prophet the Lord brought Israel up from Egypt, and by a prophet he was guarded."
Hosea,12,14,"Ephraim has given bitter offense, so his Lord will bring his crimes down on him and pay him back for his insults."
Hosea,13,1,"When Ephraim spoke, there was trembling; he was exalted in Israel; but he incurred guilt through Baal and died."
Hosea,13,2,"And now they keep on sinning and make a cast image for themselves, idols of silver made according to their understanding, all of them the work of artisans. “Sacrifice to these,” they say. People are kissing calves!"
Hosea,13,3,"Therefore they shall be like the morning mist or like the dew that goes away early, like chaff that swirls from the threshing floor or like smoke from a window."
Hosea,13,4,"Yet I have been the Lord your God ever since the land of Egypt; you know no God but me, and besides me there is no savior."
Hosea,13,5,"It was I who fed you in the wilderness, in the land of drought."
Hosea,13,6,"When I fed them, they were satisfied; they were satisfied, and their heart was proud; therefore they forgot me."
Hosea,13,7,"So I will become like a lion to them, like a leopard I will lurk beside the way."
Hosea,13,8,"I will fall upon them like a bear robbed of her cubs, and will tear open the covering of their heart; there I will devour them like a lion, as a wild animal would mangle them."
Hosea,13,9,"I will destroy you, O Israel; who can help you?"
