Ecclesiastes,1,1,"These are the words of the Teacher. He is a son of David, king in Jerusalem."
Ecclesiastes,1,2,"The Teacher says, “Useless! Useless! Completely useless! All things are useless.”"
Ecclesiastes,1,3,What do people really gain from all the hard work they do here on earth?
Ecclesiastes,1,4,"People live, and people die. But the earth continues forever."
Ecclesiastes,1,5,"The sun rises, and the sun sets. Then it hurries back to the place where it rises again."
Ecclesiastes,1,6,"The wind blows to the south. Then it blows to the north. It blows from one direction and then another. Then it turns around and repeats the same pattern, going nowhere."
Ecclesiastes,1,7,All the rivers flow to the sea. But the sea never becomes full.
Ecclesiastes,1,8,Everything is boring. It makes you so tired you don’t even want to talk about it. Words come again and again to our ears. But we never can hear enough. Nor can we ever really see all we want to see.
Ecclesiastes,1,9,All things continue the way they have been since the beginning. The same things will be done that have always been done. There is nothing new here on earth.
Ecclesiastes,1,10,"A person might say, “Look, this is new!” But really it has always been here. It was here before we were!"
Ecclesiastes,1,11,"People don’t remember what happened long ago. In the future, people will not remember what happens now. And later, other people will not remember what was done before them."
Ecclesiastes,1,12,"I, the Teacher, was king over Israel in Jerusalem."
Ecclesiastes,1,13,I decided to use my wisdom. I wanted to learn about everything that happens here on earth. I learned that God has given us terrible things to face here on earth.
Ecclesiastes,1,14,I looked at everything done here on earth. I saw that it is all a waste of time. It is like chasing the wind.
Ecclesiastes,1,15,"If something is crooked, you can’t make it straight. If something is missing, you can’t say it is there."
Ecclesiastes,1,16,"I said to myself, “I have become very wise. I am now wiser than anyone who ruled Jerusalem before me. I know what wisdom and knowledge really are.”"
Ecclesiastes,1,17,So I decided to find out how wisdom and knowledge are better than foolish thinking. But I learned that trying to become wise is also like chasing the wind.
Ecclesiastes,1,18,With much wisdom comes much disappointment. The person who gains more knowledge also gains more sorrow.
Ecclesiastes,2,1,"I said to myself, “I will try having fun. I will enjoy myself.” But I found that this is also useless."
Ecclesiastes,2,2,It is foolish to laugh all the time. Having fun gets nothing done.
Ecclesiastes,2,3,I decided to cheer myself up with wine. At the same time my mind was still thinking wisely. I wanted to find a way to enjoy myself. I wanted to see what was good for people to do during their few days of life.
Ecclesiastes,2,4,"Then I did great things. I built houses, and I planted vineyards for myself."
Ecclesiastes,2,5,"I planted gardens, and I made parks. I planted all kinds of fruit trees in them."
Ecclesiastes,2,6,I made pools of water for myself. And I used them to water my growing trees.
Ecclesiastes,2,7,I bought men and women slaves. Slaves were also born in my house. I had large herds of cattle and flocks of sheep. I had more than anyone in Jerusalem before me.
Ecclesiastes,2,8,I also gathered silver and gold for myself. I took treasures from kings and other areas. I had men and women singers. I had all the wives a man could ever want.
Ecclesiastes,2,9,I became very famous. I was greater than anyone who had lived in Jerusalem before me. My wisdom helped me in all this.
Ecclesiastes,2,10,"Anything I saw and wanted, I got for myself. I did not miss any pleasure I desired. I was pleased with everything I did. And this pleasure was the reward for all my hard work."
Ecclesiastes,2,11,"But then I looked at what I had done. I thought about all the hard work. Suddenly I realized it was just a waste of time, like chasing the wind! There is nothing to gain from anything we do here on earth."
Ecclesiastes,2,12,"Then I began to think again about being wise. And I thought also about being foolish and doing crazy things. But after all, what more can any king do? He can only do what some other king has already done."
Ecclesiastes,2,13,"I saw that being wise is certainly better than being foolish, just as light is better than darkness."
Ecclesiastes,2,14,A wise man sees where he is going. But a foolish person is like someone walking around in the dark. Yet I saw that both the foolish person and the wise man end the same way.
Ecclesiastes,2,15,"I thought to myself, “What happens to a foolish person will happen to me, too. So what do I get for being so wise?” I said to myself, “Being wise is also useless.”"
Ecclesiastes,2,16,"The wise man and the foolish person will both die! People will not remember either one forever. In the future, both will be forgotten."
Ecclesiastes,2,17,So I hated life. It made me sad to think that everything here on earth is useless. It is like chasing the wind.
Ecclesiastes,2,18,I hated all the things I had worked for here on earth. I hated them because I must leave them to someone who will live after me.
Ecclesiastes,2,19,Someone else will control everything for which I worked so hard here on earth. And I don’t know if he will be wise or foolish. This is also useless.
Ecclesiastes,2,20,So I became sad about all the hard work I had done here on earth.
Ecclesiastes,2,21,"A person can work hard using all his wisdom, knowledge and skill. But he will die, and other people will get the things he worked for. They did not do the work, but they will get everything. This is also unfair and useless."
Ecclesiastes,2,22,What does a person get for all his work and struggling here on earth?
Ecclesiastes,2,23,All his life his work is full of pain and sorrow. Even at night his mind doesn’t rest. This is also useless.
Ecclesiastes,2,24,"The best a person can do is eat, drink and enjoy his work. I saw that even this comes from God."
Ecclesiastes,2,25,No one can eat or enjoy life without God.
Ecclesiastes,2,26,"If a person pleases God, God will give him wisdom, knowledge and joy. But the sinner will get only the work of gathering and storing wealth. Then he will have to give it to the one who pleases God. So all his work is useless. It is like chasing the wind."
Ecclesiastes,3,1,There is a right time for everything. Everything on earth has its special season.
Ecclesiastes,3,2,There is a time to be born and a time to die. There is a time to plant and a time to pull up plants.
Ecclesiastes,3,3,There is a time to kill and a time to heal. There is a time to destroy and a time to build.
Ecclesiastes,3,4,There is a time to cry and a time to laugh. There is a time to be sad and a time to dance.
Ecclesiastes,3,5,There is a time to throw away stones and a time to gather them. There is a time to hug and a time not to hug.
Ecclesiastes,3,6,There is a time to look for something and a time to stop looking for it. There is a time to keep things and a time to throw things away.
Ecclesiastes,3,7,There is a time to tear apart and a time to sew together. There is a time to be silent and a time to speak.
Ecclesiastes,3,8,There is a time to love and a time to hate. There is a time for war and a time for peace.
Ecclesiastes,3,9,Does a person really gain anything from his work?
Ecclesiastes,3,10,I saw the hard work God has given us to do.
Ecclesiastes,3,11,God has also given us a desire to know the future. God certainly does everything at just the right time. But we can never completely understand what he is doing.
Ecclesiastes,3,12,So I realize that the best thing for people is to be happy. They should enjoy themselves as long as they live.
Ecclesiastes,3,13,God wants everyone to eat and drink and be happy in his work. These are gifts from God.
Ecclesiastes,3,14,I know anything God does will continue forever. People cannot add anything to what God has done. And they cannot take anything away from it. God does it this way to cause people to honor him.
Ecclesiastes,3,15,What happens now has also happened in the past. Things that will happen in the future have also happened before. God makes the same things happen again and again.
Ecclesiastes,3,16,"I also saw this here on earth: Where there should have been justice, there was evil. Where there should have been fairness, there was wickedness."
Ecclesiastes,3,17,I certainly believe that God has planned a time for every thing and every action. He will judge both good people and bad people.
Ecclesiastes,3,18,But I decided that God leaves it the way it is to test people. He wants to show them they are just like animals.
Ecclesiastes,3,19,The same thing happens to animals and to people. They both have the same breath. So they both die. People are no better off than the animals. The lives of both are soon gone.
Ecclesiastes,3,20,Both end up the same way. Both came from dust. And both will go back to dust.
Ecclesiastes,3,21,Who can be sure that the spirit of man goes up to God? Or who can be sure that the spirit of an animal goes down into the ground?
Ecclesiastes,3,22,So I saw the best thing a person can do is to enjoy his work. That is all he has. No one can help a person see what will happen in the future.
Ecclesiastes,4,1,Again I saw all the people who were treated badly here on earth. I saw their tears. I saw that they had no one to comfort them. Cruel people had all the power. There was no one to comfort the people they hurt.
Ecclesiastes,4,2,I decided that the dead are better off than the living.
Ecclesiastes,4,3,But those who have never been born are better off still. They have not seen the evil that is done here on earth.
Ecclesiastes,4,4,"I realized the reason people work hard and try to succeed: They are jealous of each other. This, too, is useless. It is like chasing the wind."
Ecclesiastes,4,5,Some say that it is foolish to fold your hands and do nothing. You will starve to death!
Ecclesiastes,4,6,"Maybe so, but I say it is better to be content with what little you have. Otherwise, you will always be struggling for more. That is like chasing the wind."
Ecclesiastes,4,7,Again I saw something here on earth that was senseless:
Ecclesiastes,4,8,"I saw a person who had no family. He had no son or brother. He always worked hard. But he was never satisfied with what he had. He never asked himself, “For whom am I working so hard? Why don’t I let myself enjoy life?” This also is very sad and senseless."
Ecclesiastes,4,9,Two people are better than one. They get more done by working together.
Ecclesiastes,4,10,"If one person falls, the other can help him up. But it is bad for the person who is alone when he falls. No one is there to help him."
Ecclesiastes,4,11,"If two lie down together, they will be warm. But a person alone will not be warm."
Ecclesiastes,4,12,"An enemy might defeat one person, but two people together can defend themselves. A rope that has three parts wrapped together is hard to break."
Ecclesiastes,4,13,"A young person may be poor but wise. He is better than a foolish, old king who doesn’t listen to advice."
Ecclesiastes,4,14,I saw such a young person become king. He had been born poor in the kingdom. He had even gone to prison before becoming king.
Ecclesiastes,4,15,I watched some of the people who live on earth follow him. They made him their king.
Ecclesiastes,4,16,"Yes, a great many people followed him at first. But later, they did not like him, either. So fame and power are shown to be useless. They are like chasing the wind."
Ecclesiastes,5,1,Be careful when you go to worship at the Temple. It is better to listen than to offer foolish sacrifices. People who do this don’t even know they are doing wrong.
Ecclesiastes,5,2,"Think before you speak. Be careful about what you promise to God. God is in heaven, and you are on the earth. So say only a few words to God."
Ecclesiastes,5,3,The saying is true: Bad dreams come from too much worrying. So too many words come from foolish people.
Ecclesiastes,5,4,"If you make a promise to God, don’t be slow to keep it. God is not happy with foolish people. Give God what you promised."
Ecclesiastes,5,5,It is better not to promise anything than to promise something and not do it.
Ecclesiastes,5,6,"So don’t let your words cause you to sin. Also, don’t say to the priest at the Temple, “I didn’t mean what I promised!” If you do, God will become angry with your words. He will destroy everything you have worked for."
Ecclesiastes,5,7,Many empty promises are like many foolish dreams. They mean nothing. You should honor God.
Ecclesiastes,5,8,In some countries you will see poor people treated badly. They are not treated fairly or given their rights. Don’t be surprised! One officer is cheated by a higher officer. They in turn are cheated by even higher officers.
Ecclesiastes,5,9,The wealth of the country is divided up among them all. Even the king makes sure he gets his share of the profits.
Ecclesiastes,5,10,The person who loves money will never have all the money he wants. The person who loves wealth will not be satisfied when he gets it. This is also useless.
Ecclesiastes,5,11,"The more wealth a person has, the more friends he has to help him spend it. So what does he really gain? He gains nothing except to look at his riches."
Ecclesiastes,5,12,A man who works hard sleeps in peace. It is not important if he has little or much to eat. But a rich person worries about his wealth. He cannot sleep.
Ecclesiastes,5,13,I have seen something unfair here on earth: A person suffers harm from saving up his money.
Ecclesiastes,5,14,Then he loses it all in a bad deal. So he has nothing to give to his son.
Ecclesiastes,5,15,"A person comes into this world with nothing. And when he dies, he leaves with nothing. In spite of all his hard work, he leaves exactly as he came."
Ecclesiastes,5,16,"This, too, is unfair: He leaves exactly as he came. So what does he gain from chasing the wind?"
Ecclesiastes,5,17,"All he gets are days filled with sadness and sorrow. He ends up sick, defeated and angry."
Ecclesiastes,5,18,I have seen what is best for a person to do here on earth. He should eat and drink and enjoy his work. This is because the life God has given him on earth is short.
Ecclesiastes,5,19,God gives some people the ability to enjoy the wealth and property he gives them. He also gives them the ability to accept their state in life and enjoy their work.
Ecclesiastes,5,20,Such people do not worry much about how short life is. This is because God keeps them busy with the things they love to do.
Ecclesiastes,6,1,I have seen something else unfair here on earth. It causes serious problems for people.
Ecclesiastes,6,2,"God gives some people great wealth, riches and honor. They have everything they want. But God does not let them enjoy such things. Someone else enjoys them instead. This is unfair and senseless."
Ecclesiastes,6,3,It is sad when a person can’t enjoy the good things God gives him. Such a person might have 100 children. He might live a long time. But what good is it if he can’t enjoy the good God gives him? I say a baby who is born dead is better off than he is.
Ecclesiastes,6,4,It is useless for such a baby to be born. It ends up in the darkness of the grave without even a name.
Ecclesiastes,6,5,That baby never saw the sun. It never knew anything. But it finds more rest than the person who never gets to enjoy the good things God gives him.
Ecclesiastes,6,6,"Even if he lives 2,000 years, it is sad if a person can’t enjoy the good things God gives him. After all, both he and the baby born dead go to the same place—the grave."
Ecclesiastes,6,7,A person works just to feed himself. But he never seems to get enough to eat.
Ecclesiastes,6,8,"In this way a wise man is no better off than a foolish person. Then, too, it does a poor man little good to know how to get along in life."
Ecclesiastes,6,9,So it is better to be happy with what you have than always to be wanting more. Always wanting more is useless— like chasing the wind.
Ecclesiastes,6,10,Everything that happens was planned long ago. A man is only what he was created to be. It is useless to argue with God about it. This is because God is more powerful than man is.
Ecclesiastes,6,11,"The more you argue, the more useless it is. You gain nothing at all by arguing."
Ecclesiastes,6,12,A person has only a few days of life on the earth. His short life passes like a shadow. And who knows what is best for him while he lives? Who can tell him what will happen after his time on earth?
Ecclesiastes,7,1,It is better to have respect than good perfume. The day a person dies is better than the day he was born.
Ecclesiastes,7,2,It is better to go to a funeral than to a party. We all must die. Everyone living should think about this.
Ecclesiastes,7,3,Sorrow is better than laughter. Sadness has a good influence on you.
Ecclesiastes,7,4,"A wise man thinks about death, but a foolish person thinks only about having a good time."
Ecclesiastes,7,5,It is better to be criticized by a wise man than to be praised by a foolish person.
Ecclesiastes,7,6,The laughter of foolish people is useless. It is like heating a pot by burning straw. There is a lot of fire but no heat.
Ecclesiastes,7,7,Even a wise man will become foolish if he lets money change his thinking.
Ecclesiastes,7,8,It is better to finish something than to start it. It is better to be patient than to be proud.
Ecclesiastes,7,9,"Don’t become mad quickly, because getting angry is foolish."
Ecclesiastes,7,10,"Don’t ask, “Why was life better in the ‘good old days’?” It is not wise to ask such questions."
Ecclesiastes,7,11,Wisdom is as good to have as inheriting property. It helps people see what to do.
Ecclesiastes,7,12,"Wisdom is like money. They both help a person. But wisdom is better than money, because it can save a person’s life."
Ecclesiastes,7,13,"Stop and think about everything that God causes to happen. You cannot change a thing, even if you think it is wrong."
Ecclesiastes,7,14,"When life is good, enjoy it. But when life is hard, remember: God gives us good times and hard times. And no one knows what tomorrow will bring."
Ecclesiastes,7,15,In my short life I have seen both of these: I have seen good men die being good. And I have seen evil men living a long time.
Ecclesiastes,7,16,"Don’t try to be too right all the time. Don’t try to be too wise, either. Why should you destroy yourself this way?"
Ecclesiastes,7,17,Don’t be too wicked. And don’t be a foolish person. You will die young if you do so.
Ecclesiastes,7,18,Try to avoid going too far in doing anything. Those who honor God will avoid doing too much of anything.
Ecclesiastes,7,19,Wisdom gives a person strength. One wise man is stronger than ten leaders in a city.
Ecclesiastes,7,20,Surely there is not a good man on earth who always does good and never sins.
Ecclesiastes,7,21,Don’t listen to everything people say. You might hear your servant insulting you.
Ecclesiastes,7,22,You know that many times you also have insulted others.
Ecclesiastes,7,23,"I used wisdom to test all these things. I wanted to be wise, but it was too hard for me."
Ecclesiastes,7,24,I cannot understand why things are as they are. It is too hard for anyone to understand.
Ecclesiastes,7,25,I studied and tried very hard to find wisdom. I tried to find some meaning for everything. I learned that it is foolish to be evil. And it is crazy to act like a fool.
Ecclesiastes,7,26,I found that some women are worse than death. They are as dangerous as traps. Their love is like a net. Their arms hold men like chains. A man who follows God will run away from them. But a sinner will be caught by them.
Ecclesiastes,7,27,"The Teacher says, “This is what I learned: I added all these things together to see if I could find some meaning for everything."
Ecclesiastes,7,28,"I am still looking for it, but I have not found it. But I did discover that truly good people are hard to find. Such people are one in a million!"
Ecclesiastes,7,29,One thing I have learned: God made people good. But people have found all kinds of ways to be bad.”
Ecclesiastes,8,1,No one is like the wise man. He can understand what things mean. His wisdom makes him happy. It makes his sad face happy.
Ecclesiastes,8,2,I advise you always to obey the king’s command. Do this because you made a promise to God.
Ecclesiastes,8,3,"Don’t be too quick to quit the job the king gave you. But don’t support something that is wrong. Remember, the king does whatever he pleases."
Ecclesiastes,8,4,The king is the highest power. No one can tell him what to do.
Ecclesiastes,8,5,A person will be safe if he obeys the king’s command. A wise man knows how to do the right thing at the right time.
Ecclesiastes,8,6,And there is a right time and a right way for everything. Yet people often have many troubles.
Ecclesiastes,8,7,They do not know what the future holds. No one can tell them what will happen.
Ecclesiastes,8,8,"No one has the power to keep the wind from blowing. No one has the power to stop his own death. During war a soldier cannot go home. So also, the person who does evil will not get away free."
Ecclesiastes,8,9,I saw all of this as I studied. I considered all that is done here on earth. And I saw men rule others and hurt them.
Ecclesiastes,8,10,"I saw evil people being buried. They used to go in and out of the holy place. Good things were said about them in the same towns where they had done evil. This is senseless, too."
Ecclesiastes,8,11,"Sometimes people are not punished right away for the bad things they do. That makes other people want to do bad things, too."
Ecclesiastes,8,12,"A sinner might do a hundred evil things. And he might live a long time. Even so, I know it will be better for those who honor God. They fear him, and he sees it."
Ecclesiastes,8,13,And I also know it will not go well for evil people. Their lives will be like a brief shadow. They will not live very long.
Ecclesiastes,8,14,But sometimes something senseless happens on earth. Bad things happen to good people. Good things happen to bad people. This is truly senseless.
Ecclesiastes,8,15,"So I decided it was more important to enjoy life. The best that people can do here on earth is to eat, drink and enjoy life. These joys will help people do the hard work God gives them here on earth."
Ecclesiastes,8,16,I used my mind to learn about all that happens on earth. I saw how busy people are. They work day and night and hardly ever sleep.
Ecclesiastes,8,17,"I also saw all that God has done. Nobody can understand what God does here on earth. No matter how hard a person tries to understand it, he cannot. Even if a wise man says he understands, he really cannot. No one at all can really understand it."
Ecclesiastes,9,1,I thought about something else and tried hard to understand it. I saw that God takes care of both good people and wise people and what they do. But no one knows if he will see good or bad times.
Ecclesiastes,9,2,Both good and bad things happen to everyone. They happen to those who are fair and to those who are wicked. They happen to those who are good and to those who are evil. They happen to those who sacrifice and to those who do not. The same things happen to a good person as happen to a sinner. The same things happen to a person who makes promises to God as to one who does not.
Ecclesiastes,9,3,"This is something unfair that happens here on earth. The same things happen to everyone. So men’s minds are full of evil and foolish thoughts while they live. After that, they join the dead."
Ecclesiastes,9,4,But anyone still alive has hope. Even a live dog is better off than a dead lion!
Ecclesiastes,9,5,The living know they will die. But the dead no longer think about such things. Dead people have no more reward. People forget them.
Ecclesiastes,9,6,"After a person is dead, he can no longer show love or hate or jealousy. And he will never again share in the things that happen here on earth."
Ecclesiastes,9,7,So go eat your food and enjoy it. Drink your wine and be happy. It is all right with God if you do this.
Ecclesiastes,9,8,Put on nice clothes and make yourself look good.
Ecclesiastes,9,9,Enjoy life with the wife you love. Enjoy all the days of this short life God has given you here on earth. It is all you have. So enjoy the work you have to do here on earth.
Ecclesiastes,9,10,"Whatever work you do, do your best. This is because you are going to the grave. There is no working, no planning, no knowledge and no wisdom there."
Ecclesiastes,9,11,I also realized something else here on earth that is senseless: The fast runner does not always win the race. The strong army does not always win the battle. The wise man does not always have food. The smart man does not always become wealthy. And the man with special skills does not always receive praise. Bad things happen to everyone.
Ecclesiastes,9,12,"A person never knows what will happen to him next. He is like a fish caught in a cruel net. He is like a bird caught in a trap. In the same way, a person is trapped by bad things that suddenly happen to him."
Ecclesiastes,9,13,I also saw something wise happen here on earth. And it was very impressive to me.
Ecclesiastes,9,14,There was a small town with only a few people in it. A great king fought against it and put his armies all around it.
Ecclesiastes,9,15,"Now there was a wise man in the town. He was poor, but he used his wisdom to save his town. But later on, everyone forgot about him."
Ecclesiastes,9,16,I still think wisdom is better than strength. But those people forgot about the poor man’s wisdom. And they stopped listening to what he said.
Ecclesiastes,9,17,The quiet words of a wise man are better than the shouts of a foolish ruler.
