Isaiah,45,21,"Tell these people to come to me. Let them talk about these things together. Who told you long ago that this would happen? Who told about it long ago? I, the Lord, said these things. There is no other God besides me. I am the only good God. I am the Savior. There is no other God."
Isaiah,45,22,"“All people everywhere, follow me and be saved. I am God. There is no other God."
Isaiah,45,23,I will make a promise by my own power. And my promise is true. What I say will not be changed. I promise that everyone will bow before me. Everyone will promise to follow me.
Isaiah,45,24,"People will say, ‘Goodness and power come only from the Lord.’” Everyone who has been angry with the Lord will come to him and be ashamed."
Isaiah,45,25,"But with the Lord’s help, the people of Israel will be found to be good. And they will praise him."
Isaiah,46,1,Bel and Nebo bow down. Their idols are carried by animals. The statues are only heavy loads that must be carried. They only make people tired.
Isaiah,46,2,These false gods will all bow down. They cannot save themselves. They will all be carried away like prisoners.
Isaiah,46,3,"“Family of Jacob, listen to me! All you people from Israel who are still alive, listen! I have carried you since you were born. I have taken care of you from your birth."
Isaiah,46,4,"Even when you are old, I will take care of you. Even when your hair has turned gray, I will take care of you. I made you and will take care of you. I will carry you, and I will save you."
Isaiah,46,5,“Can you compare me to anyone? No one is equal to me or like me.
Isaiah,46,6,"Some people are rich with gold. They weigh their silver on the scales. They hire a goldsmith, and he makes it into a god. Then they bow down and worship it."
Isaiah,46,7,"They put it on their shoulders and carry it. They set it in its place, and there it stands. It cannot move from its place. People may yell at it, but it cannot answer. It cannot save people from their troubles."
Isaiah,46,8,"“Remember this, and do not forget it! Think about these things, you who turn against God."
Isaiah,46,9,Remember what happened long ago. Remember that I am God. There is no other God. I am God. There is no one like me.
Isaiah,46,10,"From the beginning I told you what would happen in the end. A long time ago I told you things that have not yet happened. When I plan something, it happens. I do the things I want to do."
Isaiah,46,11,I am calling a man from the east to carry out my plan. He will come like a hawk from a country far away. I will make what I have said come true. I will do what I have planned.
Isaiah,46,12,"Listen to me, you stubborn people. You are far from what is right."
Isaiah,46,13,I will soon do the things that are right. I will bring salvation soon. I will save Jerusalem. And I will bring glory to Israel.”
Isaiah,47,1,"The Lord says, “City of Babylon, go down and sit in the dirt. People of Babylon, sit on the ground. You are no longer the ruler. You will no longer be called tender or beautiful."
Isaiah,47,2,You must use large stones to grind grain into flour. Remove your veil and your nice skirts. Uncover your legs and cross the rivers.
Isaiah,47,3,Men will see your nakedness. They will see your shame. I will punish you. I will punish every one of you.”
Isaiah,47,4,Our Savior is named the Lord of heaven’s armies. He is the Holy One of Israel.
Isaiah,47,5,"“Babylon, sit in darkness and say nothing. You will no longer be called the queen of kingdoms."
Isaiah,47,6,"I was angry with my people. So I rejected those people who belonged to me. I gave them to you, but you showed them no mercy. You even made the old people work very hard."
Isaiah,47,7,"You said, ‘I will live forever. I will always be the queen.’ You did not think about these things. You did not think about what would happen."
Isaiah,47,8,"“Now, listen, you lover of pleasure. You think you are safe. You tell yourself, ‘I am the only important person. I will never be a widow. I will never lose my children.’"
Isaiah,47,9,Two things will happen to you suddenly in a single day. You will lose your children and your husband. These things will truly happen to you. All your magic and powerful tricks will not save you.
Isaiah,47,10,"You do evil things, but you feel safe. You say, ‘No one sees what I do.’ Your wisdom and knowledge have fooled you. You say to yourself, ‘I am God. No one is equal to me.’"
Isaiah,47,11,But troubles will come to you. You will not know how to stop them. Disaster will fall on you. And you will not be able to keep it away. You will be destroyed quickly. You will not even see it coming.
Isaiah,47,12,“Keep on using your tricks. Continue doing all your magic. You have done these things since you were young. Maybe they will help you. Maybe you will be able to scare someone.
Isaiah,47,13,You are tired of the advice you have received. So let those who study the sky come. They tell the future by looking at the stars. So let them save you from what is about to happen to you.
Isaiah,47,14,But they are like straw. Fire will quickly burn them up. They cannot save themselves from the power of the fire. They are not like coals that give warmth. They are not like a fire you may sit beside.
Isaiah,47,15,You have worked with these people. They have been with you since you were young. But they will not be able to help you. Everyone will go his own way. And there will be no one left to save you.”
Isaiah,48,1,"The Lord says, “Family of Jacob, listen to me. You are called Israel. You come from the family of Judah. You use the Lord’s name to make promises. You praise the God of Israel, but you are not honest or sincere."
Isaiah,48,2,You call yourselves people of the holy city. You depend on the God of Israel. He is named the Lord of heaven’s armies.
Isaiah,48,3,"Long ago I told you what would happen. I said these things and made them known. Suddenly I acted, and these things happened."
Isaiah,48,4,I did that because I knew you were stubborn. Your neck was like an iron muscle. It was as if your head were made of bronze.
Isaiah,48,5,"So a long time ago I told you about these things. I told you about them before they happened. I did this so you couldn’t say, ‘My idols did this. My wooden and metal statues made these things happen.’"
Isaiah,48,6,“You heard and saw all the things that happened. So you should tell this news to others. Now I will tell you about new things. These are hidden things that you don’t know yet.
Isaiah,48,7,"These things are happening now, not long ago. You have not heard about them before today. So you cannot say, ‘We already knew about that.’"
Isaiah,48,8,But you have not heard me. You have not understood. Even long ago you did not listen to me. I knew you would surely turn against me. You have fought against me since you were born.
Isaiah,48,9,But for my own sake I will be patient. People will praise me for not becoming angry and destroying you.
Isaiah,48,10,"I have made you pure, but not by fire, as silver is made pure. I have purified you by giving you troubles."
Isaiah,48,11,"I do this for myself, for my own sake. I will not let people speak evil against me. I will not let some false god take my glory."
Isaiah,48,12,"“People of Jacob, listen to me. People of Israel, I have called you to be my people. I am God. I am the beginning and the end."
Isaiah,48,13,"I made the earth with my own hands. With my right hand I spread out the skies. When I call them, they come together before me."
Isaiah,48,14,"“All of you, come together and listen. None of the false gods said these things would happen. I, the Lord, have chosen someone to attack the Babylonians. He will carry out my wishes against Babylon."
Isaiah,48,15,"I have spoken. I have called him. I have brought him, and I will make him successful."
Isaiah,48,16,"Come to me and listen to this. From the beginning I have spoken openly. From the time it began, I was there.” Now, the Lord God has sent me with his Spirit."
Isaiah,48,17,"The Lord is your close relative who saves you, the Holy One of Israel. The Lord says, “I am the Lord your God. I teach you to do what is good. I lead you in the way you should go."
Isaiah,48,18,"If you had obeyed me, you would have had peace like a full-flowing river. Good things would have flowed to you like the waves of the sea."
Isaiah,48,19,You would have had many children. They would have been as many as the grains of sand. They would never have died out. They would not have been destroyed.”
Isaiah,48,20,"My people, leave Babylon! Run from the Babylonians! Tell this news with shouts of joy to the people. Spread it everywhere on earth. Say, “The Lord has saved his servants, the people of Jacob.”"
Isaiah,48,21,"They did not become thirsty when he led them through the deserts. He made water flow from a rock for them. He split the rock, and water flowed out."
Isaiah,48,22,"“There is no peace for evil people,” says the Lord."
Isaiah,49,1,"All of you people in faraway places, listen to me. Listen, all you nations far away. Before I was born, the Lord called me to serve him. The Lord named me while I was still in my mother’s body."
Isaiah,49,2,The Lord made my tongue like a sharp sword. He hid me in the shadow of his hand. The Lord made me like a sharp arrow. He hid me in the holder for his arrows.
Isaiah,49,3,"The Lord told me, “Israel, you are my servant. I will show my glory through you.”"
Isaiah,49,4,"But I said, “I have worked hard for nothing. I have used all my power, but I did nothing useful. But the Lord will decide what my work is worth. God will decide my reward.”"
Isaiah,49,5,The Lord made me in the body of my mother so I would be his servant. He made me to lead the people of Jacob back to him. He made me so that Israel might be gathered to him. The Lord will honor me. I will get my strength from my God.
Isaiah,49,6,"The Lord told me, “You are an important servant to me. You will bring back the tribes of Jacob. You will bring back the people of Israel who are left alive. But, more importantly, I will make you a light for all nations. You will show people all over the world the way to be saved.”"
Isaiah,49,7,"The Lord is your close relative who saves you. He is the Holy One of Israel. He speaks to the one who is hated by the people. He speaks to the servant of rulers. The Lord says, “Kings will see you and stand to honor you. Great leaders will bow down before you. This is because the Lord can be trusted. He is the Holy One of Israel, who has chosen you.”"
Isaiah,49,8,This is what the Lord says: “At the right time I will hear your prayers. On the day of salvation I will help you. I will protect you. And you will be the sign of my agreement with the people. You will bring back the people to the land. You will give the land that is now ruined back to its owners.
Isaiah,49,9,"You will tell the prisoners, ‘Come out of your prison.’ You will tell those in darkness, ‘Come into the light.’ The people will eat beside the roads. They will find food even on bare hills."
Isaiah,49,10,They will not be hungry or thirsty. Neither the hot sun nor the desert wind will hurt them. The God who comforts them will lead them. He will lead them by springs of water.
Isaiah,49,11,I will make my mountains into roads for my people. And the roads will be raised up.
Isaiah,49,12,"Look, people are coming to me from far away. They are coming from the north and from the west. They are coming from Aswan in southern Egypt.”"
Isaiah,49,13,"Heavens and earth, be happy. Mountains, shout with joy. Be happy because the Lord comforts his people. He will comfort those who suffer."
Isaiah,49,14,"But Jerusalem said, “The Lord has left me. The Lord has forgotten me.”"
Isaiah,49,15,"The Lord answers, “Can a woman forget the baby she nurses? Can she feel no kindness for the child she gave birth to? Even if she could forget her children, I will not forget you."
Isaiah,49,16,"See, I have written your name on my hand. Jerusalem, I always think about your walls."
Isaiah,49,17,Your children will soon return to you. And the people who defeated you and destroyed you will leave.
Isaiah,49,18,"Look up and look around you. All your children are gathering to return to you.” The Lord says, “As surely as I live, your children will be like jewels. You will be as proud of them as a bride is of her jewels."
Isaiah,49,19,“You were destroyed and defeated. Your land was made useless. But now you will have more people than the land can hold. And those people who destroyed you will be far away.
Isaiah,49,20,"Children were born to you while you were sad. But they will say to you, ‘This place is too small for us. Give us a bigger place to live.’"
Isaiah,49,21,"Then you will say to yourself, ‘Who gave me all these children? I was sad and lonely. I was defeated and away from my people. So who reared these children? I was left all alone. Where did all these children come from?’”"
Isaiah,49,22,"This is what the Lord God says: “See, I will lift my hand to signal the nations. I will raise my banner for all people to see. Then they will bring your sons back to you in their arms. They will carry your daughters on their shoulders."
Isaiah,49,23,Kings will teach your children. Daughters of kings will take care of those children. They will bow down before you. They will kiss the dirt at your feet. Then you will know I am the Lord. Anyone who trusts in me will not be disappointed.”
Isaiah,49,24,Can the wealth a soldier wins in war be taken away from him? Can a prisoner be freed from a powerful soldier?
Isaiah,49,25,But this is what the Lord says: “The prisoners will be taken from the strong soldiers. What the soldiers have taken will be saved. I will fight your enemies. I will save your children.
Isaiah,49,26,"I will force those who trouble you to eat their own flesh. Their own blood will be the wine that makes them drunk. Then everyone will know I, the Lord, am the One who saves you. I am the Powerful One of Jacob who saves you.”"
Isaiah,50,1,"This is what the Lord says: “People of Israel, you say I divorced your mother. Then where is the paper that proves it? Or do you think I sold you to pay a debt? No! It was because of the evil things you did that I sold you. It was because of the times she turned against me that your mother was sent away."
Isaiah,50,2,"I came home and found no one there. I called, but no one answered. Do you think I am not able to save you? Do I not have the power to save you? Look, I need only to shout, and the sea becomes dry. I change rivers into a desert. Their fish rot because there is no water. The fish die of thirst."
Isaiah,50,3,I can make the skies dark. I can make them black like clothes of sadness.”
Isaiah,50,4,The Lord God gave me the ability to teach. He has taught me what to say to make the weak strong. Every morning he wakes me. He teaches me to listen like a student.
Isaiah,50,5,The Lord God helps me learn. And I have not turned against him. I have not stopped following him.
Isaiah,50,6,I offered my back to those who beat me. I offered my cheeks to those who pulled my beard. I won’t hide my face from them when they make fun of me and spit at me.
Isaiah,50,7,The Lord God helps me. So I will not be ashamed. I will be determined. I know I will not be disgraced.
Isaiah,50,8,"The Lord shows that I am innocent, and he is close to me. So who can accuse me? If there is someone, let us go to court together. If someone wants to prove I have done wrong, he should come and tell me."
Isaiah,50,9,It is the Lord God who helps me. So who can prove me guilty? All those who try will become useless like old clothes. Moths will eat them.
Isaiah,50,10,Who among you fears the Lord and obeys his servant? That person may walk in the dark and have no light. Then let him trust in the Lord. Let him depend on his God.
Isaiah,50,11,"But instead, some of you want to light your own fires. You want to make your own light. So, go, walk in the light of your fires. Trust your own light to guide you. But this is what you will receive from me: You will lie down in a place of pain."
Isaiah,51,1,"The Lord says, “Listen to me, those of you who try to live right and follow the Lord. Look at the rock from which you were cut. Look at the stone quarry from which you were dug."
Isaiah,51,2,"Look at Abraham, your ancestor. Look at Sarah, who gave birth to your ancestors. Abraham had no children when I called him. But I blessed him and gave him many descendants."
Isaiah,51,3,So the Lord will comfort Jerusalem. He will show mercy to those who live in her ruins. He will change her deserts into a garden like Eden. He will make her empty lands like the garden of the Lord. People there will be very happy. They will give thanks and sing songs.
Isaiah,51,4,"“My people, listen to me. My nation, pay attention to me. I will give the people my teachings. And my decisions will be like a light to all people."
Isaiah,51,5,I will soon show I do what is right. I will soon save you. I will use my power and judge all nations. All the faraway places are waiting for me. They wait for my power to help them.
Isaiah,51,6,Look up to the heavens. Look around you at the earth below. The skies will disappear like clouds of smoke. The earth will become useless like old clothes. Its people will die like flies. But my salvation will continue forever. My goodness will never end.
Isaiah,51,7,“You people who know what is right should listen to me. You people who follow my teachings should hear what I say. Don’t be afraid of the evil things people say. Don’t be upset by their insults.
Isaiah,51,8,Moths will eat those people as if they were clothes. Worms will eat them as if they were wool. But my goodness will continue forever. My salvation will continue from now on.”
Isaiah,51,9,"Wake up, wake up, and use your strength, powerful Lord. Wake up as you did in the old times. Wake up as you did a long time ago. With your own power, you cut Rahab into pieces. You killed that sea monster."
Isaiah,51,10,You caused the sea to become dry. You dried the waters of the deep ocean. You made the deepest parts of the sea into a road. Your people crossed over on that road and were saved.
Isaiah,51,11,The people the Lord has freed will return. They will enter Jerusalem with joy. Their happiness will last forever. They will have joy and gladness. All sadness and sorrow will be gone far away.
Isaiah,51,12,"The Lord says, “I am the one who comforts you. So why should you be afraid of people, who die? Why should you fear people who die like the grass?"
Isaiah,51,13,Have you forgotten that the Lord made you? He stretched out the skies. He made the earth. Why are you always afraid of those angry people who trouble you? They want to destroy. But where are those angry people now?
Isaiah,51,14,People in prison will soon be set free. They will not die in prison. They will have enough food.
Isaiah,51,15,This is because I am the Lord your God. I stir the sea and make the waves roar. My name is the Lord of heaven’s armies.
Isaiah,51,16,"I will give you the words I want you to say. I will cover you with my hands and protect you. I made the heavens and the earth. And I say to Jerusalem, ‘You are my people.’”"
Isaiah,51,17,The Lord was very angry with you. Your punishment was like wine in a cup. The Lord made you drink that wine until you stumbled.
Isaiah,51,18,"Jerusalem had many people. But there was not a person to lead her. Of all the people who grew up there, no one was there to guide her."
Isaiah,51,19,"Troubles came to you in groups of two. No one will feel sorry for you. There was ruin and disaster, great hunger and fighting. No one can comfort you."
Isaiah,51,20,Your people have become weak. They fall down and lie on every street corner. They are like animals caught in a net. They have felt the full anger of the Lord. They have heard God’s angry shout.
Isaiah,51,21,"So listen to me, poor Jerusalem, you who are drunk but not from wine."
Isaiah,51,22,Your God will fight for his people. This is what the Lord your God says: “The punishment I gave you is like a cup of wine. You drank it and could not walk straight. I am taking that cup of my anger away from you. You will never be punished by my anger again.
Isaiah,51,23,"I will now give that cup of punishment to those who gave you pain. They told you, ‘Bow down so we can walk over you.’ They made your back like dirt for them to walk on. You were like a street for them to travel on.”"
Isaiah,52,1,"Wake up, wake up, Jerusalem! Become strong! Be beautiful again, holy city of Jerusalem. The people who do not worship God and who are not pure will not enter you again."
Isaiah,52,2,"Jerusalem, you once were a prisoner. Now shake off the dust and stand up. Jerusalem, you once were a prisoner. But now free yourself from the chains around your neck."
Isaiah,52,3,This is what the Lord says: “You were not sold for a price. So you will be saved without cost.”
Isaiah,52,4,This is what the Lord God says: “First my people went down to Egypt to live. Later Assyria made them slaves.
Isaiah,52,5,"“Now see what has happened,” says the Lord. “Another nation has taken away my people for nothing. This nation who rules them makes fun of me,” says the Lord. “All day long they speak against me."
Isaiah,52,6,But this has happened so my people will know who I am. They will know I am God. And they will know that I am the one speaking to them.”
Isaiah,52,7,"How beautiful is the person who comes over the mountains to bring good news. How beautiful is the one who announces peace. He brings good news and announces salvation. How beautiful are the feet of the one who says to Jerusalem, “Your God is king.”"
Isaiah,52,8,Listen! Your guards are shouting. They are all shouting for joy! They all will see with their own eyes when the Lord returns to Jerusalem.
Isaiah,52,9,"Jerusalem, your buildings are destroyed now. But shout and rejoice together. You can rejoice because the Lord has comforted his people. He has saved Jerusalem."
Isaiah,52,10,The Lord will show his holy power to all the nations. Then everyone on earth will see the salvation of our God.
Isaiah,52,11,"You people, leave, leave; get out of Babylon! Touch nothing that is unclean. You men who carry the things used in worship, leave there and make yourselves pure."
Isaiah,52,12,You will not be forced to leave Babylon quickly. You will not be forced to run away. The Lord will go before you. And the God of Israel will guard you from behind.
Isaiah,52,13,"The Lord says, “See, my servant will act wisely. People will greatly honor and respect him."
Isaiah,52,14,Many people were shocked when they saw him. His appearance was so damaged he did not look like a man. His form was changed so much they could barely tell he was human.
Isaiah,52,15,But now he will sprinkle many people. Kings will be amazed and shut their mouths. They will see the things they had not been told about my servant. They will understand the things they had not heard.”
Isaiah,53,1,Who would have believed what we heard? Who saw the Lord’s power in this?
Isaiah,53,2,He grew up like a small plant before the Lord. He was like a root growing in a dry land. He had no special beauty or form to make us notice him. There was nothing in his appearance to make us desire him.
Isaiah,53,3,"He was hated and rejected by people. He had much pain and suffering. People would not even look at him. He was hated, and we didn’t even notice him."
Isaiah,53,4,But he took our suffering on him and felt our pain for us. We saw his suffering. We thought God was punishing him.
Isaiah,53,5,"But he was wounded for the wrong things we did. He was crushed for the evil things we did. The punishment, which made us well, was given to him. And we are healed because of his wounds."
Isaiah,53,6,We all have wandered away like sheep. Each of us has gone his own way. But the Lord has put on him the punishment for all the evil we have done.
Isaiah,53,7,"He was beaten down and punished. But he didn’t say a word. He was like a lamb being led to be killed. He was quiet, as a sheep is quiet while its wool is being cut. He never opened his mouth."
Isaiah,53,8,Men took him away roughly and unfairly. He died without children to continue his family. He was put to death. He was punished for the sins of my people.
Isaiah,53,9,He was buried with wicked men. He died with the rich. He had done nothing wrong. He had never lied.
Isaiah,53,10,But it was the Lord who decided to crush him and make him suffer. So the Lord made his life a penalty offering. But he will see his descendants and live a long life. He will complete the things the Lord wants him to do.
Isaiah,53,11,He will suffer many things in his soul. But then he will see life and be satisfied. My good servant will make many people right with God. He carried away their sins.
Isaiah,53,12,For this reason I will make him a great man among people. He will share in all things with those who are strong. He willingly gave his life. He was treated like a criminal. But he carried away the sins of many people. And he asked forgiveness for those who sinned.
Isaiah,54,1,"The Lord says, “Sing, Jerusalem. You are like a woman who never gave birth to children. Start singing and shout for joy. You never felt the pain of giving birth. But you will have more children than the woman who has a husband."
Isaiah,54,2,Make your tent bigger. Stretch it out and make it wider. Do not hold back. Make the ropes longer. Make its stakes stronger.
Isaiah,54,3,Do this because you will begin growing very much. Your children will take over other nations. And they will again live in cities that once were destroyed.
