Isaiah,33,1,"How terrible it will be for you who destroy others. But you have not been destroyed yet. How terrible it will be for you, traitor. But no one has turned against you yet. When you stop destroying, others will destroy you. When you stop turning against others, they will turn against you."
Isaiah,33,2,"Lord, be kind to us. We have waited for your help. Lord, give us strength every morning. Save us when we are in trouble."
Isaiah,33,3,Your powerful voice makes people run away in fear. Your greatness causes the nations to run away.
Isaiah,33,4,"Like locusts, your enemies will take away the things you stole in war. Like locusts rushing about, they will take your wealth."
Isaiah,33,5,The Lord is very great. He lives in a high place. He fills Jerusalem with fairness and justice.
Isaiah,33,6,"The Lord will be your safety. He is full of salvation, wisdom and knowledge. Respect for the Lord is the greatest treasure."
Isaiah,33,7,"See, brave men are crying out in the streets. Those who tried to bring peace are crying loudly."
Isaiah,33,8,There is no one on the roads. No one is walking in the paths. People have broken the agreements they made. People refuse to believe the proof from witnesses. No one respects other people.
Isaiah,33,9,The land is sick and dying. Lebanon is ashamed and dying. The Plain of Sharon is dry like the desert. The trees of Bashan and Carmel are dying.
Isaiah,33,10,"The Lord says, “Now, I will stand up and show my greatness. Now, I will become important to the people."
Isaiah,33,11,You people do useless things. These things are like hay and straw. A destructive wind will burn you like fire.
Isaiah,33,12,People will be burned until their bones become like lime. They will burn quickly like dry thornbushes.”
Isaiah,33,13,"You people in faraway lands, hear what I have done. You people who are near me, learn about my power."
Isaiah,33,14,"The sinners in Jerusalem are afraid. The people who are separated from God shake with fear. They say, “Can any of us live through this fire that destroys? Who can live near this fire that burns on and on?”"
Isaiah,33,15,A person might do what is right. He might speak what is right. He might refuse to take money unfairly. He might refuse to take money to hurt others. He might not listen to plans of murder. He might refuse to think about evil.
Isaiah,33,16,"This is the kind of person who will be safe. He will be protected as he would be in a high, walled city. He will always have bread, and he will not run out of water."
Isaiah,33,17,Your eyes will see the king in his beauty. You will see the land that stretches far away.
Isaiah,33,18,"You will think about the terror of the past. You will think, “Where is that officer? Where is the one who collected the taxes? Where is the officer in charge of our defense towers?”"
Isaiah,33,19,You will not see those proud people from other countries anymore. No more will you hear their strange language that you couldn’t understand.
Isaiah,33,20,"Look at Jerusalem, the city of our festivals. Look at Jerusalem, that beautiful place of rest. It is like a tent that will never be moved. The pegs that hold her in place will never be moved. Her ropes will never be broken."
Isaiah,33,21,There the Lord will be our Mighty One. That land is a place with streams and wide rivers. But there will be no enemy boats on those rivers. No powerful ship will sail on those rivers.
Isaiah,33,22,This is because the Lord is our judge. The Lord makes our laws. The Lord is our king. He will save us.
Isaiah,33,23,"You sailors from other lands, hear: The ropes on your boats hang loose. The mast is not held firm. The sails are not spread open. The Lord will give us your wealth. There will be so much wealth even the crippled people will carry off a share."
Isaiah,33,24,"No one living in Jerusalem will say, “I am sick.” The people who live there will have their sins forgiven."
Isaiah,34,1,"All you nations, come near and listen. Pay attention, you peoples! The earth and all the people in it should listen. The world and everything in it should listen."
Isaiah,34,2,The Lord is angry with all the nations. He is angry with their armies. He will destroy them and kill them all.
Isaiah,34,3,"Their bodies will be thrown outside. The stink will rise from the bodies, and the blood will flow down the mountains."
Isaiah,34,4,"The sun, moon and stars will dissolve. The sky will be rolled up like a scroll. The stars will fall like dead leaves from a vine or dried-up figs from a fig tree."
Isaiah,34,5,The Lord’s sword in the sky is covered with blood. It will cut through Edom. He will destroy these people as an offering to the Lord.
Isaiah,34,6,The Lord’s sword will be covered with blood. It will be covered with fat. It is the blood from lambs and goats. It is the fat from the kidneys of male sheep. This is because the Lord decided there will be a sacrifice in Bozrah. He has decided there will be much killing in Edom.
Isaiah,34,7,The oxen will be killed. And the cattle and the strong bulls will be killed. The land will be filled with their blood. The dirt will be covered with their fat.
Isaiah,34,8,The Lord has chosen a time for punishment. He has chosen a year when people must pay for the wrongs they did to Jerusalem.
Isaiah,34,9,Edom’s rivers will be like hot tar. The dirt of Edom will be like burning sulfur. The land of Edom will be like burning tar.
Isaiah,34,10,The fires will burn night and day. The smoke will rise from Edom forever. Year after year that land will be empty. No one will ever travel through that land again.
Isaiah,34,11,Birds and small animals will own that land. Owls and ravens will live there. God will make it an empty wasteland. It will have nothing left in it.
Isaiah,34,12,The important men will have no one left to rule them. The leaders will all be gone.
Isaiah,34,13,Thorns will take over the strong towers. Wild bushes will grow in the walled cities. Wild dogs will live there. Owls will live in those homes.
Isaiah,34,14,Desert animals will live with the hyenas there. And wild goats will call to their friends. Night animals will live there. They will find a place of rest there.
Isaiah,34,15,"Owls will nest there and lay eggs. When the eggs open, the owls will gather their young under their wings. Hawks will gather with their own kind."
Isaiah,34,16,Look at the Lord’s scroll. Read what is written there: None of these will be missing. Every one will have its mate. God said he will gather them together. So his Spirit will gather them together.
Isaiah,34,17,God has divided the land among them. And he has given them each their land. So they will own that land forever. They will live there year after year.
Isaiah,35,1,"The desert and dry land will become happy. The desert will be glad and will produce flowers. Like a flower,"
Isaiah,35,2,"it will have many blooms. It will show its happiness, as if it is shouting with joy. It will be beautiful like the forest of Lebanon. It will be as beautiful as the hill of Carmel and the Plain of Sharon. All people will see the glory of the Lord. They will see the splendor of our God."
Isaiah,35,3,Make the weak hands strong. Make the weak knees strong.
Isaiah,35,4,"Say to people who are afraid and confused, “Be strong. Don’t be afraid. Look, your God will come, and he will punish your enemies. He will make them pay for the wrongs they did. He will come and save you.”"
Isaiah,35,5,Then the blind people will see again. Then the deaf will hear.
Isaiah,35,6,Crippled people will jump like deer. And those who can’t talk now will shout with joy. Springs of water will flow in the desert. Streams will flow in the dry land.
Isaiah,35,7,"The burning desert will have pools of water. The dry ground will have springs. Where wild dogs once lived, grass and water plants will grow."
Isaiah,35,8,A road will be there. This highway will be called “The Road to Being Holy.” Evil people will not be allowed to walk on that road. Only good people will walk on that road. No fools will go on it.
Isaiah,35,9,No lions will be there. No dangerous animals will be on that road. They will not be found there. That road will be for the people God saves.
Isaiah,35,10,The people the Lord has freed will return there. They will enter Jerusalem with joy. Their happiness will last forever. Their gladness and joy will fill them completely. Sorrow and sadness will go far away.
Isaiah,36,1,"During Hezekiah’s fourteenth year as king, Sennacherib king of Assyria attacked Judah. He attacked all the strong, walled cities of Judah and defeated them."
Isaiah,36,2,"The king of Assyria sent out his field commander. He went with a large army from Lachish to King Hezekiah in Jerusalem. When the commander came near the waterway from the upper pool, he stopped. The upper pool is on the road to the Washerman’s Field."
Isaiah,36,3,"Eliakim, Shebna and Joah went out to meet him. Eliakim son of Hilkiah was the palace manager. Shebna was the royal assistant. And Joah son of Asaph was the recorder."
Isaiah,36,4,"The field commander said to them, “Tell Hezekiah this: “‘The great king, the king of Assyria, says: You have nothing to trust in to help you."
Isaiah,36,5,You say you have battle plans and power for war. But your words mean nothing. Whom are you trusting for help so that you turn against me?
Isaiah,36,6,"Look, you are depending on Egypt to help you. Egypt is like a splintered walking stick. If you lean on it for help, it will stab you and hurt you. The king of Egypt will hurt those who depend on him."
Isaiah,36,7,"You might say, “We are depending on the Lord our God.” But Hezekiah destroyed the Lord’s altars and the places of worship. Hezekiah told Judah and Jerusalem, “You must worship only at this one altar.”"
Isaiah,36,8,"“‘Now make an agreement with my master, the king of Assyria: I will give you 2,000 horses if you can find enough men to ride them."
Isaiah,36,9,You cannot defeat one of my master’s least important officers. So why do you depend on Egypt to give you chariots and horsemen?
Isaiah,36,10,I have not come to attack and destroy this country without an order from the Lord. The Lord himself told me to come to this country and destroy it.’”
Isaiah,36,11,"Then Eliakim, Shebna and Joah spoke to the field commander. They said, “Please speak to us in the Aramaic language. We understand it. Don’t speak to us in Hebrew because the people on the city wall can hear you.”"
Isaiah,36,12,"But the commander said, “No. My master did not send me to tell these things only to you and your king. My master sent me to tell them also to those people sitting on the wall. They will have to eat their own dung and drink their own urine like you.”"
Isaiah,36,13,"Then the commander stood and shouted loudly in the Hebrew language. He said, “Listen to the words from the great king, the king of Assyria!"
Isaiah,36,14,The king says you should not let Hezekiah fool you. Hezekiah can’t save you.
Isaiah,36,15,"Don’t let Hezekiah talk you into trusting the Lord. Hezekiah says, ‘The Lord will surely save us. This city won’t be given over to the king of Assyria.’"
Isaiah,36,16,"“Don’t listen to Hezekiah. The king of Assyria says, ‘Make peace with me. Come out of the city to me. Then everyone will be free to eat the fruit from his own grapevine and fig tree. Everyone will be free to drink water from his own well."
Isaiah,36,17,Then I will come and take you to a land like your own. It is a land with grain and new wine. It has bread and vineyards.’
Isaiah,36,18,"“Don’t let Hezekiah fool you. He says, ‘The Lord will save us.’ The god of any other nation has not saved his people from the power of the king of Assyria."
Isaiah,36,19,Where are the gods of Hamath and Arpad? Where are the gods of Sepharvaim? They did not save Samaria from my power.
Isaiah,36,20,Not one of all the gods of these countries has saved his people from me. Then the Lord cannot save Jerusalem from my power.”
Isaiah,36,21,"The people were silent. They didn’t answer the commander at all. This was because King Hezekiah had ordered, “Don’t answer him.”"
Isaiah,36,22,"Then Eliakim, Shebna and Joah tore their clothes to show how upset they were. (Eliakim son of Hilkiah was the palace manager. Shebna was the royal assistant. And Joah son of Asaph was the recorder.) The three men went to Hezekiah and told him what the field commander had said."
Isaiah,37,1,"When King Hezekiah heard the message, he tore his clothes. And he put on rough cloth to show how sad he was. Then he went into the Temple of the Lord."
Isaiah,37,2,"Hezekiah sent Eliakim, Shebna and the older priests to Isaiah. Eliakim was the palace manager, and Shebna was the royal assistant. The men were all wearing the rough cloth when they came to Isaiah. He was a prophet, the son of Amoz."
Isaiah,37,3,"These men told Isaiah, “This is what Hezekiah says: Today is a day of sorrow and punishment and disgrace. It is sad, as when a child should be born, but the mother is not strong enough to give birth to it."
Isaiah,37,4,The king of Assyria sent his field commander to make fun of the living God. Maybe the Lord your God will hear what the commander said. Maybe the Lord your God will punish him for what he said. So pray for the few people of Israel who are left alive.”
Isaiah,37,5,"When Hezekiah’s officers came to Isaiah,"
Isaiah,37,6,"he said to them, “Tell your master this: The Lord says, ‘Don’t be afraid of what you have heard. Don’t be frightened by the words the servants of the king of Assyria said against me."
Isaiah,37,7,Listen! I am going to put a spirit in the king of Assyria. He will hear a report that will make him return to his own country. And I will cause him to die by the sword there.’”
Isaiah,37,8,The field commander heard that the king of Assyria had left Lachish. So the commander left and found the king fighting against the city of Libnah.
Isaiah,37,9,"The king received a report that Tirhakah was coming to attack him. Tirhakah was the Cushite king of Egypt. When the king of Assyria heard this, he sent messengers to Hezekiah. The king said:"
Isaiah,37,10,“Say this to Hezekiah king of Judah: Don’t be fooled by the god you trust. Don’t believe him when he says Jerusalem will not be defeated by the king of Assyria.
Isaiah,37,11,You have heard what the kings of Assyria have done. They have completely defeated every country. Do not think you will be saved.
Isaiah,37,12,"The gods of those people did not save them. My ancestors destroyed them. My ancestors defeated the cities of Gozan, Haran and Rezeph. They defeated the people of Eden living in Tel Assar."
Isaiah,37,13,Where are the kings of Hamath and Arpad? Where is the king of the city of Sepharvaim? Where are the kings of Hena and Ivvah?”
Isaiah,37,14,Hezekiah received the letter from the messengers and read it. Then he went up to the Temple of the Lord. Hezekiah spread the letter out before the Lord.
Isaiah,37,15,And he prayed to the Lord:
Isaiah,37,16,"“Lord of heaven’s armies, you are the God of Israel. Your throne is between the gold creatures with wings. Only you are the God of all the kingdoms of the earth. You made the heavens and the earth."
Isaiah,37,17,"Hear, Lord, and listen. Open your eyes, Lord, and see. Listen to all the words Sennacherib has said to insult the living God."
Isaiah,37,18,"“It is true, Lord. The kings of Assyria have destroyed all these countries and their lands."
Isaiah,37,19,These kings have thrown the gods of these nations into the fire. But they were only wood and rock statues that men made. So the kings have destroyed them.
Isaiah,37,20,"Now, Lord our God, save us from the king’s power. Then all the kingdoms of the earth will know that you, Lord, are the only God.”"
Isaiah,37,21,"Then Isaiah son of Amoz sent a message to Hezekiah. Isaiah said, “The Lord, the God of Israel, says this: ‘You prayed to me about Sennacherib king of Assyria."
Isaiah,37,22,So this is what the Lord has said against Sennacherib: The people of Jerusalem hate you and make fun of you. The people of Jerusalem laugh at you as you run away.
Isaiah,37,23,"You have insulted me and spoken against me. You have raised your voice against me. You have a proud look on your face. You disobey me, the Holy One of Israel!"
Isaiah,37,24,"You have used your messengers to insult the Lord. You have said, “I have many chariots. With them I have gone to the tops of the mountains. I have climbed the highest mountains of Lebanon. I have cut down its tallest cedars. I have cut down its best pine trees. I have gone to its greatest heights. I have gone to its best forests."
Isaiah,37,25,"I have dug wells in foreign countries. I have drunk water there. By the soles of my feet, I have dried up all the rivers of Egypt.”"
Isaiah,37,26,"“‘King of Assyria, surely you have heard. Long ago I, the Lord, planned these things. Long ago I planned them. Now I have made them happen. I allowed you to turn those strong, walled cities into piles of rocks."
Isaiah,37,27,"The people living in those cities were weak. They were frightened and put to shame. They were like grass in the field. They were like tender, young grass. They were like grass that grows on the housetop. It is burned by the wind before it can grow."
Isaiah,37,28,“‘I know when you rest and when you come and go. I know how you speak against me.
Isaiah,37,29,You speak strongly against me. And I have heard your proud words. So I will put my hook in your nose. And I will put my bit in your mouth. Then I will force you to leave my country the same way that you came.’
Isaiah,37,30,"“Then the Lord said, ‘Hezekiah, I will give you this sign: This year you will eat the grain that grows wild. And the second year you will eat what grows wild from that. But in the third year, plant grain and harvest it. Plant vineyards and eat their fruit."
Isaiah,37,31,"The people left alive in the family of Judah will be saved. Like plants that take root, they will grow strong and have many children."
Isaiah,37,32,A few people will come out of Jerusalem alive. There will be a few from Mount Zion who will live. The strong love of the Lord of heaven’s armies will cause this to happen.’
Isaiah,37,33,“So this is what the Lord says about the king of Assyria: ‘He will not enter this city. He will not even shoot an arrow here. He will not fight against it with shields. He will not build a ramp to attack the city walls.
Isaiah,37,34,"He will return to his country the same way he came. He will not enter this city,’ says the Lord."
Isaiah,37,35,"The Lord says, ‘I will defend and save this city. I will do this for myself and for David, my servant.’”"
Isaiah,37,36,"Then the angel of the Lord went out. He killed 185,000 men in the Assyrian camp. When the people got up early the next morning, they saw all the dead bodies!"
Isaiah,37,37,So Sennacherib king of Assyria left. He went back to Nineveh and stayed there.
Isaiah,37,38,"One day Sennacherib was worshiping in the temple of his god Nisroch. While he was there, his sons Adrammelech and Sharezer killed him with a sword. Then they escaped to the land of Ararat. So Sennacherib’s son Esarhaddon became king of Assyria."
Isaiah,38,1,"At that time Hezekiah became very sick. He was almost dead. The prophet Isaiah son of Amoz went to see him. Isaiah told him, “This is what the Lord says: You are going to die. So you should give your last orders to everyone. You will not get well.”"
Isaiah,38,2,Hezekiah turned toward the wall and prayed to the Lord.
Isaiah,38,3,"He said, “Lord, please remember that I have always obeyed you. I have given myself completely to you. I have done what you said was right.” And Hezekiah cried loudly."
Isaiah,38,4,Then the Lord spoke his word to Isaiah:
Isaiah,38,5,"“Go to Hezekiah and tell him: ‘This is what the Lord, the God of your ancestor David, says: I have heard your prayer. And I have seen your tears. I will add 15 years to your life."
Isaiah,38,6,I will save you and this city from the king of Assyria. I will defend this city.’”
Isaiah,38,7,"Isaiah said, “The Lord will do what he says. This is the sign from the Lord to show you:"
Isaiah,38,8,The sun has made a shadow go down the stairway of Ahaz. I will make it go back ten steps.” So the shadow made by the sun went back up the ten steps it had gone down.
Isaiah,38,9,"After Hezekiah king of Judah got well, he wrote this song:"
Isaiah,38,10,"I said, “I am in the middle of my life. Do I have to go through the gates where the dead are now? Will I have the rest of my life taken away from me?”"
Isaiah,38,11,"I said, “I will not see the Lord in the land of the living again. I will not again see the people who live on the earth."
Isaiah,38,12,"Like a shepherd’s tent, my home has been pulled down and taken from me. I am finished like the cloth a weaver rolls up and cuts from the loom. In one day you brought me to this end."
Isaiah,38,13,"All night I cried loudly. Like a lion, he crushed all my bones. In one day you brought me to this end."
Isaiah,38,14,"I cried like a bird. I moaned like a dove. My eyes became tired as I looked to the heavens. Lord, I have troubles. Please help me.”"
Isaiah,38,15,What can I say? The Lord told me what would happen and then made it happen. I have had these troubles in my soul. So now I will be humble all my life.
Isaiah,38,16,"Lord, because of you, men live. Because of you, my spirit also lives. You made me well and let me live."
Isaiah,38,17,"It was for my own good that I had such troubles. Because you love me very much, you did not let me die. You threw my sins far away."
Isaiah,38,18,People in the place where the dead are cannot praise you. Those who have died cannot sing praises to you. Those who die don’t trust you to help them.
Isaiah,38,19,The people who are alive are the ones who praise you. They praise you as I praise you today. A father should tell his children that you provide help.
Isaiah,38,20,The Lord saved me. So we will sing and play songs. We will make music in the Temple of the Lord all the days of our lives.
Isaiah,38,21,"Then Isaiah said, “Make a paste from figs. Put it on Hezekiah’s boil. Then he will get well.”"
Isaiah,38,22,"Hezekiah asked Isaiah, “What will be the sign? What will show that I will go up to the Temple of the Lord?”"
Isaiah,39,1,At that time Merodach-Baladan son of Baladan was king of Babylon. He sent letters and a gift to Hezekiah. He did this because he had heard that Hezekiah had been sick and was now well.
Isaiah,39,2,"Hezekiah was happy to see the messengers. So he showed them what was in his storehouses: the silver, gold, spices and expensive perfumes. He showed them his swords and shields. He showed them all his wealth. He showed them everything in his palace and in his kingdom."
Isaiah,39,3,"Then Isaiah the prophet went to King Hezekiah. He asked Hezekiah, “What did these men say? Where did they come from?” Hezekiah said, “They came from a faraway country. They came to me from Babylon.”"
Isaiah,39,4,"So Isaiah asked him, “What did they see in your palace?” Hezekiah said, “They saw everything in my palace. I showed them all my wealth.”"
Isaiah,39,5,Then Isaiah said to Hezekiah: “Listen to the words of the Lord of heaven’s armies:
Isaiah,39,6,"‘In the future everything in your palace will be taken away to Babylon. Everything your ancestors have stored up until this day will be taken away. Nothing will be left,’ says the Lord."
Isaiah,39,7,Some of your own children will be taken away. Those who will be born to you will be taken away. And they will become eunuchs in the palace of the king of Babylon.”
Isaiah,39,8,"Hezekiah told Isaiah, “These words from the Lord are good.” He said this because he thought, “There will be peace and security while I am king.”"
Isaiah,40,1,"Your God says, “Comfort, comfort my people."
Isaiah,40,2,Speak kindly to the people of Jerusalem. Tell them that their time of service is finished. Tell them that they have paid for their sins. Tell them that the Lord has punished Jerusalem twice for every sin they did.”
Isaiah,40,3,This is the voice of a man who calls out: “Prepare in the desert the way for the Lord. Make the road in the dry lands straight for our God.
Isaiah,40,4,Every valley should be raised up. Every mountain and hill should be made flat. The rough ground should be made level. The rugged ground should be made smooth.
Isaiah,40,5,Then the glory of the Lord will be shown. All people together will see it. The Lord himself said these things.”
Isaiah,40,6,"A voice says, “Cry out!” Then I said, “What shall I cry out?” “Say all people are like the grass. And all their strength is like the flowers of the field."
Isaiah,40,7,"The grass dies, and the flowers fall. This is because the breath of the Lord blows on them. Surely the people are like grass."
Isaiah,40,8,"The grass dies, and the flowers fall. But the word of our God will live forever.”"
Isaiah,40,9,"Jerusalem, you have good news to tell. Go up on a high mountain. Jerusalem, you have good news to tell. Shout out loud the good news. Shout it out and don’t be afraid. Say to the towns of Judah, “Here is your God.”"
Isaiah,40,10,"Look, the Lord God is coming with power. He will use his power to rule all the people. Look, he will bring reward for his people. He will have their payment with him."
Isaiah,40,11,The Lord takes care of his people like a shepherd. He gathers the people like lambs in his arms. He carries them close to him. He gently leads the mothers of the lambs.
Isaiah,40,12,Who has measured the oceans in the palm of his hand? Who has used his hand to measure the sky? Who has used a bowl to measure all the dust of the earth? Who has used scales to weigh the mountains and hills?
