Isaiah,1,1,"This is the vision Isaiah son of Amoz saw. God showed Isaiah what would happen to Judah and Jerusalem. Isaiah saw these things while Uzziah, Jotham, Ahaz and Hezekiah were kings of Judah."
Isaiah,1,2,"Heaven and earth, listen, because the Lord is speaking: “I raised my children and helped them grow. But they have turned against me."
Isaiah,1,3,An ox knows its master. And a donkey knows where its owner feeds it. But the people of Israel do not know me. My people do not understand.”
Isaiah,1,4,"Terrible times are coming for Israel, a nation of sin. The people are loaded down with guilt. They are like a group of children doing evil. They are full of evil. They have left the Lord. They hate God, the Holy One of Israel. They have turned away from him."
Isaiah,1,5,Why should you continue to be punished? Why do you continue to turn against him? Your whole head is hurt. And your whole heart is sick.
Isaiah,1,6,"There is no healthy spot from the bottom of your foot to the top of your head. You are covered with wounds, hurts and open sores. Your wounds are not cleaned and covered. No medicine takes away the pain."
Isaiah,1,7,"Your land is ruined. Your cities have been burned with fire. While you watch, your enemies are stealing everything from your land. Your land is ruined like a country destroyed by enemies."
Isaiah,1,8,Jerusalem is left alone like an empty shelter in a vineyard. It is like a hut left in a field of melons. It is like a city surrounded by enemies.
Isaiah,1,9,The Lord of heaven’s armies allowed a few of our people to live. Otherwise we would have been completely destroyed like the cities of Sodom and Gomorrah.
Isaiah,1,10,"Jerusalem, your rulers are like those of Sodom. Your people are like those of Gomorrah. Hear the word of the Lord. Listen to the teachings of our God!"
Isaiah,1,11,"The Lord says, “I do not want all these sacrifices you give me. I have had enough of your sacrifices of male sheep and fat from fine animals. I am not pleased by the blood of bulls, sheep and goats."
Isaiah,1,12,You come to meet with me. But who asked you to do all this running in and out?
Isaiah,1,13,"Don’t continue bringing me worthless sacrifices! I hate the incense you burn. I can’t stand your New Moons, Sabbaths and other feast days. I can’t stand the evil you do in holding your holy meetings."
Isaiah,1,14,I hate your New Moon feasts and your other yearly feasts. They have become like heavy weights on me. I am tired of carrying them.
Isaiah,1,15,"You will raise your arms in prayer to me. But I will refuse to look at you. Even if you say many prayers, I will not listen to you. It’s because your hands are full of blood."
Isaiah,1,16,Wash yourselves and make yourselves clean. Stop doing the evil things I see you do. Stop doing wrong!
Isaiah,1,17,Learn to do good. Be fair to other people. Punish those who hurt others. Help the orphans. Stand up for the rights of widows.”
Isaiah,1,18,"The Lord says, “Come, we will talk these things over. Your sins are red like deep red cloth. But they can be as white as snow. Your sins are bright red. But you can be white like wool."
Isaiah,1,19,"If you will obey me, you will eat good crops from the land."
Isaiah,1,20,"But if you refuse to obey and if you turn against me, you will be destroyed by your enemies’ swords.” The Lord himself said these things."
Isaiah,1,21,"The city of Jerusalem once followed the Lord. But she is no longer loyal to the Lord. She used to be filled with fairness. People there lived the way God wanted. But now, murderers live there."
Isaiah,1,22,"Jerusalem, you have become like the scum left when silver is purified. You are like wine mixed with water."
Isaiah,1,23,Your rulers are rebels. They are friends of thieves. They all accept money for doing wrong things. They are paid to cheat people. They don’t try to help the orphans. And they don’t listen to the widows’ needs.
Isaiah,1,24,"The Master, the Lord of heaven’s armies, the Mighty One of Israel, says: “You, my enemies, will not cause me any more trouble. I will pay you back for what you did."
Isaiah,1,25,I will turn against you. I will clean away all your wrongs as if with soap. I will take all the worthless things out of you.
Isaiah,1,26,I will bring back judges as you had long ago. Your counselors will be like the ones you had in the beginning. Then you will be called the City That Is Right with God. You will be called the Loyal City.”
Isaiah,1,27,"Because the Lord does what is fair, he will rescue Jerusalem. Because the Lord does what is right, he will save her people who come back to him."
Isaiah,1,28,But sinners and those who turn against him will be destroyed. Those who have left the Lord will die.
Isaiah,1,29,“You will be ashamed because you have worshiped false gods under the oak trees. You will be disgraced because you have worshiped idols in your gardens.
Isaiah,1,30,You will be like an oak whose leaves are dying. You will be like a garden without water.
Isaiah,1,31,"Powerful people will be like small, dry pieces of wood. And what they do will be like sparks. The people and what they do will burn together. And no one will be able to stop that fire.”"
Isaiah,2,1,Isaiah son of Amoz saw this message about Judah and Jerusalem.
Isaiah,2,2,In the last days the mountain on which the Lord’s Temple stands will become the most important of all mountains. It will be raised above the hills. And people from all nations will come streaming to it.
Isaiah,2,3,"Many nations will come and say, “Come, let us go up to the mountain of the Lord. Let us go to the Temple of the God of Jacob. Then God will teach us his ways. And we will obey his teachings.” The Lord’s teachings will go out from Jerusalem. The Lord’s message will go out from Jerusalem."
Isaiah,2,4,Then the Lord will settle arguments among many nations. He will make decisions for strong nations that are far away. Then the nations will make their swords into plows. They will make their spears into hooks for trimming trees. Nations will no longer fight other nations. They will not even train for war anymore.
Isaiah,2,5,"Come, family of Jacob. We should follow the way of the Lord."
Isaiah,2,6,"Lord, you have left your people, the family of Jacob. They have become filled with wrong ideas from people in the East. Your people try to tell the future like the Philistines. They have completely accepted those foreign ideas."
Isaiah,2,7,Their land has been filled with silver and gold. There are a great many treasures there. Their land has been filled with horses. There are many chariots there.
Isaiah,2,8,Their land is full of idols. The people worship these idols that they made with their own hands. They worship statues shaped by their fingers.
Isaiah,2,9,"People will not be proud any longer. They will bow low with shame. God, do not forgive them."
Isaiah,2,10,Go into the caves of the cliffs. Dig holes and hide in the ground. Hide from the anger of the Lord and from his great power!
Isaiah,2,11,Proud people will stop being proud. They will bow low with shame. At that time only the Lord will still be praised.
Isaiah,2,12,The Lord of heaven’s armies has a certain day planned. On that day he will punish the proud and those who brag. They will no longer be important.
Isaiah,2,13,He will bring down the tall cedar trees from Lebanon. He will destroy the great oak trees of Bashan.
Isaiah,2,14,He will destroy all the tall mountains and the high hills.
Isaiah,2,15,"He will knock down every tall tower and every high, strong wall."
Isaiah,2,16,He will sink all the trading ships. And he will destroy the beautiful ships.
Isaiah,2,17,At that time proud people will stop being proud. They will bow low with shame. And at that time only the Lord will be praised.
Isaiah,2,18,But all the idols will be gone.
Isaiah,2,19,People will run to caves in the rocky cliffs. They will dig holes and hide in the ground. They will hide from the anger of the Lord and his great power. They will do this when the Lord stands to shake the earth.
Isaiah,2,20,At that time people will throw away their gold and silver idols. They made these idols for themselves to worship. But they will throw them away to the bats and moles.
Isaiah,2,21,Then the people will hide in caves and cracks in the rocks. They will hide from the anger of the Lord and his great power. They will do this when the Lord stands to shake the earth.
Isaiah,2,22,You should stop trusting in people to save you. People are only human. They aren’t able to help you.
Isaiah,3,1,"Understand what I am telling you. The Master, the Lord of heaven’s armies, will take away everything Judah and Jerusalem need. He will take away all the food and water."
Isaiah,3,2,"He will take away all the heroes and great soldiers. He will take away all the judges, prophets, people who do magic and elders."
Isaiah,3,3,"He will take away the military leaders and government leaders. He will take away the counselors, the skilled craftsmen and those who try to tell the future."
Isaiah,3,4,"The Lord says, “I will cause young boys to be your leaders. Foolish children will rule over you."
Isaiah,3,5,Everyone will be against everyone else. Young people will not respect older people. Common people will not respect important people.”
Isaiah,3,6,"At that time a man will grab one of his brothers from his own family and say, “You have a coat. So you will be our leader. You will be the leader over all these ruins.”"
Isaiah,3,7,"But that brother will stand up and say, “I cannot help you. I do not have food or clothes in my house. You will not make me your leader.”"
Isaiah,3,8,This will happen because Jerusalem has stumbled and Judah has fallen. The things they say and do are against the Lord. They sin openly against the Lord.
Isaiah,3,9,"The look on their faces shows they are guilty of doing wrong. Like the people of Sodom, they are proud of their sin. They don’t care who sees it. How terrible it will be for them! They have brought much trouble to themselves."
Isaiah,3,10,Tell the good people that good things will happen to them. They will receive a reward for the good they do.
Isaiah,3,11,But how terrible it will be for wicked people! They will be punished for all the wrong they have done.
Isaiah,3,12,"Children treat my people cruelly. Women rule over them. My people, your guides lead you in the wrong way. They turn you away from what is right."
Isaiah,3,13,The Lord takes his place in court. He stands to judge the people.
Isaiah,3,14,"The Lord presents his case against the elders and other leaders of his people. He says, “You have burned my vineyard. Your houses are full of what you took from the poor."
Isaiah,3,15,"What gives you the right to crush my people? How can you grind the faces of the poor into the dirt?” The Master, the Lord of heaven’s armies, said this."
Isaiah,3,16,"The Lord says, “The women of Jerusalem are proud. They walk around with their heads held high. They flirt with their eyes. They take quick, short steps, making noise with their ankle bracelets.”"
Isaiah,3,17,So the Lord will put sores on the heads of those women in Jerusalem. He will make them lose all their hair.
Isaiah,3,18,"At that time the Lord will take away everything that makes them proud. He will take away their beautiful ankle bracelets, their headbands and their necklaces shaped like the moon."
Isaiah,3,19,"He will take away their earrings, bracelets and veils."
Isaiah,3,20,"He will take away their scarves, ankle chains, the cloth belts worn around their waists, their bottles of perfume and charms."
Isaiah,3,21,"He will take away their signet rings, nose rings,"
Isaiah,3,22,"their fine robes, capes, shawls and purses."
Isaiah,3,23,"And he will take away their mirrors, linen dresses, turbans and long shawls."
Isaiah,3,24,"Instead of having sweet-smelling perfume, they will stink. Instead of fine cloth belts, they will have ropes of captives to wear. Instead of having their hair fixed in fancy ways, they will be bald. Instead of fine clothes, they will have rough clothes of sadness. Instead of having beauty, they will have the brand of a captive."
Isaiah,3,25,At that time your men will be killed with swords. Your heroes will die in war.
Isaiah,3,26,There will be crying and sadness in the meeting places near the city gates. Jerusalem will be like a woman who has lost everything and sits on the ground.
Isaiah,4,1,"At that time seven women will grab one man. They will say, “We will make our own bread. And we will make our own clothes. But please marry us! Please, take away our shame.”"
Isaiah,4,2,At that time the Lord’s branch will be very beautiful and great. The people still living in Israel will be proud of what the land grows.
Isaiah,4,3,All the people who are still living in Jerusalem will be called holy. This will be all the people whose names are recorded among the living in Jerusalem.
Isaiah,4,4,The Lord will wash away the filth from the women of Jerusalem. He will wash the bloodstains out of Jerusalem. He will clean Jerusalem with the spirit of fairness and the spirit of fire.
Isaiah,4,5,"As he did when Israel left Egypt, the Lord will cover them with a cloud of smoke during the day. And he will cover them with a bright, flaming fire at night. These proofs will be over Mount Zion. They will be over every meeting of the people there. There will be a covering over every person."
Isaiah,4,6,This covering will be a place of safety. It will protect the people from the heat of the sun. It will be a safe place to hide from the storm and rain.
Isaiah,5,1,Now I will sing a song to my friend. This song is about his vineyard. My friend had a vineyard on a hill with very rich soil.
Isaiah,5,2,He dug and cleared the field of stones. He planted the best grapevines there. And he built a tower in the middle of it. He cut out a winepress as well. He hoped good grapes would grow there. But only bad grapes grew.
Isaiah,5,3,"My friend says, “You people living in Jerusalem, and you men of Judah, judge between me and my vineyard."
Isaiah,5,4,What more could I have done for my vineyard? I did everything I could. I hoped for good grapes to grow. But why were there only bad grapes?
Isaiah,5,5,"Now I will tell you what I will do to my vineyard: I will remove the hedge, and it will be burned. I will break down the stone wall, and it will be walked on."
Isaiah,5,6,I will ruin my field. It will not be trimmed or hoed. Weeds and thorns will grow there. I will command the clouds not to rain on it.”
Isaiah,5,7,"The vineyard belonging to the Lord of heaven’s armies is the nation of Israel. The garden that the Lord loves is the men of Judah. The Lord looked for justice, but there was only killing. The Lord hoped for right living, but there were only cries of pain."
Isaiah,5,8,How terrible it will be for you who add more houses to your houses and more fields to your fields. Finally there is no room left for other people. Then you are left alone in the land.
Isaiah,5,9,The Lord of heaven’s armies said this to me: “The fine houses will be destroyed. The large and beautiful houses will be left empty.
Isaiah,5,10,At that time a ten-acre vineyard will make only six gallons of wine. And ten bushels of seed will grow only half a bushel of grain.”
Isaiah,5,11,"How terrible it will be for people who rise early in the morning to look for strong drink. They stay awake late at night, becoming drunk with wine."
Isaiah,5,12,"At their parties they have lyres, harps, tambourines, flutes and wine. They don’t see what the Lord has done. They don’t notice the work of his hands."
Isaiah,5,13,So my people will be captured and taken away because they don’t really know me. All the great men will die of hunger. The common people will die of thirst.
Isaiah,5,14,So the place where the dead are wants more and more people. It opens its mouth wide. Jerusalem’s important men will go down into it. And the common people will go down into it.
Isaiah,5,15,So the common people and the great people will be humbled. Those who are proud will be humbled.
Isaiah,5,16,The Lord of heaven’s armies will receive glory by judging fairly. The holy God will show himself holy by doing what is right.
Isaiah,5,17,Then the sheep will go anywhere they want. Lambs will feed on the land that rich people once owned.
Isaiah,5,18,How terrible it will be for those people! They pull their guilt and sins behind them as people pull wagons with ropes.
Isaiah,5,19,"They say, “Let’s see God hurry. Let’s see him do his work soon. We want to see it. Let’s see the plan of the Holy One of Israel happen soon. Then we would know what it really is.”"
Isaiah,5,20,How terrible it will be for people who call good things bad and bad things good. They think darkness is light and light is darkness. They think sour is sweet and sweet is sour.
Isaiah,5,21,How terrible it will be for people who think they are wise. They think they are clever.
Isaiah,5,22,How terrible it will be for people who are famous for drinking wine. They are champions at mixing drinks.
Isaiah,5,23,They take money to set the guilty free. But they don’t allow good people to be judged fairly.
Isaiah,5,24,They will be destroyed just as fire burns straw or dry grass. They will be destroyed like a plant whose roots rot and whose flower dies and blows away like dust. They have refused to obey the teachings of the Lord of heaven’s armies. They hated the message from the Holy God of Israel.
Isaiah,5,25,So the Lord has become very angry with his people. And he has raised his hand to punish them. Even the mountains are frightened. Dead bodies lie in the streets like garbage. But the Lord is still angry. His hand is still raised to strike down the people.
Isaiah,5,26,God raises a banner for the nations far away. He is whistling to call those people. The enemy comes quickly!
Isaiah,5,27,Not one of them becomes tired or falls down. Not one of them gets sleepy and falls asleep. Their weapons are close at hand. Their sandal straps are not broken.
Isaiah,5,28,Their arrows are sharp. All of their bows are ready to shoot. The horses’ hooves are hard as rock. Their chariot wheels move like a whirlwind.
Isaiah,5,29,Their shout is like the roar of a lion. It is loud like a young lion. The enemy growls as they grab their captives. There is no one to stop them from taking their captives away.
Isaiah,5,30,"On that day they will roar like the waves of the sea. And when people look at the land, they will see only darkness and pain. All light will become dark in this thick cloud."
Isaiah,6,1,"In the year that King Uzziah died, I saw the Lord. He was sitting on a very high throne. His long robe filled the Temple."
Isaiah,6,2,Burning heavenly creatures stood above him. Each creature had six wings. They used two wings to cover their faces. They used two wings to cover their feet. And they used two wings for flying.
Isaiah,6,3,"Each creature was calling to the others: “Holy, holy, holy is the Lord of heaven’s armies. His glory fills the whole earth.”"
Isaiah,6,4,Their voices caused the frame around the door to shake. The Temple filled with smoke.
Isaiah,6,5,"I said, “Oh, no! I will be destroyed. I am not pure. And I live among people who are not pure. But I have seen the King, the Lord of heaven’s armies.”"
Isaiah,6,6,On the altar there was a fire. One of the burning heavenly creatures used a pair of tongs to take a hot coal from the fire. Then he flew to me with the hot coal in his hand.
Isaiah,6,7,"The creature touched my mouth with the hot coal. Then he said, “Look. Your guilt is taken away because this hot coal has touched your lips. Your sin is taken away.”"
Isaiah,6,8,"Then I heard the Lord’s voice. He said, “Whom can I send? Who will go for us?” So I said, “Here I am. Send me!”"
Isaiah,6,9,"Then the Lord said, “Go and tell this to the people: ‘You will listen and listen, but you will not understand. You will look and look, but you will not learn.’"
Isaiah,6,10,"Make these people stubborn. Make them not able to understand what they hear and see. Otherwise, they might really understand what they see with their eyes and hear with their ears. They might really understand in their minds. If they did this, they would come back to me and be forgiven.”"
Isaiah,6,11,"Then I asked, “Lord, how long should I do this?” He answered, “Do this until the cities are destroyed and the people are gone. Do this until there are no people left living in the houses. Do this until the land is destroyed and left empty."
Isaiah,6,12,I will send the people far away. And the land will be left empty.
Isaiah,6,13,"One-tenth of the people will be left in the land. But the land will be destroyed again. These people will be like an oak tree. When the tree is chopped down, a stump is left. The people who remain will be like a stump that will sprout again.”"
Isaiah,7,1,"Now Ahaz was the son of Jotham, who was the son of Uzziah. When Ahaz was king of Judah, Rezin and Pekah went up to Jerusalem to fight against it. Rezin was king of Aram. And Pekah son of Remaliah was king of Israel. But they were not able to defeat the city."
Isaiah,7,2,"A message was told to Ahaz king of Judah. It said, “The armies of Aram and Israel have joined together.” When Ahaz heard this, he and the people became very frightened. They shook with fear like trees of the forest blown by the wind."
Isaiah,7,3,"Then the Lord told Isaiah, “You and your son Shear-Jashub should go out and talk to Ahaz. Go to the place where the water flows into the upper pool. This is on the road to the Washerman’s Field."
Isaiah,7,4,"Tell Ahaz, ‘Be careful. Be calm, and don’t be afraid. Don’t let those two men, Rezin and Remaliah’s son Pekah, scare you. Don’t be afraid of their anger and Aram’s anger. Those two men are as weak as two barely burning sticks that are ready to go out."
Isaiah,7,5,"They have made plans against you. They said,"
Isaiah,7,6,“Let’s fight against Judah and tear it apart. We will divide Judah for ourselves. We will make the son of Tabeel the new king of Judah.”
Isaiah,7,7,"But I, the Lord God, say, Their plan will not succeed. It will not happen."
Isaiah,7,8,"That is because Aram is led by the city of Damascus. And Damascus is led by its weak king, Rezin. Within 65 years Israel will no longer be a nation."
Isaiah,7,9,"Israel is led by the city of Samaria, and Samaria is led by its weak king, the son of Remaliah. If your faith is not strong, then you will not have strength to last.’”"
Isaiah,7,10,Then the Lord spoke to Ahaz again.
Isaiah,7,11,"The Lord said, “Ask for a sign to prove to yourself that these things are true. It may be a sign from as deep as the place where the dead are or as high as the heavens.”"
Isaiah,7,12,"But Ahaz said, “I will not ask for a sign. I will not test the Lord.”"
Isaiah,7,13,"Then Isaiah said, “Ahaz, descendant of David, listen very carefully! Isn’t it bad enough that you wear out the patience of people? Do you have to wear out the patience of my God also?"
Isaiah,7,14,"But the Lord himself will give you a sign: The virgin will be pregnant. She will have a son, and she will name him Immanuel."
Isaiah,7,15,He will be eating milk curds and honey when he learns to reject what is evil and to choose what is good.
Isaiah,7,16,"You are afraid of the kings of Israel and Aram now. But before the child learns what is good and what is evil, the lands of Israel and Aram will be empty."
Isaiah,7,17,The Lord will bring some troubled times to you. Those troubles will come to your people and to the people of your father’s family. The Lord will bring the king of Assyria to fight against you.
Isaiah,7,18,“At that time the Lord will whistle to call for the Egyptians. And they will come like flies from the streams of Egypt. The Lord will call for the Assyrians. And they will come like bees from the land of Assyria.
Isaiah,7,19,These enemies will camp in the deep ravines and in the cliffs. They will camp by the thornbushes and watering holes.
Isaiah,7,20,The Lord will use Assyria to punish Judah. Assyria will be hired and used like a razor. It will be as if the Lord is shaving the hair from Judah’s head and legs and is shaving off Judah’s beard.
Isaiah,7,21,“At that time a person will be able to keep only one young cow and two sheep alive.
Isaiah,7,22,There will be only enough milk for that person to eat milk curds. All who remain in the land will go back to eating only milk curds and honey.
Isaiah,7,23,"In this land there are now vineyards that have 1,000 grapevines. These grapevines are worth about 25 pounds of silver. But these fields will become full of weeds and thorns."
Isaiah,7,24,The land will become wild and useful only as a hunting ground.
Isaiah,7,25,People once worked and grew food on these hills. But at that time people will not go there. The land will be filled with weeds and thorns. Only sheep and cattle will go to those places.”
Isaiah,8,1,"The Lord told me, “Take a large scroll on which to write. Use a pen to write these words: ‘Maher-Shalal-Hash-Baz.’"
Isaiah,8,2,I will gather some men to be reliable witnesses. They will be Uriah the priest and Zechariah son of Jeberekiah.”
Isaiah,8,3,"Then I went to the prophetess. She became pregnant and had a son. Then the Lord told me, “Name the boy Maher-Shalal-Hash-Baz."
Isaiah,8,4,The king of Assyria will take away all the wealth and possessions of Damascus and Samaria. This will happen before the boy learns to say ‘my father’ or ‘my mother.’”
Isaiah,8,5,Again the Lord spoke to me.
Isaiah,8,6,"He said, “These people refuse to accept the slow-moving waters of the pool of Shiloah. These people are terrified of Rezin and Remaliah’s son Pekah."
