Isaiah,15,9,"The water of the city Dibon is full of blood. And I, the Lord, will bring even more troubles to Dibon. A few people living in Moab have escaped the enemy. But I will send lions to kill them."
Isaiah,16,1,Send the king of the land the payment he demands. Send a lamb from Sela through the desert to the mountain of Jerusalem.
Isaiah,16,2,The women of Moab try to cross the river Arnon. They are like little birds that have fallen from their nest.
Isaiah,16,3,They say: “Help us. Tell us what to do. Protect us from our enemies as shade protects us from the noon sun. Hide us because we are running for safety! Don’t give us to our enemies.
Isaiah,16,4,Let those of us who were forced out of Moab live in your land. Hide us from our enemies.” The robbing of Moab will stop. The enemy will be defeated. The men who hurt others will disappear from the land.
Isaiah,16,5,Then a new loyal king will come. This faithful king will be from the family of David. He will judge fairly. He wants to do what is right.
Isaiah,16,6,We have heard that the people of Moab are proud and very conceited. They are very proud and angry. But their bragging means nothing.
Isaiah,16,7,So the people of Moab will cry. They will all be sad. They will moan and groan for the raisin cakes they had in Kir Hareseth.
Isaiah,16,8,But the fields of Heshbon and the vines of Sibmah cannot grow grapes. Foreign rulers have destroyed the grapevines. The grapevines once spread as far as the city of Jazer and into the desert. They had spread as far as the sea.
Isaiah,16,9,"I cry with the people of Jazer for the grapevines of Sibmah. I will cry with the people of Heshbon and Elealeh. There will be no shouts of joy, because there will be no harvest or ripe fruit."
Isaiah,16,10,There will be no joy and happiness in the orchards. There will be no songs or shouts of joy in the vineyards. No one makes wine in the winepresses. I have put an end to shouts of joy.
Isaiah,16,11,My heart cries for Moab like a harp playing a funeral song. I am very sad for Kir Hareseth.
Isaiah,16,12,"The people of Moab will go to their places of worship. They will try to pray. But when they go to their temple to pray, they will not be able."
Isaiah,16,13,The Lord said these things about Moab before.
Isaiah,16,14,"And now the Lord says, “In three years all those people and what they are proud of will be hated. (This is three years as a hired helper would count time.) There will be a few people left, but they will be weak.”"
Isaiah,17,1,This is the message for Damascus: “The city of Damascus will be destroyed. Only ruins will be left there.
Isaiah,17,2,People will leave the cities of Aroer. Flocks of sheep will wander freely in those empty towns. There will be no one to bother them.
Isaiah,17,3,"The strong, walled cities of Israel will be destroyed. The government in Damascus will end. Those left alive of Aram will be like the glory of Israel,” says the Lord of heaven’s armies."
Isaiah,17,4,“At that time Israel’s wealth will all be gone. Israel will be like a man who has lost much weight from sickness.
Isaiah,17,5,That time will be like the grain harvest in the Valley of Rephaim. The workers cut the wheat. Then they cut the heads of grain from the plants. And they collect the grain.
Isaiah,17,6,"That time will also be like the olive harvest, when a few olives are left. Two or three olives are left in the top branches. Four or five olives are left on full branches,” says the Lord, the God of Israel."
Isaiah,17,7,"At that time people will look to God, their Maker. Their eyes will see the Holy One of Israel."
Isaiah,17,8,They will not trust the altars they have made. They will not trust what their hands have made. They will not respect the Asherah idols and altars they have made.
Isaiah,17,9,In that day all their strong cities will be empty. They will be like the cities that the Hivites and the Amorites left. They left their cities when the Israelites came to take the land. Everything will be ruined.
Isaiah,17,10,You have forgotten the God who saves you. You have not remembered that God is your place of safety. You plant the finest grapevines. You plant grapevines from faraway places.
Isaiah,17,11,You will plant your grapevines one day and try to make them grow. The next day they will begin to grow. But at harvest time everything will be dead. A sickness will kill all the plants.
Isaiah,17,12,Listen to the many people! They are crying loud like the noise from the sea. Listen to the noise! The crying is like the crashing of great waves.
Isaiah,17,13,"The people roar like those waves. But when God speaks harshly to them, they will run away. They will be like chaff on the hills being blown by the wind. They will be like tumbleweeds blown away by a storm."
Isaiah,17,14,"At night the people will be very frightened. Before morning, no one will be left. So our enemies will come to our land, but they will become nothing."
Isaiah,18,1,How terrible it will be for the land beyond the rivers of Cush. It is filled with the sound of wings.
Isaiah,18,2,"That land sends people across the sea. They go on the water in boats made of reeds. Quick messengers, go to the people who are tall and smooth-skinned. They are feared everywhere. They are a powerful nation with strange speech. They defeat the other nations. Their land is divided by rivers."
Isaiah,18,3,"All you people of the world, look! Everyone who lives in the world, look! You will see a banner raised on a mountain. You will hear a trumpet sound."
Isaiah,18,4,"The Lord said to me, “I will quietly watch from where I live. I will be like heat in the sunshine. I will be like the dew in the heat of harvest time.”"
Isaiah,18,5,The time will be after the flowers have bloomed and before the harvest. The new grapes will be budding and growing. Then the enemy will cut the plants with knives. He will cut down the vines and take them away.
Isaiah,18,6,They will be left for the birds of the mountains to eat. They will be left for the wild animals to eat. Birds will feed on them all summer. And that winter wild animals will eat them.
Isaiah,18,7,At that time gifts will be brought to the Lord of heaven’s armies. They will come from the people who are tall and smooth-skinned. They are feared everywhere. They are a powerful nation with strange speech. Their land is divided by rivers. These gifts will be brought to the place of the Lord of heaven’s armies. They will be brought to Mount Zion.
Isaiah,19,1,"The message about Egypt: Look, the Lord is coming on a fast cloud. He will enter Egypt. And the idols of Egypt will tremble before him. Egypt’s courage will melt away."
Isaiah,19,2,"The Lord says, “I will cause the Egyptians to fight against themselves. Men will fight with their brothers. Neighbors will fight neighbors. Cities will fight cities. Kingdoms will fight kingdoms."
Isaiah,19,3,The Egyptians will be afraid. I will ruin their plans. They will ask their idols and spirits of the dead what they should do. They will ask their mediums and fortune-tellers.”
Isaiah,19,4,"The Master, the Lord of heaven’s armies, says, “I will give Egypt to a hard master. A powerful king will rule over them.”"
Isaiah,19,5,The sea will become dry. The water will disappear from the Nile River.
Isaiah,19,6,The canals will stink. The streams of Egypt will decrease and dry up. All the water plants will rot.
Isaiah,19,7,"All the plants along the banks of the Nile will die. Even the planted fields by the Nile will dry up, blow away and disappear."
Isaiah,19,8,"The fishermen, all those who catch fish from the Nile, will groan and cry. Those who depend on the Nile for food will be sad."
Isaiah,19,9,All the people who make cloth from flax will be sad. Those who weave linen will lose hope.
Isaiah,19,10,Those who weave cloth will be broken. All those who work for money will be sad.
Isaiah,19,11,The officers of the city of Zoan are fools. The wise men who advise the king of Egypt give wrong advice. How can they say to him they are wise? How can they say they are from the old family of the kings?
Isaiah,19,12,"Egypt, where are your wise men? Let them show you what the Lord of heaven’s armies has planned for Egypt."
Isaiah,19,13,The officers of Zoan have been fooled. The leaders of Memphis have believed false things. So the leaders of Egypt lead her the wrong way.
Isaiah,19,14,The Lord has made the leaders confused. They wander and lead Egypt in the wrong ways. They are like drunk people stumbling in their own vomit.
Isaiah,19,15,There is nothing Egypt can do. No one in Egypt can help.
Isaiah,19,16,In that day the people of Egypt will be like frightened women. They will be afraid of the Lord of heaven’s armies. He will raise his hand to strike them down.
Isaiah,19,17,The land of Judah will bring fear to the people in Egypt. Anyone in Egypt who hears the name Judah will be afraid. This will happen because the Lord of heaven’s armies has planned terrible things for Egypt.
Isaiah,19,18,"At that time five cities in Egypt will speak Hebrew, the language of Canaan. They will promise to be loyal to the Lord of heaven’s armies. One of these cities will be named the City of Destruction."
Isaiah,19,19,At that time there will be an altar for the Lord in the middle of Egypt. At the border of Egypt there will be a monument to the Lord.
Isaiah,19,20,"This will be a sign. It will show that the Lord of heaven’s armies is powerful. When the people cry to the Lord for help, he will send help. He will send someone to save and defend the people. He will rescue them from those who hurt them."
Isaiah,19,21,"So the Lord will show himself to the Egyptians. Then they will say he is the Lord. They will serve God and offer many sacrifices. They will make promises to the Lord, and they will keep them."
Isaiah,19,22,The Lord will punish the Egyptians. Then he will heal them. They will come back to the Lord. He will listen to their prayers and heal them.
Isaiah,19,23,At that time there will be a highway from Egypt to Assyria. Then people from Assyria will go to Egypt. And the Egyptians will go to Assyria. The Egyptians and Assyrians will worship God together.
Isaiah,19,24,"At that time Israel, Assyria and Egypt will join together. This will be a blessing for the earth."
Isaiah,19,25,"The Lord of heaven’s armies will bless them. He will say, “Egypt, you are my people. Assyria, I made you. Israel, I own you. You are all blessed!”"
Isaiah,20,1,Sargon was the king of Assyria. He sent a military commander to Ashdod to attack that city. So the commander attacked and captured it.
Isaiah,20,2,"Then the Lord spoke through Isaiah son of Amoz. The Lord said, “Take the rough cloth off your body. Take your sandals off your feet.” So Isaiah obeyed the Lord. He walked around without his clothes of rough cloth or his sandals."
Isaiah,20,3,"Then the Lord said, “Isaiah my servant has walked around without his clothes of rough cloth or his sandals for three years. This is a sign for Egypt and Cush."
Isaiah,20,4,The king of Assyria will defeat Egypt and Cush. Assyria will take prisoners and lead them away from their countries. The old people and young people will be led away naked. They will go without clothes and without sandals. So the Egyptians will be shamed.
Isaiah,20,5,People who looked to Cush for help will be afraid. People who were amazed by Egypt’s glory will be shamed.
Isaiah,20,6,"Those people who live near the sea will say, ‘We trusted those countries to help us. We ran to them so they would save us from the king of Assyria. But look at them. They have been captured. So how will we be able to escape?’”"
Isaiah,21,1,The message about the Desert by the Sea: Disaster is coming from the desert. It is coming like wind blowing in the south. It is coming from a terrible country.
Isaiah,21,2,"I have seen a terrible vision. I see traitors turning against you. I see people taking your wealth. Elam, attack the people! Media, surround the city and attack it! I will bring an end to the pain the city causes."
Isaiah,21,3,"I saw those terrible things, and now I am in pain. My pains are like the pains of giving birth. What I hear makes me very afraid. What I see causes me to shake with fear."
Isaiah,21,4,"I am worried, and I am shaking with fear. My pleasant evening has become a night of fear."
Isaiah,21,5,"They set the table. They spread the rugs. They eat and drink! Leaders, stand up. Prepare the shields for battle!"
Isaiah,21,6,"The Lord said to me, “Go. Have a man be a lookout for the city. Have him report what he sees."
Isaiah,21,7,"If he sees chariots and teams of horses, donkeys or camels, he should pay very close attention.”"
Isaiah,21,8,"Then the lookout called out, “My Master, each day I stand in the watchtower watching. Every night I have been on guard."
Isaiah,21,9,"Look. I see a man coming in a chariot with a team of horses.” The man gives back the answer, “Babylon has fallen. It has fallen! All the statues of her gods lie broken on the ground.”"
Isaiah,21,10,"My people are crushed like grain on the threshing floor. My people, I tell you what I have heard from the Lord. He is the Lord of heaven’s armies, the God of Israel."
Isaiah,21,11,"The message about Dumah: Someone calls to me from Edom. He says, “Watchman, how much of the night is left? Watchman, how much longer will it be night?”"
Isaiah,21,12,"The watchman answered, “Morning is coming, but then night will come again. If you have something to ask, then come back and ask.”"
Isaiah,21,13,The message about Arabia: A group of traders from Dedan spent the night near some trees in Arabia.
Isaiah,21,14,They gave water to thirsty travelers. The people of Tema gave food to those who were escaping.
Isaiah,21,15,They were running from swords. The swords were ready to kill. They were running from bows ready to shoot. They were running from a hard battle.
Isaiah,21,16,This is what the Lord said to me: “In one year all the glory of the country of Kedar will be gone. (This is a year as a hired helper counts time.)
Isaiah,21,17,"At that time only a few of the archers will be left. Only a few of the soldiers of Kedar will be left alive.” The Lord, the God of Israel, has spoken."
Isaiah,22,1,The message about the Valley of Vision: What is wrong with you people? Why are you on your roofs?
Isaiah,22,2,"This city was a very busy city. It was full of noise and wild parties. But your people have been killed, but not with swords. They did not die in battle."
Isaiah,22,3,All your leaders ran away together. But they all have been captured without using a bow. All you who were captured tried to run away before the enemy came near.
Isaiah,22,4,"So I say, “Don’t look at me. Let me cry loudly. Don’t hurry to comfort me about the destruction of Jerusalem.”"
Isaiah,22,5,"The Master, the Lord of heaven’s armies, has chosen a special day. There will be riots and confusion. People will trample each other in the Valley of Vision. The city walls will be knocked down. The people will cry out to the mountain."
Isaiah,22,6,The soldiers from Elam will take their bags of arrows. Men in chariots and on horses will attack. Kir will prepare their shields.
Isaiah,22,7,Your nicest valleys will be filled with chariots. Horsemen will be ordered to guard the gates of the city.
Isaiah,22,8,The walls protecting Judah will fall. At that time the people of Jerusalem depended on the weapons kept at the Palace of the Forest.
Isaiah,22,9,You saw that the walls of Jerusalem had many cracks that needed repairing. You stored up water in the lower pool.
Isaiah,22,10,You counted the houses of Jerusalem. You tore them down to fix the walls with their stones.
Isaiah,22,11,You made a pool between the two walls. It was to save water from the old pool. But you did not trust the God who made these things. You did not respect the One who planned them long ago.
Isaiah,22,12,"The Master, the Lord of heaven’s armies, told the people to cry and be sad. He told them to shave their heads and wear rough cloth."
Isaiah,22,13,"But look. The people are happy. There are wild parties. They kill the cattle and the sheep. They eat the food and drink the wine. They say, “Let us eat and drink, because tomorrow we will die.”"
Isaiah,22,14,"The Lord of heaven’s armies said to me: “You people will die before this guilt is forgiven.” The Master, the Lord of heaven’s armies, said this."
Isaiah,22,15,"This is what the Master, the Lord of heaven’s armies, says: “Go to this servant Shebna. He is the manager of the palace."
Isaiah,22,16,"Say to him, ‘What are you doing here? Who said you could cut out a tomb for yourself here? Why are you preparing your tomb in a high place? Why are you carving out a tomb from the rock?"
Isaiah,22,17,"Look, mighty man! The Lord will throw you away. He will take firm hold of you."
Isaiah,22,18,He will roll you tightly into a ball and throw you into another country. There you will die. Your fine chariots will remain there. You are a disgrace to your master’s house.
Isaiah,22,19,I will force you out of your important job here. You will be thrown down from your important place.’
Isaiah,22,20,“At that time I will call for my servant Eliakim son of Hilkiah.
Isaiah,22,21,I will take your robe and put it on him. I will give him your belt. I will give him the important job you have. He will be like a father to the people of Jerusalem and the family of Judah.
Isaiah,22,22,"I will put the key to the house of David around his neck. If he opens a door, no one will be able to close it. If he closes a door, no one will be able to open it."
Isaiah,22,23,He will be like an honored chair in his father’s house. I will make him strong like a peg that is hammered into a strong board.
Isaiah,22,24,All the honored and important things of his family will depend on him. All the adults and little children will depend on him. They will be like bowls and jars hanging on him.
Isaiah,22,25,"“At that time,” says the Lord of heaven’s armies, “the peg hammered into the strong board will weaken. It will break and fall. And everything hanging on it will be destroyed.” The Lord says this."
Isaiah,23,1,"The message about Tyre: You ships of Tarshish, cry! The houses and harbor of Tyre are destroyed. This news came to the ships from the land of Cyprus."
Isaiah,23,2,"Be silent, you who live on the island of Tyre. You merchants of Sidon, be silent. Seamen have made you rich."
Isaiah,23,3,They traveled the sea to bring grain from Egypt. The men of Tyre brought grain from the Nile Valley and sold it to other nations.
Isaiah,23,4,"Sidon, be ashamed. Strong city of the sea, be ashamed. The sea says: “I have not felt the pain of giving birth. I have not reared young men or women.”"
Isaiah,23,5,Egypt will hear the news about Tyre. And it will make Egypt hurt with sorrow.
Isaiah,23,6,You ships should return to Tarshish. You people living near the sea should be sad.
Isaiah,23,7,"Look at your once happy city! Look at your old, old city! People from that city have traveled far away to live."
Isaiah,23,8,Who planned Tyre’s destruction? Tyre made others rich. Her merchants were treated like princes. Her traders were greatly respected.
Isaiah,23,9,It was the Lord of heaven’s armies who planned this! He decided to make these proud men unimportant. He decided to disgrace those who were greatly respected.
Isaiah,23,10,"Go through your land, Tarshish, like the Nile goes through Egypt. There is no harbor for you now!"
Isaiah,23,11,The Lord has stretched his hand over the sea. He makes its kingdoms tremble. He commands that Canaan’s places of safety be destroyed.
Isaiah,23,12,"The Lord said, “Sidon, you will not rejoice any longer. You are destroyed. Even if you cross the sea to Cyprus, you will not find a place to rest.”"
Isaiah,23,13,Look at the land of the Babylonians. Babylonia is not a country now. Assyria has made it a place for wild animals. Assyria built towers to attack it. The soldiers took all the treasures from its cities. They turned it into ruins.
Isaiah,23,14,"So be sad, you trading ships. Your place of safety is destroyed."
Isaiah,23,15,"At that time people will forget about Tyre for 70 years. That is the length of a king’s life. After 70 years, Tyre will be like the prostitute in this song:"
Isaiah,23,16,"“Oh woman, you are forgotten. Take your harp and walk through the city. Play your harp well. Sing your song often. Then people will remember you.”"
Isaiah,23,17,After 70 years the Lord will deal with Tyre. Tyre will again have trade. It will be like a prostitute for all the nations of the earth.
Isaiah,23,18,The profits will be saved for the Lord. Tyre will not keep the money she earns. It will give them to the people who serve the Lord. So they will have plenty of food and nice clothes.
Isaiah,24,1,Look! The Lord will destroy the earth and leave it empty. He will ruin the surface of the land and scatter its people.
Isaiah,24,2,"At that time the same thing will happen to everyone: to common people and priests, to slaves and masters, to women slaves and their women masters, to buyers and sellers, to those who borrow and those who lend, and to bankers and those who owe the bank."
Isaiah,24,3,The earth will be completely empty. The wealth will all be taken. This will happen because the Lord commanded it.
Isaiah,24,4,The earth will dry up and die. The world will grow weak and die. The great leaders in this land will become weak.
Isaiah,24,5,The people of the earth have ruined it. They do not follow God’s teachings. They do not obey God’s laws. They break their agreement with God that was to last forever.
Isaiah,24,6,A curse will destroy the earth. The people of the world are guilty. So they will be burned up. Only a few will be left.
Isaiah,24,7,"The new wine will be bad, and the grapevines will die. People who were happy will be sad."
Isaiah,24,8,The happy music of the tambourines will end. The happy sounds of wild parties will stop. The joyful music from the harps will end.
Isaiah,24,9,People will no longer sing while they drink their wine. The beer will taste bitter to those who drink it.
Isaiah,24,10,The ruined city will be empty. People will hide behind closed doors.
Isaiah,24,11,People in the streets will ask for wine. But joy will have turned to sadness. All the happiness will have left.
Isaiah,24,12,The city will be left in ruins. Its gates will be smashed to pieces.
Isaiah,24,13,This is what will happen all over the earth. This will happen to all the nations. The earth will be like an olive tree after the harvest. It will be like the few grapes left on a vine after harvest.
Isaiah,24,14,The people shout for joy. From the west they praise the greatness of the Lord.
Isaiah,24,15,"People in the east, praise the Lord. People in the islands of the sea, praise the name of the Lord, the God of Israel."
Isaiah,24,16,"We hear songs from every part of the earth. These songs praise God, the Righteous One. But I said, “I am dying! I am dying! How terrible it will be for me! Traitors turn against people. With their dishonesty, they turn against people.”"
Isaiah,24,17,"There are terrors, holes and traps for the people of the earth."
Isaiah,24,18,Anyone who tries to escape from the sound of terror will fall into a hole. Anyone who climbs out of the hole will be caught in a trap. The clouds in the sky will pour out rain. The foundations of the earth will shake.
Isaiah,24,19,The earth will be broken up. And the earth will split open. The earth will shake violently.
Isaiah,24,20,The earth will stumble around like a man who is drunk. It will shake like a hut in a storm. Its sin is like a heavy weight on its back. The earth will fall and never rise again.
Isaiah,24,21,At that time the Lord will punish the powers in the sky above and the rulers on earth below.
Isaiah,24,22,They will be gathered together. They will be thrown into a pit as prisoners. They will be shut up in prison. After much time they will be punished.
Isaiah,24,23,The moon will be embarrassed. The sun will be ashamed. This will happen because the Lord of heaven’s armies will rule as king on Mount Zion in Jerusalem. Jerusalem’s leaders will see his greatness.
Isaiah,25,1,"Lord, you are my God. I honor you and praise you. You have done amazing things. You have always done what you said you would. You have done what you planned long ago."
Isaiah,25,2,You have made the city a pile of rocks. You have destroyed her walls. The city our enemies built with strong walls is gone. It will never be built again.
Isaiah,25,3,People from powerful nations will honor you. Cruel people from strong cities will fear you.
Isaiah,25,4,You help the poor people. You help the helpless when they are in danger. You are like a shelter from storms. You are like shade that protects them from the heat. The cruel people attack like a rainstorm beating against the wall.
Isaiah,25,5,"The cruel people burn like the heat in the desert. But you, God, stop their violent attack. As a cloud cools a hot day, Lord, you silence the songs of those who have no mercy."
Isaiah,25,6,The Lord of heaven’s armies will give a feast. It will be on this mountain for all people. It will be a feast with the best food and wine. The meat and wine will be the finest.
Isaiah,25,7,"On this mountain God will destroy the veil that covers all nations. This veil, called “death,” covers all peoples."
Isaiah,25,8,But God will destroy death forever. The Lord God will wipe away every tear from every face. God will take away the shame of his people from the earth. The Lord has spoken.
Isaiah,25,9,"At that time people will say, “Our God is doing this! We have trusted in him, and he has come to save us. We have been trusting our Lord. So we will rejoice and be happy when he saves us.”"
