2 Samuel,1,1,"Saul was dead. Meanwhile, David had defeated the Amalekites and returned to Ziklag."
2 Samuel,1,2,"Three days later, a soldier came from Saul's army. His clothes were torn, and earth was on his head. He went to David and knelt down in front of him."
2 Samuel,1,3,"David asked, “Where did you come from?” The man answered, “From Israel's army. I barely escaped with my life.”"
2 Samuel,1,4,"“Who won the battle?” David asked. The man said, “Our army turned and ran, but many were wounded and died. Even King Saul and his son Jonathan are dead.”"
2 Samuel,1,5,"David asked, “How do you know Saul and Jonathan are dead?”"
2 Samuel,1,6,The young man replied: I was on Mount Gilboa and saw King Saul leaning on his spear. The enemy's war chariots and cavalry were closing in on him.
2 Samuel,1,7,"When he turned round and saw me, he called me over. I went and asked what he wanted."
2 Samuel,1,8,"Saul asked me, “Who are you?” “An Amalekite,” I answered."
2 Samuel,1,9,"Then he said, “Kill me! I'm dying, and I'm in terrible pain.”"
2 Samuel,1,10,"So I killed him. I knew he was too badly wounded to live much longer. Then I took his crown and his arm-band, and I brought them to you, Your Majesty. Here they are."
2 Samuel,1,11,"Straight away, David and his soldiers tore their clothes in sorrow."
2 Samuel,1,12,"They cried all day long and would not eat anything. Everyone was sad because Saul, his son Jonathan, and many of the LORD 's people had been killed in the battle."
2 Samuel,1,13,"David asked the young man, “Where is your home?” The man replied, “My father is an Amalekite, but we live in Israel.”"
2 Samuel,2,1,"Later, David asked the LORD , “Should I go back to one of the towns of Judah?” The LORD answered, “Yes.” David asked, “Which town should I go to?” “Go to Hebron,” the LORD replied."
2 Samuel,2,2,"David went to Hebron with his two wives, Ahinoam and Abigail. Ahinoam was from Jezreel, and Abigail was the widow of Nabal from Carmel."
2 Samuel,2,3,David also took his men and their families to live in the villages near Hebron.
2 Samuel,2,4,"The people of Judah met with David at Hebron and poured olive oil on his head to show that he was their new king. Then they told David, “The people from Jabesh in Gilead buried Saul.”"
2 Samuel,2,5,"David sent messengers to tell them: The LORD bless you! You were kind enough to bury Saul your ruler,"
2 Samuel,2,6,and I pray that the LORD will be kind and faithful to you. I will be your friend because of what you have done.
2 Samuel,2,7,"Saul is dead, but the tribe of Judah has made me their king. So be strong and have courage."
2 Samuel,2,8,Abner the son of Ner had been the general of Saul's army. He took Saul's son Ishbosheth across the River Jordan to Mahanaim
2 Samuel,2,9,"and made him king of Israel, including the areas of Gilead, Asher, Jezreel, Ephraim, and Benjamin."
2 Samuel,2,10,"Ishbosheth was forty years old at the time, and he ruled for two years. But the tribe of Judah made David their king,"
2 Samuel,2,11,and he ruled from Hebron for seven and a half years.
2 Samuel,2,12,"One day, Abner and the soldiers of Ishbosheth left Mahanaim and went to Gibeon."
2 Samuel,2,13,"Meanwhile, Joab the son of Zeruiah was leading David's soldiers, and the two groups met at the pool in Gibeon. Abner and his men sat down on one side of the pool, while Joab and his men sat on the other side."
2 Samuel,2,14,"Abner yelled to Joab, “Let's get some of our best soldiers to stand up and fight each other!” Joab agreed,"
2 Samuel,2,15,and twelve of Ishbosheth's men from the tribe of Benjamin got up to fight twelve of David's men.
2 Samuel,2,16,They grabbed each other by the hair and stabbed each other in the side with their daggers. They all died there! That's why the place in Gibeon is called “Field of Daggers”.
2 Samuel,2,17,"Then everyone started fighting. Both sides fought very hard, but David's soldiers defeated Abner and the soldiers of Israel."
2 Samuel,2,18,"Zeruiah's three sons were there: Joab, Abishai, and Asahel. Asahel could run as fast as a deer in an open field,"
2 Samuel,2,19,"and he ran straight after Abner, without looking to the right or to the left."
2 Samuel,2,20,"When Abner turned and saw him, he said, “Is that you, Asahel?” Asahel answered, “Yes it is.”"
2 Samuel,2,21,"Abner said, “There are soldiers all around. Stop chasing me and fight one of them! Kill him and take his clothes and weapons for yourself.” But Asahel refused to stop."
2 Samuel,2,22,"Abner said, “If you don't turn back, I'll have to kill you! Then I could never face your brother Joab again.”"
2 Samuel,2,23,"But Asahel would not turn back, so Abner struck him in the stomach with the back end of his spear. The spear went all the way through and came out of his back. Asahel fell down and died. Everyone who saw Asahel lying dead just stopped and stood still."
2 Samuel,2,24,"But Joab and Abishai went after Abner. Finally, about sunset, they came to the hill of Ammah, not far from Giah on the road to Gibeon Desert."
2 Samuel,2,25,"Abner brought the men of Benjamin together in one group on top of a hill, and they got ready to fight."
2 Samuel,2,26,"Abner shouted to Joab, “Aren't we ever going to stop killing each other? Don't you know that the longer we keep on doing this, the worse it's going to be when it's all over? When are you going to order your men to stop chasing their own relatives?”"
2 Samuel,2,27,"Joab shouted back, “I swear by the living God, if you hadn't spoken, my men would have chased their relatives all night!”"
2 Samuel,2,28,"Joab took his trumpet and blew the signal for his soldiers to stop chasing the soldiers of Israel. Straight away, the fighting stopped."
2 Samuel,2,29,Abner and his troops marched through the Jordan valley all that night. Then they crossed the river and marched all morning until they arrived back at Mahanaim.
2 Samuel,2,30,"As soon as Joab stopped chasing Abner, he got David's troops together and counted them. There were nineteen missing besides Asahel."
2 Samuel,2,31,But David's soldiers had killed 360 of Abner's men from the tribe of Benjamin.
2 Samuel,2,32,Joab and his troops carried Asahel's body to Bethlehem and buried him in the family burial place. Then they marched all night and reached Hebron before sunrise.
2 Samuel,3,1,"This battle was the beginning of a long war between the followers of Saul and the followers of David. Saul's power grew weaker, but David's grew stronger."
2 Samuel,4,1,Ishbosheth felt like giving up after he heard that Abner had died in Hebron. Everyone in Israel was terrified.
2 Samuel,4,2,"Ishbosheth had put the two brothers Baanah and Rechab in charge of the soldiers who raided enemy villages. Rimmon was their father, and they were from the town of Beeroth, which belonged to the tribe of Benjamin."
2 Samuel,4,3,"The people who used to live in Beeroth had run away to Gittaim, and they still live there."
2 Samuel,4,4,"Saul's son Jonathan had a son named Mephibosheth, who had not been able to walk since he was five years old. It happened when someone from Jezreel told his nurse that Saul and Jonathan had died. She hurried off with the boy in her arms, but he fell and injured his legs."
2 Samuel,4,5,"One day about midday, Rechab and Baanah went to Ishbosheth's house. It was a hot day, and he was resting"
2 Samuel,5,1,"Israel's leaders met with David at Hebron and said, “We are your relatives."
2 Samuel,5,2,"Even when Saul was king, you led our nation in battle. And the LORD promised that some day you would rule Israel and take care of us like a shepherd.”"
2 Samuel,5,3,"During the meeting, David made an agreement with the leaders and asked the LORD to be their witness. Then the leaders poured olive oil on David's head to show that he was now the king of Israel."
2 Samuel,5,4,"David was thirty years old when he became king, and he ruled for forty years."
2 Samuel,5,5,"He lived in Hebron for the first seven and a half years and ruled only Judah. Then he moved to Jerusalem, where he ruled both Israel and Judah for thirty-three years."
2 Samuel,5,6,"The Jebusites lived in Jerusalem, and David led his army there to attack them. The Jebusites did not think he could get in, so they told him, “You can't get in here! We could drive you away, even if we couldn't see or walk!”"
2 Samuel,6,1,David brought together thirty thousand of Israel's best soldiers and
2 Samuel,6,2,"led them to Baalah in Judah, which was also called Kiriath-Jearim. They were going there to get the sacred chest and bring it back to Jerusalem. The throne of the LORD All-Powerful is above the winged creatures on top of this chest, and he is worshipped there."
2 Samuel,6,3,"They put the sacred chest on a new ox cart and started bringing it down the hill from Abinadab's house. Abinadab's sons Uzzah and Ahio were guiding the ox cart,"
2 Samuel,6,4,with Ahio walking in front of it.
2 Samuel,6,5,"Some of the people of Israel were playing music on small harps and other stringed instruments, and on tambourines, castanets, and cymbals. David and the others were happy, and they danced for the LORD with all their might."
2 Samuel,6,6,"But when they came to Nacon's threshing floor, the oxen stumbled, so Uzzah reached out and took hold of the sacred chest."
2 Samuel,6,7,"The LORD God was very angry with Uzzah for doing this, and he killed Uzzah there beside the chest."
2 Samuel,6,8,"David got angry with God for killing Uzzah. He named that place “Bursting Out Against Uzzah”, and that's what it's still called."
2 Samuel,6,9,"David was afraid of the LORD and thought, “Should I really take the sacred chest to my city?”"
2 Samuel,6,10,"He decided not to take it there. Instead, he turned off the road and took it to the home of Obed-Edom, who was from Gath."
2 Samuel,7,1,"King David moved into his new palace, and the LORD let his kingdom be at peace."
2 Samuel,7,2,"Then one day, as David was talking with Nathan the prophet, David said, “Look around! I live in a palace made of cedar, but the sacred chest has to stay in a tent.”"
2 Samuel,7,3,"Nathan replied, “The LORD is with you, so do what you want!”"
2 Samuel,7,4,"That night, the LORD told Nathan"
2 Samuel,7,5,"to go to David and give him this message: David, you are my servant, so listen to what I say. Why should you build a temple for me?"
2 Samuel,7,6,"I didn't live in a temple when I brought my people out of Egypt, and I don't live in one now. A tent has always been my home wherever I have gone with them."
2 Samuel,7,7,I chose leaders and told them to be like shepherds for my people Israel. But did I ever say anything to even one of them about building a cedar temple for me?
2 Samuel,7,8,"David, this is what I, the LORD All-Powerful, say to you. I brought you in from the fields where you took care of sheep, and I made you the leader of my people."
2 Samuel,7,9,"Wherever you went, I helped you and destroyed your enemies right in front of your eyes. I have made you one of the most famous people in the world."
2 Samuel,7,10,"I have given my people Israel a land of their own where they can live in peace, and they won't have to tremble with fear any more. Evil nations won't bother them, as they did"
2 Samuel,7,11,when I let judges rule my people. And I have kept your enemies from attacking you. Now I promise that you and your descendants will be kings.
2 Samuel,7,12,"I'll choose one of your sons to be king when you reach the end of your life and are buried in the tomb of your ancestors. I'll make him a strong ruler,"
2 Samuel,7,13,and no one will be able to take his kingdom away from him. He will be the one to build a temple for me.
2 Samuel,7,14,"I will be his father, and he will be my son. When he does wrong, I'll see that he is corrected, just as children are corrected by their parents."
2 Samuel,7,15,"But I will never put an end to my agreement with him, as I put an end to my agreement with Saul, who was king before you."
2 Samuel,7,16,I will make sure that one of your descendants will always be king.
2 Samuel,7,17,Nathan told David exactly what he had heard in the vision.
2 Samuel,7,18,"David went into the tent he had set up for the sacred chest. Then he sat there and prayed: LORD All-Powerful, my family and I don't deserve what you have already done for us,"
2 Samuel,7,19,and yet you have promised to do even more. Is this the way you usually treat people?
2 Samuel,7,20,"I am your servant, and you know my thoughts, so there is nothing more that I need to say."
2 Samuel,7,21,"You have done this wonderful thing, and you have let me know about it, because you wanted to keep your promise."
2 Samuel,7,22," LORD All-Powerful, you are greater than all others. No one is like you, and you alone are God. Everything we have heard about you is true."
2 Samuel,7,23,"And there is no other nation on earth like Israel, the nation you rescued from slavery in Egypt to be your own. You became famous by using great and wonderful miracles to force other nations and their gods out of your land, so your people could live here."
2 Samuel,7,24,"You have chosen Israel to be your people for ever, and you have become their God."
2 Samuel,7,25,"And now, LORD God, please do what you have promised me and my descendants."
2 Samuel,7,26,"Then you will be famous for ever, and everyone will say, “The LORD God All-Powerful rules Israel, and David's descendants are his chosen kings.”"
2 Samuel,7,27,"After all, you really are Israel's God, the LORD All-Powerful. You've told me that you will let my descendants be kings. That's why I have the courage to pray to you like this, even though I am only your servant."
2 Samuel,7,28," LORD All-Powerful, you are God. You have promised me some very good things, and you can be trusted to do what you promise."
2 Samuel,7,29,"Please bless my descendants and let them always be your chosen kings. You have already promised, and I'm sure that you will bless my family for ever."
2 Samuel,8,1,"Later, David attacked and badly defeated the Philistines. Israel was now free from their control."
2 Samuel,8,2,"David also defeated the Moabites. Then he made their soldiers lie down on the ground, and he measured them off with a rope. He would measure off two lengths of the rope and have those men killed, then he would measure off one length and let those men live. The people of Moab had to accept David as their ruler and pay taxes to him."
2 Samuel,8,3,"David set out for the River Euphrates to build a monument there. On his way, he defeated the king of Zobah, whose name was Hadadezer the son of Rehob."
2 Samuel,8,4,"In the battle, David captured seventeen hundred cavalry and twenty thousand foot soldiers. He also captured war chariots, but he destroyed all but one hundred of them."
2 Samuel,8,5,"When troops from the Aramean kingdom of Damascus came to help Hadadezer, David killed twenty thousand of them."
2 Samuel,8,6,"He left some of his soldiers in Damascus, and the Arameans had to accept David as their ruler and pay taxes to him. Everywhere David went, the LORD helped him win battles."
2 Samuel,8,7,"Hadadezer's officers had carried their arrows in gold cases hung over their shoulders, but David took these cases and brought them to Jerusalem."
2 Samuel,8,8,"He also took a lot of bronze from the cities of Betah and Berothai, which had belonged to Hadadezer."
2 Samuel,9,1,"One day, David thought, “I wonder if any of Saul's family are still alive. If they are, I will be kind to them, because I made a promise to Jonathan.”"
2 Samuel,9,2,"David called in Ziba, one of the servants of Saul's family. David said, “So you are Ziba.” “Yes, Your Majesty, I am.”"
2 Samuel,9,3,"David asked, “Are any of Saul's family still alive? If there are, I want to be kind to them.” Ziba answered, “One of Jonathan's sons is still alive, but he can't walk.”"
2 Samuel,9,4,"“Where is he?” David asked. Ziba replied, “He lives in Lo-Debar with Machir the son of Ammiel.”"
2 Samuel,10,1,"Some time later, King Nahash of Ammon died, and his son Hanun became king."
2 Samuel,10,2,"David said, “Nahash was kind to me, and I will be kind to his son.” So he sent some officials to the country of Ammon to tell Hanun how sorry he was that his father had died."
2 Samuel,10,3,"But Hanun's officials told him, “Do you really believe David is honouring your father by sending these people to comfort you? He probably sent them to spy on our city, so he can destroy it.”"
2 Samuel,10,4,"Hanun arrested David's officials and had their beards shaved off on one side of their faces. He had their robes cut off just below the waist, and then he sent them away."
2 Samuel,10,5,"They were terribly ashamed. When David found out what had happened to his officials, he sent a message and told them, “Stay in Jericho until your beards grow back. Then you can come home.”"
2 Samuel,10,6,"The Ammonites realized that they had made David very angry, so they hired more foreign soldiers. Twenty thousand of them were foot soldiers from the Aramean cities of Beth-Rehob and Zobah, one thousand were from the king of Maacah, and twelve thousand were from the region of Tob."
2 Samuel,10,7,"David heard what they had done, and he sent out Joab with all his well-trained soldiers."
2 Samuel,10,8,The Ammonite troops came out and got ready to fight in front of the gate to their city. The Arameans from Zobah and Rehob and the soldiers from Tob and Maacah formed a separate group in the nearby fields.
2 Samuel,10,9,"Joab saw that he had to fight in front and behind at the same time, and he picked some of the best Israelite soldiers to fight the Arameans."
2 Samuel,10,10,He put his brother Abishai in command of the rest of the army and made them fight the Ammonites.
2 Samuel,10,11,"Joab told his brother, “If the Arameans are too much for me to handle, you can come and help me. If the Ammonites are too strong for you, I'll come and help you."
2 Samuel,10,12,Be brave and fight hard to protect our people and the cities of our God. I pray that the LORD will do whatever pleases him.”
2 Samuel,10,13,"Joab and his soldiers attacked the Arameans, and the Arameans ran from them."
2 Samuel,10,14,"When the Ammonite soldiers saw that the Arameans had run away, they ran from Abishai's soldiers and went back into their own city. Joab stopped fighting the Ammonites and returned to Jerusalem."
2 Samuel,10,15,"The Arameans realized they had lost the battle, so they brought all their troops together again."
2 Samuel,10,16,"Hadadezer sent messengers to call in the Arameans who were on the other side of the River Euphrates. Then Shobach, the commander of Hadadezer's army, led them to the town of Helam."
2 Samuel,10,17,"David found out what the Arameans were doing, and he brought Israel's whole army together. They crossed the River Jordan and went to Helam, where the Arameans were ready to meet them."
2 Samuel,10,18,"The Arameans attacked, but then they ran from Israel. David killed seven hundred chariot drivers and forty thousand cavalry. He also killed Shobach, their commander."
2 Samuel,10,19,"When the kings who had been under Hadadezer's rule saw that Israel had beaten them, they made peace with Israel and accepted David as their ruler. The Arameans were afraid to help Ammon any more."
2 Samuel,11,1,"It was now spring, the time when kings go to war. David sent out the whole Israelite army under the command of Joab and his officers. They destroyed the Ammonite army and surrounded the capital city of Rabbah, but David stayed in Jerusalem."
2 Samuel,12,1,and he sent Nathan the prophet to tell this story to David: A rich man and a poor man lived in the same town.
2 Samuel,12,2,"The rich man owned a lot of sheep and cattle,"
2 Samuel,12,3,but the poor man had only one little lamb that he had bought and raised. The lamb became a pet for him and his children. He even let it eat from his plate and drink from his cup and sleep on his lap. The lamb was like one of his own children.
2 Samuel,12,4,"One day someone came to visit the rich man, but the rich man didn't want to kill any of his own sheep or cattle and serve it to the visitor. So he stole the poor man's little lamb and served it instead."
2 Samuel,12,5,"David was furious with the rich man and said to Nathan, “I swear by the living LORD that the man who did this deserves to die!"
2 Samuel,12,6,"And because he didn't have any pity on the poor man, he will have to pay four times what the lamb was worth.”"
2 Samuel,12,7,Then Nathan told David: You are that rich man! Now listen to what the LORD God of Israel says to you: “I chose you to be the king of Israel. I kept you safe from Saul
2 Samuel,12,8,"and even gave you his house and his wives. I let you rule Israel and Judah, and if that had not been enough, I would have given you much more."
2 Samuel,12,9,"Why did you disobey me and do such a horrible thing? You murdered Uriah the Hittite by letting the Ammonites kill him, so you could take his wife."
2 Samuel,12,10,"“Because you wouldn't obey me and took Uriah's wife for yourself, your family will never live in peace."
2 Samuel,12,11,"Someone from your own family will cause you a lot of trouble, and I will take your wives and give them to another man before your very eyes. He will go to bed with them while everyone looks on."
2 Samuel,12,12,"What you did was in secret, but I will do this in the open for everyone in Israel to see.”"
2 Samuel,13,1,"David had a beautiful daughter named Tamar, who was the sister of Absalom. She was also the half-sister of Amnon, who fell in love with her."
2 Samuel,13,2,"But Tamar was a virgin, and Amnon could not think of a way to be alone with her. He was so upset about it that he made himself sick."
2 Samuel,13,3,"Amnon had a friend named Jonadab, who was the son of David's brother Shimeah. Jonadab always knew how to get what he wanted,"
2 Samuel,13,4,"and he said to Amnon, “What's the matter? You're the king's son! You shouldn't have to go around feeling sorry for yourself every morning.” Amnon said, “I'm in love with Tamar, my brother Absalom's sister.”"
2 Samuel,13,5,"Jonadab told him, “Lie down on your bed and pretend to be sick. When your father comes to see you, ask him to send Tamar, so you can watch her cook something for you. Then she can serve you the food.”"
2 Samuel,13,6,"So Amnon went to bed and pretended to be sick. When the king came to see him, Amnon said, “Please, ask Tamar to come over. She can make some special bread while I watch, and then she can serve me the bread.”"
2 Samuel,13,7,"David told Tamar, “Go over to Amnon's house and prepare him some food.”"
2 Samuel,13,8,"When she got there, he was lying in bed. She mixed the dough, made the loaves, and baked them while he watched."
2 Samuel,13,9,"Then she took the bread out of the pan and put it on his plate, but he refused to eat it. Amnon said, “Send the servants out of the house.” After they had gone,"
2 Samuel,13,10,"he said to Tamar, “Serve the food in my bedroom.” Tamar picked up the bread that she had made and brought it into Amnon's bedroom."
2 Samuel,13,11,"But as she was taking it over to him, he grabbed her and said, “Come to bed with me!”"
2 Samuel,13,12,"She answered, “No! Please don't force me! This sort of thing isn't done in Israel. It's too disgusting!"
2 Samuel,13,13,"Think of me. I'll be disgraced for ever! And think of yourself. Everyone in Israel will say you're nothing but a load of rubbish! Just ask the king, and he will let you marry me.”"
2 Samuel,13,14,"But Amnon would not listen to what she said. He was stronger than she was, so he overpowered her and raped her."
2 Samuel,13,15,"Then Amnon hated her even more than he had loved her before. So he told her, “Get up and get out!”"
2 Samuel,13,16,"She said, “Don't send me away! That would be worse than what you have already done.” But Amnon would not listen."
2 Samuel,13,17,"He called in his servant and said, “Throw this woman out and lock the door!”"
2 Samuel,13,18,"The servant made her leave, and he locked the door behind her. The king's unmarried daughters used to wear long robes with sleeves."
2 Samuel,13,19,Tamar tore the robe she was wearing and put ashes on her head. Then she covered her face with her hands and cried loudly as she walked away.
2 Samuel,13,20,"Tamar's brother Absalom said to her, “How could Amnon have done such a terrible thing to you! But since he's your brother, don't tell anyone what happened. Just try not to think about it.” Tamar soon moved into Absalom's house, but she was always sad and lonely."
2 Samuel,13,21,"When David heard what had happened to Tamar, he was very angry. But Amnon was his eldest son and also his favourite, and David would not do anything to make Amnon unhappy."
2 Samuel,13,22,"Absalom treated Amnon as though nothing had happened, but he hated Amnon for what he had done to his sister Tamar."
2 Samuel,13,23,"Two years later, Absalom's servants were cutting wool from his sheep in Baal-Hazor near the town of Ephraim, and Absalom invited all the king's sons to be there."
2 Samuel,13,24,"Then he went to David and said, “My servants are cutting the wool from my sheep. Please come and join us!”"
2 Samuel,13,25,"David answered, “No, my son, we won't go. It would be too expensive for you.” Absalom tried to get him to change his mind, but David did not want to go. He only said that he hoped they would have a good time."
2 Samuel,13,26,"Absalom said, “If you won't go, at least let my brother Amnon come with us.” David asked, “Why should he go with you?”"
2 Samuel,13,27,"But Absalom kept on insisting, and finally David let Amnon and all his other sons go with Absalom. Absalom prepared a banquet fit for a king."
