2 Samuel,23,9,"The next one of the Three Warriors was Eleazar the son of Dodo the Ahohite. One time when the Philistines were at war with Israel, he and David dared the Philistines to fight them. Every one of the Israelite soldiers turned and ran,"
2 Samuel,23,10,"except Eleazar. He killed Philistines until his hand was cramped, and he couldn't let go of his sword. When Eleazar finished, all the Israelite troops had to do was come back and take the enemies' weapons and armour. The LORD gave Israel a great victory that day."
2 Samuel,23,11,"Next was Shammah the son of Agee the Hararite. One time the Philistines brought their army together to destroy a crop of peas growing in a field near Lehi. The rest of Israel's soldiers ran away from the Philistines,"
2 Samuel,23,12,"but Shammah stood in the middle of the field and killed the Philistines. The crops were saved, and the LORD gave Israel a great victory."
2 Samuel,23,13,"One year at harvest time, the Three Warriors went to meet David at Adullam Cave. The Philistine army had set up camp in Rephaim Valley"
2 Samuel,23,14,"and had taken over Bethlehem. David was in his fortress,"
2 Samuel,23,15,"and he was very thirsty. He said, “I wish I had a drink from the well by the gate at Bethlehem.”"
2 Samuel,23,16,"The Three Warriors sneaked into the Philistine camp and got some water from the well near Bethlehem's gate. But after they brought the water back to David, he refused to drink it. Instead, he poured it out as a sacrifice"
2 Samuel,23,17,"and said to the LORD , “I can't drink this water! It's like the blood of these men who risked their lives to get it for me.” The Three Warriors did these brave deeds."
2 Samuel,23,18,"Joab's brother Abishai was the leader of the Thirty Warriors, and in one battle he killed three hundred men with his spear. He was as famous as the Three Warriors"
2 Samuel,23,19,"and certainly just as famous as the rest of the Thirty Warriors. He was the commander of the Thirty Warriors, but he still did not become one of the Three Warriors."
2 Samuel,23,20,"Benaiah the son of Jehoiada was a brave man from Kabzeel who did some amazing things. He killed two of Moab's best fighters, and on a snowy day he went down into a pit and killed a lion."
2 Samuel,23,21,"Another time, he killed an Egyptian, as big as a giant. The Egyptian was armed with a spear, but Benaiah only had a club. Benaiah grabbed the spear from the Egyptian and killed him with it."
2 Samuel,24,1,"The LORD was angry with Israel again, and he made David think it would be a good idea to count the people in Israel and Judah."
2 Samuel,24,2,"So David told Joab and the army officers, “Go to every tribe in Israel, from the town of Dan in the north all the way south to Beersheba, and count everyone who can serve in the army. I want to know how many there are.”"
2 Samuel,24,3,"Joab answered, “I hope the LORD your God will give you a hundred times more soldiers than you already have. I hope you will live to see that day! But why do you want to do a thing like this?”"
2 Samuel,24,4,"But when David refused to change his mind, Joab and the army officers went out and started counting the people."
2 Samuel,24,5,They crossed the River Jordan and began with Aroer and the town in the middle of the river valley. From there they went towards Gad and on as far as Jazer.
2 Samuel,24,6,"They went to Gilead and to Kadesh in Syria. Then they went to Dan, Ijon, and on towards Sidon."
2 Samuel,24,7,"They came to the fortress of Tyre, then went through every town of the Hivites and the Canaanites. Finally, they went to Beersheba in the Southern Desert of Judah."
2 Samuel,24,8,"After they had gone through the whole land, they went back to Jerusalem. It had taken them nine months and twenty days."
2 Samuel,24,9,"Joab came and told David, “In Israel there are eight hundred thousand who can serve in the army, and in Judah there are five hundred thousand.”"
2 Samuel,24,10,"After David had everyone counted, he felt guilty and told the LORD , “What I did was stupid and terribly wrong. LORD , please forgive me.”"
2 Samuel,24,11,"Before David even got up the next morning, the LORD had told David's prophet Gad"
