2 Samuel,13,28,"But he told his servants, “Keep an eye on Amnon. When he gets a little drunk from the wine and is feeling good, I'll give the signal. Then kill him! I've commanded you to do it, so don't be afraid. Be strong and brave.”"
2 Samuel,13,29,"Absalom's servants killed Amnon, just as Absalom had told them. The rest of the king's sons quickly rode away on their mules to escape from Absalom."
2 Samuel,13,30,"While they were on their way to Jerusalem, someone told David, “Absalom has killed all your sons! Not even one is left.”"
2 Samuel,13,31,"David got up, and in his sorrow he tore his clothes and lay down on the ground. His servants remained standing, but they tore their clothes too."
2 Samuel,13,32,"Then David's nephew Jonadab said, “Your Majesty, not all your sons were killed! Only Amnon is dead. On the day that Amnon raped Tamar, Absalom decided to kill him."
2 Samuel,13,33,"Don't worry about the report that all your sons were killed. Only Amnon is dead,"
2 Samuel,13,34,"and Absalom has run away.” One of the guards noticed a lot of people coming along the hillside on the road to Horonaim. He went and told the king, “I saw some men coming along Horonaim Road.”"
2 Samuel,13,35,"Jonadab said, “Your Majesty, look! Here come your sons now, just as I told you.”"
2 Samuel,13,36,"No sooner had he said it, than David's sons came in. They were weeping out loud, and David and all his officials cried just as loudly."
2 Samuel,14,1,"Joab knew that David couldn't stop thinking about Absalom,"
2 Samuel,15,1,"Some time later, Absalom got himself a chariot with horses to pull it, and he had fifty men to run in front."
2 Samuel,15,2,"He would get up early each morning and wait by the side of the road that led to the city gate. Anyone who had a complaint to bring to King David would have to go that way, and Absalom would ask each of them, “Where are you from?” If they said, “I'm from a tribe in the north,”"
2 Samuel,15,3,"Absalom would say, “You deserve to win your case. But the king doesn't have anyone to hear complaints like yours."
2 Samuel,15,4,I wish someone would make me the judge around here! I would be fair to everyone.”
2 Samuel,15,5,"Whenever anyone would come to Absalom and start bowing down, he would reach out and hug and kiss them."
2 Samuel,15,6,That's how he treated everyone from Israel who brought a complaint to the king. Soon everyone in Israel liked Absalom better than they liked David.
2 Samuel,15,7,"Four years later, Absalom said to David, “Please, let me go to Hebron. I have to keep a promise that I made to the LORD,"
2 Samuel,15,8,"when I was living with the Arameans in Geshur. I promised that if the LORD would bring me back to live in Jerusalem, I would worship him in Hebron.”"
2 Samuel,15,9,"David gave his permission, and Absalom went to Hebron."
2 Samuel,16,1,"David had started down the other side of the Mount of Olives, when he was met by Ziba, the chief servant of Mephibosheth. Ziba had two donkeys that were carrying two hundred loaves of bread, a hundred handfuls of raisins, a hundred figs, and some wine."
2 Samuel,16,2,"“What's all this?” David asked. Ziba said, “The donkeys are for your family to ride. The bread and fruit are for the people to eat, and the wine is for them to drink in the desert when they are tired out.”"
2 Samuel,16,3,"“And where is Mephibosheth?” David asked. Ziba answered, “He stayed in Jerusalem, because he thinks the people of Israel want him to rule the kingdom of his grandfather Saul.”"
2 Samuel,16,4,"David then told him, “Everything that used to belong to Mephibosheth is now yours.” Ziba said, “Your Majesty, I am your humble servant, and I hope you will be pleased with me.”"
2 Samuel,16,5,"David was near the town of Bahurim when a man came out and started cursing him. The man was Shimei the son of Gera, and he was one of Saul's distant relatives."
2 Samuel,16,6,"He threw stones at David, at his soldiers, and at everyone else, including the bodyguards who walked on each side of David."
2 Samuel,16,7,"Shimei was yelling at David, “Get out of here, you murderer! You good-for-nothing,"
2 Samuel,16,8,"the LORD is paying you back for killing so many in Saul's family. You stole his kingdom, but now the LORD has given it to your son Absalom. You're a murderer, and that's why you're in such big trouble!”"
2 Samuel,16,9,"Abishai said, “Your Majesty, this man is as useless as a dead dog! He shouldn't be allowed to curse you. Let me go over and chop off his head.”"
2 Samuel,16,10,"David replied, “What will I ever do with you and your brother Joab? If Shimei is cursing me because the LORD has told him to, then who are you to tell him to stop?”"
2 Samuel,16,11,Then David said to Abishai and all his soldiers: My own son is trying to kill me! Why shouldn't this man from the tribe of Benjamin want me dead even more? Let him curse all he wants. Perhaps the LORD did tell him to curse me.
2 Samuel,16,12,"But if the LORD hears these curses and sees the trouble I'm in, perhaps he will have pity on me instead."
2 Samuel,16,13,"David and the others went on down the road. Shimei went along the hillside by the road, cursing and throwing stones and earth at them."
2 Samuel,16,14,"When David and those with him came to the River Jordan, they were tired out. But after they rested, they felt much better."
2 Samuel,16,15,"By this time, Absalom, Ahithophel, and the others had reached Jerusalem."
2 Samuel,16,16,"David's friend Hushai came to Absalom and said, “Long live the king! Long live the king!”"
2 Samuel,16,17,"But Absalom asked Hushai, “Is this how you show loyalty to your friend David? Why didn't you go with him?”"
2 Samuel,16,18,"Hushai answered, “The LORD and the people of Israel have chosen you to be king. I can't leave. I have to stay and serve the one they've chosen."
2 Samuel,16,19,"Besides, it seems right for me to serve you, just as I served your father.”"
2 Samuel,16,20,"Absalom turned to Ahithophel and said, “Give us your advice! What should we do?”"
2 Samuel,16,21,"Ahithophel answered, “Some of your father's wives were left here to take care of the palace. You should have sex with them. Then everyone will find out that you have publicly disgraced your father. This will make you and your followers even more powerful.”"
2 Samuel,16,22,"Absalom had a tent set up on the flat roof of the palace, and everyone watched as he went into the tent with his father's wives."
2 Samuel,16,23,Ahithophel gave such good advice in those days that both Absalom and David thought it came straight from God.
2 Samuel,17,1,"Ahithophel said to Absalom: Let me choose twelve thousand men and attack David tonight,"
2 Samuel,17,2,"while he is tired and discouraged. He will panic, and everyone with him will run away. I won't kill anyone except David,"
2 Samuel,17,3,since he's the one you want to get rid of. Then I'll bring the whole nation back to you like a bride coming home to her husband. This way there won't be a civil war.
2 Samuel,17,4,Absalom and all the leaders of the tribes of Israel agreed that Ahithophel had a good plan.
2 Samuel,17,5,"Then Absalom said, “Bring in Hushai the Archite. Let's hear what he has to say.”"
2 Samuel,17,6,"Hushai came in, and Absalom told him what Ahithophel had planned. Then Absalom said, “Should we do what he says? And if we shouldn't, can you come up with anything better?”"
2 Samuel,17,7,Hushai said: This time Ahithophel's advice isn't so good.
2 Samuel,17,8,"You know that your father and his followers are real warriors. Now they are as fierce as a mother bear whose cubs have just been killed. Besides, your father has a lot of experience in fighting wars, and he won't be spending the night with the others."
2 Samuel,17,9,"He has probably already found a hiding place in a cave or somewhere else. As soon as anyone hears that some of your soldiers have been killed, everyone will think your whole army has been destroyed."
2 Samuel,17,10,Then even those who are as brave as a lion will lose their courage. All Israel knows what a great warrior your father is and what brave soldiers he has.
2 Samuel,17,11,"My advice is to gather all the fighting men of Israel from the town of Dan in the north down to the town of Beersheba in the south. You will have more soldiers than there are grains of sand on the seashore. Absalom, you should lead them yourself,"
2 Samuel,17,12,and we will all go to fight David wherever he is. We will fall on him just as dew falls and covers the ground. He and all his soldiers will die!
2 Samuel,17,13,"If they go into a walled town, we will put ropes around that town and drag it into the river. We won't leave even one small piece of a stone."
2 Samuel,17,14,Absalom and the others liked Hushai's plan better than Ahithophel's plan. This was because the LORD had decided to keep Ahithophel's plan from working and to cause trouble for Absalom.
2 Samuel,17,15,"Straight away, Hushai went to Zadok and Abiathar. He told them what advice Ahithophel had given to Absalom and to the leaders of Israel. He also told them about the advice he had given."
2 Samuel,17,16,"Then he said, “Hurry! Send someone to warn David not to spend the night on this side of the river. He must get across the river, so he and the others won't be wiped out!”"
2 Samuel,17,17,Jonathan and Ahimaaz had been waiting at Rogel Spring because they did not want to be seen in Jerusalem. A servant girl went to the spring and gave them the message for David.
2 Samuel,17,18,But a young man saw them and went to tell Absalom. So Jonathan and Ahimaaz left and hurried to the house of a man who lived in Bahurim. Then they climbed down into a well in the courtyard.
2 Samuel,17,19,"The man's wife put the cover on the well and poured grain on top of it, so the well could not be seen."
2 Samuel,17,20,"Absalom's soldiers came to the woman and demanded, “Where are Ahimaaz and Jonathan?” The woman answered, “They went across the stream.” The soldiers went off to look for the two men. But when they did not find the men, they went back to Jerusalem."
2 Samuel,17,21,"After the soldiers had gone, Jonathan and Ahimaaz climbed out of the well. They went to David and said, “Hurry! Get ready to cross the river!” Then they told him about Ahithophel's plan."
2 Samuel,17,22,David and the others got ready and started crossing the River Jordan. By sunrise all of them were on the other side.
2 Samuel,17,23,"When Ahithophel saw that Absalom and the leaders of Israel were not going to follow his advice, he saddled his donkey and rode back to his home in Gilo. He told his family and servants what to do. Then he hanged himself, and they buried him in his family's burial place."
2 Samuel,17,24,"David went to the town of Mahanaim, and Absalom crossed the River Jordan with the army of Israel."
2 Samuel,17,25,"Absalom put Amasa in Joab's place as commander of the army. Amasa's father was Ithra from the family of Ishmael, and his mother was Abigal, the daughter of Nahash and the sister of Joab's mother Zeruiah."
2 Samuel,17,26,The Israelites under Absalom's command set up camp in the region of Gilead.
2 Samuel,17,27,"After David came to the town of Mahanaim, Shobi the son of Nahash came from Rabbah in Ammon, Machir the son of Ammiel came from Lo-Debar, and Barzillai the Gileadite came from Rogelim."
2 Samuel,18,1,David divided his soldiers into groups of a hundred and groups of a thousand. Then he chose officers to be in command of each group.
2 Samuel,18,2,"He sent out one third of his army under the command of Joab, another third under the command of Abishai the son of Zeruiah, and the rest under the command of Ittai from Gath. He told the soldiers, “I'm going into battle with you.”"
2 Samuel,18,3,"But the soldiers said, “No, don't go into battle with us! It won't matter to our enemies if they make us all run away, or even if they kill half of us. But you are worth ten thousand of us. It would be better for you to stay in town and send help if we need it.”"
2 Samuel,19,1,"Someone told Joab, “The king is crying because Absalom is dead.”"
2 Samuel,19,2,"David's army found out he was crying because his son had died, and their day of victory suddenly turned into a day of sadness."
2 Samuel,19,3,"The troops were sneaking into Mahanaim, just as if they had run away from a battle and were ashamed."
2 Samuel,19,4,"David held his hands over his face and kept on crying loudly, “My son, Absalom! Absalom, my son, my son!”"
2 Samuel,19,5,"Joab went to the house where David was staying and told him: You've made your soldiers ashamed! Not only did they save your life, they saved your sons and daughters and wives as well."
2 Samuel,19,6,"You're more loyal to your enemies than to your friends. What you've done today has shown your officers and soldiers that they don't mean a thing to you. You would be happy if Absalom was still alive, even if the rest of us were dead."
2 Samuel,19,7,"Now get up! Go out there and thank them for what they did. If you don't, I swear by the LORD that you won't even have one man left on your side tomorrow morning. You may have had a lot of troubles in the past, but this will be the worst thing that has ever happened to you!"
2 Samuel,19,8,"David got up and went to the town gate and sat down. When the people heard that he was sitting there, they came to see him. After Israel's soldiers had all returned home,"
2 Samuel,20,1,"A troublemaker from the tribe of Benjamin was there. His name was Sheba the son of Bichri, and he blew a trumpet to get everyone's attention. Then he said, “People of Israel, David the son of Jesse doesn't belong to us! Let's go home.”"
2 Samuel,20,2,So they stopped following David and went off with Sheba. But the people of Judah stayed close to David all the way from the Jordan to Jerusalem.
2 Samuel,20,3,"David had left ten of his wives in Jerusalem to take care of his palace. But when he came back, he had them taken to another house, and he placed soldiers there to guard them. He gave them whatever they needed, but he never slept with any of them again. They had to live there for the rest of their lives as if they were widows."
2 Samuel,20,4,"David said to Amasa, “Three days from now I want you and all of Judah's army to be here!”"
2 Samuel,20,5,"Amasa started bringing the army together, but it was taking him more than three days."
2 Samuel,20,6,"So David said to Abishai, “Sheba will hurt us more than Absalom ever did. Take my best soldiers and go after him. We don't want him to take over any walled cities and get away from us.”"
2 Samuel,20,7,"Abishai left Jerusalem to try and capture Sheba. He took along Joab and his soldiers, as well as David's bodyguard and best troops."
2 Samuel,20,8,"They had gone as far as the big rock at Gibeon when Amasa caught up with them. Joab had a dagger strapped around his waist over his military uniform, but it fell out as he started towards Amasa."
2 Samuel,20,9,"Joab said, “Amasa, my cousin, how are you?” Then Joab took hold of Amasa's beard with his right hand, so that he could greet him with a kiss."
2 Samuel,20,10,"Amasa did not see the dagger in Joab's other hand. Joab stuck it in Amasa's stomach, and his insides spilt out on the ground. Joab only struck him once, but Amasa was dying. Joab and his brother Abishai went off to chase Sheba."
2 Samuel,20,11,"One of Joab's soldiers stood by Amasa and shouted, “If any of you like Joab, and if you are for David, then follow Joab!”"
2 Samuel,20,12,"Amasa was still rolling in his own blood in the middle of the road. The soldier who had shouted noticed that everyone who passed by would stop, so he dragged Amasa off the road and covered him with a blanket."
2 Samuel,20,13,"After this, no one else stopped. They all walked straight past him on their way to help Joab capture Sheba."
2 Samuel,20,14,Sheba had gone through all the tribes of Israel when he came to the town of Abel Beth-Maacah. All his best soldiers met him there and followed him into the town.
2 Samuel,20,15,"Joab and his troops came and surrounded Abel, so that no one could go in or come out. They made an earth ramp up to the town wall and then started to use a battering ram to knock the wall down."
2 Samuel,20,16,"A wise woman shouted from the top of the wall, “Listen to me! Listen to me! I have to talk to Joab! Tell him to come here!”"
2 Samuel,20,17,"When he came, the woman said, “Are you Joab?” “Yes, I am,” he answered. She said, “Please, listen to what I have to say.” “All right,” he said. “I'll listen.”"
2 Samuel,20,18,"She said, “Long ago people used to say, ‘If you want good advice, go to the town of Abel to get it.’ The answers they got here were all that was needed to settle any problem."
2 Samuel,20,19,"We are Israelites, and we want peace! You can trust us. Why are you trying to destroy a town that's like a mother in Israel? Why do you want to wipe out the LORD 's people?”"
2 Samuel,20,20,"Joab answered, “No, no! I'm not trying to wipe you out or destroy your town!"
2 Samuel,20,21,"That's not it at all. There's a man in your town from the hill country of Ephraim. His name is Sheba, and he is the leader of a rebellion against King David. Turn him over to me, and we will leave your town alone.” The woman told Joab, “We will throw his head over the wall.”"
2 Samuel,20,22,"She went to the people of the town and talked them into doing it. They cut off Sheba's head and threw it to Joab. Joab blew a signal on his trumpet, and the soldiers returned to their homes. Joab went back to David in Jerusalem."
2 Samuel,20,23,Joab was the commander of Israel's entire army. Benaiah the son of Jehoiada was in command of David's bodyguard.
2 Samuel,20,24,Adoram was in charge of the slave labour force. Jehoshaphat the son of Ahilud kept government records.
2 Samuel,20,25,Sheva was the secretary. Zadok and Abiathar were the priests.
2 Samuel,20,26,Ira from Jair was David's priest.
2 Samuel,21,1,"While David was king, there were three years in a row when the nation of Israel could not grow enough food. So David asked the LORD for help, and the LORD answered, “Saul and his family are guilty of murder, because he had the Gibeonites killed.”"
2 Samuel,21,2,"The Gibeonites were not Israelites; they were descendants of the Amorites. The people of Israel had promised not to kill them, but Saul had tried to kill them because he wanted Israel and Judah to control all the land. David called the Gibeonites to him, and he talked with them."
2 Samuel,21,3,"He said, “What can I do to make up for what Saul did, so that you'll ask the LORD to be kind to his people again?”"
2 Samuel,21,4,"The Gibeonites answered, “Silver and gold from Saul and his family are not enough. On the other hand, we don't have the right to put any Israelite to death.” David said, “I'll do whatever you ask.”"
2 Samuel,21,5,"They replied, “Saul tried to kill all our people so that none of us would be left in the land of Israel."
2 Samuel,21,6,"Give us seven of his descendants. We will hang these men near the place where the LORD is worshipped in Gibeah, the home town of Saul, the LORD 's chosen king.” “I'll give them to you,” David said."
2 Samuel,21,7,"David had made a promise to Jonathan with the LORD as his witness, so he spared Jonathan's son Mephibosheth, the grandson of Saul."
2 Samuel,21,8,But Saul and Rizpah the daughter of Aiah had two sons named Armoni and Mephibosheth. Saul's daughter Merab had five sons whose father was Adriel the son of Barzillai from Meholah. David took Rizpah's two sons and Merab's five sons and
2 Samuel,21,9,"turned them over to the Gibeonites, who hanged all seven of them on the mountain near the place where the LORD was worshipped. This happened right at the beginning of the barley harvest."
2 Samuel,21,10,"Rizpah spread out some sackcloth on a nearby rock. She wouldn't let the birds land on the bodies during the day, and she kept the wild animals away at night. She stayed there from the beginning of the harvest until it started to rain."
2 Samuel,22,1,"David sang a song to the LORD after the LORD had rescued him from his enemies, especially Saul. These are the words to David's song:"
2 Samuel,22,2,"Our LORD and our God, you are my mighty rock, my fortress, my protector."
2 Samuel,22,3,"You are the rock where I am safe. You are my shield, my powerful weapon, and my place of shelter. You rescue me and keep me from being hurt."
2 Samuel,22,4,"I praise you, our LORD! I prayed to you, and you rescued me from my enemies."
2 Samuel,22,5,"Death, like ocean waves, surrounded me, and I was almost swallowed by its flooding waters."
2 Samuel,22,6,"Ropes from the world of the dead had coiled around me, and death had set a trap in my path."
2 Samuel,22,7,"I was in terrible trouble when I called out to you, but from your temple you heard me and answered my prayer."
2 Samuel,22,8,Earth shook and shivered! The columns supporting the sky rocked back and forth. You were angry
2 Samuel,22,9,and breathed out smoke. Scorching heat and fiery flames spewed from your mouth.
2 Samuel,22,10,"You opened the heavens like curtains, and you came down with storm clouds under your feet."
2 Samuel,22,11,You rode on the backs of flying creatures. You appeared with the wind as wings.
2 Samuel,22,12,"Darkness was your tent! Thunderclouds filled the sky, hiding you from sight."
2 Samuel,22,13,Fiery coals lit up the sky in front of you.
2 Samuel,22,14," LORD Most High, your voice thundered from the heavens."
2 Samuel,22,15,You scattered your enemies with arrows of lightning.
2 Samuel,22,16,"You roared at the sea, and its deepest channels could be seen. You snorted, and the earth shook to its foundations."
2 Samuel,22,17,"You reached down from heaven, and you lifted me from deep in the ocean."
2 Samuel,22,18,You rescued me from enemies who were hateful and too powerful for me.
2 Samuel,22,19,"On the day disaster struck, they came and attacked, but you defended me."
2 Samuel,22,20,"When I was fenced in, you freed and rescued me because you love me."
2 Samuel,22,21,"You are good to me, LORD, because I do right, and you reward me because I am innocent."
2 Samuel,22,22,I do what you want and never turn to do evil.
2 Samuel,22,23,I keep your laws in mind and never turn away from your teachings.
2 Samuel,22,24,I obey you completely and guard against sin.
2 Samuel,22,25,You have been good to me because I do right; you have rewarded me for being innocent by your standards.
2 Samuel,22,26,"You are always loyal to your loyal people, and you are faithful to the faithful."
2 Samuel,22,27,"With all who are sincere you are sincere, but you treat the unfaithful as their deeds deserve."
2 Samuel,22,28,"You rescue the humble, but you look for ways to put down the proud."
2 Samuel,22,29,"Our LORD and God, you are my lamp. You turn darkness to light."
2 Samuel,22,30,You help me defeat armies and capture cities.
2 Samuel,22,31,"Your way is perfect, LORD, and your word is correct. You are a shield for those who run to you for help."
2 Samuel,22,32,You alone are God! Only you are a mighty rock.
2 Samuel,22,33,"You are my strong fortress, and you set me free."
2 Samuel,22,34,"You make my feet run as fast as those of a deer, and you help me stand on the mountains."
2 Samuel,22,35,You teach my hands to fight and my arms to use a bow of bronze.
2 Samuel,22,36,"You alone are my shield, and by coming to help me, you have made me famous."
2 Samuel,22,37,"You clear the way for me, and now I won't stumble."
2 Samuel,22,38,I kept chasing my enemies until I caught them and destroyed them.
2 Samuel,22,39,"I destroyed them! I stuck my sword through my enemies, and they were crushed under my feet."
2 Samuel,22,40,You helped me win victories and forced my attackers to fall victim to me.
2 Samuel,22,41,"You made my enemies run, and I killed them."
2 Samuel,22,42,"They cried out for help, but no one saved them; they called out to you, but there was no answer."
2 Samuel,22,43,"I ground them to dust, and I squashed them like mud in the streets."
2 Samuel,22,44,"You rescued me from my stubborn people and made me the leader of foreign nations, who are now my slaves."
2 Samuel,22,45,They obey and come crawling.
2 Samuel,22,46,They have lost all courage and from their fortresses they come trembling.
2 Samuel,22,47,You are the living LORD! I will praise you! You are a mighty rock. I will honour you for keeping me safe.
2 Samuel,22,48,"You took revenge for me, and you put nations in my power."
2 Samuel,22,49,"You protected me from violent enemies, and you made me much greater than all of them."
2 Samuel,22,50,"I will praise you, LORD, and I will honour you among the nations."
2 Samuel,22,51,You give glorious victories to your chosen king. Your faithful love for David and for his descendants will never end.
2 Samuel,23,1,"These are the last words of David the son of Jesse. The God of Jacob chose David and made him a great king. The Mighty God of Israel loved him. When God told him to speak, David said:"
2 Samuel,23,2,The Spirit of the LORD has told me what to say.
2 Samuel,23,3,"Our Mighty Rock, the God of Jacob, told me, “A ruler who obeys God and does right"
2 Samuel,23,4,"is like the sunrise on a cloudless day, or like rain that sparkles on the grass.”"
2 Samuel,23,5,"I have ruled this way, and God will never break his promise to me. God's promise is complete and unchanging; he will always help me and give me what I hope for."
2 Samuel,23,6,"But evil people are pulled up like thorn bushes. They are not dug up by hand,"
2 Samuel,23,7,but with a sharp spear and are burnt on the spot.
2 Samuel,23,8,"These are the names of David's warriors: Ishbosheth the son of Hachmon was the leader of the Three Warriors. In one battle, he killed eight hundred men with his spear."
