Leviticus,23,2,to say to the community of Israel: I have chosen certain times for you to come together and worship me.
Leviticus,23,3,"You have six days when you can do your work, but the seventh day of each week is holy because it belongs to me. No matter where you live, you must rest on the Sabbath and come together for worship. This law will never change."
Leviticus,24,1,The LORD told Moses
Leviticus,24,2,"to say to the community of Israel: You must supply the purest olive oil for the lamps in the sacred tent, so they will keep burning."
Leviticus,25,1,"When Moses was on Mount Sinai, the LORD told him"
Leviticus,25,2,"to say to the community of Israel: After you enter the land that I am giving you, it must be allowed to rest one year out of every seven."
Leviticus,25,3,"You may raise grain and grapes for six years,"
Leviticus,25,4,"but the seventh year you must let your fields and vineyards rest in honour of me, your LORD."
Leviticus,25,5,"This is to be a time of complete rest for your fields and vineyards, so don't harvest anything they produce."
Leviticus,26,1,I am the LORD your God! So don't make or worship any sort of idols or images.
Leviticus,26,2,"Respect the Sabbath and honour the place where I am worshipped, because I am the LORD."
Leviticus,26,3,"Faithfully obey my laws,"
Leviticus,26,4,and I will send rain to make your crops grow and your trees produce fruit.
Leviticus,26,5,"Your harvest of grain and grapes will be so abundant, that you won't know what to do with it all. You will eat and be satisfied, and you will live in safety."
Leviticus,26,6,"I will bless your country with peace, and you will rest without fear. I will wipe out the dangerous animals and protect you from enemy attacks."
Leviticus,26,7,"You will chase and destroy your enemies,"
Leviticus,26,8,"even if there are only five of you and a hundred of them, or only a hundred of you and ten thousand of them."
Leviticus,26,9,"I will treat you with such kindness that your nation will grow strong, and I will also keep my promises to you."
Leviticus,26,10,Your barns will overflow with grain each year.
Leviticus,26,11,I will live among you and never again look on you with disgust.
Leviticus,26,12,"I will walk with you—I will be your God, and you will be my people."
Leviticus,26,13,"I am the LORD your God, and I rescued you from Egypt, so that you would never again be slaves. I have set you free; now walk with your heads held high."
Leviticus,27,1,The LORD told Moses
Leviticus,27,2,"to say to the community of Israel: If you ever want to free someone who has been promised to me,"
