Ezekiel,31,1,"On the first day of the third month of the eleventh year of our exile, the LORD spoke to me."
Ezekiel,31,2,"“Mortal man,” he said, “say to the king of Egypt and all his people: How powerful you are! What can I compare you to?"
Ezekiel,31,3,"You are like a cedar in Lebanon, With beautiful, shady branches, A tree so tall it reaches the clouds."
Ezekiel,31,4,"There was water to make it grow, And underground rivers to feed it. They watered the place where the tree was growing And sent streams to all the trees of the forest."
Ezekiel,31,5,"Because it was well watered, It grew taller than other trees. Its branches grew thick and long."
Ezekiel,31,6,Every kind of bird built nests in its branches; The wild animals bore their young in its shelter; The nations of the world rested in its shade.
Ezekiel,31,7,"How beautiful the tree was — So tall, with such long branches. Its roots reached down to the deep-flowing streams."
Ezekiel,31,8," No cedar in God's garden could compare with it. No fir tree ever had such branches, And no plane tree such boughs. No tree in God's own garden was so beautiful."
Ezekiel,31,9,"I made it beautiful, with spreading branches. It was the envy of every tree in Eden, the garden of God."
Ezekiel,31,10,"“Now then, I, the Sovereign LORD , will tell you what is going to happen to that tree that grew until it reached the clouds. As it grew taller it grew proud;"
Ezekiel,31,11,so I have rejected it and will let a foreign ruler have it. He will give that tree what it deserves for its wickedness.
Ezekiel,31,12,Ruthless foreigners will cut it down and leave it. Its branches and broken boughs will fall on every mountain and valley in the country. All the nations that have been living in its shade will go away.
Ezekiel,31,13,"The birds will come and perch on the fallen tree, and the wild animals will walk over its branches."
Ezekiel,31,14,"And so from now on, no tree, no matter how well watered it is, will grow as tall as that again or push its top through the clouds and reach such a height. All of them are doomed to die like mortals, doomed to join those who go down to the world of the dead.”"
Ezekiel,31,15,"This is what the Sovereign LORD says: “On the day when the tree goes to the world of the dead, I will make the underground waters cover it as a sign of mourning. I will hold back the rivers and not let the many streams flow out. Because the tree has died, I will bring darkness over the Lebanon Mountains and make all the trees of the forest wither."
Ezekiel,31,16,"When I send it down to the world of the dead, the noise of its downfall will shake the nations. All the trees of Eden and all the choice, well-watered trees of Lebanon who have gone to the world below will be pleased at its downfall."
Ezekiel,31,17,They will go with it to the world of the dead to join those that have already fallen. And all who live under its shadow will be scattered among the nations.
Ezekiel,31,18,"“The tree is the king of Egypt and all his people. Not even the trees in Eden were so tall and impressive. But now, like the trees of Eden, it will go down to the world of the dead and join the ungodly and those killed in battle. I have spoken,” says the Sovereign LORD."
Ezekiel,32,1,"On the first day of the twelfth month of the twelfth year of our exile, the LORD spoke to me."
Ezekiel,32,2,"“Mortal man,” he said, “give a solemn warning to the king of Egypt. Give him this message from me: you act like a lion among the nations, but you are more like a crocodile splashing through a river. You muddy the water with your feet and pollute the rivers."
Ezekiel,32,3,"When many nations gather, I will catch you in my net and let them drag the net ashore."
Ezekiel,32,4,I will throw you out on the ground and bring all the birds and animals of the world to feed on you.
Ezekiel,32,5,I will cover mountains and valleys with your rotting corpse.
Ezekiel,32,6,I will pour out your blood until it spreads over the mountains and fills the streams.
Ezekiel,32,7,"When I destroy you, I will cover the sky and blot out the stars. The sun will hide behind the clouds, and the moon will give no light."
Ezekiel,32,8,"I will put out all the lights of heaven and plunge your world into darkness. I, the Sovereign LORD , have spoken."
Ezekiel,32,9,“Many nations will be troubled when I spread the news of your destruction through countries you never heard of.
Ezekiel,32,10,"What I do to you will shock many nations. When I swing my sword, kings will shudder with fright. On the day you fall, all of them will tremble in fear for their own lives.”"
Ezekiel,32,11,"The Sovereign LORD says to the king of Egypt, “You will face the sword of the king of Babylonia."
Ezekiel,32,12,I will let soldiers from cruel nations draw their swords and kill all your people. All your people and everything else that you are proud of will be destroyed.
Ezekiel,32,13,I will slaughter your cattle at every water hole. There will be no people or cattle to muddy the water any more.
Ezekiel,32,14,"I will let your waters settle and become clear and let your rivers run calm. I, the Sovereign LORD , have spoken."
Ezekiel,32,15,"When I make Egypt a desolate waste and destroy all who live there, they will know that I am the LORD."
Ezekiel,32,16,"This solemn warning will become a funeral song. The women of the nations will sing it to mourn for Egypt and all its people. I, the Sovereign LORD , have spoken.”"
Ezekiel,32,17,"On the fifteenth day of the first month of the twelfth year of our exile, the LORD spoke to me."
Ezekiel,32,18,"“Mortal man,” he said, “mourn for all the many people of Egypt. Send them down with the other powerful nations to the world of the dead."
Ezekiel,32,19,Say to them: “Do you think you are more beautiful than anyone else? You will go down to the world of the dead and lie there among the ungodly.
Ezekiel,32,20,“The people of Egypt will fall with those who are killed in battle. A sword is ready to kill them all.
Ezekiel,32,21,"The greatest heroes and those who fought on the Egyptian side welcome the Egyptians to the world of the dead. They shout: ‘The ungodly who were killed in battle have come down here, and here they lie!’"
Ezekiel,32,22,"“Assyria is there, with the graves of her soldiers all around. They were all killed in battle,"
Ezekiel,32,23,"and their graves are in the deepest parts of the world of the dead. All her soldiers fell in battle, and their graves surround her tomb. Yet once they terrified the land of the living."
Ezekiel,32,24,"“Elam is there, with the graves of her soldiers all around. They were all killed in battle, and they went down, uncircumcised, to the world of the dead. In life they spread terror, but now they lie dead and disgraced."
Ezekiel,32,25,"Elam lies down among those killed in battle, and the graves of her soldiers are all around her. They are all uncircumcised, all killed in battle. In life they spread terror, but now they lie dead and disgraced, sharing the fate of those killed in battle."
Ezekiel,32,26,"“Meshech and Tubal are there, with the graves of their soldiers all around. They are all uncircumcised, all killed in battle. Yet once they terrified the living."
Ezekiel,32,27,"They were not given honourable burial like the heroes of ancient times, who went fully armed to the world of the dead, their swords placed under their heads and their shields over their bodies. These heroes were once powerful enough to terrify the living."
Ezekiel,32,28,“That is how the Egyptians will lie crushed among the uncircumcised who were killed in battle.
Ezekiel,32,29,"“Edom is there with her kings and rulers. They were powerful soldiers, but now they lie in the world of the dead with the uncircumcised who were killed in battle."
Ezekiel,32,30,"“All the princes of the north are there, and so are the Sidonians. Their power once spread terror, but now they go down in disgrace with those killed in battle and are laid to rest, uncircumcised. They share the disgrace of those who go down to the world of the dead."
Ezekiel,32,31,"“The sight of all these who were killed in battle will be a comfort to the king of Egypt and his army,” says the Sovereign LORD."
Ezekiel,32,32,"“I made the king of Egypt terrorize the living, but he and all his army will be killed and laid to rest with all the uncircumcised who die in battle.” The Sovereign LORD has spoken."
Ezekiel,33,1,The LORD spoke to me.
Ezekiel,33,2,"“Mortal man,” he said, “tell your people what happens when I bring war to a land. The people of that country choose one of their number to be a watchman."
Ezekiel,33,3,"When he sees the enemy approaching, he sounds the alarm to warn everyone."
Ezekiel,33,4,"If someone hears it but pays no attention and the enemy comes and kills him, then he is to blame for his own death."
Ezekiel,33,5,"His death is his own fault, because he paid no attention to the warning. If he had paid attention, he could have escaped."
Ezekiel,33,6,"If, however, the watchman sees the enemy coming and does not sound the alarm, the enemy will come and kill those sinners, but I will hold the watchman responsible for their death."
Ezekiel,33,7,"“Now, mortal man, I am making you a watchman for the nation of Israel. You must pass on to them the warnings I give you."
Ezekiel,33,8,"If I announce that an evil person is going to die but you do not warn him to change his ways so that he can save his life, then he will die, still a sinner, and I will hold you responsible for his death."
Ezekiel,33,9,"If you do warn an evil person and he doesn't stop sinning, he will die, still a sinner, but your life will be spared.”"
Ezekiel,33,10,"The LORD spoke to me. “Mortal man,” he said, “repeat to the Israelites what they are saying: ‘We are burdened with our sins and the wrongs we have done. We are wasting away. How can we live?’"
Ezekiel,33,11,"Tell them that as surely as I, the Sovereign LORD , am the living God, I do not enjoy seeing sinners die. I would rather see them stop sinning and live. Israel, stop the evil you are doing. Why do you want to die?"
Ezekiel,33,12,"“Now, mortal man, tell the Israelites that when someone good sins, the good he has done will not save him. If an evil person stops doing evil, he won't be punished, and if a good person starts sinning, his life will not be spared."
Ezekiel,33,13,"I may promise life to someone good, but if he starts thinking that his past goodness is enough and begins to sin, I will not remember any of the good he did. He will die because of his sins."
Ezekiel,33,14,"I may warn someone evil that he is going to die, but if he stops sinning and does what is right and good —"
Ezekiel,33,15,"for example, if he returns the security he took for a loan or gives back what he stole — if he stops sinning and follows the laws that give life, he will not die, but live."
Ezekiel,33,16,"I will forgive the sins he has committed, and he will live because he has done what is right and good."
Ezekiel,33,17,"“And your people say that what I do isn't right! No, it's their way that isn't right."
Ezekiel,33,18,"When someone righteous stops doing good and starts doing evil, he will die for it."
Ezekiel,33,19,"When someone evil gives up sinning and does what is right and good, he has saved his life."
Ezekiel,33,20,"But Israel, you say that what I do isn't right. I am going to judge you by what you do.”"
Ezekiel,33,21," On the fifth day of the tenth month of the twelfth year of our exile, someone who had escaped from Jerusalem came and told me that the city had fallen."
Ezekiel,33,22,"The evening before he came, I had felt the powerful presence of the LORD . When the man arrived the next morning, the LORD gave me back the power of speech."
Ezekiel,33,23,The LORD spoke to me.
Ezekiel,33,24,"“Mortal man,” he said, “the people who are living in the ruined cities of the land of Israel are saying: ‘Abraham was only one man, and he was given the whole land. There are many of us, so now the land is ours.’"
Ezekiel,33,25,"“Tell them what I, the Sovereign LORD , am saying: You eat meat with the blood still in it. You worship idols. You commit murder. What makes you think that the land belongs to you?"
Ezekiel,33,26,You rely on your swords. Your actions are disgusting. Everyone commits adultery. What makes you think that the land is yours?
Ezekiel,33,27,"“Tell them that I, the Sovereign LORD , warn them that as surely as I am the living God, the people who live in the ruined cities will be killed. Those living in the country will be eaten by wild animals. Those hiding in the mountains and in caves will die of disease."
Ezekiel,33,28,"I will make the country a desolate waste, and the power they were so proud of will come to an end. The mountains of Israel will be so wild that no one will be able to travel through them."
Ezekiel,33,29,"When I punish the people for their sins and make the country a waste, then they will know that I am the LORD .”"
Ezekiel,33,30,"The LORD said, “Mortal man, your people are talking about you when they meet by the city walls or in the doorways of their houses. They say to one another, ‘Let's go and hear what word has come from the LORD now.’"
Ezekiel,33,31,"So my people crowd in to hear what you have to say, but they don't do what you tell them to do. Loving words are on their lips, but they continue their greedy ways."
Ezekiel,33,32,To them you are nothing more than an entertainer singing love songs or playing a harp. They listen to all your words and don't obey a single one of them.
Ezekiel,33,33,But when all your words come true — and they will come true — then they will know that a prophet has been among them.”
Ezekiel,34,1,The LORD spoke to me.
Ezekiel,34,2,"“Mortal man,” he said, “denounce the rulers of Israel. Prophesy to them, and tell them what I, the Sovereign LORD , say to them: you are doomed, you shepherds of Israel! You take care of yourselves, but never tend the sheep."
Ezekiel,34,3,"You drink the milk, wear clothes made from the wool, and kill and eat the finest sheep. But you never tend the sheep."
Ezekiel,34,4,"You have not taken care of the weak ones, healed those that are sick, bandaged those that are hurt, brought back those that wandered off, or looked for those that were lost. Instead, you treated them cruelly."
Ezekiel,34,5,"Because the sheep had no shepherd, they were scattered, and wild animals killed and ate them."
Ezekiel,34,6,"So my sheep wandered over the high hills and the mountains. They were scattered over the face of the earth, and no one looked for them or tried to find them."
Ezekiel,34,7,"“Now, you shepherds, listen to what I, the LORD , am telling you."
Ezekiel,34,8,"As surely as I am the living God, you had better listen to me. My sheep have been attacked by wild animals that killed and ate them because there was no shepherd. My shepherds did not try to find the sheep. They were taking care of themselves and not the sheep."
Ezekiel,34,9,"So listen to me, you shepherds."
Ezekiel,34,10,"I, the Sovereign LORD , declare that I am your enemy. I will take my sheep away from you and never again let you be their shepherds; never again will I let you take care only of yourselves. I will rescue my sheep from you and not let you eat them."
Ezekiel,34,11,"“I, the Sovereign LORD , tell you that I myself will look for my sheep and take care of them"
Ezekiel,34,12,"in the same way as shepherds take care of their sheep that were scattered and are brought together again. I will bring them back from all the places where they were scattered on that dark, disastrous day."
Ezekiel,34,13,"I will take them out of foreign countries, gather them together, and bring them back to their own land. I will lead them back to the mountains and the streams of Israel and will feed them in pleasant pastures."
Ezekiel,34,14,I will let them graze in safety in the mountain meadows and the valleys and in all the green pastures of the land of Israel.
Ezekiel,34,15,"I myself will be the shepherd of my sheep, and I will find them a place to rest. I, the Sovereign LORD , have spoken."
Ezekiel,34,16,"“I will look for those that are lost, bring back those that wander off, bandage those that are hurt, and heal those that are sick; but those that are fat and strong I will destroy, because I am a shepherd who does what is right."
Ezekiel,34,17,"“Now then, my flock, I, the Sovereign LORD , tell you that I will judge each of you and separate the good from the bad, the sheep from the goats."
Ezekiel,34,18,Some of you are not satisfied with eating the best grass; you even trample down what you don't eat! You drink the clear water and muddy what you don't drink!
Ezekiel,34,19,My other sheep have to eat the grass you trample down and drink the water you muddy.
Ezekiel,34,20,"“So now, I, the Sovereign LORD , tell you that I will judge between you strong sheep and the weak sheep."
Ezekiel,34,21,You pushed the sick ones aside and butted them away from the flock.
Ezekiel,34,22,But I will rescue my sheep and not let them be ill-treated any more. I will judge each of my sheep and separate the good from the bad.
Ezekiel,34,23,"I will give them a king like my servant David to be their one shepherd, and he will take care of them."
Ezekiel,34,24,"I, the LORD , will be their God, and a king like my servant David will be their ruler. I have spoken."
Ezekiel,34,25,"I will make a covenant with them that guarantees their security. I will get rid of all the dangerous animals in the land, so that my sheep can live safely in the fields and sleep in the forests."
Ezekiel,34,26,“I will bless them and let them live round my sacred hill. There I will bless them with showers of rain when they need it.
Ezekiel,34,27,"The trees will bear fruit, the fields will produce crops, and everyone will live in safety on his own land. When I break my people's chains and set them free from those who made them slaves, then they will know that I am the LORD."
Ezekiel,34,28,"The heathen nations will not plunder them any more, and the wild animals will not kill and eat them. They will live in safety, and no one will terrify them."
Ezekiel,34,29,I will give them fertile fields and put an end to hunger in the land. The other nations will not sneer at them any more.
Ezekiel,34,30,"Everyone will know that I protect Israel and that they are my people. I, the Sovereign LORD , have spoken."
Ezekiel,34,31,"“You, my sheep, the flock that I feed, are my people, and I am your God,” says the Sovereign LORD."
Ezekiel,35,1, The LORD spoke to me.
Ezekiel,35,2,"“Mortal man,” he said, “denounce the country of Edom."
Ezekiel,35,3,"Tell the people what I, the Sovereign LORD , am saying: “I am your enemy, mountains of Edom! I will make you a desolate waste."
Ezekiel,35,4,I will leave your cities in ruins And your land desolate; Then you will know that I am the LORD.
Ezekiel,35,5,"“You were Israel's constant enemy and let her people be slaughtered in the time of her disaster, the time of final punishment for her sins."
Ezekiel,35,6,"So then — as surely as I, the Sovereign LORD , am the living God — death is your fate, and you cannot escape it. You are guilty of murder, and murder will follow you."
Ezekiel,35,7,I will make the hill country of Edom a waste and kill everyone who travels through it.
Ezekiel,35,8,"I will cover the mountains with corpses, and the bodies of those who are killed in battle will cover the hills and valleys."
Ezekiel,35,9,"I will make you desolate for ever, and no one will live in your cities again. Then you will know that I am the LORD."
Ezekiel,35,10,"“You said that the two nations, Judah and Israel, together with their lands, belonged to you and that you would possess them, even though I, the LORD , was their God."
Ezekiel,35,11,"So then, as surely as I, the Sovereign LORD , am the living God, I will pay you back for your anger, your jealousy, and your hatred towards my people. They will know that I am punishing you for what you did to them."
Ezekiel,35,12,"Then you will know that I, the LORD , heard you say with contempt that the mountains of Israel were desolate and that they were yours to devour."
Ezekiel,35,13,"I have heard the wild, boastful way you have talked against me.”"
Ezekiel,35,14,"The Sovereign LORD says, “I will make you so desolate that the whole world will rejoice at your downfall,"
Ezekiel,35,15,"just as you rejoiced at the devastation of Israel, my own possession. The mountains of Seir, yes, all the land of Edom, will be desolate. Then everyone will know that I am the LORD .”"
Ezekiel,36,1,"The LORD said, “Mortal man, speak to the mountains of Israel and tell them to listen to the message which I,"
Ezekiel,36,2,"the Sovereign LORD , have for them: Israel's enemies gloated and said, ‘Now those ancient hills are ours!’"
Ezekiel,36,3,"“Prophesy, then, and announce what I, the Sovereign LORD , am saying. When the neighbouring nations captured and plundered the mountains of Israel, all of them insulted Israel."
Ezekiel,36,4,"So now listen to what I, the Sovereign LORD , say to you mountains and hills, to you brooks and valleys, to you places that were left in ruins, and to you deserted cities which were plundered and mocked by all the surrounding nations."
Ezekiel,36,5,"“I, the Sovereign LORD , have spoken out in the heat of my anger against the surrounding nations, and especially against Edom. With glee and contempt, they captured my land and took possession of its pastures."
Ezekiel,36,6,"“So prophesy to the land of Israel; tell the mountains, hills, brooks, and valleys what I, the Sovereign LORD , am saying in jealous anger because of the way the nations have insulted and humiliated them."
Ezekiel,36,7,"I, the Sovereign LORD , solemnly promise that the surrounding nations will be humiliated."
Ezekiel,36,8,"But on the mountains of Israel the trees will again grow leaves and bear fruit for you, my people Israel. You are going to come home soon."
Ezekiel,36,9,"I am on your side, and I will make sure that your land is ploughed again and that seeds are sown there."
Ezekiel,36,10,I will make your population grow. You will live in the cities and rebuild everything that was left in ruins.
Ezekiel,36,11,"I will make people and cattle increase in number. There will be more of you than ever before, and you will have many children. I will let you live there as you used to live, and I will make you more prosperous than ever. Then you will know that I am the LORD."
Ezekiel,36,12,"I will bring you, my people Israel, back to live again in the land. It will be your own land, and it will never again let your children starve."
Ezekiel,36,13,"“I, the Sovereign LORD , say: it is true that people say that the land eats people, and that it robs the nation of its children."
Ezekiel,36,14,"But from now on it will no longer eat people and rob you of your children. I, the Sovereign LORD , have spoken."
Ezekiel,36,15,"The land will no longer have to listen to the nations mocking it or see the peoples sneer at it. The land will no longer rob the nation of its children. I, the Sovereign LORD , have spoken.”"
Ezekiel,36,16,The LORD spoke to me.
Ezekiel,36,17,"“Mortal man,” he said, “when the Israelites were living in their land, they defiled it by the way they lived and acted. I regarded their behaviour as being as ritually unclean as a woman is during her monthly period."
Ezekiel,36,18,I let them feel the force of my anger because of the murders they had committed in the land and because of the idols by which they had defiled it.
Ezekiel,36,19,"I condemned them for the way they lived and acted, and I scattered them through foreign countries."
Ezekiel,36,20,"Wherever they went, they brought disgrace on my holy name, because people would say, ‘These are the people of the LORD , but they had to leave his land.’"
Ezekiel,36,21,"That made me concerned for my holy name, since the Israelites brought disgrace on it everywhere they went."
Ezekiel,36,22,"“Now then, give the Israelites the message that I, the Sovereign LORD , have for them: what I am going to do is not for the sake of you Israelites, but for the sake of my holy name, which you have disgraced in every country where you have gone."
Ezekiel,36,23,"When I demonstrate to the nations the holiness of my great name — the name you disgraced among them — then they will know that I am the LORD . I, the Sovereign LORD , have spoken. I will use you to show the nations that I am holy."
Ezekiel,36,24,I will take you from every nation and country and bring you back to your own land.
Ezekiel,36,25,I will sprinkle clean water on you and make you clean from all your idols and everything else that has defiled you.
Ezekiel,36,26,I will give you a new heart and a new mind. I will take away your stubborn heart of stone and give you an obedient heart.
Ezekiel,36,27,I will put my spirit in you and I will see to it that you follow my laws and keep all the commands I have given you.
Ezekiel,36,28,"Then you will live in the land I gave your ancestors. You will be my people, and I will be your God."
Ezekiel,36,29,"I will save you from everything that defiles you. I will command the corn to be plentiful, so that you will not have any more famines."
Ezekiel,36,30,"I will increase the yield of your fruit trees and your fields, so that there will be no more famines to disgrace you among the nations."
Ezekiel,36,31,"You will remember your evil conduct and the wrongs that you committed, and you will be disgusted with yourselves because of your sins and your iniquities."
Ezekiel,36,32,"Israel, I want you to know that I am not doing all this for your sake. I want you to feel the shame and disgrace of what you are doing. I, the Sovereign LORD , have spoken.”"
