Ezekiel,1,1," On the fifth day of the fourth month of the thirtieth year, I, Ezekiel the priest, son of Buzi, was living with the Jewish exiles by the River Chebar in Babylonia. The sky opened, and I saw a vision of God. ("
Ezekiel,1,2,It was the fifth year since King Jehoiachin had been taken into exile.)
Ezekiel,1,3,"There in Babylonia beside the River Chebar, I heard the LORD speak to me and I felt his power."
Ezekiel,1,4,"I looked up and saw a storm coming from the north. Lightning was flashing from a huge cloud, and the sky round it was glowing. Where the lightning was flashing, something shone like bronze."
Ezekiel,1,5,"At the centre of the storm, I saw what looked like four living creatures in human form,"
Ezekiel,1,6,but each of them had four faces and four wings.
Ezekiel,1,7,"Their legs were straight, and they had hoofs like those of a bull. They shone like polished bronze."
Ezekiel,1,8,"In addition to their four faces and four wings, they each had four human hands, one under each wing."
Ezekiel,1,9,"Two wings of each creature were spread out so that the creatures formed a square with their wing tips touching. When they moved, they moved as a group without turning their bodies."
Ezekiel,1,10," Each living creature had four different faces: a human face in front, a lion's face at the right, a bull's face at the left, and an eagle's face at the back."
Ezekiel,1,11,"Two wings of each creature were raised so that they touched the tips of the wings of the creatures next to it, and their other two wings were folded against their bodies."
Ezekiel,1,12,"Each creature faced all four directions, and so the group could go wherever they wished, without having to turn."
Ezekiel,1,13,"Among the creatures there was something that looked like a blazing torch, constantly moving. The fire would blaze up and shoot out flashes of lightning."
Ezekiel,1,14,The creatures themselves darted to and fro with the speed of lightning.
Ezekiel,1,15," As I was looking at the four creatures, I saw four wheels touching the ground, one beside each of them."
Ezekiel,1,16,"All four wheels were alike; each one shone like a precious stone, and each had another wheel intersecting it at right angles,"
Ezekiel,1,17,so that the wheels could move in any of the four directions.
Ezekiel,1,18,The rims of the wheels were covered with eyes.
Ezekiel,1,19,"Whenever the creatures moved, the wheels moved with them, and if the creatures rose up from the earth, so did the wheels."
Ezekiel,1,20,"The creatures went wherever they wished, and the wheels did exactly what the creatures did, because the creatures controlled them."
Ezekiel,1,21,"So every time the creatures moved or stopped or rose in the air, the wheels did exactly the same."
Ezekiel,1,22, Above the heads of the creatures there was something that looked like a dome made of dazzling crystal.
Ezekiel,1,23,"There under the dome stood the creatures, each stretching out two wings towards the ones next to it and covering its body with the other two wings."
Ezekiel,1,24,"I heard the noise their wings made in flight; it sounded like the roar of the sea, like the noise of a huge army, like the voice of Almighty God. When they stopped flying, they folded their wings,"
Ezekiel,1,25,but there was still a sound coming from above the dome over their heads.
Ezekiel,1,26," Above the dome there was something that looked like a throne made of sapphire, and sitting on the throne was a figure that looked like a human being."
Ezekiel,1,27,The figure seemed to be shining like bronze in the middle of a fire. It shone all over with a bright light
Ezekiel,1,28,"that had in it all the colours of the rainbow. This was the dazzling light that shows the presence of the LORD. When I saw this, I fell face downwards on the ground. Then I heard a voice"
Ezekiel,2,1,"saying, “Mortal man, stand up. I want to talk to you.”"
Ezekiel,2,2,"While the voice was speaking, God's Spirit entered me and raised me to my feet, and I heard the voice continue,"
Ezekiel,2,3,"“Mortal man, I am sending you to the people of Israel. They have rebelled and turned against me and are still rebels, just as their ancestors were."
Ezekiel,2,4,"They are stubborn and do not respect me, so I am sending you to tell them what I, the Sovereign LORD , am saying to them."
Ezekiel,2,5,"Whether those rebels listen to you or not, they will know that a prophet has been among them."
Ezekiel,2,6,"“But you, mortal man, must not be afraid of them or of anything they say. They will defy and despise you; it will be like living among scorpions. Still, don't be afraid of those rebels or of anything they say."
Ezekiel,2,7,"You will tell them whatever I tell you to say, whether they listen or not. Remember what rebels they are."
Ezekiel,2,8,"“Mortal man, listen to what I tell you. Don't be rebellious like them. Open your mouth and eat what I am going to give you.”"
Ezekiel,2,9,"I saw a hand stretched out towards me, and it was holding a scroll."
Ezekiel,2,10,"The hand unrolled the scroll, and I saw that there was writing on both sides — cries of grief were written there, and wails and groans."
Ezekiel,3,1," God said, “Mortal man, eat this scroll; then go and speak to the people of Israel.”"
Ezekiel,3,2,"So I opened my mouth, and he gave me the scroll to eat."
Ezekiel,3,3,"He said, “Mortal man, eat this scroll that I give you; fill your stomach with it.” I ate it, and it tasted as sweet as honey."
Ezekiel,3,4,"Then God said, “Mortal man, go to the people of Israel and say to them whatever I tell you to say."
Ezekiel,3,5,"I am not sending you to a nation that speaks a difficult foreign language, but to the Israelites."
Ezekiel,3,6,"If I sent you to great nations that spoke difficult languages you didn't understand, they would listen to you."
Ezekiel,3,7,But none of the people of Israel will be willing to listen; they will not even listen to me. All of them are stubborn and defiant.
Ezekiel,3,8,Now I will make you as stubborn and as tough as they are.
Ezekiel,3,9,"I will make you as firm as a rock, as hard as a diamond; don't be afraid of those rebels.”"
Ezekiel,3,10,"God continued, “Mortal man, pay close attention and remember everything I tell you."
Ezekiel,3,11,"Then go to your countrymen who are in exile and tell them what I, the Sovereign LORD , am saying to them, whether they pay attention to you or not.”"
Ezekiel,3,12,"Then God's Spirit lifted me up, and I heard behind me the loud roar of a voice that said, “Praise the glory of the LORD in heaven above!”"
Ezekiel,3,13,"I heard the wings of the creatures beating together in the air, and the noise of the wheels, as loud as an earthquake."
Ezekiel,3,14,"The power of the LORD came on me with great force, and as his Spirit carried me off, I felt bitter and angry."
Ezekiel,3,15,"So I came to Tel Abib beside the River Chebar, where the exiles were living, and for seven days I stayed there, overcome by what I had seen and heard."
Ezekiel,3,16,"After the seven days had passed, the LORD spoke to me."
Ezekiel,3,17,"“Mortal man,” he said, “I am making you a watchman for the nation of Israel. You will pass on to them the warnings I give you."
Ezekiel,3,18,"If I announce that an evil person is going to die but you do not warn him to change his ways so that he can save his life, he will die, still a sinner, and I will hold you responsible for his death."
Ezekiel,3,19,"If you do warn an evil man and he doesn't stop sinning, he will die, still a sinner, but your life will be spared."
Ezekiel,3,20,"“If a truly good person starts doing evil and I put him in a dangerous situation, he will die if you do not warn him. He will die because of his sins — I will not remember the good he did — and I will hold you responsible for his death."
Ezekiel,3,21,"If you do warn a good man not to sin and he listens to you and doesn't sin, he will stay alive, and your life will also be spared.”"
Ezekiel,3,22,"I felt the powerful presence of the LORD and heard him say to me, “Get up and go out into the valley. I will talk to you there.”"
Ezekiel,3,23,"So I went out into the valley, and there I saw the glory of the LORD , just as I had seen it beside the River Chebar. I fell face downwards on the ground,"
Ezekiel,3,24,"but God's Spirit entered me and raised me to my feet. The LORD said to me, “Go home and shut yourself up in the house."
Ezekiel,3,25,"You will be tied with ropes, mortal man, and you will not be able to go out in public."
Ezekiel,3,26,I will paralyse your tongue so that you won't be able to warn these rebellious people.
Ezekiel,3,27,"Then, when I speak to you again and give you back the power of speech, you will tell them what I, the Sovereign LORD , am saying. Some of them will listen, but some will ignore you, for they are a nation of rebels.”"
Ezekiel,4,1,"God said, “Mortal man, get a brick, put it in front of you, and scratch lines on it to represent the city of Jerusalem."
Ezekiel,4,2,"Then, to represent a siege, put trenches, earthworks, camps, and battering rams all round it."
Ezekiel,4,3,"Take an iron pan and set it up like a wall between you and the city. Face the city. It is under siege, and you are the one besieging it. This will be a sign to the nation of Israel."
Ezekiel,5,1,"The LORD said, “Mortal man, take a sharp sword and use it to shave off your beard and all your hair. Then weigh the hair on scales and divide it into three parts."
Ezekiel,5,2,"Burn a third of it in the city when the siege is over. Take another third and chop it up with your sword as you move about outside the city. Scatter the remaining third to the winds, and I will pursue it with my sword."
Ezekiel,5,3,Keep back a few hairs and wrap them in the hem of your clothes.
Ezekiel,5,4,"Then take a few of them out again, throw them in the fire, and let them burn up. From them fire will spread to the whole nation of Israel.”"
Ezekiel,5,5,"The Sovereign LORD said, “Look at Jerusalem. I put her at the centre of the world, with other countries all round her."
Ezekiel,5,6,"But Jerusalem rebelled against my commands and showed that she was more wicked than the other nations, more disobedient than the countries around her. Jerusalem rejected my commands and refused to keep my laws."
Ezekiel,5,7,"Now listen, Jerusalem, to what I, the Sovereign LORD , am saying. By not obeying my laws or keeping my commands, you have caused more trouble than the nations around you. You have followed the customs of other nations."
Ezekiel,5,8,"And so I, the Sovereign LORD , am telling you that I am your enemy. I will pass judgement on you where all the nations can see it."
Ezekiel,5,9,"Because of all the things you do that I hate, I will punish Jerusalem as I have never done before and will never do again."
Ezekiel,5,10,"As a result, parents in Jerusalem will eat their children, and children will eat their parents. I will punish you and scatter in every direction any who are left alive."
Ezekiel,5,11,"“Therefore, as I am the living God — this is the word of the Sovereign LORD — because you defiled my Temple with all the evil, disgusting things you did, I will cut you down without mercy."
Ezekiel,5,12,A third of your people will die from sickness and hunger in the city; a third will be cut down by swords outside the city; and I will scatter the last third to the winds and pursue them with a sword.
Ezekiel,5,13,"“You will feel all the force of my anger and rage until I am satisfied. When all this happens, you will be convinced that I, the LORD , have spoken to you because I am outraged at your unfaithfulness."
Ezekiel,5,14,All those from the nations around you who pass by will sneer at you and keep their distance.
Ezekiel,5,15,"“When I am angry and furious with you and punish you, all the nations around you will be terrified. They will look at you with disgust and will mock you."
Ezekiel,5,16,I will cut off your supply of food and let you starve. You will feel the pains of hunger like sharp arrows sent to destroy you.
Ezekiel,5,17,"I will send hunger and wild animals to kill your children, and will send sickness, violence, and war to kill you. I, the LORD , have spoken.”"
Ezekiel,6,1,The LORD spoke to me.
Ezekiel,6,2,"“Mortal man,” he said, “look towards the mountains of Israel and give them my message."
Ezekiel,6,3,"Tell the mountains of Israel to hear the word of the LORD — to hear what I, the Sovereign LORD , am telling the mountains, the hills, the gorges, and the valleys: I will send a sword to destroy the places where people worship idols."
Ezekiel,6,4,The altars will be torn down and the incense altars broken. All the people there will be killed in front of their idols.
Ezekiel,6,5,I will scatter the corpses of the people of Israel; I will scatter their bones all round the altars.
Ezekiel,6,6,"All the cities of Israel will be destroyed, so that all their altars and their idols will be smashed to pieces, their incense altars will be shattered, and everything they made will disappear."
Ezekiel,6,7,"People will be killed everywhere, and those who survive will acknowledge that I am the LORD."
Ezekiel,6,8,"“I will let some escape the slaughter and be scattered among the nations,"
Ezekiel,6,9,"where they will live in exile. There they will remember me and know that I have punished them and disgraced them, because their faithless hearts deserted me and they preferred idols to me. And they will be disgusted with themselves because of the evil and degrading things they have done."
Ezekiel,6,10,They will know that I am the LORD and that my warnings were not empty threats.”
Ezekiel,6,11,"The Sovereign LORD said, “Wring your hands! Stamp your feet! Cry in sorrow because of all the evil, disgusting things the Israelites have done. They are going to die in war, by famine, and by disease."
Ezekiel,6,12,Those far away will fall ill and die; those near by will be killed in war; those who survive will starve to death. They will feel all the force of my anger.
Ezekiel,6,13,"Corpses will be scattered among the idols and round the altars, scattered on every high hill, on the top of every mountain, under every green tree and every large oak, in every place where they burnt sacrifices to their idols. Then everyone will know that I am the LORD."
Ezekiel,6,14,"Yes, I will stretch out my hand and destroy their country. I will make it a waste from the southern desert to the city of Riblah in the north, not sparing any place where the Israelites live. Then everyone will know that I am the LORD .”"
Ezekiel,7,1,The LORD spoke to me.
Ezekiel,7,2,"“Mortal man,” he said, “this is what I, the Sovereign LORD , am saying to the land of Israel: this is the end for the whole land!"
Ezekiel,7,3,"“Israel, the end has come. You will feel my anger, because I am judging you for what you have done. I will pay you back for all your disgusting conduct."
Ezekiel,7,4,"I will not spare you or show you any mercy. I am going to punish you for the disgusting things you have done, so that you will know that I am the LORD .”"
Ezekiel,7,5,"This is what the Sovereign LORD is saying, “One disaster after another is coming on you."
Ezekiel,7,6,It's all over. This is the end. You are finished.
Ezekiel,7,7,"The end is coming for you people who live in the land. The time is near when there will be no more celebrations at the mountain shrines, only confusion."
Ezekiel,7,8,"“Very soon now you will feel all the force of my anger. I am judging you for what you have done, and I will pay you back for all your disgusting conduct."
Ezekiel,7,9,"I will not spare you or show you any mercy. I am going to punish you for the disgusting things you have done, so that you will know that I am the LORD , and that I am the one who punishes you.”"
Ezekiel,7,10,The day of disaster is coming for Israel. Violence is flourishing. Pride is at its height.
Ezekiel,7,11,"Violence produces more wickedness. Nothing of theirs will remain, nothing of their wealth, their splendour, or their glory."
Ezekiel,7,12,"The time is coming. The day is near when buying and selling will have no more meaning, because God's punishment will fall on everyone alike."
Ezekiel,7,13,"No merchant will live long enough to get back what he has lost, because God's anger is on everyone. Those who are evil cannot survive."
Ezekiel,7,14,"The trumpet sounds, and everyone gets ready. But no one goes off to war, for God's anger will fall on everyone alike."
Ezekiel,7,15,"There is fighting in the streets, and sickness and hunger in the houses. Anyone who is out in the country will die in the fighting, and anyone in the city will be a victim of sickness and hunger."
Ezekiel,7,16,Some will escape to the mountains like doves frightened from the valleys. All of them will moan over their sins.
Ezekiel,7,17,"Everyone's hands will be weak, and their knees will shake."
Ezekiel,7,18,"They will put on sackcloth and they will tremble all over. Their heads will be shaved, and they will all be disgraced."
Ezekiel,7,19,"They will throw their gold and silver away in the streets like refuse, because neither silver nor gold can save them when the LORD pours out his fury. They cannot use it to satisfy their desires or fill their stomachs. Gold and silver led them into sin."
Ezekiel,7,20,"Once they were proud of their beautiful jewels, but they used them to make disgusting idols. That is why the LORD has made their wealth repulsive to them."
Ezekiel,7,21,"“I will let foreigners rob them,” says the LORD , “and lawbreakers will take all their wealth and defile it."
Ezekiel,7,22,"I will not interfere when my treasured Temple is profaned, when robbers break into it and defile it."
Ezekiel,7,23,“Everything is in confusion — the land is full of murders and the cities are full of violence.
Ezekiel,7,24,I will bring the most evil nations here and let them have your homes. Your strongest men will lose their confidence when I let the nations profane the places where you worship.
Ezekiel,7,25,Despair is coming. You will look for peace and never find it.
Ezekiel,7,26,"One disaster will follow another, and a steady stream of bad news will pour in. You will beg the prophets to reveal what they foresee. The priests will have nothing to teach the people, and the elders will have no advice to give."
Ezekiel,7,27,"The king will mourn, the prince will give up hope, and the people will shake with fear. I will punish you for all you have done, and will judge you in the same way as you have judged others. This will show you that I am the LORD .”"
Ezekiel,8,1,"On the fifth day of the sixth month of the sixth year of our exile, the leaders of the exiles from Judah were sitting in my house with me. Suddenly the power of the Sovereign LORD came on me."
Ezekiel,8,2,"I looked up and saw a vision of a fiery human form. From the waist down his body looked like fire, and from the waist up he was shining like polished bronze."
Ezekiel,8,3,"He stretched out what seemed to be a hand and seized me by the hair. Then in this vision God's Spirit lifted me high in the air and took me to Jerusalem. He took me to the inner entrance of the north gate of the Temple, where there was an idol that was an outrage to God."
Ezekiel,8,4," There I saw the dazzling light that shows the presence of Israel's God, just as I had seen it when I was by the River Chebar."
Ezekiel,8,5,"God said to me, “Mortal man, look towards the north.” I looked, and there near the altar by the entrance of the gateway I saw the idol that was an outrage to God."
Ezekiel,8,6,"God said to me, “Mortal man, do you see what is happening? Look at the disgusting things the people of Israel are doing here, driving me farther and farther away from my holy place. You will see even more disgraceful things than this.”"
Ezekiel,8,7,He took me to the entrance of the outer courtyard and showed me a hole in the wall.
Ezekiel,8,8,"He said, “Mortal man, break through the wall here.” I broke through it and found a door."
Ezekiel,8,9,"He said to me, “Go in and look at the evil, disgusting things they are doing there.”"
Ezekiel,8,10,"So I went in and looked. The walls were covered with drawings of snakes and other unclean animals, and of the other things which the Israelites were worshipping."
Ezekiel,8,11,"Seventy Israelite leaders were there, including Jaazaniah son of Shaphan. Each one was holding an incense burner, and smoke was rising from the incense."
Ezekiel,8,12,"God asked me, “Mortal man, do you see what the Israelite leaders are doing in secret? They are all worshipping in a room full of images. Their excuse is: ‘The LORD doesn't see us! He has abandoned the country.’ ”"
Ezekiel,8,13,"Then the LORD said to me, “You are going to see them do even more disgusting things than that.”"
Ezekiel,8,14,So he took me to the north gate of the Temple and showed me women weeping over the death of the god Tammuz.
Ezekiel,8,15,"He asked, “Mortal man, do you see that? You will see even more disgusting things.”"
Ezekiel,8,16,"So he took me to the inner courtyard of the Temple. There near the entrance of the sanctuary, between the altar and the passage, were about 25 men. They had turned their backs to the sanctuary and were bowing low towards the east, worshipping the rising sun."
Ezekiel,8,17,"The LORD said to me, “Mortal man, do you see that? These people of Judah are not satisfied with merely doing all the disgusting things you have seen here and with spreading violence throughout the country. No, they must come and do them here in the Temple itself and make me even more angry. Look how they insult me in the most offensive way possible!"
Ezekiel,8,18,"They will feel all the force of my anger. I will not spare them or show them any mercy. They will shout prayers to me as loud as they can, but I will not listen to them.”"
Ezekiel,9,1,"Then I heard God shout, “Come here, you men who are going to punish the city. Bring your weapons with you.”"
Ezekiel,9,2,"At once six men came from the outer north gate of the Temple, each one carrying a weapon. With them was a man dressed in linen clothes, carrying something to write with. They all came and stood by the bronze altar."
Ezekiel,9,3,"Then the dazzling light of the presence of the God of Israel rose up from the winged creatures, where it had been, and moved to the entrance of the Temple. The LORD called to the man dressed in linen,"
Ezekiel,9,4,“Go through the whole city of Jerusalem and put a mark on the forehead of everyone who is distressed and troubled because of all the disgusting things being done in the city.”
Ezekiel,9,5,"And I heard God say to the other men, “Follow him through the city, and kill. Spare no one; have mercy on no one."
Ezekiel,9,6,"Kill the old men, young men, young women, mothers, and children. But don't touch anyone who has the mark on his forehead. Start here at my Temple.” So they began with the leaders who were standing there at the Temple."
Ezekiel,9,7,"God said to them, “Defile the Temple. Fill its courtyards with corpses. Get to work!” So they began to kill the people in the city."
Ezekiel,9,8,"While the killing was going on, I was there alone. I threw myself face downwards on the ground and shouted, “Sovereign LORD , are you so angry with Jerusalem that you are going to kill everyone left in Israel?”"
Ezekiel,9,9,"God answered, “The people of Israel and Judah are guilty of terrible sins. They have committed murder all over the land and have filled Jerusalem with crime. They say that I, the LORD , have abandoned their country and that I don't see them."
Ezekiel,9,10,But I will not have pity on them; I will do to them what they have done to others.”
Ezekiel,9,11,"Then the man wearing linen clothes returned and reported to the LORD , “I have carried out your orders.”"
Ezekiel,10,1, I looked at the dome over the heads of the living creatures and above them was something that seemed to be a throne made of sapphire.
Ezekiel,10,2,"God said to the man wearing linen clothes, “Go between the wheels under the creatures and fill your hands with burning coals. Then scatter the coals over the city.” I watched him go."
Ezekiel,10,3,"The creatures were standing to the south of the Temple when he went in, and a cloud filled the inner courtyard."
Ezekiel,10,4,"The dazzling light of the LORD 's presence rose up from the creatures and moved to the entrance of the Temple. Then the cloud filled the Temple, and the courtyard was blazing with the light."
Ezekiel,10,5,The noise made by the creatures' wings was heard even in the outer courtyard. It sounded like the voice of Almighty God.
Ezekiel,10,6,"When the LORD commanded the man wearing linen clothes to take some fire from between the wheels that were under the creatures, the man went in and stood by one of the wheels."
Ezekiel,10,7,"One of the creatures put his hand into the fire that was there among them, picked up some coals, and put them in the hands of the man in linen. The man took the coals and left."
Ezekiel,10,8,I saw that each creature had what looked like a human hand under each of its wings.
Ezekiel,11,1,"God's Spirit lifted me up and took me to the east gate of the Temple. There near the gate I saw 25 men, including Jaazaniah son of Azzur and Pelatiah son of Benaiah, two leaders of the nation."
Ezekiel,11,2,"God said to me, “Mortal man, these men make evil plans and give bad advice in this city."
Ezekiel,11,3,"They say, ‘We will soon be building houses again. The city is like a cooking pot, and we are like the meat in it, but at least it protects us from the fire.’"
Ezekiel,11,4,"Now then, denounce them, mortal man.”"
Ezekiel,11,5,"The Spirit of the LORD took control of me, and the LORD told me to give the people this message: “People of Israel, I know what you are saying and what you are planning."
Ezekiel,11,6,You have murdered so many people here in the city that the streets are full of corpses.
