Ezekiel,22,28,"The prophets have hidden these sins like those covering a wall with whitewash. They see false visions and make false predictions. They claim to speak the word of the Sovereign LORD , but I, the LORD , have not spoken to them."
Ezekiel,22,29,The wealthy cheat and rob. They ill-treat the poor and take advantage of foreigners.
Ezekiel,22,30,"I looked for someone who could build a wall, who could stand in the places where the walls have crumbled and defend the land when my anger is about to destroy it, but I could find no one."
Ezekiel,22,31,"So I will turn my anger loose on them, and like a fire I will destroy them for what they have done.” The Sovereign LORD has spoken."
Ezekiel,23,1,The LORD spoke to me.
Ezekiel,23,2,"“Mortal man,” he said, “there were once two sisters."
Ezekiel,23,3,"When they were young, living in Egypt, they lost their virginity and became prostitutes."
Ezekiel,23,4,"The older one was named Oholah (she represents Samaria), and the younger one was named Oholibah (she represents Jerusalem). I married both of them, and they bore me children."
Ezekiel,23,5,"Although she was mine, Oholah continued to be a prostitute and was full of lust for her lovers from Assyria."
Ezekiel,23,6,"They were soldiers in uniforms of purple, noblemen and high-ranking officers; all of them were handsome young cavalry officers."
Ezekiel,23,7,"She was the whore for all the Assyrian officers, and her lust led her to defile herself by worshipping Assyrian idols."
Ezekiel,23,8,"She continued what she had begun as a prostitute in Egypt, where she lost her virginity. From the time she was a young woman, men slept with her and treated her like a prostitute."
Ezekiel,23,9,So I handed her over to her Assyrian lovers whom she wanted so much.
Ezekiel,23,10,"They stripped her naked, seized her sons and daughters, and then killed her with a sword. Women everywhere gossiped about her fate."
Ezekiel,23,11,"“Even though her sister Oholibah saw this, she was wilder and more of a prostitute than Oholah had ever been."
Ezekiel,23,12,"She too was full of lust for the Assyrian noblemen and officers — soldiers in bright uniforms — and for the cavalry officers, all those handsome young men."
Ezekiel,23,13,"I saw that she was completely immoral, that the second sister was as bad as the first."
Ezekiel,24,1,"On the tenth day of the tenth month of the ninth year of our exile, the LORD spoke to me."
Ezekiel,24,2,"“Mortal man,” he said, “write down today's date, because this is the day that the king of Babylonia is beginning the siege of Jerusalem."
Ezekiel,24,3,"Tell my rebellious people this parable that I, the Sovereign LORD , have for them: Set the pot on the fire and fill it up with water."
Ezekiel,24,4,Put in the best pieces of meat — the shoulders and the legs — fill it with choice bony pieces too.
Ezekiel,24,5,Use the meat of the finest sheep; pile the wood under the pot. Let the water boil; boil the bones and the meat.”
Ezekiel,24,6,"This is what the Sovereign LORD is saying: “The city of murderers is doomed! It is like a corroded pot that is never cleaned. Piece after piece of meat is taken out, and not one is left."
Ezekiel,24,7,"There was murder in the city, but the blood was not spilt on the ground where the dust could hide it; it was spilt on a bare rock."
Ezekiel,24,8,"I have left the blood there, where it cannot be hidden, where it demands angry revenge.”"
Ezekiel,24,9,This is what the Sovereign LORD is saying: “The city of murderers is doomed! I myself will pile up the firewood.
Ezekiel,24,10,Bring more wood! Fan the flames! Cook the meat! Boil away the broth! Burn up the bones!
Ezekiel,24,11,"Now set the empty bronze pot on the coals and let it get red-hot. Then the pot will be ritually pure again after the corrosion is burnt off,"
Ezekiel,24,12,although all that corrosion will not disappear in the flames.
Ezekiel,24,13,"Jerusalem, your immoral actions have defiled you. Although I tried to purify you, you remained defiled. You will not be pure again until you have felt the full force of my anger."
Ezekiel,24,14,"I, the Sovereign LORD , have spoken. The time has come for me to act. I will not ignore your sins or show pity or be merciful. You will be punished for what you have done.” The Sovereign LORD has spoken."
Ezekiel,24,15,The LORD spoke to me.
Ezekiel,24,16,"“Mortal man,” he said, “with one blow I am going to take away the person you love most. You are not to complain or cry or shed any tears."
Ezekiel,24,17,Don't let your sobbing be heard. Do not go bareheaded or barefoot as a sign of mourning. Don't cover your face or eat the food that mourners eat.”
Ezekiel,24,18,"Early in the day I was talking with the people. That evening my wife died, and the next day I did as I had been told."
Ezekiel,24,19,"The people asked me, “Why are you acting like this?”"
Ezekiel,24,20,"So I said to them, “The LORD spoke to me and told me"
Ezekiel,24,21,"to give you Israelites this message: you are proud of the strength of the Temple. You like to look at it and to visit it, but the LORD is going to profane it. And the younger members of your families who are left in Jerusalem will be killed in war."
Ezekiel,24,22,Then you will do what I have done. You will not cover your faces or eat the food that mourners eat.
Ezekiel,24,23,"You will not go bareheaded or barefoot or mourn or cry. You will waste away because of your sins, and you will groan to one another."
Ezekiel,24,24,"Then I will be a sign to you; you will do everything I have done. The LORD says that when this happens, you will know that he is the Sovereign LORD .”"
Ezekiel,24,25,"The LORD said, “Now, mortal man, I will take away from them the strong Temple that was their pride and joy, which they liked to look at and to visit. And I will take away their sons and daughters."
Ezekiel,24,26,"On the day that I do this, someone who escapes the destruction will come and tell you about it."
Ezekiel,24,27,"That same day you will get back the power of speech which you had lost, and you will talk with him. In this way you will be a sign to the people, and they will know that I am the LORD .”"
Ezekiel,25,1, The LORD spoke to me.
Ezekiel,25,2,"“Mortal man,” he said, “denounce the country of Ammon."
Ezekiel,25,3,"Tell them to listen to what I, the Sovereign LORD , am saying: you were delighted to see my Temple profaned, to see the land of Israel devastated, to see the people of Judah go into exile."
Ezekiel,25,4,"Because you were glad, I will let the tribes from the eastern desert conquer you. They will set up their camps in your country and settle there. They will eat the fruit and drink the milk that should have been yours."
Ezekiel,25,5,"I will turn the city of Rabbah into a place to keep camels, and the whole country of Ammon into a place to keep sheep, so that you will know that I am the LORD."
Ezekiel,25,6,“This is what the Sovereign LORD is saying: you clapped your hands and jumped for joy. You despised the land of Israel.
Ezekiel,25,7,"Because you did, I will hand you over to other nations who will rob you and plunder you. I will destroy you so completely that you will not be a nation any more or have a country of your own. Then you will know that I am the LORD .”"
Ezekiel,25,8," The Sovereign LORD said, “Because Moab has said that Judah is like all the other nations,"
Ezekiel,25,9,"I will let the cities that defend the border of Moab be attacked, including even the finest cities — Beth Jeshimoth, Baal Meon, and Kiriathaim."
Ezekiel,25,10,"I will let the tribes of the eastern desert conquer Moab, together with Ammon, so that Moab will no longer be a nation."
Ezekiel,25,11,"I will punish Moab, and they will know that I am the LORD .”"
Ezekiel,25,12," The Sovereign LORD said, “The people of Edom took cruel revenge on Judah, and that revenge has brought lasting guilt on Edom."
Ezekiel,25,13,"Now I announce that I will punish Edom and kill every person and animal there. I will make it a waste, from the city of Teman to the city of Dedan, and the people will be killed in battle."
Ezekiel,25,14,"My people Israel will take revenge on Edom for me, and they will make Edom feel my furious anger. Edom will know what it means to be the object of my revenge.” The Sovereign LORD has spoken."
Ezekiel,25,15," The Sovereign LORD said, “The Philistines have taken cruel revenge on their age-long enemies and destroyed them in their hate."
Ezekiel,25,16,And so I am announcing that I will attack the Philistines and wipe them out. I will destroy everyone left living there on the Philistine Plain.
Ezekiel,25,17,I will punish them severely and take full revenge on them. They will feel my anger. Then they will know that I am the LORD .”
Ezekiel,26,1," On the first day of the… month of the eleventh year of our exile, the LORD spoke to me."
Ezekiel,26,2,"“Mortal man,” he said, “this is what the people in the city of Tyre are cheering about. They shout, ‘Jerusalem is shattered! Her commercial power is gone! She won't be our rival any more!’"
Ezekiel,26,3,"“Now then, this is what I, the Sovereign LORD , am saying: I am your enemy, city of Tyre. I will bring many nations to attack you, and they will come like the waves of the sea."
Ezekiel,26,4,They will destroy your city walls and tear down your towers. Then I will sweep away all the dust and leave only a bare rock.
Ezekiel,26,5,"Fishermen will dry their nets on it, there where it stands in the sea. I, the Sovereign LORD , have spoken. The nations will plunder Tyre,"
Ezekiel,26,6,and with their swords they will kill those who live in her towns on the mainland. Then Tyre will know that I am the LORD .”
Ezekiel,26,7,"The Sovereign LORD says, “I am going to bring the greatest king of all — King Nebuchadnezzar of Babylonia — to attack Tyre. He will come from the north with a huge army, with horses and chariots and with cavalry."
Ezekiel,26,8,"Those who live in the towns on the mainland will be killed in the fighting. The enemy will dig trenches, build earthworks, and make a solid wall of shields against you."
Ezekiel,26,9,They will pound in your walls with battering rams and tear down your towers with iron bars.
Ezekiel,26,10,The clouds of dust raised by their horses will cover you. The noise of their horses pulling wagons and chariots will shake your walls as they pass through the gates of the ruined city.
Ezekiel,26,11,"Their horsemen will storm through your streets, killing your people with their swords. Your mighty pillars will be thrown to the ground."
Ezekiel,26,12,"Your enemies will help themselves to your wealth and merchandise. They will pull down your walls and shatter your luxurious houses. They will take the stones and wood and all the rubble, and dump them into the sea."
Ezekiel,26,13,"I will put an end to all your songs, and I will silence the music of your harps."
Ezekiel,26,14,"I will leave only a bare rock where fishermen can dry their nets. The city will never be rebuilt. I, the Sovereign LORD , have spoken.”"
Ezekiel,26,15,"The Sovereign LORD has this to say to the city of Tyre: “When you are being conquered, the people who live along the coast will be terrified at the screams of those who are slaughtered."
Ezekiel,26,16,All the kings of the seafaring nations will come down from their thrones. They will take off their robes and their embroidered clothes and sit trembling on the ground. They will be so terrified at your fate that they will not be able to stop trembling.
Ezekiel,26,17,They will sing this funeral song for you: The famous city is destroyed! Her ships have been swept from the seas. The people of this city ruled the seas And terrified all who lived on the coast.
Ezekiel,26,18,"Now, on the day it has fallen, The islands are trembling, And their people are shocked at such destruction.”"
Ezekiel,26,19,The Sovereign LORD says: “I will make you as desolate as ruined cities where no one lives. I will cover you with the water of the ocean depths.
Ezekiel,26,20,"I will send you down to the world of the dead to join the people who lived in ancient times. I will make you stay in that underground world among eternal ruins, keeping company with the dead. As a result you will never again be inhabited and take your place in the land of the living."
Ezekiel,26,21,"I will make you a terrifying example, and that will be the end of you. People may look for you, but you will never be found.” The Sovereign LORD has spoken."
Ezekiel,27,1,"The LORD said to me,"
Ezekiel,27,2,"“Mortal man, sing a funeral song for Tyre,"
Ezekiel,27,3,"that city which stands at the edge of the sea and does business with the people living on every seacoast. Tell her what the Sovereign LORD is saying: “Tyre, you boasted of your perfect beauty."
Ezekiel,27,4,Your home is the sea. Your builders made you like a beautiful ship;
Ezekiel,27,5,They used fir trees from Mount Hermon for timber And a cedar from Lebanon for your mast.
Ezekiel,27,6,They took oak trees from Bashan to make oars; They made your deck out of pine from Cyprus And inlaid it with ivory.
Ezekiel,27,7,"Your sails were made of linen, Embroidered linen from Egypt, Easily recognized from afar. Your awnings were made of finest cloth, Of purple from the island of Cyprus."
Ezekiel,27,8,Your oarsmen were from the cities of Sidon and Arvad. Your own skilful men were the sailors.
Ezekiel,27,9,The ship's carpenters Were well-trained men from Byblos. Sailors from every seagoing ship Did business in your shops.
Ezekiel,27,10,"“Soldiers from Persia, Lydia, and Libya served in your army. They hung their shields and their helmets in your barracks. They are the men who won glory for you."
Ezekiel,27,11,"Soldiers from Arvad guarded your walls, and men from Gamad guarded your towers. They hung their shields on your walls. They are the men who made you beautiful."
Ezekiel,27,12,"“You did business in Spain and took silver, iron, tin, and lead in payment for your abundant goods."
Ezekiel,27,13,"You did business in Greece, Tubal, and Meshech and traded your goods for slaves and for articles of bronze."
Ezekiel,27,14,"You sold your goods for draught horses, war horses, and mules from Beth Togarmah."
Ezekiel,27,15,The people of Rhodes traded with you; people of many coastal lands gave you ivory and ebony in exchange for your goods.
Ezekiel,27,16,"The people of Syria bought your merchandise and your many products. They gave emeralds, purple cloth, embroidery, fine linen, coral, and rubies in payment for your wares."
Ezekiel,27,17,"Judah and Israel paid for your goods with wheat, honey, olive oil, and spices."
Ezekiel,28,1,The LORD spoke to me.
Ezekiel,28,2,"“Mortal man,” he said, “tell the ruler of Tyre what I, the Sovereign LORD , am saying to him: puffed up with pride, you claim to be a god. You say that like a god you sit on a throne, surrounded by the seas. You may pretend to be a god, but, no, you are mortal, not divine."
Ezekiel,28,3,"You think you are wiser than Danel, that no secret can be kept from you."
Ezekiel,28,4,Your wisdom and skill made you rich with treasures of gold and silver.
Ezekiel,28,5,You made clever business deals and kept on making profits. How proud you are of your wealth!
Ezekiel,28,6,"“Now then, this is what I, the Sovereign LORD , am saying: because you think you are as wise as a god,"
Ezekiel,28,7,I will bring ruthless enemies to attack you. They will destroy all the beautiful things you have acquired by your skill and wisdom.
Ezekiel,28,8,They will kill you and send you to a watery grave.
Ezekiel,28,9,"When they come to kill you, will you still claim that you are a god? When you face your murderers, you will be mortal and not at all divine."
Ezekiel,28,10,"You will die like a dog at the hand of godless foreigners. I, the Sovereign LORD , have given the command.”"
Ezekiel,28,11,The LORD spoke to me again.
Ezekiel,28,12,"“Mortal man,” he said, “grieve for the fate that is waiting for the king of Tyre. Tell him what I, the Sovereign LORD , am saying: you were once an example of perfection. How wise and handsome you were!"
Ezekiel,28,13,"You lived in Eden, the garden of God, and wore gems of every kind: rubies and diamonds; topaz, beryl, carnelian, and jasper; sapphires, emeralds, and garnets. You had ornaments of gold. They were made for you on the day you were created."
Ezekiel,28,14,I put a terrifying angel there to guard you. You lived on my holy mountain and walked among sparkling gems.
Ezekiel,28,15,Your conduct was perfect from the day you were created until you began to do evil.
Ezekiel,28,16,"You were busy buying and selling, and this led you to violence and sin. So I forced you to leave my holy mountain, and the angel who guarded you drove you away from the sparkling gems."
Ezekiel,28,17,"You were proud of being handsome, and your fame made you act like a fool. Because of this I hurled you to the ground and left you as a warning to other kings."
Ezekiel,28,18,You did such evil in buying and selling that your places of worship were corrupted. So I set fire to the city and burnt it to the ground. All who look at you now see you reduced to ashes.
Ezekiel,28,19,"You are gone, gone for ever, and all the nations that had come to know you are terrified, afraid that they will share your fate.”"
Ezekiel,28,20," The LORD said to me,"
Ezekiel,28,21,"“Mortal man, denounce the city of Sidon."
Ezekiel,28,22,"Tell the people there what I, the Sovereign LORD , say about them: I am your enemy, Sidon; people will praise me because of what I do to you. They will know that I am the LORD , when I show how holy I am by punishing those who live in you."
Ezekiel,28,23,"I will send diseases on you and make blood flow in your streets. You will be attacked from every side, and your people will be killed. Then you will know that I am the LORD .”"
Ezekiel,28,24,"The LORD said, “None of the surrounding nations that treated Israel with scorn will ever again be like thorns and briars to hurt Israel. And they will know that I am the Sovereign LORD .”"
Ezekiel,28,25,"The Sovereign LORD said, “I will bring back the people of Israel from the nations where I scattered them, and all the nations will know that I am holy. The people of Israel will live in their own land, the land that I gave to my servant Jacob."
Ezekiel,28,26,"They will live there in safety. They will build houses and plant vineyards. I will punish all their neighbours who treated them with scorn, and Israel will be secure. Then they will know that I am the LORD their God.”"
Ezekiel,29,1," On the twelfth day of the tenth month of the tenth year of our exile, the LORD spoke to me."
Ezekiel,29,2,"“Mortal man,” he said, “denounce the king of Egypt. Tell him how he and all the land of Egypt will be punished."
Ezekiel,29,3,"Say that this is what the Sovereign LORD is telling the king of Egypt: I am your enemy, you monster crocodile, lying in the river. You say that the Nile is yours and that you made it."
Ezekiel,29,4,"I am going to put a hook through your jaw and make the fish in your river stick fast to you. Then I will pull you up out of the Nile, with all the fish sticking to you."
Ezekiel,29,5,I will throw you and all those fish into the desert. Your body will fall on the ground and be left unburied. I will give it to the birds and animals for food.
Ezekiel,29,6,"Then all the people of Egypt will know that I am the LORD .” The LORD says, “The Israelites relied on you Egyptians for support, but you were no better than a weak stick."
Ezekiel,29,7,"When they leaned on you, you broke, pierced their armpits, and made them wrench their backs."
Ezekiel,29,8,"Now then, I, the Sovereign LORD , am telling you that I will get troops to attack you with swords, and they will kill your people and your animals."
Ezekiel,29,9,"Egypt will become an empty waste. Then you will know that I am the LORD. “Because you said that the Nile is yours and you made it,"
Ezekiel,29,10,"I am your enemy and the enemy of your Nile. I will make all of Egypt an empty waste, from the city of Migdol in the north to the city of Aswan in the south, all the way to the Ethiopian border."
Ezekiel,29,11,No human being or animal will walk through it. For forty years nothing will live there.
Ezekiel,29,12,"I will make Egypt the most desolate country in the world. For forty years the cities of Egypt will lie in ruins, ruins worse than those of any other city. I will make the Egyptians refugees. They will flee to every country and live among other peoples.”"
Ezekiel,29,13,"The Sovereign LORD says, “After forty years I will bring the Egyptians back from the nations where I have scattered them,"
Ezekiel,29,14,"and I will let them live in southern Egypt, their original home. There they will be a weak kingdom,"
Ezekiel,29,15,"the weakest kingdom of all, and they will never again rule over other nations. I will make them so unimportant that they will not be able to bend any other nation to their will."
Ezekiel,29,16,Israel will never again depend on them for help. Egypt's fate will remind Israel how wrong it was to rely on them. Then Israel will know that I am the Sovereign LORD .”
Ezekiel,29,17,"On the first day of the first month of the 27th year of our exile, the LORD spoke to me."
Ezekiel,29,18,"“Mortal man,” he said, “King Nebuchadnezzar of Babylonia launched an attack on Tyre. He made his soldiers carry such heavy loads that their heads were rubbed bald and their shoulders were worn raw, but neither the king nor his army got anything for all their trouble."
Ezekiel,29,19,"So now this is what I, the Sovereign LORD , am saying: I am giving the land of Egypt to King Nebuchadnezzar. He will loot and plunder it and carry off all the wealth of Egypt as his army's pay."
Ezekiel,29,20,"I am giving him Egypt in payment for his services, because his army was working for me. I, the Sovereign LORD , have spoken."
Ezekiel,29,21,"“When that happens, I will make the people of Israel strong and let you, Ezekiel, speak out where everyone can hear you, so that they will know that I am the LORD .”"
Ezekiel,30,1,The LORD spoke again.
Ezekiel,30,2,"“Mortal man,” he said, “prophesy and announce what I, the Sovereign LORD , am saying. You are to shout these words: A day of terror is coming!"
Ezekiel,30,3,"The day is near, the day when the LORD will act, A day of clouds and trouble for the nations."
Ezekiel,30,4,There will be war in Egypt And great distress in Ethiopia. Many in Egypt will be killed; The country will be plundered And left in ruins.
Ezekiel,30,5,"“That war will also kill the soldiers hired from Ethiopia , Lydia, Libya, Arabia, Kub, and even from among my own people.”"
Ezekiel,30,6,"The LORD says, “From Migdol in the north to Aswan in the south, all Egypt's defenders will be killed in battle. Egypt's proud army will be destroyed. I, the Sovereign LORD , have spoken."
Ezekiel,30,7,"The land will be the most desolate in the world, and its cities will be left totally in ruins."
Ezekiel,30,8,"When I set fire to Egypt and all her defenders are killed, then they will know that I am the LORD."
Ezekiel,30,9,"“When that day comes and Egypt is destroyed, I will send messengers in ships to arouse the unsuspecting people of Ethiopia , and they will be terrified. That day is coming!”"
Ezekiel,30,10,"The Sovereign LORD says, “I will use King Nebuchadnezzar of Babylonia to put an end to Egypt's wealth."
Ezekiel,30,11,"He and his ruthless army will come to devastate the land. They will attack Egypt with swords, and the land will be full of corpses."
Ezekiel,30,12,"I will dry up the Nile and put Egypt under the power of evil people. Foreigners will devastate the whole country. I, the LORD , have spoken.”"
Ezekiel,30,13,"The Sovereign LORD says, “I will destroy the idols and the false gods in Memphis. There will be no one to rule over Egypt, and I will terrify all the people."
Ezekiel,30,14,I will make southern Egypt desolate and set fire to the city of Zoan in the north. I will punish the capital city of Thebes.
Ezekiel,30,15,"I will let the city of Pelusium, Egypt's great fortress, feel my fury. I will destroy the wealth of Thebes."
Ezekiel,30,16,"I will set fire to Egypt, and Pelusium will be in agony. The walls of Thebes will be broken down, and the city will be flooded."
Ezekiel,30,17,"The young men of the cities of Heliopolis and Bubastis will die in the war, and the other people will be taken prisoner."
Ezekiel,30,18,"Darkness will fall on Tahpanhes when I break the power of Egypt and put an end to the strength they were so proud of. A cloud will cover Egypt, and the people of all her cities will be taken prisoner."
Ezekiel,30,19,"When I punish Egypt in this way, they will know that I am the LORD .”"
Ezekiel,30,20,"On the seventh day of the first month of the eleventh year of our exile, the LORD spoke to me."
Ezekiel,30,21,"“Mortal man,” he said, “I have broken the arm of the king of Egypt. No one has bandaged it or put it in a sling so that it could heal and be strong enough to hold a sword again."
Ezekiel,30,22,"Now then, this is what I, the Sovereign LORD , say: I am the enemy of the king of Egypt. I am going to break both his arms — the good one and the one already broken — and the sword will fall from his hand."
Ezekiel,30,23,I am going to scatter the Egyptians throughout the world.
Ezekiel,30,24,"Then I will make the arms of the king of Babylonia strong and put my sword in his hands. But I will break the arms of the king of Egypt, and he will groan and die in front of his enemy."
Ezekiel,30,25,"Yes, I will weaken him and strengthen the king of Babylonia. When I give him my sword and he points it towards Egypt, everyone will know that I am the LORD."
Ezekiel,30,26,I will scatter the Egyptians throughout the world. Then they will know that I am the LORD .”
