Esther,9,9,"They killed 500 people in Susa, but they did not take anything that belonged to the ones they killed. Haman had been one of the worst enemies of the Jews, and ten of his sons were among those who were killed. Their names were Parshandatha, Dalphon, Aspatha, Poratha, Adalia, Aridatha, Parmashta, Arisai, Aridai, and Vaizatha."
Esther,9,10,"They killed 500 people in Susa, but they did not take anything that belonged to the ones they killed. Haman had been one of the worst enemies of the Jews, and ten of his sons were among those who were killed. Their names were Parshandatha, Dalphon, Aspatha, Poratha, Adalia, Aridatha, Parmashta, Arisai, Aridai, and Vaizatha."
Esther,9,11,"Later that day, someone told the king how many people had been killed in Susa."
Esther,9,12,"Then he told Esther, “Five hundred people, including Haman's ten sons, have been killed in Susa alone. If that many were killed here, what must have happened in the provinces? Is there anything else you want done? Just tell me, and it will be done.”"
Esther,9,13,"Esther answered, “Your Majesty, please let the Jews in Susa fight to defend themselves tomorrow, just as they did today. And order the bodies of Haman's ten sons to be hanged in public.”"
Esther,9,14,"King Xerxes did what Esther had requested, and the bodies of Haman's sons were hung in Susa."
Esther,9,15,Then on the fourteenth day of Adar the Jews of the city got together and killed 300 more people. But they still did not take anything that belonged to their enemies.
Esther,9,16,"On the thirteenth day of Adar, the Jews in the provinces had come together to defend themselves. They killed 75,000 of their enemies, but the Jews did not take anything that belonged to the ones they killed. Then on the fourteenth day of the month the Jews celebrated with a feast."
Esther,9,17,"On the thirteenth day of Adar, the Jews in the provinces had come together to defend themselves. They killed 75,000 of their enemies, but the Jews did not take anything that belonged to the ones they killed. Then on the fourteenth day of the month the Jews celebrated with a feast."
Esther,9,18,"On the fifteenth day of the month the Jews in Susa held a holiday and celebrated, after killing their enemies on the thirteenth and the fourteenth."
Esther,9,19,This is why the Jews in the villages now celebrate on the fourteenth day of the month. It is a joyful holiday that they celebrate by feasting and sending gifts of food to each other.
Esther,9,20,Mordecai wrote down everything that had happened. Then he sent letters to the Jews everywhere in the provinces
Esther,9,21,"and told them:
Each year you must celebrate on both the fourteenth and the fifteenth of Adar"
Esther,9,22,"the days when we Jews defeated our enemies. Remember this month as a time when our sorrow was turned to joy, and celebration took the place of crying. Celebrate by having parties and by giving to the poor and by sharing gifts of food with each other."
Esther,9,23,They followed Mordecai's instructions and set aside these two days every year as a time of celebration.
Esther,9,24,"Haman was the son of Hammedatha and a descendant of Agag. He hated the Jews so much that he planned to destroy them, but he wanted to find out the best time to do it. So he cast lots."
Esther,9,25,Esther went to King Xerxes and asked him to save her people. Then the king gave written orders for Haman and his sons to be punished in the same terrible way that Haman had in mind for the Jews. So they were hanged.
Esther,9,26,"Mordecai's letter had said that the Jews must celebrate for two days because of what had happened to them. This time of celebration is called Purim, which is the Hebrew word for the lots that were cast."
Esther,9,27,"Now every year the Jews set aside these two days for having parties and celebrating, just as they were told to do."
Esther,9,28,"From now on, all Jewish families must remember to celebrate Purim on these two days each year."
Esther,9,29,"Queen Esther, daughter of Abihail, wanted to give full authority to Mordecai's letter about the Festival of Purim, and with his help she wrote a letter about the feast."
Esther,9,30,"Copies of this letter were sent to Jews in the 127 provinces of King Xerxes. In the letter they said:
We pray that all of you will live in peace and safety."
Esther,9,31,You and your descendants must always remember to celebrate Purim at the time and in the way that we have said. You must also follow the instructions that we have given you about mourning and going without eating.
Esther,9,32,These laws about Purim are written by the authority of Queen Esther.
Esther,10,1,"King Xerxes made everyone in his kingdom pay taxes, even those in lands across the sea."
Esther,10,2,All the great and famous things that King Xerxes did are written in the record books of the kings of Media and Persia. These records also tell about the honors that the king gave to Mordecai.
Esther,10,3,"Next to the king himself, Mordecai was the highest official in the kingdom. He was a popular leader of the Jews, because he helped them in many ways and would even speak to the king on their behalf."
