Psalms,68,30,"Rebuke the beast in the reeds,
the herd of bulls with the calves of the peoples.
Trample underfoot those with bars of silver.
Scatter the peoples who take pleasure in war."
Psalms,68,31,"Ambassadors will come from Egypt;
Cush will stretch out its hands to God."
Psalms,68,32,"Sing to God, you kingdoms of the earth;
sing praise to the Lord, Selah"
Psalms,68,33,"to him who rides in the ancient, highest heavens.
Look, he thunders with his powerful voice!"
Psalms,68,34,"Ascribe power to God.
His majesty is over Israel;
his power is among the clouds."
Psalms,68,35,"God, you are awe-inspiring in your sanctuaries.
The God of Israel gives power and strength to his people.
Blessed be God!"
Psalms,69,1,"Save me, God,
for the water has risen to my neck."
Psalms,69,2,"I have sunk in deep mud, and there is no footing;
I have come into deep water,
and a flood sweeps over me."
Psalms,69,3,"I am weary from my crying;
my throat is parched.
My eyes fail, looking for my God."
Psalms,69,4,"Those who hate me without cause
are more numerous than the hairs of my head;
my deceitful enemies, who would destroy me,
are powerful.
Though I did not steal, I must repay."
Psalms,69,5,"God, you know my foolishness,
and my guilty acts are not hidden from you."
Psalms,69,6,"Do not let those who put their hope in you
be disgraced because of me,
Lord GOD of Armies;
do not let those who seek you
be humiliated because of me,
God of Israel."
Psalms,69,7,"For I have endured insults because of you,
and shame has covered my face."
Psalms,69,8,"I have become a stranger to my brothers
and a foreigner to my mother’s sons"
Psalms,69,9,"because zeal for your house has consumed me,
and the insults of those who insult you
have fallen on me."
Psalms,69,10,"I mourned and fasted,
but it brought me insults."
Psalms,69,11,"I wore sackcloth as my clothing,
and I was a joke to them."
Psalms,69,12,"Those who sit at the city gate talk about me,
and drunkards make up songs about me."
Psalms,69,13,"But as for me, LORD,
my prayer to you is for a time of favor.
In your abundant, faithful love, God,
answer me with your sure salvation."
Psalms,69,14,"Rescue me from the miry mud; don’t let me sink.
Let me be rescued from those who hate me
and from the deep water."
Psalms,69,15,"Don’t let the floodwaters sweep over me
or the deep swallow me up;
don’t let the Pit close its mouth over me."
Psalms,69,16,"Answer me, LORD,
for your faithful love is good.
In keeping with your abundant compassion,
turn to me."
Psalms,69,17,"Don’t hide your face from your servant,
for I am in distress.
Answer me quickly!"
Psalms,69,18,"Come near to me and redeem me;
ransom me because of my enemies."
Psalms,69,19,"You know the insults I endure —
my shame and disgrace.
You are aware of all my adversaries."
Psalms,69,20,"Insults have broken my heart,
and I am in despair.
I waited for sympathy,
but there was none;
for comforters, but found no one."
Psalms,69,21,"Instead, they gave me gall for my food,
and for my thirst
they gave me vinegar to drink."
Psalms,69,22,"Let their table set before them be a snare,
and let it be a trap for their allies."
Psalms,69,23,"Let their eyes grow too dim to see,
and let their hips continually quake."
Psalms,69,24,"Pour out your rage on them,
and let your burning anger overtake them."
Psalms,69,25,"Make their fortification desolate;
may no one live in their tents."
Psalms,69,26,"For they persecute the one you struck
and talk about the pain of those you wounded."
Psalms,69,27,"Charge them with crime on top of crime;
do not let them share in your righteousness."
Psalms,69,28,"Let them be erased from the book of life
and not be recorded with the righteous."
Psalms,69,29,"But as for me — poor and in pain —
let your salvation protect me, God."
Psalms,69,30,"I will praise God’s name with song
and exalt him with thanksgiving."
Psalms,69,31,"That will please the LORD more than an ox,
more than a bull with horns and hooves."
Psalms,69,32,"The humble will see it and rejoice.
You who seek God, take heart!"
Psalms,69,33,"For the LORD listens to the needy
and does not despise
his own who are prisoners."
Psalms,69,34,"Let heaven and earth praise him,
the seas and everything that moves in them"
Psalms,69,35,"for God will save Zion
and build up the cities of Judah.
They will live there and possess it."
Psalms,69,36,"The descendants of his servants will inherit it,
and those who love his name will live in it."
Psalms,70,1,"God, hurry to rescue me.
LORD, hurry to help me!"
Psalms,70,2,"Let those who seek to kill me
be disgraced and confounded;
let those who wish me harm
be turned back and humiliated."
Psalms,70,3,"Let those who say, “Aha, aha!”
retreat because of their shame."
Psalms,70,4,"Let all who seek you rejoice and be glad in you;
let those who love your salvation
continually say, “God is great!”"
Psalms,70,5,"I am oppressed and needy;
hurry to me, God.
You are my help and my deliverer;
LORD, do not delay."
Psalms,71,1,"LORD, I seek refuge in you;
let me never be disgraced."
Psalms,71,2,"In your justice, rescue and deliver me;
listen closely to me and save me."
Psalms,71,3,"Be a rock of refuge for me,
where I can always go.
Give the command to save me,
for you are my rock and fortress."
Psalms,71,4,"Deliver me, my God, from the power of the wicked,
from the grasp of the unjust and oppressive."
Psalms,71,5,"For you are my hope, Lord GOD,
my confidence from my youth."
Psalms,71,6,"I have leaned on you from birth;
you took me from my mother’s womb.
My praise is always about you."
Psalms,71,7,"I am like a miraculous sign to many,
and you are my strong refuge."
Psalms,71,8,"My mouth is full of praise
and honor to you all day long."
Psalms,71,9,"Don’t discard me in my old age.
As my strength fails, do not abandon me."
Psalms,71,10,"For my enemies talk about me,
and those who spy on me plot together"
Psalms,71,11,"saying, “God has abandoned him;
chase him and catch him,
for there is no one to rescue him.”"
Psalms,71,12,"God, do not be far from me;
my God, hurry to help me."
Psalms,71,13,"May my adversaries be disgraced and destroyed;
may those who intend to harm me
be covered with disgrace and humiliation."
Psalms,71,14,"But I will hope continually
and will praise you more and more."
Psalms,71,15,"My mouth will tell about your righteousness
and your salvation all day long,
though I cannot sum them up."
Psalms,71,16,"I come because of the mighty acts of the Lord GOD;
I will proclaim your righteousness, yours alone."
Psalms,71,17,"God, you have taught me from my youth,
and I still proclaim your wondrous works."
Psalms,71,18,"Even while I am old and gray,
God, do not abandon me,
while I proclaim your power
to another generation,
your strength to all who are to come."
Psalms,71,19,"Your righteousness reaches the heights, God,
you who have done great things;
God, who is like you?"
Psalms,71,20,"You caused me to experience
many troubles and misfortunes,
but you will revive me again.
You will bring me up again,
even from the depths of the earth."
Psalms,71,21,"You will increase my honor
and comfort me once again."
Psalms,71,22,"Therefore, I will praise you with a harp
for your faithfulness, my God;
I will sing to you with a lyre,
Holy One of Israel."
Psalms,71,23,"My lips will shout for joy
when I sing praise to you
because you have redeemed me."
Psalms,71,24,"Therefore, my tongue will proclaim
your righteousness all day long,
for those who intend to harm me
will be disgraced and confounded."
Psalms,72,1,"God, give your justice to the king
and your righteousness to the king’s son."
Psalms,72,2,"He will judge your people with righteousness
and your afflicted ones with justice."
Psalms,72,3,"May the mountains bring well-being to the people
and the hills, righteousness."
Psalms,72,4,"May he vindicate the afflicted among the people,
help the poor,
and crush the oppressor."
Psalms,72,5,"May they fear you while the sun endures
and as long as the moon, throughout all generations."
Psalms,72,6,"May the king be like rain that falls on the cut grass,
like spring showers that water the earth."
Psalms,72,7,"May the righteous flourish in his days
and well-being abound
until the moon is no more."
Psalms,72,8,"May he rule from sea to sea
and from the Euphrates
to the ends of the earth."
Psalms,72,9,"May desert tribes kneel before him
and his enemies lick the dust."
Psalms,72,10,"May the kings of Tarshish
and the coasts and islands bring tribute,
the kings of Sheba and Seba offer gifts."
Psalms,72,11,"Let all kings bow in homage to him,
all nations serve him."
Psalms,72,12,"For he will rescue the poor who cry out
and the afflicted who have no helper."
Psalms,72,13,"He will have pity on the poor and helpless
and save the lives of the poor."
Psalms,72,14,"He will redeem them from oppression and violence,
for their lives are precious in his sight."
Psalms,72,15,"May he live long!
May gold from Sheba be given to him.
May prayer be offered for him continually,
and may he be blessed all day long."
Psalms,72,16,"May there be plenty of grain in the land;
may it wave on the tops of the mountains.
May its crops be like Lebanon.
May people flourish in the cities
like the grass of the field."
Psalms,72,17,"May his name endure forever;
as long as the sun shines,
may his fame increase.
May all nations be blessed by him
and call him blessed."
Psalms,72,18,"Blessed be the LORD God, the God of Israel,
who alone does wonders."
Psalms,72,19,"Blessed be his glorious name forever;
the whole earth is filled with his glory.
Amen and amen."
Psalms,72,20,The prayers of David son of Jesse are concluded.
Psalms,73,1,"God is indeed good to Israel,
to the pure in heart."
Psalms,73,2,"But as for me, my feet almost slipped;
my steps nearly went astray."
Psalms,73,3,"For I envied the arrogant;
I saw the prosperity of the wicked."
Psalms,73,4,"They have an easy time until they die,
and their bodies are well fed."
Psalms,73,5,"They are not in trouble like others;
they are not afflicted like most people."
Psalms,73,6,"Therefore, pride is their necklace,
and violence covers them like a garment."
Psalms,73,7,"Their eyes bulge out from fatness;
the imaginations of their hearts run wild."
Psalms,73,8,"They mock, and they speak maliciously;
they arrogantly threaten oppression."
Psalms,73,9,"They set their mouths against heaven,
and their tongues strut across the earth."
Psalms,73,10,"Therefore his people turn to them
and drink in their overflowing words."
Psalms,73,11,"The wicked say, “How can God know?
Does the Most High know everything?”"
Psalms,73,12,"Look at them — the wicked!
They are always at ease,
and they increase their wealth."
Psalms,73,13,"Did I purify my heart
and wash my hands in innocence for nothing?"
Psalms,73,14,"For I am afflicted all day long
and punished every morning."
Psalms,73,15,"If I had decided to say these things aloud,
I would have betrayed your people."
Psalms,73,16,"When I tried to understand all this,
it seemed hopeless"
Psalms,73,17,"until I entered God’s sanctuary.
Then I understood their destiny."
Psalms,73,18,"Indeed, you put them in slippery places;
you make them fall into ruin."
Psalms,73,19,"How suddenly they become a desolation!
They come to an end, swept away by terrors."
Psalms,73,20,"Like one waking from a dream,
Lord, when arising, you will despise their image."
Psalms,73,21,"When I became embittered
and my innermost being was wounded"
Psalms,73,22,"I was stupid and didn’t understand;
I was an unthinking animal toward you."
Psalms,73,23,"Yet I am always with you;
you hold my right hand."
Psalms,73,24,"You guide me with your counsel,
and afterward you will take me up in glory."
Psalms,73,25,"Who do I have in heaven but you?
And I desire nothing on earth but you."
Psalms,73,26,"My flesh and my heart may fail,
but God is the strength of my heart,
my portion forever."
Psalms,73,27,"Those far from you will certainly perish;
you destroy all who are unfaithful to you."
Psalms,73,28,"But as for me, God’s presence is my good.
I have made the Lord GOD my refuge,
so I can tell about all you do."
Psalms,74,1,"Why have you rejected us forever, God?
Why does your anger burn
against the sheep of your pasture?"
Psalms,74,2,"Remember your congregation,
which you purchased long ago
and redeemed as the tribe for your own possession.
Remember Mount Zion where you dwell."
Psalms,74,3,"Make your way to the perpetual ruins,
to all that the enemy has destroyed in the sanctuary."
Psalms,74,4,"Your adversaries roared in the meeting place
where you met with us.
They set up their emblems as signs."
Psalms,74,5,"It was like men in a thicket of trees,
wielding axes"
Psalms,74,6,"then smashing all the carvings
with hatchets and picks."
Psalms,74,7,"They set your sanctuary on fire;
they utterly desecrated
the dwelling place of your name."
Psalms,74,8,"They said in their hearts,
“Let’s oppress them relentlessly.”
They burned every place throughout the land
where God met with us."
Psalms,74,9,"There are no signs for us to see.
There is no longer a prophet.
And none of us knows how long this will last."
Psalms,74,10,"God, how long will the enemy mock?
Will the foe insult your name forever?"
Psalms,74,11,"Why do you hold back your hand?
Stretch out your right hand and destroy them!"
Psalms,74,12,"God my King is from ancient times,
performing saving acts on the earth."
Psalms,74,13,"You divided the sea with your strength;
you smashed the heads of the sea monsters in the water"
Psalms,74,14,"you crushed the heads of Leviathan;
you fed him to the creatures of the desert."
Psalms,74,15,"You opened up springs and streams;
you dried up ever-flowing rivers."
Psalms,74,16,"The day is yours, also the night;
you established the moon and the sun."
Psalms,74,17,"You set all the boundaries of the earth;
you made summer and winter."
Psalms,74,18,"Remember this: the enemy has mocked the LORD,
and a foolish people has insulted your name."
Psalms,74,19,"Do not give to beasts the life of your dove;
do not forget the lives of your poor people forever."
Psalms,74,20,"Consider the covenant,
for the dark places of the land are full of violence."
Psalms,74,21,"Do not let the oppressed turn away in shame;
let the poor and needy praise your name."
Psalms,74,22,"Rise up, God, champion your cause!
Remember the insults
that fools bring against you all day long."
Psalms,74,23,"Do not forget the clamor of your adversaries,
the tumult of your opponents that goes up constantly."
Psalms,75,1,"We give thanks to you, God;
we give thanks to you, for your name is near.
People tell about your wondrous works."
Psalms,75,2,"“When I choose a time,
I will judge fairly."
Psalms,75,3,"When the earth and all its inhabitants shake,
I am the one who steadies its pillars. Selah"
Psalms,75,4,"I say to the boastful, ‘Do not boast,’
and to the wicked, ‘Do not lift up your horn."
Psalms,75,5,"Do not lift up your horn against heaven
or speak arrogantly.’”"
Psalms,75,6,"Exaltation does not come
from the east, the west, or the desert"
Psalms,75,7,"for God is the Judge:
He brings down one and exalts another."
Psalms,75,8,"For there is a cup in the LORD’s hand,
full of wine blended with spices, and he pours from it.
All the wicked of the earth will drink,
draining it to the dregs."
Psalms,75,9,"As for me, I will tell about him forever;
I will sing praise to the God of Jacob."
Psalms,75,10,"“I will cut off all the horns of the wicked,
but the horns of the righteous will be lifted up.”"
Psalms,76,1,"God is known in Judah;
his name is great in Israel."
Psalms,76,2,"His tent is in Salem,
his dwelling place in Zion."
Psalms,76,3,"There he shatters the bow’s flaming arrows,
the shield, the sword, and the weapons of war. Selah"
Psalms,76,4,"You are resplendent and majestic
coming down from the mountains of prey."
Psalms,76,5,"The brave-hearted have been plundered;
they have slipped into their final sleep.
None of the warriors was able to lift a hand."
Psalms,76,6,"At your rebuke, God of Jacob,
both chariot and horse lay still."
Psalms,76,7,"And you — you are to be feared.
When you are angry,
who can stand before you?"
Psalms,76,8,"From heaven you pronounced judgment.
The earth feared and grew quiet"
Psalms,76,9,"when God rose up to judge
and to save all the lowly of the earth. Selah"
Psalms,76,10,"Even human wrath will praise you;
you will clothe yourself
with the wrath that remains."
Psalms,76,11,"Make and keep your vows
to the LORD your God;
let all who are around him bring tribute
to the awe-inspiring one."
Psalms,76,12,"He humbles the spirit of leaders;
he is feared by the kings of the earth."
Psalms,77,1,"I cry aloud to God,
aloud to God, and he will hear me."
Psalms,77,2,"I sought the Lord in my day of trouble.
My hands were continually lifted up
all night long;
I refused to be comforted."
Psalms,77,3,"I think of God; I groan;
I meditate; my spirit becomes weak. Selah"
Psalms,77,4,"You have kept me from closing my eyes;
I am troubled and cannot speak."
Psalms,77,5,"I consider days of old,
years long past."
Psalms,77,6,"At night I remember my music;
I meditate in my heart, and my spirit ponders."
Psalms,77,7,"“Will the Lord reject forever
and never again show favor?"
Psalms,77,8,"Has his faithful love ceased forever?
Is his promise at an end for all generations?"
Psalms,77,9,"Has God forgotten to be gracious?
Has he in anger withheld his compassion?” Selah"
Psalms,77,10,"So I say, “I am grieved
that the right hand of the Most High has changed.”"
Psalms,77,11,"I will remember the LORD’s works;
yes, I will remember your ancient wonders."
Psalms,77,12,"I will reflect on all you have done
and meditate on your actions."
Psalms,77,13,"God, your way is holy.
What god is great like God?"
Psalms,77,14,"You are the God who works wonders;
you revealed your strength among the peoples."
Psalms,77,15,"With power you redeemed your people,
the descendants of Jacob and Joseph. Selah"
Psalms,77,16,"The water saw you, God.
The water saw you; it trembled.
Even the depths shook."
Psalms,77,17,"The clouds poured down water.
The storm clouds thundered;
your arrows flashed back and forth."
Psalms,77,18,"The sound of your thunder was in the whirlwind;
lightning lit up the world.
The earth shook and quaked."
Psalms,77,19,"Your way went through the sea
and your path through the vast water,
but your footprints were unseen."
Psalms,77,20,"You led your people like a flock
by the hand of Moses and Aaron."
Psalms,78,1,"My people, hear my instruction;
listen to the words from my mouth."
Psalms,78,2,"I will declare wise sayings;
I will speak mysteries from the past  "
Psalms,78,3,"things we have heard and known
and that our ancestors have passed down to us."
Psalms,78,4,"We will not hide them from their children,
but will tell a future generation
the praiseworthy acts of the LORD,
his might, and the wondrous works
he has performed."
Psalms,78,5,"He established a testimony in Jacob
and set up a law in Israel,
which he commanded our ancestors
to teach to their children"
Psalms,78,6,"so that a future generation —
children yet to be born — might know.
They were to rise and tell their children"
Psalms,78,7,"so that they might put their confidence in God
and not forget God’s works,
but keep his commands."
Psalms,78,8,"Then they would not be like their ancestors,
a stubborn and rebellious generation,
a generation whose heart was not loyal
and whose spirit was not faithful to God."
Psalms,78,9,"The Ephraimite archers turned back
on the day of battle."
Psalms,78,10,"They did not keep God’s covenant
and refused to live by his law."
Psalms,78,11,"They forgot what he had done,
the wondrous works he had shown them."
Psalms,78,12,"He worked wonders in the sight of their ancestors
in the land of Egypt, the territory of Zoan."
Psalms,78,13,"He split the sea and brought them across;
the water stood firm like a wall."
Psalms,78,14,"He led them with a cloud by day
and with a fiery light throughout the night."
Psalms,78,15,"He split rocks in the wilderness
and gave them drink as abundant as the depths."
Psalms,78,16,"He brought streams out of the stone
and made water flow down like rivers."
Psalms,78,17,"But they continued to sin against him,
rebelling in the desert against the Most High."
Psalms,78,18,"They deliberately tested God,
demanding the food they craved."
Psalms,78,19,"They spoke against God, saying,
“Is God able to provide food in the wilderness?"
Psalms,78,20,"Look! He struck the rock and water gushed out;
torrents overflowed.
But can he also provide bread
or furnish meat for his people?”"
Psalms,78,21,"Therefore, the LORD heard and became furious;
then fire broke out against Jacob,
and anger flared up against Israel"
Psalms,78,22,"because they did not believe God
or rely on his salvation."
Psalms,78,23,"He gave a command to the clouds above
and opened the doors of heaven."
Psalms,78,24,"He rained manna for them to eat;
he gave them grain from heaven."
Psalms,78,25,"People ate the bread of angels.
He sent them an abundant supply of food."
Psalms,78,26,"He made the east wind blow in the skies
and drove the south wind by his might."
Psalms,78,27,"He rained meat on them like dust,
and winged birds like the sand of the seas."
Psalms,78,28,"He made them fall in the camp,
all around the tents."
Psalms,78,29,"The people ate and were completely satisfied,
for he gave them what they craved."
Psalms,78,30,"Before they had turned from what they craved,
while the food was still in their mouths"
Psalms,78,31,"God’s anger flared up against them,
and he killed some of their best men.
He struck down Israel’s fit young men."
Psalms,78,32,"Despite all this, they kept sinning
and did not believe his wondrous works."
Psalms,78,33,"He made their days end in futility,
their years in sudden disaster."
Psalms,78,34,"When he killed some of them,
the rest began to seek him;
they repented and searched for God."
Psalms,78,35,"They remembered that God was their rock,
the Most High God, their Redeemer."
Psalms,78,36,"But they deceived him with their mouths,
they lied to him with their tongues"
Psalms,78,37,"their hearts were insincere toward him,
and they were unfaithful to his covenant."
Psalms,78,38,"Yet he was compassionate;
he atoned for their iniquity
and did not destroy them.
He often turned his anger aside
and did not unleash all his wrath."
Psalms,78,39,"He remembered that they were only flesh,
a wind that passes and does not return."
Psalms,78,40,"How often they rebelled against him
in the wilderness
and grieved him in the desert."
Psalms,78,41,"They constantly tested God
and provoked the Holy One of Israel."
Psalms,78,42,"They did not remember his power shown
on the day he redeemed them from the foe"
Psalms,78,43,"when he performed his miraculous signs in Egypt
and his wonders in the territory of Zoan."
Psalms,78,44,"He turned their rivers into blood,
and they could not drink from their streams."
Psalms,78,45,"He sent among them swarms of flies,
which fed on them,
and frogs, which devastated them."
Psalms,78,46,"He gave their crops to the caterpillar
and the fruit of their labor to the locust."
Psalms,78,47,"He killed their vines with hail
and their sycamore fig trees with a flood."
Psalms,78,48,"He handed over their livestock to hail
and their cattle to lightning bolts."
Psalms,78,49,"He sent his burning anger against them:
fury, indignation, and calamity —
a band of deadly messengers."
Psalms,78,50,"He cleared a path for his anger.
He did not spare them from death
but delivered their lives to the plague."
Psalms,78,51,"He struck all the firstborn in Egypt,
the first progeny of the tents of Ham."
Psalms,78,52,"He led his people out like sheep
and guided them like a flock in the wilderness."
Psalms,78,53,"He led them safely, and they were not afraid;
but the sea covered their enemies."
Psalms,78,54,"He brought them to his holy territory,
to the mountain his right hand acquired."
Psalms,78,55,"He drove out nations before them.
He apportioned their inheritance by lot
and settled the tribes of Israel in their tents."
Psalms,78,56,"But they rebelliously tested the Most High God,
for they did not keep his decrees."
Psalms,78,57,"They treacherously turned away like their ancestors;
they became warped like a faulty bow."
Psalms,78,58,"They enraged him with their high places
and provoked his jealousy with their carved images."
Psalms,78,59,"God heard and became furious;
he completely rejected Israel."
Psalms,78,60,"He abandoned the tabernacle at Shiloh,
the tent where he resided among mankind."
Psalms,78,61,"He gave up his strength to captivity
and his splendor to the hand of a foe."
Psalms,78,62,"He surrendered his people to the sword
because he was enraged with his heritage."
Psalms,78,63,"Fire consumed his chosen young men,
and his young women had no wedding songs."
Psalms,78,64,"His priests fell by the sword,
and the widows could not lament."
Psalms,78,65,"The Lord awoke as if from sleep,
like a warrior from the effects of wine."
Psalms,78,66,"He beat back his foes;
he gave them lasting disgrace."
Psalms,78,67,"He rejected the tent of Joseph
and did not choose the tribe of Ephraim."
Psalms,78,68,"He chose instead the tribe of Judah,
Mount Zion, which he loved."
Psalms,78,69,"He built his sanctuary like the heights,
like the earth that he established forever."
Psalms,78,70,"He chose David his servant
and took him from the sheep pens"
Psalms,78,71,"he brought him from tending ewes
to be shepherd over his people Jacob —
over Israel, his inheritance."
Psalms,78,72,"He shepherded them with a pure heart
and guided them with his skillful hands."
Psalms,79,1,"God, the nations have invaded your inheritance,
desecrated your holy temple,
and turned Jerusalem into ruins."
Psalms,79,2,"They gave the corpses of your servants
to the birds of the sky for food,
the flesh of your faithful ones
to the beasts of the earth."
