Psalms,35,25,"Do not let them say in their hearts,
“Aha! Just what we wanted.”
Do not let them say,
“We have swallowed him up!”"
Psalms,35,26,"Let those who rejoice at my misfortune
be disgraced and humiliated;
let those who exalt themselves over me
be clothed with shame and reproach."
Psalms,35,27,"Let those who want my vindication
shout for joy and be glad;
let them continually say,
“The LORD be exalted.
He takes pleasure in his servant’s well-being.”"
Psalms,35,28,"And my tongue will proclaim your righteousness,
your praise all day long."
Psalms,36,1,"An oracle within my heart
concerning the transgression of the wicked person:
Dread of God has no effect on him."
Psalms,36,2,"For with his flattering opinion of himself,
he does not discover and hate his iniquity."
Psalms,36,3,"The words from his mouth are malicious and deceptive;
he has stopped acting wisely and doing good."
Psalms,36,4,"Even on his bed he makes malicious plans.
He sets himself on a path that is not good,
and he does not reject evil."
Psalms,36,5,"LORD, your faithful love reaches to heaven,
your faithfulness to the clouds."
Psalms,36,6,"Your righteousness is like the highest mountains,
your judgments like the deepest sea.
LORD, you preserve people and animals."
Psalms,36,7,"How priceless your faithful love is, God!
People take refuge in the shadow of your wings."
Psalms,36,8,"They are filled from the abundance of your house.
You let them drink from your refreshing stream."
Psalms,36,9,"For the wellspring of life is with you.
By means of your light we see light."
Psalms,36,10,"Spread your faithful love over those who know you,
and your righteousness over the upright in heart."
Psalms,36,11,"Do not let the foot of the arrogant come near me
or the hand of the wicked drive me away."
Psalms,36,12,"There! The evildoers have fallen.
They have been thrown down and cannot rise."
Psalms,37,1,"Do not be agitated by evildoers;
do not envy those who do wrong."
Psalms,37,2,"For they wither quickly like grass
and wilt like tender green plants."
Psalms,37,3,"Trust in the LORD and do what is good;
dwell in the land and live securely."
Psalms,37,4,"Take delight in the LORD,
and he will give you your heart’s desires."
Psalms,37,5,"Commit your way to the LORD;
trust in him, and he will act"
Psalms,37,6,"making your righteousness shine like the dawn,
your justice like the noonday."
Psalms,37,7,"Be silent before the LORD and wait expectantly for him;
do not be agitated by one who prospers in his way,
by the person who carries out evil plans."
Psalms,37,8,"Refrain from anger and give up your rage;
do not be agitated — it can only bring harm."
Psalms,37,9,"For evildoers will be destroyed,
but those who put their hope in the LORD
will inherit the land."
Psalms,37,10,"A little while, and the wicked person will be no more;
though you look for him, he will not be there."
Psalms,37,11,"But the humble will inherit the land
and will enjoy abundant prosperity."
Psalms,37,12,"The wicked person schemes against the righteous
and gnashes his teeth at him."
Psalms,37,13,"The Lord laughs at him
because he sees that his day is coming."
Psalms,37,14,"The wicked have drawn the sword and strung the bow
to bring down the poor and needy
and to slaughter those whose way is upright."
Psalms,37,15,"Their swords will enter their own hearts,
and their bows will be broken."
Psalms,37,16,"The little that the righteous person has is better
than the abundance of many wicked people."
Psalms,37,17,"For the arms of the wicked will be broken,
but the LORD supports the righteous."
Psalms,37,18,"The LORD watches over the blameless all their days,
and their inheritance will last forever."
Psalms,37,19,"They will not be disgraced in times of adversity;
they will be satisfied in days of hunger."
Psalms,37,20,"But the wicked will perish;
the LORD’s enemies, like the glory of the pastures,
will fade away —
they will fade away like smoke."
Psalms,37,21,"The wicked person borrows and does not repay,
but the righteous one is gracious and giving."
Psalms,37,22,"Those who are blessed by the LORD will inherit the land,
but those cursed by him will be destroyed."
Psalms,37,23,"A person’s steps are established by the LORD,
and he takes pleasure in his way."
Psalms,37,24,"Though he falls, he will not be overwhelmed,
because the LORD supports him with his hand."
Psalms,37,25,"I have been young and now I am old,
yet I have not seen the righteous abandoned
or his children begging for bread."
Psalms,37,26,"He is always generous, always lending,
and his children are a blessing."
Psalms,37,27,"Turn away from evil, do what is good,
and settle permanently."
Psalms,37,28,"For the LORD loves justice
and will not abandon his faithful ones.
They are kept safe forever,
but the children of the wicked will be destroyed."
Psalms,37,29,"The righteous will inherit the land
and dwell in it permanently."
Psalms,37,30,"The mouth of the righteous utters wisdom;
his tongue speaks what is just."
Psalms,37,31,"The instruction of his God is in his heart;
his steps do not falter."
Psalms,37,32,"The wicked one lies in wait for the righteous
and intends to kill him"
Psalms,37,33,"the LORD will not leave him
in the power of the wicked one
or allow him to be condemned when he is judged."
Psalms,37,34,"Wait for the LORD and keep his way,
and he will exalt you to inherit the land.
You will watch when the wicked are destroyed."
Psalms,37,35,"I have seen a wicked, violent person
well-rooted, like a flourishing native tree."
Psalms,37,36,"Then I passed by and noticed he was gone;
I searched for him, but he could not be found."
Psalms,37,37,"Watch the blameless and observe the upright,
for the person of peace will have a future."
Psalms,37,38,"But transgressors will all be eliminated;
the future of the wicked will be destroyed."
Psalms,37,39,"The salvation of the righteous is from the LORD,
their refuge in a time of distress."
Psalms,37,40,"The LORD helps and delivers them;
he will deliver them from the wicked and will save them
because they take refuge in him."
Psalms,38,1,"LORD, do not punish me in your anger
or discipline me in your wrath."
Psalms,38,2,"For your arrows have sunk into me,
and your hand has pressed down on me."
Psalms,38,3,"There is no soundness in my body
because of your indignation;
there is no health in my bones
because of my sin."
Psalms,38,4,"For my iniquities have flooded over my head;
they are a burden too heavy for me to bear."
Psalms,38,5,"My wounds are foul and festering
because of my foolishness."
Psalms,38,6,"I am bent over and brought very low;
all day long I go around in mourning."
Psalms,38,7,"For my insides are full of burning pain,
and there is no soundness in my body."
Psalms,38,8,"I am faint and severely crushed;
I groan because of the anguish of my heart."
Psalms,38,9,"Lord, my every desire is in front of you;
my sighing is not hidden from you."
Psalms,38,10,"My heart races, my strength leaves me,
and even the light of my eyes has faded."
Psalms,38,11,"My loved ones and friends stand back from my affliction,
and my relatives stand at a distance."
Psalms,38,12,"Those who intend to kill me set traps,
and those who want to harm me threaten to destroy me;
they plot treachery all day long."
Psalms,38,13,"I am like a deaf person; I do not hear.
I am like a speechless person
who does not open his mouth."
Psalms,38,14,"I am like a man who does not hear
and has no arguments in his mouth."
Psalms,38,15,"For I put my hope in you, LORD;
you will answer me, my Lord, my God."
Psalms,38,16,"For I said, “Don’t let them rejoice over me —
those who are arrogant toward me when I stumble.”"
Psalms,38,17,"For I am about to fall,
and my pain is constantly with me."
Psalms,38,18,"So I confess my iniquity;
I am anxious because of my sin."
Psalms,38,19,"But my enemies are vigorous and powerful;
many hate me for no reason."
Psalms,38,20,"Those who repay evil for good
attack me for pursuing good."
Psalms,38,21,"LORD, do not abandon me;
my God, do not be far from me."
Psalms,38,22,"Hurry to help me,
my Lord, my salvation."
Psalms,39,1,"I said, “I will guard my ways
so that I may not sin with my tongue;
I will guard my mouth with a muzzle
as long as the wicked are in my presence.”"
Psalms,39,2,"I was speechless and quiet;
I kept silent, even from speaking good,
and my pain intensified."
Psalms,39,3,"My heart grew hot within me;
as I mused, a fire burned.
I spoke with my tongue"
Psalms,39,4,"“LORD, make me aware of my end
and the number of my days
so that I will know how short-lived I am."
Psalms,39,5,"In fact, you have made my days just inches long,
and my life span is as nothing to you.
Yes, every human being stands as only a vapor. Selah"
Psalms,39,6,"Yes, a person goes about like a mere shadow.
Indeed, they rush around in vain,
gathering possessions
without knowing who will get them."
Psalms,39,7,"“Now, Lord, what do I wait for?
My hope is in you."
Psalms,39,8,"Rescue me from all my transgressions;
do not make me the taunt of fools."
Psalms,39,9,"I am speechless; I do not open my mouth
because of what you have done."
Psalms,39,10,"Remove your torment from me.
Because of the force of your hand I am finished."
Psalms,39,11,"You discipline a person with punishment for iniquity,
consuming like a moth what is precious to him;
yes, every human being is only a vapor. Selah"
Psalms,39,12,"“Hear my prayer, LORD,
and listen to my cry for help;
do not be silent at my tears.
For I am here with you as an alien,
a temporary resident like all my ancestors."
Psalms,39,13,"Turn your angry gaze from me
so that I may be cheered up
before I die and am gone.”"
Psalms,40,1,"I waited patiently for the LORD,
and he turned to me and heard my cry for help."
Psalms,40,2,"He brought me up from a desolate pit,
out of the muddy clay,
and set my feet on a rock,
making my steps secure."
Psalms,40,3,"He put a new song in my mouth,
a hymn of praise to our God.
Many will see and fear,
and they will trust in the LORD."
Psalms,40,4,"How happy is anyone
who has put his trust in the LORD
and has not turned to the proud
or to those who run after lies!"
Psalms,40,5,"LORD my God, you have done many things —
your wondrous works and your plans for us;
none can compare with you.
If I were to report and speak of them,
they are more than can be told."
Psalms,40,6,"You do not delight in sacrifice and offering;
you open my ears to listen.
You do not ask for a whole burnt offering or a sin offering."
Psalms,40,7,"Then I said, “See, I have come;
in the scroll it is written about me."
Psalms,40,8,"I delight to do your will, my God,
and your instruction is deep within me.”"
Psalms,40,9,"I proclaim righteousness in the great assembly;
see, I do not keep my mouth closed  —
as you know, LORD."
Psalms,40,10,"I did not hide your righteousness in my heart;
I spoke about your faithfulness and salvation;
I did not conceal your constant love and truth
from the great assembly."
Psalms,40,11,"LORD, you do not withhold your compassion from me.
Your constant love and truth will always guard me."
Psalms,40,12,"For troubles without number have surrounded me;
my iniquities have overtaken me; I am unable to see.
They are more than the hairs of my head,
and my courage leaves me."
Psalms,40,13,"LORD, be pleased to rescue me;
hurry to help me, LORD."
Psalms,40,14,"Let those who intend to take my life
be disgraced and confounded.
Let those who wish me harm
be turned back and humiliated."
Psalms,40,15,"Let those who say to me, “Aha, aha!”
be appalled because of their shame."
Psalms,40,16,"Let all who seek you rejoice and be glad in you;
let those who love your salvation continually say,
“The LORD is great!”"
Psalms,40,17,"I am oppressed and needy;
may the Lord think of me.
You are my helper and my deliverer;
my God, do not delay."
Psalms,41,1,"Happy is one who is considerate of the poor;
the LORD will save him in a day of adversity."
Psalms,41,2,"The LORD will keep him and preserve him;
he will be blessed in the land.
You will not give him over to the desire of his enemies."
Psalms,41,3,"The LORD will sustain him on his sickbed;
you will heal him on the bed where he lies."
Psalms,41,4,"I said, “LORD, be gracious to me;
heal me, for I have sinned against you.”"
Psalms,41,5,"My enemies speak maliciously about me:
“When will he die and be forgotten?”"
Psalms,41,6,"When one of them comes to visit, he speaks deceitfully;
he stores up evil in his heart;
he goes out and talks."
Psalms,41,7,"All who hate me whisper together about me;
they plan to harm me."
Psalms,41,8,"“Something awful has overwhelmed him,
and he won’t rise again from where he lies!”"
Psalms,41,9,"Even my friend in whom I trusted,
one who ate my bread,
has raised his heel against me."
Psalms,41,10,"But you, LORD, be gracious to me and raise me up;
then I will repay them."
Psalms,41,11,"By this I know that you delight in me:
my enemy does not shout in triumph over me."
Psalms,41,12,"You supported me because of my integrity
and set me in your presence forever."
Psalms,41,13,"Blessed be the LORD God of Israel,
from everlasting to everlasting.
Amen and amen."
Psalms,42,1,"As a deer longs for flowing streams,
so I long for you, God."
Psalms,42,2,"I thirst for God, the living God.
When can I come and appear before God?"
Psalms,42,3,"My tears have been my food day and night,
while all day long people say to me,
“Where is your God?”"
Psalms,42,4,"I remember this as I pour out my heart:
how I walked with many,
leading the festive procession to the house of God,
with joyful and thankful shouts."
Psalms,42,5,"Why, my soul, are you so dejected?
Why are you in such turmoil?
Put your hope in God, for I will still praise him,
my Savior and my God."
Psalms,42,6,"I am deeply depressed;
therefore I remember you from the land of Jordan
and the peaks of Hermon, from Mount Mizar."
Psalms,42,7,"Deep calls to deep in the roar of your waterfalls;
all your breakers and your billows have swept over me."
Psalms,42,8,"The LORD will send his faithful love by day;
his song will be with me in the night —
a prayer to the God of my life."
Psalms,42,9,"I will say to God, my rock,
“Why have you forgotten me?
Why must I go about in sorrow
because of the enemy’s oppression?”"
Psalms,42,10,"My adversaries taunt me,
as if crushing my bones,
while all day long they say to me,
“Where is your God?”"
Psalms,42,11,"Why, my soul, are you so dejected?
Why are you in such turmoil?
Put your hope in God, for I will still praise him,
my Savior and my God."
Psalms,43,1,"Vindicate me, God, and champion my cause
against an unfaithful nation;
rescue me from the deceitful and unjust person."
Psalms,43,2,"For you are the God of my refuge.
Why have you rejected me?
Why must I go about in sorrow
because of the enemy’s oppression?"
Psalms,43,3,"Send your light and your truth; let them lead me.
Let them bring me to your holy mountain,
to your dwelling place."
Psalms,43,4,"Then I will come to the altar of God,
to God, my greatest joy.
I will praise you with the lyre,
God, my God."
Psalms,43,5,"Why, my soul, are you so dejected?
Why are you in such turmoil?
Put your hope in God, for I will still praise him,
my Savior and my God."
Psalms,44,1,"God, we have heard with our ears —
our ancestors have told us —
the work you accomplished in their days,
in days long ago"
Psalms,44,2,"In order to plant them,
you displaced the nations by your hand;
in order to settle them,
you brought disaster on the peoples."
Psalms,44,3,"For they did not take the land by their sword —
their arm did not bring them victory —
but by your right hand, your arm,
and the light of your face,
because you were favorable toward them."
Psalms,44,4,"You are my King, my God,
who ordains victories for Jacob."
Psalms,44,5,"Through you we drive back our foes;
through your name we trample our enemies."
Psalms,44,6,"For I do not trust in my bow,
and my sword does not bring me victory."
Psalms,44,7,"But you give us victory over our foes
and let those who hate us be disgraced."
Psalms,44,8,"We boast in God all day long;
we will praise your name forever. Selah"
Psalms,44,9,"But you have rejected and humiliated us;
you do not march out with our armies."
Psalms,44,10,"You make us retreat from the foe,
and those who hate us
have taken plunder for themselves."
Psalms,44,11,"You hand us over to be eaten like sheep
and scatter us among the nations."
Psalms,44,12,"You sell your people for nothing;
you make no profit from selling them."
Psalms,44,13,"You make us an object of reproach to our neighbors,
a source of mockery and ridicule to those around us."
Psalms,44,14,"You make us a joke among the nations,
a laughingstock among the peoples."
Psalms,44,15,"My disgrace is before me all day long,
and shame has covered my face"
Psalms,44,16,"because of the taunts of the scorner and reviler,
because of the enemy and avenger."
Psalms,44,17,"All this has happened to us,
but we have not forgotten you
or betrayed your covenant."
Psalms,44,18,"Our hearts have not turned back;
our steps have not strayed from your path."
Psalms,44,19,"But you have crushed us in a haunt of jackals
and have covered us with deepest darkness."
Psalms,44,20,"If we had forgotten the name of our God
and spread out our hands to a foreign god"
Psalms,44,21,"wouldn’t God have found this out,
since he knows the secrets of the heart?"
Psalms,44,22,"Because of you we are being put to death all day long;
we are counted as sheep to be slaughtered."
Psalms,44,23,"Wake up, Lord! Why are you sleeping?
Get up! Don’t reject us forever!"
Psalms,44,24,"Why do you hide
and forget our affliction and oppression?"
Psalms,44,25,"For we have sunk down to the dust;
our bodies cling to the ground."
Psalms,44,26,"Rise up! Help us!
Redeem us because of your faithful love."
Psalms,45,1,"My heart is moved by a noble theme
as I recite my verses to the king;
my tongue is the pen of a skillful writer."
Psalms,45,2,"You are the most handsome of men;
grace flows from your lips.
Therefore God has blessed you forever."
Psalms,45,3,"Mighty warrior, strap your sword at your side.
In your majesty and splendor  "
Psalms,45,4,"in your splendor ride triumphantly
in the cause of truth, humility, and justice.
May your right hand show your awe-inspiring acts."
Psalms,45,5,"Your sharpened arrows pierce the hearts of the king’s enemies;
the peoples fall under you."
Psalms,45,6,"Your throne, God, is forever and ever;
the scepter of your kingdom is a scepter of justice."
Psalms,45,7,"You love righteousness and hate wickedness;
therefore God, your God, has anointed you with the oil of joy
more than your companions."
Psalms,45,8,"Myrrh, aloes, and cassia perfume all your garments;
from ivory palaces harps bring you joy."
Psalms,45,9,"Kings’ daughters are among your honored women;
the queen, adorned with gold from Ophir,
stands at your right hand."
Psalms,45,10,"Listen, daughter, pay attention and consider:
Forget your people and your father’s house"
Psalms,45,11,"and the king will desire your beauty.
Bow down to him, for he is your lord."
Psalms,45,12,"The daughter of Tyre, the wealthy people,
will seek your favor with gifts."
Psalms,45,13,"In her chamber, the royal daughter is all glorious,
her clothing embroidered with gold."
Psalms,45,14,"In colorful garments she is led to the king;
after her, the virgins, her companions, are brought to you."
Psalms,45,15,"They are led in with gladness and rejoicing;
they enter the king’s palace."
Psalms,45,16,"Your sons will succeed your ancestors;
you will make them princes throughout the land."
Psalms,45,17,"I will cause your name to be remembered for all generations;
therefore the peoples will praise you forever and ever."
Psalms,46,1,"God is our refuge and strength,
a helper who is always found
in times of trouble."
Psalms,46,2,"Therefore we will not be afraid,
though the earth trembles
and the mountains topple
into the depths of the seas"
Psalms,46,3,"though its water roars and foams
and the mountains quake with its turmoil. Selah"
Psalms,46,4,"There is a river —
its streams delight the city of God,
the holy dwelling place of the Most High."
Psalms,46,5,"God is within her; she will not be toppled.
God will help her when the morning dawns."
Psalms,46,6,"Nations rage, kingdoms topple;
the earth melts when he lifts his voice."
Psalms,46,7,"The LORD of Armies is with us;
the God of Jacob is our stronghold. Selah"
Psalms,46,8,"Come, see the works of the LORD,
who brings devastation on the earth."
Psalms,46,9,"He makes wars cease throughout the earth.
He shatters bows and cuts spears to pieces;
he sets wagons ablaze."
Psalms,46,10,"“Stop fighting, and know that I am God,
exalted among the nations, exalted on the earth.”"
Psalms,46,11,"The LORD of Armies is with us;
the God of Jacob is our stronghold. Selah"
Psalms,47,1,"Clap your hands, all you peoples;
shout to God with a jubilant cry."
Psalms,47,2,"For the LORD, the Most High, is awe-inspiring,
a great King over the whole earth."
Psalms,47,3,"He subdues peoples under us
and nations under our feet."
Psalms,47,4,"He chooses for us our inheritance —
the pride of Jacob, whom he loves. Selah"
Psalms,47,5,"God ascends among shouts of joy,
the LORD, with the sound of a ram’s horn."
Psalms,47,6,"Sing praise to God, sing praise;
sing praise to our King, sing praise!"
Psalms,47,7,"Sing a song of wisdom,
for God is King of the whole earth."
Psalms,47,8,"God reigns over the nations;
God is seated on his holy throne."
Psalms,47,9,"The nobles of the peoples have assembled
with the people of the God of Abraham.
For the leaders of the earth belong to God;
he is greatly exalted."
Psalms,48,1,"The LORD is great and highly praised
in the city of our God.
His holy mountain"
Psalms,48,2,"rising splendidly,
is the joy of the whole earth.
Mount Zion — the summit of Zaphon — 
is the city of the great King."
Psalms,48,3,"God is known as a stronghold
in its citadels."
Psalms,48,4,"Look! The kings assembled;
they advanced together."
Psalms,48,5,"They looked and froze with fear;
they fled in terror."
Psalms,48,6,"Trembling seized them there,
agony like that of a woman in labor"
Psalms,48,7,"as you wrecked the ships of Tarshish
with the east wind."
Psalms,48,8,"Just as we heard, so we have seen
in the city of the LORD of Armies,
in the city of our God;
God will establish it forever. Selah"
Psalms,48,9,"God, within your temple,
we contemplate your faithful love."
Psalms,48,10,"Like your name, God, so your praise
reaches to the ends of the earth;
your right hand is filled with justice."
Psalms,48,11,"Mount Zion is glad.
Judah’s villages rejoice
because of your judgments."
Psalms,48,12,"Go around Zion, encircle it;
count its towers"
Psalms,48,13,"note its ramparts; tour its citadels
so that you can tell a future generation"
Psalms,48,14,"“This God, our God forever and ever —
he will always lead us.”"
Psalms,49,1,"Hear this, all you peoples;
listen, all who inhabit the world"
Psalms,49,2,"both low and high,
rich and poor together."
Psalms,49,3,"My mouth speaks wisdom;
my heart’s meditation brings understanding."
Psalms,49,4,"I turn my ear to a proverb;
I explain my riddle with a lyre."
Psalms,49,5,"Why should I fear in times of trouble?
The iniquity of my foes surrounds me."
Psalms,49,6,"They trust in their wealth
and boast of their abundant riches."
Psalms,49,7,"Yet these cannot redeem a person
or pay his ransom to God  "
Psalms,49,8,"since the price of redeeming him is too costly,
one should forever stop trying  "
Psalms,49,9,"so that he may live forever
and not see the Pit."
Psalms,49,10,"For one can see that the wise die;
the foolish and stupid also pass away.
Then they leave their wealth to others."
Psalms,49,11,"Their graves are their permanent homes,
their dwellings from generation to generation,
though they have named estates after themselves."
Psalms,49,12,"But despite his assets, mankind will not last;
he is like the animals that perish."
Psalms,49,13,"This is the way of those who are arrogant,
and of their followers,
who approve of their words. Selah"
Psalms,49,14,"Like sheep they are headed for Sheol;
Death will shepherd them.
The upright will rule over them in the morning,
and their form will waste away in Sheol,
far from their lofty abode."
Psalms,49,15,"But God will redeem me
from the power of Sheol,
for he will take me. Selah"
Psalms,49,16,"Do not be afraid when a person gets rich,
when the wealth of his house increases."
Psalms,49,17,"For when he dies, he will take nothing at all;
his wealth will not follow him down."
Psalms,49,18,"Though he blesses himself during his lifetime —
and you are acclaimed when you do well for yourself  "
Psalms,49,19,"he will go to the generation of his ancestors;
they will never see the light."
Psalms,49,20,"Mankind, with his assets
but without understanding,
is like the animals that perish."
Psalms,50,1,"The Mighty One, God, the LORD, speaks;
he summons the earth
from the rising of the sun to its setting."
Psalms,50,2,"From Zion, the perfection of beauty,
God appears in radiance."
Psalms,50,3,"Our God is coming; he will not be silent!
Devouring fire precedes him,
and a storm rages around him."
Psalms,50,4,"On high, he summons heaven and earth
in order to judge his people"
Psalms,50,5,"“Gather my faithful ones to me,
those who made a covenant with me by sacrifice.”"
Psalms,50,6,"The heavens proclaim his righteousness,
for God is the Judge. Selah"
Psalms,50,7,"“Listen, my people, and I will speak;
I will testify against you, Israel.
I am God, your God."
Psalms,50,8,"I do not rebuke you for your sacrifices
or for your burnt offerings,
which are continually before me."
Psalms,50,9,"I will not take a bull from your household
or male goats from your pens"
Psalms,50,10,"for every animal of the forest is mine,
the cattle on a thousand hills."
Psalms,50,11,"I know every bird of the mountains,
and the creatures of the field are mine."
