Joshua,1,1-9,"After the death of Moses the servant of GOD, GOD spoke to Joshua, Moses’ assistant:
“Moses my servant is dead. Get going. Cross this Jordan River, you and all the people. Cross to the country I’m giving to the People of Israel. I’m giving you every square inch of the land you set your foot on—just as I promised Moses. From the wilderness and this Lebanon east to the Great River, the Euphrates River—all the Hittite country—and then west to the Great Sea. It’s all yours. All your life, no one will be able to hold out against you. In the same way I was with Moses, I’ll be with you. I won’t give up on you; I won’t leave you. Strength! Courage! You are going to lead this people to inherit the land that I promised to give their ancestors. Give it everything you have, heart and soul. Make sure you carry out The Revelation that Moses commanded you, every bit of it. Don’t get off track, either left or right, so as to make sure you get to where you’re going. And don’t for a minute let this Book of The Revelation be out of mind. Ponder and meditate on it day and night, making sure you practice everything written in it. Then you’ll get where you’re going; then you’ll succeed. Haven’t I commanded you? Strength! Courage! Don’t be timid; don’t get discouraged. GOD, your God, is with you every step you take.”"
Joshua,1,10-11,"Then Joshua gave orders to the people’s leaders: “Go through the camp and give this order to the people: ‘Pack your bags. In three days you will cross this Jordan River to enter and take the land GOD, your God, is giving you to possess.’”"
Joshua,1,12-15,"Then Joshua addressed the Reubenites, the Gadites, and the half-tribe of Manasseh. He said, “Remember what Moses the servant of GOD commanded you: GOD, your God, gives you rest and he gives you this land. Your wives, your children, and your livestock can stay here east of the Jordan, the country Moses gave you; but you, tough soldiers all, must cross the River in battle formation, leading your brothers, helping them until GOD, your God, gives your brothers a place of rest just as he has done for you. They also will take possession of the land that GOD, your God, is giving them. Then you will be free to return to your possession, given to you by Moses the servant of GOD, across the Jordan to the east.”"
Joshua,1,16-18,"They answered Joshua: “Everything you commanded us, we’ll do. Wherever you send us, we’ll go. We obeyed Moses to the letter; we’ll also obey you—we just pray that GOD, your God, will be with you as he was with Moses. Anyone who questions what you say and refuses to obey whatever you command him will be put to death. Strength! Courage!”"
Joshua,2,1,Joshua son of Nun secretly sent out from Shittim two men as spies: “Go. Look over the land. Check out Jericho.” They left and arrived at the house of a harlot named Rahab and stayed there.
Joshua,2,2,"The king of Jericho was told, “We’ve just learned that men arrived tonight to spy out the land. They’re from the People of Israel.”"
Joshua,2,3,The king of Jericho sent word to Rahab: “Bring out the men who came to you to stay the night in your house. They’re spies; they’ve come to spy out the whole country.”
Joshua,2,4-7,"The woman had taken the two men and hidden them. She said, “Yes, two men did come to me, but I didn’t know where they’d come from. At dark, when the gate was about to be shut, the men left. But I have no idea where they went. Hurry up! Chase them—you can still catch them!” (She had actually taken them up on the roof and hidden them under the stalks of flax that were spread out for her on the roof.) So the men gave chase down the Jordan road toward the fords. As soon as they were gone, the gate was shut."
Joshua,2,8-11,"Before the spies were down for the night, the woman came up to them on the roof and said, “I know that GOD has given you the land. We’re all afraid. Everyone in the country feels hopeless. We heard how GOD dried up the waters of the Red Sea before you when you left Egypt, and what he did to the two Amorite kings east of the Jordan, Sihon and Og, whom you put under a holy curse and destroyed. We heard it and our hearts sank. We all had the wind knocked out of us. And all because of you, you and GOD, your God, God of the heavens above and God of the earth below."
Joshua,2,12-13,"“Now promise me by GOD. I showed you mercy; now show my family mercy. And give me some tangible proof, a guarantee of life for my father and mother, my brothers and sisters—everyone connected with my family. Save our souls from death!”"
Joshua,2,14,"“Our lives for yours!” said the men. “But don’t tell anyone our business. When GOD turns this land over to us, we’ll do right by you in loyal mercy.”"
Joshua,2,15-16,"She lowered them down out a window with a rope because her house was on the city wall to the outside. She told them, “Run for the hills so your pursuers won’t find you. Hide out for three days and give your pursuers time to return. Then get on your way.”"
Joshua,2,17-20,"The men told her, “In order to keep this oath you made us swear, here is what you must do: Hang this red rope out the window through which you let us down and gather your entire family with you in your house—father, mother, brothers, and sisters. Anyone who goes out the doors of your house into the street and is killed, it’s his own fault—we aren’t responsible. But for everyone within the house we take full responsibility. If anyone lays a hand on one of them, it’s our fault. But if you tell anyone of our business here, the oath you made us swear is canceled—we’re no longer responsible.”"
Joshua,2,21,"She said, “If that’s what you say, that’s the way it is,” and sent them off. They left and she hung the red rope out the window."
Joshua,2,22,They headed for the hills and stayed there for three days until the pursuers had returned. The pursuers had looked high and low but found nothing.
Joshua,2,23-24,"The men headed back. They came down out of the hills, crossed the river, and returned to Joshua son of Nun and reported all their experiences. They told Joshua, “Yes! GOD has given the whole country to us. Everybody there is in a state of panic because of us.”"
Joshua,3,1-4,"Joshua was up early and on his way from Shittim with all the People of Israel with him. He arrived at the Jordan and camped before crossing over. After three days, leaders went through the camp and gave out orders to the people: “When you see the Covenant-Chest of GOD, your God, carried by the Levitical priests, start moving. Follow it. Make sure you keep a proper distance between you and it, about half a mile—be sure now to keep your distance!—and you’ll see clearly the route to take. You’ve never been on this road before.”"
Joshua,3,5,Then Joshua addressed the people: “Sanctify yourselves. Tomorrow GOD will work miracle-wonders among you.”
Joshua,3,6,"Joshua instructed the priests, “Take up the Chest of the Covenant and step out before the people.” So they took it up and processed before the people."
Joshua,3,7-8,"GOD said to Joshua, “This very day I will begin to make you great in the eyes of all Israel. They’ll see for themselves that I’m with you in the same way that I was with Moses. You will command the priests who are carrying the Chest of the Covenant: ‘When you come to the edge of the Jordan’s waters, stand there on the river bank.’”"
Joshua,3,9-13,"Then Joshua addressed the People of Israel: “Attention! Listen to what GOD, your God, has to say. This is how you’ll know that God is alive among you—he will completely dispossess before you the Canaanites, Hittites, Hivites, Perizzites, Girgashites, Amorites, and Jebusites. Look at what’s before you: the Chest of the Covenant. Think of it—the Master of the entire earth is crossing the Jordan as you watch. Now take twelve men from the tribes of Israel, one man from each tribe. When the soles of the feet of the priests carrying the Chest of GOD, Master of all the earth, touch the Jordan’s water, the flow of water will be stopped—the water coming from upstream will pile up in a heap.”"
Joshua,3,14-16,"And that’s what happened. The people left their tents to cross the Jordan, led by the priests carrying the Chest of the Covenant. When the priests got to the Jordan and their feet touched the water at the edge (the Jordan overflows its banks throughout the harvest), the flow of water stopped. It piled up in a heap—a long way off—at Adam, which is near Zarethan. The river went dry all the way down to the Arabah Sea (the Salt Sea). And the people crossed, facing Jericho."
Joshua,3,17,"And there they stood; those priests carrying the Chest of the Covenant stood firmly planted on dry ground in the middle of the Jordan while all Israel crossed on dry ground. Finally the whole nation was across the Jordan, and not one wet foot."
Joshua,4,1-3,"When the whole nation was finally across, GOD spoke to Joshua: “Select twelve men from the people, a man from each tribe, and tell them, ‘From right here, the middle of the Jordan where the feet of the priests are standing firm, take twelve stones. Carry them across with you and set them down in the place where you camp tonight.’”"
Joshua,4,4-7,"Joshua called out the twelve men whom he selected from the People of Israel, one man from each tribe. Joshua directed them, “Cross to the middle of the Jordan and take your place in front of the Chest of GOD, your God. Each of you heft a stone to your shoulder, a stone for each of the tribes of the People of Israel, so you’ll have something later to mark the occasion. When your children ask you, ‘What are these stones to you?’ you’ll say, ‘The flow of the Jordan was stopped in front of the Chest of the Covenant of GOD as it crossed the Jordan—stopped in its tracks. These stones are a permanent memorial for the People of Israel.’”"
Joshua,4,8-9,"The People of Israel did exactly as Joshua commanded: They took twelve stones from the middle of the Jordan—a stone for each of the twelve tribes, just as GOD had instructed Joshua—carried them across with them to the camp, and set them down there. Joshua set up the twelve stones taken from the middle of the Jordan that had marked the place where the priests who carried the Chest of the Covenant had stood. They are still there today."
Joshua,4,10-11,"The priests carrying the Chest continued standing in the middle of the Jordan until everything GOD had instructed Joshua to tell the people to do was done (confirming what Moses had instructed Joshua). The people crossed; no one dawdled. When the crossing of all the people was complete, they watched as the Chest of the Covenant and the priests crossed over."
Joshua,4,12-13,"The Reubenites, Gadites, and the half-tribe of Manasseh had crossed over in battle formation in front of the People of Israel, obedient to Moses’ instructions. All told, about forty thousand armed soldiers crossed over before GOD to the plains of Jericho, ready for battle."
Joshua,4,14,"GOD made Joshua great that day in the sight of all Israel. They were in awe of him just as they had been in awe of Moses all his life.
* * *"
Joshua,4,15-16,"GOD told Joshua, “Command the priests carrying the Chest of The Testimony to come up from the Jordan.”"
Joshua,4,17,"Joshua commanded the priests, “Come up out of the Jordan.”"
Joshua,4,18,"They did it. The priests carrying GOD’s Chest of the Covenant came up from the middle of the Jordan. As soon as the soles of the priests’ feet touched dry land, the Jordan’s waters resumed their flow within the banks, just as before."
Joshua,4,19-22,"The people came up out of the Jordan on the tenth day of the first month. They set up camp at The Gilgal (The Circle) to the east of Jericho. Joshua erected a monument at The Gilgal, using the twelve stones that they had taken from the Jordan. And then he told the People of Israel, “In the days to come, when your children ask their fathers, ‘What are these stones doing here?’ tell your children this: ‘Israel crossed over this Jordan on dry ground.’"
Joshua,4,23-24,"“Yes, GOD, your God, dried up the Jordan’s waters for you until you had crossed, just as GOD, your God, did at the Red Sea, which had dried up before us until we had crossed. This was so that everybody on earth would recognize how strong GOD’s rescuing hand is and so that you would hold GOD in solemn reverence always.”
* * *"
Joshua,5,1,"When all the Amorite kings west of the Jordan and the Canaanite kings along the seacoast heard how GOD had stopped the Jordan River before the People of Israel until they had crossed over, their hearts sank; the courage drained out of them just thinking about the People of Israel."
Joshua,5,2-3,"At that time GOD said to Joshua, “Make stone knives and circumcise the People of Israel a second time.” So Joshua made stone knives and circumcised the People of Israel at Foreskins Hill."
Joshua,5,4-7,"This is why Joshua conducted the circumcision. All the males who had left Egypt, the soldiers, had died in the wilderness on the journey out of Egypt. All the people who had come out of Egypt, of course, had been circumcised, but all those born in the wilderness along the way since leaving Egypt had not been. The fact is that the People of Israel had walked through that wilderness for forty years until the entire nation died out, all the men of military age who had come out of Egypt but had disobeyed the call of GOD. GOD vowed that these would never lay eyes on the land GOD had solemnly promised their ancestors to give us, a land flowing with milk and honey. But their children had replaced them. These are the ones Joshua circumcised. They had never been circumcised; no one had circumcised them along the way."
Joshua,5,8,"When they had completed the circumcising of the whole nation, they stayed where they were in camp until they were healed."
Joshua,5,9,"GOD said to Joshua, “Today I have rolled away the reproach of Egypt.” That’s why the place is called The Gilgal. It’s still called that.
* * *"
Joshua,5,10,The People of Israel continued to camp at The Gilgal. They celebrated the Passover on the evening of the fourteenth day of the month on the plains of Jericho.
Joshua,5,11-12,"Right away, the day after the Passover, they started eating the produce of that country, unraised bread and roasted grain. And then no more manna; the manna stopped. As soon as they started eating food grown in the land, there was no more manna for the People of Israel. That year they ate from the crops of Canaan.
* * *"
Joshua,5,13,"And then this, while Joshua was there near Jericho: He looked up and saw right in front of him a man standing, holding his drawn sword. Joshua stepped up to him and said, “Whose side are you on—ours or our enemies’?”"
Joshua,5,14,"He said, “Neither. I’m commander of GOD’s army. I’ve just arrived.” Joshua fell, face to the ground, and worshiped. He asked, “What orders does my Master have for his servant?”"
Joshua,5,15,"GOD’s army commander ordered Joshua, “Take your sandals off your feet. The place you are standing is holy.”
Joshua did it."
Joshua,6,1,"Jericho was shut up tight as a drum because of the People of Israel: no one going in, no one coming out."
Joshua,6,2-5,"GOD spoke to Joshua, “Look sharp now. I’ve already given Jericho to you, along with its king and its elite forces. Here’s what you are to do: March around the city, all your soldiers. Circle the city once. Repeat this for six days. Have seven priests carry seven ram’s horn trumpets in front of the Chest. On the seventh day march around the city seven times, the priests blowing away on the trumpets. And then, a long blast on the ram’s horn—when you hear that, all the people are to shout at the top of their lungs. The city wall will collapse at once. All the people are to enter, every man straight on in.”"
Joshua,6,6,"So Joshua son of Nun called the priests and told them, “Take up the Chest of the Covenant. Seven priests are to carry seven ram’s horn trumpets leading GOD’s Chest.”"
Joshua,6,7,"Then he told the people, “Set out! March around the city. Have the armed guard march before the Chest of GOD.”"
Joshua,6,8-9,"And it happened. Joshua spoke, the people moved: Seven priests with their seven ram’s horn trumpets set out before GOD. They blew the trumpets, leading GOD’s Chest of the Covenant. The armed guard marched ahead of the trumpet-blowing priests; the rear guard was marching after the Chest, marching and blowing their trumpets."
Joshua,6,10,"Joshua had given orders to the people, “Don’t shout. In fact, don’t even speak—not so much as a whisper until you hear me say, ‘Shout!’—then shout away!”"
Joshua,6,11-13,"He sent the Chest of GOD on its way around the city. It circled once, came back to camp, and stayed for the night. Joshua was up early the next morning and the priests took up the Chest of GOD. The seven priests carrying the seven ram’s horn trumpets marched before the Chest of GOD, marching and blowing the trumpets, with the armed guard marching before and the rear guard marching after. Marching and blowing of trumpets!"
Joshua,6,14,On the second day they again circled the city once and returned to camp. They did this six days.
Joshua,6,15-17,"When the seventh day came, they got up early and marched around the city this same way but seven times—yes, this day they circled the city seven times. On the seventh time around the priests blew the trumpets and Joshua signaled the people, “Shout!—GOD has given you the city! The city and everything in it is under a holy curse and offered up to GOD.
“Except for Rahab the harlot—she is to live, she and everyone in her house with her, because she hid the agents we sent."
Joshua,6,18-19,"“As for you, watch yourselves in the city under holy curse. Be careful that you don’t covet anything in it and take something that’s cursed, endangering the camp of Israel with the curse and making trouble for everyone. All silver and gold, all vessels of bronze and iron are holy to GOD. Put them in GOD’s treasury.”"
Joshua,6,20,"The priests blew the trumpets.
When the people heard the blast of the trumpets, they gave a thunderclap shout. The wall fell at once. The people rushed straight into the city and took it."
Joshua,6,21,"They put everything in the city under the holy curse, killing man and woman, young and old, ox and sheep and donkey."
Joshua,6,22-24,"Joshua ordered the two men who had spied out the land, “Enter the house of the harlot and rescue the woman and everyone connected with her, just as you promised her.” So the young spies went in and brought out Rahab, her father, mother, and brothers—everyone connected with her. They got the whole family out and gave them a place outside the camp of Israel. But they burned down the city and everything in it, except for the gold and silver and the bronze and iron vessels—all that they put in the treasury of GOD’s house."
Joshua,6,25,But Joshua let Rahab the harlot live—Rahab and her father’s household and everyone connected to her. She is still alive and well in Israel because she hid the agents whom Joshua sent to spy out Jericho.
Joshua,6,26,"Joshua swore a solemn oath at that time:
Cursed before GOD is the man
who sets out to rebuild this city Jericho.
He’ll pay for the foundation with his firstborn son,
he’ll pay for the gates with his youngest son."
Joshua,6,27,GOD was with Joshua. He became famous all over the land.
Joshua,7,1,"Then the People of Israel violated the holy curse. Achan son of Carmi, the son of Zabdi, the son of Zerah of the tribe of Judah, took some of the cursed things. GOD became angry with the People of Israel."
Joshua,7,2,"Joshua sent men from Jericho to Ai (The Ruin), which is near Beth Aven just east of Bethel. He instructed them, “Go up and spy out the land.” The men went up and spied out Ai."
Joshua,7,3,"They returned to Joshua and reported, “Don’t bother sending a lot of people—two or three thousand men are enough to defeat Ai. Don’t wear out the whole army; there aren’t that many people there.”"
Joshua,7,4-5,"So three thousand men went up—and then fled in defeat before the men of Ai! The men of Ai killed thirty-six—chased them from the city gate as far as The Quarries, killing them at the descent. The heart of the people sank, all spirit knocked out of them."
Joshua,7,6,"Joshua ripped his clothes and fell on his face to the ground before the Chest of GOD, he and the leaders throwing dirt on their heads, prostrate until evening."
Joshua,7,7-9,"Joshua said, “Oh, oh, oh . . . Master, GOD. Why did you insist on bringing this people across the Jordan? To make us victims of the Amorites? To wipe us out? Why didn’t we just settle down on the east side of the Jordan? Oh, Master, what can I say after this, after Israel has been run off by its enemies? When the Canaanites and all the others living here get wind of this, they’ll gang up on us and make short work of us—and then how will you keep up your reputation?”"
Joshua,7,10-12,"GOD said to Joshua, “Get up. Why are you groveling? Israel has sinned: They’ve broken the covenant I commanded them; they’ve taken forbidden plunder—stolen and then covered up the theft, hoarding it up with their own stuff. The People of Israel can no longer look their enemies in the eye—they themselves are plunder. I can’t continue with you if you don’t rid yourselves of the cursed things."
Joshua,7,13,"“So get started. Purify the people. Tell them: Get ready for tomorrow by purifying yourselves. For this is what GOD, the God of Israel, says: There are cursed things in the camp. You won’t be able to face your enemies until you have gotten rid of these cursed things."
Joshua,7,14-15,"“First thing in the morning you will be called up by tribes. The tribe GOD names will come up clan by clan; the clan GOD names will come up family by family; and the family GOD names will come up man by man. The person found with the cursed things will be burned, he and everything he has, because he broke GOD’s covenant and did this despicable thing in Israel.”"
Joshua,7,16-18,"Joshua was up at the crack of dawn and called Israel up tribe by tribe. The tribe of Judah was singled out. Then he called up the clans and singled out the Zerahites. He called up the Zerahite families and singled out the Zabdi family. He called up the family members one by one and singled out Achan son of Carmi, the son of Zabdi, the son of Zerah of the tribe of Judah."
Joshua,7,19,"Joshua spoke to Achan, “My son, give glory to GOD, the God of Israel. Make your confession to him. Tell me what you did. Don’t keep back anything from me.”"
Joshua,7,20-21,"Achan answered Joshua, “It’s true. I sinned against GOD, the God of Israel. This is how I did it. In the plunder I spotted a beautiful Shinar robe, two hundred shekels of silver, and a fifty-shekel bar of gold, and I coveted and took them. They are buried in my tent with the silver at the bottom.”"
Joshua,7,22-23,"Joshua sent off messengers. They ran to the tent. And there it was, buried in the tent with the silver at the bottom. They took the stuff from the tent and brought it to Joshua and to all the People of Israel and spread it out before GOD."
Joshua,7,24,"Joshua took Achan son of Zerah, took the silver, the robe, the gold bar, his sons and daughters, his ox, donkey, sheep, and tent—everything connected with him. All Israel was there. They led them off to the Valley of Achor (Trouble Valley)."
Joshua,7,25-26,"Joshua said, “Why have you troubled us? GOD will now trouble you. Today!” And all Israel stoned him—burned him with fire and stoned him with stones. They piled a huge pile of stones over him. It’s still there. Only then did GOD turn from his hot anger. That’s how the place came to be called Trouble Valley right up to the present time."
Joshua,8,1,"GOD said to Joshua, “Don’t be timid and don’t so much as hesitate. Take all your soldiers with you and go back to Ai. I have turned the king of Ai over to you—his people, his city, and his land."
Joshua,8,2,“Do to Ai and its king what you did to Jericho and its king. Only this time you may plunder its stuff and cattle to your heart’s content. Set an ambush behind the city.”
Joshua,8,3-8,"Joshua and all his soldiers got ready to march on Ai. Joshua chose thirty thousand men, tough, seasoned fighters, and sent them off at night with these orders: “Pay me all of your attention now. Lie in ambush behind the city. Get as close as you can. Stay alert. I and the troops with me will approach the city head-on. When they come out to meet us just as before, we’ll turn and run. They’ll come after us, leaving the city. As we are off and running, they’ll say, ‘They’re running away just like the first time.’ That’s your signal to spring from your ambush and take the city. GOD, your God, will hand it to you on a platter. Once you have the city, burn it down. GOD says it, you do it. Go to it. I’ve given you your orders.”"
Joshua,8,9,"Joshua sent them off. They set their ambush and waited between Bethel and Ai, just west of Ai. Joshua spent the night with the people."
