Joshua,21,43-44,"And so GOD gave Israel the entire land that he had solemnly vowed to give to their ancestors. They took possession of it and made themselves at home in it. And GOD gave them rest on all sides, as he had also solemnly vowed to their ancestors. Not a single one of their enemies was able to stand up to them—GOD handed over all their enemies to them."
Joshua,21,45,"Not one word failed from all the good words GOD spoke to the house of Israel. Everything came out right.
* * *"
Joshua,22,1-5,"Then Joshua called together the Reubenites, Gadites, and the half-tribe of Manasseh. He said: “You have carried out everything Moses the servant of GOD commanded you, and you have obediently done everything I have commanded you. All this time and right down to this very day you have not abandoned your brothers; you’ve shouldered the task laid on you by GOD, your God. And now GOD, your God, has given rest to your brothers just as he promised them. You’re now free to go back to your homes, the country of your inheritance that Moses the servant of GOD gave you on the other side of the Jordan. Only this: Be vigilant in keeping the Commandment and The Revelation that Moses the servant of GOD laid on you: Love GOD, your God, walk in all his ways, do what he’s commanded, embrace him, serve him with everything you are and have.”"
Joshua,22,6,"Then Joshua blessed them and sent them on their way. They went home. (To the half-tribe of Manasseh, Moses had assigned a share in Bashan. To the other half, Joshua assigned land with their brothers west of the Jordan.)"
Joshua,22,7,"Then Joshua blessed them and sent them on their way. They went home. (To the half-tribe of Manasseh, Moses had assigned a share in Bashan. To the other half, Joshua assigned land with their brothers west of the Jordan.)

* * *"
Joshua,22,8,"When Joshua sent them off to their homes, he blessed them. He said: “Go home. You’re going home rich—great herds of cattle, silver and gold, bronze and iron, huge piles of clothing. Share the wealth with your friends and families—all this plunder from your enemies!”
* * *"
Joshua,22,9,"The Reubenites, Gadites, and the half-tribe of Manasseh left the People of Israel at Shiloh in the land of Canaan to return to Gilead, the land of their possession, which they had taken under the command of Moses as ordered by GOD."
Joshua,22,10,"They arrived at Geliloth on the Jordan (touching on Canaanite land). There the Reubenites, Gadites, and the half-tribe of Manasseh built an altar on the banks of the Jordan—a huge altar!"
Joshua,22,11,"The People of Israel heard of it: “What’s this? The Reubenites, Gadites, and the half-tribe of Manasseh have built an altar facing the land of Canaan at Geliloth on the Jordan, across from the People of Israel!”"
Joshua,22,12-14,"When the People of Israel heard this, the entire congregation mustered at Shiloh to go to war against them. They sent Phinehas son of Eleazar the priest to the Reubenites, Gadites, and the half-tribe of Manasseh (that is, to the land of Gilead). Accompanying him were ten chiefs, one chief for each of the ten tribes, each the head of his ancestral family. They represented the military divisions of Israel."
Joshua,22,15-18,"They went to the Reubenites, Gadites, and the half-tribe of Manasseh and spoke to them: “The entire congregation of GOD wants to know: What is this violation against the God of Israel that you have committed, turning your back on GOD and building your own altar—a blatant act of rebellion against GOD? Wasn’t the crime of Peor enough for us? Why, to this day we aren’t rid of it, still living with the fallout of the plague on the congregation of GOD! Look at you—turning your back on GOD! If you rebel against GOD today, tomorrow he’ll vent his anger on all of us, the entire congregation of Israel."
Joshua,22,19-20,"“If you think the land of your possession isn’t holy enough but somehow contaminated, come back over to GOD’s possession, where GOD’s Dwelling is set up, and take your land there, but don’t rebel against GOD. And don’t rebel against us by building your own altar apart from the Altar of our GOD. When Achan son of Zerah violated the holy curse, didn’t anger fall on the whole congregation of Israel? He wasn’t the only one to die for his sin.”"
Joshua,22,21-22,"The Reubenites, Gadites, and the half-tribe of Manasseh replied to the heads of the tribes of Israel:
The God of Gods is GOD,
The God of Gods is GOD!"
Joshua,22,23,"“He knows and he’ll let Israel know if this is a rebellious betrayal of GOD. And if it is, don’t bother saving us. If we built ourselves an altar in rebellion against GOD, if we did it to present on it Whole-Burnt-Offerings or Grain-Offerings or to enact there sacrificial Peace-Offerings, let GOD decide."
Joshua,22,24-25,"“But that’s not it. We did it because we cared. We were anxious lest someday your children should say to our children, ‘You’re not connected with GOD, the God of Israel! GOD made the Jordan a boundary between us and you. You Reubenites and Gadites have no part in GOD.’ And then your children might cause our children to quit worshiping GOD."
Joshua,22,26,"“So we said to ourselves, ‘Let’s do something. Let’s build an altar—but not for Whole-Burnt-Offerings, not for sacrifices.’"
Joshua,22,27,"“We built this altar as a witness between us and you and our children coming after us, a witness to the Altar where we worship GOD in his Sacred Dwelling with our Whole-Burnt-Offerings and our sacrifices and our Peace-Offerings.
“This way, your children won’t be able to say to our children in the future, ‘You have no part in GOD.’"
Joshua,22,28,"“We said to ourselves, ‘If anyone speaks disparagingly to us or to our children in the future, we’ll say: Look at this model of GOD’s Altar which our ancestors made. It’s not for Whole-Burnt-Offerings, not for sacrifices. It’s a witness connecting us with you.’"
Joshua,22,29,“Rebelling against or turning our backs on GOD is the last thing on our minds right now. We never dreamed of building an altar for Whole-Burnt-Offerings or Grain-Offerings to rival the Altar of our GOD in front of his Sacred Dwelling.”
Joshua,22,30,"Phinehas the priest, all the heads of the congregation, and the heads of the military divisions of Israel who were also with him heard what the Reubenites, Gadites, and the half-tribe of Manasseh had to say. They were satisfied."
Joshua,22,31,"Priest Phinehas son of Eleazar said to Reuben, Gad, and Manasseh, “Now we’re convinced that GOD is present with us since you haven’t been disloyal to GOD in this matter. You saved the People of Israel from GOD’s discipline.”"
Joshua,22,32-33,"Then Priest Phinehas son of Eleazar left the Reubenites, Gadites, and the half-tribe of Manasseh (from Gilead) and, with the chiefs, returned to the land of Canaan to the People of Israel and gave a full report. They were pleased with the report. The People of Israel blessed God—there was no more talk of attacking and destroying the land in which the Reubenites and Gadites were living."
Joshua,22,34,"Reuben and Gad named the altar:
A Witness Between Us.
GOD Alone Is God."
Joshua,23,1-2,"A long time later, after GOD had given Israel rest from all their surrounding enemies, and Joshua was a venerable old man, Joshua called all Israel together—elders, chiefs, judges, and officers. Then he spoke to them"
Joshua,23,3,"“I’m an old man. I’ve lived a long time. You have seen everything that GOD has done to these nations because of you. He did it because he’s GOD, your God. He fought for you."
Joshua,23,4-5,"“Stay alert: I have assigned to you by lot these nations that remain as an inheritance to your tribes—these in addition to the nations I have already cut down—from the Jordan to the Great Sea in the west. GOD, your God, will drive them out of your path until there’s nothing left of them and you’ll take over their land just as GOD, your God, promised you."
Joshua,23,6-8,"“Now, stay strong and steady. Obediently do everything written in the Book of The Revelation of Moses—don’t miss a detail. Don’t get mixed up with the nations that are still around. Don’t so much as speak the names of their gods or swear by them. And by all means don’t worship or pray to them. Hold tight to GOD, your God, just as you’ve done up to now."
Joshua,23,9-10,"“GOD has driven out superpower nations before you. And up to now, no one has been able to stand up to you. Think of it—one of you, single-handedly, putting a thousand on the run! Because GOD is GOD, your God. Because he fights for you, just as he promised you."
Joshua,23,11-13,"“Now, vigilantly guard your souls: Love GOD, your God. Because if you wander off and start taking up with these remaining nations still among you (intermarry, say, and have other dealings with them), know for certain that GOD, your God, will not get rid of these nations for you. They’ll be nothing but trouble to you—horsewhips on your backs and sand in your eyes—until you’re the ones who will be driven out of this good land that GOD, your God, has given you."
Joshua,23,14,"“As you can see, I’m about to go the way we all end up going. Know this with all your heart, with everything in you, that not one detail has failed of all the good things GOD, your God, promised you. It has all happened. Nothing’s left undone—not so much as a word."
Joshua,23,15-16,"“But just as sure as everything good that GOD, your God, has promised has come true, so also GOD will bring to pass every bad thing until there’s nothing left of you in this good land that GOD has given you. If you leave the path of the Covenant of GOD, your God, that he commanded you, go off and serve and worship other gods, GOD’s anger will blaze out against you. In no time at all there’ll be nothing left of you, no sign that you’ve ever been in this good land he gave you.”"
Joshua,24,1-2,"Joshua called together all the tribes of Israel at Shechem. He called in the elders, chiefs, judges, and officers. They presented themselves before God. Then Joshua addressed all the people"
Joshua,24,3-6,"“This is what GOD, the God of Israel, says: A long time ago your ancestors, Terah and his sons Abraham and Nahor, lived to the east of the River Euphrates. They worshiped other gods. I took your ancestor Abraham from the far side of The River. I led him all over the land of Canaan and multiplied his descendants. I gave him Isaac. Then I gave Isaac Jacob and Esau. I let Esau have the mountains of Seir as home, but Jacob and his sons ended up in Egypt. I sent Moses and Aaron. I hit Egypt hard with plagues and then led you out of there. I brought your ancestors out of Egypt. You came to the sea, the Egyptians in hot pursuit with chariots and cavalry, to the very edge of the Red Sea!"
Joshua,24,7-10,"“Then they cried out for help to GOD. He put a cloud between you and the Egyptians and then let the sea loose on them. It drowned them.
“You watched the whole thing with your own eyes, what I did to Egypt. And then you lived in the wilderness for a long time. I brought you to the country of the Amorites, who lived east of the Jordan, and they fought you. But I fought for you and you took their land. I destroyed them for you. Then Balak son of Zippor made his appearance. He was the king of Moab. He got ready to fight Israel by sending for Balaam son of Beor to come and curse you. But I wouldn’t listen to Balaam—he ended up blessing you over and over! I saved you from him."
Joshua,24,11,"“You then crossed the Jordan and came to Jericho. The Jericho leaders ganged up on you as well as the Amorites, Perizzites, Canaanites, Hittites, Girgashites, Hivites, and Jebusites, but I turned them over to you."
Joshua,24,12,"“I sent the Hornet ahead of you. It drove out the two Amorite kings—did your work for you. You didn’t have to do a thing, not so much as raise a finger."
Joshua,24,13,"“I handed you a land for which you did not work, towns you did not build. And here you are now living in them and eating from vineyards and olive groves you did not plant."
Joshua,24,14,"“So now: Fear GOD. Worship him in total commitment. Get rid of the gods your ancestors worshiped on the far side of The River (the Euphrates) and in Egypt. You, worship GOD."
Joshua,24,15,"“If you decide that it’s a bad thing to worship GOD, then choose a god you’d rather serve—and do it today. Choose one of the gods your ancestors worshiped from the country beyond The River, or one of the gods of the Amorites, on whose land you’re now living. As for me and my family, we’ll worship GOD.”"
Joshua,24,16,"The people answered, “We’d never forsake GOD! Never! We’d never leave GOD to worship other gods."
Joshua,24,17-18,"“GOD is our God! He brought up our ancestors from Egypt and from slave conditions. He did all those great signs while we watched. He has kept his eye on us all along the roads we’ve traveled and among the nations we’ve passed through. Just for us he drove out all the nations, Amorites and all, who lived in the land.
“Count us in: We too are going to worship GOD. He’s our God.”"
Joshua,24,19-20,"Then Joshua told the people: “You can’t do it; you’re not able to worship GOD. He is a holy God. He is a jealous God. He won’t put up with your fooling around and sinning. When you leave GOD and take up the worship of foreign gods, he’ll turn right around and come down on you hard. He’ll put an end to you—and after all the good he has done for you!”"
Joshua,24,21,But the people told Joshua: “No! No! We worship GOD!”
Joshua,24,22,"And so Joshua addressed the people: “You are witnesses against yourselves that you have chosen GOD for yourselves—to worship him.”
And they said, “We are witnesses.”"
Joshua,24,23,"Joshua said, “Now get rid of all the foreign gods you have with you. Say an unqualified Yes to GOD, the God of Israel.”"
Joshua,24,24,"The people answered Joshua, “We will worship GOD. What he says, we’ll do.”"
Joshua,24,25-26,"Joshua completed a Covenant for the people that day there at Shechem. He made it official, spelling it out in detail. Joshua wrote out all the directions and regulations into the Book of The Revelation of God. Then he took a large stone and set it up under the oak that was in the holy place of GOD."
Joshua,24,27,Joshua spoke to all the people: “This stone is a witness against us. It has heard every word that GOD has said to us. It is a standing witness against you lest you cheat on your God.”
Joshua,24,28,"Then Joshua dismissed the people, each to his own place of inheritance.
* * *"
Joshua,24,29-30,"After all this, Joshua son of Nun, the servant of GOD, died. He was 110 years old. They buried him in the land of his inheritance at Timnath Serah in the mountains of Ephraim, north of Mount Gaash."
Joshua,24,31,"Israel served GOD through the lifetime of Joshua and of the elders who outlived him, who had themselves experienced all that GOD had done for Israel."
Joshua,24,32,"Joseph’s bones, which the People of Israel had brought from Egypt, they buried in Shechem in the plot of ground that Jacob had purchased from the sons of Hamor (who was the father of Shechem). He paid a hundred silver coins for it. It belongs to the inheritance of the family of Joseph."
Joshua,24,33,"Eleazar son of Aaron died. They buried him at Gibeah, which had been allotted to his son Phinehas in the mountains of Ephraim."
