Joshua,14,6-12,"The people of Judah came to Joshua at Gilgal. Caleb son of Jephunneh the Kenizzite spoke: “You’ll remember what GOD said to Moses the man of God concerning you and me back at Kadesh Barnea. I was forty years old when Moses the servant of GOD sent me from Kadesh Barnea to spy out the land. And I brought back an honest and accurate report. My companions who went with me discouraged the people, but I stuck to my guns, totally with GOD, my God. That was the day that Moses solemnly promised, ‘The land on which your feet have walked will be your inheritance, you and your children’s, forever. Yes, you have lived totally for GOD.’ Now look at me: GOD has kept me alive, as he promised. It is now forty-five years since GOD spoke this word to Moses, years in which Israel wandered in the wilderness. And here I am today, eighty-five years old! I’m as strong as I was the day Moses sent me out. I’m as strong as ever in battle, whether coming or going. So give me this hill country that GOD promised me. You yourself heard the report, that the Anakim were there with their great fortress cities. If GOD goes with me, I will drive them out, just as GOD said.”"
Joshua,14,13-14,"Joshua blessed him. He gave Hebron to Caleb son of Jephunneh as an inheritance. Hebron belongs to Caleb son of Jephunneh the Kenizzite still today, because he gave himself totally to GOD, the God of Israel."
Joshua,14,15,"The name of Hebron used to be Kiriath Arba, named after Arba, the greatest man among the Anakim.
And the land had rest from war."
Joshua,15,1,"The lot for the people of Judah, their clans, extended south to the border of Edom, to the wilderness of Zin in the extreme south."
Joshua,15,2-4,"The southern border ran from the tip of the Salt Sea south of The Tongue; it ran southward from Scorpions Pass, went around Zin and just south of Kadesh Barnea; then it ran past Hezron, ascended to Addar, and curved around to Karka; from there it passed along to Azmon, came out at the Brook of Egypt, ending at the Sea. This is the southern boundary."
Joshua,15,5-11,"The eastern boundary: the Salt Sea up to the mouth of the Jordan.
The northern boundary started at the shallows of the Sea at the mouth of the Jordan, went up to Beth Hoglah and around to the north of Beth Arabah and to the Stone of Bohan son of Reuben. The border then ascended to Debir from Trouble Valley and turned north toward Gilgal, which lies opposite Red Pass, just south of the gorge. The border then followed the Waters of En Shemesh and ended at En Rogel. The border followed the Valley of Ben Hinnom along the southern slope of the Jebusite ridge (that is, Jerusalem). It ascended to the top of the mountain opposite Hinnom Valley on the west, at the northern end of Rephaim Valley; the border then took a turn at the top of the mountain to the spring, the Waters of Nephtoah, and followed the valley out to Mount Ephron, turned toward Baalah (that is, Kiriath Jearim), took another turn west of Baalah to Mount Seir, curved around to the northern shoulder of Mount Jearim (that is, Kesalon), descended to Beth Shemesh, and crossed to Timnah. The border then went north to the ridge of Ekron, turned toward Shikkeron, passed along to Mount Baalah, and came out at Jabneel. The border ended at the Sea."
Joshua,15,12,"The western border: the coastline of the Great Sea.
This is the boundary around the people of Judah for their clans."
Joshua,15,13,"Joshua gave Caleb son of Jephunneh a section among the people of Judah, according to GOD’s command. He gave him Kiriath Arba, that is, Hebron. Arba was the ancestor of Anak."
Joshua,15,14-15,"Caleb drove out three Anakim from Hebron: Sheshai, Ahiman, and Talmai, all descendants of Anak. He marched up from there against the people of Debir. Debir used to be called Kiriath Sepher."
Joshua,15,16-17,"Caleb said, “Whoever attacks Kiriath Sepher and takes it, I’ll give my daughter Acsah to him as his wife.” Othniel son of Kenaz, Caleb’s brother, took it; so Caleb gave him his daughter Acsah as his wife."
Joshua,15,18-19,"When she arrived she got him
to ask for farmland from her father.
As she dismounted from her donkey
Caleb asked her, “What would you like?”
She said, “Give me a marriage gift.
You’ve given me desert land;
Now give me pools of water!”
And he gave her the upper and the lower pools.
* * *"
Joshua,15,20-32,"This is the inheritance of the tribe of the people of Judah, clan by clan.
The southern towns of the tribe of Judah in the Negev were near the boundary of Edom:
Kabzeel, Eder, Jagur,
Kinah, Dimonah, Adadah,
Kedesh, Hazor, Ithnan,
Ziph, Telem, Bealoth,
Hazor Hadattah, Kerioth Hezron (that is, Hazor),
Amam, Shema, Moladah,
Hazar Gaddah, Heshmon, Beth Pelet,
Hazar Shual, Beersheba, Biziothiah,
Baalah, Iim, Ezem,
Eltolad, Kesil, Hormah,
Ziklag, Madmannah, Sansannah,
Lebaoth, Shilhim, Ain, and Rimmon—
a total of twenty-nine towns and their villages."
Joshua,15,33-47,"In the Shephelah (the western foothills) there were:
Eshtaol, Zorah, Ashnah,
Zanoah, En Gannim, Tappuah, Enam,
Jarmuth, Adullam, Socoh, Azekah,
Shaaraim, Adithaim, and Gederah (or Gederothaim)—
fourteen towns and their villages.
Zenan, Hadashah, Migdal Gad,
Dilean, Mizpah, Joktheel,
Lachish, Bozkath, Eglon,
Cabbon, Lahmas, Kitlish,
Gederoth, Beth Dagon, Naamah, and Makkedah—
sixteen towns and their villages.
Libnah, Ether, Ashan,
Iphtah, Ashnah, Nezib,
Keilah, Aczib, and Mareshah—
nine towns and their villages.
Ekron with its towns and villages;
From Ekron, west to the sea, all that bordered Ashdod with its villages;
Ashdod with its towns and villages;
Gaza with its towns and villages all the way to the Brook of Egypt.
The Great Sea is the western border."
Joshua,15,48-60,"In the hill country:
Shamir, Jattir, Socoh,
Dannah, Kiriath Sannah (that is, Debir),
Anab, Eshtemoh, Anim,
Goshen, Holon, and Giloh—
eleven towns and their villages.
Arab, Dumah, Eshan,
Janim, Beth Tappuah, Aphekah,
Humtah, Kiriath Arba (that is, Hebron), and Zior—
nine towns and their villages.
Maon, Carmel, Ziph, Juttah,
Jezreel, Jokdeam, Zanoah,
Kain, Gibeah, and Timnah—
ten towns and their villages.
Halhul, Beth Zur, Gedor,
Maarath, Beth Anoth, and Eltekon—
six towns and their villages.
Kiriath Baal (that is, Kiriath Jearim) and Rabbah—
two towns and their villages."
Joshua,15,61-62,"In the wilderness:
Beth Arabah, Middin, Secacah,
Nibshan, the City of Salt, and En Gedi—
six towns and their villages."
Joshua,15,63,"The people of Judah couldn’t get rid of the Jebusites who lived in Jerusalem. The Jebusites stayed put, living alongside the people of Judah. They are still living there in Jerusalem."
Joshua,16,1-3,"The lot for the people of Joseph went from the Jordan near Jericho, east of the spring of Jericho, north through the desert mountains to Bethel. It went on from Bethel (that is, Luz) to the territory of the Arkites in Ataroth. It then descended westward to the territory of the Japhletites to the region of Lower Beth Horon and on to Gezer, ending at the Sea."
Joshua,16,4,"This is the region from which the people of Joseph—Manasseh and Ephraim—got their inheritance.
* * *"
Joshua,16,5-9,"Ephraim’s territory by clans:
The boundary of their inheritance went from Ataroth Addar in the east to Upper Beth Horon and then west to the Sea. From Micmethath on the north it turned eastward to Taanath Shiloh and passed along, still eastward, to Janoah. The border then descended from Janoah to Ataroth and Naarah; it touched Jericho and came out at the Jordan. From Tappuah the border went westward to the Brook Kanah and ended at the Sea. This was the inheritance of the tribe of Ephraim by clans, including the cities set aside for Ephraim within the inheritance of Manasseh—all those towns and their villages."
Joshua,16,10,"But they didn’t get rid of the Canaanites who were living in Gezer. Canaanites are still living among the people of Ephraim, but they are made to do forced labor.
* * *"
Joshua,17,1-2,"This is the lot that fell to the people of Manasseh, Joseph’s firstborn. (Gilead and Bashan had already been given to Makir, Manasseh’s firstborn and father of Gilead, because he was an outstanding fighter.) So the lot that follows went to the rest of the people of Manasseh and their clans, the clans of Abiezer, Helek, Asriel, Shechem, Hepher, and Shemida. These are the male descendants of Manasseh son of Joseph by their clans."
Joshua,17,3-4,"Zelophehad son of Hepher, the son of Gilead, the son of Makir, the son of Manasseh, had no sons, only daughters. Their names were Mahlah, Noah, Hoglah, Milcah, and Tirzah. They went to Eleazar the priest, Joshua son of Nun, and the leaders and said, “GOD commanded Moses to give us an inheritance among our kinsmen.” And Joshua did it; he gave them, as GOD commanded, an inheritance amid their father’s brothers."
Joshua,17,5-6,"Manasseh’s lot came to ten portions, in addition to the land of Gilead and Bashan on the other side of the Jordan, because Manasseh’s daughters got an inheritance along with his sons. The land of Gilead belonged to the rest of the people of Manasseh."
Joshua,17,7-10,"The boundary of Manasseh went from Asher all the way to Micmethath, just opposite Shechem, then ran southward to the people living at En Tappuah. (The land of Tappuah belonged to Manasseh, but Tappuah itself on the border of Manasseh belonged to the Ephraimites.) The boundary continued south to the Brook Kanah. (The cities there belonged to Ephraim although they lay among the cities of Manasseh.) The boundary of Manasseh ran north of the brook and ended at the Sea. The land to the south belonged to Ephraim; the land to the north to Manasseh, with the Sea as their western border; they meet Asher on the north and Issachar on the east."
Joshua,17,11,"Within Issachar and Asher, Manasseh also held Beth Shan, Ibleam, and the people of Dor, Endor, Taanach, and Megiddo, together with their villages, and the third in the list is Naphoth."
Joshua,17,12-13,"The people of Manasseh never were able to take over these towns—the Canaanites wouldn’t budge. But later, when the Israelites got stronger, they put the Canaanites to forced labor. But they never did get rid of them.
* * *"
Joshua,17,14,"The people of Joseph spoke to Joshua: “Why did you give us just one allotment, one solitary share? There are a lot of us, and growing—GOD has extravagantly blessed us.”"
Joshua,17,15,"Joshua responded, “Since there are so many of you, and you find the hill country of Ephraim too confining, climb into the forest and clear ground there for yourselves in the land of the Perizzites and the Rephaim.”"
Joshua,17,16,"But the people of Joseph said, “There’s not enough hill country for us; and the Canaanites who live down in the plain, both those in Beth Shan and its villages and in the Valley of Jezreel, have iron chariots.”"
Joshua,17,17-18,"Joshua said to the family of Joseph (to Ephraim and Manasseh): “Yes, there are a lot of you, and you are very strong. One lot is not enough for you. You also get the hill country. It’s nothing but trees now, but you will clear the land and make it your own from one end to the other. The powerful Canaanites, even with their iron chariots, won’t stand a chance against you.”"
Joshua,18,1-2,"Then the entire congregation of the People of Israel got together at Shiloh. They put up the Tent of Meeting.
The land was under their control but there were still seven Israelite tribes who had yet to receive their inheritance."
Joshua,18,3-5,"Joshua addressed the People of Israel: “How long are you going to sit around on your hands, putting off taking possession of the land that GOD, the God of your ancestors, has given you? Pick three men from each tribe so I can commission them. They will survey and map the land, showing the inheritance due each tribe, and report back to me. They will divide it into seven parts. Judah will stay in its territory in the south and the people of Joseph will keep to their place in the north."
Joshua,18,6,“You are responsible for preparing a survey map showing seven portions. Then bring it to me so that I can cast lots for you here in the presence of our GOD.
Joshua,18,7,"“Only the Levites get no portion among you because the priesthood of GOD is their inheritance. And Gad, Reuben, and the half-tribe of Manasseh already have their inheritance on the east side of the Jordan, given to them by Moses the servant of GOD.”"
Joshua,18,8,"So the men set out. As they went out to survey the land, Joshua charged them: “Go. Survey the land and map it. Then come back to me and I will cast lots for you here at Shiloh in the presence of GOD.”"
Joshua,18,9,So off the men went. They covered the ground and mapped the country by towns in a scroll. Then they reported back to Joshua at the camp at Shiloh.
Joshua,18,10,"Joshua cast the lots for them at Shiloh in the presence of GOD. That’s where Joshua divided up the land to the People of Israel, according to their tribal divisions."
Joshua,18,11,The first lot turned up for the tribe of Benjamin with its clans. The border of the allotment went between the peoples of Judah and Joseph.
Joshua,18,12-13,"The northern border began at the Jordan, then went up to the ridge north of Jericho, ascending west into the hill country into the wilderness of Beth Aven. From there the border went around to Luz, to its southern ridge (that is, Bethel), and then down from Ataroth Addar to the mountain to the south of Lower Beth Horon."
Joshua,18,14,"There the border took a turn on the west side and swung south from the mountain to the south of Beth Horon and ended at Kiriath Baal (that is, Kiriath Jearim), a town of the people of Judah. This was the west side."
Joshua,18,15-19,"The southern border began at the edge of Kiriath Jearim on the west, then ran west until it reached the spring, the Waters of Nephtoah. It then descended to the foot of the mountain opposite the Valley of Ben Hinnom (which flanks the Valley of Rephaim to the north), descended to the Hinnom Valley, just south of the Jebusite ridge, and went on to En Rogel. From there it curved north to En Shemesh and Geliloth, opposite the Red Pass (Adummim), down to the Stone of Bohan the son of Reuben, continued toward the north flank of Beth Arabah, then plunged to the Arabah. It then followed the slope of Beth Hoglah north and came out at the northern bay of the Salt Sea—the south end of the Jordan. This was the southern border."
Joshua,18,20,"The east border was formed by the Jordan.
This was the inheritance of the people of Benjamin for their clans, marked by these borders on all sides."
Joshua,18,21-28,"The cities of the tribe of Benjamin, clan by clan, were:
Jericho, Beth Hoglah, Emek Keziz,
Beth Arabah, Zemaraim, Bethel,
Avvim, Parah, Ophrah,
Kephar Ammoni, Ophni, and Geba—
twelve towns with their villages.
Gibeon, Ramah, Beeroth,
Mizpah, Kephirah, Mozah,
Rekem, Irpeel, Taralah,
Zelah, Haeleph, the Jebusite city (that is, Jerusalem), Gibeah, and Kiriath Jearim—
fourteen cities with their villages.
This was the inheritance for Benjamin, according to its clans."
Joshua,19,1-8,"The second lot went to Simeon for its clans. Their inheritance was within the territory of Judah. In their inheritance they had:
Beersheba (or Sheba), Moladah,
Hazar Shual, Balah, Ezem,
Eltolad, Bethul, Hormah,
Ziklag, Beth Marcaboth, Hazar Susah,
Beth Lebaoth, and Sharuhen—
thirteen towns and their villages.
Ain, Rimmon, Ether, and Ashan—
four towns and their villages—plus all the villages around these towns as far as Baalath Beer, the Ramah of the Negev."
Joshua,19,9,"This is the inheritance of the tribe of Simeon according to its clans. The inheritance of Simeon came out of the share of Judah, because Judah’s portion turned out to be more than they needed. That’s how the people of Simeon came to get their lot from within Judah’s portion."
Joshua,19,10-15,"The third lot went to Zebulun, clan by clan:
The border of their inheritance went all the way to Sarid. It ran west to Maralah, met Dabbesheth, and then went to the brook opposite Jokneam. In the other direction from Sarid, the border ran east; it followed the sunrise to the border of Kisloth Tabor, on to Daberath and up to Japhia. It continued east to Gath Hepher and Eth Kazin, came out at Rimmon, and turned toward Neah. There the border went around on the north to Hannathon and ran out into the Valley of Iphtah El. It included Kattath, Nahalal, Shimron, Idalah, and Bethlehem—twelve cities with their villages."
Joshua,19,16,This is the inheritance of the people of Zebulun for their clans—these towns and their villages.
Joshua,19,17-21,"The fourth lot went to Issachar, clan by clan. Their territory included:
Jezreel, Kesulloth, Shunem,
Hapharaim, Shion, Anaharath,
Rabbith, Kishion, Ebez,
Remeth, En Gannim, En Haddah, and Beth Pazzez."
Joshua,19,22,"The boundary touched Tabor, Shahazumah, and Beth Shemesh and ended at the Jordan—sixteen towns and their villages."
Joshua,19,23,"These towns with their villages were the inheritance of the tribe of Issachar, clan by clan."
Joshua,19,24,"The fifth lot went to the tribe of Asher, clan by clan"
Joshua,19,25-30,"Their territory included Helkath, Hali, Beten, Acshaph, Allammelech, Amad, and Mishal. The western border touched Carmel and Shihor Libnath, then turned east toward Beth Dagon, touched Zebulun and the Valley of Iphtah El, and went north to Beth Emek and Neiel, skirting Cabul on the left. It went on to Abdon, Rehob, Hammon, and Kanah, all the way to Greater Sidon. The border circled back toward Ramah, extended to the fort city of Tyre, turned toward Hosah, and came out at the Sea in the region of Aczib, Ummah, Aphek, and Rehob—twenty-two towns and their villages."
Joshua,19,31,"These towns and villages were the inheritance of the tribe of Asher, clan by clan."
Joshua,19,32,The sixth lot came to Naphtali and its clans.
Joshua,19,33,"Their border ran from Heleph, from the oak at Zaanannim, passing Adami Nekeb and Jabneel to Lakkum and ending at the Jordan."
Joshua,19,34,"The border returned on the west at Aznoth Tabor and came out at Hukkok, meeting Zebulun on the south, Asher on the west, and the Jordan on the east.
The fort cities were"
Joshua,19,35-38,"Ziddim, Zer, Hammath, Rakkath, Kinnereth,
Adamah, Ramah, Hazor,
Kedesh, Edrei, En Hazor,
Iron, Migdal El, Horem, Beth Anath, and Beth Shemesh—
nineteen towns and their villages."
Joshua,19,39,"This is the inheritance of the tribe of Naphtali, the cities and their villages, clan by clan."
Joshua,19,40-46,"The seventh lot fell to Dan. The territory of their inheritance included:
Zorah, Eshtaol, Ir Shemesh,
Shaalabbin, Aijalon, Ithlah,
Elon, Timnah, Ekron,
Eltekeh, Gibbethon, Baalath,
Jehud, Bene Berak, Gath Rimmon,
Me Jarkon, and Rakkon, with the region facing Joppa."
Joshua,19,47,"But the people of Dan failed to get rid of the Westerners (Amorites), who pushed them back into the hills. The Westerners kept them out of the plain and they didn’t have enough room. So the people of Dan marched up and attacked Leshem. They took it, killed the inhabitants, and settled in. They renamed it Leshem Dan after the name of Dan their ancestor."
Joshua,19,48,"This is the inheritance of the tribe of Dan, according to its clans, these towns with their villages.
* * *"
Joshua,19,49-50,"They completed the dividing of the land as inheritance and the setting of its boundaries. The People of Israel then gave an inheritance among them to Joshua son of Nun. In obedience to GOD’s word, they gave him the city which he had requested, Timnath Serah in the hill country of Ephraim. He rebuilt the city and settled there."
Joshua,19,51,These are the inheritances which Eleazar the priest and Joshua son of Nun and the ancestral leaders assigned by lot to the tribes of Israel at Shiloh in the presence of GOD at the entrance of the Tent of Meeting. They completed the dividing of the land.
Joshua,20,1-3,"Then GOD spoke to Joshua: “Tell the People of Israel: Designate the asylum-cities, as I instructed you through Moses, so that anyone who kills a person accidentally—that is, unintentionally—may flee there as a safe place of asylum from the avenger of blood."
Joshua,20,4,"“A person shall escape for refuge to one of these cities, stand at the entrance to the city gate, and lay out his case before the city’s leaders. The leaders must then take him into the city among them and give him a place to live with them."
Joshua,20,5-6,"“If the avenger of blood chases after him, they must not give him up—he didn’t intend to kill the person; there was no history of ill-feeling. He may stay in that city until he has stood trial before the congregation and until the death of the current high priest. Then he may go back to his own home in his hometown from which he fled.”"
Joshua,20,7,"They set apart Kedesh in Galilee in the hills of Naphtali, Shechem in the hills of Ephraim, and Kiriath Arba (that is, Hebron) in the hills of Judah."
Joshua,20,8-9,"On the other side of the Jordan, east of Jericho, they designated Bezer on the desert plateau from the tribe of Reuben, Ramoth in Gilead from the tribe of Gad, and Golan in Bashan from the tribe of Manasseh. These were the designated cities for the People of Israel and any resident foreigner living among them, so that anyone who killed someone unintentionally could flee there and not die by the hand of the avenger of blood without a fair trial before the congregation."
Joshua,21,1-2,"The ancestral heads of the Levites came to Eleazar the priest and Joshua son of Nun and to the heads of the other tribes of the People of Israel. This took place at Shiloh in the land of Canaan. They said, “GOD commanded through Moses that you give us cities to live in with access to pastures for our cattle.”"
Joshua,21,3,"So the People of Israel, out of their own inheritance, gave the Levites, just as GOD commanded, the following cities and pastures"
Joshua,21,4-5,"The lot came out for the families of the Kohathites this way: Levites descended from Aaron the priest received by lot thirteen cities out of the tribes of Judah, Simeon, and Benjamin. The rest of the Kohathites received by lot ten cities from the families of the tribes of Ephraim, Dan, and the half-tribe of Manasseh."
Joshua,21,6,"The Gershonites received by lot thirteen cities from the families of the tribes of Issachar, Asher, Naphtali, and the half-tribe of Manasseh in Bashan."
Joshua,21,7,"The families of the Merarites received twelve towns from the tribes of Reuben, Gad, and Zebulun."
Joshua,21,8,"So the People of Israel gave these cities with their pastures to the Levites just as GOD had ordered through Moses, that is, by lot."
Joshua,21,9-10,"They assigned from the tribes of Judah, Simeon, and Benjamin the following towns, here named individually (these were for the descendants of Aaron who were from the families of the Kohathite branch of Levi because the first lot fell to them)"
Joshua,21,11-12,"Kiriath Arba (Arba was the ancestor of Anak), that is, Hebron, in the hills of Judah, with access to the pastures around it. The fields of the city and its open lands they had already given to Caleb son of Jephunneh as his possession."
Joshua,21,13-16,"To the descendants of Aaron the priest they gave Hebron (the asylum-city for the unconvicted killers), Libnah, Jattir, Eshtemoa, Holon, Debir, Ain, Juttah, and Beth Shemesh, all with their accompanying pastures—nine towns from these two tribes."
Joshua,21,17-18,"And from the tribe of Benjamin: Gibeon, Geba, Anathoth, and Almon, together with their pastures—four towns."
Joshua,21,19,The total for the cities and pastures for the priests descended from Aaron came to thirteen.
Joshua,21,20-22,"The rest of the Kohathite families from the tribe of Levi were assigned their cities by lot from the tribe of Ephraim: Shechem (the asylum-city for the unconvicted killer) in the hills of Ephraim, Gezer, Kibzaim, and Beth Horon, with their pastures—four towns."
Joshua,21,23-24,"From the tribe of Dan they received Eltekeh, Gibbethon, Aijalon, and Gath Rimmon, all with their pastures—four towns."
Joshua,21,25,And from the half-tribe of Manasseh they received Taanach and Gath Rimmon with their pastures—two towns.
Joshua,21,26,"All told, ten cities with their pastures went to the remaining Kohathite families."
Joshua,21,27,"The Gershonite families of the tribe of Levi were given from the half-tribe of Manasseh: Golan in Bashan (an asylum-city for the unconvicted killer), and Be Eshtarah, with their pastures—two cities."
Joshua,21,28-29,"And from the tribe of Issachar: Kishion, Daberath, Jarmuth, and En Gannim, with their pastures—four towns."
Joshua,21,30-31,"From the tribe of Asher: Mishal, Abdon, Helkath, and Rehob, with their pastures—four towns."
Joshua,21,32,"From the tribe of Naphtali: Kedesh in Galilee (an asylum-city for the unconvicted killer), Hammoth Dor, and Kartan, with their pastures—three towns."
Joshua,21,33,For the Gershonites and their families: thirteen towns with their pastures.
Joshua,21,34-35,"The Merari families, the remaining Levites, were given from the tribe of Zebulun: Jokneam, Kartah, Dimnah, and Nahalal, with their pastures—four cities."
Joshua,21,36-37,"From the tribe of Reuben: Bezer, Jahaz, Kedemoth, and Mephaath, with their pastures—four towns."
Joshua,21,38-39,"From the tribe of Gad: Ramoth in Gilead (an asylum-city for the unconvicted killer), Mahanaim, Heshbon, and Jazer, with their pastures—a total of four towns."
Joshua,21,40,"All these towns were assigned by lot to the Merarites, the remaining Levites—twelve towns."
Joshua,21,41-42,"The Levites held forty-eight towns with their accompanying pastures within the territory of the People of Israel. Each of these towns had pastures surrounding it—this was the case for all these towns.
* * *"
