Joshua,8,10-13,"Joshua was up early in the morning and mustered his army. He and the leaders of Israel led the troops to Ai. The whole army, fighting men all, marched right up within sight of the city and set camp on the north side of Ai. There was a valley between them and Ai. He had taken about five thousand men and put them in ambush between Bethel and Ai, west of the city. They were all deployed, the main army to the north of the city and the ambush to the west. Joshua spent the night in the valley."
Joshua,8,14,"So it happened that when the king of Ai saw all this, the men of the city lost no time; they were out of there at the crack of dawn to join Israel in battle, the king and his troops, at a field en route to the Arabah. The king didn’t know of the ambush set against him behind the city."
Joshua,8,15-17,Joshua and all Israel let themselves be chased; they ran toward the wilderness. Everybody in the city was called to the chase. They pursued Joshua and were led away from the city. There wasn’t a soul left in Ai or Bethel who wasn’t out there chasing after Israel. The city was left empty and undefended as they were chasing Israel down.
Joshua,8,18-19,"Then GOD spoke to Joshua: “Stretch out the javelin in your hand toward Ai—I’m giving it to you.” Joshua stretched out the javelin in his hand toward Ai. At the signal the men in ambush sprang to their feet, ran to the city, took it, and quickly had it up in flames."
Joshua,8,20-21,"The men of Ai looked back and, oh! saw the city going up in smoke. They found themselves trapped with nowhere to run. The army on the run toward the wilderness did an about-face—Joshua and all Israel, seeing that the ambush had taken the city, saw it going up in smoke, turned and attacked the men of Ai."
Joshua,8,22-23,Then the men in the ambush poured out of the city. The men of Ai were caught in the middle with Israelites on both sides—a real massacre. And not a single survivor. Except for the king of Ai; they took him alive and brought him to Joshua.
Joshua,8,24-25,"When it was all over, Israel had killed everyone in Ai, whether in the fields or in the wilderness where they had chased them. When the killing was complete, the Israelites returned to Ai and completed the devastation. The death toll that day came to twelve thousand men and women—everyone in Ai."
Joshua,8,26-27,Joshua didn’t lower his outstretched javelin until the sacred destruction of Ai and all its people was completed. Israel did get to take the livestock and loot left in the city; GOD’s instructions to Joshua allowed for that.
Joshua,8,28-29,"Joshua burned Ai to the ground. A “heap” of nothing forever, a “no-place”—go see for yourself. He hanged the king of Ai from a tree. At evening, with the sun going down, Joshua ordered the corpse cut down. They dumped it at the entrance to the city and piled it high with stones—you can go see that also.
* * *"
Joshua,8,30-32,"Then Joshua built an altar to the GOD of Israel on Mount Ebal. He built it following the instructions of Moses the servant of GOD to the People of Israel and written in the Book of The Revelation of Moses, an altar of whole stones that hadn’t been chiseled or shaped by an iron tool. On it they offered to GOD Whole-Burnt-Offerings and sacrificed Peace-Offerings. He also wrote out a copy of The Revelation of Moses on the stones. He wrote it with the People of Israel looking on."
Joshua,8,33,"All Israel was there, foreigners and citizens alike, with their elders, officers, and judges, standing on opposite sides of the Chest, facing the Levitical priests who carry GOD’s Covenant Chest. Half of the people stood with their backs to Mount Gerizim and half with their backs to Mount Ebal to bless the People of Israel, just as Moses the servant of GOD had instructed earlier."
Joshua,8,34-35,"After that, he read out everything written in The Revelation, the Blessing and the Curse, everything in the Book of The Revelation. There wasn’t a word of all that Moses commanded that Joshua didn’t read to the entire congregation—men, women, children, and foreigners who had been with them on the journey."
Joshua,9,1-2,"All the kings west of the Jordan in the hills and foothills and along the Mediterranean seacoast north toward Lebanon—the Hittites, Amorites, Canaanites, Perizzites, Hivites, Girgashites, and Jebusites—got the news. They came together in a coalition to fight against Joshua and Israel under a single command."
Joshua,9,3-6,"The people of Gibeon heard what Joshua had done to Jericho and Ai and cooked up a ruse. They posed as travelers: their donkeys loaded with patched sacks and mended wineskins, threadbare sandals on their feet, tattered clothes on their bodies, nothing but dry crusts and crumbs for food. They came to Joshua at Gilgal and spoke to the men of Israel, “We’ve come from a far-off country; make a covenant with us.”"
Joshua,9,7,"The men of Israel said to these Hivites, “How do we know you aren’t local people? How could we then make a covenant with you?”"
Joshua,9,8,"They said to Joshua, “We’ll be your servants.”
Joshua said, “Who are you now? Where did you come from?”"
Joshua,9,9-11,"They said, “From a far-off country, very far away. Your servants came because we’d heard such great things about GOD, your God—all those things he did in Egypt! And the two Amorite kings across the Jordan, King Sihon of Heshbon and King Og of Bashan, who ruled in Ashtaroth! Our leaders and everybody else in our country told us, ‘Pack up some food for the road and go meet them. Tell them, We’re your servants; make a covenant with us.’"
Joshua,9,12-13,"“This bread was warm from the oven when we packed it and left to come and see you. Now look at it—crusts and crumbs. And our cracked and mended wineskins, good as new when we filled them. And our clothes and sandals, in tatters from the long, hard traveling.”"
Joshua,9,14,The men of Israel looked them over and accepted the evidence. But they didn’t ask GOD about it.
Joshua,9,15,So Joshua made peace with them and formalized it with a covenant to guarantee their lives. The leaders of the congregation swore to it.
Joshua,9,16-18,"And then, three days after making this covenant, they learned that they were next-door neighbors who had been living there all along! The People of Israel broke camp and set out; three days later they reached their towns—Gibeon, Kephirah, Beeroth, and Kiriath Jearim. But the People of Israel didn’t attack them; the leaders of the congregation had given their word before the GOD of Israel. But the congregation was up in arms over their leaders."
Joshua,9,19-21,"The leaders were united in their response to the congregation: “We promised them in the presence of the GOD of Israel. We can’t lay a hand on them now. But we can do this: We will let them live so we don’t get blamed for breaking our promise.” Then the leaders continued, “We’ll let them live, but they will be woodcutters and water carriers for the entire congregation.”
And that’s what happened; the leaders’ promise was kept."
Joshua,9,22-23,"But Joshua called the Gibeonites together and said, “Why did you lie to us, telling us, ‘We live far, far away from you,’ when you’re our next-door neighbors? For that you are cursed. From now on it’s menial labor for you—woodcutters and water carriers for the house of my God.”"
Joshua,9,24-25,"They answered Joshua, “We got the message loud and clear that GOD, your God, commanded through his servant Moses: to give you the whole country and destroy everyone living in it. We were terrified because of you; that’s why we did this. That’s it. We’re at your mercy. Whatever you decide is right for us, do it.”"
Joshua,9,26-27,And that’s what they did. Joshua delivered them from the power of the People of Israel so they didn’t kill them. But he made them woodcutters and water carriers for the congregation and for the Altar of GOD at the place GOD chooses. They still are.
Joshua,10,1-2,"It wasn’t long before My-Master-Zedek king of Jerusalem heard that Joshua had taken Ai and destroyed it and its king under a holy curse, just as he had done to Jericho and its king. He also learned that the people of Gibeon had come to terms with Israel and were living as neighbors. He and his people were alarmed: Gibeon was a big city—as big as any with a king and bigger than Ai—and all its men were seasoned fighters."
Joshua,10,3-4,"Adoni-Zedek king of Jerusalem sent word to Hoham king of Hebron, Piram king of Jarmuth, Japhia king of Lachish, and Debir king of Eglon: “Come and help me. Let’s attack Gibeon; they’ve joined up with Joshua and the People of Israel.”"
Joshua,10,5,"So the five Amorite (Western) kings—the king of Jerusalem, the king of Hebron, the king of Jarmuth, the king of Lachish, and the king of Eglon—combined their armies and set out to attack Gibeon."
Joshua,10,6,"The men of Gibeon sent word to Joshua camped at Gilgal, “Don’t let us down now! Come up here quickly! Save us! Help us! All the Amorite kings who live up in the hills have ganged up on us.”"
Joshua,10,7-8,"So Joshua set out from Gilgal, his whole army with him—all those tough soldiers! GOD told him, “Don’t give them a second thought. I’ve put them under your thumb—not one of them will stand up to you.”"
Joshua,10,9-11,"Joshua marched all night from Gilgal and took them by total surprise. GOD threw them into total confusion before Israel, a major victory at Gibeon. Israel chased them along the ridge to Beth Horon and fought them all the way down to Azekah and Makkedah. As they ran from the People of Israel, down from the Beth Horon ridge and all the way to Azekah, GOD pitched huge stones on them out of the sky and many died. More died from the hailstones than the People of Israel killed with the sword."
Joshua,10,12-13,"The day GOD gave the Amorites up to Israel, Joshua spoke to GOD, with all Israel listening:
“Stop, Sun, over Gibeon;
Halt, Moon, over Aijalon Valley.”
And Sun stopped,
Moon stood stock still
Until he defeated his enemies."
Joshua,10,14,"(You can find this written in the Book of Jashar.) The sun stopped in its tracks in mid sky; just sat there all day. There’s never been a day like that before or since—GOD took orders from a human voice! Truly, GOD fought for Israel."
Joshua,10,15,"Then Joshua returned, all Israel with him, to the camp at Gilgal."
Joshua,10,16-17,"Meanwhile the five kings had hidden in the cave at Makkedah. Joshua was told, “The five kings have been found, hidden in the cave at Makkedah.”"
Joshua,10,18-19,"Joshua said, “Roll big stones against the mouth of the cave and post guards to keep watch. But don’t you hang around—go after your enemies. Cut off their retreat. Don’t let them back into their cities. GOD has given them to you.”"
Joshua,10,20-21,"Joshua and the People of Israel then finished them off, total devastation. Only a few got away to the fortified towns. The whole army then returned intact to the camp and to Joshua at Makkedah. There was no criticism that day from the People of Israel!"
Joshua,10,22,"Then Joshua said, “Open the mouth of the cave and bring me those five kings.”"
Joshua,10,23,"They did it. They brought him the five kings from the cave: the king of Jerusalem, the king of Hebron, the king of Jarmuth, the king of Lachish, and the king of Eglon."
Joshua,10,24,"When they had them all there in front of Joshua, he called up the army and told the field commanders who had been with him, “Come here. Put your feet on the necks of these kings.”
They stepped up and put their feet on their necks."
Joshua,10,25,"Joshua told them, “Don’t hold back. Don’t be timid. Be strong! Be confident! This is what GOD will do to all your enemies when you fight them.”"
Joshua,10,26-27,Then Joshua struck and killed the kings. He hung them on five trees where they remained until evening. At sunset Joshua gave the command. They took them down from the trees and threw them into the cave where they had hidden. They put large stones at the mouth of the cave. The kings are still in there.
Joshua,10,28,"That same day Joshua captured Makkedah, a massacre that included the king. He carried out the holy curse. No survivors. Makkedah’s king got the same treatment as Jericho’s king."
Joshua,10,29-30,"Joshua, all Israel with him, moved on from Makkedah to Libnah and fought against Libnah. GOD gave Libnah to Israel. They captured city and king and massacred the lot. No survivors. Libnah’s king got the same treatment as Jericho’s king."
Joshua,10,31-32,"Joshua, all Israel with him, moved on from Libnah to Lachish. He set up camp nearby and attacked. GOD gave Lachish to Israel. Israel took it in two days and killed everyone. He carried out the holy curse, the same as with Libnah."
Joshua,10,33,"Horam, king of Gezer, arrived to help Lachish. Joshua attacked him and his army until there was nothing left of them. No survivors."
Joshua,10,34-35,"Joshua, all Israel with him, moved on from Lachish to Eglon. They set up camp and attacked. They captured it and killed everyone, carrying out the holy curse, the same as they had done with Lachish."
Joshua,10,36-37,"Joshua, all Israel with him, went up from Eglon to Hebron. He attacked and captured it. They killed everyone, including its king, its villages, and their people. No survivors, the same as with Eglon. They carried out the holy curse on city and people."
Joshua,10,38-39,"Then Joshua, all Israel with him, turned toward Debir and attacked it. He captured it, its king, and its villages. They killed everyone. They put everyone and everything under the holy curse. No survivors. Debir and its king got the same treatment as Hebron and its king, and Libnah and its king.
* * *"
Joshua,10,40-42,"Joshua took the whole country: hills, desert, foothills, and mountain slopes, including all kings. He left no survivors. He carried out the holy curse on everything that breathed, just as GOD, the God of Israel, had commanded. Joshua’s conquest stretched from Kadesh Barnea to Gaza and from the entire region of Goshen to Gibeon. Joshua took all these kings and their lands in a single campaign because GOD, the God of Israel, fought for Israel."
Joshua,10,43,"Then Joshua, all Israel with him, went back to the camp at Gilgal.
* * *"
Joshua,11,1-3,"When Jabin king of Hazor heard of all this, he sent word to Jobab king of Madon; to the king of Shimron; to the king of Acshaph; to all the kings in the northern mountains; to the kings in the valley south of Kinnereth; to the kings in the western foothills and Naphoth Dor; to the Canaanites both east and west; to the Amorites, Hittites, Perizzites, and Jebusites in the hill country; and to the Hivites below Hermon in the region of Mizpah."
Joshua,11,4-5,"They came out in full force, all their troops massed together—a huge army, in number like sand on an ocean beach—to say nothing of all the horses and chariots. All these kings met and set up camp together at the Waters of Merom, ready to fight against Israel."
Joshua,11,6,"GOD said to Joshua: “Don’t worry about them. This time tomorrow I’ll hand them over to Israel, all dead. You’ll hamstring their horses. You’ll set fire to their chariots.”"
Joshua,11,7-9,"Joshua, his entire army with him, took them by surprise, falling on them at the Waters of Merom. GOD gave them to Israel, who struck and chased them all the way to Greater Sidon, to Misrephoth Maim, and then to the Valley of Mizpah on the east. No survivors. Joshua treated them following GOD’s instructions: he hamstrung their horses; he burned up their chariots."
Joshua,11,10-11,"Then Joshua came back and took Hazor, killing its king. Early on Hazor had been head of all these kingdoms. They killed every person there, carrying out the holy curse—not a breath of life left anywhere. Then he burned down Hazor."
Joshua,11,12-14,"Joshua captured and massacred all the royal towns with their kings, the holy curse commanded by Moses the servant of GOD. But Israel didn’t burn the cities that were built on mounds, except for Hazor—Joshua did burn down Hazor. The People of Israel plundered all the loot, including the cattle, from these towns for themselves. But they killed the people—total destruction. They left nothing human that breathed."
Joshua,11,15,"Just as GOD commanded his servant Moses, so Moses commanded Joshua, and Joshua did it. He didn’t leave incomplete one thing that GOD had commanded Moses.
* * *"
Joshua,11,16-20,"Joshua took the whole country: the mountains, the southern desert, all of Goshen, the foothills, the valley (the Arabah), and the Israel mountains with their foothills, from Mount Halak, which towers over the region of Seir, all the way to Baal Gad in the Valley of Lebanon in the shadows of Mount Hermon. He captured their kings and then killed them. Joshua fought against these kings for a long time. Not one town made peace with the People of Israel, with the one exception of the Hivites who lived in Gibeon. Israel fought and took all the rest. It was GOD’s idea that they all would stubbornly fight the Israelites so he could put them under the holy curse without mercy. That way he could destroy them just as GOD had commanded Moses.
* * *"
Joshua,11,21-22,"Joshua came out at that time also to root out the Anakim from the hills, from Hebron, from Debir, from Anab, from the mountains of Judah, from the mountains of Israel. Joshua carried out the holy curse on them and their cities. No Anakim were left in the land of the People of Israel, except in Gaza, Gath, and Ashdod—there were a few left there."
Joshua,11,23,"Joshua took the whole region. He did everything that GOD had told Moses. Then he parceled it out as an inheritance to Israel according to their tribes.
And Israel had rest from war."
Joshua,12,1,"These are the kings that the People of Israel defeated and whose land they took on the east of the Jordan, from the Arnon Gorge to Mount Hermon, with the whole eastern side of the Arabah Valley."
Joshua,12,2-3,"Sihon king of the Amorites, who reigned from Heshbon: His rule extended from Aroer, which sits at the edge of the Arnon Gorge, from the middle of the gorge and over half of Gilead to the Gorge of the Jabbok River, which is the border of the Ammonites. His rule included the eastern Arabah Valley from the Sea of Kinnereth to the Arabah Sea (the Salt Sea), eastward toward Beth Jeshimoth and southward to the slopes of Pisgah."
Joshua,12,4-5,"And Og king of Bashan, one of the last of the Rephaim who reigned from Ashtaroth and Edrei: His rule extended from Mount Hermon and Salecah over the whole of Bashan to the border of the Geshurites and the Maacathites (the other half of Gilead) to the border of Sihon king of Heshbon."
Joshua,12,6,"Moses the servant of GOD and the People of Israel defeated them. And Moses the servant of GOD gave this land as an inheritance to the Reubenites, the Gadites, and half of the tribe of Manasseh.
* * *"
Joshua,12,7-24,"And these are the kings of the land that Joshua and the People of Israel defeated in the country west of the Jordan, from Baal Gad in the Valley of Lebanon south to Mount Halak, which towers over Seir. Joshua gave this land to the tribes of Israel as a possession, according to their divisions: lands in the mountains, the western foothills, and the Arabah Valley, on the slopes, and in the wilderness and the Negev desert (lands on which Hittites, Amorites and Canaanites, Perizzites, Hivites, and Jebusites had lived). The kings were:
The king of Jericho one
A total of thirty-one kings."
Joshua,13,1-6,"When Joshua had reached a venerable age, GOD said to him, “You’ve had a good, long life, but there is a lot of land still to be taken. This is the land that remains:
all the districts of the Philistines and Geshurites;
the land from the Shihor River east of Egypt to the border of Ekron up north, Canaanite country (there were five Philistine tyrants—in Gaza, in Ashdod, in Ashkelon, in Gath, in Ekron); also the Avvim from the south;
all the Canaanite land from Arah (belonging to the Sidonians) to Aphek at the Amorite border;
the country of the Gebalites;
all Lebanon eastward from Baal Gad in the shadow of Mount Hermon to the Entrance of Hamath;
all who live in the mountains, from Lebanon to Misrephoth Maim;
all the Sidonians."
Joshua,13,7,"“I myself will drive them out before the People of Israel. All you have to do is allot this land to Israel as an inheritance, as I have instructed you. Do it now: Allot this land as an inheritance to the nine tribes and the half-tribe of Manasseh.”"
Joshua,13,8,"The other half-tribe of Manasseh, with the Reubenites and Gadites, had been given their inheritance by Moses on the other side of the Jordan eastward. Moses the servant of GOD gave it to them."
Joshua,13,9-13,"This land extended from Aroer at the edge of the Arnon Gorge and the city in the middle of the valley, taking in the entire tableland of Medeba as far as Dibon, and all the towns of Sihon king of the Amorites, who ruled from Heshbon, and out to the border of the Ammonites. It also included Gilead, the country of the people of Geshur and Maacah, all of Mount Hermon, and all Bashan as far as Salecah—the whole kingdom of Og in Bashan, who reigned in Ashtaroth and Edrei. He was one of the last survivors of the Rephaim. Moses had defeated them and taken their land. The People of Israel never did drive out the Geshurites and the Maacathites—they’re still there, living in Israel."
Joshua,13,14,"Levi was the only tribe that did not receive an inheritance. The Fire-Gift-Offerings to GOD, the God of Israel, are their inheritance, just as he told them."
Joshua,13,15-22,"To the tribe of Reuben, clan by clan, Moses gave:
the land from Aroer at the edge of the Arnon Gorge and the town in the middle of the valley, including the tableland around Medeba;
Heshbon on the tableland with all its towns (Dibon, Bamoth Baal, Beth Baal Meon, Jahaz, Kedemoth, Mephaath, Kiriathaim, Sibmah, Zereth Shahar on Valley Mountain, Beth Peor, the slopes of Pisgah, Beth Jeshimoth);
and all the cities of the tableland, the whole kingdom of Sihon king of the Amorites, who ruled at Heshbon, whom Moses put to death along with the princes of Midian: Evi, Rekem, Zur, Hur, and Reba, who lived in that country, all puppets of Sihon. (In addition to those killed in battle, Balaam son of Beor, the soothsayer, was put to death by the People of Israel.)"
Joshua,13,23,"The boundary for the Reubenites was the bank of the Jordan River. This was the inheritance of the Reubenites, their villages and cities, according to their clans."
Joshua,13,24-27,"To the tribe of Gad, clan by clan, Moses gave:
the territory of Jazer and all the towns of Gilead and half the Ammonite country as far as Aroer near Rabbah;
the land from Heshbon to Ramath Mizpah and Betonim, and from Mahanaim to the region of Debir;
in the valley: Beth Haram, Beth Nimrah, Succoth, and Zaphon, with the rest of the kingdom of Sihon king of Heshbon (the east side of the Jordan, north to the end of the Sea of Kinnereth)."
Joshua,13,28,"This was the inheritance of the Gadites, their cities and villages, clan by clan."
Joshua,13,29-31,"To the half-tribe of Manasseh, clan by clan, Moses gave:
the land stretching out from Mahanaim;
all of Bashan, which is the entire kingdom of Og king of Bashan, and all the settlements of Jair in Bashan—sixty towns in all.
Half of Gilead with Ashtaroth and Edrei, the royal cities of Og in Bashan, belong to the descendants of Makir, a son of Manasseh (in other words, the half-tribe of the children of Makir) for their clans."
Joshua,13,32-33,"This is the inheritance that Moses gave out when he was on the plains of Moab across the Jordan east of Jericho. But Moses gave no inheritance to the tribe of Levi. GOD, the God of Israel, is their inheritance, just as he told them."
Joshua,14,1-2,"Here are the inheritance allotments that the People of Israel received in the land of Canaan. Eleazar the priest, Joshua son of Nun, and the heads of the family clans made the allotments. Each inheritance was assigned by lot to the nine and a half tribes, just as GOD had commanded Moses."
Joshua,14,3-4,"Moses had given the two and a half tribes their inheritance east of the Jordan, but hadn’t given an inheritance to the Levites, as he had to the others. Because the sons of Joseph had become two tribes, Manasseh and Ephraim, they gave no allotment to the Levites; but they did give them cities to live in with pasture rights for their flocks and herds."
Joshua,14,5,The People of Israel followed through exactly as GOD had commanded Moses. They apportioned the land.
